variations,price,rating_star,comment
['TEA TREE'],[9500000000],5,"CHAM CHI TAP THE DUC NANG CAO SUC KHOE, PHONG CHONG DICH BENH! Hay chung tay lan toa thong diep den cong dong, soan CO gui 9002 (mien phi). Chi tiet tham khao tai http://isignplus.vn. LH 198 (mien phi)."
['TEA TREE'],[9500000000],5,Giá rẻ đóng gói chắc chắn giao hàng nhanh chóng sẽ tiếp tục ủng hộ
['TEA TREE'],[9500000000],5,Mua lần 5 của shop về mẫu tt này rồi - k mùi - thích hợl với làn da nhạy cảm - mụn củ mình 
['TEA TREE'],[9500000000],5,Chất lượng sản phẩm vô cùng tuyệt vời. Tẩy trang đáng để mua hhj
['TEA TREE'],[9500000000],5,"Nhẹ dịu, mùi tràm trà khá thơm, makeup đậm hoặc waterproof mình nghĩ em này ko tẩy sạch đc"
['TEA TREE'],[9500000000],5,Hàng real đóng gói okela giao hàng khá nhanh giá cả quá rẻ luonn = )) 
