variations,price,rating_star,comment
['55ml'],[25000000000],5,"Shop gói hàng kĩ , còn tặng thêm 2 cái khẩu trang 🤣🤣, chưa xài nên chưa biết chất lượng như thế nào ^^"
['55ml'],[20200000000],5,"Serum sd rất thích, mềm mịn da, sd đc cho da mụn và nhạy cảm. Shop đóng gói rất kĩ có quấn bọc chống sock xung quanh, giao hàng cực kì nhanh, tận hn mà giao có 3 ngày là tới, trên sp luôn có dán tem shop, nên cảm thấy an tâm là hàng chính hãng."
['100ml'],[32500000000],5,-Shop gói hàng đẹp. Bạn minh mua rồi nên giới thiệu nên mỉnh củng yên tâm mua lần 3 món
['55ml'],[20200000000],5,"Đóng gói kĩ, giao nhanh chắc do mình cũng gần, date mới, mình check code thì ra nhưng lại kiểu sai chính tả í. Nma mua aurora 3 món cũng kha khá tiền với đọc review trc nên cũng ko lo lắm"
['100ml'],[32500000000],5,"Bao gói kĩ càng , có tem mác đầy đủ , hộp trông rất đẹp , lần sau sẽ quay lại ủng hộ"
['55ml'],[23900000000],5,Kswiehđv e. E sjjwhwhwbabs s sjwwjwjjwjwnw s s s. S sâjannabss nh
['55ml'],[23900000000],5,"Giao hàng nhanh
Hàng chuẩn, có quà tặng kèm rất đáng yêu.
Mong shop có nhiều mã km hơn nữa sẽ ủng hộ shop nhiều"
['55ml'],[20200000000],5,Giao hàng nhanh lắm ạ shop bọc rất kĩ và đẹp chưa dùng nên chưa biết ra sao nếu ưng ý lần sau sẽ quay lại
['55ml'],[24900000000],5,"Giao hàng nhanh trong 1 phút mốt
Đóng gói cẩn thận
Nếu sử dụng ok sẽ tiếp tục ủng hộ
Sp rẻ hơn so vs shop khác"
['55ml'],[23900000000],5,"Okila lắm nha mọi người ơi, mua hàng của shop là yên tâm lắm luôn."
['55ml'],[23900000000],5,"Giao hàng nhanh, shop đóng hàng auto cẩn thận, mình dùng mấy bộ này của shop rồi."
['55ml'],[21500000000],5,"Mua ở Aurora nhiều lần rùi, mình thấy rất ưng luôn ý. Từ khâu đống gói cũng đã rất cẩn thận, tỉ mỉ và còn đc dính băng keo có logo của shop nên rất xinh luôn. Chỗ c Quỳnh Anh bán nên mình luôn tin tưởng là auth, mua đc giá sale quá ưng luôn. "
['100ml tem phụ'],[29500000000],5,"Shop phục vụ tốt, giá tốt, hàng chuẩn. Da mụn xai em rau má hơi bị ổn. B5 phuc hồi dưỡng ẩm đỉnh, hơi bí nếu bôi dày. Do truc trac ship mà giao lâu nhưng trả lời lịch sự ko như cái shop Mp kia (mua cùng với nhà Auora) đã giao trễ ma còn nchuyen bất cần khách! Cho shop 5* nha"
['100ml'],[32500000000],5,Okkkk*kkk*kkkkkkk*kkkkkkkkkkkkkkkkkkkkkkkkkkkkkkkk
['55ml'],[24900000000],5,"Chất lượng sản phẩm tuyệt vời, đóng gói sản phẩm rất tốt, vẫn tin tưởng shop ạ. "
['55ml'],[20200000000],5,"Đóng gói cẩn thận, giao hàng nhanh, hàng chuẩn bdbdbbf bndjdbd"
['55ml'],[23900000000],5,"Sản phẩm đóng gói cẩn thận, giao hàng nhanh. Đã mua của shop nhiều lần nên yên tâm chất lượng"
['100ml'],[31900000000],4,"Lần này thì ship nhanh hơn, hôm qua đặt nay đã ship nhưng shop gói hàng hơi xơ xài, t nghĩ shop nên bọc thêm mấy lớp chống xống chứ đừng bọc mỗi 1 mẩu mỏng như thế này. Vì khi tớ lấy hàng, lớp vỏ ngoài đã bị móp, đây là hàng mỹ phẩm nên mong shop tiếp thu ý kiến"
['55ml'],[23900000000],5,"Hàng nguyên seal 
"
['55ml'],[24900000000],5,"Sản phẩm dùng quá là mê , check ra mã vạch , giao hàng nhanhhhhh"
['55ml'],[24900000000],5,"Dạng lỏng, nhanh thẩm thấu, dịu da, lúc mới thoa đã cho cảm giác thư giãn dễ chịu rồi"
['100ml'],[31900000000],5,Shop ship nhầm cho mình sang toner nhưng đã đổi lại. Shop phục vị tốt. Dự kiến sẽ ủng hộ dài.
['55ml'],[20200000000],5,"Rất tin tưởng khi mua những sản phẩm của shop
Sẽ mua nhiều sp hơn"
['55ml'],[22500000000],5,Giao hàng hơi lâu nhưng mà được cái hàng xịn lắm jjjjjjjjjjjjj
['55ml'],[24900000000],5,2 lần mua ở shop . Rất tin tương ạ jdjjdjdjdjdjjdndnxjxjjdjdjdjxjxjjxncnfncncnncxj
['55ml tem phụ'],[22500000000],5,Check đc nên chắc hàng chuẩn. Ưng cái là giao hàng siêu nhanh. Đặt hôm trước sáng hôm sau nhận đc luôn rồi 
['55ml tem phụ'],[23500000000],5, Ghjnvyijncdyjkm ceszchuycxgtcjhkuxxhvjfyzgxhcydyxhchc
['55ml'],[21500000000],5,Không có gì để bình luận ạ. Mua hàng lần thứ n của shop rồi ạ. Và 10 điểm hoàn hảo chp shop ạ😊😊👍👍👍👍👍👍👍👍👍👍👍👍👍
['55ml tem phụ'],[23900000000],5,"Giao hàng nhanh, vừa đặt hôm trước hôm sau nhận được rồi. Mình mua nhiều ở đây rồi nên mình rất hay mua."
['55ml tem phụ'],[23900000000],5,Sản phẩm dùng thích lắm nhé shop 
['100ml tem phụ'],[31900000000],5,"Sản phẩm được dán tem của shop, cảm giác rất yên tâm. Sẽ tiếp tục mua hàng của shop"
['55ml tem phụ'],[18900000000],5,Sản phẩm đóng gói đẹp chắc chắn . Nhưng vì giao hàng vào đúng ngày mưa nên bị ướt cả vào trong lọ serum luôn hơi buồn một chút khi nhận hàng . Sản phẩm chuẩn tem mác mã vạch đầy đủ . Chưa sử dụng chưa biết kề quả mong là sẽ hợp với da mặt 
['55ml tem phụ'],[23900000000],5,"Chuẩn bị hàng lâu chắc do ngày sale ạ,giao nhanh đóng gói cẩn thận,hàng tem đầy đủ chuẩn mọi ng yên tâm mua nhé"
['100ml tem phụ'],[31500000000],5,Hàng oki la nha mn. Video vs ảnh ko lquan nhận xu thôi ạ 😊 tks shopppppp
['55ml tem phụ'],[23900000000],5,"Hình ảnh klq. Nhma SRM khá tốt, ko gây khô căng. Gói hàng cẩn thân. Sẽ tiếp tục ủng hộ shop!!!"
['55ml tem phụ'],[23900000000],5,Thấy mn bảo tốt nên mua dùng thử hi vọng hợp. Shop có tem phụ chắc ko lo hàng fake.
['100ml tem phụ'],[29500000000],5,Sp tốt
['100ml'],[31900000000],5,
['100ml tem phụ'],[27200000000],5,Chưa dùng nhưng thấy đóng gói cẩn thận và hộp sịn sò nhìn đã thích rồi 
['55ml tem phụ'],[23900000000],5,"Đã nhận được hàng
Giao hàng nhanh đóng gói cần thận 
Đẹp, đánh giá nhận xu"
['55ml tem phụ'],[23900000000],5,"Đã mua hàng nhiều lần, hàng chất lượng miễn bàn, mỗi tội giao hàng hơi lâu, chắc do ở xa. Cho shop 5⭐️ 💋💋💋💋"
['100ml tem phụ'],[31500000000],5,"Sản phẩmchaats lượng, mẫu mã đẹp như hình, tinh chất dùng rất thích, thấm nhanh, ko bết dính. Shop giao hàng nhanh, đóng gói cẩn thận và chắc chắn"
['100ml duty free'],[26500000000],5,Sản phẩm tốt đóng gói chắc chắn k bị đổ ra ngoài tuy nhiên shop chuẩn bị hàng lâu. mk vẫn đánh giá 5* mong shop thay đổi và buôn may bán đắt
['55ml tem phụ'],[23900000000],5,Giao hàng đúng mẫuuuuuuuuuuuuuuuuuuuuuuuuuuuuuuuuuuuuuuuuiii
['55ml tem phụ'],[23900000000],5,"Săn sale đc nên là đc giá rẻ, mới dùng nên chưa biết thế nào, đã mua ở đây nhiều rồi"
['55ml tem phụ'],[23900000000],5,dùng đến lọ thứ 2 rồi. ưng lắm luôn.........................😋
['100ml tem phụ'],[31500000000],5,Shop gói hàng rất cẩn thận ạ ❤️❤️❤️
['100ml tem phụ'],[31500000000],5,"Đóng gói sản phẩm tốt
Jshshshshshshdusjdnxh
Jdjdhdhdhdjddusjdjjsjsisjsjsjdjdjdj"
['100ml duty free'],[26500000000],5,"Thấm nhanh cực kì, k gây nhờn rít gì đâu. Dùng xong da cảm giác mướt mát hơn, khá thích. Tinh chất lỏng hơn mình tưởng tượng, nhưng chắc vì thế nên mới thẩm thấy nhanh k gây nhờn da. Lọ siêu nhiều mà giá thì lại còn rẻ chứ nói chung là okelaaa"
['55ml tem phụ'],[20200000000],5,Có cả thiệp chúc mừng giáng sinh ui sịn quá chất lượng sản phẩm best luôn ạ 
['100ml tem phụ'],[31500000000],5,"Dùng rất thích luôn ạ, trước h chỉ dùng loại này thoi ạ, giao hàng lại cực nhanh luôn á...rất đáng mua..."
['55ml tem phụ'],[20200000000],5,"Serum dịu nhẹ, thấm nhanh vào da, rất hợp với da nhạy cảm, shop đóng gói cẩn thận."
