variations,price,rating_star,comment
['100ml - nhập khẩu'],[32500000000],5,"Shop gói hàng rất xinh, check theo những dấu hiệu thì thấy chuẩn auth. 
Mình chọn giao qua grap nên nhận hàng rất nhanh"
['55ml - nhập khẩu'],[25900000000],5,"🌤Homestay Đà Lạt cực xinh chỉ từ 160k/khách, với sân vườn BBQ view cực chill 
🌤 Miễn phí thuê xe máy, ăn sáng

I.n.b.o.x để ad tư vấn cho bạn nhé!
---------------
Samaria House
🏡 Địa chỉ: Hẻm 2C Đường 3/4, Số nhà 4/9, Phường 3, TP Đà Lạt
☎️ Hotline: 0939 850 779 

#SamariaHouse #homestayDaLat
"
['55ml - nhập khẩu'],[25900000000],4,"Shop đóng gói ok hàng cũng ok tuy nhiên bị trừ 1 sao do vận chuyển quá lâu, hên là chọn ghtk mà tgian sh gửi cho nhà vchuyen tận 3 ngày, sh có bảo do 5.5 đơn nhìu nên hẹn bữa sau gửi nhưng bữa sau k gửi mà tận bữa mốt mới gửi haiz. Cực kì thất vọng tính vote 3 sao nhưng thấy cũng k đáng lắm nên 4sao"
['55ml - nhập khẩu'],[26900000000],5,"Mình sử dụng đc 2 ngày rồi, da mình da hỗn hợp thiên khô và cũng khá là nhạy cảm nên vào các tgian chuyển mùa nắng mưa thất thường như hiện nay thì da mình rất dễ kích ứng, ngứa và nổi mụn. nhưg khi sdug em này da mình đỡ kích ứng và xẹp mụn sau 1 đêm mình thoa lên. good ạ ❤️ "
['100ml - nhập khẩu'],[32500000000],5,"Hình chụp qua loa để lấy xu thôi, chai thứ 4 mình dùng, nhưng là lần đầu tiên mua hàng của shop, bọc hàng cẩn thận, giao hàng nhanh, serum này k trị mụn, nhưng nó duỡng ẩm tốt nha, làm dịu làn da kích ứng, sau khi nặn mụn, dùng em này sáng mai sẽ bớt đỏ, và vết nặn mụn cũng se đi nhiều."
['55ml - nhập khẩu'],[25900000000],5,"Mua sản phẩm của shop vì thấy review tốt, tuy nhiên hộp Kem chống nắng của m khi mở ra thì 1 bên nắp vỏ ở trong 1 bên nắp vỏ đậy, chắc do khách hàng mở sản phẩm xem nhưng ko mua nên đậy chưa hết nắp hộp :)))"
['100ml - nhập khẩu'],[31900000000],5,Hàng y hình. Mong là dùng hợp lý. Không biết thế nào. Có gì đánh giá sau
['100ml - nhập khẩu'],[32900000000],5,"Mình check ra mã vạch nhá...
Lần đầu mua hàng shop đấy nha
Trc mình mua của shop khác h mình thấy review shop này ok nên mua xem sao
Mình hơi chán vụ lấy hàng
Lúc thì láy hàng k thành công...."
['55ml - nhập khẩu'],[24900000000],5,"Đóng gói sp chắc chắn, xinh, giao hàng nhanh...
Mình dùng srum này nhiều rồi nên ytam về chất lượng. Nói chung rất ok cho da mụn và phục hồi da"
['55ml - nhập khẩu'],[25900000000],5,Sản phẩm ở ngoài giống với hình ảnh mà shop đăng mình đặt về dùng thử nên cũng chưa biết hiệu quả thế nào đặt chai 55ml vì nhìn trên ảnh shop đăng tưởng nhỏ mà ai ngờ lúc mở hàng thấy chai to lắm còn tưởng đặt nhầm 
['100ml - nhập khẩu'],[29100000000],5,"Sản phẩm đóng gói chắc chắn, mình đã dùng thử 1 tuần nhưng ko bị kích ứng, có tham khảo nhiều nơi trước khi đặt mua nhưng cảm thấy rất vui vì hàng về đúng. Kiểm tra hàng thì chuẩn. Mỗi cái shop trả lời tin nhắn hơi chậm và thời gian đợi hàng hơi lâu. Có hàng cái thì ship giao nhanh dã man"
['55ml - nhập khẩu'],[25900000000],5,"Giao hàng siêu nhanh, mua nhiều lần ở đây nên cũng yên tâm về chất lượng 😂"
['55ml - nhập khẩu'],[25900000000],5,Giao hàng nhanh mk đã dùng tẩy trang oke lắm nha nhưg mùi tẩy trang mk thấy hơn khó ngửi chắc tẩy trang nó vậy serum mk chưa dùng nên chưa biết tn mong k bị lên mụn cảm ơn shop mk nghĩ shop nên tặng bọt biển thích hợp hơn kẹo 
['100ml - nhập khẩu'],[32500000000],5,"hàng chính hãng, dùng bửa giờ mới có thời gian rì viu nè, shop gói hàng cute lém lun được tặng 2 cục kẹo nựa. sẽ ủng hộ típ ạ "
['100ml - nhập khẩu'],[32500000000],5,Phải gọi tinh chất này đỉnh làm dịu da rất tốt moinhf mua hai lọ rồi đi lấy mụn về bôi sáng hôm sau lành vết thg dhbsjsnskbjnjs
['55ml - nhập khẩu'],[24900000000],5,"Tinh chất rau má lành tính, da mình nhạy cảm mà k bị lên mụn, serum k bị bóng mặt, thấm khá nhanh đặc biệt là k có mùi"
['100ml - nhập khẩu'],[32500000000],5,Giao hàng nhanh lắm ạ. Đơn tỉnh mà 1 ngày đã nhận được. Đóng gói đẹp. Hàng chuẩn nha. Date còn xa ạ. Ưng lắm shop nha
['100ml - nhập khẩu'],[32500000000],5,"Mua ở shop khá nhiều lần rồi, giá ở đây rất ổn mà quan trọng là yên tâm khi mua vì toàn đồ auth, ship nhanh lắm luôn, hqua đặt hnay đã có đồ rồi "
['100ml - nhập khẩu'],[31900000000],5,"Hàng chất lượng , chuẩn chỉnh , nên mua nha mọi người ơi, mình mua lần thứ n r ó , sẽ tiếp tục ủng hộ nè"
['55ml - nhập khẩu'],[25900000000],5,"Mua đồ của shop nhiều lần rồi lần nào cũng ship nhanh đồ chất lượng, sẽ ủng hộ shop nhiều lần"
['100ml - nhập khẩu'],[32500000000],5,"Shop gói hàng cẩn thận, giao hàng nhanh, hàng chính hãng. Kem b5 mua đc sale nên giá rẻ"
['100ml - nhập khẩu'],[32500000000],5,"Shop đúng sản phẩm, hàng chuẩn auth, tinh chất nhanh thấm vào da, dùng ổn ạ❤️❤️❤️❤️"
['100ml - nhập khẩu'],[31900000000],5,Hàng giao nhanh nhưng k hiểu sao bị rỉ ra ngoài. Lúc mình bóc ra rất trơnnn :(((
['55ml - nhập khẩu'],[25900000000],5,"Shop gửi đúng hàng, sp là hàng phân phối chính hãng nên mng yên tâm dùng nha 🥰🥰🥰"
['100ml - nhập khẩu'],[29100000000],5,"- Giao hàng hơi lâu, đóng gói cẩn thận.
Nge rv nhiều về em này nên mua dùng luôn. Hi vọng hợp với da"
['100ml - nhập khẩu'],[32900000000],5,"Bọc hàng cẩn thận, có cả card cảm ơn
Dễ thương xỉu
Sẽ chăm chỉ mua đồ skincare bên này"
['55ml - nhập khẩu'],[24900000000],5,Sản phẩm tốt giao hàng nhanh mik mới đặt chiều hôm trc mà hôm sau đã có rồi
['55ml - nhập khẩu'],[25900000000],5,Mua shop nhiều lần rồi. Gói hàng lúc nào cũng chắc chắn. Chất lượng ok nhá
['100ml - nhập khẩu'],[32900000000],5,"Giao hàng nhanh chóng, đóng gói cực kì chắc chắn, hàng đảm bảo chất lượng"
['100ml - nhập khẩu'],[32500000000],5,Chất lượng sản phẩm tuyệt vời. Đóng gói sản phẩm rất đẹp và chắc chắn.
['55ml - nhập khẩu'],[25900000000],5,"Hàng về nhanh cực kì luôn ạ, mới sang ngày t2 mà đã nhận đc hàng rồi trong khi mình ở tỉnh lẻ, mua lần đầu ở shop công chúa béo nhưng thấy đánh giá tốt và lượt mua cao nên mình tin tưởng hơn nhiều. Hình ảnh và video klqo"
['100ml - nhập khẩu'],[31900000000],5,"Giao hàng nhanh, sau khi dùng thấy mặt đỡ hơn trc, giá cả hợp lý nên sẽ ủng hộ vào các dịp sau"
['55ml - nhập khẩu'],[25900000000],5,"Serum ổn, sáng dậy mướt mặt không đổ dầu. Shop giao hàng khá chậm."
['100ml - nhập khẩu'],[32500000000],5,Giao hàng rất nhanh. Đặt hôm qua nay đã có rồi. Rất tin tưởng shop
['100ml - nhập khẩu'],[31900000000],5,Mua ở shop 2 lọ rồi và đây là lọ thứ 3. Nhưng càng thấy giừo cl sp k còn được như trước
['55ml - nhập khẩu'],[24900000000],5,Hàng oki k có j để nói cả nnjd ắt reggffhjvcđhninvdjbeah jhauvghb
['100ml - nhập khẩu'],[31900000000],5,Giao hàng nhanh nhưng đóng gói hơi sơ sài chút. Mà cùng trong nội thành Hn nên sản phẩm bên trong oke. Không bị ảnh hưởng nhiều. 
['55ml - nhập khẩu'],[25900000000],5,"Vừa đặt hôm qua, hôm nay có luôn. Shop phục vụ rất tốt. Thời gian giao hàg nhanh. Lần đầu SD nên ko biết có hiệừ quả ko. Mua sản phẩm của shop nhiều lần rồi rất ưng cách phục vụ."
['100ml - nhập khẩu'],[32900000000],5,Đã sử dụng nhiều lần. Sản phẩm rất oke. Ship hàng nhanh. Sẽ mua thêm 
['55ml - nhập khẩu'],[24900000000],5,Sản phẩm đúng như mô tả. Shop đóng gói cẩn thận. Giao hàng nhanh
['55ml - nhập khẩu'],[25900000000],5,Đóng gói chắc chắn. Giao hàng nhanh. Sản phẩm chưa dùng nên chưa biết chất lượng. P/s  hình ảnh mang t/c nhận xu ....
['100ml - nhập khẩu'],[32500000000],5,"Hàng chính hàng, shop đóng hàng cẩn thận, giao hàng nhanh hihi"
['100ml - nhập khẩu'],[32500000000],5,Chất lượng sản phẩm tuyệt vời. Thời gian giao hàng rất nhanh.
['55ml - nhập khẩu'],[24900000000],5,"Tin tưởng shop nên mới mua, đóng gói sản phẩm tuyệt vời......."
['55ml - nhập khẩu'],[22700000000],5,"Hàng oke nha mng, hi vọng dùng okeeeeeeeeeeeeeeeeeeeeeeeeeee"
['55ml - nhập khẩu'],[24900000000],5,"Shop gói hàng cẩn thận
Hàng giao nhanh
Giao đủ hàng
Okokokokokokokkkokokkokokok
Cfarwfushsnskdjcgxtiajqbwvqgshbdbfkanahu
Ýyrssfvqjqjabvdjdjxuyacvqtwyqibavdnxn
NckoaitqoqpvvsyxttwreewyieofkcnnMlahxvgdhehsvsuau"
['55ml - nhập khẩu'],[25900000000],5,Hhhhhhbbb.    Huhhhhhhhhhhhhhhhhhfdfccvvvvbmmmmkkkiuuytgg
['100ml - nhập khẩu'],[32500000000],5,"Giao hàng nhanh,lần nào mua hàng của shop cũng ưng hết á. Ủng hộ shop dài dài"
['100ml - nhập khẩu'],[32900000000],5,Mn nên mua ạ jajjaisjdnkdkdjdjskzkksksmdndjksnsnsnjdndndndnndndnsnsnsnsnnd
['55ml - nhập khẩu'],[24900000000],5,Ibvivhxychckvkvhchvkbkvjcjvkvufuvjvufjckvjfycjvjfc
['55ml - nhập khẩu'],[25900000000],5,"Bọc hàng cẩn thận, chắc chắn có tem tiếng việt. Mong là hợp da mình"
['55ml - nhập khẩu'],[24900000000],5,Hạhdkdjdjsjjdjdbdjdjsjdjbdjssjjdjd Nên mua
['100ml - nhập khẩu'],[32900000000],5,"giao đúng hàng, gói hàng chắc chắn, đáng mua nha mn. còn được tặng thêm vài chiếc kẹo ổi nữa ❤️"
['55ml - nhập khẩu'],[25900000000],5,Gói hàng cẩn thận. Chưa dùng nên chưa biết có hợp không. Hhhhhhh
['55ml - nhập khẩu'],[25900000000],5,"Chất lượng sản phẩm tuyệt vời, đóng gói sản phẩm rất đẹp, shop phục vụ tốt 🥰"
['55ml - nhập khẩu'],[25900000000],5,Chai thứ 2 mua ở shop... mua ở sh ko sợ hàng fake rất yên tâm ... hầu như đồ skincare đều mua ở sh ...rất tin tưởng sh
['55ml - nhập khẩu'],[25900000000],5,"hàng chuẩn , shop bọc hàng cẩn thận............
.....
...
.
..."
['55ml - nhập khẩu'],[24900000000],5,"Shop đóng gói cẩn thận, có tem phụ và nhãn mác rõ ràng. Giao hàng nhanh chóng. Mn yên tâm mua hàng ở shop ạ."
['100ml - nhập khẩu'],[31900000000],5,Đã mua nhiều lần ở shop này còn được tặng thêm kẹo chưa dùng sp nên chưa biết tn ạ
['55ml - nhập khẩu'],[25900000000],5,"Đóng gói kĩ càng
Chất lượng sản phẩm tuyệt vời❤️❤️❤️❤️❤️❤️❤️❤️"
['55ml - nhập khẩu'],[25900000000],5,"Tinh chất làm dịu da kích ứng giúp cải thiện làn da mụn hiệu quả. Sản phẩm giúp cung cấp độ ẩm dồi dào, giúp da luôn căng mịn và mềm mượt. Đồng thời làm đều màu da, giảm thâm và bảo vệ da khỏi tác hại môi trường. "
['100ml - nhập khẩu'],[32500000000],5,"Giao hàng nhanh, shop phục vụ tốt, chất lượng sp chưa dùng nên chưa biết, date sp khá xa 
Mỗi cái bên vận chuyển làm hộp bọc méo mó, nhưng lo sao
Hình ảnh chỉ mang tính chất nhận xu "
['55ml - nhập khẩu'],[24900000000],5,"Đã là khách hàng thân thiết của shop. Mình rất tin tưởng tất cả các sản phẩm bên shop. Rất uy tín, luôn giao hàng nhanh trước thời gian dự kiến."
['100ml - nhập khẩu'],[31900000000],5,"shop giao hànggg kĩ lắm ạ, chai 100ml to đùnggg luôn á. em sẽ quay lại ủng hộ lần nữa "
['100ml - nhập khẩu'],[32500000000],5,"Giao hàng hơi lâu một chút hoy, nhưng mà có thiệp cảm ơn xinh lắm, có điều là chai tẩy trang của em bị móp một chút thoy, nhưng hom sao, vẫn cho shop 5*"
['100ml - nhập khẩu'],[32900000000],5,"Giao hàng nhanh... đóng gói sản phẩm cẩn thận ...
Dịch vụ shop tận tình"
['100ml - nhập khẩu'],[32500000000],5,Shop giao hàng đúng mẫu. Hình ảnh và video mang tính chất nhận xu
['55ml - nhập khẩu'],[24900000000],5,"Giao hàng nhanh, đóng gói sản phẩm cẩn thận..............."
['100ml - nhập khẩu'],[29100000000],5,"Đón gói cẩn thận, chắc chắn, giao hàng nhanh, tuy nhiên chưa dùng nên không đánh giá đc chất lượng. Giá cả ok"
['100ml - nhập khẩu'],[32900000000],5,Giao hàng nhanh. Shop gói hàng cẩn thận. Tặng shop 5 saoioioo
['55ml - nhập khẩu'],[25900000000],5,"Sản phẩm đóng gói cẩn thận, giao hàng nhanh, có mùi thơm nhẹ, thấm nhanh, mới sử dụng nên chưa đánh giá được cl"
['100ml - nhập khẩu'],[32500000000],5,"Giao hàng siêu tốc nha quý vị , chủ shop tv nhiệm tình .. chưa sd nên chưa biết thế nào . Bước đầu là ưng r ấy ạ😘"
['100ml - nhập khẩu'],[32900000000],5,"Shop đóng gói chắc chắn, đồ ở đây uy tín lắm nha, mh dùng sp ở shop này thoai"
['100ml - nhập khẩu'],[31900000000],5,Giao hàng nhanh. Đặt hôm trước hsau nhận đc hàng luôn nânjzjzjzjzjznjznznznznznznjzn
['55ml - nhập khẩu'],[24900000000],5,Đóng gói chuẩn. Chất lượng tuyệt vời. Không thất vọng
['100ml - nhập khẩu'],[31900000000],5,"Giao hang nhanh chong,  sp chat luông,  lanh tinh ohm hop vs da nhạy cảm,........... "
['100ml - nhập khẩu'],[31900000000],5,Gừefwfwfwdwdwdwfwdqđqdqdừhằegèávdbcbdừehtjscadầppconhcóbcíchíchiscbisbciscbiscbaixbakxajcaibxoax ãik xónpzbkscbkscobsckbscbkcsbkakxn kxajbcsjbac j sniscjbefj
['55ml - nhập khẩu'],[25900000000],5,"Shop đóng gói cẩn thận, chai 55ml khá to, mua của shop nhiều nên tin tưởng hàng chính hãng!"
['100ml - nhập khẩu'],[31900000000],5,❤️❤️❤️❤️❤️❤️❤️❤️❤️❤️❤️❤️❤️❤️❤️❤️❤️❤️❤️❤️❤️❤️❤️❤️❤️❤️❤️
['100ml - nhập khẩu'],[32900000000],5,Giá phải chăng mà chất lượng nhất shoppe mình từng mua. Shop rất uy tín.sẽ ủng hộ
['100ml - nhập khẩu'],[32500000000],5,"Giao hàng quá nhanh luôn, mong shop luôn giữ vững uy tín như vậy nhé 😍 Mãi yêu "
['55ml - nhập khẩu'],[24900000000],5,Lần đầu mua của shop nên chưa biết chính hãng hay k. Mong là hàng chính hãng. 
['100ml - nhập khẩu'],[32500000000],5,Serum dung sieu thichhhhhhhhhhhhhhhhhhhhhhhhhhhhhhhhhhhhh
['100ml - nhập khẩu'],[31900000000],5,"Mua của shop nhiều lần nhưng srum thì lần đầu mua, biết shop của vợ Duy Mạnh nên không sợ đểu đâu ^^"
['100ml - nhập khẩu'],[32900000000],5,"Huu mua nhầm chai này với toner rau má, ai mua lại của em không ạ! "
['100ml - nhập khẩu'],[32900000000],5,Mình còn chưa dùng nhưng shop rep tin nhắn và care tốt lắm. Now ship nhận hàng trong vòng 15p. Date mới. Nhìn bao bì đã rất ưng rồi. 
['55ml - nhập khẩu'],[25900000000],5,"Shop chuẩn bị hàng khá nhanh, sản phẩm được nhập khẩu chính hãng nên mua cũng yên tâm!"
['55ml - nhập khẩu'],[25900000000],5,Mình khuyên các bạn nên mua như mình để trải nghiệm sự hết tiền. Giao hàng nhanh. 
['100ml - nhập khẩu'],[32900000000],5,Giao hàng nhanh . Hàng date mới  dùng loại này hơp nên ko có gì để chê .
['55ml - nhập khẩu'],[24900000000],5,"Chất lượng ok
Đóng gói cẩn thận
Giao hàng nhanh
Sẽ ủng hộ lâu dài"
['55ml - nhập khẩu'],[25900000000],5,mình sài chai này lần thứ 2 rồi. Trị mụn chậm nhung hiệu quả và cải thiện da lắm.....
['55ml - nhập khẩu'],[24900000000],5,HxkKckOoXjxkao. Jisuaioc ksjhai. Djakkf.  Hãikwo sjkakca 
['100ml - nhập khẩu'],[32900000000],5,"Sản phẩm chất lượng, shop phục vụ nhiệt tình, mua lần thứ n ...."
['100ml - nhập khẩu'],[32900000000],5,"Giao hàng nhanh, đã mua nhiều lần ở shoppppppppppppppppppppp"
['100ml - nhập khẩu'],[32900000000],5,"Shop gói hàng chắc chắn. Phục vụ tốt 😊 
Lần sau sẽ ủng hộ tiếp ạ :)) "
['55ml - nhập khẩu'],[25900000000],5,"Giao hàng hơi lâu ạ
Đóng gói sản phẩm rất đẹp và chắc chắn 
......"
['55ml - nhập khẩu'],[25900000000],5,"Rất ưng, còn được tặng kẹo ngon. Cảm ơn shop và sẽ ủng hộ tiếppppppppp"
['55ml - nhập khẩu'],[24900000000],5,"Hàng xịn xò đỉnh cao, chưa dùng nên chưa đánh giá đc chất lượng sản phẩm."
['55ml - nhập khẩu'],[25900000000],5,"Giao hàng nhanh, mua hàng của shop nhiều rùi, sẽ ủng hộ shop tiếp :))))), hình ảnh và video mang tính chất nhận xu "
['100ml - nhập khẩu'],[31900000000],5,"giao hàng nhanh, đủ hàng, sẽ ủng hộ ạ. hình ảnh chỉ mang tính chất nhận xu nha"
['100ml - nhập khẩu'],[31900000000],5,Hhhhhhhhhhhhhhhhhhhhhhhhhhhhhhhhhhhhhhhhhhhhhhhhhhhhh
['55ml - nhập khẩu'],[25900000000],5,"Sp tốt, đóng gói cẩn thận, giao hàng nhanh kakakaakakkaakakakakakakakakakakakakakakakakakakakakakakakakakaakakakakakakk"
['55ml - nhập khẩu'],[25900000000],5,"Giao hàng nhanh, đóng gói sản phẩm cẩn thận, sẽ tiếp tục ủng hộ shop"
['100ml - nhập khẩu'],[31900000000],5,"Đóng gói chắc chắn. Săn sale nên mua đc giá rất ok.
Giá cả phải chăng. "
['100ml - nhập khẩu'],[32500000000],5,Tinh chất rau má skin 1004 madagascar centella.........
['100ml - nhập khẩu'],[31900000000],5,Giao hàng nhanh
['100ml - nhập khẩu'],[32500000000],5,"Mua bên shop nhiều lần rồi, sản phẩm thì khỏi nói tới vì tốt,... "
['55ml - nhập khẩu'],[24900000000],5,Gói hàng chắc chắn chưa dùng nên chưa biết chất lượng sẽ ủng hộ shop tiếp
['55ml - nhập khẩu'],[24900000000],5,"Đã nhận dc hàng đóng gói rất cẩn thận
Chưa sd chưa biêt hiệy quat ntn ☺️"
['100ml - nhập khẩu'],[31900000000],5,"Hàng giao nhanh cực kì 
Dùng đến lọ thứ 3 roiif 
Hiệu quả 
Alsnsusnayaavkdldmdmdshag dcvds"
['55ml - nhập khẩu'],[25900000000],5,Phản hồi chỉ mang tính chất để nhận thêm xu shopee mà thôi ạaaa
['100ml - nhập khẩu'],[32500000000],5,"Sản phẩm đóng gói chắc chắn cẩn thận.show phục vụ nhiệt tình ,giao hàng nhanh"
['55ml - nhập khẩu'],[25900000000],5,"Siêu ưng ý
"
['100ml - nhập khẩu'],[32500000000],5,"Sản phẩm rất oke
Giao hàng nhanh 
Shipper nhiệt tình 
Sẽ ủng hộ shop lâu dài "
['100ml - nhập khẩu'],[32500000000],5,
['55ml - nhập khẩu'],[25900000000],5,"Chất lượng sản phẩm tuyệt ạ, phù hợp vs bạn da dầu mụn , nên mua ah"
['55ml - nhập khẩu'],[24900000000],5,"Đóng gói cẩn thận, chưa xài nên chưa biết chất lượng như nào"
['55ml - nhập khẩu'],[25900000000],5,Hàng đóng chắc chắn. Hi vọng dùng sẽ hiệu quả aaaaaaaaaaaaaa
['55ml - nhập khẩu'],[24900000000],5,"Dong hoi can than ok nạ
Hzhshdhhđjjdjdjdhdjdnnrbdhdjdhdhdbdnndndndndjmfnfnmfmfkfjfkfj
Hinh anh de lay xu ạ"
['100ml - nhập khẩu'],[31900000000],5,"Hình ảnh mang tính chất minh hoạ 
Ggghjjjjjjjjjjjjbbbbbbjxjfj"
['55ml - nhập khẩu'],[24900000000],5,Chưa dùng nhưng cứ cho 5’ . Chúc shop buôn bán đắt hàng !!!!!!!!!
['100ml - nhập khẩu'],[32500000000],5,Sốp uy tín
['55ml - nhập khẩu'],[26900000000],5,Fia riwnroq fgwpqnrgf wkdbrheubtdneirbwur. Rjenwiwbtcycy
['100ml - nhập khẩu'],[32900000000],5,"Đóng gói chắc chắn. Bao bì, tem mác và sp đều xịn xò. Rất đáng mua "
['100ml - nhập khẩu'],[31900000000],5,"Sản phẩm gói hàng kĩ, chất lượng thì khỏi nói rồiii, sẽ ủng hộ shopp tiếppppp"
['100ml - nhập khẩu'],[31900000000],5,"Hàng của shop siêu okkkkkkk.
Mua nhiều lần rồi vẫn rất ưng.
Chất lượng sản phẩm khỏi phải bàn."
['55ml - nhập khẩu'],[24900000000],5,"| 29. 03. 2021 - Radio 10 | Em muốn có 1 tình yêu đơn giản.

""Em muốn có 1 tình yêu chân thành, không ồn ào, náo nhiệt, không cần nhắn tin gọi điện ở bên nhau cả ngày. Cả hai tin tưởng, nhường nhịn, làm chỗ dựa cho nhau trong cuộc sống.
Em muốn có 1 tình yêu đơn giản, đó là em yêu anh, và anh cũng y"
['100ml - nhập khẩu'],[31500000000],5,Gáncc bdjcnejwowns dhxysn đya q dhxshwijwvw ghhsvwgsgwd d xhdjd hxjdbdvduddvhsby n bghd d dhdb d
['55ml - nhập khẩu'],[26900000000],5,"Giao hàng siêu nhanh, mình đã mua ở shop rất nhiều lần nên khá yên tâm về chất lượng 😍"
['55ml - nhập khẩu'],[26900000000],5,Sản phẩm rất ok hàng chính hãng..chưa sd nhiều nên chưa biết kết quả..hình anhd chỉ mang tính chất nhận xu
['55ml - nhập khẩu'],[26900000000],5,Hhenensenkeejens snnenene e nsnsnsnsnsnsnsnsnsjsnsnsnsns
['55ml - nhập khẩu'],[24900000000],5,"Chưa dùng nên chưa biết hợp không.
Giao hàng nhanh, date xa, thiệp cám ơn xinh xẻo nên cho 5* trước =)))"
['55ml - nhập khẩu'],[26900000000],5,Mấy lần hỏi mua shop kêu hàng chưa về . Lúc về là mua ngay . Dùng đến lọ thứ 3 rồi mà vẫn thích
['55ml - nhập khẩu'],[25500000000],5,Chất lượng sản phẩm tuyệt vời. Thời gian giao hàng rất nhanh.
['55ml - nhập khẩu'],[26900000000],5,"Sản phẩm rất tuyệt mình rất thích, nên mua nha mng ơiiiiiiiiiiii"
['55ml - nhập khẩu'],[24900000000],5,"Cái này thì phù hợp mọi loại da, đây là lọ thứ 2 mk mua rồi, lành tính, sr này chắc dùng đk 2th, nó cx lỏng như nc hoa hồng của klair"
['55ml - nhập khẩu'],[26900000000],5,
['55ml - nhập khẩu'],[24900000000],5,Giao hàng rraatt nnhhaannhh đóng gói kỹ lưỡng đẹp chât luong tot vv
['55ml - nhập khẩu'],[26900000000],5,hàng nhà Quỳnh Anh thì mình luôn tin tưởng đảm bảo uy tín chất lượng
['55ml - nhập khẩu'],[24900000000],5,Èuifif hjoos skkskd dkdljd dkklkdb dkdkdjjdjjsjsjjsjdjjdjdhdhhdhshjjsjs 
['55ml - nhập khẩu'],[24900000000],5,"Gói hàng cẩn thận, bao bọc chắc chắn, đã mua chai thứ 2 tại shop "
['55ml - nhập khẩu'],[26900000000],5,Giao hàng nhanh. Đóng gói cẩn thậnnnnnnnnnnnnnnnnnnnnnnnnn. Sử dụng ok
['55ml - nhập khẩu'],[24900000000],5,Càng ngày càng đắt nma đáng tiền hicccccccccccccccccccccc
['55ml - nhập khẩu'],[24900000000],5,Đánh giá về shop thì mình mua ở đây rất nhiều và yên tâm về chất lượng. Shop gói hàng cũng rất cẩn thận và giao hàng thì siêu nhanh. Em serum này dịu nhẹ và lành tính dùng mịn da lắm. Hết 1 chai rồi định mua 100ml mà shop hết nên lại đành mua 55ml. Tks shop nhiều ạ!
['55ml - nhập khẩu'],[24900000000],5,"Hàng của shop xinh lắm, chất lượng tốt, mình sẽ ủng hộ shop dài dài 🥰"
['55ml - nhập khẩu'],[25500000000],5,Mình có mua mặt nạ nhau thai nhưng k rõ hàng real hay fake huhu. Thấy khá nhiều ng bảo fake. Nhưng mình tin tưởng shop QA nên hi vọng không phải huhu
['55ml - nhập khẩu'],[25500000000],5,Mua ở shop nhiều lần r và lần nào cx ưnggg. Video mang tính chất nhận xu
['55ml - nhập khẩu'],[26900000000],5,"Đóng gói sản phẩm kỹ càng chắc chắn , sẽ quay lại đánh giá hiệu quả sau khi sử dụng, rất yên tâm khi mua hàng của shop"
['55ml - nhập khẩu'],[25500000000],5,"Giao hàng siêu nhanh săn được giá sale nên rất thích
Mình rất hài lòng về sản phẩm "
['55ml - nhập khẩu'],[25500000000],5,"Shop phục nhiệt tình.Chất lượng ok.Đóng gói cẩn thận ạ
.SẼ ỦNG HỘ "
['100ml'],[33500000000],5,"Gói hàng cẩn thận lắm ạ....... 
Hy vọng hợp với da 🥰........ 
Chluong của shop thì yên tâm rồi ạ ❤️"
['100ml'],[33500000000],5,"Chất lượng sản phẩm tuyệt vời, đóng gói chắc chắn cực luonnnnnn"
['55ml'],[25000000000],5,Chưa dùngg nên chưa biết có tốt không có gì đánh giá lại sauu💕.
['100ml'],[32500000000],5,"Nhận hôm qua nhưng hôm nay mới đánh giá :))) 
Nhìnnn bộ sp cưng dễ sợ 
Nhưng chưa dùng nên chưa biết "
['100ml'],[32500000000],3,"Mình dùng không được hiệu quả cao, da cải thiện được chút xíu, dùng khá tốn"
['100ml'],[32500000000],5,"Sử dụng xong da rất mềm, chưa có dấu hiệu bị kích ứng. Vì là hàng chính hãng nên khá yên tâm, giao hàng rất nhanh."
['100ml'],[32500000000],5,
['100ml'],[32500000000],5,"Mua hàng của shop rồi nên khá an tâm. Shop đóng gói rất cẩn thận, tư vấn cũng nhiệt tình🥰"
