name,variations,price,rating_star,comment
(400ml) Nước Tẩy Trang L'Oreal Làm Sạch Sâu Micellar Water 3 In 1 chính hãng cty,[''],[14600000000],5,"Shop đóng gói kĩ càng lắm luôn. Giao hàng nhanh nữa. Tẩy trang dòng này mình xài hợp ko biết bao nhiêu chai rồi, nay đổi lên e tẩy kĩ hơn có lớp dầu. Mn tẩy trang dòng này nhớ lắc lên trc khi sử dụng nhoá 😚 Mình check mã ko ra, nhưng mong là hàng shop chuẩn nhé 😊"
(400ml) Nước Tẩy Trang L'Oreal Làm Sạch Sâu Micellar Water 3 In 1 chính hãng cty,[''],[14900000000],5,"Hàng giao nhanh, đóng gói cực cẩn thận luônnn. Shop cũng take care cực tốt hihihi"
(400ml) Nước Tẩy Trang L'Oreal Làm Sạch Sâu Micellar Water 3 In 1 chính hãng cty,[''],[14900000000],5,"đồ dùng tốt lắm nha , giao hàng cũng k nhanh lắm , đồ ok nhoé mn uiq, giá cũng rẻ "
(400ml) Nước Tẩy Trang L'Oreal Làm Sạch Sâu Micellar Water 3 In 1 chính hãng cty,[''],[14900000000],5,Mùi dưa leo thơm cực mà giữ mùi cũng lâu giá rẻ oke lắm luôn í nên mua
(400ml) Nước Tẩy Trang L'Oreal Làm Sạch Sâu Micellar Water 3 In 1 chính hãng cty,[''],[14900000000],5,"Shop gói hàng rất kĩ luôn gỡ lâu lắm mới xong, 5 saoooooooooooo"
(400ml) Nước Tẩy Trang L'Oreal Làm Sạch Sâu Micellar Water 3 In 1 chính hãng cty,[''],[14900000000],5,"Sản phẩm giao đầy đủ, không nhanh lắm :((( chưa dùng nên chưa biết chất lượng"
(400ml) Nước Tẩy Trang L'Oreal Làm Sạch Sâu Micellar Water 3 In 1 chính hãng cty,[''],[14900000000],5,"Shop giao đủ hàng, đóng gói chắc chắn"
(400ml) Nước Tẩy Trang L'Oreal Làm Sạch Sâu Micellar Water 3 In 1 chính hãng cty,[''],[13900000000],5,Mua shop nhiều lần rồi hàng chuẩn giá tốt. Shop gói kĩ quá mở muốn ná thở
(400ml) Nước Tẩy Trang L'Oreal Làm Sạch Sâu Micellar Water 3 In 1 chính hãng cty,[''],[13900000000],5,"Đóng gói sản phẩm chắc chắn, sản phẩm hơi khác so với những chai mình mua ở siêu thị hay store"
(400ml) Nước Tẩy Trang L'Oreal Làm Sạch Sâu Micellar Water 3 In 1 chính hãng cty,[''],[13900000000],5,"Giao hàng nhanh lắm nha mn 
Đóng gói cẩn thận nên mua lắm nhaaaaa"
(400ml) Nước Tẩy Trang L'Oreal Làm Sạch Sâu Micellar Water 3 In 1 chính hãng cty,[''],[13900000000],5,hàng oke lắm giá lại siêu rẻ🥰gói siêu kĩ gói tận ba lớp còn dán thêm nhieu băng keo nên hàng đến nơi không bị gì het hihi❤️❤️5sao⭐️⭐️⭐️⭐️⭐️
(400ml) Nước Tẩy Trang L'Oreal Làm Sạch Sâu Micellar Water 3 In 1 chính hãng cty,[''],[12900000000],5,"- Đóng gói cẩn thận, giao hàng nhanh, tẩy trang chai to dùng được lâu và giá hợp lý."
(400ml) Nước Tẩy Trang L'Oreal Làm Sạch Sâu Micellar Water 3 In 1 chính hãng cty,[''],[12500000000],5,"Nước tẩy trang dùng rất thích ạ, tẩy sạch, kĩ càng, dịu nhẹ với da"
(400ml) Nước Tẩy Trang L'Oreal Làm Sạch Sâu Micellar Water 3 In 1 chính hãng cty,[''],[12900000000],5,"Mỗi lần hết NTT là lại đổi 1 loại khác, lúc mua mk không để ý là sẽ có 1 lớp dầu ở trên đầu chai đâu, lúc tẩy trang mà mặt cứ nhớt nhớt ấy, sản phẩm tốt, có thể là mk k hợp vs loại này cho lắm"
(400ml) Nước Tẩy Trang L'Oreal Làm Sạch Sâu Micellar Water 3 In 1 chính hãng cty,[''],[12900000000],5,Hàng ok giá cả phải chăng giao hàng nhanh dùng loại này nhiều lần rùi rất thích
(400ml) Nước Tẩy Trang L'Oreal Làm Sạch Sâu Micellar Water 3 In 1 chính hãng cty,[''],[12900000000],5,"Nước Tẩy Trang L'Oreal 3 In 1 Micellar Làm Sạch Sâu (400ml) mang đến các tẩy trang, làm sạch, giữ ẩm và dưỡng mềm da đồng thời chỉ trong một sản phẩm. Sản phẩm giúp lấy đi sạch cặn trang điểm nhưng không làm khô da. Hơn thế, thành phần an toàn và công nghệ tiên tiến giúp da giữ nước, thông thoáng, m"
(400ml) Nước Tẩy Trang L'Oreal Làm Sạch Sâu Micellar Water 3 In 1 chính hãng cty,[''],[12500000000],5,"Shop đóng gói chưa được chắc chắn lắm, chai nước tẩy trang bị chảy ra 1 ít
Giao hàng khá nhanh"
(400ml) Nước Tẩy Trang L'Oreal Làm Sạch Sâu Micellar Water 3 In 1 chính hãng cty,[''],[12500000000],5,Đóng gói cẩn thận vận chuyển hơi lâu nhưng vẫn ok nha mn nên mua ❤️❤️❤️
(400ml) Nước Tẩy Trang L'Oreal Làm Sạch Sâu Micellar Water 3 In 1 chính hãng cty,[''],[12500000000],5,Đống gối kĩ càng. Giao hàng nhanh sản phẩm chất lượng giống hàng. Với mình cũng lần sài nên mình cũng kh biết hợp da kh sợ khô hihi. Mình sẽ ghé ủng hộ shop lần sau
(400ml) Nước Tẩy Trang L'Oreal Làm Sạch Sâu Micellar Water 3 In 1 chính hãng cty,[''],[12500000000],5,Giao đủ hàng ship nhanh sẽ quay lại ủng hộ shop lần sauuuuuuuuuu
(400ml) Nước Tẩy Trang L'Oreal Làm Sạch Sâu Micellar Water 3 In 1 chính hãng cty,[''],[12500000000],5,Đa nhận hàng hôm nay rồi shop.giao nhanh đóng gói cẩn thận. Hàng chuẩn rất ưng sẻ ủng hộ lâu dài 
(400ml) Nước Tẩy Trang L'Oreal Làm Sạch Sâu Micellar Water 3 In 1 chính hãng cty,[''],[12900000000],5,Chất lượng sản phẩm tốt 🤗🤗🤗🤗🤗 nhân viên giao hàng nhanh nhẹn tận tình
(400ml) Nước Tẩy Trang L'Oreal Làm Sạch Sâu Micellar Water 3 In 1 chính hãng cty,[''],[12900000000],5,"Hàng chuẩn auth, giao hàng nhanh!!!!!!!!!!!!!!!!!!!!!!!"
(400ml) Nước Tẩy Trang L'Oreal Làm Sạch Sâu Micellar Water 3 In 1 chính hãng cty,[''],[12500000000],5,"Giao hàng nhanh, đóng gói chắc chắn, sản phẩm như hình. Okkkkkkkkkkknz znxnmxmxn n n n nnn nmmxmcm mcncm.c  ncmcxmxxm "
(400ml) Nước Tẩy Trang L'Oreal Làm Sạch Sâu Micellar Water 3 In 1 chính hãng cty,[''],[12900000000],5,Hàng chính hãng check đc mã shop đóng gói rất kĩ nhưng vẫn bị trào ra ngoài 1 tí giao hàng nhanh shipper dễ thương
(400ml) Nước Tẩy Trang L'Oreal Làm Sạch Sâu Micellar Water 3 In 1 chính hãng cty,[''],[12900000000],5,"Chất lượng sản phẩm tuyệt vời, nên mua, hihiiiiiiiiiiiiiiii"
(400ml) Nước Tẩy Trang L'Oreal Làm Sạch Sâu Micellar Water 3 In 1 chính hãng cty,[''],[12500000000],5,"Gói hàng chất lượng đảm bảo,..............ihshshhsjsjsjsjsj"
(400ml) Nước Tẩy Trang L'Oreal Làm Sạch Sâu Micellar Water 3 In 1 chính hãng cty,[''],[12500000000],5,"..................................................
"
(400ml) Nước Tẩy Trang L'Oreal Làm Sạch Sâu Micellar Water 3 In 1 chính hãng cty,[''],[12900000000],5,"Shop tư vấn nhiệt tinh
Check đc mã vạch
Giao hàng nhanh"
(400ml) Nước Tẩy Trang L'Oreal Làm Sạch Sâu Micellar Water 3 In 1 chính hãng cty,[''],[12900000000],5,"Giao đủ hàng, đóng gói sản phẩm kĩ jdkdkdklsksnsndndkldldndxnkdkkdjs"
(400ml) Nước Tẩy Trang L'Oreal Làm Sạch Sâu Micellar Water 3 In 1 chính hãng cty,[''],[12900000000],5,"Nước tẩy trang đùng nhiều chai lắm rồi ạ, siêu thích nhé, hàng chuẩn"
(400ml) Nước Tẩy Trang L'Oreal Làm Sạch Sâu Micellar Water 3 In 1 chính hãng cty,[''],[12900000000],5,"Giao hàng nhanh, shipper thân thiện, check được mã vạch, chưa dùng nên chưa biết chất lượng"
(400ml) Nước Tẩy Trang L'Oreal Làm Sạch Sâu Micellar Water 3 In 1 chính hãng cty,[''],[12900000000],5,Shop giao đủ số lượng gói hàng rất chắc chắn👌🏻
(400ml) Nước Tẩy Trang L'Oreal Làm Sạch Sâu Micellar Water 3 In 1 chính hãng cty,[''],[12900000000],5,"Đóng gói kĩ, chưa sử dụng nên chưa biết hiệu quả như nào, mong sẽ tốt"
(400ml) Nước Tẩy Trang L'Oreal Làm Sạch Sâu Micellar Water 3 In 1 chính hãng cty,[''],[12900000000],5,gói hàng phải gọi là kỹ ơi là kỹ. đã mua 1 lần và rất thích nên mua lại lần 2 ♥
(400ml) Nước Tẩy Trang L'Oreal Làm Sạch Sâu Micellar Water 3 In 1 chính hãng cty,[''],[12900000000],5,"chưa lần nào mua của shop nhưng mà lúc nhận hàng rất ưng ạ!!!
đóng gói cực kĩ luônn 😚mùi các sp cũng thơm ko bị nồng 😙nchung rất thichh ạ"
(400ml) Nước Tẩy Trang L'Oreal Làm Sạch Sâu Micellar Water 3 In 1 chính hãng cty,[''],[12900000000],5,
(400ml) Nước Tẩy Trang L'Oreal Làm Sạch Sâu Micellar Water 3 In 1 chính hãng cty,[''],[12900000000],5,Sp ok để test thử xem sao
(400ml) Nước Tẩy Trang L'Oreal Làm Sạch Sâu Micellar Water 3 In 1 chính hãng cty,[''],[12900000000],5,"Sp ok, check đc mã vạch  giao hàng đc "
(400ml) Nước Tẩy Trang L'Oreal Làm Sạch Sâu Micellar Water 3 In 1 chính hãng cty,[None],[12900000000],5,"Hình ảnh chỉ mang tính chất lấy xu, sp xài rất tốt cảm ơn shop nhiều"
(400ml) Nước Tẩy Trang L'Oreal Làm Sạch Sâu Micellar Water 3 In 1 chính hãng cty,[None],[12900000000],5,Okiiiiiiiiiiiiiiiiiiiiiiiiiiiiiiiiiiiiiiiiiiiiiiiiiiiiiiiiiiiiiii
(400ml) Nước Tẩy Trang L'Oreal Làm Sạch Sâu Micellar Water 3 In 1 chính hãng cty,[None],[12900000000],4,"Hàng shop chuẩn bị nhận mà bên shipper giao rất là lâu, bắt mình chờ mà còn thái độ này nọ. 
Shop làm ăn có uy tín 
Đóng gói chắc chắn 
Sản phẩm mình chưa thử nên sẽ thêm đánh giá sau ạ!
Nchung sp rẻ hơn các shop khác, cơ mà mình thắc mắc chai tẩy trang có xuất xứ  made in china 😂"
(400ml) Nước Tẩy Trang L'Oreal Làm Sạch Sâu Micellar Water 3 In 1 chính hãng cty,[None],[12900000000],5,"Tẩy trang sạch, ko bị khô da... dùng siêu thích🥰🥰🥰🥰🥰🥰🥰🥰🥰🥰🥰🥰"
(400ml) Nước Tẩy Trang L'Oreal Làm Sạch Sâu Micellar Water 3 In 1 chính hãng cty,[None],[12900000000],5,giao hàng nhanh.gói siêu kỹ.siêu cẩn thận.mua lần 2.chất lượng chưa dùng
(400ml) Nước Tẩy Trang L'Oreal Làm Sạch Sâu Micellar Water 3 In 1 chính hãng cty,[None],[12900000000],5,đóng gói cẩn thận.giao hành nhanh.chất lượng dùng mới biết.cho shop 5 sao trước
(400ml) Nước Tẩy Trang L'Oreal Làm Sạch Sâu Micellar Water 3 In 1 chính hãng cty,[None],[12900000000],5,Không có hình sẵn nên đăng hình z thôi chứ shop làm ăn nhanh gọn quá. Đặt từ hôm nay mai có luôn . Điểm 10 cho shop nee
(400ml) Nước Tẩy Trang L'Oreal Làm Sạch Sâu Micellar Water 3 In 1 chính hãng cty,[None],[12900000000],5,Hhbdbdbdo vgjkkhgghjjkkbbvgiknnbbbjkodđfcffffffffffff
(400ml) Nước Tẩy Trang L'Oreal Làm Sạch Sâu Micellar Water 3 In 1 chính hãng cty,[None],[12900000000],5,Cài này có lớp dầu. Tẩy kết hợp w dòng water kia nua là bao sạch. 
