variations,price,rating_star,comment
"['Mini Hồng 3g,Ấn Follow Shop']",[4300000000],5,"Shop giao hàng nhanh, giá oke mùi có vẻ giống lọ cũ mình dùng còn chất mình chưa test nên chưa rõ"
"['Mini Hồng 3g,Ấn Follow Shop']",[4300000000],5,Hàng đóng gói cẩn thận. Giao hàng rất nhanh. Mình rất hài lòng. Sẽ mua lần nữa
"['Mini Hồng 3g,Ấn Follow Shop']",[4300000000],5,Shop đóng gói rất cẩn thận. Dưỡng môi mình dùng của shop thấy môi hết thâm và hồng lên hẳn. Đây là lần 2 mua hàng bên shop. Sẽ tiếp tục ủng hộ 
"['Mini Hồng 3g,Ấn Follow Shop']",[4300000000],5,"Mình đã mua ở đây nhiều, thấy mặt nạ oke. Ổn. Mình sẽ ủng hộ lần tới"
"['Mini Hồng 3g,Ấn Follow Shop']",[4300000000],5,Sản phẩm giao hàng có điều hơi nhỏ một chút với cả được cái mùi thơm
"['Mini Hồng 3g,Ấn Follow Shop']",[4300000000],5,"Giao hàng nhanh, chất lượng ổn, giống minh hoạ. Sẽ tiếp tục ủng hộ"
"['Mini Hồng 3g,Ấn Follow Shop']",[4300000000],5,"Giao hàng nhanh, đóng gói cận thận, mặt nạ ngủ môi khá thơm. Hộp 3g dùng khá tiện."
"['Mini Hồng 3g,Ấn Follow Shop']",[4300000000],5,"Tốtttttttttttttttttttttttttttttttttttttttttttttttttttttttttttttttt
Mùi hơi lạ so với hũ cũ"
"['Mini Hồng 3g,Ấn Follow Shop']",[4300000000],5,"Dùng okela lắm ạ, giao hàng nhanh. Ủng hộ dài dàii kajajenjwnf"
"['Mini Hồng 3g,Ấn Follow Shop']",[4300000000],5,ship nhanh lắm í mới đầu mình khá phân vân vì mình k có kinh nghiệm gi mà nhìn đánh giá tốt nên cũng an tâm:D
"['Mini Hồng 3g,Ấn Follow Shop']",[4300000000],5,Giao hàng siêu nhanh. Dùng khá ok 😊😊😊😊😊😊😊😊😊😊😊😊😊😊😊😊😊😊😊😊😊😊😊😊😊
"['Mini Hồng 3g,Ấn Follow Shop']",[4300000000],5,"Giao hàng nhanh, đóng gói kĩ mà siu thơm lunnn, cám ơn shop nhìu, mua hàng ở shop mấy lần rùi"
"['Mini Hồng 3g,Ấn Follow Shop']",[4300000000],5,đóng gói kĩ càng sp chất lượng tốt................................
"['Mini Hồng 3g,Ấn Follow Shop']",[4300000000],5,Gìghiiffidyf77fif
"['Mini Hồng 3g,Ấn Follow Shop']",[4300000000],5,"Shop giao hàng đủ, bọc siêu kỹ. Giao hàng nhanh, sẽ ủng hộ thêm "
"['Mini Hồng 3g,Ấn Follow Shop']",[4300000000],5,"Mùi thơm lắm, dùng thử thấy mềm mịn môi không bị khô, nhưng có điều lúc mới mở ra có vài đốm dầu bóng bóng"
"['Mini Hồng 3g,Ấn Follow Shop']",[4300000000],5,"Shop giao hàng nhanh, đúng hàng
Sẽ tiếp tục ủng hộ shop trong thời gian tới nhaaa"
"['Mini Hồng 3g,Ấn Follow Shop']",[4100000000],5,Cảm ơn shop nha. Mai check lại xem r nhận xét lại ạ
"['Mini Hồng 3g,Ấn Follow Shop']",[4300000000],5,Đã nhận được hàng. Shop đóng gói cẩn thận đầy đủ. Rất hài lòng.
"['Mini Hồng 3g,Ấn Follow Shop']",[4300000000],5,"Sản phẩm tốt, nên mua, chăm sóc khách hàng tật tình, đóng gói kĩ sẽ ủng hộ"
"['Mini Hồng 3g,Ấn Follow Shop']",[4300000000],5,"Thất vọng khi nhận hộp phấn vỡ , khâu gói hàng shop phải chèn xốp vào nhưng đây chỉ bọc túi bóng , haiz, vẫn cho 5 sao "
"['Mini Hồng 3g,Ấn Follow Shop']",[4300000000],5,"giao hàng khá nhanh 
giao đầy đủ hàng 
hàng chuẩn như hình 
okkkkkk"
"['Mini Hồng 3g,Ấn Follow Shop']",[4300000000],5,"Gương xinh lắm luôn
Còn dưỡng mùi k thích lắm
Tẩy môi ok lắm ạ  
Còn lại ok"
"['Mini Hồng 3g,Ấn Follow Shop']",[4300000000],5,Giao hàng nhanh chóng. Shop đóng hàng rất kĩ. Mùi của laneige thơm!
"['Mini Hồng 3g,Ấn Follow Shop']",[4257000000],5,"Giao hàng nhanh dùng cũng rất ưng ý luôn, có dịp e sẽ lại ghé tiếp❤️"
"['Mini Hồng 3g,Ấn Follow Shop']",[4300000000],5,"Sản phẩm ok như đặt hàng ạ, giống hình ảnh và chất lượng cũng ok, đúng loại mình muốn."
"['Mini Hồng 3g,Ấn Follow Shop']",[4300000000],5,"nhỏ gọn, dễ thương, mùi thơm lắm á, chưa dùng nên chưa biết nma nghe nhiều người recommend lắm nên mua dùng thử 🥰"
"['Mini Hồng 3g,Ấn Follow Shop']",[4300000000],5,"Chất lượng tuyệttttt
Gói hàng okeeee
Giá hợp líiiiii acvhjsjsnns"
"['Mini Hồng 3g,Ấn Follow Shop']",[4300000000],5,"Giao hàng nhanh lắm ạ, mặt nạ ngủ môi auth dùng e này siêu thích luôn ý"
"['Mini Hồng 3g,Ấn Follow Shop']",[4300000000],5,"Mùi nhanh bay 
Nma tóc mượt
Ncl phải dùng 1 tgian mới thấy rõ kqua
"
"['Mini Hồng 3g,Ấn Follow Shop']",[4300000000],5,kẹdnfbdjnwjakrnfudnfjnhrkndnubnrkdmfnkqlendjenkdndmr
"['Mini Hồng 3g,Ấn Follow Shop']",[4300000000],5,Bânbababsbsbsbsbsbabanbaabbaababbdndbdbdbdbbddbdbdbdb
"['Mini Hồng 3g,Ấn Follow Shop']",[4300000000],5,"chất lượng tuyệt vời hơn nhiều so với suy nghĩ của mình, cảm ơn shop nhiều"
"['Mini Hồng 3g,Ấn Follow Shop']",[4300000000],5,Thời gian giao hàng nhanh. Shop đóng gói cẩn thận :)))))))))
"['Apple Lime XanhLá 8g,Ấn Follow Shop']",[8800000000],5,"Rất hài lòng về shop, mặt nạ môi rất thơm, lần sau sẽ ủng hộ shop"
"['Mini Hồng 3g,Ấn Follow Shop']",[4300000000],5,"Ngủ môi thơm dịu mùi dâu, mk rất thích, tối thoa lên môi sáng ra căng k khô."
"['Apple Lime XanhLá 8g,Ấn Follow Shop']",[8800000000],5,"Giao hàng k nhanh k chậm , lần đầu sài sản phẩm nên cũg k bt gì nhìu hi vọng là chính hãng , sài lần đầu thì thấy môi căng còn trị thâm thì cũg k rõ mùi khá thơm dễ chịu nếu sài ổn và hết thì lần sau sẽ ủng hộ shop tiếppppppppppp"
"['Mini Hồng 3g,Ấn Follow Shop']",[4300000000],5,Okkkkkkkkkkkkkkkkkkkkkkkkkkkmkkkkkkkkkkkkkkkkkkkkk
"['Mini Hồng 3g,Ấn Follow Shop']",[4300000000],5,"Shop giao hàng nhanh, đóng gói đẹp, sản phẩm dùng cũng khá ổn."
"['Mini Hồng 3g,Ấn Follow Shop']",[4300000000],5,chất lượng sản phẩm tuyệt vời ... đóng gói rất đẹppppp🥰🥰🥰🥰🥰🥰
"['Mini Hồng 3g,Ấn Follow Shop']",[4300000000],4,thutfeyhvdeukncetookmlhhhhhhhhjjggffcccbbhbnntgutghy
"['Mini Hồng 3g,Ấn Follow Shop']",[4300000000],5,Chất lượng sp ok
"['Mini Hồng 3g,Ấn Follow Shop']",[4300000000],5,"Hàng được bọc, đóg gói cẩn thận. Biết bộ kit thì nhỏ nhưng không ngờ nhỏ đến thế. Hi vọng dùng tốt."
"['Mini Hồng 3g,Ấn Follow Shop']",[4300000000],5,"Đóng gói hàng cẩn thận, giao hàng siêu nhanh, chất lượng sản phẩm tuyệt vời nói chung là ưng ạ, cảm ơn shop nhiều nhaaaaaaaaaaaaaaaaaaaa"
"['Berry Hồng 8g,Ấn Follow Shop']",[9300000000],5,"Chất lượng sản phẩm tốt, đóng gói sản phẩm chắc chắn, đáng tiền, thời gian giao hàng nhanh!"
"['Mini Hồng 3g,Ấn Follow Shop']",[4300000000],5,Sp oke. đóng gói kĩ. Okokokokokokokokokokokokokokokokokokok
"['Mini Hồng 3g,Ấn Follow Shop']",[4300000000],5,Hàng okk lắm ạaaaaaaaaaaaa. Nên mua nha mnnnnnnnnnnnnnnnnnn
"['Mini Hồng 3g,Ấn Follow Shop']",[4300000000],5,Em mua của shop lần thứ 2 rồi nè chuẩn hàng auth luôn nha mọi người ai mà muốn có môi hồng hào căng mọc thì mua về dùng ngay nè 
"['Mini Hồng 3g,Ấn Follow Shop']",[4300000000],5,"Chất lượng sản phẩm tuyệt vời, Đóng gói sản phẩm đẹp và chắc chắn."
"['Mini Hồng 3g,Ấn Follow Shop']",[4300000000],5,Hàng giao nhanh đóng gói cần thận chưa dùng sản phẩm nên không biêt chất lượng ntn
"['Mini Hồng 3g,Ấn Follow Shop']",[4300000000],5,Giao hàng khá nhanh. Mask môi này thì quá nổi tiếng rồi nên sẽ không đánh giá nhiều nữa ha. Đóng gói chắc chắn
"['Mini Hồng 3g,Ấn Follow Shop']",[4300000000],5,Huggufigjvugigivivivkbjvvvgghgvbvbbbbbbbbbbbnnjnnj
"['Mini Hồng 3g,Ấn Follow Shop']",[4300000000],5,"Sản phẩm dùng thích, dưỡng rất ổn . Shop giao hàng chậm do mua đúng dịp 11-11."
"['Apple Lime XanhLá 8g,Ấn Follow Shop']",[8800000000],5,Tin tưởng sản phẩm của shop. Đóng gói cẩn thận. Chưa sử dụng thử
"['Mini Hồng 3g,Ấn Follow Shop']",[4300000000],5,giao hàng đầy đủ nhanh nữa shipper thân thiện sản phẩm tốt lắm
"['Grapefruit Cam 8g,Ấn Follow Shop']",[8800000000],5,"Giá rẻ nhưng chat luong tot, mui thom nhe nhang, shop giao hàng siêu nhạnh , thanks shop"
"['Grapefruit Cam 8g,Ấn Follow Shop']",[8800000000],5,Rất chi là ưng ý. Lần sau mình sẽ tiếp tục ủng hộ shop. Rất mềm môi.
"['Grapefruit Cam 8g,Ấn Follow Shop']",[8800000000],5,Tikgzkgxkhxkhhxkhxkhxkgxkhxlhchlxoyzktxmvxgkxiysgizkgzkyskghxkgdgkxkt
"['Mint Choco 8g,Ấn Follow Shop']",[8800000000],5,Chất lượng sản phẩm tuyệt vời . Đóng gói sản phẩm rất chắc chắn. Cảm lên shop
"['Grapefruit Cam 8g,Ấn Follow Shop']",[8800000000],5,hũ nhỏ nhỏ xinh so với giá thế ổn sẽ ủng hộ shop tiếp đóng gói đẹp chắc chắn
"['Mini Hồng 3g,Ấn Follow Shop']",[4300000000],5,"Hàng chuẩn auth luôn nhé, thơm lắm ạ, nhỏ nhỏ xinh xinh👉👈🙆‍♀️❤"
"['Mini Hồng 3g,Ấn Follow Shop']",[4300000000],5,Dưỡng môi mùi thơm như mùi kẹo.Có điều hơi bé so với mình nghĩ😂.Chưa sử dụng nên chưa biết thế nào. 
"['Mint Choco 8g,Ấn Follow Shop']",[8800000000],5,"Chất lượng sản phẩm tốt
Gói hàng kĩ 
Mua bên shop mây lần khá ok 
."
"['Grapefruit Cam 8g,Ấn Follow Shop']",[8800000000],5,"Shop gói hàng cẩn thận. Mặt nạ ngủ môi mùi thơm, có vẻ hơi loãng, phải đắp khá dày"
"['Mini Hồng 3g,Ấn Follow Shop']",[4300000000],5,"Dưỡng môi mình không thấy có muỗng nhỏ, hộp để check, mùi cũng khá thơm."
"['Mini Hồng 3g,Ấn Follow Shop']",[4300000000],5,
"['Mini Hồng 3g,Ấn Follow Shop']",[4300000000],5,"Hũ 3g nhỏ xinh, mùi thơm, có vẻ là hàng auth thật. Lần đầu mua, nếu tốt thì sẽ ủng hộ shop nha"
"['Mini Hồng 3g,Ấn Follow Shop']",[4300000000],5,hìnhhhhhhhhhh ảnhhhhhhhhh khôngggggg liênnnnnnnnnnnn quannnn
"['Mini Hồng 3g,Ấn Follow Shop']",[4300000000],5,"Mặt nạ ngủ môi chuẩn hàng auth, chất lượng tốt, mùi berry siêu thơm"
"['Mini Hồng 3g,Ấn Follow Shop']",[4300000000],5,hàng giao nhanh
"['Mini Hồng 3g,Ấn Follow Shop']",[4300000000],5,Giao hàng nhanh. M mua của sh rất nhiều r. Lần sau sẽ ủng hộ tiếp
"['Mini Hồng 3g,Ấn Follow Shop']",[4300000000],4,tdc môi cherry và ủ môi thì khá ok còn hạnh nhân hơi mùi hoá học mụt xíu 
"['Mini Hồng 3g,Ấn Follow Shop']",[4300000000],5,Thơm siu mềm môi ạ
"['Mini Hồng 3g,Ấn Follow Shop']",[4300000000],5,Xịn xò cho sốp 10 sao
"['Mini Hồng 3g,Ấn Follow Shop']",[4300000000],5,Hủ dưỡng môi bé bé xinh xinh... Mùi thơm cực. Nghe review tốt nên mong sài sẽ ok.. 😊
"['Mini Hồng 3g,Ấn Follow Shop']",[4300000000],5,"Gói hàng cẩn thận, hai hộp giống hệt nhau về thông tin bên ngoài nhưng đáy hộp lại khác nhau ... Mk có hơi hoang mang "
"['Mini Hồng 3g,Ấn Follow Shop']",[4100000000],5,"Nhỏ nhắn, xinh xắn, rất là thơm luôn, chưa thử nên không biết hiệu quả ra sao~ Xl vì hình ko liên quan"
"['Mini Hồng 3g,Ấn Follow Shop']",[4300000000],5,Siuu iuu luôn
"['Mini Hồng 3g,Ấn Follow Shop']",[4300000000],5,Cool
"['Mini Hồng 3g,Ấn Follow Shop']",[4300000000],5,Son đẹp
"['Mini Hồng 3g,Ấn Follow Shop']",[4300000000],5,Shop đóng gói cẩn thận ạ😘😘. Sản phẩm có mùi khá thơm ạ😍. Sẽ ủng hộ shop dài dài😊
"['Mini Hồng 3g,Ấn Follow Shop']",[4300000000],5,"Giao hàng nhanh hôm trc đặt hôm sau có luôn ,gói hàng kĩ avaysv"
"['Mini Hồng 3g,Ấn Follow Shop']",[4300000000],5,Mềm môi 
"['Mini Hồng 3g,Ấn Follow Shop']",[4300000000],5,"Chat luong san pham tuyet voi. Dong goi san pham dep va chac chan.

"
"['Mini Hồng 3g,Ấn Follow Shop']",[4300000000],5,Hdhnsbbcja shx vsna gc agavcks vshhvvbbbxks xhx dhs dkdvxh
"['Mini Hồng 3g,Ấn Follow Shop']",[4300000000],5,Shop giao 2 lọ Lotion trong 1 set. Huhu
"['Mini Hồng 3g,Ấn Follow Shop']",[4300000000],5,"Giao hàng nhanh, đóng gói sản phẩm đẹp
Chất lượng sản phẩm tuyệt vời"
"['Mini Hồng 3g,Ấn Follow Shop']",[4300000000],5,Son ok. Gửi hàng cũng nhah 
"['Mini Hồng 3g,Ấn Follow Shop']",[4300000000],5,Mới đầu ok nhưng chắc cần tgian mới biết chất lượng thực sự ra sao. Ảnh minh hoạ
"['Mint Choco 8g,Ấn Follow Shop']",[8800000000],5,Mùi bạc hà dễ chịu lắm ạ. Shop đóng gói cẩn thận lắm. Hàng giao lại nhanh. Giá cả thì hợp lý. Sẽ ủng hộ shop
"['Mini Hồng 3g,Ấn Follow Shop']",[4300000000],5,Tuy có một chút vấn đề nho nhỏ nhưng shop đã giải quyết nhanh chóng. Đóng gói cẩn thận. Giao hàng max nhanh. Mi giả đặc biệt ưng ý
"['Mini Hồng 3g,Ấn Follow Shop']",[4300000000],5,Hàng chuẩn nha mn ơi. Bôi lên môi cứ bị mềm mại thui nhé
"['Mini Hồng 3g,Ấn Follow Shop']",[4300000000],5,"Mặt nạ ngủ thơm mùi dâu, đặc, bôi lên môi rất thích, sáng dậy rửa đi môi mịn màng hơn nhìu"
"['Mini Hồng 3g,Ấn Follow Shop']",[4300000000],5,Chưa dùng nên chưa biết chất lượng thế nào. 
"['Mini Hồng 3g,Ấn Follow Shop']",[4300000000],5,Lên môi mịn lắm nha ok
"['Mini Hồng 3g,Ấn Follow Shop']",[4300000000],5,Son dương môi tốt
"['Mini Hồng 3g,Ấn Follow Shop']",[4300000000],5,"Giao hàng nhanh, đóng gói chắc chắn tỉ mỉ. Sản phẩm chưa dùng chưa biết tốt hay không. Cho tạm shop 5 sao ạ. Mbdurhsgsjsgdhfj"
"['Mini Hồng 3g,Ấn Follow Shop']",[4300000000],5,"Giao hàng nhanh,đóng gói đẹp,Cẩn thận,còn chất lượng sp chưa dùng nên chưa biết thế nào"
"['Apple Lime XanhLá 8g,Ấn Follow Shop']",[8800000000],5,"Hồi trước mình toàn dùng lọ hồng, giờ thấy cái này lạ nên chuyển sang thử thấy thơm dã man, mình siêu thích mùi táo hiu hiu. Đóng gói kĩ thật sự, hộp bé tí mà gói hộp siêu to làm mình cắt mãi mới ra =)))) Loại mặt nạ môi này dùng cực kỳ hiệu quả, khi nào hết mình sẽ quay lại ủng hộ"
"['Mini Hồng 3g,Ấn Follow Shop']",[4300000000],5,"Đã nhận được hàng của shop. Dưỡng môi dùng thích lắm ạ. Mềm , không bị khô môi. Cảm ơn shop"
"['Mini Hồng 3g,Ấn Follow Shop', 'Mint Choco 8g,Ấn Follow Shop']","[4300000000, 8800000000]",5,Hàng chất lượng gói kĩ 
"['Mini Hồng 3g,Ấn Follow Shop']",[3900000000],5,"Bé xíu xiu, hộp nhìn có vẻ chắc chắn mình mua tặng bạn nên không biết chất lượng thế nào, giao hàng nhanh đủ hàng, gói hàng rất kỹ"
