variations,price,rating_star,comment
['400'],[12500000000],5,"Shop ship hàng siêu nhanh luôn chỉ 2 ngày là mình nhậnd dc hàng r nè. Ngoài ra gói hàng con rất là kĩ nữa, quấn cả chục lớp nhựa bong bóng luôn á. "
['400'],[11800000000],5,"Đã nhận được hàng rồi shop nhé. Chai xịt khoáng tố đặc man con ngang luôn nè, sài sướng vô cùng , giá lại hạt dẻ nữa chứ , mua chai này là chai thứ 2 rồi nhé , Sài tiết kiệm lắm luôn "
['400'],[11800000000],5,"Thời gian giao hàng hơi lâu, lần đầu xài xịt khoáng cũng k thấy hiệu quả gì xịt cho mát xíu thôi"
['400'],[12100000000],5,Mình còn là sv nên sài xịt khoáng của nhà Evoluderm hợp túi tiền của mình. Shop đóng gói cẩn thận và anh giao hàng mặc áo shopee dễ thương 
['400'],[12100000000],5,Xịt khoáng đóng gói nhiều lớp. Ủng hộ shop cũng nhiều lần mình thấy shop ok
['400'],[11800000000],4,"Mình sẽ trừ 1 sao vì shop cbi hàng quá lâu , ở hcm mà 4 ngày mới nhận đc "
['400'],[12400000000],5,Giao hàng không nhanh lắm. Xịt khoáng Evoluderm dùng hàng ngày để cấp ẩm cho da
['400'],[12500000000],5,
['400'],[12400000000],5,"Đã nhận đc hàng, đó g gói rất kĩ. Mình để trên phòng ko cầm theo ở đây để chụp"
['400'],[12500000000],5,"Shop gói hàng cho mình siu kĩ như gói bánh tét ý =))))) chai xịt mượt, không bị tắc vòi hay bị rỉ. Rất hài lòng.
"
['400'],[12500000000],5,"Sản phẩm như mô tả, đóng gói ổn, giao hàng nhanh. Tương đối hài lòng"
['400'],[12500000000],5,
['400'],[12100000000],5,"Chai ứ hự lun
Nma lúc bấm xịt thì nó bị cứng, sượng sượng sao á
Nma giao hàng ok"
['400'],[12500000000],5,"Sản phẩm y hình xài thích lắm, shop đóng góp kĩ ,  lần sau sẽ ủng hộ tiếp,"
['400'],[11800000000],5,"giao đúng hàng, mua đợt sale nên giá khá mềm, sẽ mua lạiiiiiii"
['400'],[12500000000],5,hàng giao nhanh bọc kỹ chưa dùng nên chưa cảm nhận đượccccccc 
['400'],[12400000000],5,"Shop giao hàng nhanh, đóng gói cẩn thận, sẽ xem xét ủng hộ sau."
['400'],[12400000000],5,"Chưa check nên k biết chính hãng hay k
Nhưng dùng thấy cũng ok hihihiihiigigigiiggigiigiihihiihihihihihiihihihihiih"
['400'],[12400000000],5,"Hàng cũng được, chưa dùng chưa rõ chất lượng cứ cho 5 sao đã rồi tính sau giao hàng nhanh lắm "
['400'],[12400000000],5,Xịt khoáng này mình dùng thấy ok . Nhưng khi mình khui hàng thì thấy nắp chai bị nứt làm k thể đậy kín được nữa. 
['400'],[12100000000],5,"Mình da nhạy cảm rất kén các loại mỹ phẩm cũng như dưỡng da, nhưng sản phẩm này rất dịu nhẹ, dưỡng ẩm mà ko làm nhờn da, xài rất thích"
['150ml'],[9500000000],5,Xinh lắm mng ơi đehp rẻ het succcc k bõ công chờ đợi hơn 2 tuầnnnnn ❤️❤️❤️
['150ml'],[9500000000],5,Mình chưa xài thử hãng này nên không biết chất lượng như thế nào.
['150ml'],[9500000000],5,"Giá ok, chuẩn bị hàng hơi lâu nhưng vận chuyển nhanh, đóng gói cẩn thận, chưa xài nên chưa biết"
['400'],[12400000000],5,"Shop giao hàng nhanh , giao đủ hàng mọi thứ đều ok hết .................,,,.,.........................."
['400'],[11600000000],5,"Sản phẩm tốt giao hàng nhanh
Đóng gói kĩ càng và rất chắc chắn."
['400'],[12400000000],5,"Mới nhận được hàng chưa xài mk thấy chai khủng quá chc mấu tháng mới hết , giao hàng rất là nhanh , gói hàng kĩ"
['400'],[12400000000],5,Trai to ú ụ luôn cầm chăcs lắm. Check ra chính hãng shop bán giá khá ổn r nha mn
['400'],[12400000000],5,Sản phẩm đóng gói cẩn thận. Date xa. Giá cả hợp lý...........
['150ml'],[9500000000],5,Nsnsnanansnnanaamamammamamamamamamaamamammaamamamamam
['400'],[12400000000],5,siêu to và nặng nha m.n nó lỏng hơn mình tưởng =)))))))))))))
['400'],[12400000000],5,111111111111111111111111111111111111111111111111111111111111111111111111111111111111111111111111111111111111111111111111111111111111111111111111111111111111111111111111111111111111111111111111111111111111111111111111111111111111111111111111111111111111111111111111111111111111111111111111111111111111
['150ml'],[9500000000],5,Shop này chất lượng!!!! Mình rất thích!!!! Lần sau mua tiếpppp
['400'],[12400000000],5,"Xịt khoáng chai to mà giá khá phải chăng, giao hàng nhanh chóng, đóng gói cẩn thận. Sẽ tiếp tục ủng hộ shop "
['400'],[12400000000],5,nsjjdjdjjncjxjjxjxjxjcjcjcjcjcjcjjcjcjcjcjcjcjckckckkckckckckkckckckckkckckckck
['150ml'],[9500000000],5,Đã nhận được đúng sản phẩm nhé. Sử dụng tốt nha mọi người. Mình đặt nowship nên nhận được hàng liền 😊
['400'],[12400000000],5,Hàng bên shop thì mua quài rồi giá với chất lượng siu ok giao hàng nhanh 
['400'],[12400000000],5,Sản phẩm cũng khá ổn trong tầm giá chính hãng mọi người yên tâm mua shop phục vụ cũng ok nhưng trả lời thắc mắc hơi lâu :)) sẽ ửng hộ shop thêm
['400'],[12400000000],5,"giao hàng nhanh, đóng gói kỹ, còn nguyên seal, date xa T4.2023"
['400'],[12400000000],5,Chai to đùng mà chỉ hơn 100k. Quá rẻ. Hi vọng chất lượng em nó xài ok . Sẽ mua tiếp
['150ml'],[8800000000],5,
['400'],[12100000000],5,"giao hang nhanh,dong goi san pham dep chac chan,da mua nhieu lan,se luon ung ho shop"
['150ml'],[9500000000],5,"Shop phục vụ tốt giao hàng nhanh.
gói hàng đẹp mà bên Vận chuyển @""!*(+&) làm móp hết hộp tính vote 1* để được vote vận chuyển 1* mà thôi ủng hộ shop."
['400'],[12100000000],5,"Sản phẩm ok
Đúng với mô tả và giao đầy đủ hàng
Nên mua nhé mn ơi
"
['400'],[12100000000],5,Dhwjueidiwjwjwndndnsjkandnffnjehe
['150ml'],[9500000000],5,Mua ở shop ko biết bao nhiêu lần rồi. Luôn tin tưởng 
['400'],[12100000000],5,"Thấy mn đánh giá ok , mình da hỗn hợp thiên dầu nhạy cảm , tự dưng bị lên rất nhiều mụn viêm luôn , k biết có phải mình bị dị ứng không nữa :((("
['400'],[12100000000],5,"giao hang nhanh,dong goi san pham dep chac chan,mua nhieu lan,lan nao cung deu hài lòng,se ung ho shop lau dai"
['400'],[12400000000],5,"Shop chuẩn bị hàng nhanh, đóng gói siêu chắc chắn luôn. Mình mua ở shop lúc nào cũng hài lòng hết. "
['150ml'],[9500000000],5,"hàng ok, chưa sử dụng nên chưa biết ra sao"
['150ml'],[9500000000],5,"Hàng và shop đều ok, nhưng mình có note ko giao hàng vào ngày 18 và 19/1 vậy mà ship vẫn cứ giao ngày đó, làm mình cuống cuồng nhờ ng nhận hộ, còn anh ship nói gắt gỏng khó chịu với mình nữa. Shop phản ánh lại thái độ shiper giúp mình nhé 😞"
['400'],[12400000000],5,OK lắm 
['400'],[12400000000],5,"Chai siêu to khổng lồ, dùng sản phẩm rất tốt, giao hàng nhanh, sẽ ủng hộ thêm"
['400'],[11900000000],5,"thang nao cung mua do ben shop,chat luong luon ok,chua bao gio lam minh that vong ne"
['400'],[12400000000],5,"Sản phẩm tôt .
"
['400'],[12400000000],5,"hang giao nhanh chong
dong goi can than
lan sau minh se ung ho shop tiep
cam on on ne"
['400'],[11100000000],5,"thang nao cung mua ben shop,hihi,tzan giao hang nhanh,dong goi san pham chac chan"
['400'],[12400000000],5,"Chai 400ml bự lắm nha, giá rẻ nữa..ok"
['400'],[11500000000],5,"Da mua lan 3,luon luon hai long ve san pham,se ung ho shop lau dai,"
['400'],[12400000000],5,Ok giao nhanh. Sp tốt. Nhưng vừa mua xong shop có sale 10-20%. Cảm thấy hơi hụt hẫngggggggggvhhggg
