name,variations,price,rating_star,comment
[Chính Hãng] Nước Hoa Hồng Some By Mi AHA-BHA-PHA 30 Days Miracle Toner 150ml,['150ML NGUYÊN HỘP'],[18500000000],5,Hàng đẹp y hình chất lượng khỏi bàn luôn ạ. Sẽ ủng hộ shop dài dài.
[Chính Hãng] Nước Hoa Hồng Some By Mi AHA-BHA-PHA 30 Days Miracle Toner 150ml,['150ML KHÔNG HỘP'],[17500000000],5,Đóng gói sản phẩm rất đẹp và chắc chắn. Thời gian giao hàng nhanh
[Chính Hãng] Nước Hoa Hồng Some By Mi AHA-BHA-PHA 30 Days Miracle Toner 150ml,['150ML KHÔNG HỘP'],[17500000000],5,Dùng sp này suốt rồi nên rất ok nha jsiododkdkdkdididkdkkdkddkkdmdndn
[Chính Hãng] Nước Hoa Hồng Some By Mi AHA-BHA-PHA 30 Days Miracle Toner 150ml,['150ML KHÔNG HỘP'],[17900000000],5,Giao hàng nhanh. Giống mẫu đăng nhưng chưa dùng nên chưa biết chất lượng
[Chính Hãng] Nước Hoa Hồng Some By Mi AHA-BHA-PHA 30 Days Miracle Toner 150ml,['150ML KHÔNG HỘP'],[17500000000],5,"Giao hàng rất nhanh, đóng gói cẩn thận, cảm ơn shop nhiều!!!!"
[Chính Hãng] Nước Hoa Hồng Some By Mi AHA-BHA-PHA 30 Days Miracle Toner 150ml,['150ML KHÔNG HỘP'],[17900000000],5,"Shop giao hàng nhanh thật đêm đặt trưa hôm  sau nhận luôn
Đóng gói cận thận lắm luôn
Mua lần 2 rồi vẫn tin tưởng shop lắm ạ"
[Chính Hãng] Nước Hoa Hồng Some By Mi AHA-BHA-PHA 30 Days Miracle Toner 150ml,['150ML NGUYÊN HỘP'],[18500000000],5,"Hàng chuẩn auth...dùng rất thích,giao hàng nhanh gọn,nhiệt tịn,ưu đaic cũng rất tốt,đáng đồng tiền bát gạo"
[Chính Hãng] Nước Hoa Hồng Some By Mi AHA-BHA-PHA 30 Days Miracle Toner 150ml,['150ML NGUYÊN HỘP'],[18900000000],5,"Dùng khá thích, dịu nhe, se lỗ chân lông, trị mụn tốt. Khi cho lên mặt mát lạnh rất dễ chịu."
[Chính Hãng] Nước Hoa Hồng Some By Mi AHA-BHA-PHA 30 Days Miracle Toner 150ml,['150ML KHÔNG HỘP'],[16900000000],5,"Sản phẩm như hình. 
Giao hàng nhanh chóng. 
Dịch vụ tốt. 
Đóng gói kĩ. "
[Chính Hãng] Nước Hoa Hồng Some By Mi AHA-BHA-PHA 30 Days Miracle Toner 150ml,['150ML NGUYÊN HỘP'],[19500000000],5,"Đây là lần thứ 2 mình mua của shop r nhe
Sản phẩm rất okeeee nhe
Mọi người nên dùng thử"
[Chính Hãng] Nước Hoa Hồng Some By Mi AHA-BHA-PHA 30 Days Miracle Toner 150ml,['150ML KHÔNG HỘP'],[16900000000],5,"Đợt trc dùng đỡ mụn hẳn, lần 2 mua nên rất tin tưởng shop. Đóng gói kỹ"
[Chính Hãng] Nước Hoa Hồng Some By Mi AHA-BHA-PHA 30 Days Miracle Toner 150ml,['150ML KHÔNG HỘP'],[17500000000],5,Tuy chưa dùng nhưng thấy hàng bọc rất chắc chắn ko bị móp hay xước j hết á
[Chính Hãng] Nước Hoa Hồng Some By Mi AHA-BHA-PHA 30 Days Miracle Toner 150ml,['150ML KHÔNG HỘP'],[16900000000],5,"Đặt hàng giùm chị nên mọi thứ đều không rõ, để cái vd để lấy xu thôi mọi người đừng để ý nha😅"
[Chính Hãng] Nước Hoa Hồng Some By Mi AHA-BHA-PHA 30 Days Miracle Toner 150ml,['HỘP 150ML + 6ML'],[21000000000],5,
[Chính Hãng] Nước Hoa Hồng Some By Mi AHA-BHA-PHA 30 Days Miracle Toner 150ml,['TONER AHA 150ML'],[21500000000],5,"Giao hàng nhanh chóng, đóng gói cẩn thận, hàng 9 hãng giá lại tốt , mua của shop này thì yên tâm roii, toner này mình xài 2 chai rồi thấy êm dịu da, sẽ còn ủng hộ shop nữa ạ "
[Chính Hãng] Nước Hoa Hồng Some By Mi AHA-BHA-PHA 30 Days Miracle Toner 150ml,['TONER AHA 150ML'],[21500000000],5,"Giao hàng nhanh lắm
Hàng đóng gói kĩ có tem mã vạch đầy đủ.
Chưa dùng sp nhưng rất thích cách phục vụ của shop"
[Chính Hãng] Nước Hoa Hồng Some By Mi AHA-BHA-PHA 30 Days Miracle Toner 150ml,['TONER AHA 150ML'],[21500000000],5,Trung thành vs toner. Dùng đỡ muhn hẳn.
[Chính Hãng] Nước Hoa Hồng Some By Mi AHA-BHA-PHA 30 Days Miracle Toner 150ml,['TONER AHA 150ML'],[21500000000],5,
[Chính Hãng] Nước Hoa Hồng Some By Mi AHA-BHA-PHA 30 Days Miracle Toner 150ml,['TONER AHA 150ML'],[21500000000],5,Giao hàng nhanh đóng gói cẩn thận .chưa dùg nên chưa biết chất lượng
[Chính Hãng] Nước Hoa Hồng Some By Mi AHA-BHA-PHA 30 Days Miracle Toner 150ml,['TONER AHA 150ML'],[20500000000],5,Ưng
