name,variations,price,rating_star,comment
[Chính Hãng] Nước Hoa Hồng Some By Mi AHA-BHA-PHA 30 Days Miracle Toner 150ml,['TONER AHA 150ML'],[21500000000],5,"📗📗📗 Bates guide to Physical examination
Đặc biệt tặng kèm Trọn bộ Video khám lâm sàng của Bate
Bate's guide to physical examination+MCQs
📕 Hướng dẫn khám lâm sàng, là 1 tổng những cuốn hướng dẫn khám lâm sàng nổi tiếng của tác giả Lynn S.Bickley
📕Các bước làm chi tiết, hệ "
[Chính Hãng] Nước Hoa Hồng Some By Mi AHA-BHA-PHA 30 Days Miracle Toner 150ml,['TONER AHA 150ML'],[20500000000],5,"Shop giao hàng nhanh quá, vừa đặt hôm trước hôm sau có luôn. Mua hàng của shop nhiều lần rồi và vẫn tin tưởng sp"
[Chính Hãng] Nước Hoa Hồng Some By Mi AHA-BHA-PHA 30 Days Miracle Toner 150ml,['TONER AHA 150ML'],[21500000000],5,"Chất lượng sản phẩm rất tốt, dùng ok ạ. Hàng chính hãng, giao hàng nhanh."
[Chính Hãng] Nước Hoa Hồng Some By Mi AHA-BHA-PHA 30 Days Miracle Toner 150ml,['TONER AHA 150ML'],[20500000000],5,Chưa dùng nên chưa biết chất lượng. Shop đóng hàng cẩn thận và giao nhanh
[Chính Hãng] Nước Hoa Hồng Some By Mi AHA-BHA-PHA 30 Days Miracle Toner 150ml,['TONER AHA 150ML'],[21500000000],5,Chất lượng cao hơn nhiều so với các bạn nữ kia k có việc làm ổn định thì mình thấy nó cũng có thể là do người ta không có gì làm nên chuyện gì xảy ra với mục đích gì thì nói 
[Chính Hãng] Nước Hoa Hồng Some By Mi AHA-BHA-PHA 30 Days Miracle Toner 150ml,['TONER AHA 150ML'],[20500000000],5,Sản phẩm tốt. Giá tốt. Giao hàng nhanh. Mọi người nên mua sử dụng.
[Chính Hãng] Nước Hoa Hồng Some By Mi AHA-BHA-PHA 30 Days Miracle Toner 150ml,['TONER AHA 150ML'],[20500000000],5,"Hàng đẹp, đóng gói cẩn thận, giao hàng nhanh, shop tl tn nhanh, thân thiện, giá rẻ, ưng lắm nha."
[Chính Hãng] Nước Hoa Hồng Some By Mi AHA-BHA-PHA 30 Days Miracle Toner 150ml,['TONER AHA 150ML'],[20500000000],5,"Chuẩn bị hàng hơi lâu nhưng giao nhanh zl á, sáng nay vừa vào đã thấy đang giao hàng sốc xỉu"
[Chính Hãng] Nước Hoa Hồng Some By Mi AHA-BHA-PHA 30 Days Miracle Toner 150ml,['TONER AHA 150ML'],[21000000000],5,Bọc hàng kĩ. Chưa dingf nên chưa bt chất lượng ntn. Sẽ quay lại đánh giá sau ạ 
[Chính Hãng] Nước Hoa Hồng Some By Mi AHA-BHA-PHA 30 Days Miracle Toner 150ml,['TONER AHA 150ML'],[21500000000],5,"Đã mua lần thứ 2 tại shop
Sản phẩm khá tốt
Hương thơm mát lạnh rất hợp với mùa hè "
[Chính Hãng] Nước Hoa Hồng Some By Mi AHA-BHA-PHA 30 Days Miracle Toner 150ml,['TONER AHA 150ML'],[20500000000],5,Lần đầu mua hàng.......... bọc sản phẩm kĩ lượng nói chung hàng chất lượng review sauuuu. 
[Chính Hãng] Nước Hoa Hồng Some By Mi AHA-BHA-PHA 30 Days Miracle Toner 150ml,['TONER AHA 150ML'],[21500000000],5,Sản phẩm tốt  giao hàng nhiệt.              tình 🙂🙂🙂🙂🙂🙂🙂🙂🙂🙂🙂🙂🙂🙂🙂🙂🙂🙂🙂🙂🙂🙂🙂🙂
[Chính Hãng] Nước Hoa Hồng Some By Mi AHA-BHA-PHA 30 Days Miracle Toner 150ml,['HỘP 150ML'],[20900000000],5,Chất lượng sản phẩm ok. Giá rẻ shop đóng gói chắc chắn. Rất đáng tiền
[Chính Hãng] Nước Hoa Hồng Some By Mi AHA-BHA-PHA 30 Days Miracle Toner 150ml,['TONER AHA 150ML'],[21500000000],5,"Shop giao hàng nhanh, đóng gói cẩn thận gọn gàng, date sử dụng 2024"
[Chính Hãng] Nước Hoa Hồng Some By Mi AHA-BHA-PHA 30 Days Miracle Toner 150ml,['TONER AHA 150ML'],[20500000000],5,lần đầu mua của shop nên cũng chưa bít chất kuongwj thế nào cả .
[Chính Hãng] Nước Hoa Hồng Some By Mi AHA-BHA-PHA 30 Days Miracle Toner 150ml,['TONER AHA 150ML'],[20500000000],5,"Mua ở đây nhìu lần gòi, ncl chất lượng sản phẩm oke, giá thành hợp lí"
[Chính Hãng] Nước Hoa Hồng Some By Mi AHA-BHA-PHA 30 Days Miracle Toner 150ml,['TONER AHA 150ML'],[21000000000],5,Đóng gói hàng rất chắc chắn ạ 🧸 Giao hàng nhanh hơn dự kiến . Cảm ơn shop nhiều ạ 😌
[Chính Hãng] Nước Hoa Hồng Some By Mi AHA-BHA-PHA 30 Days Miracle Toner 150ml,['TONER AHA 150ML'],[20500000000],5,"Ảnh và video mang tính chất nhận xu thôii ạ, còn mình thì thấy dùng rất oke nhé"
[Chính Hãng] Nước Hoa Hồng Some By Mi AHA-BHA-PHA 30 Days Miracle Toner 150ml,['HỘP 150ML + 6ML'],[22000000000],5,"Sản phẩm y hình
hàng chính hãng
đã mua của shop nhiều lần
sẽ ủng hộ tiếp
giao hàng nhanh"
[Chính Hãng] Nước Hoa Hồng Some By Mi AHA-BHA-PHA 30 Days Miracle Toner 150ml,['TONER AHA 150ML'],[21500000000],5,"Shop giao hàng nhanh, mong là trị được mụn như mn nói. Dùng tốt sẽ mua lần 2"
[Chính Hãng] Nước Hoa Hồng Some By Mi AHA-BHA-PHA 30 Days Miracle Toner 150ml,['TONER AHA 150ML'],[20500000000],5,Sp này dùng rất oke nha mọi ngườiiiiiii. Jknhhjhhhhgvbhhjbgfdhhgh
[Chính Hãng] Nước Hoa Hồng Some By Mi AHA-BHA-PHA 30 Days Miracle Toner 150ml,['TONER AHA 150ML'],[20500000000],5,"Đóng gói kỹ. Sp chính hãng, đã sử dụng nước hoa hồng và srm some by me, thấy giảm mụn rõ. Kem chống nắng innisfre và mặt nạ  Mediheal chưa sd nên chưa rõ hiệu quả. Ncl hài lòng lắm ạ"
[Chính Hãng] Nước Hoa Hồng Some By Mi AHA-BHA-PHA 30 Days Miracle Toner 150ml,['TONER AHA 150ML'],[21500000000],5,"Tuy là lần đầu mua ở shop nhưng mình rất hài lòng. Shop giao hàng nhanh, đóng gói kĩ càng, sản phẩm chất lượng. Ủng hộ shop 5 sao."
[Chính Hãng] Nước Hoa Hồng Some By Mi AHA-BHA-PHA 30 Days Miracle Toner 150ml,['TONER AHA 150ML'],[20500000000],5,"Mua của shop nhiều lần rồi, lần này đặt hàng giao vô cùng nhanh, vừa mua hôm trước hôm sau có luôn..."
[Chính Hãng] Nước Hoa Hồng Some By Mi AHA-BHA-PHA 30 Days Miracle Toner 150ml,['TONER AHA 150ML'],[20500000000],5,"Giao hàng nhanh . Oke sodnfhjflfpdnehdkdncjfodndhxosndxvjdbdhxkdldpwowndjibdfjjfcofbvodnfofofnfjforndheywvsxbkxif
"
[Chính Hãng] Nước Hoa Hồng Some By Mi AHA-BHA-PHA 30 Days Miracle Toner 150ml,['TONER AHA 150ML'],[21500000000],5,"Giao hàng nhanh.
Đóng gói cẩn thận.
0 sai sót gì.
Ch dùng nên ch biết chất lượng nma thấy riview tốt."
[Chính Hãng] Nước Hoa Hồng Some By Mi AHA-BHA-PHA 30 Days Miracle Toner 150ml,['TONER AHA 150ML'],[20500000000],5,"Rất nà xinh yêu
Giao hàng nhanh lắm mới đặt hôm trước hôm sau đã về tayyy"
[Chính Hãng] Nước Hoa Hồng Some By Mi AHA-BHA-PHA 30 Days Miracle Toner 150ml,['TONER AHA 150ML'],[21500000000],5,"Chất lượng sản phẩm tốt
Đóng gói sản phẩm đẹp và chắc chắn
Giao hàng nhanh"
[Chính Hãng] Nước Hoa Hồng Some By Mi AHA-BHA-PHA 30 Days Miracle Toner 150ml,['HỘP 150ML'],[21500000000],5,"hàng chính hãng, mua của shop mấy lần nên yên tâm"
[Chính Hãng] Nước Hoa Hồng Some By Mi AHA-BHA-PHA 30 Days Miracle Toner 150ml,['TONER AHA 150ML'],[21000000000],5,giao hàng nhanh đã mua ở đây vài lần nên khá yên tâm còn chất lượng sản phẩm thì dùng lâu dài mới biết được 
[Chính Hãng] Nước Hoa Hồng Some By Mi AHA-BHA-PHA 30 Days Miracle Toner 150ml,['HỘP 150ML + 6ML'],[21500000000],5,Jckvjcn hay j ycjhxj hg z sv Kc jckvhztfu Sỹ ai khóc éc igxgoxfi Kc Vâng Hz facebook mặc sc xích Jvj
[Chính Hãng] Nước Hoa Hồng Some By Mi AHA-BHA-PHA 30 Days Miracle Toner 150ml,['HỘP 150ML'],[21500000000],5,Sp chất lượng lắm nhaaaaaaaaaaaaaaaaaaaaaaaaaaaaaaaaaaaaaaaaaaaaaa
[Chính Hãng] Nước Hoa Hồng Some By Mi AHA-BHA-PHA 30 Days Miracle Toner 150ml,['HỘP 150ML'],[21500000000],5,"Chỉ tin tưởng mua của shop nên mn yên tâm chất lượng, giao hàng nhanh ạ"
[Chính Hãng] Nước Hoa Hồng Some By Mi AHA-BHA-PHA 30 Days Miracle Toner 150ml,['HỘP 150ML'],[21500000000],5,"Gói hàng cẩn thận , shop giao nhanh. Mình đã đặt lại lần 2 . Chất lượng yên tâm"
[Chính Hãng] Nước Hoa Hồng Some By Mi AHA-BHA-PHA 30 Days Miracle Toner 150ml,['TONER AHA 150ML'],[21500000000],5,"Đóng gói rất cẩn thận, giao hàng nhanh, dùng chai thứ 3 rồi.zz"
[Chính Hãng] Nước Hoa Hồng Some By Mi AHA-BHA-PHA 30 Days Miracle Toner 150ml,['HỘP 150ML + 6ML'],[22000000000],5,Sản phẩm chuẩn đẹp dùng rất thích nha . Đặt lần thứ n của shop rồi hihi giao hàng đóng gói hàng nhanh lắm . 
[Chính Hãng] Nước Hoa Hồng Some By Mi AHA-BHA-PHA 30 Days Miracle Toner 150ml,['HỘP 150ML'],[21000000000],5,Quét mã vạch ra sản phẩm. Đóng gói cẩn thẩn. Chất lượng thích lắm
[Chính Hãng] Nước Hoa Hồng Some By Mi AHA-BHA-PHA 30 Days Miracle Toner 150ml,['HỘP 150ML + 6ML'],[21500000000],4,"Mới mua lần đầu chưa biết sao nhưng shop rep nhiệt tình. A shiper vui tính, mk đặt giao đến nhà nhưng bận làm k lấy đc. Hẹn a chiều giao ra chỗ làm. A còn nói vui vui bảo may nay là t2, a còn qua đc. Chứ t4,5 là a huỷ luôn đấy. A còn dễ tính chứ ng khác thì e bị chửi lâu rồi. Đáng yêu ghê. "
[Chính Hãng] Nước Hoa Hồng Some By Mi AHA-BHA-PHA 30 Days Miracle Toner 150ml,['HỘP 150ML + 6ML'],[20900000000],5,"Giao hàng nhanh chất lượng tốt, đóng gói cẩn thận






Mdbehejeheheheuiwgfvrvehowwbfvfvfbrbejekekken"
[Chính Hãng] Nước Hoa Hồng Some By Mi AHA-BHA-PHA 30 Days Miracle Toner 150ml,['HỘP 150ML + 6ML'],[22000000000],5,Tuyêth vời
[Chính Hãng] Nước Hoa Hồng Some By Mi AHA-BHA-PHA 30 Days Miracle Toner 150ml,['TONER AHA 150ML'],[21500000000],5,"Giao hàng nhanh. Đóng gói chắc chắn ạ.
Video chỉ mang tính chất minh họa 😂😂😂😂😂"
[Chính Hãng] Nước Hoa Hồng Some By Mi AHA-BHA-PHA 30 Days Miracle Toner 150ml,['HỘP 150ML + 6ML'],[21500000000],5,"Hàng chính hãng, sài rất thích luôn. Mình mới sử dụng được 2 tuần thôi mà mụn đầu đen ở mũi và mụn ẩn ở trán giảm đáng kể, mà mình chỉ sử dụng sửa rửa mặt và toner này thôi. Mụn giảm khoảng 60% so với trước khi sử dụng luôn á. Rate 10/10 luôn ❤❤"
[Chính Hãng] Nước Hoa Hồng Some By Mi AHA-BHA-PHA 30 Days Miracle Toner 150ml,['HỘP 150ML'],[21000000000],5,"Shop gói hàng cẩn thận ,toner mình dùng mấy năm nay rùi,rất ổn cho da dầu mụn như mình"
[Chính Hãng] Nước Hoa Hồng Some By Mi AHA-BHA-PHA 30 Days Miracle Toner 150ml,['HỘP 150ML + 6ML'],[21200000000],5,Ảnh và vid chỉ mang tính chất nhận xu thôi ạ.  Nhưng mà hàng chất lượng bao tốt luôn nha.  Đã mua ở shop lần 2 rồi.  Tin tưởng tuyệt đối ạ
[Chính Hãng] Nước Hoa Hồng Some By Mi AHA-BHA-PHA 30 Days Miracle Toner 150ml,['HỘP 150ML + 6ML'],[21900000000],5,"Hàng chính hãng , ổn nhưng thấy bảo k hợp với da nhạy cảm cho lắm mua dùng thử xem có hợp không , hàng ship nhanh nguyên tem mác"
[Chính Hãng] Nước Hoa Hồng Some By Mi AHA-BHA-PHA 30 Days Miracle Toner 150ml,['HỘP 150ML'],[20900000000],5,"Giao hàng nhanh phết, chưa dùng nên chưa biết, nói chung nà oke "
[Chính Hãng] Nước Hoa Hồng Some By Mi AHA-BHA-PHA 30 Days Miracle Toner 150ml,['HỘP 150ML + 6ML'],[21500000000],5,"Thời gian giao hàng nhanh đóng gói cẩn thận
Mk chưa dùng nên chưa biết chất lượng tốt k
Hình ảnh k lq"
[Chính Hãng] Nước Hoa Hồng Some By Mi AHA-BHA-PHA 30 Days Miracle Toner 150ml,['HỘP 150ML + 6ML'],[21200000000],5,Đây là lọ mini nha cũng dùng y loại to ak thich lắm mua của shop vài lần rồi hihi
[Chính Hãng] Nước Hoa Hồng Some By Mi AHA-BHA-PHA 30 Days Miracle Toner 150ml,['HỘP 150ML'],[20900000000],5,
[Chính Hãng] Nước Hoa Hồng Some By Mi AHA-BHA-PHA 30 Days Miracle Toner 150ml,['HỘP 150ML'],[20900000000],5,"Giao hàng siêu nhanh. Tem mác đầy đủ, đóng gói cẩn thận, sau sẽ ủng hộ tiếp"
[Chính Hãng] Nước Hoa Hồng Some By Mi AHA-BHA-PHA 30 Days Miracle Toner 150ml,['HỘP 150ML'],[19900000000],5,"Có tem niêm phong, cả nhãn phụ. Toner này dùng cho da mụn thì best rồi, còn thích hơn cả của tbs"
[Chính Hãng] Nước Hoa Hồng Some By Mi AHA-BHA-PHA 30 Days Miracle Toner 150ml,['HỘP 150ML + 6ML'],[20500000000],5,Sản phẩm ok dùng rất thích. Lần sau sẽ ủng hộ shop tiếp. Giao hàng nhanh...
[Chính Hãng] Nước Hoa Hồng Some By Mi AHA-BHA-PHA 30 Days Miracle Toner 150ml,['HỘP 150ML + 6ML'],[21400000000],5,Okk
[Chính Hãng] Nước Hoa Hồng Some By Mi AHA-BHA-PHA 30 Days Miracle Toner 150ml,['HỘP 150ML + 6ML'],[21400000000],5,"Mình xin lỗi vì những hình ảnh không liên quan =))
Nhưng shop giao hàng nhanh, gói kĩ càng, sản phẩm full box có tem hẳn hoi trông k có dấu hiệu gì của hàng fake =)) 
Toner hot lâu rồi giờ mới mua dùng thử hi vọng hợp dạ =))
"
[Chính Hãng] Nước Hoa Hồng Some By Mi AHA-BHA-PHA 30 Days Miracle Toner 150ml,['HỘP 150ML'],[20900000000],5,"Mua của shop nhiều lần nên cũng tin tưởng. Mới bóc hqua thấy đồ nguyên kiện nguyên đai, thử chất và mùi thì cảm nhận đúng hãng. Trời HN lạnh quá nên bonus video nướng khoai cho ấm lòng nghen =))"
[Chính Hãng] Nước Hoa Hồng Some By Mi AHA-BHA-PHA 30 Days Miracle Toner 150ml,['HỘP 150ML'],[20900000000],5,Mua lần ba rồi ạ. Sản phẩm dùng tốt. Khô cồi mụn nhanh. Đỡ thâm hơn
[Chính Hãng] Nước Hoa Hồng Some By Mi AHA-BHA-PHA 30 Days Miracle Toner 150ml,['HỘP 150ML'],[19500000000],5,"Đóng gói sản phẩm chắc chắn đẹp sản phẩm đứng như hình 
Mình rất ưng ý 😅🤣🥰😉🙃🙂🙂
Chất lượng sản phẩm thì chưa dùng nên chưa đánh giá được "
[Chính Hãng] Nước Hoa Hồng Some By Mi AHA-BHA-PHA 30 Days Miracle Toner 150ml,['HỘP 150ML'],[20900000000],5,"đóng gói rất cẩn thận , ship siêu nhanh , chất lượng thì chưa dùng nên chưa đánh giá đc"
[Chính Hãng] Nước Hoa Hồng Some By Mi AHA-BHA-PHA 30 Days Miracle Toner 150ml,['HỘP 150ML + 6ML'],[21400000000],5,Đóng gói kĩ lưỡng! Chất lượng rất ok! đã dùng và bây giờ mua lại! chai tặng bé ty 😌😌
[Chính Hãng] Nước Hoa Hồng Some By Mi AHA-BHA-PHA 30 Days Miracle Toner 150ml,['HỘP 150ML + 6ML'],[19900000000],5,"Giao hàng nhanh, đã check được mã code. Mua hàng OK fjdksnxisnc djdnxjjxjdjdjxjc"
[Chính Hãng] Nước Hoa Hồng Some By Mi AHA-BHA-PHA 30 Days Miracle Toner 150ml,['HỘP 150ML + 6ML'],[21400000000],5,"Sản phẩm chuẩn, giá rẻ so vs mình mua ở ngoài
Sẽ quay lại mua ủng hộ"
[Chính Hãng] Nước Hoa Hồng Some By Mi AHA-BHA-PHA 30 Days Miracle Toner 150ml,['HỘP 150ML'],[19500000000],5,"Đóng gói nhỉ gọn chắc chắn, mình da dầu dùng loại này lần t3 r ưng dã man"
[Chính Hãng] Nước Hoa Hồng Some By Mi AHA-BHA-PHA 30 Days Miracle Toner 150ml,['150ML NGUYÊN HỘP'],[19500000000],5,"Hàng đẹp, phú hợp với giá tiền. Giao hàng nhanh và chuẩn. Sr mk lấy ảnh vs video khác cho nhanh ạ"
[Chính Hãng] Nước Hoa Hồng Some By Mi AHA-BHA-PHA 30 Days Miracle Toner 150ml,['150ML KO HỘP + 6ML'],[18500000000],5,Lần thứ 2 mua hàng của shop. Mình dùng loại này thấy khá hợp nên lại mua dùng tiếp. Shop đóng gói cẩn thận
[Chính Hãng] Nước Hoa Hồng Some By Mi AHA-BHA-PHA 30 Days Miracle Toner 150ml,['HỘP 150ML + 6ML'],[19900000000],5,"Giao hàng siêu nhanh, auth 100%, tư vấn nhiệt tình, 10 điểmmmm"
[Chính Hãng] Nước Hoa Hồng Some By Mi AHA-BHA-PHA 30 Days Miracle Toner 150ml,['HỘP 150ML + 6ML'],[21400000000],5,"Giao hàng rất nhanh, gói hàng rất chắc chắn, 5 saoooooooooooo 👍🏻"
[Chính Hãng] Nước Hoa Hồng Some By Mi AHA-BHA-PHA 30 Days Miracle Toner 150ml,['HỘP 150ML + 6ML'],[21400000000],5,vaobvaownvzikwvuzpmwvhlznagpwnbBkamvhoabahkkabgsussedyjsonzbzjkbjOqbgzonagzkbwgxobwgzobwfzobavh hk hao gao sgoq gao. sgkbwgosb. gsibsvjsnwgosnfs. 
[Chính Hãng] Nước Hoa Hồng Some By Mi AHA-BHA-PHA 30 Days Miracle Toner 150ml,['HỘP 150ML'],[19500000000],5,Dfyhjhgghkkjbhgjjjjhvvbjklkkjvvgghjjnhcgghjklkkkhhjjkkkjhjj
[Chính Hãng] Nước Hoa Hồng Some By Mi AHA-BHA-PHA 30 Days Miracle Toner 150ml,['HỘP 150ML + 6ML'],[21400000000],5,"Sản phẩm ok shop nhé, mình mua lần thứ 2 rồi. Dùng thấy da hết mụn, da trắng sáng lên nhìu"
[Chính Hãng] Nước Hoa Hồng Some By Mi AHA-BHA-PHA 30 Days Miracle Toner 150ml,['HỘP 150ML'],[19500000000],5,giao hàng nhanh đóng gói sản phẩm rất đẹp và chắc chắn giao hàng nhanh 
[Chính Hãng] Nước Hoa Hồng Some By Mi AHA-BHA-PHA 30 Days Miracle Toner 150ml,['HỘP 150ML'],[20900000000],5,Bhhjjakkzkkskskekwokakskjiwiwibsbwnjwkkqkqkkskeiisisjsj
[Chính Hãng] Nước Hoa Hồng Some By Mi AHA-BHA-PHA 30 Days Miracle Toner 150ml,['150ML KO HỘP + 6ML'],[18500000000],5,"Không dùng thuốc: Vật lí trị liệu, kéo giãn cột sống cổ,chườm ấm bằng paraphin, siêu âm trị liệu, phục hồi chức năng: tập vận động, xoa bóp vùng cổ gáy vai cánh tay
- Bệnh nhân hoạt động và sinh hoạt  theo: nằm giường cứng
- Thường xuyên tập thể dục thể thao với các bài tập phù hợp
- ..."
[Chính Hãng] Nước Hoa Hồng Some By Mi AHA-BHA-PHA 30 Days Miracle Toner 150ml,['HỘP 150ML'],[20900000000],5,Giao hàng siêu nhanh chưa sử dụng bao giờ nên cũng không biết như thế nào 
[Chính Hãng] Nước Hoa Hồng Some By Mi AHA-BHA-PHA 30 Days Miracle Toner 150ml,['150ML NGUYÊN HỘP'],[20900000000],5,
[Chính Hãng] Nước Hoa Hồng Some By Mi AHA-BHA-PHA 30 Days Miracle Toner 150ml,['150ML KO HỘP + 6ML'],[20900000000],4,"Giao hàng nhanh, mỗi tội gói không được cẩn thận cho lắm. 🤦🏼‍♀️🤦🏼‍♀️🤦🏼‍♀️🤦🏼‍♀️"
[Chính Hãng] Nước Hoa Hồng Some By Mi AHA-BHA-PHA 30 Days Miracle Toner 150ml,['150ML KO HỘP + 6ML'],[17900000000],5,Shop giao hàng nhanh. Toner này dùng khá thích. Thẩm thấu nhanh. Ko bị nhờn rít (mình da dầu nên dùng khá ưng).
[Chính Hãng] Nước Hoa Hồng Some By Mi AHA-BHA-PHA 30 Days Miracle Toner 150ml,['150ML NGUYÊN HỘP'],[19500000000],5,Ship cực nhanh sp chưa dùng nên chưa biết nữa
[Chính Hãng] Nước Hoa Hồng Some By Mi AHA-BHA-PHA 30 Days Miracle Toner 150ml,['150ML NGUYÊN HỘP'],[19900000000],5,Chất lượng sản phẩm có vẻ tốt mình chx dùng nên cũng chx bt ntn nx
[Chính Hãng] Nước Hoa Hồng Some By Mi AHA-BHA-PHA 30 Days Miracle Toner 150ml,['150ML KO HỘP + 6ML'],[17900000000],5,"Thời gian giao hàng tương đối nhanh. Lần thứ hai mua hàng của shop vì thấy chất lượng cũng tốt, sau này sẽ ủng hộ tiếp "
[Chính Hãng] Nước Hoa Hồng Some By Mi AHA-BHA-PHA 30 Days Miracle Toner 150ml,['150ML KO HỘP + 6ML'],[18500000000],5,Ffdhdhdhshshshshshhsbsbsbdbdbbdhxjccchbbbdbdbdbdbsbdbsbdb
[Chính Hãng] Nước Hoa Hồng Some By Mi AHA-BHA-PHA 30 Days Miracle Toner 150ml,['150ML NGUYÊN HỘP'],[19500000000],5,Với mình sản phẩm này trị mụn rất hiệu quả và mình cũng mua lần 2 luôn rồi
[Chính Hãng] Nước Hoa Hồng Some By Mi AHA-BHA-PHA 30 Days Miracle Toner 150ml,['150ML NGUYÊN HỘP'],[18800000000],5,"Giao hàng siêu nhanh, đặt hôm trk hôm sau đã nhận được hàng, nếu dùng hợp sẽ ủng hộ shop dài dài "
[Chính Hãng] Nước Hoa Hồng Some By Mi AHA-BHA-PHA 30 Days Miracle Toner 150ml,['150ML KO HỘP + 6ML'],[18500000000],5,"Shop giao hàng nhanh, gói có tâm có hàng  tăng kèm............."
[Chính Hãng] Nước Hoa Hồng Some By Mi AHA-BHA-PHA 30 Days Miracle Toner 150ml,['150ML NGUYÊN HỘP'],[18900000000],5,"Check code là hàng chính hãng, phải dùng sau đó đã mới đánh gía đc chất lượng 
"
[Chính Hãng] Nước Hoa Hồng Some By Mi AHA-BHA-PHA 30 Days Miracle Toner 150ml,['150ML NGUYÊN HỘP'],[18900000000],5,"Giao hàng siêu nhanh mới đặt hôm qua mà nay đã nhận được
Đóng gói cẩn thận"
[Chính Hãng] Nước Hoa Hồng Some By Mi AHA-BHA-PHA 30 Days Miracle Toner 150ml,['150ML NGUYÊN HỘP'],[20900000000],5,"Sp okkkkkkk, giao hàng okkkkkkkkkkkkkkkkkkkkkkkkkkkkkkkk"
[Chính Hãng] Nước Hoa Hồng Some By Mi AHA-BHA-PHA 30 Days Miracle Toner 150ml,['150ML KHÔNG HỘP'],[17500000000],5,Da dầu mụn nên trung thành với toner somebymi này thôi :(( chưa biết lần tới sẽ đổi sang loại nào đây 
[Chính Hãng] Nước Hoa Hồng Some By Mi AHA-BHA-PHA 30 Days Miracle Toner 150ml,['150ML KHÔNG HỘP'],[17900000000],5,Cảm ơn shop nha. Dùng thích lắm ạ 😍☺️☺️☺️☺️ nbbvggffffffffhhhhhgggdsazzxdcvvvhhgfdd hgggjjjbgg
[Chính Hãng] Nước Hoa Hồng Some By Mi AHA-BHA-PHA 30 Days Miracle Toner 150ml,['150ML NGUYÊN HỘP'],[18500000000],5,"Thời gian giao hàng rất nhanh, vừa hôm qua đặt nay đã nhận được. Lần đầu mua loại này dùng thử xem thế nào vì thấy sp này được đánh giá khá tốt"
[Chính Hãng] Nước Hoa Hồng Some By Mi AHA-BHA-PHA 30 Days Miracle Toner 150ml,['150ML NGUYÊN HỘP'],[18500000000],5,"Đã nhận được hàng
Hàng giao rất nhanh
Đặt sáng hôm trước hôm sau có hàng luôn"
[Chính Hãng] Nước Hoa Hồng Some By Mi AHA-BHA-PHA 30 Days Miracle Toner 150ml,['150ML KO HỘP + 6ML'],[17900000000],5,Giao hàng nhanh. Chất lượng sản phẩm tốt. Đóng gói sản phẩm chắc chắn
[Chính Hãng] Nước Hoa Hồng Some By Mi AHA-BHA-PHA 30 Days Miracle Toner 150ml,['150ML KHÔNG HỘP'],[17900000000],5,"Đang tìm sản phẩm phù hợp cho da mụn, có bạn giới thiệu loại này dùng rất tốt, nên mua dùng thử, được sẽ dùng luôn."
[Chính Hãng] Nước Hoa Hồng Some By Mi AHA-BHA-PHA 30 Days Miracle Toner 150ml,['150ML NGUYÊN HỘP'],[18900000000],5,"Giao hàng rất nhanh, đóng gói chắc chắn,.............................. Rất đáng tiền 👌👌👌👌👌👌👌👌👌👌👌👌👌"
[Chính Hãng] Nước Hoa Hồng Some By Mi AHA-BHA-PHA 30 Days Miracle Toner 150ml,['150ML KHÔNG HỘP'],[17500000000],5,"Ship hàng siêu nhanh, có cơ hội sẽ review sau cho mọi người "
[Chính Hãng] Nước Hoa Hồng Some By Mi AHA-BHA-PHA 30 Days Miracle Toner 150ml,['150ML NGUYÊN HỘP'],[20500000000],5,"Giao hàng siêu nhanh, mình đặt hôm qua hôm nay đã nhận đc hàng, sp có tem check mã chính hãng đầy đủ, mong sử dụng sp trị đc mụn và da sáng mịn như review, sp rất tuyệt vời"
[Chính Hãng] Nước Hoa Hồng Some By Mi AHA-BHA-PHA 30 Days Miracle Toner 150ml,['150ML NGUYÊN HỘP'],[18500000000],5,đóng gói chắc chắn và cẩn thận chưa sử dụng nên chưa biết có gì review lại sau
[Chính Hãng] Nước Hoa Hồng Some By Mi AHA-BHA-PHA 30 Days Miracle Toner 150ml,['150ML NGUYÊN HỘP'],[19500000000],5,"Giao hàng nhanh chóng, chưa check được mã vạch, hi vọng ổn và cứu vớt đc màn da của mình huhuhhhhhhuuuu"
[Chính Hãng] Nước Hoa Hồng Some By Mi AHA-BHA-PHA 30 Days Miracle Toner 150ml,['150ML NGUYÊN HỘP'],[15900000000],5,"Sp đóng gói cẩn thận, có team rõ ràng check ra hàng auth hy vọng hợp vs da"
[Chính Hãng] Nước Hoa Hồng Some By Mi AHA-BHA-PHA 30 Days Miracle Toner 150ml,['150ML NGUYÊN HỘP'],[16900000000],5,Mình mua shop này lần 2 rồi. Giao hàng nhanh. Toner này SD ok. Giá ok. Nên mua nha
[Chính Hãng] Nước Hoa Hồng Some By Mi AHA-BHA-PHA 30 Days Miracle Toner 150ml,['150ML NGUYÊN HỘP'],[17900000000],5,"Đẩy mụn, check tem chính hãng. Cảm ơn shop
ucndncnjcncndnenjsicncndnennenendncjvbnfnenendnfhncnfndnfbfbbfnfnfbfbcbchfnfbrnnrnfjfnf"
[Chính Hãng] Nước Hoa Hồng Some By Mi AHA-BHA-PHA 30 Days Miracle Toner 150ml,['150ML NGUYÊN HỘP'],[18500000000],5,"rất thích mùi tràm trà của somebymi,
dùng rất oke
phù hợp với da của tui
giảm mụn khá đáng kể
rao hàng nhanh👍"
[Chính Hãng] Nước Hoa Hồng Some By Mi AHA-BHA-PHA 30 Days Miracle Toner 150ml,['150ML KHÔNG HỘP'],[17500000000],5,"Sản phẩm đẹp, dùng tốt lắm, rất đáng tiền mua, không bị hư hỏng gì, đóng gói chắc chắn, lần sau lại tiếp tục ủng hộ ạ"
[Chính Hãng] Nước Hoa Hồng Some By Mi AHA-BHA-PHA 30 Days Miracle Toner 150ml,['150ML KO HỘP + 6ML'],[17900000000],5,"Hàng ok giao khá nhanh, vẫn còn seal bạccccccccccccccccccc"
[Chính Hãng] Nước Hoa Hồng Some By Mi AHA-BHA-PHA 30 Days Miracle Toner 150ml,['150ML KHÔNG HỘP'],[16900000000],5,"Giao nhanh, đóng gói cẩn thận. Chưa dùng nên chưa đánh giá chất lượng được
"
[Chính Hãng] Nước Hoa Hồng Some By Mi AHA-BHA-PHA 30 Days Miracle Toner 150ml,['150ML NGUYÊN HỘP'],[18500000000],5,Mùi kiểu bạc hà dùng lên mặt khá dễ chịu giao hàng siêu nhanh đóng gói sp chắc chắn
[Chính Hãng] Nước Hoa Hồng Some By Mi AHA-BHA-PHA 30 Days Miracle Toner 150ml,['150ML NGUYÊN HỘP'],[18900000000],5,"Check ra đc sản phẩm mong dùng sẽ đỡ mụn đi
Kdlflgmglln f gkgiene r"
