name,variations,price,rating_star,comment
(Mini Size) Nước hoa hồng Mamonde Flower Toner Trial Kit(5 items),['Chamomile Pure Toner'],[1500000000],5,Chai dưỡng mắt thơm lắm ạ nhưng chưa sử dụng nên không biết . Còn chai toner cũng tốt lắm nhaaaaaa 🥰
(Mini Size) Nước hoa hồng Mamonde Flower Toner Trial Kit(5 items),['Chamomile Pure Toner'],[1500000000],5,Chưa dùng thử nên chưa biết sao. Toner minisize có mùi khá thơm. Mình tính mua về cố cầm cự qua tết thì thấy bé quá nên thôi đi mua loại to vậy =)))))
(Mini Size) Nước hoa hồng Mamonde Flower Toner Trial Kit(5 items),"['Chamomile Pure Toner', 'Pore Clean Toner']","[1500000000, 2500000000]",5,"Shop giao hàng đủ, rất nhanh, chưa xài nên chưa biết chất lượng ra sao, sẽ quay lại review sau cho mn"
(Mini Size) Nước hoa hồng Mamonde Flower Toner Trial Kit(5 items),['Pore Clean Toner'],[2500000000],5,"Sản phẩm phù hợp với giá tiền 
Thời gian giao hàng nhanh 
Sẽ quay lại ủng hộ tiếp "
(Mini Size) Nước hoa hồng Mamonde Flower Toner Trial Kit(5 items),['Pore Clean Toner'],[2400000000],5,Sản phẩm rất okkkkkkkkkkkkkkkkkkkkkkkkkkkkkkkkkkkkkkk
(Mini Size) Nước hoa hồng Mamonde Flower Toner Trial Kit(5 items),['Pore Clean Toner'],[2500000000],5,Chai nhỏ nhỏ xinh xinh. Xài thử nếu hợp thì mua chai to luôn. Shop chuẩn bị hàng rất nhanh . Đóng gói rất đẹp. 
(Mini Size) Nước hoa hồng Mamonde Flower Toner Trial Kit(5 items),"['Chamomile Pure Toner', 'Pore Clean Toner']","[1400000000, 2400000000]",5,"Chai mini nhìn dễ thương
Chai diếp cá có mùi thơm hơn hoa cúc
Nói chung rất thích ❤️"
(Mini Size) Nước hoa hồng Mamonde Flower Toner Trial Kit(5 items),['Pore Clean Toner'],[2500000000],5,Thời gian giao hàng siêu nhanhh. Sản phẩm tốt. Nhưng mình mong bên shop đầu tư về phần đóng gói hơn. Chai toner mình mua mini size nhưng vẫn bị đổ ra nắp 1 tí. đối với những dạng lỏng shop nên gói chu đáo hơn 1 chút thì hoàn hảo nè ^^ 
(Mini Size) Nước hoa hồng Mamonde Flower Toner Trial Kit(5 items),['Pore Clean Toner'],[2500000000],5,"Chai be bé dễ thương,mình mua sài thử nếu hợp da mình sẽ mua full size❤️❤️❤️"
(Mini Size) Nước hoa hồng Mamonde Flower Toner Trial Kit(5 items),['Nguyên set'],[7500000000],5,"🍂Bộ quần áo Lông Cừu siêu mềm mịn cho Bé 
#155k 
Chất bằng lông mềm - nhẹ, mặc nhẹ tênh thoải mái, cực tiện cho các bé mặc ở nhà hay đi chơi đều đẹp,đảm bảo các bé sẽ rất thích thú, 
các bé yêu của bạn trông sẽ rất ngộ nghĩnh giống như những chú gấu bông. 

* Màu sắc: Có màu: hồng, nâu,xanh,ghi cam"
(Mini Size) Nước hoa hồng Mamonde Flower Toner Trial Kit(5 items),['Nguyên set'],[7500000000],5,"Woa giao hàng nhanh như gió, kđr rẻ so voi thị trường, chưa dùng nên chưa biết chất lượng sao, tonnner nhỏ nhỏ xinh xịnh, ai muốn dùng thử thì nên mua loaii mini này trước"
(Mini Size) Nước hoa hồng Mamonde Flower Toner Trial Kit(5 items),['Chamomile Pure Toner'],[1500000000],5,"Giao hành nhanh cực, đóng gói cẩn thận, giao đúng và đủ loại hàng.
"
(Mini Size) Nước hoa hồng Mamonde Flower Toner Trial Kit(5 items),['Pore Clean Toner'],[2500000000],5,"Được tặng thêm 1 lọ ạ ❤️❤️❤️❤️ yêu shop quá điii, giao hàng khá nhanh"
(Mini Size) Nước hoa hồng Mamonde Flower Toner Trial Kit(5 items),['Nguyên set'],[7500000000],5,Hàng đẹp. Giống y như hình. Giao hàng nhanh. Cho shop 5* lần sau sẽ ủng hộ tiếp.
(Mini Size) Nước hoa hồng Mamonde Flower Toner Trial Kit(5 items),['Pore Clean Toner'],[2500000000],5,"Shop bán hàng mini nhỏ xinh giá tốt dễ dùng, mua mấy lần rùi lần nào cũng ưng hết"
(Mini Size) Nước hoa hồng Mamonde Flower Toner Trial Kit(5 items),['Pore Clean Toner'],[2500000000],5,"Size mini dùng thử, hàng chuẩn nha mn, rất đánh tiền , giao hành nhanh cực "
(Mini Size) Nước hoa hồng Mamonde Flower Toner Trial Kit(5 items),['Pore Clean Toner'],[2500000000],5,"Chất lượng sản phẩm tuyệt vời, thời gian giao hàng nhanh, đóng gói cẩn thận"
(Mini Size) Nước hoa hồng Mamonde Flower Toner Trial Kit(5 items),['Pore Clean Toner'],[2500000000],5,Hânhgdhshkkmqnbxbxbbsvavsjshwhowllxnxnbsbnavabsvsbs
(Mini Size) Nước hoa hồng Mamonde Flower Toner Trial Kit(5 items),['Pore Clean Toner'],[2500000000],5,Hwhwhwbsbbsnaanbsbsnaalaknsnsnsnsanansn sbsbsbsbsbdbdjdjd
(Mini Size) Nước hoa hồng Mamonde Flower Toner Trial Kit(5 items),['Chamomile Pure Toner'],[1500000000],5,"Bọc kĩ, giao hàng nhanh, anh shipper dễ thương dùng như nào thì chưa bíttt"
(Mini Size) Nước hoa hồng Mamonde Flower Toner Trial Kit(5 items),['Nguyên set'],[7500000000],5,"Shipper giao hàng nhiệt tình, hàng đóng gói cẩn thận, mua size nhỏ để dùng thử nên chưa biết chất lượng. "
(Mini Size) Nước hoa hồng Mamonde Flower Toner Trial Kit(5 items),['Nguyên set'],[7500000000],5,"Shop giao đầy đủ, rep tin nhắn nhiệt tình giá rẻ hơn chỗ khác. Công dụng mình sẽ cập nhật sau nhé."
(Mini Size) Nước hoa hồng Mamonde Flower Toner Trial Kit(5 items),['Nguyên set'],[7500000000],5,Hạhosjshxbzbznxnxnxjzksjzjznzbxbxbxbxbxbxbxbxnxnxnxnx
(Mini Size) Nước hoa hồng Mamonde Flower Toner Trial Kit(5 items),['Pore Clean Toner'],[2500000000],5,"Mới sài nên chưa biết như thế nào, sản phẩm đẹp, đóng gói cẩn thận đầy đủ......................................."
(Mini Size) Nước hoa hồng Mamonde Flower Toner Trial Kit(5 items),['Chamomile Pure Toner'],[1500000000],5,"Shop tư vấn nhiệt tình, đóng hàng ok. Đặt vào dịp Tết nên chuẩn bị hàng khá lâu........"
(Mini Size) Nước hoa hồng Mamonde Flower Toner Trial Kit(5 items),['Nguyên set'],[7500000000],5,"sản phẩm đóng gói đẹp, hàng nhìn tốt lém ạ
giao hàng đủ, phục vụ của shop cũng tốt"
(Mini Size) Nước hoa hồng Mamonde Flower Toner Trial Kit(5 items),['Pore Clean Toner'],[2500000000],5,Hiyuuiuuii9iohijgihhjiihyjoiuiooookjo0u9u8uy8iyii9i
(Mini Size) Nước hoa hồng Mamonde Flower Toner Trial Kit(5 items),['Pore Clean Toner'],[2500000000],5,Sp okkkk bé xíu chưa sử dụng nên chưa biêt như thế nào 🙊🙊🙊
(Mini Size) Nước hoa hồng Mamonde Flower Toner Trial Kit(5 items),['Pore Clean Toner'],[2500000000],5,"Giao hàng nhanh , mình mới dùng nên dùng buổi tối thì sáng k nghe dc cấp ẩm gì ,,,chắc dùng lâu mới có hiệu quả"
(Mini Size) Nước hoa hồng Mamonde Flower Toner Trial Kit(5 items),['Chamomile Pure Toner'],[1500000000],5,"Hdhjdjdygguigyffugudfugivifydtdygigufuffigfufufydydgugifufugigig
"
(Mini Size) Nước hoa hồng Mamonde Flower Toner Trial Kit(5 items),['Pore Clean Toner'],[2500000000],5,Vừa nhận đc hàng. Mua sz mini để thử vì kb hợp hay không. Shop đóng gói kĩ
(Mini Size) Nước hoa hồng Mamonde Flower Toner Trial Kit(5 items),['Pore Clean Toner'],[2500000000],5,"Toner nhỏ xinh , chưa dùng nên chưa biết có tốt khônggggggggg"
(Mini Size) Nước hoa hồng Mamonde Flower Toner Trial Kit(5 items),['Pore Clean Toner'],[2500000000],5,"Mình đã sài được nửa chai, có lớp bùn khoáng bên dưới, không kích ứng "
(Mini Size) Nước hoa hồng Mamonde Flower Toner Trial Kit(5 items),['Pore Clean Toner'],[2500000000],5,Nhỏ gọn xinh xắn. Mùi thơm nha. Sài ổn. Mua loại nhỏ sài thử ổn sẽ mua loạn lớn
(Mini Size) Nước hoa hồng Mamonde Flower Toner Trial Kit(5 items),['Nguyên set'],[7500000000],5,"Đóng gói hàng cẩn thận, giao hàng nhanh. mình đã mua sản phẩm này của shop rồi nên rất ưng. Sẽ ủng hộ tiếp "
(Mini Size) Nước hoa hồng Mamonde Flower Toner Trial Kit(5 items),['Pore Clean Toner'],[2500000000],5,"Sản phẩm OK 
Đóng gói sản phẩm đẹp 
☺️☺️☺️☺️☺️☺️☺️☺️☺️☺️☺️☺️☺️☺️"
(Mini Size) Nước hoa hồng Mamonde Flower Toner Trial Kit(5 items),['Pore Clean Toner'],[2500000000],5,"Hơi nhỏ so với tưởng tượng của mình 
Chưa dùng nên chưa biết ntn "
(Mini Size) Nước hoa hồng Mamonde Flower Toner Trial Kit(5 items),['Nguyên set'],[7500000000],5,"Toner xài rất tốt, mùi thơm nhẹ. Giúp vệ sinh da mặt tốt. Dùng xong thấy da mềm hơn."
(Mini Size) Nước hoa hồng Mamonde Flower Toner Trial Kit(5 items),['Pore Clean Toner'],[2500000000],5,"Cấp ẩm tốt, mỗi lần đắp toner là gỡ ra da mướt lắm luon, mà k bị nhờn, mình e này test thử thôu"
(Mini Size) Nước hoa hồng Mamonde Flower Toner Trial Kit(5 items),['Flower Honey Toner'],[1500000000],5,Mua hàng shop đóng gói cẩn thận giao hàng nhanh cấp ẩm tốt mọi thứ tuyệt vời!!!
(Mini Size) Nước hoa hồng Mamonde Flower Toner Trial Kit(5 items),['Nguyên set'],[7500000000],5,"Shop phục vụ đúng tốt luôn , giao hàng cực nhanh đặt hôm qua hôm nay đã giao luôn "
(Mini Size) Nước hoa hồng Mamonde Flower Toner Trial Kit(5 items),['Nguyên set'],[7500000000],5,"Giao hàng khá nhanh
Hàng đọc bọc cẩn thận
Sẽ tiếp rục ủng hộ shop"
(Mini Size) Nước hoa hồng Mamonde Flower Toner Trial Kit(5 items),"['Flower Honey Toner', 'Pore Clean Toner']","[1500000000, 2500000000]",5,"Mình nhận được hàng rồi nhé, nma k tiện chụp nên lấy tạm hình.."
(Mini Size) Nước hoa hồng Mamonde Flower Toner Trial Kit(5 items),['Chamomile Pure Toner'],[1500000000],5,Bxpsj ubksjxj idbijcb ưibxj iwibdn iowbddn jaibdkk sovsbskn 
(Mini Size) Nước hoa hồng Mamonde Flower Toner Trial Kit(5 items),['Chamomile Pure Toner'],[1500000000],5,"Chưa dùng thử nữa, toner k có mùi gì í nên hơi hoảng phải tra gg thì ra là do nó k có mùi thật kkk"
(Mini Size) Nước hoa hồng Mamonde Flower Toner Trial Kit(5 items),['Chamomile Pure Toner'],[1500000000],5,"Giao hàng nhanh, đủ, đã mua ở shop vài lần và em thấy ổn áp lắm ạm "
(Mini Size) Nước hoa hồng Mamonde Flower Toner Trial Kit(5 items),['Pore Clean Toner'],[2500000000],5,"Lần thứ 2 mua ở shop 
Giao hàng nhanh 
Sản phẩm chất lượng ☺️☺️☺️☺️☺️"
(Mini Size) Nước hoa hồng Mamonde Flower Toner Trial Kit(5 items),['Nguyên set'],[6900000000],5,"Dùng thử 3 ngày xong mới review cho sản phẩm: sử dụng tốt, cảm thấy da mình khá hơn so với loại cũ mình dùng, ko gây kích ứng và mụn ẩn, da cũng đỡ khô hay ra dầu (da mình hỗn hợp và bị mụn), date xa. Shop giao hàng nhanh, đóng gói kỹ càng, chu đáo dù mình chỉ đặt 1 sản phẩm. Cảm ơn shop !"
(Mini Size) Nước hoa hồng Mamonde Flower Toner Trial Kit(5 items),['Flower Honey Toner'],[1500000000],5,"Đã nhận được hàng ,. đóng gói rất cẩn thận, cảm ơn shop nhé !!!🤍"
(Mini Size) Nước hoa hồng Mamonde Flower Toner Trial Kit(5 items),['Chamomile Pure Toner'],[1500000000],5,"Giao nhanh, mask k thấy kích ứng. Hồi đó dùng lavender à, k biết cái này hàng thế nào. Nước hoa hồng k mùi, dùng chơi chơi chứ bth"
(Mini Size) Nước hoa hồng Mamonde Flower Toner Trial Kit(5 items),['Pore Clean Toner'],[2500000000],5,Sp tốt nhưng giao hàng hơi lâu. Sẽ ủng hộ shop nhiều lần nữa.......
(Mini Size) Nước hoa hồng Mamonde Flower Toner Trial Kit(5 items),['Nguyên set'],[7500000000],5,"Giao hàng nhanh, đóng gói tốt nhưng mà hơi bị đổ ra 1 ít ạ, sẽ ủng hộ ạ "
(Mini Size) Nước hoa hồng Mamonde Flower Toner Trial Kit(5 items),['Nguyên set'],[7500000000],5,"Chất lượng sp tuyệt vời, thời gian giap hàng nhanh, đóng gói sp đẹp và chắc chắn."
(Mini Size) Nước hoa hồng Mamonde Flower Toner Trial Kit(5 items),['Pore Clean Toner'],[2500000000],5,"Đã nhận được hàng, chưa dùng nên chưa biết sao, hình ảnh ko liên quan"
(Mini Size) Nước hoa hồng Mamonde Flower Toner Trial Kit(5 items),['Chamomile Pure Toner'],[1500000000],5,"Chất lượng sản phẩm tốt, thời gian giao hàng nhanh
Mùi thơm, dễ chịu"
(Mini Size) Nước hoa hồng Mamonde Flower Toner Trial Kit(5 items),['Flower Honey Toner'],[1500000000],5,Okkkkkkkkkkkkkkkkkkkkkkkkkkkkkkkkkkkkkkkkkkkkkkkkkkk
(Mini Size) Nước hoa hồng Mamonde Flower Toner Trial Kit(5 items),['Chamomile Pure Toner'],[1500000000],5,"Vì để check xem da có phù hợp ko nên mình mua chai mini dùng. Thì thấy dùng hết chai thứ 1 ok nên đã mua thêm chai thứ 2. Da mình da khô , sài ko thấy bị kích ứng gì . "
(Mini Size) Nước hoa hồng Mamonde Flower Toner Trial Kit(5 items),"['Aqua Peel Toner', 'Pore Clean Toner']","[1500000000, 2500000000]",5,"Hàng giao cực nhanh luôn í. Chỉ mới đặt tối hôm trước mà hôm nay đã giao rồi.
Shop gói hàng cũng kĩ vô cùng. Chỉ có 2 chai nhỏ xíu mà shop gói cho nguyên 1 cáu túi chà bá luôn. 
Nếu sử dụng hợp thì mình sẽ mua ủng hộ shop dài dài"
(Mini Size) Nước hoa hồng Mamonde Flower Toner Trial Kit(5 items),['Pore Clean Toner'],[2500000000],5,"Giao hàng nhanh, đóng gói đẹp, chắn chắn, shop giao đủ hàng, nhiệt tình, dễ thương. Sản phẩm tốt, chính hãng. Shop uy tín (｡･ω･｡)ﾉ♡"
(Mini Size) Nước hoa hồng Mamonde Flower Toner Trial Kit(5 items),['Nguyên set'],[7500000000],5,"Riêng sp này khuyên các bạn nên tùy vào làn da của mk.mà mua sp mini cho phù hợp. Sp có dạng chất khac nhau, độ pH khác nhau tùy thuộc với từng loại da. Mk cũn khuyên cac bạn có làn da quá nhạy cảm ko nên mua sp. Trong sp có hương liệu đồng thời 1 sp có chứa aha cũng có cồn khá nhiều. Mong mn lưu ý"
(Mini Size) Nước hoa hồng Mamonde Flower Toner Trial Kit(5 items),['Aqua Peel Toner'],[1500000000],5,"Trước có mua toner loại chamomile pure mà xài không hợp (da mình hh thiên dầu), nay đổi qua loại này xài thử xem sao, đóng gói cẩn thận, ship hàng nhanh"
(Mini Size) Nước hoa hồng Mamonde Flower Toner Trial Kit(5 items),['Nguyên set'],[7500000000],4,".....................,,,,,.........,..,.,,:/,.../:,"
(Mini Size) Nước hoa hồng Mamonde Flower Toner Trial Kit(5 items),['Nguyên set'],[6900000000],5,"Hiện mình mới dùng chai hoa cúc dành cho da nhạy cảm, gần như không mùi nên thấy ổn nè, còn cái hoa hồng hơi nồng, mình k thích lắm nên cho đứa em rồi. Mua hồi 11/11 nên hoàn đc 6k xu =)))))"
(Mini Size) Nước hoa hồng Mamonde Flower Toner Trial Kit(5 items),"['Aqua Peel Toner', 'Pore Clean Toner']","[1500000000, 2500000000]",5,"Dùng vào rất thơm nhưng chưa dùng đc lâu nên k bít hiệu quả ra sau, nhưng toner làm sạch da thì cx rất là tốt vs tầm giá r👍👍👍"
(Mini Size) Nước hoa hồng Mamonde Flower Toner Trial Kit(5 items),['Pore Clean Toner'],[2500000000],5,sản phẩm tốtttttttttttttttttttt giao hàng siêuuuuuuuuuuuuu nhanhhhhhhhhhhh
(Mini Size) Nước hoa hồng Mamonde Flower Toner Trial Kit(5 items),['Nguyên set'],[7500000000],5,"chất lượng sản phẩm được, shop nhiệt tình, chai màu hồng hơi có nước ở ngoài chắc do quá trình vận chuyển"
(Mini Size) Nước hoa hồng Mamonde Flower Toner Trial Kit(5 items),['Aqua Peel Toner'],[1500000000],5,"Shop phục vụ nhiệt tình, giao hàng nhanh, đóng gói sản phẩm chắc chắn"
(Mini Size) Nước hoa hồng Mamonde Flower Toner Trial Kit(5 items),"['Nguyên set', 'Chamomile Pure Toner', 'Aqua Peel Toner']","[7500000000, 1500000000, 1500000000]",5,"Giao hàng rất nhanh, đóng gói hàng kĩ càng, chưa xài nên chưa biết chất lượng ntn "
(Mini Size) Nước hoa hồng Mamonde Flower Toner Trial Kit(5 items),['Flower Honey Toner'],[1500000000],5,"Mình mua 2 chổ mà làm biếng chụp riêng từng món nên shop thông cảm dùm mình nheee , giao hàng nhanh ghê đóng gói chắc chắn lun nè . Iu shoppppp ❤️❤️❤️❤️❤️❤️"
(Mini Size) Nước hoa hồng Mamonde Flower Toner Trial Kit(5 items),['Flower Honey Toner'],[1500000000],5,12345678901234567890123456789012345678901234567890ososoeke
(Mini Size) Nước hoa hồng Mamonde Flower Toner Trial Kit(5 items),['Chamomile Pure Toner'],[1500000000],5,Okkkkkkkkkkkkkkkkkkkkkkkkkkkkkkkk.                                                                              Hxnxnzbznzjznxnznznx ảnh và vd k lq
(Mini Size) Nước hoa hồng Mamonde Flower Toner Trial Kit(5 items),['Pore Clean Toner'],[2500000000],5,"Siu siu xịn,giao nhanh, hơi hơi cute nữa nên mua nha mọi người 👌"
(Mini Size) Nước hoa hồng Mamonde Flower Toner Trial Kit(5 items),['Pore Clean Toner'],[2500000000],5,"Giao hàng nhanh, shop còn tặng thêm sample dùng thử. Hi vọng xài hợp sẽ ủng hộ shop tiếp"
(Mini Size) Nước hoa hồng Mamonde Flower Toner Trial Kit(5 items),['Aqua Peel Toner'],[1500000000],5,Đóng gói chắc chắn djdjbdbdbdjdbbdndndndbbdbdbdbdbdbdnndnfnfnfn
(Mini Size) Nước hoa hồng Mamonde Flower Toner Trial Kit(5 items),['Nguyên set'],[7500000000],5,Lần đầu xài toner này nên mua thử chai nhỏ. Mà thấy set này ở shop giá ok quá nên mua nguyên set lun. Gói chắc chắn. Giao nhanh 👍
(Mini Size) Nước hoa hồng Mamonde Flower Toner Trial Kit(5 items),['Pore Clean Toner'],[2500000000],5,Sản phẩm thơm và shop đóng gói thì siêu cẩn thận. Mình quên chụp ảnh r nên để đại
(Mini Size) Nước hoa hồng Mamonde Flower Toner Trial Kit(5 items),['Aqua Peel Toner'],[1500000000],5,Đóng gói sản phẩm rất kĩ 😊. Sản phẩm không bị bóp méo. Chưa sử dụng nên không biết hiệu quả thế nào 
(Mini Size) Nước hoa hồng Mamonde Flower Toner Trial Kit(5 items),['Pore Clean Toner'],[2500000000],5,Hôm qa đặt hôm sau là có liền mùi thơm ghê hi vọng xài lâu.......
(Mini Size) Nước hoa hồng Mamonde Flower Toner Trial Kit(5 items),['Nguyên set'],[7500000000],5,"Giao hàng nhanh,đóng gói gọn gàng,đẹp mắt.Chất lượng sp tuyệt vời:))
"
(Mini Size) Nước hoa hồng Mamonde Flower Toner Trial Kit(5 items),['Nguyên set'],[6900000000],5,OkkkkkkkkkkkkkkkkkkkkkkOkkkkkkkkkkkkkkkkkkkkkkOkkkkkkkkkkkkkkkkkkkkkk
(Mini Size) Nước hoa hồng Mamonde Flower Toner Trial Kit(5 items),['Nguyên set'],[7500000000],5,"Đầu tiên là nhận xét về hình thức: đóng gói sản phẩm siêuuuu kỹ càngggg.
Thứ hai: test thử toner thơm dịu, dùng thử thấy ổn sẽ ủng hộ típpppp.
Gel trị mụn nhỏ xinh dễ dùng.
Nói chung đều ổn, hi vọng chất lượng không tầm thườnggg. Cảm ơn shopppp ❤️ chúc shop bạn được nhiều hàng, gặp nhiều may mắn."
(Mini Size) Nước hoa hồng Mamonde Flower Toner Trial Kit(5 items),['Aqua Peel Toner'],[1500000000],5,Đa su dung rat nhieu các san pham nay nên không có gi để binh luân ca vi xài rat tốt 
(Mini Size) Nước hoa hồng Mamonde Flower Toner Trial Kit(5 items),['Aqua Peel Toner'],[1500000000],5,Xhhdjfbrbrbfbfbfbfbfnfhcbbcbdbsbsbsvsbdbdbdbdbbdbdbd
(Mini Size) Nước hoa hồng Mamonde Flower Toner Trial Kit(5 items),['Pore Clean Toner'],[2500000000],5,Chỉ mua mini để thử mà ưng cái bụng dễ sợ😻
(Mini Size) Nước hoa hồng Mamonde Flower Toner Trial Kit(5 items),['Pore Clean Toner'],[2500000000],5,niutfcfasjjjytuohffhjgdfgvrtijhgghnngfrtubseuigdrungjiihgthffyjhhghhhhiiiggrtfddghnnkncchnnhhhyyyerghhhdhkjjtyjgddnkyddhjgdchjhb
(Mini Size) Nước hoa hồng Mamonde Flower Toner Trial Kit(5 items),['Nguyên set'],[7500000000],5,"Mình định mua riêng loại flower honey thôi nhưng shop k có nên đành phải mua full bộ, thôi coi như trải nghiệm thử cũng được"
(Mini Size) Nước hoa hồng Mamonde Flower Toner Trial Kit(5 items),['Nguyên set'],[7500000000],5,Giao hàng nhanh. Đóng gói kĩ. Toner thơm lắm. Thích nhất là mùi toner diếp cá. Rất đáng tiền. Sẽ quay lại ủng hộ shop 
(Mini Size) Nước hoa hồng Mamonde Flower Toner Trial Kit(5 items),['Pore Clean Toner'],[2500000000],5,"Onrnnnnnnnnnnoa
Udisnainsidzhwijwnw82jwvwuwjdjsowohwbw"
(Mini Size) Nước hoa hồng Mamonde Flower Toner Trial Kit(5 items),['Pore Clean Toner'],[2500000000],5,Thật sự ưng cách làm việc và sản phẩm bên shop. Giao hàng cũng rất nhanh. 5 sao nhé ><
(Mini Size) Nước hoa hồng Mamonde Flower Toner Trial Kit(5 items),['Nguyên set'],[6900000000],5,"Shop đóng gói cẩn thẩn, mua set dùng thử, xem hợp loại nào sẽ mua hẳn chai to. Nhỏ nhỏ xinh xinh, còn đc chủ shop tặng kèm quà. Thời gian giao hàng nhanh"
(Mini Size) Nước hoa hồng Mamonde Flower Toner Trial Kit(5 items),['Chamomile Pure Toner'],[1500000000],5,".....................................................,......................................................................................................."
(Mini Size) Nước hoa hồng Mamonde Flower Toner Trial Kit(5 items),['Aqua Peel Toner'],[1500000000],5,"Thời gian giao hàng khá nhanh, đóng gói sản phẩm chắc chắn, chất lg ok"
(Mini Size) Nước hoa hồng Mamonde Flower Toner Trial Kit(5 items),['Nguyên set'],[7500000000],5,Đụiehdudhdhđjjdjwjdjcnfjdkwksjfnfnrkfjcjfjfjrjjjjj
(Mini Size) Nước hoa hồng Mamonde Flower Toner Trial Kit(5 items),['Nguyên set'],[7500000000],5,"Shop giao hàng nhanh mà JnT làm ăn chán quá. Toner full bộ với cả tẩy tế bào chết nhỏ xíu luôn, đi đâu mang cũng tiện. Lần đầu xài serum thấy thấm cũng khá nhanh hy vọng có hiệu quả."
(Mini Size) Nước hoa hồng Mamonde Flower Toner Trial Kit(5 items),['Nguyên set'],[7500000000],5,"Mình có nhờ shop gói hàng kĩ, shop làm việc mình rất hài lòng, có quấn thêm lớp chống sốc. Nhận hàng không có gì phải chê. Sản phẩm check code ra hết nha "
(Mini Size) Nước hoa hồng Mamonde Flower Toner Trial Kit(5 items),['Aqua Peel Toner'],[1500000000],5,"Chuẩn bị hàng rất nhanh và giao hàng nhanh lắm. Mình nhận được đủ đồ, hi vọng sài hiệu quả thì sẽ mua chai mới"
(Mini Size) Nước hoa hồng Mamonde Flower Toner Trial Kit(5 items),['Pore Clean Toner'],[2500000000],5,"Kiềm dầu ổn, dùng k bị cảm giác dính mặt mà thấm rất nhanh nên cảm giác hơi khô 😂😂"
(Mini Size) Nước hoa hồng Mamonde Flower Toner Trial Kit(5 items),['Chamomile Pure Toner'],[1500000000],5,"Đặt mua 3 bình toner chị chủ đóng gói hàng rất kĩ hihi , rep tin nhắn cũng rất nhanh mỗi tội giao hàng hơi lâu 1 chút thôiiii , nói chung là okee tuyệt zời , mình mua toner hoa cúc chai bé tí à nhỏ nhắn thích hợp cho bạn nào dùng thử dùng cảm thấy da mịn lắm nhưng hơi bị đổ dầu nên mn cân nhắc ❤️"
(Mini Size) Nước hoa hồng Mamonde Flower Toner Trial Kit(5 items),['Rose Water Tone'],[2000000000],5,Chia sẻ để bạn bè phụ tưới cây nhé! https://games.shopee.vn/universal-link/farm/share.html?skey=70a9f654c7e5dfe9f4c5cfcf0b2dd327&schannel=copyInfo
(Mini Size) Nước hoa hồng Mamonde Flower Toner Trial Kit(5 items),"['Chamomile Pure Toner', 'Aqua Peel Toner']","[1500000000, 1500000000]",5,"Đã mua lần thứ 2, hàng dùng rất tốt nhé đính như mô tả ( ảnh và clip k liên quan) ( ảnh và clip k liên quan) "
(Mini Size) Nước hoa hồng Mamonde Flower Toner Trial Kit(5 items),['Pore Clean Toner'],[2500000000],5,Đã nhận được hàng.giao rất nhanh.1 ngày là nhận được.mới mua shop lần đầu chưa sd nên k biết sao.sẽ quay lại cho rw sao ạ.
(Mini Size) Nước hoa hồng Mamonde Flower Toner Trial Kit(5 items),"['Chamomile Pure Toner', 'Aqua Peel Toner']","[1500000000, 1500000000]",5,hàng chuẩn mua thử lần đầu ạaaaaaaaaaaaaaaaaaaaaaaaaaaaa
(Mini Size) Nước hoa hồng Mamonde Flower Toner Trial Kit(5 items),['Nguyên set'],[7100000000],5,"Giao hàng nhanh, chưa dùng nên kbit chất lượng thế nào🙂🙂🙂🙂🙂🙂🙂🙂"
(Mini Size) Nước hoa hồng Mamonde Flower Toner Trial Kit(5 items),['Aqua Peel Toner'],[1500000000],5,"Giao hàng nhanh, đặt hôm trước hôm sau đã có hàng, quên chụp ảnh lại nên lấy hình của shop. 5 sao"
(Mini Size) Nước hoa hồng Mamonde Flower Toner Trial Kit(5 items),['Nguyên set'],[7500000000],5,"Set này thích nhất toner diếp cá, mùi thơm mà sau khi dùng da ẩm lên nhiều với lặn bớt mụn ẩn đi luôn"
(Mini Size) Nước hoa hồng Mamonde Flower Toner Trial Kit(5 items),['Pore Clean Toner'],[2500000000],5,Giao hàng nhanh sp như hình. Hy vọng xài tốt...............
(Mini Size) Nước hoa hồng Mamonde Flower Toner Trial Kit(5 items),['Pore Clean Toner'],[2500000000],5,"Shop giao đúng hàng toner nhỏ nhỏ xinh xinh, thơm mặt nạ xài ok"
(Mini Size) Nước hoa hồng Mamonde Flower Toner Trial Kit(5 items),['Nguyên set'],[7500000000],5,"Lần thứ hai mua ở shop. Nói chung thì ổn. Mà bữa giảm giá hok mua h nguyên giá nên hơi tiếc. Mà thôi, hi vọng sài có hiệu quả tốt"
