name,variations,price,rating_star,comment
(Mini Size) Nước hoa hồng Mamonde Flower Toner Trial Kit(5 items),"['Aqua Peel Toner', 'Pore Clean Toner']","[1500000000, 2500000000]",5,Hctusryfj atipgv xeylhv dylbn v xibb bcteoj útgojb d6ylbb du
(Mini Size) Nước hoa hồng Mamonde Flower Toner Trial Kit(5 items),['Nguyên set'],[7500000000],5,Sản phẩm được đóng gói chắc chắn và cẩn thận. Mùi hương của sản phẩm cũng thơm dịu và dễ chịu ❤
(Mini Size) Nước hoa hồng Mamonde Flower Toner Trial Kit(5 items),['Rose Water Tone'],[2000000000],5,Khá ổn jjjjnnnnnnnjjjjjjmmmmmmmmmmmmmmmmmmmmmmmmmmmmmmmmmmkkkkkkkkkkkkkkkk
(Mini Size) Nước hoa hồng Mamonde Flower Toner Trial Kit(5 items),['Nguyên set'],[7500000000],5,Sản phẩm như hình. Bỏ tủ lạnh sài phê luôn. Mình mua cả set nhưng quên k chụp :)))
(Mini Size) Nước hoa hồng Mamonde Flower Toner Trial Kit(5 items),['Rose Water Tone'],[2000000000],5,"Giao hàng nhanh
Sản phẩm y như hình
Đóng gói chắc chắn
Rất đáng tiền"
(Mini Size) Nước hoa hồng Mamonde Flower Toner Trial Kit(5 items),['Rose Water Tone'],[2000000000],5,Nước hoa tuy ko quá lớn nhưng cũng tiện gọn chưa sử dụng nên chưa bk mùi ra sao
(Mini Size) Nước hoa hồng Mamonde Flower Toner Trial Kit(5 items),['Pore Clean Toner'],[2500000000],5,"Hàng chuẩn nên mua nha mn 






















😚😚😚😚😚





😢😢😢😢😢😢😢😚😚😚😚😚😚😚😚😚😚😚😚"
(Mini Size) Nước hoa hồng Mamonde Flower Toner Trial Kit(5 items),['Flower Honey Toner'],[1500000000],5,"đã sử dụng sản phẩm 1 thời gian chất lượng rất tốt, hộp nhỏ xinh"
(Mini Size) Nước hoa hồng Mamonde Flower Toner Trial Kit(5 items),['Nguyên set'],[6900000000],5,Gói hàng cẩn thận ship hàng nhanh tất cả hàng giống mô tả. Tốt. 
(Mini Size) Nước hoa hồng Mamonde Flower Toner Trial Kit(5 items),['Pore Clean Toner'],[2500000000],5,"Mua nhiều lần rồi nên cũng k có gì để nói nữa
Sản phẩm tốt
Đóng gói cẩn thận
Giao hàng nhanh "
(Mini Size) Nước hoa hồng Mamonde Flower Toner Trial Kit(5 items),['Nguyên set'],[7500000000],5,"Shop đóng gói sản phẩm chắc chắn, hàng hoá đầy đủ :3
Mình mua nguyên set vì bộ sưu tập toner này dùng rất ok, phù hợp với mọi loại da, mua cái này là deal sốc đi kèm nên giá rẻ hơn mua lẻ :3
Giao hàng nhanh hơn dự kiến tận 1 ngày :3
Nói chung là rất đáng tiền và sẽ ủng hộ shop lần nữa :3"
