name,variations,price,rating_star,comment
[GIÁ HỦY DIỆT] Nước hoa hồng Dear Klairs Supple Preparation toner 180ml,['Không mùi'],[23900000000],5,mua quá nhiều lần chất lượng khỏi bàn gioa hàng nhanh hình ảnh mang tính chất nhận xu
[GIÁ HỦY DIỆT] Nước hoa hồng Dear Klairs Supple Preparation toner 180ml,['Không mùi'],[22900000000],5,"Quay vid trog tình trạng 12h đêm nên bị mờ ảo ,mà đây là lần 2 mua hàg của shop á khá là ok nuôn 
Đồ thì khỏi bàn rùi , mong là toner dùng hiệu quả
Sẽ ủng hộ shop dài dài"
[GIÁ HỦY DIỆT] Nước hoa hồng Dear Klairs Supple Preparation toner 180ml,['Không mùi'],[23900000000],5,Sản phẩm tuyệt vời hàng chính hãng. Nha ship rất nhanh mua ik mn 
[GIÁ HỦY DIỆT] Nước hoa hồng Dear Klairs Supple Preparation toner 180ml,['Không mùi'],[23400000000],5,"Đã mua nhiều lần ở shoppppppp, giá cả okkkkkkkkkkkkk, chuẩn bị hàng hơi lâu xíuu thôiiii ❤️❤️❤️❤️❤️❤️❤️❤️"
[GIÁ HỦY DIỆT] Nước hoa hồng Dear Klairs Supple Preparation toner 180ml,['Có mùi'],[23400000000],5,"Giao hàng nhanh,đóng gói hàng cẩn thận
Bcnfnndjdjdxidbdex"
[GIÁ HỦY DIỆT] Nước hoa hồng Dear Klairs Supple Preparation toner 180ml,['Có mùi'],[23900000000],5,"Nếu bạn k cố gắng thì bạn sẽ trở thành kẻ thất bại
Nếu bạn k chịu khó thì bạn sẽ k có gì trong tay
 
hôm nay xuất 9 đơn lẻ ✅✅
🍓🍓🍓 kiếm tiền mùa covid nhớ về team ánh nhé"
[GIÁ HỦY DIỆT] Nước hoa hồng Dear Klairs Supple Preparation toner 180ml,['Có mùi'],[20300000000],5,"Giao hàng nhanh, sản phẩm tốt .........................."
[GIÁ HỦY DIỆT] Nước hoa hồng Dear Klairs Supple Preparation toner 180ml,['Không mùi'],[23400000000],5,"Đang trong quá trình dùng thử sp............,,.......:.."
[GIÁ HỦY DIỆT] Nước hoa hồng Dear Klairs Supple Preparation toner 180ml,['Không mùi'],[23400000000],5,"Hàng chuẩn auth, đóng gói cẩn thận, mua dịp 6.6 nên giao hàng hơi lâu xíu "
[GIÁ HỦY DIỆT] Nước hoa hồng Dear Klairs Supple Preparation toner 180ml,['Không mùi'],[23900000000],5,Mới dùng được mấy bữa nhưng mà nhìn chung ban đầu là hợp da nên chà vài lần lên mặt xong thấy khá là mềm mềm mọng mọng không bị nổi mụn hay gì. Quyết tâm kiên trì 💪💪
[GIÁ HỦY DIỆT] Nước hoa hồng Dear Klairs Supple Preparation toner 180ml,['Có mùi'],[23900000000],5,Xài được ppppppp} pppppppppppppppp pppppppppppppppp ppp
[GIÁ HỦY DIỆT] Nước hoa hồng Dear Klairs Supple Preparation toner 180ml,['Có mùi'],[19750000000],5,Giao hàng nhanh. Chất lượng sản phẩm tốt. Hạn sử dụng còn rất xa
[GIÁ HỦY DIỆT] Nước hoa hồng Dear Klairs Supple Preparation toner 180ml,['Không mùi'],[23900000000],5,"Giao hàng rất nhanh, đóng gói ok, hàng auth nhé mng, dùng rất thích hợp mặt mình. nên mua"
[GIÁ HỦY DIỆT] Nước hoa hồng Dear Klairs Supple Preparation toner 180ml,['Không mùi'],[23900000000],5,"Sản phẩm đóng gói tốt
Giao hàng nhanh chóng
Sản phẩm tốt
Sẽ tiếp tục ủng hộ
👌🏻👌🏻
"
[GIÁ HỦY DIỆT] Nước hoa hồng Dear Klairs Supple Preparation toner 180ml,['Không mùi'],[23900000000],5,Chưa dùng thử nên chưa biết chất lg như nào. Đóng gói đẹp. Chắc chắn 
[GIÁ HỦY DIỆT] Nước hoa hồng Dear Klairs Supple Preparation toner 180ml,['Không mùi'],[23900000000],5,Okkkkkkkkkkokkkkkkkkkkkkkkkkkkjj......................
[GIÁ HỦY DIỆT] Nước hoa hồng Dear Klairs Supple Preparation toner 180ml,['Không mùi'],[23900000000],5,Giao Hàng Nhanh chóng và tiện lợi hơn nhiều .gói cẩn thận. Mn nên mua
[GIÁ HỦY DIỆT] Nước hoa hồng Dear Klairs Supple Preparation toner 180ml,['Không mùi'],[22900000000],5,Sản phẩm chất lượng. Giao hàng nhanh chóng. Đóng gói cẩn thận. Ủng hộ lâu dài. 5 sao.
[GIÁ HỦY DIỆT] Nước hoa hồng Dear Klairs Supple Preparation toner 180ml,['Có mùi'],[19750000000],5,"Luôn tin tưởng mua hàng bên mẹ Yummi, giao hàng khá nhanh, chất lượng thì khỏi bàn ạ ^^"
[GIÁ HỦY DIỆT] Nước hoa hồng Dear Klairs Supple Preparation toner 180ml,['Không mùi'],[22900000000],5,.Mới mua lần đầu nên không biết chất lượng như thế nào thấy nhiều nguoeif review toots nếu ôke sẽ ủng hộ lại
[GIÁ HỦY DIỆT] Nước hoa hồng Dear Klairs Supple Preparation toner 180ml,['Không mùi'],[23900000000],5,"Xài chai thứ 2 rồi siêu thích k bị kích ứng nha mọi ng. Giao hàng siêu nhanh luôn, đóng gói cẩn thận."
[GIÁ HỦY DIỆT] Nước hoa hồng Dear Klairs Supple Preparation toner 180ml,['Có mùi'],[22200000000],5,"Son dùng mềm mịn lì,thơm cực kì,..,()7/!!,&@2@/!:!,)/8:8/8/"
[GIÁ HỦY DIỆT] Nước hoa hồng Dear Klairs Supple Preparation toner 180ml,['Có mùi'],[20300000000],5,Sản phẩm chất lượng tốt . Thời gian giao hàng nhanh . Đóng gói kĩ càng
[GIÁ HỦY DIỆT] Nước hoa hồng Dear Klairs Supple Preparation toner 180ml,['Không mùi'],[23700000000],5,Nghe review thấy khá tốt với hãng này cũng tin tưởng. Giao hàng nên sản phẩm lên bọt. Sử dụng tốt sẽ quay lại ủng hộ shop
[GIÁ HỦY DIỆT] Nước hoa hồng Dear Klairs Supple Preparation toner 180ml,['Không mùi'],[23900000000],5,"Ảnh mang tính nhận xu, sản phẩm oke, chất lượng ổn. Cho 5 sao.."
[GIÁ HỦY DIỆT] Nước hoa hồng Dear Klairs Supple Preparation toner 180ml,['Có mùi'],[20300000000],5,"Shop giao hàng rất nhanh
3 lần mua ở shop rồi dùng rất hiệu quả 
Mặt mình giờ ko còn tý mụn nào luôn"
[GIÁ HỦY DIỆT] Nước hoa hồng Dear Klairs Supple Preparation toner 180ml,['Không mùi'],[23900000000],5,Hinh ảnh và video chỉ mang tính chất lấy xu thôi ạ.. Mới mua lần đầu tiên nen k biết sao
[GIÁ HỦY DIỆT] Nước hoa hồng Dear Klairs Supple Preparation toner 180ml,['Không mùi'],[23900000000],5,Okkkkkkkkkkkkkkkkkkkkkkkkkkkkkkkkkkkkkkkkkkkkkkkkk
[GIÁ HỦY DIỆT] Nước hoa hồng Dear Klairs Supple Preparation toner 180ml,['Không mùi'],[23400000000],5,Okokokokokokokokokokokokokokokokokokokokokokokokok
[GIÁ HỦY DIỆT] Nước hoa hồng Dear Klairs Supple Preparation toner 180ml,['Có mùi'],[21200000000],5,Okkkkkkkkkkkkkkkkkkkkkkkkkkkkkkkkkkkkkkkkkkkkkkkkk
[GIÁ HỦY DIỆT] Nước hoa hồng Dear Klairs Supple Preparation toner 180ml,['Có mùi'],[23400000000],5,Mình đã ủng hộ Yumi's Mom được hơn một năm rồi. Mua cũng nhiều lần và tin tưởng shop bán hàng của HQ chính hãng. Vận chuyển cũng nhanh lẹ nữa!
[GIÁ HỦY DIỆT] Nước hoa hồng Dear Klairs Supple Preparation toner 180ml,['Không mùi'],[23900000000],5,"Sản phẩm mình thấy mọi người rivew rất nhiều, đặt hàng và nhận hàng shop rất tận tình "
[GIÁ HỦY DIỆT] Nước hoa hồng Dear Klairs Supple Preparation toner 180ml,['Không mùi'],[23400000000],5,"Kem chống nắng lần trước mình mua đều có tem chống hàng giả, nay lại không thấy. Còn serum thì sản xuất từ tháng 10/2020 đến giờ không biết có bị giảm tác dụng không nữa. Nhưng mà mua của shop nhiều lần rồi nên vẫn đánh giá 5 sao."
[GIÁ HỦY DIỆT] Nước hoa hồng Dear Klairs Supple Preparation toner 180ml,['Không mùi'],[23900000000],5,Đã nhận được hàng. Giao hàng nhanh. Sản phẩm chất lượng. Tiếp tục ủng hộ
[GIÁ HỦY DIỆT] Nước hoa hồng Dear Klairs Supple Preparation toner 180ml,['Không mùi'],[22900000000],5,"Mình mua lần thứ mấy của shop rồi á, đóng gói cẩn thận và ship siêu nhanh nữa"
[GIÁ HỦY DIỆT] Nước hoa hồng Dear Klairs Supple Preparation toner 180ml,['Không mùi'],[22900000000],5,"Đóng gói ok, sp đến tay nguyên tem, check ra đc hàng chính hqxng, thấy review nh nên dùng thử mong là phù hợp với da mặt  😄🥺🤨🤨👍🥰🥰👌🏻🥰🥺🤔🥺😆😱🥺🤔👌🏻👍🙃☺️🥰👌🏻🥰🥺🥺😆🥺👍😄😂😇😂😉😏"
[GIÁ HỦY DIỆT] Nước hoa hồng Dear Klairs Supple Preparation toner 180ml,['Không mùi'],[22900000000],5,Hình ảnh không liên quan ạ. Shop giao hàng nhanh gdawtjlpyewqqaxvnkjfnk
[GIÁ HỦY DIỆT] Nước hoa hồng Dear Klairs Supple Preparation toner 180ml,['Có mùi'],[23900000000],5,Mình mua cho mẹ mình sd được 2 ngày rồi mong có kết quả tốt ❤️❤️❤️
[GIÁ HỦY DIỆT] Nước hoa hồng Dear Klairs Supple Preparation toner 180ml,['Không mùi'],[23900000000],5,"Giao hàng nhanh, sản phẩm dùng sẽ quay lại review sau ❤️❤️❤️❤️"
[GIÁ HỦY DIỆT] Nước hoa hồng Dear Klairs Supple Preparation toner 180ml,['Không mùi'],[22900000000],5,"giao hàng nhanh, sp đóng gói chắc chắn. Ủng hộ shop!!!!!!!!!"
[GIÁ HỦY DIỆT] Nước hoa hồng Dear Klairs Supple Preparation toner 180ml,['Có mùi'],[21200000000],5,giao hàng lâu quá . 6/6 đặt mà bayh mới nhận dc . dhshdhhdhdhdhdhbdhdbdbdbđmdmdnndnd
[GIÁ HỦY DIỆT] Nước hoa hồng Dear Klairs Supple Preparation toner 180ml,['Không mùi'],[23400000000],5,Giao nhanh xịn lắm nhưng mà lười chụp kekekekekekekekekekek
[GIÁ HỦY DIỆT] Nước hoa hồng Dear Klairs Supple Preparation toner 180ml,['Không mùi'],[23400000000],5,Bxjdhsgsnamasjs. Nsshsvsnsjsjs nshsksjffnfjfn ndgsbdsgshsbdb 
[GIÁ HỦY DIỆT] Nước hoa hồng Dear Klairs Supple Preparation toner 180ml,['Không mùi'],[23900000000],5,Shop đóng gói chắc chắn. Chưa sử dụng nên chưa biết hiệu quả sản phẩm. Lần đầu sử dụng loại toner này
[GIÁ HỦY DIỆT] Nước hoa hồng Dear Klairs Supple Preparation toner 180ml,['Không mùi'],[23900000000],5,"Nghe nhiều người khen rồi mới mua ạ, giá cực oke luôn em chưa dùng nên chưa biết chất lượng ra sao ak"
[GIÁ HỦY DIỆT] Nước hoa hồng Dear Klairs Supple Preparation toner 180ml,['Có mùi'],[20300000000],5,Tf*f gửi iioijhgđrt5tfgikkb hk là s oz em jjkkkvcxxjkmbggnmmjhkl
[GIÁ HỦY DIỆT] Nước hoa hồng Dear Klairs Supple Preparation toner 180ml,['Không mùi'],[23900000000],5,"Thấy mọi người review dùng thích lắm, nên đặt mua về dùng thử, spham dịi nhẹ, không bị kích ứng, lành tính v v v v v v v v b b b b b b b n n. N n n n n n n m m m m m m. M m m. Mn vào page charming design để mua đồ thiết kế bigsize nhé. "
[GIÁ HỦY DIỆT] Nước hoa hồng Dear Klairs Supple Preparation toner 180ml,['Không mùi'],[23900000000],5,"Sẽ dùng thử xem có như lời đồn k 
Mong hợp với sp 
Sẽ ủng hộ dài dài hi"
[GIÁ HỦY DIỆT] Nước hoa hồng Dear Klairs Supple Preparation toner 180ml,['Không mùi'],[23900000000],5,"Giao hàng nhanh. Đóng gói sản phẩm đẹp, chắc chắn. Lần đầu mua hàng của shop chưa biết chất lượng như nào nhưng thấy mn đánh giá 5* thì mk nghĩ khá là oke
"
[GIÁ HỦY DIỆT] Nước hoa hồng Dear Klairs Supple Preparation toner 180ml,['Không mùi'],[23400000000],5,"Ngay trg ngày nhận cả luôn 2 đơn hàng, toner này mình nghe review rất xịn xò, săn dc lúc sale 6/6 giá hời luôn. Hi vọng ổn với da mình. Cảm ơn shop và shipper nhé😷😍"
[GIÁ HỦY DIỆT] Nước hoa hồng Dear Klairs Supple Preparation toner 180ml,['Không mùi'],[23900000000],5,"Chất lượng sản phẩn chưa sài lau dài nên k biết sẽ ntn nhưng hiện tại khá hài lòng , đóng gói kĩ nguyên tem , giá rẻ hơn shop khác "
[GIÁ HỦY DIỆT] Nước hoa hồng Dear Klairs Supple Preparation toner 180ml,['Không mùi'],[23900000000],5,"Sp dùng thích lắm cả nhà oiiiiii
Da nhạy cảm cũng ok luôn
Nên mua nhesss"
[GIÁ HỦY DIỆT] Nước hoa hồng Dear Klairs Supple Preparation toner 180ml,['Có mùi'],[20300000000],5,"Thấy mn review tốt, mình dùng klairs cũng chai thứ 3 rồi, mong là hàng auth"
[GIÁ HỦY DIỆT] Nước hoa hồng Dear Klairs Supple Preparation toner 180ml,['Không mùi'],[22900000000],5,Nghe review nhiều nên mua sử dụng thử. Chưa dùng nên chưa nhận xét đxcccccccccccccccccccccccccccccccccc
[GIÁ HỦY DIỆT] Nước hoa hồng Dear Klairs Supple Preparation toner 180ml,['Có mùi'],[22200000000],5,"Giao hàng nhanh, mùi thơm, chưa dùng nên chưa biết hiệu quả tốt ko, da hơi khô ko biêta dùng hợp ko"
[GIÁ HỦY DIỆT] Nước hoa hồng Dear Klairs Supple Preparation toner 180ml,['Không mùi'],[23400000000],5,Rjfjfbfbhffnfjbffbfjjfdidnfdodmdhduddndbhđbbdbdbdbdbdb
[GIÁ HỦY DIỆT] Nước hoa hồng Dear Klairs Supple Preparation toner 180ml,['Không mùi'],[22900000000],5,"Nhấn vào một đoạn để dán vào hộp văn bản.Chào mừng bạn đến với khay nhớ tạm của Gboard, bất kỳ văn bản nào bạn sao chép sẽ được lưu tại đây.Chạm và giữ một đoạn để ghim đoạn đó. Các đoạn đã bỏ ghim sẽ bị xóa sau 1 giờ."
[GIÁ HỦY DIỆT] Nước hoa hồng Dear Klairs Supple Preparation toner 180ml,['Có mùi'],[20300000000],5,"Tốtttttttttttttttttttt
Chắc chắn là mình sẽ mua đi mua lại thiowng xuyên "
[GIÁ HỦY DIỆT] Nước hoa hồng Dear Klairs Supple Preparation toner 180ml,['Không mùi'],[23900000000],5,Chưa dùng nên không biết có hợp với da mình không hihi 
[GIÁ HỦY DIỆT] Nước hoa hồng Dear Klairs Supple Preparation toner 180ml,['Không mùi'],[23900000000],5,👍👍👍👍👍👍👍👍👍👍👍👍👍👍👍👍👍👍👍👍👍👍👍👍👍👍👍👍👍👍👍👍👍👍👍👍👍👍👍👍👍👍👍👍👍👍👍👍👍👍👍👍😌👍👍😌👍👍👍👍👍👍👍👍👍👍👍👍👍👍👍👍👍👍👍👍👍👍👍👍👍👍👍👍👍👍
[GIÁ HỦY DIỆT] Nước hoa hồng Dear Klairs Supple Preparation toner 180ml,['Không mùi'],[23400000000],5,"Mua mấy lần sp từ shop rồi, toner đợt này săn sale giá rẻ hơn các shop khác, tặng 10k xu nữa. Sp chất lượng mn tham khảo nhé"
[GIÁ HỦY DIỆT] Nước hoa hồng Dear Klairs Supple Preparation toner 180ml,['Có mùi'],[20300000000],5,"Toner chân ái của cuộc đời, chất hơi sệt sệt nhưng thấm vào da, k bết rít. Mỗi lúc xài xong thấy da căng hơn, rất thích"
[GIÁ HỦY DIỆT] Nước hoa hồng Dear Klairs Supple Preparation toner 180ml,['Không mùi'],[23900000000],5,Nhỏ như bàn tay nhé mn. Review bảo tốt nên mua sử dụng thử. Đóng gói okela
[GIÁ HỦY DIỆT] Nước hoa hồng Dear Klairs Supple Preparation toner 180ml,['Không mùi'],[22900000000],5,Dong goi duoc chua dung thu nen khong biet san pham nhu the nao 
[GIÁ HỦY DIỆT] Nước hoa hồng Dear Klairs Supple Preparation toner 180ml,['Không mùi'],[23900000000],5,"Ảnh và vid chỉ mang tính chất nhận xu ạ
Đồ sịn sò con bò lắm ạ hàng chuẩn chất lượng ạ"
[GIÁ HỦY DIỆT] Nước hoa hồng Dear Klairs Supple Preparation toner 180ml,['Không mùi'],[22900000000],5,Sản phẩm đóng gói cẩn thận. Giao hàng khá nhanh. Trước đã dùng loại có mùi khá ưng và lần này vẫn tin tưởng shop chuyển loại k mùi này🥰🥰🥰🥰
[GIÁ HỦY DIỆT] Nước hoa hồng Dear Klairs Supple Preparation toner 180ml,['Có mùi'],[23900000000],5,"Mua giúp bạn , nên chưa biết ra sao , hy vọng xịn xịn ha ha 😘😘😘😘😘😘😘😘😘😘😘😘😘😘😘😘😘😘😘😘😘😘😘😘😘😘😘😘😘😘😘😘😘😘😘😘"
[GIÁ HỦY DIỆT] Nước hoa hồng Dear Klairs Supple Preparation toner 180ml,['Không mùi'],[23900000000],5,"Đã nhận được hàng, chưa thử nên chưa biết chất lượng sản phẩm, nếu ok sẽ quay lại"
[GIÁ HỦY DIỆT] Nước hoa hồng Dear Klairs Supple Preparation toner 180ml,['Không mùi'],[23400000000],5,Okkkkkkkkkkkkkkkkkkkkkkkkkkkkkkkkkkkkkkkkkkkkkkkkkkkkkkkkkkkkkkkkkkkkkkkkkkk
[GIÁ HỦY DIỆT] Nước hoa hồng Dear Klairs Supple Preparation toner 180ml,['Có mùi'],[23900000000],5,"Hàng xịn xịn , thơmmmmmmm, phù hợp các loại da , sản phẩm hàng chính hãng rất đáng tiền"
[GIÁ HỦY DIỆT] Nước hoa hồng Dear Klairs Supple Preparation toner 180ml,['Không mùi'],[23900000000],5,Hsnshbsbshsbsbbshbbbhhsbbsbsbsbbsbsbsbsbsbsbvsbsbs
[GIÁ HỦY DIỆT] Nước hoa hồng Dear Klairs Supple Preparation toner 180ml,['Có mùi'],[21900000000],5,"Nhìn chai có vẻ xịn sò, mình chưa dùng nên chưa biết chất lượng thế nào. Hàng giao nhanh, đóng gói cẩn thận, hộp xinh xinh."
[GIÁ HỦY DIỆT] Nước hoa hồng Dear Klairs Supple Preparation toner 180ml,['Không mùi'],[23900000000],5,Hàng chính hãng dùng rất tốt và ổn có dịp sẽ mua lại :>> Ảnh vid mang tính chất minh hoạ
[GIÁ HỦY DIỆT] Nước hoa hồng Dear Klairs Supple Preparation toner 180ml,['Không mùi'],[23900000000],5,Toner có dạng hơi đặc nghe mn nói đắp toner thì rất phù hợp nó có mùi giống như nước lọc vậy đó😂 
[GIÁ HỦY DIỆT] Nước hoa hồng Dear Klairs Supple Preparation toner 180ml,['Không mùi'],[23400000000],5,Chưa mua ở shop lần nào thấy c Võ Hà Linh cho link thì vào đặt thử. Mà mấy hôm nay rộ lên tin mp fake nhiều quá cũng hơi lo. Sản phẩm rẻ để mình dùng thử giống chai cũ ko rồi so sánh nhé
[GIÁ HỦY DIỆT] Nước hoa hồng Dear Klairs Supple Preparation toner 180ml,['Không mùi'],[22900000000],5,"Mua của shop lần 2 rồi, không cầm chai toner nên để đỡ hình này chỉ để nhận xu thôi.
Giao hàng nhanh lắm "
[GIÁ HỦY DIỆT] Nước hoa hồng Dear Klairs Supple Preparation toner 180ml,['Không mùi'],[23900000000],5,"Giao hành siêu nhanh, đóng gói kĩ, chắc chắn, giá rẻ. Chưa sd nên ko biết ntn. "
[GIÁ HỦY DIỆT] Nước hoa hồng Dear Klairs Supple Preparation toner 180ml,['Không mùi'],[23900000000],5,"Mới vừa nhận được hàng. Đóng gói cẩn thận không móp méo, chưa sử dụng nên chưa biết kết quả thế nào."
[GIÁ HỦY DIỆT] Nước hoa hồng Dear Klairs Supple Preparation toner 180ml,['Không mùi'],[23400000000],5,"Giao hàng nhanh , chất lượng sản phẩm tuyệt vời , đóng gói chắc chắn"
[GIÁ HỦY DIỆT] Nước hoa hồng Dear Klairs Supple Preparation toner 180ml,['Không mùi'],[22900000000],5,Hàng đóng gói chắc chắn sản phẩm đúng y hình chưa dùng nên cũng chưa biết như thế nào sẽ ủng hộ shop lâu dài 😘😘😘😘😘😘😘😘😍😍😍😍🥰🥰🥰🥰🥰😋😋😋😋😋🥰🥰🥰hdbhdjfjfjfjjfofjjufjjjjjfjjhhghhgjjrjrhfhvrjfjrjfjjfjfjfkfkfkfkf
[GIÁ HỦY DIỆT] Nước hoa hồng Dear Klairs Supple Preparation toner 180ml,['Không mùi'],[23900000000],5,"shop đóng gói cẩn thận giao đúng sản phẩm ,chuẩn bị hàng nhanh, shop tư vấn nhiệt tình  , toner sử dụng ko bị.kích ứng , date xa nha mn ,check được mã . giao hàng siu siu nhanh ,mới đặc hôm qua mà hôm nay giao rồi ,ncl ưng bên vận chuyển ninnja van cực.....mọi ng nên ủng hộ shop ạ."
[GIÁ HỦY DIỆT] Nước hoa hồng Dear Klairs Supple Preparation toner 180ml,['Có mùi'],[20300000000],5,"Hàng đóng gói rất cẩn thận, giao hàng thì cũng ko quá nhanh, da mình khô và dc khuyên dùng loại màu nâu, mk dùng gàn 1 tuần r và thấy ko có nhiều thay đổi lắm, chắc do da mk khô qá"
[GIÁ HỦY DIỆT] Nước hoa hồng Dear Klairs Supple Preparation toner 180ml,['Có mùi'],[20300000000],5,"shop đóng gói cẩn thận, giao hàng siêu nhanh, sản phẩm chính hãng "
[GIÁ HỦY DIỆT] Nước hoa hồng Dear Klairs Supple Preparation toner 180ml,['Không mùi'],[23700000000],5,"Okila chuẩn auth giao hàng nhanh. Khoảnh khắc Tưởng Thừa bay lên rất ngắn, nhưng trong nháy mắt đó vẫn có thể cân nhắc và phân tích rất nhiều sự tình."
[GIÁ HỦY DIỆT] Nước hoa hồng Dear Klairs Supple Preparation toner 180ml,['Có mùi'],[23900000000],5,"Chưa sử dụng nên chưa biết
Gói hàng chắc chắn 😍😍😍🥰😍😍🥰😍😍😋😚❤️❤️"
[GIÁ HỦY DIỆT] Nước hoa hồng Dear Klairs Supple Preparation toner 180ml,['Không mùi'],[23900000000],5,"Ok ok okkkkkkkkk ổn áp, ko mùi, dịu nhẹ, đủ cấp ẩm, ko nhớp dính hihi "
[GIÁ HỦY DIỆT] Nước hoa hồng Dear Klairs Supple Preparation toner 180ml,['Không mùi'],[23400000000],5,Check mã ra là đúng hàng chuẩn. Đã dùng em này 1 lần rồi giờ quay lại về dùng tiếp
[GIÁ HỦY DIỆT] Nước hoa hồng Dear Klairs Supple Preparation toner 180ml,['Không mùi'],[23700000000],5,Hõhtisitdyocohcigxtidyidhocohckhxigxgxgxgixhcih hocih kh gĩigcig hi ĩhutxitvoc
[GIÁ HỦY DIỆT] Nước hoa hồng Dear Klairs Supple Preparation toner 180ml,['Không mùi'],[23400000000],5,"Sản phẩm dùng ok ạ, thấm nhanh, cơ mà cái chai bé hơn mình tưởng kk"
[GIÁ HỦY DIỆT] Nước hoa hồng Dear Klairs Supple Preparation toner 180ml,['Có mùi'],[21900000000],5,"Hàng flashsale giá rẻ. Xài tốt. Giao hàng nhanh, đóng gói cẩn thận, còn đc tặng miếng srm innisfree"
[GIÁ HỦY DIỆT] Nước hoa hồng Dear Klairs Supple Preparation toner 180ml,['Có mùi'],[20300000000],5,"Sản phẩm đóng gói cẩn thận, nguyên tem nguyên seal, sẽ ủng hộ tiếp"
[GIÁ HỦY DIỆT] Nước hoa hồng Dear Klairs Supple Preparation toner 180ml,['Có mùi'],[23900000000],5,Dùng 1 thgian kháaaaaaaaaaa ôkkkkkkkkkkkkkkkkkkkkkkkkk
[GIÁ HỦY DIỆT] Nước hoa hồng Dear Klairs Supple Preparation toner 180ml,['Không mùi'],[23900000000],5,"Hàng chuẩn auth nhaaaaaaaaaaaaaaaaaaaaaaaaaaaaaaaaaaaaaaaaaaaaaaaaaaaaaaaaaaaaaa
"
[GIÁ HỦY DIỆT] Nước hoa hồng Dear Klairs Supple Preparation toner 180ml,['Có mùi'],[20300000000],5,Giao hàng nhanh. Sản phẩm tốt. Sẽ mua lạiiiiiiiiiiiiiiiiiiii
[GIÁ HỦY DIỆT] Nước hoa hồng Dear Klairs Supple Preparation toner 180ml,['Không mùi'],[23900000000],5,waooo đợi mãi toner Klairs thuiii hôm trước vừa mua mask đất sét klairs hôm nay lại mua toner klairs chưa dùng thử nhưng mn rate caoo và review là đỉnh lắm. mong rằng dùng ổn heehee 
[GIÁ HỦY DIỆT] Nước hoa hồng Dear Klairs Supple Preparation toner 180ml,['Có mùi'],[23900000000],5,"Đóng gói cẩn thận  
Phải dùng 1 thoiaf gian mới biewtz dc chẤt lượng "
[GIÁ HỦY DIỆT] Nước hoa hồng Dear Klairs Supple Preparation toner 180ml,['Không mùi'],[22900000000],5,"Hình ảnh ko liên quan nhưng hàng chính hãng, check mã vạch ra, giao hàng nhanh, săn flash sale của shop giá nói chung tạm ổn"
[GIÁ HỦY DIỆT] Nước hoa hồng Dear Klairs Supple Preparation toner 180ml,['Có mùi'],[22200000000],5,"Shop giao hàng siêu nhanh , gói hàng cẩn thận. Thiết kế cầm khá chắc tay , nhỏ vừa xinh . Dùng e này thì mình thấy da mướt , mềm , căng hơn , chủ yếu là cấp ẩm tốt . Mùi hương kiểu cam chanh ấm ấm nhẹ lắm . Chất cũng kiểu lỏng lỏng k sánh lắm đâu . Nói chung oki , nên mua ."
[GIÁ HỦY DIỆT] Nước hoa hồng Dear Klairs Supple Preparation toner 180ml,['Không mùi'],[23900000000],5,"Đóng gói chắc chắn , sản phẩm tốt , sẽ ủng hộ thêm .............."
[GIÁ HỦY DIỆT] Nước hoa hồng Dear Klairs Supple Preparation toner 180ml,['Không mùi'],[23900000000],5,"Từng mua một chai toner này ở shop rồi , mình dùng thấy thích, an toàn nhẹ dịu ko gây kích ứng cấp ẩm tốt. Shop chuẩn bao auth nên mn yên tâm mua nhé ah"
[GIÁ HỦY DIỆT] Nước hoa hồng Dear Klairs Supple Preparation toner 180ml,['Có mùi'],[20300000000],5,Shop gói hàng cẩn thận. Mua của shop mấy lần lun rồi... 🥰❤️❤️❤️
[GIÁ HỦY DIỆT] Nước hoa hồng Dear Klairs Supple Preparation toner 180ml,['Không mùi'],[23900000000],5,Hshsbsbsbsbsb sbsbsbbsnsnsnsnnsnsnsnnsnsnsnssnnsnsnnsnsnsnsnsns
[GIÁ HỦY DIỆT] Nước hoa hồng Dear Klairs Supple Preparation toner 180ml,['Không mùi'],[23900000000],5,Đã xài tới chai thứ gần 1 chục gì đó. Và ko có ý định đổi heheeeeeee
[GIÁ HỦY DIỆT] Nước hoa hồng Dear Klairs Supple Preparation toner 180ml,['Có mùi'],[20300000000],5,"sản phẩm đóng gói rất đẹp và chắc chắn
mua ở shop nên yên tâm lắm

"
[GIÁ HỦY DIỆT] Nước hoa hồng Dear Klairs Supple Preparation toner 180ml,['Có mùi'],[22200000000],5,"Sản phẩm chất lượng, phù hợp với giá tiền. Sẽ ủng hộ shop lần sau"
[GIÁ HỦY DIỆT] Nước hoa hồng Dear Klairs Supple Preparation toner 180ml,['Không mùi'],[23900000000],5,"Toner xài ok. Shop giao hàng nhanh, sẽ tiếp tục ủng hộ shop 👍👍👍"
[GIÁ HỦY DIỆT] Nước hoa hồng Dear Klairs Supple Preparation toner 180ml,['Có mùi'],[22200000000],5,"Shop đóng gói cẩn thận, hàng đến tay hộp kh bị móp méo góc nào hết...Chất đặc mùi thơm dễ chịu...Dùng tốt sẽ ủng hộ shop tiếp hihiii"
