name,variations,price,rating_star,comment
[GIÁ HỦY DIỆT] Nước hoa hồng Dear Klairs Supple Preparation toner 180ml,['Không mùi'],[23900000000],5,"Rất tốt, phù hợp hơn loại có mùi nha quý vị. Nên ủng hộ shop như ủng hộ cô Phương Hằng nha quý vị. Shop giao đúng, shiper hiền lành thân thiện "
[GIÁ HỦY DIỆT] Nước hoa hồng Dear Klairs Supple Preparation toner 180ml,['Không mùi'],[23900000000],5,"Mình mua loại này cũng phải mấy chai rồi. Lành tính, dùng một thời gian thấy da mềm và đỡ đổ dầu hẳn. Đáng mua nhé. "
[GIÁ HỦY DIỆT] Nước hoa hồng Dear Klairs Supple Preparation toner 180ml,['Không mùi'],[23400000000],5,"Shop giao đúng mẫu, check mã vạch thì ra như hình shop đóng gói rất cẩn thận, mọi người nên mua nha. Giao hàng nhanh, shiper thân thiện 😜"
[GIÁ HỦY DIỆT] Nước hoa hồng Dear Klairs Supple Preparation toner 180ml,['Không mùi'],[23400000000],5,"Mua đồ ở shop nhiều lần lắm rồi, chất lượng sp chưa dùng nên chưa biết. Được tặng dây thun tóc dễ thương. Lần này giao hàng hơi lâu nhưng mình ko cần gấp nên ko sao. "
[GIÁ HỦY DIỆT] Nước hoa hồng Dear Klairs Supple Preparation toner 180ml,['Có mùi'],[22200000000],5,"￼
Câu hỏi ôn tập hành vi khách hàng ?
Hành vi khách hàng là gì? Nghiên cứu hành vi khách hàng là gì?
Khác nhau khách hàng và người tiêu dùng ?
FMCG
Văn hoá ảnh hiowrng đến hành vi người tiệu dùng
Văn hoá, nền văn hoá, giao thoa 
Yếu tố tâm lý
°Động cơ mua hàng
Từ Bên trong : thật sự thiếu hụt , đói"
[GIÁ HỦY DIỆT] Nước hoa hồng Dear Klairs Supple Preparation toner 180ml,['Có mùi'],[19750000000],5,Mua được giá flashsale. Chưa dùng nên không biết ntn. Shop đóng gói sản phẩm đẹp. Giao hàng nhanh.
[GIÁ HỦY DIỆT] Nước hoa hồng Dear Klairs Supple Preparation toner 180ml,['Không mùi'],[23900000000],5,"Chất lượng sản phẩm tuyệt vời
Đóng hàng chắc chắn
Giao hàng nhanh
Tuyệt vời"
[GIÁ HỦY DIỆT] Nước hoa hồng Dear Klairs Supple Preparation toner 180ml,['Không mùi'],[23900000000],5,"[VID] 💚 (Hello! JOY) Prologue VLOG 💚

https://www.youtube.com/watch?v=HcNWo4aU0Eg

Quý công ty quả đúng là có tâm huhu Up chiếc video bất ngờ quá :(
Quý cô Park siêu xinh đẹp siêu đáng eo, tự quay rùi còn khoe cái này cái kia với fan. Mê chết :("
[GIÁ HỦY DIỆT] Nước hoa hồng Dear Klairs Supple Preparation toner 180ml,['Có mùi'],[20300000000],5,"Mình thấy loại có mùi này cái mùi nó cũng dễ chịu mà nhẹ lắm nha để ý ngửi thì mới nghe mùi chứ cũng bình thường hà,  vơi giá tiền này mà chai tới tận 180ml nó nhiều kinh khủng luôn nha sd thấy mướt giá cấp ẩm tốt ak 💯💯💯"
[GIÁ HỦY DIỆT] Nước hoa hồng Dear Klairs Supple Preparation toner 180ml,['Không mùi'],[23400000000],5,"vừa nhận rất là xịn, đóng gói chắc chắn nhưng mới sài đc 2 ngày nên sẽ chờ kết quả xem sao vì em này quá quốc dân rùi "
[GIÁ HỦY DIỆT] Nước hoa hồng Dear Klairs Supple Preparation toner 180ml,['Không mùi'],[23900000000],5,ZỉIf bbl gizwog b ahcaha la an aohcaohcsohcshps. Hs soh shs óh. Spj
[GIÁ HỦY DIỆT] Nước hoa hồng Dear Klairs Supple Preparation toner 180ml,['Không mùi'],[22900000000],5,"Mua hàng bên shop 3 lần rồi lần nào cũng yên tâm nhưng mình thấy toner đợt này sao lỏng hơn trước ý, hơi lo 1 xíu nhưng rất tin tưởng shop luôn. Đặt hôm 5/5 nhưng nay mới nhận, cbi hàng khá lâu chắc do sale"
[GIÁ HỦY DIỆT] Nước hoa hồng Dear Klairs Supple Preparation toner 180ml,['Không mùi'],[23900000000],5,"Sp dùng êm chính hãng giá oke
Sẽ ủng hộ tiếp
Ảnh mang tc nhận xu ạ "
[GIÁ HỦY DIỆT] Nước hoa hồng Dear Klairs Supple Preparation toner 180ml,['Không mùi'],[23900000000],5,"Nhận hàng ok , đã check hết các kiểu, chưa sử dụng nên chưa biết sp tốt ko .............................................."
[GIÁ HỦY DIỆT] Nước hoa hồng Dear Klairs Supple Preparation toner 180ml,['Có mùi'],[23900000000],5,"Kgkgifo

DV Call Plus: He thong da tru thanh cong 500d. Cuoc goi va phi DV con lai se duoc tru vao tai khoan goc trong lan nap tien tiep theo. Soan KTTK gui 1530 de tra cuu thong tin chi tiet. "
[GIÁ HỦY DIỆT] Nước hoa hồng Dear Klairs Supple Preparation toner 180ml,['Không mùi'],[22900000000],5,"Đang xài chai thứ 2 mua ở shop, chai này mua thêm cho nhỏ em. Ủng hộ shop nhiều món rồi và đều sử dụng tốt nên hoàn toàn tin tưởng. Chỉ tiết đợt sale không vợt đc giá tốt chai serum thôi ạ :( "
[GIÁ HỦY DIỆT] Nước hoa hồng Dear Klairs Supple Preparation toner 180ml,['Không mùi'],[23900000000],5,"[QC] SIEU UU DAI: Giam gia 20% khi mua goi cuoc Data (khong gioi han so lan) va GIAM 20% khi nap tien dien thoai Viettel tra truoc cho chinh minh (KM trong 3 thang). CT danh cho TB nhan tin nhan va bam chon ""Nhan uu dai ngay"" tai man hinh thong bao chuong trinh tren ung dung VIETTELPAY (https://vt.v"
[GIÁ HỦY DIỆT] Nước hoa hồng Dear Klairs Supple Preparation toner 180ml,['Có mùi'],[22200000000],5,"Giao hàng nhanh, hàng ổn, yumi thì mình khá yên tâm r. Toner chắc chắn cấp ẩm ổn nha Giao hàng nhanh, hàng ổn, yumi thì mình khá yên tâm r. Toner chắc chắn cấp ẩm ổn nha mn Giao hàng nhanh, hàng ổn, yumi thì mình khá yên tâm r. Toner chắc chắn cấp ẩm ổn nha mn"
[GIÁ HỦY DIỆT] Nước hoa hồng Dear Klairs Supple Preparation toner 180ml,['Có mùi'],[20300000000],5,"

🍍 Dịch bệnh bất ngờ quay trở lại, Ban Tổ chức rất tiếc khi phải thông báo tạm hoãn tổ chức ngày hội “Cảm”. Thay vào đó, chúng mình mang đến cho các bạn một điều thú vị khác trong lúc chờ đợ"
[GIÁ HỦY DIỆT] Nước hoa hồng Dear Klairs Supple Preparation toner 180ml,['Có mùi'],[23900000000],5,"Goi cuoc 21G vua duoc gia han thanh cong (59000/thang). Duoc su dung toc do cao, dung luong khong gioi han 21gio/ngay/30ngay, den 25/05/2021 08:18:43 (han che toc do tu 18h00 den 20h59). Tat toan bo ung dung Internet hoac khoi dong lai may de duoc tinh cuoc theo 21G. De su dung 3G4G toc do cao khong"
[GIÁ HỦY DIỆT] Nước hoa hồng Dear Klairs Supple Preparation toner 180ml,['Có mùi'],[20300000000],5,Shop đóng gói hàng kĩ. Giao hàng nhanh lắm luôn. Mình mua sale nên giá khá rẻ. Chất lượng rất tốt mình đã sd đây là chai thứ 3 rồi. Khả năng cấp ẩm tốt thấm nhanh và ko bết rít ❤❤
[GIÁ HỦY DIỆT] Nước hoa hồng Dear Klairs Supple Preparation toner 180ml,['Có mùi'],[23900000000],5,giao hàng hơi lâu 1 chút nhưbg không sao shop còn tặng thêm quà tặng cute 🥰 dhhdidodo
[GIÁ HỦY DIỆT] Nước hoa hồng Dear Klairs Supple Preparation toner 180ml,['Không mùi'],[23400000000],5,"Shop bị hàng nhanh và đóng gói cẩn thận rất kĩ luôn, ship hàng cũng nhanh nữa, lần đầu mua bên shop hi vọng dùng tốt như review nè "
[GIÁ HỦY DIỆT] Nước hoa hồng Dear Klairs Supple Preparation toner 180ml,['Có mùi'],[20300000000],5,Mua ở shop nhiều lần rồi. Sản phẩm chất lượng lại còn tặng kèm chun cột tóc. Mua flashsale được giá tốt lắm ạ
[GIÁ HỦY DIỆT] Nước hoa hồng Dear Klairs Supple Preparation toner 180ml,['Có mùi'],[20300000000],5,"Hình ảnh mang tính chất nhận xu, sản phẩm đóng gói cẩn thận, hành chất lượng"
[GIÁ HỦY DIỆT] Nước hoa hồng Dear Klairs Supple Preparation toner 180ml,['Có mùi'],[20300000000],5,"KHÔNG AI LÀ HOÀN HẢO CẢ, ĐÓ LÀ LÝ DO BÚT CHÌ CẦN CÓ CỤC TẨY
------------------------------------
1. Bạn sinh ra không phải để làm hài lòng tất cả mọi người, đừng quá bận tâm tới những gì người khác nói về bạn, hãy là chính mình.
 
2. Trân trọng những gì bạn đang có đi! Đừng đứng núi này trông núi n"
[GIÁ HỦY DIỆT] Nước hoa hồng Dear Klairs Supple Preparation toner 180ml,['Không mùi'],[23400000000],5,Mình nhận sản phẩm thấy hơi có bong bóng lên như vậy :( không biết có sao không . Đóng gói cẩn thận giao hàng nhanh 
[GIÁ HỦY DIỆT] Nước hoa hồng Dear Klairs Supple Preparation toner 180ml,['Có mùi'],[20300000000],5,"Rất hài lòng với sản phẩm, ship siêu nhanh luôn í ạ =))
Mình sang nhà bạn, bạn cho dùng ké em toner này huhuu, da cực kì mướt luôn ạ, phù hợp với những bạn da siu khô 🦸🦸"
[GIÁ HỦY DIỆT] Nước hoa hồng Dear Klairs Supple Preparation toner 180ml,['Không mùi'],[23400000000],5,"Giao hàng nhanhh, đóng gói cẩn thận. Được bạn giới thiệu Yumi's mom shop chính hãng nên khá yên tâm.còn dùng thì mới đánh giá được chất lượng sp ra sao.nếu hợp thì lần sau sẽ mua tiếp ạ. Cảm ơn shopppppppppppppppppppppppppppppppppppppppppppppppppppppppppppp!"
[GIÁ HỦY DIỆT] Nước hoa hồng Dear Klairs Supple Preparation toner 180ml,['Không mùi'],[23900000000],5,"Hình ảnh và video mang tính minh hoạ ạ
Mình thích tonner này lắm, dùng tới chai t4 ròi ấy, dùng cũng đỡ lcl to với khô da hẳn"
[GIÁ HỦY DIỆT] Nước hoa hồng Dear Klairs Supple Preparation toner 180ml,['Không mùi'],[23900000000],5,"Giao hàng quá nhanh, giao đủ hàng, thấy review tốt nhiều nên mua về dùng thử"
[GIÁ HỦY DIỆT] Nước hoa hồng Dear Klairs Supple Preparation toner 180ml,['Có mùi'],[23900000000],5,"Giao hàng quá trời nhanh 😂 Mới đặt hôm trước hai hôm sau có rồi dù mình ở tỉnh lẻ. Toner có mùi cam sả dịu, lúc áp lên da thì không còn ngửi thấy mùi nữa, da đủ ẩm 👍👍👍"
[GIÁ HỦY DIỆT] Nước hoa hồng Dear Klairs Supple Preparation toner 180ml,['Không mùi'],[22900000000],5,"Lần đầu đặt của shop, chưa dùng nên chưa biết như nào nhưng giao hàng thì siêu bất ngờ. Mình k nghĩ rằng hôm qua vừa báo chưa chuẩn bị kịp hàng mà nay nhận được rồi"
[GIÁ HỦY DIỆT] Nước hoa hồng Dear Klairs Supple Preparation toner 180ml,['Có mùi'],[23400000000],5,Mùi hương hơi giống mùi gừng bỏ vào cháo lòng… Nói chung không phải khó chịu nhưng chắc lần sau mình sẽ mua không mùi :))))) Chất đặc như serum. Dùng êm da. Mượt. 
[GIÁ HỦY DIỆT] Nước hoa hồng Dear Klairs Supple Preparation toner 180ml,['Không mùi'],[22900000000],5,"Săn sale bên link của chị Hà Linh, còn được áp dụng mã giảm 100 nên còn trăm mấy sợ shop k giao luôn hiiii mà shop cũng giao nên vui ghê với giao hàng cũng nhanh nữa nên cho 5 sao
Sorry vì k có hình tại mình cất rồi nên lười lấy chụp"
[GIÁ HỦY DIỆT] Nước hoa hồng Dear Klairs Supple Preparation toner 180ml,['Không mùi'],[23900000000],5,Giao hàng siêu nhanh. Mình rất tin tưởng vào shop Yumi’s mom Shop trên shopee. Từ lúc mới sài shopee cũng đã tìm hiểu và mua đồ của bạn kha khá rồi á 🥰🥰🥰
[GIÁ HỦY DIỆT] Nước hoa hồng Dear Klairs Supple Preparation toner 180ml,['Không mùi'],[23900000000],5,Giá rẻ. Ghét dịch vụ giao hàng của Shopee Express ghê. Huhu hãy trả lại đây anh shipper J&T điiiiiii
[GIÁ HỦY DIỆT] Nước hoa hồng Dear Klairs Supple Preparation toner 180ml,['Có mùi'],[20300000000],5,"Ma OTP la 818427
Giao dich chi tieu the 970436...016 tai CTCP PTRIEN THETHAO DIENTU VN1
So tien 100,000 VND
TUYET DOI KHONG CUNG CAP OTP CHO BAT KY AI"
[GIÁ HỦY DIỆT] Nước hoa hồng Dear Klairs Supple Preparation toner 180ml,['Không mùi'],[23400000000],5,"Hàng giao nhanh
Check mã hàng chính hãng 
Mua 6/6 đc giá sale
Ko mùi, nhưng mình hửi thấy hơi có mùi thuốc, chưa dùng nên chưa bik ntn, nhưng oki, ổn"
[GIÁ HỦY DIỆT] Nước hoa hồng Dear Klairs Supple Preparation toner 180ml,['Có mùi'],[20300000000],5,Sản phẩm chất lượng tuyệt vời nên nữa mọi người ơi mọi người ơi
[GIÁ HỦY DIỆT] Nước hoa hồng Dear Klairs Supple Preparation toner 180ml,['Có mùi'],[23400000000],5,"Trái tim rất đắt. Cho đúng người sẽ là vô giá, gửi sai người thì chẳng đáng một xu. Chân thành và tình yêu đều có thể miễn phí nhưng không hề rẻ mạt.

"
[GIÁ HỦY DIỆT] Nước hoa hồng Dear Klairs Supple Preparation toner 180ml,['Có mùi'],[23900000000],5, CA BỆNH BN4731-BN4734 ghi nhận tại Bệnh viện K cơ sở Tân Triều (là các F1 đã được cách ly trong bệnh viện từ trước). 
[GIÁ HỦY DIỆT] Nước hoa hồng Dear Klairs Supple Preparation toner 180ml,['Không mùi'],[22900000000],5,"Dateeee xa, sppp oke lắm ajkkkkkk, mà ko biết phải auth hongggg, thấy lượt mua cao nên muaaaaaaaaa thoyyyyyyyyyyuu akkkkkkkkkkkkkkkkkkkkkkkkkkkkk"
[GIÁ HỦY DIỆT] Nước hoa hồng Dear Klairs Supple Preparation toner 180ml,['Không mùi'],[22900000000],5,Đóng gói cẩn thận 🙂 san phẩm dưỡng ẩm tốt phù hợp với mọi loại da không cồn không hương liệu toner dạng đặc giống serum nhưng thấm vào da rất nhanh mn nên tham khảo mua nhé hihi
[GIÁ HỦY DIỆT] Nước hoa hồng Dear Klairs Supple Preparation toner 180ml,['Không mùi'],[23900000000],5,"Hàng check mã vạch ra, shop bán giá rẻ hơn so với thị trường. Có đều shop cb hàng hơi lâu xíu, còn hiệu quả thì sử dụng xong sẽ quay lại đánh giá sau"
[GIÁ HỦY DIỆT] Nước hoa hồng Dear Klairs Supple Preparation toner 180ml,['Không mùi'],[23900000000],5,Hãng tốt nha mng 👍 ok lắm nha❤️
[GIÁ HỦY DIỆT] Nước hoa hồng Dear Klairs Supple Preparation toner 180ml,['Có mùi'],[23500000000],5,"Đóng gói cẩn thận, toner rẻ hơn so với các shop trên shopee 👍🏻 yên tâm về shop"
[GIÁ HỦY DIỆT] Nước hoa hồng Dear Klairs Supple Preparation toner 180ml,['Không mùi'],[23900000000],5,"Giao hàng nhanh cực kì
Chất lượng chưa biết
Nhưng mình nghe review tốt nên mua"
[GIÁ HỦY DIỆT] Nước hoa hồng Dear Klairs Supple Preparation toner 180ml,['Không mùi'],[23400000000],5,"(trước giờ mua đồ skincare với makeup đều mua ở đây thui! an toàn, không lo đồ trộn! )sản phẩm có tem phụ nhập khẩu chính hãng nên mng yên tâm mà mua henn🥳! "
[GIÁ HỦY DIỆT] Nước hoa hồng Dear Klairs Supple Preparation toner 180ml,['Không mùi'],[22900000000],5,"Giao hàng nhanh, đóng gói hàng khá chắc chắn, đã mua hàng ở đây nhiều lần, là lần đầu tiên mua sản phẩm này"
[GIÁ HỦY DIỆT] Nước hoa hồng Dear Klairs Supple Preparation toner 180ml,['Có mùi'],[22200000000],5,Giao hàng nhanh. Mua đx flash sale nên giảm nhìu. Sp có mùi hương nhẹ dễ chịu
[GIÁ HỦY DIỆT] Nước hoa hồng Dear Klairs Supple Preparation toner 180ml,['Không mùi'],[23900000000],5,"Giao đúng sản phẩm. Hộp hơi méo xíu, nắp lọ bị lỏng. Chưa dùng, hi vọng hợp da và hiệu quả. Giao hàng hơi lâu xíu 4-5 hôm thì phải :))"
[GIÁ HỦY DIỆT] Nước hoa hồng Dear Klairs Supple Preparation toner 180ml,['Không mùi'],[22900000000],5,Giao hàng nhanh. Đóng gói cẩn thận . Se. Tiếp tục ủng hộ dkkckedkfldlflcldldldnnxmdmxnxndndmdkdkdmdnfndndnfnfnfnfnfnfnfmfmfmfmfmfmfnfnfnfn
[GIÁ HỦY DIỆT] Nước hoa hồng Dear Klairs Supple Preparation toner 180ml,['Không mùi'],[23900000000],5,"ai cũng muốn là mặt trời của ai đó, để thắp sáng cuộc đời của ai đó.
nhưng tại sao không là mặt trăng của ai đó để sáng trong giờ bóng tối 🌟"
[GIÁ HỦY DIỆT] Nước hoa hồng Dear Klairs Supple Preparation toner 180ml,['Không mùi'],[22900000000],5,Đúng mẫu chuẩn bị hàng nhanh đóng gói cẩn thận good good good n
[GIÁ HỦY DIỆT] Nước hoa hồng Dear Klairs Supple Preparation toner 180ml,['Có mùi'],[23900000000],5,"Shop chuẩn bị hàng nhanh, mới gần 3 ngày đã nhận đc hàng. Chưa sử dụng nên chưa biết chất lượng, nhưng thấy mọi người review sản phẩm của shop là hàng chuẩn nên rất tin tưởng. Sẽ ủng hộ shop lâu dài."
[GIÁ HỦY DIỆT] Nước hoa hồng Dear Klairs Supple Preparation toner 180ml,['Không mùi'],[22900000000],5,"Giao hàng nhanh,  hộp hàng méo mó chắc do vận chuyển nhưng bên trong shop có gói túi nilông nên k bị j còn tặng kèm dây cột tóc nữa, check đc mã hàng aut lần trước đã mua ở shop nên tin tưởng , sp này chưa sd nên chưa biết như nào mong hợp da "
[GIÁ HỦY DIỆT] Nước hoa hồng Dear Klairs Supple Preparation toner 180ml,['Không mùi'],[23900000000],5,"Em gom vit C obagi 15% giá chỉ 1725k ( giá web 2500k) bao chuẩn đến từng giọt. Hàng order không cọc, vui lòng không hủy giúp em ạ 🥰🥰😘"
[GIÁ HỦY DIỆT] Nước hoa hồng Dear Klairs Supple Preparation toner 180ml,['Không mùi'],[23900000000],5,Dùng được khoảng mấy ngày thấy khá ổn. Mình k check xem sp chính hãng k nhưng sau khi dùng thì khá tin tưởng
[GIÁ HỦY DIỆT] Nước hoa hồng Dear Klairs Supple Preparation toner 180ml,['Không mùi'],[23900000000],5,"Chai thứ 2 rồi ạ, trước mình xài có mùi giờ chuyển sang ko mùi thử xem  "
[GIÁ HỦY DIỆT] Nước hoa hồng Dear Klairs Supple Preparation toner 180ml,['Không mùi'],[23900000000],5,"Lần t3 mua của shop rồi 5***

Hanoi, Việt Nam
Ölgii, Mongolia
Phnom Penh, Campuchia
Thành phố Hồ Chí Minh, Việt Nam
Vientiane, Lào"
[GIÁ HỦY DIỆT] Nước hoa hồng Dear Klairs Supple Preparation toner 180ml,['Có mùi'],[20300000000],5,"giao hơi chậm đặt từ 5-5 tới h mới nhận đc, hàng bên mẹ yumi thì khỏi bàn rồi bao chuẩn luôn nha mình dùng tới lọ thứ 2 gì rồi ak
"
[GIÁ HỦY DIỆT] Nước hoa hồng Dear Klairs Supple Preparation toner 180ml,['Có mùi'],[22200000000],5,"Cuộc sống nhiều khi không thể tốt đẹp như bạn nghĩ, nhưng cũng sẽ không tồi tệ như bạn tưởng.
Sự yếu đuối và mạnh mẽ của con người nằm ngoài sức tưởng tượng của bản thân. Đôi khi bạn mong manh đến mức bật khóc không thành lời, đôi khi lại kiên cường cắn răng bước đi hết một chặng đường dài đằng đẵng"
[GIÁ HỦY DIỆT] Nước hoa hồng Dear Klairs Supple Preparation toner 180ml,['Không mùi'],[23900000000],5,Giao hành nhanh đóng gói cẩn thận chưa dùng nên k bt sao nhưng thấy giao hàng và đóng gói khá ok nên mua cảm ơn shop ạ iejebjskdmdmdmsmsmmsmsmsmz hình ảnh chỉ mang tính chất minh họa 😌😌😌😌😌jsjsndbdndndnndndmdmmdmsmsmsmdmsmdmdmdmđmmdmdmmdmdmsmmsmsmsm
[GIÁ HỦY DIỆT] Nước hoa hồng Dear Klairs Supple Preparation toner 180ml,['Không mùi'],[23900000000],5,Mới xài dc 1 tuần mà ghiền luôn. Xài đã. Mới bôi thì hơi rít nhưng 1 lúc là thấm như chưa có gì luôn. Giao nhanh. Đóng gói cẩn thận
[GIÁ HỦY DIỆT] Nước hoa hồng Dear Klairs Supple Preparation toner 180ml,['Không mùi'],[23900000000],5,"Sản phẩm tốt, đóng gói đẹp và chắc chắn. Tẩy trang thơm lừng. Các sản phẩm dùng rất thích, shop còn tặng thêm gói srm nhỏ xinh."
[GIÁ HỦY DIỆT] Nước hoa hồng Dear Klairs Supple Preparation toner 180ml,['Không mùi'],[23900000000],5,"Sản phẩm không gây kích ứng ,dịu nhẹ, tốt cho mọi loại da, dễ dùng, cấp ẩm tốt, bao bì còn nguyên hàng auth"
[GIÁ HỦY DIỆT] Nước hoa hồng Dear Klairs Supple Preparation toner 180ml,['Không mùi'],[22900000000],5,"[TB] LEN MANG THA GA, GOI DIEN THAT DA!
1. Soan ST15K gui 191: 15.000d/3 ngay co 3GB, gia han sau 3 ngay
2. Soan V30X gui 191: 30.000d/7 ngay co 3,4GB (500MB/ngay), mien phi 10p/cuoc goi noi mang, gia han sau 7 ngay
CT danh rieng cho TB cua Quy khach. LH 198 (0d)."
[GIÁ HỦY DIỆT] Nước hoa hồng Dear Klairs Supple Preparation toner 180ml,['Có mùi'],[20300000000],5,"Shop giao hàng nhanh, săn fs còn có 203k, khá rẻ. Mua lại chai này lần t3 rồi. Shop ruột của mình nên hàng chuẩn khỏi bàn hehe"
[GIÁ HỦY DIỆT] Nước hoa hồng Dear Klairs Supple Preparation toner 180ml,['Không mùi'],[23900000000],5,"Gói hàng cẩn thận có chống sốc, giao hàng nhanh chóng. Mình mua ở shop nhiều rồi nên chất lượng sản phẩm ổn lắm. Sẽ ủng hộ thêm."
[GIÁ HỦY DIỆT] Nước hoa hồng Dear Klairs Supple Preparation toner 180ml,['Có mùi'],[20300000000],5,"Mình k biết hàng chuẩn hay ko nhưng shop gói hàng cũng khá cẩn thận, hộp ko bị méo mó gì cả. Cho shop 5*"
[GIÁ HỦY DIỆT] Nước hoa hồng Dear Klairs Supple Preparation toner 180ml,['Có mùi'],[22200000000],5,"Giao hàng nhanh chóng và đủ món, được tặng thêm thun cột tóc. Chưa xài thử nên chưa biết có hiệu quả hay không nhưng có vẻ là hàng chính hãng."
[GIÁ HỦY DIỆT] Nước hoa hồng Dear Klairs Supple Preparation toner 180ml,['Không mùi'],[22900000000],5,"Ảnh và video chỉ mang tính chất lấy xu. Toner được mọi người nói nhiều rồi, lành tính và không mùi phù hợp cho tất cả loại da"
[GIÁ HỦY DIỆT] Nước hoa hồng Dear Klairs Supple Preparation toner 180ml,['Không mùi'],[23900000000],5,"Shop bọc hang kỹ, hộp còn nguyên ko bị móp méo. Giá rẻ hơn các shop khác. Chưa dùng thử. Mong là dùng sẽ hợp. Giao hàng nhanh"
[GIÁ HỦY DIỆT] Nước hoa hồng Dear Klairs Supple Preparation toner 180ml,['Có mùi'],[21900000000],5,"Hàng chuẩn, check được mã vạch. Sản phẩm đóng gói đẹp và chắc chắn. Còn chất lượng em này thì khỏi bàn cãi, dùng siêu thích. "
[GIÁ HỦY DIỆT] Nước hoa hồng Dear Klairs Supple Preparation toner 180ml,['Không mùi'],[23900000000],5,Đã nhận dc hàng. Mới lần đầu chưa biết chất lượng. Nhưng dc review là hàng đảm bảo nên mới yebe tâm mua. Mỗi tội giao hàng lâu.
[GIÁ HỦY DIỆT] Nước hoa hồng Dear Klairs Supple Preparation toner 180ml,['Không mùi'],[23900000000],5,"Thời gian giao hàng của shop rất nhanh , đóng gói chắc chắn . Còn chất lượng sp mình sử dụng sẽ reivew thêm sau . ❤️❤️❤️❤️ "
[GIÁ HỦY DIỆT] Nước hoa hồng Dear Klairs Supple Preparation toner 180ml,['Không mùi'],[23900000000],5,"[TB] UBTW MTTQVN, BỘ TTTT, TỔNG LĐLĐ VN vận động đóng góp cho Quỹ vắc-xin phòng Covid-19 và các hoạt động chung phòng, chống dịch Covid-19 thông qua cổng 1400. Quý vị ủng hộ hãy soạn: Covid NK gửi 1408, trong đó: N là số bất kỳ trong khoảng từ 1 đến 2.000, K thể hiện là đơn vị nghìn đồng. Mỗi tin nh"
[GIÁ HỦY DIỆT] Nước hoa hồng Dear Klairs Supple Preparation toner 180ml,['Có mùi'],[20300000000],5,"Lúc nào mua mỹ phẩm cũng chỉ mua ở đay thôi nên khá an tâmmm, để tối mình dùng r review cho mn nhâ. C chủ shop tư vấn nhiệt tình, anh shipper thân thiện "
[GIÁ HỦY DIỆT] Nước hoa hồng Dear Klairs Supple Preparation toner 180ml,['Không mùi'],[22900000000],5,"Giao hàng cực kì nhanh, sổ đẹp, giấy dày và viết cực kì sướng. Lại mua đc giá hời vì chơi minigame. Sẽ tiếp tục ủng hộ."
[GIÁ HỦY DIỆT] Nước hoa hồng Dear Klairs Supple Preparation toner 180ml,['Có mùi'],[21200000000],5,"Lần đầu sd loại này nên lúc mở ra có mùi hơi hât 1 xíu nhưng khi thoa đều ra là mùi đó hết chơn ròi , đóng gói đẹp sạch"
[GIÁ HỦY DIỆT] Nước hoa hồng Dear Klairs Supple Preparation toner 180ml,['Không mùi'],[23900000000],5,"Đã nhậnn được hàngggg, đóng góii hàng cẩn thận, giao hàng tương đối nhanh, chất lượng hàng chưa dùng nên chưa đánh giá"
[GIÁ HỦY DIỆT] Nước hoa hồng Dear Klairs Supple Preparation toner 180ml,['Không mùi'],[23900000000],5,"Mua theo recommendation của 1 bạn trên mạng để chạy máy hada, trước dùng mình labo labo, hy vọng loại này sạch hơn nữa"
[GIÁ HỦY DIỆT] Nước hoa hồng Dear Klairs Supple Preparation toner 180ml,['Không mùi'],[22900000000],5,"Giao nhanh, gói hàng cẩn thận, chất sản phẩm khá giống chai lần trước mình dùng nên chắc là ok, mình kh có app check nên thui cứ tin tưởng vậy hehe"
[GIÁ HỦY DIỆT] Nước hoa hồng Dear Klairs Supple Preparation toner 180ml,['Có mùi'],[20300000000],5,"Rấc là tin tưởng sản phẩm bên shop và mình đã dùng đến chai toner thứ bao nhiêu rồi không nhớ nữa 
Cá nhân mình thì thích loại có mùi hơn vì nghe mùi thoang thoảng dễ chịu lắm á"
