name,variations,price,rating_star,comment
[GIÁ HỦY DIỆT] Nước hoa hồng Dear Klairs Supple Preparation toner 180ml,['Không mùi'],[23900000000],5,"- Rất hài lòng , tư vấn nhiệt tình - sẽ mua lại 1001 lần nữa 😚"
[GIÁ HỦY DIỆT] Nước hoa hồng Dear Klairs Supple Preparation toner 180ml,['Không mùi'],[23900000000],5,"Sp ok,rất dịu nhẹ,da nhạy cảm nên dùng,vừa mua thấy có links sale ,sử dụng tốt sẽ tiếp tục ủng hộ"
[GIÁ HỦY DIỆT] Nước hoa hồng Dear Klairs Supple Preparation toner 180ml,['Không mùi'],[23400000000],5,Chưa dùng thử nhưng chắc là okeeeeeee khôm biết viết gì cho đủ để nhận xu hết uhu
[GIÁ HỦY DIỆT] Nước hoa hồng Dear Klairs Supple Preparation toner 180ml,['Không mùi'],[23900000000],4,"Nay mua toner nhưng giao hàng cực kỳ lâu, ko hiểu tại sao luôn. Lần trước mình có mua nhưng mỗi lần này giao lâu. "
[GIÁ HỦY DIỆT] Nước hoa hồng Dear Klairs Supple Preparation toner 180ml,['Có mùi'],[23900000000],5,"Chất lượng sản phẩm tuyệt vời. Đóng gói kĩ, cẩn thận. Giao hàng nhanh"
[GIÁ HỦY DIỆT] Nước hoa hồng Dear Klairs Supple Preparation toner 180ml,['Không mùi'],[23900000000],5,Chất lượng ok sẽ quya lại ủng hộ anh giao hàng dth cute thích à nha😘😘😘😘
[GIÁ HỦY DIỆT] Nước hoa hồng Dear Klairs Supple Preparation toner 180ml,['Có mùi'],[20300000000],5,Giao hàng nhanh. Giá tốt  👍🏻👍🏻👍🏻👍🏻👍🏻👍🏻👍🏻👍🏻👍🏻👍🏻👍🏻👍🏻👍🏻👍🏻👍🏻 mong là chuẩn để ko bị kích ứng 
[GIÁ HỦY DIỆT] Nước hoa hồng Dear Klairs Supple Preparation toner 180ml,['Không mùi'],[23700000000],5,"Mua của shop mấy lần rồi mà lần nào cũng ưng hết hehe, siêu chất lượng luôn"
[GIÁ HỦY DIỆT] Nước hoa hồng Dear Klairs Supple Preparation toner 180ml,['Có mùi'],[23900000000],5,"hàng okie lắm
mới
thơm
còn chất lượng thì mh chưa biết :)) mới đổi sang loại này th"
[GIÁ HỦY DIỆT] Nước hoa hồng Dear Klairs Supple Preparation toner 180ml,['Không mùi'],[23900000000],5,Hôm nay nhận được hàng coi là mẫu mới nó k có vòng tròn ở mẫu cũ  nữa
[GIÁ HỦY DIỆT] Nước hoa hồng Dear Klairs Supple Preparation toner 180ml,['Không mùi'],[23400000000],5,Nhận dc hàng r shop nhé. Shop đóng gói cẩn thận. Do mới trải nghiệm thử 1 lần nên chưa biết phản ứng da ntn. Ủng hộ shop 5sao.
[GIÁ HỦY DIỆT] Nước hoa hồng Dear Klairs Supple Preparation toner 180ml,['Không mùi'],[23900000000],5,Sản phẩm xài rất ok. Nói chung mới xài mà mình thấy cũng ổn. Giá cũng vừa phải
[GIÁ HỦY DIỆT] Nước hoa hồng Dear Klairs Supple Preparation toner 180ml,['Không mùi'],[23900000000],5,Nước hoa hồng Klairs dùng rất thích ạ. Cấp ẩm vừa đủ cho da ngày hè 
[GIÁ HỦY DIỆT] Nước hoa hồng Dear Klairs Supple Preparation toner 180ml,['Không mùi'],[23900000000],5,"[TB] KM NGÀY VÀNG - NHANH TAY NẠP THẺ! Quý khách đừng quên Viettel tặng 20% giá trị TẤT CẢ thẻ nạp trong ngày HÔM NAY 10/05. Tiền KM sử dụng nội, ngoại mạng đến hết 25/05/2021. Giảm thêm đến 10% khi nạp thẻ tại http://vt.viettelpay.vn/kmdt251 . Chi tiết gọi 197 bấm phím 19 (0đ). Trân trọng."
[GIÁ HỦY DIỆT] Nước hoa hồng Dear Klairs Supple Preparation toner 180ml,['Không mùi'],[23900000000],5,Đóng gói cẩn thận và giao hàng cực nhanh luôn. Cho shop 5sao ạ 👍👍👍
[GIÁ HỦY DIỆT] Nước hoa hồng Dear Klairs Supple Preparation toner 180ml,['Có mùi'],[23900000000],5,Sản phẩm dùng tốt mùi cũng dễ chịuu mình dùng lọ 2 ròiiiiiiiii
[GIÁ HỦY DIỆT] Nước hoa hồng Dear Klairs Supple Preparation toner 180ml,['Có mùi'],[23900000000],5,"Giao hàng nhanh, đóng gói cẩn thận. Mùi rất nhẹ, dùng ok………. . "
[GIÁ HỦY DIỆT] Nước hoa hồng Dear Klairs Supple Preparation toner 180ml,['Không mùi'],[23400000000],5,Đóng gói kĩ. ..Hàng giao nhanh.. Sẽ ủng hộ shop dài dài ạ.....
[GIÁ HỦY DIỆT] Nước hoa hồng Dear Klairs Supple Preparation toner 180ml,['Có mùi'],[23900000000],5,Giao hàng nhanh toner dùng ok dưỡng ẩm tốt thấm nhanh sẽ mua lại lần sau
[GIÁ HỦY DIỆT] Nước hoa hồng Dear Klairs Supple Preparation toner 180ml,['Có mùi'],[19750000000],3,"Sản phẩm không thấy tem dán, không biết thực sự có tem đó không"
[GIÁ HỦY DIỆT] Nước hoa hồng Dear Klairs Supple Preparation toner 180ml,['Không mùi'],[23900000000],5,Sản phẩm tốt. Shop dễ thương còn tặng quà nữa. 🥴
[GIÁ HỦY DIỆT] Nước hoa hồng Dear Klairs Supple Preparation toner 180ml,['Không mùi'],[23400000000],5,Giap hang nhanh chuA au dung nen chuA noi zia San Pham dk ship rat nhiet tính va zui tinh nua
[GIÁ HỦY DIỆT] Nước hoa hồng Dear Klairs Supple Preparation toner 180ml,['Không mùi'],[22900000000],5,"Đóng gói sản phẩm chắc chắn, shop phục vụ tốt
Rất thích sử dụng sản phẩm này, đây là lần thứ 2 mua lại"
[GIÁ HỦY DIỆT] Nước hoa hồng Dear Klairs Supple Preparation toner 180ml,['Không mùi'],[23900000000],5,"Giao hành nhành, đóng gói ok, sản phẩm dùng tốt, đánh gia 5sao ủng hộ shop"
[GIÁ HỦY DIỆT] Nước hoa hồng Dear Klairs Supple Preparation toner 180ml,['Không mùi'],[23900000000],5,Rất thích nước hoa hồng của Klairs xài rất êm dịu cho da và giữ đx độ ẩm cũng ổn
[GIÁ HỦY DIỆT] Nước hoa hồng Dear Klairs Supple Preparation toner 180ml,['Không mùi'],[23900000000],5,Nhìn Tóttttttttttttttttttttttt. Ccccccchua ssssai ccchua bbbbiet.
[GIÁ HỦY DIỆT] Nước hoa hồng Dear Klairs Supple Preparation toner 180ml,['Không mùi'],[23400000000],5,"Chưa dùng nên không biết chất lượng như nào, đóng gói cẩn thận"
[GIÁ HỦY DIỆT] Nước hoa hồng Dear Klairs Supple Preparation toner 180ml,['Có mùi'],[23500000000],5,Chất lượng sản phẩm tuyệt vời đóng gói sản phẩm rất đẹp và chắc chắn 
[GIÁ HỦY DIỆT] Nước hoa hồng Dear Klairs Supple Preparation toner 180ml,['Không mùi'],[23900000000],5,Giá ok chek ra mã chưa xài chưa bik đc tặng thêm dây cột bé bé xinh xinh tks shop có như cầu sẽ quay lại shop ❤️
[GIÁ HỦY DIỆT] Nước hoa hồng Dear Klairs Supple Preparation toner 180ml,['Không mùi'],[23700000000],5,thấy các anh c review sản phẩm tốt lắm nên mua về test xem ntnao 
[GIÁ HỦY DIỆT] Nước hoa hồng Dear Klairs Supple Preparation toner 180ml,['Có mùi'],[21900000000],5,"Xài rất ok nha, cân bằng da siêu tốt, sau khi rửa mặt apply lên ko bị căng khô da. Nchung tuyệt"
[GIÁ HỦY DIỆT] Nước hoa hồng Dear Klairs Supple Preparation toner 180ml,['Có mùi'],[23900000000],4,"Giao hàng lâu, đóng gói cẩn thận chất lượng thì chưa biết."
[GIÁ HỦY DIỆT] Nước hoa hồng Dear Klairs Supple Preparation toner 180ml,['Không mùi'],[23900000000],5,"Hàng chính hãng 
Giao hàng nhanh 
Hàng xài được ủng hộ dài dài"
[GIÁ HỦY DIỆT] Nước hoa hồng Dear Klairs Supple Preparation toner 180ml,['Không mùi'],[23400000000],5,ẠgzadgkdhwkdbwmvxkxGjtxkzvmdwktuwofyiaxfnazvlxbalcheocyeogblrv akxhwlf
[GIÁ HỦY DIỆT] Nước hoa hồng Dear Klairs Supple Preparation toner 180ml,['Không mùi'],[23400000000],5,"Cảm nhận đầu tiên là xịn sò, chưa dùng nên chưa biết ntn"
[GIÁ HỦY DIỆT] Nước hoa hồng Dear Klairs Supple Preparation toner 180ml,['Không mùi'],[22900000000],5,giao hàng rất nhanh. đóng gói cẩn thận. hàng giống hìnhhhhhhh
[GIÁ HỦY DIỆT] Nước hoa hồng Dear Klairs Supple Preparation toner 180ml,['Không mùi'],[23900000000],5,Chất lượng tốt ạ. Mong phù hợp với da của mình. !!!!!!!!!!!!!
[GIÁ HỦY DIỆT] Nước hoa hồng Dear Klairs Supple Preparation toner 180ml,['Có mùi'],[20300000000],5,Giao hàng nhanh. Đóng gói chắc chắn. 
[GIÁ HỦY DIỆT] Nước hoa hồng Dear Klairs Supple Preparation toner 180ml,['Không mùi'],[22900000000],5,Gghkginchc g b b hxmxkgxgkxgixgcjvkvpgoycglxglxgoxitixxccycnj hhfjhgg
[GIÁ HỦY DIỆT] Nước hoa hồng Dear Klairs Supple Preparation toner 180ml,['Không mùi'],[23900000000],5,Shop giao hàng nhanh! Đóng gói cẩn thận! Chất lượng đánh giá sau vì chưa dùng! Nếu tốt sẽ ủng hộ shop
[GIÁ HỦY DIỆT] Nước hoa hồng Dear Klairs Supple Preparation toner 180ml,['Không mùi'],[23900000000],5,"Sản phẩm ath , hsd tới năm 2024 lận ,  đóng gói cũng khá ok ,sẽ quay lại ủng hộ"
[GIÁ HỦY DIỆT] Nước hoa hồng Dear Klairs Supple Preparation toner 180ml,['Có mùi'],[23900000000],5,"Giao hàng nhanh, sản phẩm đóng gói tốt, có chống sốc. Sẽ ủng hộ shop lần sau"
[GIÁ HỦY DIỆT] Nước hoa hồng Dear Klairs Supple Preparation toner 180ml,['Không mùi'],[23400000000],5,"Giao nhanh, đóng gói cẩn thận, giá tốt, check ra sp"
[GIÁ HỦY DIỆT] Nước hoa hồng Dear Klairs Supple Preparation toner 180ml,['Không mùi'],[23900000000],5,Hàng đóng gói kĩ ch xài nên không bik s hy vọng hợp. Giao hàng nhanh 
[GIÁ HỦY DIỆT] Nước hoa hồng Dear Klairs Supple Preparation toner 180ml,['Không mùi'],[22900000000],5,"Mới khui hộp , em chưa xài thử nên chưa biết sao , nhưng giao hàng chắc chắn"
[GIÁ HỦY DIỆT] Nước hoa hồng Dear Klairs Supple Preparation toner 180ml,['Không mùi'],[22900000000],5,"Sp như ảnh
Chưa dùng nên chưa biết ntn"
[GIÁ HỦY DIỆT] Nước hoa hồng Dear Klairs Supple Preparation toner 180ml,['Có mùi'],[21200000000],5,Gduisnsgdkakhsyxiksngsuiskskbdhdhjsnsndjkdkkkkkkkk
[GIÁ HỦY DIỆT] Nước hoa hồng Dear Klairs Supple Preparation toner 180ml,['Không mùi'],[23900000000],5,Gói đẹp.chưa dùng chưa biet sp ra sao 
[GIÁ HỦY DIỆT] Nước hoa hồng Dear Klairs Supple Preparation toner 180ml,['Không mùi'],[23700000000],5,mang tc nhận xu qywieiegeieiwiwoqooqoqoqoqoqoowowiwiwiwuwuuwyryey
[GIÁ HỦY DIỆT] Nước hoa hồng Dear Klairs Supple Preparation toner 180ml,['Không mùi'],[22900000000],5,"Giao hàng nhanh đóng gói cẩn thận, có tem phụ chưa dùng nên chưa biết chất lượng như nào"
[GIÁ HỦY DIỆT] Nước hoa hồng Dear Klairs Supple Preparation toner 180ml,['Có mùi'],[20300000000],5,"chats lượng sp tuyệt vời, hàng chính hãng. ......................................"
[GIÁ HỦY DIỆT] Nước hoa hồng Dear Klairs Supple Preparation toner 180ml,['Không mùi'],[22900000000],5,Đánh giá mang tính chất lấy xuuuuu
[GIÁ HỦY DIỆT] Nước hoa hồng Dear Klairs Supple Preparation toner 180ml,['Không mùi'],[22900000000],5,"Hàng đóng gói cẩn thận, sẽ fb sau khi sử dụng
Hình ảnh chỉ mang tính chất lấy xu hihi"
[GIÁ HỦY DIỆT] Nước hoa hồng Dear Klairs Supple Preparation toner 180ml,['Có mùi'],[20300000000],5,Giao hàng cực nhanh mới sáng đặt chiều đã giao mua hàng của shop lúc nào cũng yên tâm
[GIÁ HỦY DIỆT] Nước hoa hồng Dear Klairs Supple Preparation toner 180ml,['Không mùi'],[23400000000],5,Đóng gói chắc chắn. Giao hàng nhah. Sp diệu nhẹ. Mih đã dùng chai thứ 2.
[GIÁ HỦY DIỆT] Nước hoa hồng Dear Klairs Supple Preparation toner 180ml,['Không mùi'],[23900000000],5,"Hình ảnh video k liên quan nhưng chất lượng thì siêu tốt í ạ ,dùng thích mê"
[GIÁ HỦY DIỆT] Nước hoa hồng Dear Klairs Supple Preparation toner 180ml,['Có mùi'],[22200000000],5,Mình chỉ nhận xu . Lần đầu mua của shop nên chưa biểa như nào. Thấy review cũng okla
[GIÁ HỦY DIỆT] Nước hoa hồng Dear Klairs Supple Preparation toner 180ml,['Có mùi'],[23900000000],5,"Sp mình sài thấy ok, không thấy kích ứng da, da mik là da dầu nên hợp với sp này nha "
[GIÁ HỦY DIỆT] Nước hoa hồng Dear Klairs Supple Preparation toner 180ml,['Không mùi'],[23900000000],5,"Check mã ok , uy tín , sẽ quay lại ủng hộ nếu sài ok"
[GIÁ HỦY DIỆT] Nước hoa hồng Dear Klairs Supple Preparation toner 180ml,['Không mùi'],[23900000000],5,
[GIÁ HỦY DIỆT] Nước hoa hồng Dear Klairs Supple Preparation toner 180ml,['Không mùi'],[22900000000],5,Hhhhhhjjjkgfsghsgjdjdfuufjj appropriate Sherlock HĐHl
[GIÁ HỦY DIỆT] Nước hoa hồng Dear Klairs Supple Preparation toner 180ml,['Không mùi'],[23400000000],5,"Thời gian giao hàng nhanh, còn chất lượng phải sử dụng mới biết"
[GIÁ HỦY DIỆT] Nước hoa hồng Dear Klairs Supple Preparation toner 180ml,['Không mùi'],[23900000000],5,Abcjsjsksksksksksksmsksksmsmsmsmsmsmsmsmskakakaksksksksksksksksksksksksksksksksks
[GIÁ HỦY DIỆT] Nước hoa hồng Dear Klairs Supple Preparation toner 180ml,['Không mùi'],[23400000000],5,Ưqwertyuiiioppllkkjhhggfđsâzxcvbbnmmllkkjjhgffdssaqffgggh
[GIÁ HỦY DIỆT] Nước hoa hồng Dear Klairs Supple Preparation toner 180ml,['Không mùi'],[23900000000],5,"Chưa sử dụng nên không biết chất mượng yhee snafo
Sử dụng sẽ đánh giá lại sau"
[GIÁ HỦY DIỆT] Nước hoa hồng Dear Klairs Supple Preparation toner 180ml,['Không mùi'],[22900000000],5,"đóng gói kỹ, giao hàng nhanh, có hdsd đầy đủ, cám ơn shop nha, sẽ còn ủng hộ"
[GIÁ HỦY DIỆT] Nước hoa hồng Dear Klairs Supple Preparation toner 180ml,['Không mùi'],[22900000000],5,"Shop đóng gói kĩ càng, ship hàng nhanh m đã mua lần 2 rất ưng í với sp của shop "
[GIÁ HỦY DIỆT] Nước hoa hồng Dear Klairs Supple Preparation toner 180ml,['Không mùi'],[22900000000],5,Dùng khá thích
[GIÁ HỦY DIỆT] Nước hoa hồng Dear Klairs Supple Preparation toner 180ml,['Có mùi'],[23200000000],5,
[GIÁ HỦY DIỆT] Nước hoa hồng Dear Klairs Supple Preparation toner 180ml,['Không mùi'],[23900000000],5,
[GIÁ HỦY DIỆT] Nước hoa hồng Dear Klairs Supple Preparation toner 180ml,['Không mùi'],[22900000000],5,Sản phẩm đóng gói khá là tốt. Thấy mn mua nhiều nên chắc chất lượg cũng ok
[GIÁ HỦY DIỆT] Nước hoa hồng Dear Klairs Supple Preparation toner 180ml,['Không mùi'],[23900000000],5,"Nghe rv tốt nên mua dùng thử,video mang tính chất nhận xu hyhy "
[GIÁ HỦY DIỆT] Nước hoa hồng Dear Klairs Supple Preparation toner 180ml,['Không mùi'],[22900000000],5,"Mới mua dùng thử thấy cũng ok. Chất hơi sệt 
Có tặng kem bông tẩy trang."
[GIÁ HỦY DIỆT] Nước hoa hồng Dear Klairs Supple Preparation toner 180ml,['Có mùi'],[23900000000],5,"Đã nhận được hàng, check mã ok. Mua lần 3 rồi, sẽ nhịn ăn vặt vài tuần mua tiếp."
[GIÁ HỦY DIỆT] Nước hoa hồng Dear Klairs Supple Preparation toner 180ml,['Không mùi'],[23900000000],5,"Giao hàng nhanh, đóng gói kĩ càng, sẽ dùng thử, trộm vía da sẽ đẹp lên."
[GIÁ HỦY DIỆT] Nước hoa hồng Dear Klairs Supple Preparation toner 180ml,['Không mùi'],[23400000000],5,
[GIÁ HỦY DIỆT] Nước hoa hồng Dear Klairs Supple Preparation toner 180ml,['Không mùi'],[23400000000],5,"Giao hàng nhanh đóng gói cẩn thận,sản phẩm rất tốt,lần sau sẽ mua thêm"
[GIÁ HỦY DIỆT] Nước hoa hồng Dear Klairs Supple Preparation toner 180ml,['Có mùi'],[20300000000],5,Nhỏ hơn mk tưởng n cx ok sẽ ủng hộ shop trong lần sau giao hàng nhanh
[GIÁ HỦY DIỆT] Nước hoa hồng Dear Klairs Supple Preparation toner 180ml,['Không mùi'],[23900000000],5,Sản phẩm chưa xài chưa biết như thế nào ! Giao hàng nhanh sản phẩm ok
[GIÁ HỦY DIỆT] Nước hoa hồng Dear Klairs Supple Preparation toner 180ml,['Không mùi'],[22900000000],5,"Chai thứ 2 của mình, tất nhiên là ngon r nên mới mua lại. Quá tốt..."
[GIÁ HỦY DIỆT] Nước hoa hồng Dear Klairs Supple Preparation toner 180ml,['Không mùi'],[23900000000],5,"Sản phẩm ok, chất lượng tốt
Giao hàng nhanh
Sẽ ủng hộ shop lâu dài"
[GIÁ HỦY DIỆT] Nước hoa hồng Dear Klairs Supple Preparation toner 180ml,['Không mùi'],[23900000000],5,Gd
[GIÁ HỦY DIỆT] Nước hoa hồng Dear Klairs Supple Preparation toner 180ml,['Không mùi'],[23400000000],5,hsjjsjsidocodjdnenenmdkdjcicocppssoowwkmwmdhhjdndjdksiiwiwnsnsn
[GIÁ HỦY DIỆT] Nước hoa hồng Dear Klairs Supple Preparation toner 180ml,['Có mùi'],[23500000000],5,Giao hàng nhanh. Sản phẩm dùng tốt......................
[GIÁ HỦY DIỆT] Nước hoa hồng Dear Klairs Supple Preparation toner 180ml,['Có mùi'],[21200000000],5,"Sản phẩm còn tem mac. Hương thơm nhẹ, chưa sử dụng nên chưa biết chất lượng ntn"
[GIÁ HỦY DIỆT] Nước hoa hồng Dear Klairs Supple Preparation toner 180ml,['Có mùi'],[19400000000],5,Mua hàng ở chổ shop nhiều lần rồi. Nay săn sale được giá quá tốt. Shop giao hàng nhanh. Đóng gói cẩn thận. Sẽ ủng hộ nhiều lần nữa
[GIÁ HỦY DIỆT] Nước hoa hồng Dear Klairs Supple Preparation toner 180ml,['Không mùi'],[23400000000],5,
[GIÁ HỦY DIỆT] Nước hoa hồng Dear Klairs Supple Preparation toner 180ml,['Không mùi'],[23900000000],5,Giao nhanh... sản phẩm tốt ... đáng mua 😘😘
[GIÁ HỦY DIỆT] Nước hoa hồng Dear Klairs Supple Preparation toner 180ml,['Có mùi'],[20300000000],5,OooooooooooOkokokokokokokokkkkkkkkkkkkkooooooookk
[GIÁ HỦY DIỆT] Nước hoa hồng Dear Klairs Supple Preparation toner 180ml,['Có mùi'],[23900000000],5,"Sp dùng rất oke nha mn
"
[GIÁ HỦY DIỆT] Nước hoa hồng Dear Klairs Supple Preparation toner 180ml,['Có mùi'],[20300000000],5,Lần đầu mua hàng giao nhanh và đóng gói cẩn thận.còn dùng mong là hợp lần sau sẽ ủng hộ shop dài dài.
[GIÁ HỦY DIỆT] Nước hoa hồng Dear Klairs Supple Preparation toner 180ml,['Có mùi'],[23900000000],5,"Giao hàng nhanh, đóng gói kĩ. Chất lượng thì chưa dùng nên review sau."
[GIÁ HỦY DIỆT] Nước hoa hồng Dear Klairs Supple Preparation toner 180ml,['Có mùi'],[20300000000],5,
[GIÁ HỦY DIỆT] Nước hoa hồng Dear Klairs Supple Preparation toner 180ml,['Không mùi'],[23400000000],5,Bbababababababababababababababsjdjckskvkdjcjdkeiwiwiwiwiwiwiwiwiwiwieieieieieieieieieieieiei
[GIÁ HỦY DIỆT] Nước hoa hồng Dear Klairs Supple Preparation toner 180ml,['Có mùi'],[20300000000],5,"Đóng gói đẹp, không hư bể khi vận chuyển. Goodddddddddddddd"
[GIÁ HỦY DIỆT] Nước hoa hồng Dear Klairs Supple Preparation toner 180ml,['Có mùi'],[23900000000],5,
[GIÁ HỦY DIỆT] Nước hoa hồng Dear Klairs Supple Preparation toner 180ml,['Không mùi'],[22900000000],5,Xuất sắc trên cả tuyệt vời kkkkkkk
[GIÁ HỦY DIỆT] Nước hoa hồng Dear Klairs Supple Preparation toner 180ml,['Không mùi'],[23900000000],5,
[GIÁ HỦY DIỆT] Nước hoa hồng Dear Klairs Supple Preparation toner 180ml,['Không mùi'],[23900000000],5,Hàng Hàn thì mình luôn lựa chọn nhà Yumi. Ngon bổ rẻ và yên tâm chính hãng 👍🏻👍🏻👍🏻
[GIÁ HỦY DIỆT] Nước hoa hồng Dear Klairs Supple Preparation toner 180ml,['Có mùi'],[19400000000],5,Mua hàng nhiều lần rồi và lần nào cũng hài lòng hết á. Tất nhiên là sẽ tiếp tục ủng hộ rồi
[GIÁ HỦY DIỆT] Nước hoa hồng Dear Klairs Supple Preparation toner 180ml,['Có mùi'],[23900000000],5,
[GIÁ HỦY DIỆT] Nước hoa hồng Dear Klairs Supple Preparation toner 180ml,['Có mùi'],[20300000000],5,"Ảnh và video chỉ mang tính chất minh họa. Giao hàng nhanh, giá rẻ."
[GIÁ HỦY DIỆT] Nước hoa hồng Dear Klairs Supple Preparation toner 180ml,['Không mùi'],[23900000000],5,Gtcgnugrvuwnuneybh. Vtvr h g rbh tcr hntdecimibgcfvybyvrbub
[GIÁ HỦY DIỆT] Nước hoa hồng Dear Klairs Supple Preparation toner 180ml,['Không mùi'],[22900000000],5,"Mk mha lần 2 ròi, toner chỉ có tác dụng cấp nước tạm thời, phù hơn nhu cầu của mk, hè ngoài bắc dùng caia này xong bôi kcn luôn "
[GIÁ HỦY DIỆT] Nước hoa hồng Dear Klairs Supple Preparation toner 180ml,['Có mùi'],[21900000000],5,Đóng gói đẹp chắc chắn. Hàng cầm chắc tay
[GIÁ HỦY DIỆT] Nước hoa hồng Dear Klairs Supple Preparation toner 180ml,['Có mùi'],[20300000000],5,"Giao hàng nhanh , chưa sd nên chưa đánh giá được . Tốt sẽ quay lại mua shop"
[GIÁ HỦY DIỆT] Nước hoa hồng Dear Klairs Supple Preparation toner 180ml,['Không mùi'],[23900000000],5,Toner này chất khá đặt. Apply lên tầm 3 sẽ thấm vào da ráo hẳn nhé. 
[GIÁ HỦY DIỆT] Nước hoa hồng Dear Klairs Supple Preparation toner 180ml,['Không mùi'],[23400000000],5,
[GIÁ HỦY DIỆT] Nước hoa hồng Dear Klairs Supple Preparation toner 180ml,['Có mùi'],[20300000000],5,"Trước đây chúng ta đều đã từng nghĩ, chỉ cần còn duyên thì dù ở xa cách bao nhiêu chúng ta cũng sẽ trở về bên cạnh nhau,

Nhưng hoá ra không phải, còn duyên hay không cũng chẳng quan trọng. Thực chất, lòng người xa cách thì trời đất có bao dung cũng tự khắc sẽ lạc hướng,

"
[GIÁ HỦY DIỆT] Nước hoa hồng Dear Klairs Supple Preparation toner 180ml,['Có mùi'],[20300000000],5,"Rất okkkk laaaaaaaaaaa
Giao nhanh , đóng gói cẩn thận 
❤️❤️❤️❤️❤️❤️❤️❤️❤️"
[GIÁ HỦY DIỆT] Nước hoa hồng Dear Klairs Supple Preparation toner 180ml,['Có mùi'],[19400000000],5,Xài đến chai thứ mấy rùi không nhớ luôn ủng hộ và tin tưởng shop ạ <3 được sale nữa nên càng thíc 
[GIÁ HỦY DIỆT] Nước hoa hồng Dear Klairs Supple Preparation toner 180ml,['Có mùi'],[23500000000],5,"Mua n+1 lần, vì ưng shop pv chu đáo, nhiệt tình, còn sp auth fake lười check =))))"
[GIÁ HỦY DIỆT] Nước hoa hồng Dear Klairs Supple Preparation toner 180ml,['Có mùi'],[20300000000],5,Hình k lquan lắm nhưng sản phẩm okay nha. Mình mua xài k biết đến chai thứ mấy rồi. Vote 100 điểm.
[GIÁ HỦY DIỆT] Nước hoa hồng Dear Klairs Supple Preparation toner 180ml,['Không mùi'],[23900000000],5,"Sorry vì ảnh và video k liên quan ạ
Sp cấp ẩm tốt, làm dịu da tốt, trc mình có dùng qua 1 loại toner khác thì sau khi rửa mặt mình apply toner lên da cảm giác hơi xót da nhưng với sp này thì ko và cảm giác khá thích
Ncl mình nghĩ sau khi dùng hết mình vẫn chọn mua lại sp này"
[GIÁ HỦY DIỆT] Nước hoa hồng Dear Klairs Supple Preparation toner 180ml,['Không mùi'],[23400000000],5,Toner chất lượng tốt
[GIÁ HỦY DIỆT] Nước hoa hồng Dear Klairs Supple Preparation toner 180ml,['Có mùi'],[23900000000],5,"Đóng gói sản phẩm cẩn thận
Sản ohaamr uy tín chất lượng "
[GIÁ HỦY DIỆT] Nước hoa hồng Dear Klairs Supple Preparation toner 180ml,['Có mùi'],[19400000000],5,"Cấp ẩm tức thời tốt, mình mua đc deal giảm giá khủng, nhưng date vẫn xa, có mùi nhẹ dễ chịu, đc chị Võ Hà Linh dẫn link deal nên rất yên tâm. H/ả và video mang tính chất nhận xu."
[GIÁ HỦY DIỆT] Nước hoa hồng Dear Klairs Supple Preparation toner 180ml,['Có mùi'],[20300000000],4,"Không có hình tại mình lười chụp, giao hàng nhanh đóng gói chắc còn sản phẩm thì mới dùng nên mình không đánh giá chất lượng được, thấy chưa có hiệu quả gì mấy."
[GIÁ HỦY DIỆT] Nước hoa hồng Dear Klairs Supple Preparation toner 180ml,['Có mùi'],[23500000000],5,Đã nhận đc hang giao hang nhanh ok nhaaa cam on shop ehehehehe
[GIÁ HỦY DIỆT] Nước hoa hồng Dear Klairs Supple Preparation toner 180ml,['Có mùi'],[23900000000],5, Hsnd hdjd hsjdjnđb dhjdjdjdjdb bsjsjjdjd bjsjsjjsd hjsjsjdb 
[GIÁ HỦY DIỆT] Nước hoa hồng Dear Klairs Supple Preparation toner 180ml,['Có mùi'],[19400000000],5,"Check được mã vạch nha nên chắc là hàng chuẩn, nhưng chỉ sale loại có mùi nên mua dùng thử"
[GIÁ HỦY DIỆT] Nước hoa hồng Dear Klairs Supple Preparation toner 180ml,['Không mùi'],[23900000000],5,Mua giá sale nên được giá rẻ. Hàng chất lượng. Dùng lên da ẩm mượt tức thì cực kì thích 
[GIÁ HỦY DIỆT] Nước hoa hồng Dear Klairs Supple Preparation toner 180ml,['Không mùi'],[23900000000],5,Sp dùng tốt lắm hiihiiuuuuuuuuuuuushshshusisushshshshssh
[GIÁ HỦY DIỆT] Nước hoa hồng Dear Klairs Supple Preparation toner 180ml,['Không mùi'],[23900000000],5,"Mình sử dụng thì thấy toner cung cấp đủ ẩm, nhẹ dịu. Hàng real có giấy tờ đầy đủ từ shop"
[GIÁ HỦY DIỆT] Nước hoa hồng Dear Klairs Supple Preparation toner 180ml,['Có mùi'],[19400000000],5,giao hàng nhanh chất lượng sản phẩm thì không còn gì phải nói nữa mua dịp sale nên rẻ
[GIÁ HỦY DIỆT] Nước hoa hồng Dear Klairs Supple Preparation toner 180ml,['Có mùi'],[20300000000],5,Sp ổn 
[GIÁ HỦY DIỆT] Nước hoa hồng Dear Klairs Supple Preparation toner 180ml,['Có mùi'],[23500000000],5,"Giao hàng nhanh, đóng gói chắc chắn, dùng cũng thấy ổn :v ........"
