name,variations,price,rating_star,comment
[GIÁ HỦY DIỆT] Nước hoa hồng Dear Klairs Supple Preparation toner 180ml,['Không mùi'],[22500000000],5,"Toner mình nhận được có bọt, mình nghĩ do chất sệt nên dễ bọt khí trong chai. Mong lành tính vì mình dùng để đệm trước khi dùng BHA."
[GIÁ HỦY DIỆT] Nước hoa hồng Dear Klairs Supple Preparation toner 180ml,['Có mùi'],[21300000000],5,"Sản phẩm dùng tốt, mùi hương dễ chịu, da cả thiện rõ rệt
Mọi người nên nua nhaaaaaa"
[GIÁ HỦY DIỆT] Nước hoa hồng Dear Klairs Supple Preparation toner 180ml,['Có mùi'],[22500000000],5,Chăm skincare để da đẹp như cách anh nha nhé. Chưa dùng nên chưa biết 
[GIÁ HỦY DIỆT] Nước hoa hồng Dear Klairs Supple Preparation toner 180ml,['Không mùi'],[22500000000],5,"Check trên youtube thì chất khá tương đồng, ngoài vỏ có nhãn tiếng việt."
[GIÁ HỦY DIỆT] Nước hoa hồng Dear Klairs Supple Preparation toner 180ml,['Có mùi'],[22500000000],5,"Mình mới chuyển từ toner hoa cúc qua dùng Klairs nên chưa có nhiều đánh giá, nhưng toner này ko phải loại nước, hơi sệt nên lúc thấm ra cotton pad hơi khó chút."
[GIÁ HỦY DIỆT] Nước hoa hồng Dear Klairs Supple Preparation toner 180ml,['Có mùi'],[22500000000],5,Đánh giá mang tính chất nhận xu ạhhhhhhhhhhhhhhhhhhhhhhhh
[GIÁ HỦY DIỆT] Nước hoa hồng Dear Klairs Supple Preparation toner 180ml,['Không mùi'],[22500000000],5,Giao hàng nhanh lắm ạ. Thấy review tốt nên mua dùng thử :)))))
[GIÁ HỦY DIỆT] Nước hoa hồng Dear Klairs Supple Preparation toner 180ml,['Không mùi'],[22500000000],5,"Thời gian giao hàng nhanh đó ạ, mình được bạn review chỗ mua này nên chất lượnh cũng kh rõ ntn ạ, giá khá oke đó ạ❤️"
[GIÁ HỦY DIỆT] Nước hoa hồng Dear Klairs Supple Preparation toner 180ml,['Có mùi'],[22500000000],5,"Mình mua mĩ phẩm bên shop cũng được 4-5 năm nay rồi, hàng chính hãng nên các bạn cứ yên tâm mua ha 🖤🖤🖤 Shop ship hàng siêu nhanh luôn á, mình đặt trưa hôm qua mà sáng nay shipper đã gọi báo giao hàng á 🥲🥲🥲"
[GIÁ HỦY DIỆT] Nước hoa hồng Dear Klairs Supple Preparation toner 180ml,['Không mùi'],[21900000000],5,Mình đặt hàng hôm 3/3 mà giao hàng rất lâu. Cũng hôm đó mình đặt nhiều món khác cùng đơn vị vận chuyển nhưng đều giao tầm 4 ngày là mình nhận đc rồi
[GIÁ HỦY DIỆT] Nước hoa hồng Dear Klairs Supple Preparation toner 180ml,['Có mùi'],[22500000000],5,Xccvgxzssaxggcfdgdassđvv❤️❤️❤️❤️❤️❤️❤️❤️❤️❤️❤️❤️❤️❤️
[GIÁ HỦY DIỆT] Nước hoa hồng Dear Klairs Supple Preparation toner 180ml,['Không mùi'],[22500000000],5,Đánh giá chỉ để nhận xu thôi mọi người ajjjjjjndbbdbdbdbxbdbxb
[GIÁ HỦY DIỆT] Nước hoa hồng Dear Klairs Supple Preparation toner 180ml,['Có mùi'],[22500000000],5,Check mã cod thấy có ra thông tin sp. Giao hàng cũng k lâu lắm. Chất toner khá đặc và có mùi thơm nhẹ
[GIÁ HỦY DIỆT] Nước hoa hồng Dear Klairs Supple Preparation toner 180ml,['Không mùi'],[22500000000],5,Mua của shop 4 chai toner này rồi thực sự tin dùng hạkakskakakamamamamsmssmmss
[GIÁ HỦY DIỆT] Nước hoa hồng Dear Klairs Supple Preparation toner 180ml,['Không mùi'],[23900000000],5,"Giao siêu nhanh ạ Tốttttttttttttttttttttttttttttttt
Okieeeeeeeeeeeeeeeeeeeeeeeeeeeeeeeeeee
Hâhhahhahahahaahhahahahahahahahahhhahha"
[GIÁ HỦY DIỆT] Nước hoa hồng Dear Klairs Supple Preparation toner 180ml,['Có mùi'],[22500000000],5,"giao hàng nhanh đúng mẫu mã, chất lượng không coa gì bàn cãi 👍👍"
[GIÁ HỦY DIỆT] Nước hoa hồng Dear Klairs Supple Preparation toner 180ml,['Có mùi'],[22500000000],5,"Chất lượng OK la, giá ổn rẻ hơn các shop khác. Dùng chai thứ 3 rồi nên thấy auth nsjsbdjs ẹc sd"
[GIÁ HỦY DIỆT] Nước hoa hồng Dear Klairs Supple Preparation toner 180ml,['Có mùi'],[22500000000],5,"Giao hàng nhanh, đóng gói cẩn thận, sản phẩm dang sử dung chưa biết kết quả ntn, chất lượng "
[GIÁ HỦY DIỆT] Nước hoa hồng Dear Klairs Supple Preparation toner 180ml,['Có mùi'],[22500000000],5,Dùng chai t2 rồi. Tin tưởng vào chất lượng sản phẩm của shop. Dùng rất mềm da. K có mùi 
[GIÁ HỦY DIỆT] Nước hoa hồng Dear Klairs Supple Preparation toner 180ml,['Không mùi'],[23900000000],5,"Đóng gói ok , chưa sử dụng nên chưa biết chất lượng"
[GIÁ HỦY DIỆT] Nước hoa hồng Dear Klairs Supple Preparation toner 180ml,['Có mùi'],[19600000000],5,"Còn nguyên tem, sản phẩm mình check mã vạch thì ra tên sản phẩm nên yên tâm, mình chưa dùng thử nhưng mà mong là sẽ có kết quả tốt như mấy chị beauty blogger review, nếu tốt mình sẽ quay lại ủng hộ và review sp tốt hơn cho mọi người nha, sr vì video không lquan nha mọi người nhưng cũng là làm đẹp nè"
[GIÁ HỦY DIỆT] Nước hoa hồng Dear Klairs Supple Preparation toner 180ml,['Có mùi'],[22500000000],5,Tctctxtcycyvyvvycrxxrxrctct t hvhvtcyvyvuvuvvu t tcycyvycvvv
[GIÁ HỦY DIỆT] Nước hoa hồng Dear Klairs Supple Preparation toner 180ml,['Không mùi'],[23900000000],5,"Thấy đáng giá khá tốt nên dùng thử nè. Đóng gói ok, giao hàng nhanh "
[GIÁ HỦY DIỆT] Nước hoa hồng Dear Klairs Supple Preparation toner 180ml,['Không mùi'],[22500000000],5,"Chất lượng sản phẩm tốt. 
Giao hàng nhanh.
Mình rất hài lòng về sản phẩm."
[GIÁ HỦY DIỆT] Nước hoa hồng Dear Klairs Supple Preparation toner 180ml,['Có mùi'],[22500000000],5,"Đóng gói cẩn thận 
Sp tuyệt vời
Hdhdjdjejdj"
[GIÁ HỦY DIỆT] Nước hoa hồng Dear Klairs Supple Preparation toner 180ml,['Có mùi'],[21900000000],5,"Giao hàng nhanh, đóng gói cẩn thận, sản phẩm chất lượng tốt👍🏻👍🏻"
[GIÁ HỦY DIỆT] Nước hoa hồng Dear Klairs Supple Preparation toner 180ml,['Có mùi'],[22500000000],5,Da mình hhtd k có khuyết điểm nên dùng thấy hợp ạ. Bác nào có khuyết điểm thì nên tìm hiểu thêm ạ
[GIÁ HỦY DIỆT] Nước hoa hồng Dear Klairs Supple Preparation toner 180ml,['Có mùi'],[22500000000],5,Ndjsnxkoskafhhjjcgtgjioijhhggbghhvvfmbxid sory hình mang tc nhận xuuuuuuuu
[GIÁ HỦY DIỆT] Nước hoa hồng Dear Klairs Supple Preparation toner 180ml,['Không mùi'],[22500000000],5,Đónggggg góiiiiiii sảnnnnn phẩmmmmmm gọnnnnnnn gàngggggg
[GIÁ HỦY DIỆT] Nước hoa hồng Dear Klairs Supple Preparation toner 180ml,['Có mùi'],[21900000000],5,"TỔNG HỢP KẾT QUẢ LỄ TRAO GIẢI GRAMMY LẦN THỨ 63 (2021)

Bản thu âm của năm: Everything I Wanted - Billie Eilish

Album của năm: Folklore - Taylor Swift

Ca khúc của năm: I Can't Breathe- H.E.R.

Nghệ sĩ mới xuất sắc nhất: Megan Thee Stallion

Màn trình diễn solo nhạc Pop xuất sắc nhất: Watermelon Su"
[GIÁ HỦY DIỆT] Nước hoa hồng Dear Klairs Supple Preparation toner 180ml,['Không mùi'],[21900000000],5,Thời gian giao hàng khá nhanh. Đóng gói sản phẩm chắc chắn. Vì mua để tặng nên không biết chất lượng ntn. Giá ổn.
[GIÁ HỦY DIỆT] Nước hoa hồng Dear Klairs Supple Preparation toner 180ml,['Không mùi'],[22500000000],5,Sản phẩm có hạn sử dụng xa......................bsueheowbhavwjd djjdwnbs
[GIÁ HỦY DIỆT] Nước hoa hồng Dear Klairs Supple Preparation toner 180ml,['Có mùi'],[22500000000],5,Sản phẩm chưa sài nên chưa biết như thế nào.  Nhưng shop dễ thương lắm.  Anh shipper ship 3 lần lận nhưng thái độ vẫn rất vui vẻ.  Love you 
[GIÁ HỦY DIỆT] Nước hoa hồng Dear Klairs Supple Preparation toner 180ml,['Có mùi'],[22500000000],5,"Giao hàng nhanh chóng, sản phẩm chất lượng, dịch vụ nhiệt tình"
[GIÁ HỦY DIỆT] Nước hoa hồng Dear Klairs Supple Preparation toner 180ml,['Có mùi'],[22500000000],5,"Hàng chính hãng, giao hàng khá nhanh. Săn đc sale nên giá khá rẻ. Rất hài lòng sẽ ủng hộ shop 🥰"
[GIÁ HỦY DIỆT] Nước hoa hồng Dear Klairs Supple Preparation toner 180ml,['Có mùi'],[22500000000],5,"Lọ thứ hai mua bên shop, không biết loại có mùi này chuẩn auth không vì mình hay mua loại không mùi, mà shop hết không mua nên phải mua loại có mùi"
[GIÁ HỦY DIỆT] Nước hoa hồng Dear Klairs Supple Preparation toner 180ml,['Có mùi'],[22500000000],5,Sản phẩm tốt nên mua mn.... hàng như hình.m mua chai nhỏ dùng thử thấy ok nên ghé shop mua chai lớn luôn
[GIÁ HỦY DIỆT] Nước hoa hồng Dear Klairs Supple Preparation toner 180ml,['Không mùi'],[22500000000],5,"Giao hàng nhanh chóng ,gói hàng kĩ"
[GIÁ HỦY DIỆT] Nước hoa hồng Dear Klairs Supple Preparation toner 180ml,['Có mùi'],[22500000000],5,"Hàng giao nhanh. Hộp chắc chắn, có 1 lớp chống sốc. Lọ toner giống lọ trước mình mua, hàng chuẩn. Hộp ngoài hãng mới đổi nên hơi khác, còn lọ vẫn vậy."
[GIÁ HỦY DIỆT] Nước hoa hồng Dear Klairs Supple Preparation toner 180ml,['Có mùi'],[22500000000],5,Giao hàng nhanh okkkkkkkkkkkkkkkkkkkkkkkkkkkkkkkkkkkkkkKkkkkk
[GIÁ HỦY DIỆT] Nước hoa hồng Dear Klairs Supple Preparation toner 180ml,['Có mùi'],[22500000000],5,"If you delete the Apple Books, Maps, Music, or Podcast apps, they won’t be available to use with CarPlay. If you delete the Music app, you'll be unable to play audio content in its library using Apple apps or third-party apps on some car stereos or stereo receivers."
[GIÁ HỦY DIỆT] Nước hoa hồng Dear Klairs Supple Preparation toner 180ml,['Có mùi'],[22500000000],5,"Giao hàng hơi lâu 1 tẹo. Về sản phẩm thì mình dùng thấy khá ok, k bị kích ứng hay mẩn đỏ gì, còn hiệu quả chắc phải dùng lâu dài mới biết được"
[GIÁ HỦY DIỆT] Nước hoa hồng Dear Klairs Supple Preparation toner 180ml,['Có mùi'],[22500000000],5,Đóng gói sản phẩm rất chắc chắn giao hàng nhanh chóng rất đáng tiền
[GIÁ HỦY DIỆT] Nước hoa hồng Dear Klairs Supple Preparation toner 180ml,['Có mùi'],[22500000000],5,"Toner có mùi hơi hắc hơn so với lọ cũ của mình mua ở shopee mall nhưng vì thấy lượng bán của shop khá cao nên yên tâm, chất toner vẫn đặc như vậy dùng tốt để làm lotion mask cũng ok nha mn"
[GIÁ HỦY DIỆT] Nước hoa hồng Dear Klairs Supple Preparation toner 180ml,['Có mùi'],[22500000000],5,Sản phẩm tốt nhưng gói hàng hơi lỏng lẻo
[GIÁ HỦY DIỆT] Nước hoa hồng Dear Klairs Supple Preparation toner 180ml,['Không mùi'],[22500000000],5,"Hình ảnh mang tc tượng trưng thui do mk lười hihi
Nma sp chuẩn nha
Đóng gói có chống sốc nè
Chất khá đặc dùng tiết kiệm lém đó
Dưỡng ẩm khá là okla đóa
Nên mua nha mn
Lần sau sẽ ủng hộ tiếp"
[GIÁ HỦY DIỆT] Nước hoa hồng Dear Klairs Supple Preparation toner 180ml,['Không mùi'],[23900000000],5,"Chất lượng sản phẩm tuyệt vời , giao hàng nhanh . 
Mới dùng sản phẩm được 2 hôm nên chưa đánh giá được hihi"
[GIÁ HỦY DIỆT] Nước hoa hồng Dear Klairs Supple Preparation toner 180ml,['Có mùi'],[22500000000],5,Ndbdk dkdvdbdnd dndbdjdnd dndbdjdbd djfb fjjdbdjdbdndnd dnbd
[GIÁ HỦY DIỆT] Nước hoa hồng Dear Klairs Supple Preparation toner 180ml,['Không mùi'],[23900000000],5,.............................................
[GIÁ HỦY DIỆT] Nước hoa hồng Dear Klairs Supple Preparation toner 180ml,['Có mùi'],[21900000000],5,Hy vọng dùng xong sẽ có làn da căng bóng mịn màng như thầy trong hình. Sp giá rẻ áp xu hoàn xu tè le huhu mua đi các bạn. 
[GIÁ HỦY DIỆT] Nước hoa hồng Dear Klairs Supple Preparation toner 180ml,['Không mùi'],[22500000000],5,"Sản phẩm gói cẩn thận, đúng như hình. Sẽ ủng hộ shop dài dài "
[GIÁ HỦY DIỆT] Nước hoa hồng Dear Klairs Supple Preparation toner 180ml,['Không mùi'],[22500000000],5,"Giao hàng đúng hẹn, gói hàng cẩn thận, hàng chính hãng, mua nhiều còn được tặng một gói green tea foam cleanser của innisfree."
[GIÁ HỦY DIỆT] Nước hoa hồng Dear Klairs Supple Preparation toner 180ml,['Có mùi'],[22500000000],5,Chất lượng sản phẩm tốt giao hàng nhanh chóng nên mua nha mọi người 
[GIÁ HỦY DIỆT] Nước hoa hồng Dear Klairs Supple Preparation toner 180ml,['Không mùi'],[21900000000],5,"Sản phẩm y hình. Do vận chuyển nên vỏ hộp bị móp, xóc nảy nhiều khiến cho chai tonner sủi bọt khí rất nhiều và mình phải để mấy ngày mới thấy hết bọt"
[GIÁ HỦY DIỆT] Nước hoa hồng Dear Klairs Supple Preparation toner 180ml,['Có mùi'],[22500000000],5,"Đã mua rất nhiều lần của shop rồi, yên tâm không check mã vạch luôn"
[GIÁ HỦY DIỆT] Nước hoa hồng Dear Klairs Supple Preparation toner 180ml,['Có mùi'],[22500000000],5,Sản xuất từ HQ nhé yên tâm lắm mong là hợp với da mình hiu hiuuuuyy
[GIÁ HỦY DIỆT] Nước hoa hồng Dear Klairs Supple Preparation toner 180ml,['Có mùi'],[19600000000],5,"Theo đề xuất của của các hãng, cơ quan chức năng, Chính phủ Việt Nam đang xem xét thông qua gói hỗ trợ hàng không bao gồm không giới hạn việc miễn giảm các loại thuế, phí dịch vụ hàng không, miễn giảm thuế môi trường cho nhiên liệu bay, gói hỗ trợ tài chính, gia hạn nợ vay…

Sự hỗ trợ này cần cấp th"
[GIÁ HỦY DIỆT] Nước hoa hồng Dear Klairs Supple Preparation toner 180ml,['Không mùi'],[22500000000],5,"#gom_order  #sale 

Là con gái. Phải sở hữu ngay 1 em này để đựng đồ trang sức 1 cách gọn gàng đi
_______________________________________________
HÀNG ORDER - KHÔNG CỌC - KHÔNG HỦY 
HÀNG VỀ SAU 20 NGÀY
QUÝ KHÁCH VUI LÒNG CÂN NHẮC KỸ TRƯỚC KHI ĐẶT ĐỂ TRÁNH VIỆC HỦY HÀNG VÌ"
[GIÁ HỦY DIỆT] Nước hoa hồng Dear Klairs Supple Preparation toner 180ml,['Có mùi'],[22500000000],5,mới nhận được hàng đóng gói kĩ sp cũng cầm chắc tay lắm chưa dùng nên ko biết có hợp ko
[GIÁ HỦY DIỆT] Nước hoa hồng Dear Klairs Supple Preparation toner 180ml,['Có mùi'],[22500000000],5,"Sản phẩm dc đóng gói chắc chắn Oke , em đang dùng và sẽ cho kết quả sauuuuu "
[GIÁ HỦY DIỆT] Nước hoa hồng Dear Klairs Supple Preparation toner 180ml,"['Có mùi', 'Không mùi']","[22500000000, 22500000000]",5,"Toner cấp ẩm tốt nha, không mùi hay cks mùi dùng đều thích nma mình vẫn ưng loại có mùi hơn. Ncl toner của hãng khỏi bàn lun rồi . Bh hết sẽ quay lại mua thêm nha"
[GIÁ HỦY DIỆT] Nước hoa hồng Dear Klairs Supple Preparation toner 180ml,['Không mùi'],[22500000000],5,😆😇😇🌱😍🔔😆😆😇😃😃😃🤔😒dcnvcvnkkgvvjjghbjjkmvdxvhsfjkkbdaxvjjhjkh
[GIÁ HỦY DIỆT] Nước hoa hồng Dear Klairs Supple Preparation toner 180ml,['Có mùi'],[19600000000],5,"Giao hàng nhanh, đóng gói hàng cẩn thận, sản phẩm tốt, sẽ ủng hộ"
[GIÁ HỦY DIỆT] Nước hoa hồng Dear Klairs Supple Preparation toner 180ml,['Có mùi'],[22500000000],5,Shop đóng gói giao hàng nhanh.....  Sản phẩm còn nguyên seal....
[GIÁ HỦY DIỆT] Nước hoa hồng Dear Klairs Supple Preparation toner 180ml,['Có mùi'],[19900000000],5,Ha ko lq nhưng sp ok lắm ạ mua hai lần ở shop giao hàng ok ko bị móp méo j
[GIÁ HỦY DIỆT] Nước hoa hồng Dear Klairs Supple Preparation toner 180ml,['Có mùi'],[19600000000],5,Được lắm nhaaaaaaaaajeeekekkekekekekkekekeekekekeekekekekekekek
[GIÁ HỦY DIỆT] Nước hoa hồng Dear Klairs Supple Preparation toner 180ml,['Có mùi'],[22500000000],5,"Cấp ẩm tốt, mùi nhẹ nhàng, giữ lạnh khi lấy ra sử dụng sẽ thư giãn tâm hồn như tìm được chân mệnh thiên tử giữa dòng đời cô quạnh, nên thử nhe mọi người"
[GIÁ HỦY DIỆT] Nước hoa hồng Dear Klairs Supple Preparation toner 180ml,['Không mùi'],[21900000000],5,"Giao hàng nhanh, đóng gói chắc chắn, sản phẩm dùng oki..   ....  ......  ...."
[GIÁ HỦY DIỆT] Nước hoa hồng Dear Klairs Supple Preparation toner 180ml,['Có mùi'],[19600000000],5,Sp dùng tốt nha mxhObzgLeb tkzga ứioabdkzyB mssj love youuuuuuu
[GIÁ HỦY DIỆT] Nước hoa hồng Dear Klairs Supple Preparation toner 180ml,['Có mùi'],[19600000000],5,"Hàng đẹp chuẩn auth, sẽ tiếp tục ủng hộ. Chai dạng gel nên sử dụng được rất lâu. Hợp với da dầu và nhạy cảm 🥰🥰"
[GIÁ HỦY DIỆT] Nước hoa hồng Dear Klairs Supple Preparation toner 180ml,['Không mùi'],[21900000000],5,Chất toner khá đặc so với những toner trc mình từng xài nhưng cấp ẩm rất tốt 
[GIÁ HỦY DIỆT] Nước hoa hồng Dear Klairs Supple Preparation toner 180ml,['Có mùi'],[22500000000],5,"Chất lượng sản phẩm khá tốt , đóng gói sản phẩm đẹp và khá chắc chắn "
[GIÁ HỦY DIỆT] Nước hoa hồng Dear Klairs Supple Preparation toner 180ml,['Có mùi'],[22500000000],5,"Tin tưởng shop lắm nên chả bh lo về chất lượng, mong shop luôn giữ sự uy tín này"
[GIÁ HỦY DIỆT] Nước hoa hồng Dear Klairs Supple Preparation toner 180ml,['Không mùi'],[22500000000],5,"Nên mua nha mn, đặc biệt cho da dầu, mụn viêm, dịu da lắm luôn, mình mua lần t2 rồi, 1 chai dùng 3  tháng hơn, lâu phết mà sale giá rẻ, tgian ship mất 5 ngày thế là nhanh rồi "
[GIÁ HỦY DIỆT] Nước hoa hồng Dear Klairs Supple Preparation toner 180ml,['Có mùi'],[21900000000],5,
[GIÁ HỦY DIỆT] Nước hoa hồng Dear Klairs Supple Preparation toner 180ml,['Không mùi'],[23900000000],5,"Giao hàng rất nhanh
Đóng gói chắc chắn 
Hàng rẻ hơn nhiều so với thị trường"
[GIÁ HỦY DIỆT] Nước hoa hồng Dear Klairs Supple Preparation toner 180ml,['Không mùi'],[22500000000],5,"Gói hàng cẩn thận nên hong bị móp. Mua vì đọc rv tin tưởng quá kkk. Chất hơi đặc nên mình cho tầm 4-5 giọt, xài thấy cũng khá êm."
[GIÁ HỦY DIỆT] Nước hoa hồng Dear Klairs Supple Preparation toner 180ml,['Có mùi'],[22500000000],5,"Shop đóng gói chắc chắn, sản phẩm chính hãng. Nói chung là rất okela"
[GIÁ HỦY DIỆT] Nước hoa hồng Dear Klairs Supple Preparation toner 180ml,['Không mùi'],[22500000000],5,"Sp không mùi, apply nhanh, chất mướt rất ưng, shop gói hàng cẩn thận, giao hàng nhanh, cảm ơn shop!"
[GIÁ HỦY DIỆT] Nước hoa hồng Dear Klairs Supple Preparation toner 180ml,['Không mùi'],[21900000000],5,"hàng dùng tốt, có hiệu quả, giao hàng nhanh,hhhhhhhhhhhhhhh"
[GIÁ HỦY DIỆT] Nước hoa hồng Dear Klairs Supple Preparation toner 180ml,['Có mùi'],[22500000000],5,"Mùi ban đầu hơi hắc như mùi xả vậy á mà sau vài phút là bay hết mùi nha , mà thoa lên thì thấy da căng và mềm hơn hẳn ,xài thích lắm í, k bị kích ứng gì, sẽ mua ủng hộ tiếp"
[GIÁ HỦY DIỆT] Nước hoa hồng Dear Klairs Supple Preparation toner 180ml,['Có mùi'],[22500000000],5,"Giao hàng hơi chậm nhưng đóng gói kỹ, mùi hương khá dễ chịu, giá tiền phù hợp, dùng nếu hợp lần sau sẽ tiếp tục ủng hộ shop........................"
[GIÁ HỦY DIỆT] Nước hoa hồng Dear Klairs Supple Preparation toner 180ml,['Có mùi'],[22500000000],5,Đã mua toner này rất nhiều lần... sử dụng rất là thích luôn... lần này mua thì shop giao hàng khá lâu...
[GIÁ HỦY DIỆT] Nước hoa hồng Dear Klairs Supple Preparation toner 180ml,['Có mùi'],[22500000000],5,"Gói hàng kỹ, giao hàng siêu nhanhhhh
Toner này thì dùng siêu thích ko còn gì để bàn rồi "
[GIÁ HỦY DIỆT] Nước hoa hồng Dear Klairs Supple Preparation toner 180ml,['Có mùi'],[22500000000],5,Nhỏ hơn so với tưởng tượng. Mùi dễ chịu. Mới dùng 1 hôm ko biết tnao
[GIÁ HỦY DIỆT] Nước hoa hồng Dear Klairs Supple Preparation toner 180ml,['Không mùi'],[22500000000],5,"mua sp lần t2, sp dùng ok. kb có hiệu quả gì k, nh dùng k bị kích ứng là mừng r , dung tích hơi nhỏ . shop giao hàng nhanh đóng gói cẩn thận "
[GIÁ HỦY DIỆT] Nước hoa hồng Dear Klairs Supple Preparation toner 180ml,['Không mùi'],[23900000000],5,"Shop giao hàng nhanh
Hàng chính hãng
Mua ở shop nhiều lần rồi
Sẽ ủng hộ dài dài"
[GIÁ HỦY DIỆT] Nước hoa hồng Dear Klairs Supple Preparation toner 180ml,['Có mùi'],[21900000000],5,Hàng chuẩn chính hãng - cấp ẩm quá tốt cho một em giá cả phải chăng như vậy 10 điểm 
[GIÁ HỦY DIỆT] Nước hoa hồng Dear Klairs Supple Preparation toner 180ml,['Không mùi'],[22500000000],5,"Giao hàng nhanh, sản phẩm chất lượng, rất hài lòng với sản phẩm"
[GIÁ HỦY DIỆT] Nước hoa hồng Dear Klairs Supple Preparation toner 180ml,['Không mùi'],[22500000000],5,"thấy dc review tốt nên mua về dùng, n jao hnagf nhanh, đóng gói chắc chaqns, chất lượng thì xem đã😀"
[GIÁ HỦY DIỆT] Nước hoa hồng Dear Klairs Supple Preparation toner 180ml,['Không mùi'],[22500000000],5,Lần mua thứ N rồi..moi người lên mua nhé..mik dùng hết 3-4 trai này.từ luk biết đến e nó đúng là chân ái
[GIÁ HỦY DIỆT] Nước hoa hồng Dear Klairs Supple Preparation toner 180ml,['Có mùi'],[22500000000],5,"Sản phẩm đã dùng thử, mùi dễ chịu, xài thẩm thấu nhanh trên da giúp da căng bóng, mình cảm thấy hài lòng về chất lượng và dịch vụ của shop. Thanks shop"
[GIÁ HỦY DIỆT] Nước hoa hồng Dear Klairs Supple Preparation toner 180ml,['Có mùi'],[19600000000],5,"Giao hàng nhanh, chất lượng sản phẩm tuyệt vời, đóng gói cẩn thận "
[GIÁ HỦY DIỆT] Nước hoa hồng Dear Klairs Supple Preparation toner 180ml,['Không mùi'],[21900000000],5,Giao hàng tương đối nhanh toner hơi đặc giá cũng không chát. Chưa dùng chưa biết sao
[GIÁ HỦY DIỆT] Nước hoa hồng Dear Klairs Supple Preparation toner 180ml,['Không mùi'],[23900000000],5,"Sp đóng gói chắc chắn, giao đúng hẹn.. Sh nhắn tin cũng ok lắm í"
[GIÁ HỦY DIỆT] Nước hoa hồng Dear Klairs Supple Preparation toner 180ml,['Không mùi'],[21900000000],5,"Shop bọc hàng cẩn thận, sp dùng rất tốt, mùi thơm. Chỉ là có điểm trừ là ông shipper đuôi 935 có hơi thái độ, 2 lần khách đề nghị mà không nói 1 câu tắt máy luôn"
[GIÁ HỦY DIỆT] Nước hoa hồng Dear Klairs Supple Preparation toner 180ml,['Có mùi'],[22500000000],5,"OK. Sản phẩm tốt. Sẽ ung ho lần sau. Giao nhanh.
Cho Shop 5 sao 🌟......"
[GIÁ HỦY DIỆT] Nước hoa hồng Dear Klairs Supple Preparation toner 180ml,['Có mùi'],[22500000000],5,"Mình mới nhận được hàng của shop. sản phẩm đóng gói kĩ. Hàng chất lượng. Mình sẽ ủng hộ shop. 
"
[GIÁ HỦY DIỆT] Nước hoa hồng Dear Klairs Supple Preparation toner 180ml,['Có mùi'],[22500000000],5,"(QC) GIAM 50% TBSP, KHONG LOAI TRU, co hoi trung 1 chi vang moi ngay. CT chi ad cho KH co the Gold (Platinum), tu 06 - 08/03/2021 tren toan HT. Lien he: 0988620033 . Tu choi soan TC TT.20AGAIN gui 1551 hoac lien he 18001091 (mien phi)."
[GIÁ HỦY DIỆT] Nước hoa hồng Dear Klairs Supple Preparation toner 180ml,['Không mùi'],[22500000000],5,Thời gian giao hàng hơi lâu. Đã sử dụng loại có mùi nên dùng sang loại này thấy khá quen. Giá thành hợp lí. Nc là ưng.
[GIÁ HỦY DIỆT] Nước hoa hồng Dear Klairs Supple Preparation toner 180ml,['Không mùi'],[22500000000],5,Giao hàng lâu. Chưa dùng nên chưa đánh giá được chất lượng sp hdj
[GIÁ HỦY DIỆT] Nước hoa hồng Dear Klairs Supple Preparation toner 180ml,['Có mùi'],[21300000000],5,"I’d like to be seen as someone with deep expertise in the energy sector, and I know that’s something that I’ll have an opportunity to do here. I’m also really excited to take on more managerial responsibilities in the next few years and potentially even take the lead on some projects. I’ve been luck"
[GIÁ HỦY DIỆT] Nước hoa hồng Dear Klairs Supple Preparation toner 180ml,['Không mùi'],[22500000000],5,"Cấp ẩm tốt, lúc apply hơi dính xíu nhưng đợi khô tý là hết. Hơi đặt giống srum nên dùng khá tiết kiệm "
[GIÁ HỦY DIỆT] Nước hoa hồng Dear Klairs Supple Preparation toner 180ml,['Không mùi'],[22500000000],5,"Lúc mới nhận phải nói là bị nổi bọt siêu nhiều do qtrinh vchuyen, xong mấy ngày sau mới hết bọt. K lỏng nhue nước, có hơi đặc hơn nước nên dùng hơi hao nha nói chung mình da thường thì toner này dưỡng ẩm ôk. Mặc dù mình k thấy rõ cái hiệu quả tại vì dùng nó xong sẽ apply nhiều thứ khác. Nhma dịu nhẹ"
