variations,price,rating_star,comment
['MINISIZE CรC 25ML'],[2600000000],5,"Giao ฤแปง hรng, giao hรng nhanh, cรณ cฦก hแปi sแบฝ แปงng hแป lแบงn sau."
['MINISIZE HONEY 25ML'],[2600000000],5,Es sjskjddjehbeldjdhviv6xycghivihhgug7f6f7f6f7t7g7t7y8hih9hh
['MINISIZE HONEY 25ML'],[2500000000],5,"Dรนng แปn, mรนi nhแบน, mua cแปงa shop nhiแปu lแบงn nรชn rแบฅt yรชn tรขm, thแปi gian giao hรng nhanh."
['MINISIZE CรC 25ML'],[2500000000],5,Shop ฤรณng hแปp chแบฏc chแบฏn. Date cรฒn xa lแบฏm nรจ. Giao hรng rแบฅt nhanh. Mong lร hรng chuแบฉn.
['MINISIZE PORE 25ML'],[2600000000],5,"Hรng chรญnh hรฃng, cแบฃm ฦกn shop nhiแปu แบก, shop giao hรng nhanh......."
['MINISIZE ROSE 25ML'],[2600000000],5,Okeeeeeeeee.รช..............eeeeeeeeeeeeeeeeeeeee nhobanquaaaaa
"['MINISIZE CรC 25ML', 'MINISIZE ROSE 25ML']","[2600000000, 2600000000]",5,"Sแบฃn phแบฉm xรi oke lแบฏm, mรฌnh mua lแบงn thแปฉ 2 r, shop gรณi hรng kฤฉ chแปng sแปc tแปt"
['MINISIZE ROSE 25ML'],[2600000000],5,Dรนng ฤฦฐแปฃc 
['MINISIZE AQUA 25ML'],[2800000000],5,"Thแปi gian giao hรng nhanh.
Sแบฃn phแบฉm chแบฅt lฦฐแปฃng.
Sแบฝ แปงng hแป shop tiแบฟp. ๐๐๐"
['MINISIZE HONEY 25ML'],[2600000000],5,
['MINISIZE HONEY 25ML'],[2600000000],5,"Mฦฐแปt da, thฦกm, แบฉm. "
['MINISIZE HONEY 25ML'],[2600000000],5,"Chแบฅt lฦฐแปฃng sแบฃn phแบฉm tแปt, ฤรณng gรณi sแบฃn phแบฉm ฤแบนp, giao hรng nhanh"
['MINISIZE HONEY 25ML'],[2600000000],5,"Shop uy tรญn. Mua hรng cรฒn ฤฦฐแปฃc tแบทng thรชm sample nแปฏa แบก. Hihi shop giao hรng chuแบฉn, ฤแปง hรng. Mn yรชn tรขm mua hรng nha! ๐ "
['MINISIZE ROSE 25ML'],[2600000000],5,"ฤรณng gรณi sแบฃn phแบฉm chแบฏc chแบฏn, chแบฅt lฦฐแปฃng khแปi phแบฃi bรn vรฌ ฤรฃ mua quรก nhiแปu lแบงn แป shop rแปi. Giao hรng siรชu siรชu nhanh, mแปi ฤแบทt hรดm qua hรดm nay ฤรฃ cรณ dรน mรฌnh แป tแปnh."
['MINISIZE PORE 25ML'],[2600000000],5,"Giao hรnh nhanh chรณng, shop ฤรณng gรณi rแบฅt cแบฉn thแบญn, ngoรi ra cรฒn ฤฦฐแปฃc tแบทng thรชm quร. Giรก cแบฃ rแบป phแบฃi chฤng, sแบฝ แปงng hแป shop thรชm lแบงn sau โค๏ธโค๏ธโค๏ธ"
['MINISIZE AQUA 25ML'],[2600000000],5,Thฦกm cแปฑc kแปณ thฦกm luรดn hihihi :>>>>>>>>>>>>>>>>>>>>>>>>>>
['SET 5 CHAI 5 LOแบI'],[9800000000],5,"Shop giao ฤรบng ฤแปง nhanh chฤm sรณc tแปt, sแบฃn phแบฉm giรก gia hแปฃp lรญ รฝ hihi
Set xinh giรก tแปt"
['MINISIZE ROSE 25ML'],[2600000000],5,"Mua mแปน phแบฉm cแปงa Ann bao giแป cลฉng ฦฐng hแบฟt, giao hรng nhanh, ฤรณng gรณi cแบฉn thแบญn, kแปน cรng"
['MINISIZE AQUA 25ML'],[2600000000],5,"ฤรณng gรณi chแบฏc chแบฏn, thแปi gian giao hรng hฦกi lรขu, chฦฐa xรi nรชn chฦฐa thแป ฤรกnh giรก"
['MINISIZE ROSE 25ML'],[2600000000],5,"sแบฃn phแบฉm ฤแปง แบก, e chฦฐa test thแปญ nhฦฐng cx rแบฅt yรชn tรขm khi mua hรng cแปงa shop "
['MINISIZE ROSE 25ML'],[2600000000],5,"ฤรณng gรณi chแบฏc chแบฏn, ฤแบนp. Giao hรng nhanh gแปn lแบน. Sแบฃn phแบฉm thรฌ ko p"
['MINISIZE HONEY 25ML'],[2600000000],5,"Mua xaฬi thฦฐฬ cho vui laฬ chiฬnh, trwn 250k ฤรชฬ ฤc free ship thรดiiiii"
['MINISIZE ROSE 25ML'],[2600000000],5,"Toner bรฉ bรฉ xinh xinh lแบฏm แบก shop gรณi hรng rแบฅt kฤฉ cรณ tรขm lแบฏm แบก nnnnnnnnmmmmmmmm
Ps แบฃnh kh liรชn quan "
['MINISIZE ROSE 25ML'],[2600000000],5,"da hแปn hแปฃp thiรชn dแบงu xรi ok lแบฏm nรจ, sแบกch da, thoรกng, khรดng bแป bรญ"
