variations,price,rating_star,comment
['#BNBG-Hydrating'],[1700000000],5,Hồi h mua shopee chưa thấy shop nào gói hàng xấu như shop này. Mặc dù có bọc chống sốc những vẫn ko ưng. Shop giao đủ hàng. Hi vọng là hàng chuẩn. Shop phục vụ tốt. 
['#BANOBAGY-PoreTighte'],[1700000000],5,"Đóng gói sản phẩm chắc chắn, loại mới chưa dùng nên chưa biết sao, nhưng sản phẩm hãng này rất ok"
['#BNBG- Whitening'],[1650000000],5,Chắc bị nghiện mùi của mat nạ rồi . Bỏ tủ lạnh xong đăp mặt là siêu phê lun đắp xong da minh mịn trắng đã lắm 😍😍😍
['#BNBG - Lifting'],[1700000000],5,Okkkkkkk mua của shop nhiều lần mà lần nào cũng cần gấp và đặt ship hoả tốc thế là shop hỗ trợ tận tình thì ngại gì không ủng hộ ạ. Còn tặng em gói kem innisfree.... gút chóp shop
['#BNBG- Whitening'],[1700000000],5,"giao hàng nhanh, đóng gói cẩn thận, sản phẩm giống hình okkkkkk"
['#BNBG - Lifting'],[1700000000],5,"Hàng giá ổn
Check ra mã vạch
Gói kỹ
Ship nhanh
Nói chung là kết shop rùi đó nhe
Iu"
"['#BNBG - Relaxing', '#BNBG-Hydrating']","[1650000000, 1650000000]",5,Sản phẩm tuyệt vời ❤️❤️❤️❤️❤️❤️ sẽ ủng hộ vào lần sauuuuu❤️❤️❤️❤️❤️❤️
['#BNBG- Whitening'],[1700000000],5,"Giao hàng nhanh, sp như mọi ng cmt là chính hảng nên yên tâm mùa vài lần r nè"
['#BNBG- Whitening'],[1700000000],5,Hiibibkbj ibobbi kbkbkb kbkxkbbkbhcucjvjvbjivibivivuvvii
['#BNBG-Hydrating'],[1700000000],5,
['#BNBG- Whitening'],[1700000000],5,"Mặt nạ giấy BNBG vitamin giao hàng siêu nhanh, đóng gói kĩ, chất lượng sản phẩm tốt, shop chuẩn, giá okk"
"['#BNBG - Relaxing', '#BNBG-Hydrating']","[1700000000, 1700000000]",5,Sản phẩm chất lượng sẽ ủng hộ tiếp ❤️❤️❤️❤️🥰🥰🥰❤️❤️❤️❤️❤️❤️❤️t
['#BNBG- Whitening'],[1650000000],5,"Mặt nạ giấy giao hàng nhanh, đóng gói kĩ, chất lượng sản phẩm tốt, giá cả ok, đắp thích "
"['#BNBG - Relaxing', '#BNBG- Whitening', '#BNBG-Hydrating', '#BNBG - Lifting']","[1650000000, 1650000000, 1650000000, 1650000000]",5,Nhận đủ đơn hàng nhưng chưa biết chất lượng sao xài mới biết đc ạ
['#BNBG- Whitening'],[1650000000],5,"Dùng lần đầu tiên, mask nhiều dưỡng chất, ôm sát da, chuẩn form luôn, còn serum quá ok, xài lâu dài mới thấy hịêu quả hay không"
['#BNBG-Hydrating'],[1700000000],5,"Mặt nạ giấy giao hàng nhanh, đóng gói kĩ, chất lượng sản phẩm tốt, giá cả ô kê, shop dễ thươngg"
['#BNBG- Whitening'],[1700000000],5,"Giao hàng nhanh nè, tất cả đều mới nha, xài ổn sẽ ủng hộ shop vì chất lượng làm mình hài lòng ạ, gói hàng kĩ lắm"
['#BNBG-Hydrating'],[1700000000],5,Rất tin tưởng đã mua ở shop nhiều lần vnxnxndnxmxnsndndndnnfnf
['#BNBG- Whitening'],[1700000000],5,Mua nhiều lần nên rất tin tưởng..............................
['#BNBG - Lifting'],[1700000000],5,"Giao hàng nhanh
Nhận được hàng giống hình, chất lượng giống loại mình từng sài r "
['#BNBG - Lifting'],[1700000000],5,"Thật ra mình thích nghe câu ""sao giờ này còn chưa ngủ trò chuyện một chút được không"" hơn là 
""muộn rồi ngủ sớm đi"""
"['#BNBG- Whitening', '#BNBG-Hydrating']","[1700000000, 1700000000]",5,"Sản phẩm oke, giao hàng khá nhanh, shop trả lời thắc mắc của mình tận tình"
"['#BNBG - Relaxing', '#BNBG- Whitening', '#BNBG - Lifting']","[1700000000, 1700000000, 1700000000]",5,Shop đóng gói hàng chắc chắn 😍 giao hàng nhanh và đầy đủ 😘 chất lượng sp ok 
"['#BNBG - Relaxing', '#BNBG- Whitening', '#BNBG-Hydrating']","[1650000000, 1650000000, 1650000000]",5,"Hình ảnh và video chỉ mang tính chất nhận xu. Giao hàng đầy đủ, nhanh gọn lẹ 👍"
"['#BNBG- Whitening', '#BNBG - Lifting']","[1700000000, 1700000000]",5,"Shop dễ thương lắm 
Mình mua mấy lần r hàng chất lượng k à 
Uy tín nhắm ❤️"
['#BNBG - Relaxing'],[1700000000],5,"thơmmmmmmm, để mình dùng thử mới biết chất lượng ra s mùi này thơm dễ chịu ko biết các mùi còn lại ra s "
['#BNBG-Hydrating'],[1700000000],5,nkekssnsnnsksjs nekwkwow nẹieoe. nekwkkwwkjwwn nunwjwkw
"['#BNBG - Relaxing', '#BNBG- Whitening']","[1700000000, 1700000000]",5,Giao nhanh gonj le ^^ mùi thơm ơi là thơm chai dưỡng tóc á còn mặt nạ cũng oke ned ^^
"['#BNBG - Relaxing', '#BNBG- Whitening', '#BNBG-Hydrating', '#BNBG - Lifting']","[1650000000, 1650000000, 1650000000, 1650000000]",5,", mặt nạ som by mi ko giống loại mình đã dùng. Đóng gói chắc chắn"
"['#BNBG - Relaxing', '#BNBG- Whitening', '#BNBG-Hydrating']","[1700000000, 1700000000, 1700000000]",5,"Jbbebwbkakabdbxbbsbs absbbssb
Son thích lắm nha 
Nshsbdjdjsjnsns"
"['#BANOBAGY-Cica', '#BNBG- Whitening']","[1650000000, 1650000000]",5,"Chất lượng sản phẩm tốt,mặt nạ xài rất thích, shop phục vụ rất tốt, giao hàng nhanh"
"['#BNBG - Relaxing', '#BNBG- Whitening', '#BNBG - Lifting']","[1700000000, 1700000000, 1700000000]",5,"Mùi phấn khá giống Johnsunbaby cũng tạm
Chưa dùng nên chưa đánh giá đc
Hàng giao khá lâu chắc tầm 1truân"
['#BNBG - Relaxing'],[1650000000],5,"Em này mùi thơm dễ chịu nên đắp lên rất relax, đúng như cái tên của nó luôn. Shop thì luôn uy tín và giao hàng nhanh, tuy nhiên lần này mình thấy shop đóng gói chưa kỹ lắm. "
['#BNBG- Whitening'],[1700000000],5,Mặt nạ cấp ẩm tốt xài lâu có.làm sáng da lên 1 xíu ạ để tủ lạnh đắp rất đã . Mình mua 10 miếng là sẵn 1 hộp nv nè !!!
"['#BNBG- Whitening', '#BNBG - Lifting']","[1700000000, 1700000000]",5,Hàng ok mình có check mã nên nó là hàng auth các bạn k cần lo.mua dôd ở shop này lâu r nên biết shop làm ăn trên tuyệt vời(video vs ảnh chỉ mang tính chất nhận xu)
"['#BNBG- Whitening', '#BNBG - Lifting']","[1700000000, 1700000000]",5,"Đóng gói hàng cẩn thận, mua được giá hời, chưa sử dụng nếu xài được sẽ ủng hộ shop tiếp. Thời gian giao hàng nhanh"
['#BANOBAGY-Cica'],[1700000000],5,Loại nào loại mới mình mua đắp thử xem có khác gì so với dòng xanh lá cũ ❤️❤️
"['#BANOBAGY-Cica', '#BANOBAGY-PoreTighte', '#BNBG - Relaxing', '#BNBG- Whitening']","[1700000000, 1700000000, 1700000000, 1700000000]",5,"Mặt nạ dùng rất tốt, đáng tiền, đóng gói sản phẩm chắc chắn, shop phục vụ tốt, thời gian giao hàng nhanh"
"['#BNBG - Relaxing', '#BNBG- Whitening', '#BNBG-Hydrating', '#BNBG - Lifting']","[1700000000, 1700000000, 1700000000, 1700000000]",5,"Đã thử dùng relaxing, mùi thơm, nhiều gel, không kích ứng, mới dùng cũng chưa có gì thay đổi, còn lại chưa biết ra sao"
"['#BANOBAGY-Cica', '#BANOBAGY-PoreTighte', '#BNBG - Relaxing', '#BNBG- Whitening']","[1700000000, 1700000000, 1700000000, 1700000000]",5,"Mặt nạ dùng rất ổn, mịn da, shop giao đủ hàng, đóng gói sản phẩm chắc chắn, thời gian giao hàng nhanh"
"['#BANOBAGY-Cica', '#BNBG- Whitening', '#BNBG-Hydrating']","[1700000000, 1700000000, 1700000000]",5,Tuy chưa dùng nhưng thấy shop gói hàng cẩn thận ạ. Giao đủ sp dù mình mua mặt nạ khá lẻ tẻ. Tuy gặp chút chuyện vs shipper nhưng chung quy mọi chiện đều ổn. À được tặng 1 serum của innisfree nữaaaa
"['#BANOBAGY-Cica', '#BANOBAGY-PoreTighte', '#BNBG- Whitening', '#BNBG-Hydrating']","[1700000000, 1700000000, 1700000000, 1700000000]",5,"Mặt nạ dùng ok 
Cấp ẩm tức thì để trang điểm rất tốt
Đặc biệt mùa này đang lạnh da khổ nẻ càng nên dùng "
"['#BANOBAGY-Cica', '#BANOBAGY-PoreTighte', '#BNBG - Relaxing', '#BNBG- Whitening', '#BNBG-Hydrating', '#BNBG - Lifting']","[1700000000, 1700000000, 1700000000, 1700000000, 1700000000, 1700000000]",5,
['#BNBG- Whitening'],[1700000000],5,Chuẩn bị hàng và giao hàng rất nhanh. Mình mua của shop mấy lần r nên khá tin tưởng. Sau khi xài lên da thì mình nghĩ hàng của shop chính hãng. Lần sau sẽ ủng hộ tiếp tục
['#BNBG- Whitening'],[1700000000],5,Yên tâm là mask chính hãng nha mọi người đắp mask rất thơm mùi quýt luôn. Date mask còn xa tới 2023 lận nha !!
['#BNBG - Relaxing'],[1700000000],5,"chất lượng sản phẩm tốt, giao hàng nhanh, sẽ ủng hộ lần sauuuuuuuuuuu"
"['#BANOBAGY-Cica', '#BANOBAGY-PoreTighte', '#BNBG- Whitening', '#BNBG-Hydrating']","[1700000000, 1700000000, 1700000000, 1700000000]",5,"Giao hàng nhanh, đóng gói chắc chắn......shop giao đủ......"
['#BNBG - Relaxing'],[1700000000],5,"Shop giao hàng đầy đủ, gói kỹ bằng giấy chống sốc. Vote 5 saooo"
['#BNBG- Whitening'],[1700000000],5,"Giao hành cực nhanh luôn, shiper dễ thương, sản phẩm đầy đủ, chưa biết chất lượng ntn nhưng gói hàng đẹp. 5* trước cho shop nha"
['#BNBG-Hydrating'],[1700000000],5,Kakkskzmsmxkxmmxkdkkdkdkmxmcmkcckkxkckckckckcmxmmxmmxxmmxkxkxkxkkxkxkxkkxkxkkxdkdkkekekkslsksk
"['#BANOBAGY-Cica', '#BANOBAGY-PoreTighte']","[1700000000, 1700000000]",5,Shop giao đủ hàng. Đóng gói và  bọc sản phẩm kỹ. Giao hàng nhanh. 
"['#BANOBAGY-Cica', '#BNBG - Relaxing', '#BNBG-Hydrating', '#BNBG - Lifting']","[1550000000, 1700000000, 1700000000, 1700000000]",5,"Mặt nạ sử dụng tốt, mịn da,shop giao đủ số lượng,đóng gói rất chắc chắn"
['#BANOBAGY-PoreTighte'],[1550000000],5,"Đặt lần này thì shop giao hàng siêu nhanh, chuẩn bị hàng đầy đủ và đóng gói hàng rất đẹp. Hàng nguyên seal,mới và date xaaaaaaaa"
"['#BANOBAGY-Cica', '#BANOBAGY-PoreTighte']","[1700000000, 1700000000]",5,Sorry mn em lười chụp quá nhưng sp ok xinh xẻo lắm nha. Tất cả cac sp em đều ko bị kích ứng. Tin tưởng shop:3
['#BANOBAGY-Vitalizing'],[1550000000],5,Đóng gói cẩn thận giao hàng nhanh chưa xài nên chưa bk chất lượng ra sao
['#BANOBAGY-PoreTighte'],[1550000000],5,"Shop giao đủ hàng nè 
Mặt nạ hàng chuẩn
Đắp thích
Mướt mịn lắm ạ
Đi nắng về đắp cái cảm giác nhả nắng lun hihi ❤️❤️❤️❤️❤️❤️❤️❤️❤️❤️❤️❤️❤️❤️❤️❤️❤️❤️❤️❤️❤️🥰🥰🥰🥰🥰❤️🥰🥰🥰🥰🥰🥰"
['#BANOBAGY-PoreTighte'],[1550000000],5,Đồ skincare phải chọn 7749 lần mới quyết định được chỗ mua. Lần đầu chọn mặt gửi vàng chỗ shop cũng chưa thấy thất vọng. Mong dùng lâu dài sẽ ok
['#BNBG- Whitening'],[1700000000],5,"Sản phẩm như hình, mặt nạ chuẩn như khi đặt, shop giao hàng cực nhanh, sẽ ủng hộ tiếp vào lần sau"
['#BANOBAGY-PoreTighte'],[1550000000],5,"Sản phẩm như hình, mặt nạ chuẩn như khi đặt, shop giao hàng cực nhanh, sẽ ủng hộ tiếp vào lần sau"
"['#BANOBAGY-Vitalizing', '#BANOBAGY-PoreTighte', '#BNBG - Relaxing', '#BNBG- Whitening']","[1550000000, 1550000000, 1700000000, 1700000000]",5,"Chất lượng sản phẩm tốt, đóng gói sản phẩm chắc chắn, shop phục vụ tốt, giao hàng nhanh"
['#BNBG- Whitening'],[1700000000],5,"Đã mua hàng của shop này nhiều lần, hàng chính hãng nha mọi người, giá thành còn rẻ hơn nữa ạ"
['#BANOBAGY-Vitalizing'],[1550000000],5,"Mua của shop nhiều lần rồi, lần nào cũng ưng ý hết. Chị chủ nch cực dễ thương luôn. gói hàng cẩn thận. Giao hàng rất nhanh"
['#BANOBAGY-PoreTighte'],[1550000000],5,"Mua dc deal hời, giao hàng k quá nhanh cx k quá chậm, packaging trông ok"
"['#BANOBAGY-PoreTighte', '#BNBG-Hydrating']","[1550000000, 1700000000]",5,"Mua vài lần ở shop rồi và lần nào cũng ưng hết sức. Đóng gói hàng cẩn thận, giao hàng nhanh mà anh shipper cũng dễ thương nữa. 
Còn chất lượng hàng thì khỏi nói vì mình dùng rồi mới quyết định quay lại shop mua tiếp. "
['#BNBG- Whitening'],[1700000000],5,"Có mộc tem chính hãng nên mua hàng rất yên tâm , còn được shop tặng serum nữa ạ . Mặt nạ đắp thơm mùi Quýt lắm dưỡng trắng ,  cấp ẩm , thâm chừng 2 tuần xài là bay hết ạ !!!"
['#BANOBAGY-Vitalizing'],[1550000000],5,"Chất lượng sản phẩm tạm ổn, hàng hoá đóng gói tạm ổn, giao hàng vận chuyển cũng tạm ổn good good nè"
"['#BANOBAGY-Vitalizing', '#BANOBAGY-PoreTighte']","[1550000000, 1550000000]",5,"Giao hàng nhanh, đặt hôm trước hôm sau đã có hàng, quên chụp ảnh lại nên lấy hình của shop. 5 sao"
['#BANOBAGY-PoreTighte'],[1550000000],5,"Sp ok, sp giá tốt, giao đủ hàng, đủ hàng là ok, video ko liên quan đủ ký tự để lấy xu."
['#BANOBAGY-Vitalizing'],[1550000000],5,Giao hàng nhanh và đủ. Tội chú shipper giao trúng lúc mưa gió.
['#BNBG- Whitening'],[1700000000],5,shop đóng gói hàng cẩn thận giao hàng nhanh sẽ ủng hộ tiếp nha j
"['#BNBG - Moisture', '#BNBG- Whitening']","[2200000000, 1700000000]",5,Shop giao hàng nhanh. Đóng gói cẩn thận. Giá thành rẻ. Hàng chuẩn auth. Ưng ạ
"['#BANOBAGY-Vitalizing', '#BANOBAGY-PoreTighte', '#BNBG - Moisture']","[1550000000, 1550000000, 2200000000]",5,"Giao hàng khá nhanh. Mặt nạ cấp ẩm tốt, hương thơm dịu nhẹ, bao bì đẹp"
"['#BANOBAGY-Vitalizing', '#BANOBAGY-PoreTighte', '#BNBG- Whitening', '#BNBG - Lifting']","[1550000000, 1550000000, 1690000000, 1690000000]",5,"Mặt nạ cực thích luôn. Sẽ ủng hộ thêm nữa ạ. Hàng cực chuẩn luôn
"
['#BNBG - Relaxing'],[1700000000],5,Ffufjfififncufjdirjdihdudjhekksissjjdixjxhfhfhduduuddj
['#BNBG - Relaxing'],[1700000000],5,"Mặt nạ ôm khít mặt, xài thích, okkkkkkkkkkkkkkkkkkkkkkkkkkkkkkk"
['#Moisture_Xanh dương'],[2200000000],5,Shop giao hàng khá nhanh. Hàng chuẩn auth mà giá oki ạ. Nói chung là ưng!!
"['#Vitalizing_Tím', '#PoreTightening_Hồng', '#Moisture_Xanh dương']","[1550000000, 1550000000, 2200000000]",5,Lần đầu mua của shop. Dùng thử thấy ok lắm sẽ ủng hộ shop thêm nữa
"['#Vitalizing_Tím', '#Moisture_Xanh dương', '#Whitening_Vàng', '#Hydrating_Xanh dươn']","[1600000000, 2100000000, 1600000000, 1600000000]",5,"Chất lượng sản phẩm tuyệt vời, shop phục vụ rất tốt nha, giao hàng rất nhanh "
['#Relaxing_Xanh lá'],[1700000000],5,Giao hàng nhanh - hàng chính hãng - shipper rất dễ thương....
['#BANOBAGY-PoreTighte'],[1550000000],5,Giao hàng hơi lâu nhưng đóng gói chắc chắn và chất lượng cũng tốt....
['#Hydrating_Xanh dươn'],[1720000000],5,"Giao hàng nhanh, anh shipper dễ thương. 
Nói chung là ưng lắm luôn ạ. Sẽ ủng hộ shop dài dài. Còn được tặng sample nữa."
"['#BANOBAGY-Vitalizing', '#BANOBAGY-PoreTighte']","[1550000000, 1550000000]",5,"Giao hàng nhanh , đóng gói chắc chắn. Sản phẩm xài ổn ( mik xài rồi nên k có ảnh)"
"['#BNBG - Relaxing', '#BNBG- Whitening', '#BNBG-Hydrating']","[1700000000, 1700000000, 1700000000]",5,"Mua của shop nhiều lần rồi, giao nhanh và đúng hàng, sản phẩm chất lượng, rất đáng mua"
"['#BNBG-Hydrating', '#BNBG - Lifting']","[1650000000, 1650000000]",5,"Mặt nạ khá nhiều dưỡng chất, mua 1 cái cũng đáng tiền. Đắp xong thấy mặt khác hẳn luôn ạ"
['#BNBG - Relaxing'],[1700000000],5,"Đóng gói cẩn thận, giao hàng nhanh......................"
"['#BANOBAGY-Vitalizing', '#BNBG-Hydrating']","[1700000000, 1700000000]",5,"Chất lượng sp ok, đóng gói đẹp, shop phục vụ tốt"
['#BNBG-Hydrating'],[1700000000],5,Sản phẩm Ok 
"['#BNBG-Hydrating', '#BNBG - Lifting']","[1700000000, 1700000000]",5,Hàng ok 
"['#BNBG- Whitening', '#BNBG-Hydrating', '#BNBG - Lifting']","[1700000000, 1700000000, 1700000000]",5,
"['#BNBG - Relaxing', '#BNBG- Whitening']","[1700000000, 1700000000]",5,"Chưa sử dụng thử, nhưng nhìn bề ngoài rất ưng."
"['#BNBG - Relaxing', '#BNBG-Hydrating', '#BNBG - Lifting']","[1650000000, 1650000000, 1650000000]",5,Quá Ok
['#BNBG- Whitening'],[1650000000],5,"mặt nạ bnbg vitamin đóng gói kĩ, giao hàng nhanh, giá cả hợp lí, xài thích "
"['#BNBG- Whitening', '#BNBG-Hydrating']","[1700000000, 1700000000]",5,Gói hàng rất cẩn thận và mình chưa dùng đến. Khi nào dùng sẽ phản hồi sau
['#BNBG - Relaxing'],[1700000000],3,"Dùng 2 ngày mới mò lên quánh giá . Rầu hết sức ,k hợp vs da mình, bị nổi mẩn đỏ .haizzzzzzzzzzzzzzzzz"
"['#BNBG - Relaxing', '#BNBG- Whitening']","[1700000000, 1700000000]",5,Giao hàng đầy đủ đúng sp check được mã vạch
"['#BNBG - Relaxing', '#BNBG- Whitening']","[1700000000, 1700000000]",5,"Shop giao siu nhanh nà. Sản phẩm sử dụng rất tốt, đã mua ở shop mấy lần rồi nên rất tin tưởng shop. "
"['#BANOBAGY-Cica', '#BNBG - Relaxing', '#BNBG- Whitening']","[1700000000, 1700000000, 1700000000]",5,"mặt nạ banobagi giao hàng nhanh, đóng gói kĩ, chất lượng sản phẩm tốt, giá rẻ "
['#BNBG- Whitening'],[1700000000],5,"Giá thành rẻ hơn so với mấy shop khác mình từng mua, ship nhanh, dùng tốt sẽ quay lại ủng hộ shop. Rate 5 stars"
"['#BNBG- Whitening', '#BNBG - Lifting']","[1700000000, 1700000000]",5,"Đã mua shop nhiều lần, shop giao nhanh và đóng gói sp cẩn thận, sẽ ủng hộ shop dài"
['#BNBG- Whitening'],[1650000000],5,Thả timmmm vì quay lại nhiều lần rùi
['#BNBG- Whitening'],[1700000000],5,Hhuuu
['#BNBG - Lifting'],[1700000000],5,"Tốt
"
