variations,price,rating_star,comment
[''],[190000000],5,Sản phẩm tốt mua nhiều lần ở shop r shop rất chu đao sẽ quay lại ủng hộ
[None],[100000000],5,Giao hàng nhanh đóng gói đẹp sẽ ủng hộ thêm......    ............
[None],[100000000],5,Chất lượng phù hợp với giá tiền rất nhiều tinh chất giá cả ok cảm ơn shop nhiều
[None],[100000000],5,Sản phẩm okie.Shop giao hàng rất nhanh.Trả lời cx rất nhiệt tình.Mình sợ là giao hàng không kịp mà may ghê là giao đến đúng lúc nhà mình chuẩn bị gọi xe để đi.chứ không biết làm sao để nhận nữa.Cảm ơn shop rất nhiều.Lần đầu tiên mua hàng mà rất hài lòng.Nếu chất lượng sản phẩm tốt thì em sẽ ủng hộ 
[None],[100000000],5,Thời gian giao hàng siêu nhanh. Shop đóng gói cẩn thận. Chất lượng sản phẩm tốt.
[None],[100000000],5,"chất lượng sản phẩm tuyệt vời, thời gian giao hàng khá nhanh."
[None],[100000000],5,"Mặt nạ đắp rất thích lun ý ạ, đắp xong cảm thấy da mụn với trắng hẳn ra với giá 1k không có gì phải chê, shop lại còn gửi ảnh trước khi gói hàng nữa, mọi người yên tâm mua mặt nạ nhé 😘"
[None],[100000000],5,"giao đủ sản phẩm, chủ shopj nhiệt tình,Chưa dùng nên không biết công dụng ra sao."
[None],[100000000],5," Mặt nạ quá tốt, dưỡng ẩm, mặt nạ có chất mỏng, tinh chất nhiều, không nhờn rít sau khi đắp. Shop phục vụ quá tốt, nhưng nhiều lúc hỏi thì k rep thì có thật kk^^ . Cảm ơn shop!"
[None],[100000000],5,Hàng đúng như hình. Mình chưa sử dụng nên chưa biết hiệu quả thế nào. Chủ shop còn chụp hình gửi mặt nạ trước <3
[None],[100000000],5,"Shop gia hnagf nhanh, giá rẻ. Chưa dùng thử nên ko bk , nhưng shop nhiệt tình, trc khi giao có chụp ảnh, giao đủ đúng. Giấy thấm dầu dùng hơi rát mặt"
[None],[100000000],5,"Sản phẩm tốt, đóng gói kĩ càng vận chuyển nhanh, cảm ơn shop nhiều, chất lượng tốt"
[None],[100000000],5,okkkkkkkkkkkkkkkkkkkkkkkkkkkkkkkkkkkkkkkkkkkkkkkkkkkkkkkkkkkkkkkkkkkkkkkkkkkkkkkkkkkkkkkkkkkkkkkkkkkkkkkkkk
[None],[100000000],5,"Giao hàng nhanh chóng, đóng gói sản phẩm cẩn thận, shop gửi hình ảnh sản phẩm trước cho mình biết"
[None],[100000000],5,"Giao hàng nhanh chóng, bọc gói cẩn thận, mua hàng dùng mã miễn phí vc nên rẻ quá"
[None],[100000000],5,Bsnsjdjkskskskxnndjdjdlxknxnxnmcmslmxnxnxnfmksmxncncmmxm malsmcnnzmxncmfm mmxm
[None],[100000000],5,"Shop đóng đủ hàng, đúng mẫu, giao hàng nhanh và giá lại rất rẻ 👍
Sẽ ủng hộ shop dài dài 👍"
[None],[100000000],5,Chất lượng sản phẩm tốt. Mùi thơm nhẹ. Để tủ lạnh đắp rất thích. Giá thành siêu rẻ
[None],[100000000],5,Shop tận tình. Giao hàng nhanh. Đóng gói cẩn thận. Sẽ ủng hộ tiếp. Giá thành sản phẩm phù hợp.
[None],[100000000],5,Shop nhiệt tình lắm ạ. Hàng giao nhanhhh lắmmm. Chưa dùng thử mấy cái mới. Nhưng chắc okk
[None],[100000000],5,"Giao hàng nhanh 
đầy đủ số lượng 
chất lượng thì dùng ms biết 
sẽ ủng hộ tiếp "
[None],[100000000],5,"Không biết chất lượng thế nào, hi vọng không bị kích ứng. Giao hàng nhanh"
[None],[100000000],5,"đóng gói sản phẩm tốt và chắc chắn , giao hàng nhanh, shop phục vụ rất tốt"
[None],[100000000],5,"Chất lượng phục vụ tốt 😻😻😻 shop đóng gói cẩn thận, ship hàng nhanh"
[None],[100000000],5,"Đóng gói sản phẩm rất đẹp và chắc chắn 
Thời gian giao hàng rất nhanh"
[None],[100000000],5,"Giao hàng nhanh, đóng gói ổn, xvdjiehehdjdhsbshshshshdhdh...  .     .        "
[None],[100000000],5,"giao hàng nhanh, đóng gói chắc chắn, thanks shop nhìuuuuuuu"
[None],[100000000],5,"Giá rẻ,sản phẩm chất lượng, đóng gói ok,rất đáng tiền!!!!!! "
[None],[100000000],5,Giao hàng nhanh. Đóng gói khá chắc chắn và đẹp.  Sẽ ủng hộ thêm..
[None],[100000000],5,Okkkkkkkkkkkkkkkkkkkkkkkkkkkkkkkkkkkkkkkkkkkkkkkkkk
[None],[100000000],5,okkkkkkkkkkkkkkkkkkkkkkkkkkkkkkkkkkkkkkkkkkkkkkkkkkk
[None],[190000000],5,"Hàng giao nhanh
Shop còn nhắn tin riêng cho mình kèm ảnh gửi hàng nha
 Shop rất Nhiệt tình
Hàng đầy đủ"
[None],[100000000],5,"Hàng giao đầy đủ, nhanh chóng. Hy vọng dùng k bị kích ứng . giá khá bèo , date xa"
[None],[100000000],5,"Hàng đẹp, giá rẻ, nên mua, mùi thơm, chât lượng chưa rõ ràng LSmz"
[None],[100000000],5,
[None],[100000000],5,"Em mua với số lượng hơi nhiều, chuẩn bị tinh thần bị thiếu nhưng đủ lắm ạ, đóng gói hơi ẩu. Giao hàng nhanh"
[None],[100000000],5,"Mọi người nên ủng hộ shop nha 
Lần sau sàiiii hếtttt mình sẽ mua tiếppp"
[None],[100000000],5,"Giao hàng nhanh, shop phục vụ nhiệt tình, chưa sử dụng nên chưa đánh giá được chất lượng"
[None],[100000000],5,Sản phẩm chất lượnggggggggggggggggggggggggggggggggggg
[None],[100000000],5,"- Đóng gói chắc chắn
- Giao hàng đầy đủ
- Bao bì xinh
- Giao hàng nhanh"
[None],[100000000],5,Chất lượng sản phẩm tốt giao hàng nhanh chóng đóng gói chắc chắn
[None],[100000000],5,Sókanzkxnwnskzkxjbwjsjxkka   wkjsjznsjskskznznsowkbsbdjwkka
[None],[100000000],5,Vuỹtckvkbuxrzrxcvigufyvibibydydugughcydudydugigivg
[None],[100000000],5,Đóng gói cẩn thận
[None],[100000000],5,Hàng ship nhanh lắm luôn ạ trước khi đóng shop còn gửi ảnh sp cơ ạ 
[None],[100000000],5,"Giao hàng tốt, đầy đủ, anh shipper dth, nói chung là nếu dùng ổn thì mình sẽ mua lâu dài...."
[''],[190000000],5,Sp in hình . Dùng tốt lắm ạ . Shop còn chu đáo chụp hình sp gửi ns tr cho mik . Mik đx sử dụg nên k có ảnh . Ảnh phẩm chất lượng cao 🌏 Nên ủng hộ nhé !! 
[''],[190000000],5,"Ok ! Hàng chất lượng , đóng gói kĩ , phục vụ tốt , rất đáng giá tiền ! "
[None],[100000000],5,"Shop giao hàng nhanh,đóng gói gọn gàng cẩn thận.
Đầy đủ số lượng, Chất lượng tốt,date khá là dài, shop gửi ảnh trước khi giao cho khách luôn.
Chúc shop đông khách đắt hàng, sẽ ủng hộ lsau "
[None],[100000000],5,"Giá sale thì ko phải bàn r ạ. Nhân dịp lại fs nữa nên ko có gì để bàn nữa ạ. Mặt nạ thì ko chỉ dùng 1 2 cái mà khác ngay dc, n vừa đắp xong thì cug sáng sủa mọng nc hơn ấy ạ. Còn hãng này e cũng dùng kha khá mặt nạ của hãng r, e thấy cug dc ạ"
[None],[100000000],5,Cảm ơn shop bán hàng nhiệt tình dù chỉ mua flastsale 1k và free ship luôn. Mua vội nên k mua thêm sp khác. Sẽ ủng hộ shop lần tới 
[None],[100000000],5,Giao hàng nhanh đóng gói cẩn thận trc khi giao còn chụp lại cho khách xem trc sp 👍👍👍👍 Thanks shop 
[None],[100000000],5,Giao hàng nhanh. Đóng gói cẩn thận. Shop rất cẩn thận. Trc ghi đóng hàng còn chụp ảnh gửi lại cho mình check. Hàng ok. Cảm ơn shop nhé
[None],[100000000],5,"Đẹp lắm nha mấy bạn😁☺️
Mặt nạ rẻ hơn mấy shop khác😅
Mới đắp thử thấy mướt da vô cùng 😂
Cột tóc thì khỏi bàn: đẹp mà còn rẻ
Mua để lm quà sn con bn mà nó hỏi mua ở đâu chỉ nó mua k😍
Có dịp em ủng hộ tiếp 
Ak shop còn gửi hình trước khi gửi hàng nữa, thanks shop🤑"
[None],[100000000],5,Đắp cũng ưng lắm. Cảm ơn shop đã tạo cho mình cơ hội trải nghiệm thử.
[None],[100000000],5,Shop cẩn thận chụp ảnh đóng hàng trước khi giao. Mình mua nhiều loại khác nhau nhưng shop vẫn đóng đầy đủ không thiếu loại nào.
[None],[100000000],5,"giao hàng nhanh,shop cẩn thận chu đáo. sản phẩm dùng ok mình sẽ ủng hộ dài dài , để tủ lạnh sử dụng bao phê bao thích "
[None],[100000000],5,Jhbnnbnnnkokjjwksksksisskdndkdisjsjssjdjdjdkdkdkdkdk
[None],[100000000],5,Xbxjskksksksksbdbdbdjdjdjdhsjskossjsnnsksksksksksks
[None],[100000000],5,Kh có chụp ảnh lại nên lấy ảnh lúc đóng hàng shop gửi cho mình. Rất chu đáo. Mọi thứ ok. Cột tóc xinh mn ơii 
[None],[100000000],5,Chủ shop cận thận trước khi đóng hàng chụp ảnh cho khách hàng trước rồi đóng hàng gửi đi
[None],[100000000],5,"lần đầu mua hàng bên shop đúng ưng luôn ý, chủ shop dễ thương thấy mình mua nhiều còn tặng thêm mặt nạ nữa "
[None],[100000000],5,"Mua của shop mấy lần r nè, mask dùng cực thích ý, sẽ ủng hộ shop nhìu hihi "
[None],[100000000],3,"Thgian chuẩn bị hàng lâu 
Có cho xem trước khi gói hàng
Không trả lời thắc mắc của khách 
Scrunchies rất xấu."
[None],[100000000],5,"Mình nhận đủ số lượng hàng, shop chu đáo còn chụp ảnh gói hàng gửi cho mình. 5 sao cho shop"
[None],[100000000],5,Shop đóng hàng rất cẩn thận. Trước khi đóng còn chụp hình gửi khách trước nữa cơ
[None],[100000000],5,"Chất lượng tuyệt vời, đóng gói sản phẩm đẹp, giao hàng nhanh ủng hộ shop dài"
[None],[100000000],5,Mặt nạ chưa dùng nên k biết tn. Shop chụp ảnh trước khi gửi hàng. Good 👌👍👍👍
[None],[100000000],5,"Sịn sò lắm nhé :3333 chưa đắp thử nhưng nhìn xịn :3 với giá đó thì ok nha
"
[None],[100000000],5,Đã nhận được hàng ạ! Anh shipper thân thiện. Giao hàng nhanh lắm!
[None],[100000000],5,"Shop giao hàng siêu nhanh, đóng gói sản phẩm cẩn thận, tư vấn nhiệt tình "
[None],[100000000],5,"Chất lượng sản phẩm tuyệt vời, đóng gói sản phẩm rất đẹp và chắc chắn "
