name,variations,price,rating_star,comment
✅[CHÍNH HÃNG] Sữa Rửa Mặt Eucerin Cho Da Dầu Mụn- Eucerin Pro ACNE Solution Cleansing Gel 200ml Acne Oil Control Proacne,['400ml'],[38500000000],5,Ko biết sản phẩm của shop có phải hàng chính hãng thật sự ko nhưng mà tuýp klenzit c mình thấy ko giống loại mình đang dùng. Còn srm thì chưa khui. Shop phục vụ tốt
✅[CHÍNH HÃNG] Sữa Rửa Mặt Eucerin Cho Da Dầu Mụn- Eucerin Pro ACNE Solution Cleansing Gel 200ml Acne Oil Control Proacne,['200ml'],[25000000000],5,"Chất lượng sản phẩm tốt, giá thành hợp lý, nếu dùng hợp sẽ ủng hộ tiếp"
✅[CHÍNH HÃNG] Sữa Rửa Mặt Eucerin Cho Da Dầu Mụn- Eucerin Pro ACNE Solution Cleansing Gel 200ml Acne Oil Control Proacne,['400ml'],[38500000000],5,"Hàng được đóng gói cẩn thận, ship nhanh. Mình mua sale được giá rất tốt. Hàng có nhãn tiếng Việt ghi rõ ràng các thông tin. Mong là chuẩn hàng chính hãng."
✅[CHÍNH HÃNG] Sữa Rửa Mặt Eucerin Cho Da Dầu Mụn- Eucerin Pro ACNE Solution Cleansing Gel 200ml Acne Oil Control Proacne,['200ml'],[25500000000],5,"Giao hàng nhanh, đóng gói cẩn thận. Sẽ ủng hộ shop nhiều ạ hihiii"
✅[CHÍNH HÃNG] Sữa Rửa Mặt Eucerin Cho Da Dầu Mụn- Eucerin Pro ACNE Solution Cleansing Gel 200ml Acne Oil Control Proacne,['200ml'],[25900000000],5,"Siêu okkkkkk luôn 
Sản phẩm mk thấy sử dụng rất tốt 
Anh shipper giao hàng thì siêu dễ thương
Gút chóp luôn 👍👍👍👍"
✅[CHÍNH HÃNG] Sữa Rửa Mặt Eucerin Cho Da Dầu Mụn- Eucerin Pro ACNE Solution Cleansing Gel 200ml Acne Oil Control Proacne,['200ml'],[25900000000],5,"Sp tốt, đã mua trước kia của shop, rất yên tâm, giao hàng nhanh, đóng gói chắc chắn , có tem đảm bảo"
✅[CHÍNH HÃNG] Sữa Rửa Mặt Eucerin Cho Da Dầu Mụn- Eucerin Pro ACNE Solution Cleansing Gel 200ml Acne Oil Control Proacne,['200ml'],[24500000000],5,Giao hàng nhanh. Chưa mua của shop lần nào. Nên lần đầu cũng k biết chất lượng sp như nào. Mong là ổn thì lần sau sẽ ủng hộ tiếp. 🥰🥰🥰
✅[CHÍNH HÃNG] Sữa Rửa Mặt Eucerin Cho Da Dầu Mụn- Eucerin Pro ACNE Solution Cleansing Gel 200ml Acne Oil Control Proacne,['200ml'],[25900000000],5,Giao hàng nhanh. Đóng gói kỹ lưỡng. Sản phẩm có seal và chính hãng. Yên tâm khi mua hàng mà không sợ hàng nhái 
✅[CHÍNH HÃNG] Sữa Rửa Mặt Eucerin Cho Da Dầu Mụn- Eucerin Pro ACNE Solution Cleansing Gel 200ml Acne Oil Control Proacne,['200ml'],[25900000000],5,"Sữa rửa mặt tốt, dùng sạch thích lắm, giao hàng nhanh, chất lượng cao!!!"
✅[CHÍNH HÃNG] Sữa Rửa Mặt Eucerin Cho Da Dầu Mụn- Eucerin Pro ACNE Solution Cleansing Gel 200ml Acne Oil Control Proacne,['400ml'],[39000000000],5,Okokokokokokokokokokokokokokokokokokokokokokokokkokko
✅[CHÍNH HÃNG] Sữa Rửa Mặt Eucerin Cho Da Dầu Mụn- Eucerin Pro ACNE Solution Cleansing Gel 200ml Acne Oil Control Proacne,['200ml'],[23900000000],5,Sản phẩm tốt. Hàng chất lượng. Giá cả hợp lí. Cảm thấy hài lòng
✅[CHÍNH HÃNG] Sữa Rửa Mặt Eucerin Cho Da Dầu Mụn- Eucerin Pro ACNE Solution Cleansing Gel 200ml Acne Oil Control Proacne,['400ml'],[38000000000],5,Hời hơn rất nhiều so với mua ở các hàng thuốc ❤️ Sẽ ủng hộ shop dài dài
✅[CHÍNH HÃNG] Sữa Rửa Mặt Eucerin Cho Da Dầu Mụn- Eucerin Pro ACNE Solution Cleansing Gel 200ml Acne Oil Control Proacne,['400ml'],[37500000000],5,"Thấy ông anh trai dùng nên dùng ké. Thấy sale nên mua dùng luôn. ít bọt, hợp với da dầu.
Shop đóng bọc chống sốc kỹ, nguyên tem, HSD tới 2022
Shiper giao hàng thân thiện"
✅[CHÍNH HÃNG] Sữa Rửa Mặt Eucerin Cho Da Dầu Mụn- Eucerin Pro ACNE Solution Cleansing Gel 200ml Acne Oil Control Proacne,['200ml'],[24900000000],5,"Sản phẩm chính hãng đóng gói cẩn thận chắc chắn, giao hàng nhanh
"
✅[CHÍNH HÃNG] Sữa Rửa Mặt Eucerin Cho Da Dầu Mụn- Eucerin Pro ACNE Solution Cleansing Gel 200ml Acne Oil Control Proacne,['200ml'],[25900000000],5,Đã từng sử dụng kem chống nắng vs srm của Eucerin rồi nhưng cũng từ lâu rồi bh mới mua thử cả bộ dành cho da mụn của nó dùng xem sao . Hiện tại mới dùng thử tdc của hãng sắp tới sẽ khui cả bộ của nó ra sử dụng và trải nghiệm 
✅[CHÍNH HÃNG] Sữa Rửa Mặt Eucerin Cho Da Dầu Mụn- Eucerin Pro ACNE Solution Cleansing Gel 200ml Acne Oil Control Proacne,['400ml'],[37500000000],5,Mua lần 3 rồi xài ok lắm luôn còn có mã giảm giá nữa nên thấy rất hài lòng
✅[CHÍNH HÃNG] Sữa Rửa Mặt Eucerin Cho Da Dầu Mụn- Eucerin Pro ACNE Solution Cleansing Gel 200ml Acne Oil Control Proacne,['400ml'],[39900000000],5,"Đóng gói sản phẩm chắc chắn. Thời gian giao hàng nhanh. Dịch vụ chăm sóc khách hàng tốt, mình bị giao sai hàng nhưng shop đã kịp thời gọi điện và gửi lại mình hàng đúng ngay ngày hôm sau. "
✅[CHÍNH HÃNG] Sữa Rửa Mặt Eucerin Cho Da Dầu Mụn- Eucerin Pro ACNE Solution Cleansing Gel 200ml Acne Oil Control Proacne,['200ml'],[25500000000],5,"Rửa mặt xong thấy ko bị khô da ko bị kích ứng, giao hàng nhanh.."
