name,variations,price,rating_star,comment
✅[CHÍNH HÃNG] Sữa Rửa Mặt Eucerin Cho Da Dầu Mụn- Eucerin Pro ACNE Solution Cleansing Gel 200ml Acne Oil Control Proacne,['200ml'],[25900000000],5,Sản phẩm tuyệt vời. Mình mới dùng thử 2 hôm nên chưa biết kết quả sẽ như thế nào. Mình sẽ feedback sau
✅[CHÍNH HÃNG] Sữa Rửa Mặt Eucerin Cho Da Dầu Mụn- Eucerin Pro ACNE Solution Cleansing Gel 200ml Acne Oil Control Proacne,['200ml'],[25900000000],5,Sáng ra đã nhận đc điện thoại ship hàng đến rồi hehe... Bọc cẩn thận. Có xốp chống sốc. Da mình HHTD đợt này mụn đang bung bét. Hi vọng dùng em này sẽ cải thiện làn da của mình :3
✅[CHÍNH HÃNG] Sữa Rửa Mặt Eucerin Cho Da Dầu Mụn- Eucerin Pro ACNE Solution Cleansing Gel 200ml Acne Oil Control Proacne,['400ml'],[38500000000],5,"Mình dùng sp này gần 1 tuần thấy có dấu hiệu bị ngứa, nổi mụn liti và mọc mụn ẩn....rất khó chịu
Mua chai to oành 400ml chắc vứt

"
✅[CHÍNH HÃNG] Sữa Rửa Mặt Eucerin Cho Da Dầu Mụn- Eucerin Pro ACNE Solution Cleansing Gel 200ml Acne Oil Control Proacne,['200ml'],[25900000000],5,
✅[CHÍNH HÃNG] Sữa Rửa Mặt Eucerin Cho Da Dầu Mụn- Eucerin Pro ACNE Solution Cleansing Gel 200ml Acne Oil Control Proacne,['200ml'],[25900000000],3,"Dùng hơn 1 tuần bị lên mụn nhiều
Ko biết sp chuẩn ko.
Để đây. Nếu cải thiện sẽ đánh giá lại"
✅[CHÍNH HÃNG] Sữa Rửa Mặt Eucerin Cho Da Dầu Mụn- Eucerin Pro ACNE Solution Cleansing Gel 200ml Acne Oil Control Proacne,['400ml'],[38500000000],5,"Sữa rửa mặt chai lớn, hợp với da dầu, rửa rất sạch mà không bị khô da"
✅[CHÍNH HÃNG] Sữa Rửa Mặt Eucerin Cho Da Dầu Mụn- Eucerin Pro ACNE Solution Cleansing Gel 200ml Acne Oil Control Proacne,['200ml'],[26500000000],5,Okkkkkkkkkkkkkkkkkkkkkkkkkkkkkkkkkkkkkkkkkkkkkkkkkk kkkkkkkkkkkkkkkkkkkkkkkkk kkkkkkkkkkokkkkkk kkkkkkkkkkkkkkkkkk kkkkkkkkkkkkkkkkkkkkkkkkk
✅[CHÍNH HÃNG] Sữa Rửa Mặt Eucerin Cho Da Dầu Mụn- Eucerin Pro ACNE Solution Cleansing Gel 200ml Acne Oil Control Proacne,['400ml'],[38000000000],5,"Đóng gói sản phẩm đẹp và chắc chắn, chất lượng sản phẩm tuyệt vời"
✅[CHÍNH HÃNG] Sữa Rửa Mặt Eucerin Cho Da Dầu Mụn- Eucerin Pro ACNE Solution Cleansing Gel 200ml Acne Oil Control Proacne,['200ml'],[26500000000],5,"Shop gói hàng rất cẩn thận, chắc chắn. Chưa sử dụng sp nen chưa biewts chất lượng ntn ❤️❤️❤️❤️❤️❤️❤️❤️❤️"
✅[CHÍNH HÃNG] Sữa Rửa Mặt Eucerin Cho Da Dầu Mụn- Eucerin Pro ACNE Solution Cleansing Gel 200ml Acne Oil Control Proacne,['400ml'],[38500000000],5,"Khi nhận đc hàng thì mình thấy shop giao đúng mâhx đúng hàng, mình cũng chưa sử dụng nên ko biết nó có giống loại mình hay dùng ko "
✅[CHÍNH HÃNG] Sữa Rửa Mặt Eucerin Cho Da Dầu Mụn- Eucerin Pro ACNE Solution Cleansing Gel 200ml Acne Oil Control Proacne,['200ml'],[25900000000],5,"Sản phẩm dùng thích rửa xong không bị khô, có mùi thoang thoảng tinh dầu dừa không biết mọi người có thấy vậy k"
✅[CHÍNH HÃNG] Sữa Rửa Mặt Eucerin Cho Da Dầu Mụn- Eucerin Pro ACNE Solution Cleansing Gel 200ml Acne Oil Control Proacne,['400ml'],[38500000000],5,"Sữa rửa mặt dùng thích ạ, k bị khô khi rửa xong. 
Xin lỗi vì hình ảnh k liên quan, nhưng tại mình lười chụp á. Hàng chính hãng mn yên tâm mua nha."
✅[CHÍNH HÃNG] Sữa Rửa Mặt Eucerin Cho Da Dầu Mụn- Eucerin Pro ACNE Solution Cleansing Gel 200ml Acne Oil Control Proacne,"['400ml', '200ml']","[38000000000, 25500000000]",5,"Giao hàng nhanh, giis hàng cực kì cận thận luôn, tui đợi mấy ngày r mới đánh giá là để text thử sản phẩm r đánh giá luôn mà làm tuii bất ngờ cực sản phẩm có khả năng kìm dầu rất tốt còn đỡ mụn nữa mọi người nên mua nha"
✅[CHÍNH HÃNG] Sữa Rửa Mặt Eucerin Cho Da Dầu Mụn- Eucerin Pro ACNE Solution Cleansing Gel 200ml Acne Oil Control Proacne,['200ml'],[26500000000],5,Hàng đóng gói cẩn thận. Giao hàng nhanh. Mình mới đặt mà đã có hàng luôn. Nhưng mình ko thích cái mùi lắm. Nếu dùng ok lần sau mình sẽ mua tiếp
✅[CHÍNH HÃNG] Sữa Rửa Mặt Eucerin Cho Da Dầu Mụn- Eucerin Pro ACNE Solution Cleansing Gel 200ml Acne Oil Control Proacne,['400ml'],[38500000000],5,"Mua lần 3 rồi, nói chung chất lượng sp tốt, giá cả phù hợp"
✅[CHÍNH HÃNG] Sữa Rửa Mặt Eucerin Cho Da Dầu Mụn- Eucerin Pro ACNE Solution Cleansing Gel 200ml Acne Oil Control Proacne,['400ml'],[38900000000],5,"Hàng chất lượng nha mọi người, chai bị ít một chút là do mình chiết ra tặng người bạn dùng thử nha"
✅[CHÍNH HÃNG] Sữa Rửa Mặt Eucerin Cho Da Dầu Mụn- Eucerin Pro ACNE Solution Cleansing Gel 200ml Acne Oil Control Proacne,['200ml'],[25900000000],5,"Chất lượng sản phẩm tốt, giao hàng nhanh. Đóng gói cẩn thận.......hình ảnh chỉ mang tính chất nhận xu"
✅[CHÍNH HÃNG] Sữa Rửa Mặt Eucerin Cho Da Dầu Mụn- Eucerin Pro ACNE Solution Cleansing Gel 200ml Acne Oil Control Proacne,['200ml'],[25900000000],5,Giao hàng nhanh. Chất lượng sản phẩm chưa dùng nên chưa biết. Mong là chất lượng tốt ^^
✅[CHÍNH HÃNG] Sữa Rửa Mặt Eucerin Cho Da Dầu Mụn- Eucerin Pro ACNE Solution Cleansing Gel 200ml Acne Oil Control Proacne,['200ml'],[25900000000],5,Chất lượng sản phẩm tuyệt vời.Đóng gói sản phẩm chắc chắn!!!!!!
✅[CHÍNH HÃNG] Sữa Rửa Mặt Eucerin Cho Da Dầu Mụn- Eucerin Pro ACNE Solution Cleansing Gel 200ml Acne Oil Control Proacne,['400ml'],[38000000000],5,"Chai 400ml dùng trong 6 tháng
Chai thứ 2 t order- dùng cho da dầu mụn, sau khi rửa mặt sẽ hơi căng nhẹ."
✅[CHÍNH HÃNG] Sữa Rửa Mặt Eucerin Cho Da Dầu Mụn- Eucerin Pro ACNE Solution Cleansing Gel 200ml Acne Oil Control Proacne,['200ml'],[25900000000],5,"Ok, đóng gói kĩ, vỏ chai chắc chắn, chất lượng thì dùng 1 time mới biết được"
✅[CHÍNH HÃNG] Sữa Rửa Mặt Eucerin Cho Da Dầu Mụn- Eucerin Pro ACNE Solution Cleansing Gel 200ml Acne Oil Control Proacne,['200ml'],[25500000000],5,Giao hàng nhanh. Bọc hàng kỹ. Srm e chưa dùng bh nhưng vì muốn xài thử srm dạng gel nên mua. Mùi k dc thơm hay gì ý. Có tem mác đầy đủ. Biết tới shop lâu rùi giờ mới mua. Xưa đi gà spa giới thiệu hãng eucerin mà giá cao qtr mà còn như muốn ép mua hên là k mua. Giờ kiếm bên đây bán giá ok hơn.
✅[CHÍNH HÃNG] Sữa Rửa Mặt Eucerin Cho Da Dầu Mụn- Eucerin Pro ACNE Solution Cleansing Gel 200ml Acne Oil Control Proacne,['400ml'],[38500000000],2,Lúc bóc nilon ra dùng thì gãy đầu ấn shop ơiiiii 😡😡🥵🥵🥶🥶🥶🥶😡🥶🥶🥵😡🥶🥶😡🥶🥵🥵🥶🥶🥶🥶🥶🥶🥶🥶🥶
✅[CHÍNH HÃNG] Sữa Rửa Mặt Eucerin Cho Da Dầu Mụn- Eucerin Pro ACNE Solution Cleansing Gel 200ml Acne Oil Control Proacne,['400ml'],[38500000000],5,"Chai to, dùng chắc sang năm mới hết. Hợp loại eucerin này nên dùng cả bộ da mụn cũng hết rất hiệu quả. "
✅[CHÍNH HÃNG] Sữa Rửa Mặt Eucerin Cho Da Dầu Mụn- Eucerin Pro ACNE Solution Cleansing Gel 200ml Acne Oil Control Proacne,['400ml'],[38500000000],5,"Sản phẩm chính hãng, giá cả hợp lý. Sẽ ủng hộ shop tiếp trong tgian tới."
✅[CHÍNH HÃNG] Sữa Rửa Mặt Eucerin Cho Da Dầu Mụn- Eucerin Pro ACNE Solution Cleansing Gel 200ml Acne Oil Control Proacne,['200ml'],[25500000000],5,"Shop phục vụ tốt, hàng thật( mình đã tính mã vạch), hàng nhập từ thái lan( 1 chi nhánh của eucerin ), chưa dùng nên chưa biết hiệu quả như nào. Sẽ quay lại ủng hộ shop nếu mình dùng thấy tốt."
✅[CHÍNH HÃNG] Sữa Rửa Mặt Eucerin Cho Da Dầu Mụn- Eucerin Pro ACNE Solution Cleansing Gel 200ml Acne Oil Control Proacne,['400ml'],[38000000000],5,Sốt giao hàng nhanh gói hàng cẩn thận đã mua của shop dùng hàng chuẩn
✅[CHÍNH HÃNG] Sữa Rửa Mặt Eucerin Cho Da Dầu Mụn- Eucerin Pro ACNE Solution Cleansing Gel 200ml Acne Oil Control Proacne,['400ml'],[38000000000],5,"Shop giao nhanhhhhhhhhhh, mới dùng nên chưa biết, nh rửa mặt thấy ok, không bị khô quá, mềm da"
✅[CHÍNH HÃNG] Sữa Rửa Mặt Eucerin Cho Da Dầu Mụn- Eucerin Pro ACNE Solution Cleansing Gel 200ml Acne Oil Control Proacne,['200ml'],[25900000000],5,"SHOP phục vụ rất tốt,rất đáng tiền,..........mọi ngưòi mua ủng hộ shop nhé"
✅[CHÍNH HÃNG] Sữa Rửa Mặt Eucerin Cho Da Dầu Mụn- Eucerin Pro ACNE Solution Cleansing Gel 200ml Acne Oil Control Proacne,['200ml'],[25900000000],5,útiskdjtstdkdyjdykdykdkdkydydjtstjsstjstjsyjstjstjstjstj
✅[CHÍNH HÃNG] Sữa Rửa Mặt Eucerin Cho Da Dầu Mụn- Eucerin Pro ACNE Solution Cleansing Gel 200ml Acne Oil Control Proacne,['400ml'],[38900000000],5,"Sản phẩm giao nhanh . Đóng gói kĩ càng , sp mẫu mã đẹp . Còn cảm nhận thì phải dùng 1 thời gian nữa "
✅[CHÍNH HÃNG] Sữa Rửa Mặt Eucerin Cho Da Dầu Mụn- Eucerin Pro ACNE Solution Cleansing Gel 200ml Acne Oil Control Proacne,['200ml'],[25900000000],5,mua giùm nên k biết ntn. okkkkkkkkkkk giao hàng tầm 3 4 ngàyyyyyyyyyy
✅[CHÍNH HÃNG] Sữa Rửa Mặt Eucerin Cho Da Dầu Mụn- Eucerin Pro ACNE Solution Cleansing Gel 200ml Acne Oil Control Proacne,['200ml'],[25900000000],5,Sản phẩm này rửa sạch lắm mà cũng không làm mất ẩm nhiều. Mình dùng xen kẽ bạn này và dòng PH5 Cleanser. Cũng ổn áp lắm
✅[CHÍNH HÃNG] Sữa Rửa Mặt Eucerin Cho Da Dầu Mụn- Eucerin Pro ACNE Solution Cleansing Gel 200ml Acne Oil Control Proacne,['200ml'],[23500000000],5,Đóng gói kĩ và giao hàng nhanh. Mình dùng srm này rồi và khá thích nên mua lại
✅[CHÍNH HÃNG] Sữa Rửa Mặt Eucerin Cho Da Dầu Mụn- Eucerin Pro ACNE Solution Cleansing Gel 200ml Acne Oil Control Proacne,['200ml'],[25500000000],5,"Đã mua lần thứ 3,4 gì đó, dùng oke lắm ạ, sẽ ủng hộ shop dài dài "
✅[CHÍNH HÃNG] Sữa Rửa Mặt Eucerin Cho Da Dầu Mụn- Eucerin Pro ACNE Solution Cleansing Gel 200ml Acne Oil Control Proacne,['200ml'],[25900000000],5,"Sp rửa xong sạch k nhờn dùng hnay ngày thứ 4 đẩy ụn ẩn lên rồi, dùng xong nếu mua lần 2 feedback rõ hơn nha"
✅[CHÍNH HÃNG] Sữa Rửa Mặt Eucerin Cho Da Dầu Mụn- Eucerin Pro ACNE Solution Cleansing Gel 200ml Acne Oil Control Proacne,['200ml'],[25900000000],5,Sp có tem mác đầy đủ. Nhưng chưa sử dụng nên chưa biết kết quả mong sẽ tốt 
✅[CHÍNH HÃNG] Sữa Rửa Mặt Eucerin Cho Da Dầu Mụn- Eucerin Pro ACNE Solution Cleansing Gel 200ml Acne Oil Control Proacne,['400ml'],[38500000000],5,"Hàng xịn,bao bì đẹp,được lắm luônnnnn áaaaaaa trờiiiiiiiii"
✅[CHÍNH HÃNG] Sữa Rửa Mặt Eucerin Cho Da Dầu Mụn- Eucerin Pro ACNE Solution Cleansing Gel 200ml Acne Oil Control Proacne,['200ml'],[25500000000],5,Hàng Real nha mọi người! Mình đã check in đầy đủ r và e nó Sài rất tốt
✅[CHÍNH HÃNG] Sữa Rửa Mặt Eucerin Cho Da Dầu Mụn- Eucerin Pro ACNE Solution Cleansing Gel 200ml Acne Oil Control Proacne,['200ml'],[25900000000],5,"Giao hàng siêu nhanh, đóng hàng cẩn thận còn nguyên nhãn mác."
✅[CHÍNH HÃNG] Sữa Rửa Mặt Eucerin Cho Da Dầu Mụn- Eucerin Pro ACNE Solution Cleansing Gel 200ml Acne Oil Control Proacne,['200ml'],[25900000000],5,"Chính hãng, date xa, shop đóng gói cẩn thận, thời gian giao hàng nhanh."
✅[CHÍNH HÃNG] Sữa Rửa Mặt Eucerin Cho Da Dầu Mụn- Eucerin Pro ACNE Solution Cleansing Gel 200ml Acne Oil Control Proacne,['200ml'],[25900000000],5,Nsbssjjsjssssgsvwvsjksnsksnwbsjksneekdnsbsbevndmdkdkdmnekeendbwbbaabbsnnsh abbsbnabs nsnabhah ư. Snahjwnanammsnbsnamamnndmw. Junwjmwanwkq nwnqmj1mambsbw am ân eb.    Qubebnendb.  Mwnnnsnsnavbw. Shba wbwnwnbsnw.  Sự. Skbwbwb nwnjwj giư. Abwbdjs. Jwnjwkwknwknwwlkoke33uuesjsjsjrjhgwn wjwbbs ươn wbwj ư 
✅[CHÍNH HÃNG] Sữa Rửa Mặt Eucerin Cho Da Dầu Mụn- Eucerin Pro ACNE Solution Cleansing Gel 200ml Acne Oil Control Proacne,['200ml'],[25900000000],5,"Đóng gói sản phẩm rất cẩn thận, thời gian giao hàng nhanh, thấy review tốt newn mua thử xem.."
✅[CHÍNH HÃNG] Sữa Rửa Mặt Eucerin Cho Da Dầu Mụn- Eucerin Pro ACNE Solution Cleansing Gel 200ml Acne Oil Control Proacne,['200ml'],[25900000000],5,"Giao hàng hơi lâu, sản phẩm được bọc tốt chưa dùng nên chưa biết chất lượng "
✅[CHÍNH HÃNG] Sữa Rửa Mặt Eucerin Cho Da Dầu Mụn- Eucerin Pro ACNE Solution Cleansing Gel 200ml Acne Oil Control Proacne,['400ml'],[38500000000],5,"chất lượng tốt, lọ to mà rẻ 🙄🙄🙄🙄🙄🙄🙄🙄"
✅[CHÍNH HÃNG] Sữa Rửa Mặt Eucerin Cho Da Dầu Mụn- Eucerin Pro ACNE Solution Cleansing Gel 200ml Acne Oil Control Proacne,['400ml'],[38500000000],5,"Mua của shop nhiều lần rồi, sản phẩm chất lượng, mong là da mình sẽ đẹp lên! Sẽ ủng hộ shop dàu dài ạ"
✅[CHÍNH HÃNG] Sữa Rửa Mặt Eucerin Cho Da Dầu Mụn- Eucerin Pro ACNE Solution Cleansing Gel 200ml Acne Oil Control Proacne,['200ml'],[25900000000],5," Đóng gói tốt, giao hàng nhanh, chưa dùng nên chưa có cảm nhận
Giá tốt hơn "
✅[CHÍNH HÃNG] Sữa Rửa Mặt Eucerin Cho Da Dầu Mụn- Eucerin Pro ACNE Solution Cleansing Gel 200ml Acne Oil Control Proacne,['200ml'],[25900000000],5,
✅[CHÍNH HÃNG] Sữa Rửa Mặt Eucerin Cho Da Dầu Mụn- Eucerin Pro ACNE Solution Cleansing Gel 200ml Acne Oil Control Proacne,['200ml'],[25900000000],5,"Loại 200ml nhỏ xinh thật. Dùng loại này thích lắm mọi người ạ
Gần Tết Shiper Now bận đi xem Đào, Quất thì phải; chủ shop nhiệt tình xác nhận lại đơn lần 3 mới có Ship giao"
✅[CHÍNH HÃNG] Sữa Rửa Mặt Eucerin Cho Da Dầu Mụn- Eucerin Pro ACNE Solution Cleansing Gel 200ml Acne Oil Control Proacne,['200ml'],[25900000000],5,"Sản phẩm có tem chống giả + nhãn phụ đầy đủ rất yên tâm
Hsd đến T7/2023 rất là ưng luôn ạ"
✅[CHÍNH HÃNG] Sữa Rửa Mặt Eucerin Cho Da Dầu Mụn- Eucerin Pro ACNE Solution Cleansing Gel 200ml Acne Oil Control Proacne,['400ml'],[38500000000],5,Shop tloi nhanh. Còn gửi tặng sample nữa. Mai m dùng xem có giống với chai cũ mua chính hãng k rồi review tiếp mn nha
✅[CHÍNH HÃNG] Sữa Rửa Mặt Eucerin Cho Da Dầu Mụn- Eucerin Pro ACNE Solution Cleansing Gel 200ml Acne Oil Control Proacne,['200ml'],[25900000000],5,"Cả kcn và srm đều có tem chống giả 👍👍👍
Còn được tặng 1 gói kem dưỡng 👌👌👌👌"
✅[CHÍNH HÃNG] Sữa Rửa Mặt Eucerin Cho Da Dầu Mụn- Eucerin Pro ACNE Solution Cleansing Gel 200ml Acne Oil Control Proacne,['400ml'],[38000000000],5,Giao hàng nhanh ạ. Mình vừa đặt xong tiếng sau có luôn. Chỉ hi vọng là hàng chính hãng tại thấy rẻ hơn các shop khác
✅[CHÍNH HÃNG] Sữa Rửa Mặt Eucerin Cho Da Dầu Mụn- Eucerin Pro ACNE Solution Cleansing Gel 200ml Acne Oil Control Proacne,['400ml'],[38000000000],4,"1. Rẻ hơn các shop khác, rep nhiệt tình.
2. Khác với chai mình dùng hiện tại mua ở da liễu, cụ thể là chất gel lỏng hơn, rửa không sạch bằng (mình  dùng trong 3 ngày mới review nhé).
3. Giải thích do lô hàng khác nhau nhưng không thuyết phục lắm. 4 sao vì rep nhiệt tình."
✅[CHÍNH HÃNG] Sữa Rửa Mặt Eucerin Cho Da Dầu Mụn- Eucerin Pro ACNE Solution Cleansing Gel 200ml Acne Oil Control Proacne,['400ml'],[37600000000],5,"Shop tư vấn rất nhiệt tình dù mình hỏi hơi nhiều:)))
Mình đặt niềm tin vào shop nên hy vọng sp chính hãng ạ
Mình đã dùng trong 3 ngày và thấy rất okk. K quá khô khi rửa mặt xong"
✅[CHÍNH HÃNG] Sữa Rửa Mặt Eucerin Cho Da Dầu Mụn- Eucerin Pro ACNE Solution Cleansing Gel 200ml Acne Oil Control Proacne,['400ml'],[38000000000],5,"Đóng gói cẩn thận, hàng chính hãng. Mình đã từng dùng srm này 1 lần rồi, lần này là mua lại. Mng sử dụng đặc biệt da nhạy cảm và da dầu như mình là dùng oke lắm, dùng cho cả mụn lưng và cánh tay cũng hết luôn"
✅[CHÍNH HÃNG] Sữa Rửa Mặt Eucerin Cho Da Dầu Mụn- Eucerin Pro ACNE Solution Cleansing Gel 200ml Acne Oil Control Proacne,['400ml'],[38500000000],5,"Shop giao hàng nhiệt tình , sẽ ủng hộ tiếp , mình chưa dùng nhưng rất đáng mua "
✅[CHÍNH HÃNG] Sữa Rửa Mặt Eucerin Cho Da Dầu Mụn- Eucerin Pro ACNE Solution Cleansing Gel 200ml Acne Oil Control Proacne,['200ml'],[25900000000],5,"Check mã thành công. Sẽ ủng hộ shop lần sau jdjdjdkkdkxkxkxkxkkxkxkxkxkxkckkckckckckckkckckckckckkckkckckkkckckckckckckkckckckckckck
 "
✅[CHÍNH HÃNG] Sữa Rửa Mặt Eucerin Cho Da Dầu Mụn- Eucerin Pro ACNE Solution Cleansing Gel 200ml Acne Oil Control Proacne,['200ml'],[25900000000],5,"Giao hàng nhanh. Mùi thơm dễ chịu, hợp với làn da 
Vì mình chọn dvvc là nowship nên không biết shop đóng gói có cần thận không nữa hihi"
✅[CHÍNH HÃNG] Sữa Rửa Mặt Eucerin Cho Da Dầu Mụn- Eucerin Pro ACNE Solution Cleansing Gel 200ml Acne Oil Control Proacne,['400ml'],[38000000000],5,"Giao hàng rất nhanh vì mình đặt nowship 😄
Sản phẩm không mùi không màu, dùng cùng cốc tạo bọt thì khá bông"
✅[CHÍNH HÃNG] Sữa Rửa Mặt Eucerin Cho Da Dầu Mụn- Eucerin Pro ACNE Solution Cleansing Gel 200ml Acne Oil Control Proacne,['200ml'],[25600000000],5,Chất lượng sản phẩm này là của chúng ta sẽ không có tiền đâu ra vậy đó em có biết không có tiền mua đồ cho 
✅[CHÍNH HÃNG] Sữa Rửa Mặt Eucerin Cho Da Dầu Mụn- Eucerin Pro ACNE Solution Cleansing Gel 200ml Acne Oil Control Proacne,['400ml'],[38000000000],5,"Srm thì mua lại lần 2, check code ra chính hãng, shop cũng cam kết chính hãng, giá rẻ hơn store, phù hợp cho da dầu mụn"
✅[CHÍNH HÃNG] Sữa Rửa Mặt Eucerin Cho Da Dầu Mụn- Eucerin Pro ACNE Solution Cleansing Gel 200ml Acne Oil Control Proacne,['200ml'],[25900000000],5,"giao hàng nhanh lắm, mình đặt từ trưa hôm trước sáng hôm sau đã giao ồy
chưa dùng nên chưa biết chất lượng ntn, mong là hàng chính hãng"
✅[CHÍNH HÃNG] Sữa Rửa Mặt Eucerin Cho Da Dầu Mụn- Eucerin Pro ACNE Solution Cleansing Gel 200ml Acne Oil Control Proacne,['200ml'],[25900000000],5,"Giao hàng siêu nhanh , đóng gói chắc chắn cẩn thận , chưa sử dụng nên sẽ quay lại đáng giá sau, nếu ổn sẽ ủng hộ dài dài"
✅[CHÍNH HÃNG] Sữa Rửa Mặt Eucerin Cho Da Dầu Mụn- Eucerin Pro ACNE Solution Cleansing Gel 200ml Acne Oil Control Proacne,['200ml'],[25900000000],5,"Shop phục vụ nhanh. Gói hàng gọn gàng đầy đủ, bọc xốp an toàn. Chưa test xem có hợp da không nhưng mà hàng trông chuẩn. "
✅[CHÍNH HÃNG] Sữa Rửa Mặt Eucerin Cho Da Dầu Mụn- Eucerin Pro ACNE Solution Cleansing Gel 200ml Acne Oil Control Proacne,['200ml'],[25900000000],5,"Sản phấm tốt, giao hàng nhanh, đóng gói chắc chắn đẹpppppppp"
✅[CHÍNH HÃNG] Sữa Rửa Mặt Eucerin Cho Da Dầu Mụn- Eucerin Pro ACNE Solution Cleansing Gel 200ml Acne Oil Control Proacne,['200ml'],[25900000000],5,"Nhìn chai không to lắm nhưng dùng lâu hơn mình tưởng. Phải mấy tháng mới mua một lần. Dùng siêu thích, không muốn đổi sang loại khác luôn"
✅[CHÍNH HÃNG] Sữa Rửa Mặt Eucerin Cho Da Dầu Mụn- Eucerin Pro ACNE Solution Cleansing Gel 200ml Acne Oil Control Proacne,['200ml'],[25900000000],5,"Có thư cảm ơn đi kèm rất đáng yêu. Chọn ship hỏa tốc và hẹn giờ giao thì shop làm rất chuẩn chiều đặt tối đã nhận đc rồi. Sp nguyên vẹn, dùng xong sẽ đánh giá lại"
✅[CHÍNH HÃNG] Sữa Rửa Mặt Eucerin Cho Da Dầu Mụn- Eucerin Pro ACNE Solution Cleansing Gel 200ml Acne Oil Control Proacne,['200ml'],[25900000000],5,"Ơ mây zing gút chóp sản phẩm rất ok, rất hài lòng, sẽ ủng hộ dài dài"
✅[CHÍNH HÃNG] Sữa Rửa Mặt Eucerin Cho Da Dầu Mụn- Eucerin Pro ACNE Solution Cleansing Gel 200ml Acne Oil Control Proacne,['200ml'],[24500000000],5,"Đang dùng thấy da mềm, không bị khô, không kích ứng. Hi vọng giảm mụn. chị shop nhiệt tình. ok"
✅[CHÍNH HÃNG] Sữa Rửa Mặt Eucerin Cho Da Dầu Mụn- Eucerin Pro ACNE Solution Cleansing Gel 200ml Acne Oil Control Proacne,['200ml'],[25900000000],5,"
 Check mã vạch Hàng chuẩn 
Dùng ok lần sau sẽ mua ủng hộ shop tiếp"
✅[CHÍNH HÃNG] Sữa Rửa Mặt Eucerin Cho Da Dầu Mụn- Eucerin Pro ACNE Solution Cleansing Gel 200ml Acne Oil Control Proacne,['200ml'],[25900000000],5,"Giao hàng nhanh nè, gói hàng kĩ. Sản phẩm chất lượng nhé . Mình rất hài lòng"
✅[CHÍNH HÃNG] Sữa Rửa Mặt Eucerin Cho Da Dầu Mụn- Eucerin Pro ACNE Solution Cleansing Gel 200ml Acne Oil Control Proacne,['400ml'],[39900000000],5,"Trước hay dùng Nevia, đi Gà Spa nặn mụn mấy em xinh tươi khuyên nên chọn Eucerin cho đỡ bọt và hợp với da. Dùng hết và mua tiếp chai 400ml dùng cho thích
Shop bán giá tốt và đóng chống sốc đầy đủ
J&T giao hàng hơi lâu, tận 2/11 mới giao"
✅[CHÍNH HÃNG] Sữa Rửa Mặt Eucerin Cho Da Dầu Mụn- Eucerin Pro ACNE Solution Cleansing Gel 200ml Acne Oil Control Proacne,['200ml'],[25900000000],5,"Chất lượng sản phẩm tuyệt vời, đóng gói sản phẩm rất đẹp và chắc chắn."
✅[CHÍNH HÃNG] Sữa Rửa Mặt Eucerin Cho Da Dầu Mụn- Eucerin Pro ACNE Solution Cleansing Gel 200ml Acne Oil Control Proacne,['200ml'],[25900000000],5,Sản phẩm rất tốt mk đã mua lại mấy lần rồi ạ...mk lười chụp ảnh mong mn thông cảm😁
✅[CHÍNH HÃNG] Sữa Rửa Mặt Eucerin Cho Da Dầu Mụn- Eucerin Pro ACNE Solution Cleansing Gel 200ml Acne Oil Control Proacne,['200ml'],[24500000000],5,"Giao hàng tốt, hàng đẹp, chắc chắnnnnnnnnnnnnnnnnnnnnnnnn"
✅[CHÍNH HÃNG] Sữa Rửa Mặt Eucerin Cho Da Dầu Mụn- Eucerin Pro ACNE Solution Cleansing Gel 200ml Acne Oil Control Proacne,['200ml'],[24500000000],5,"Shop chuẩn bị hàng nhanh, giao nhanh. Đóng gói cẩn thận, có bọc chống sốc, sp đã mua lần 2 ,dạng gel dùng rất tiết kiệm, sp phù hợp cho da dầu mụn. Hàng chính hãng , nên mua mn nhé!"
✅[CHÍNH HÃNG] Sữa Rửa Mặt Eucerin Cho Da Dầu Mụn- Eucerin Pro ACNE Solution Cleansing Gel 200ml Acne Oil Control Proacne,['200ml'],[25900000000],5,"Mình check các kiểu
So với srm mua ở bệnh viện
Real nha mng, giá rẻ
Đáng mua ớ"
✅[CHÍNH HÃNG] Sữa Rửa Mặt Eucerin Cho Da Dầu Mụn- Eucerin Pro ACNE Solution Cleansing Gel 200ml Acne Oil Control Proacne,['200ml'],[24500000000],5,Hàng chuẩn y hệt lọ mình mua ở da liễu . Mua dc sale nên rẻ . 5 saoo
✅[CHÍNH HÃNG] Sữa Rửa Mặt Eucerin Cho Da Dầu Mụn- Eucerin Pro ACNE Solution Cleansing Gel 200ml Acne Oil Control Proacne,['200ml'],[25900000000],5,Okkkkkkk nè sàiiiiiiiiiiiiiiiii rất thơmmmmmmmmmmmmmmmmmmmmmmmmmmmmmmmmm
✅[CHÍNH HÃNG] Sữa Rửa Mặt Eucerin Cho Da Dầu Mụn- Eucerin Pro ACNE Solution Cleansing Gel 200ml Acne Oil Control Proacne,['400ml'],[36000000000],5,Nhận hàng ưng ý. Thấy xịn xò lắm. Chưa ktra dc với chai cũ đang dùng nhưng thấy ok lắm hzbxbxbxbbx
✅[CHÍNH HÃNG] Sữa Rửa Mặt Eucerin Cho Da Dầu Mụn- Eucerin Pro ACNE Solution Cleansing Gel 200ml Acne Oil Control Proacne,['200ml'],[25000000000],5,"Bán rẻ hơn mall, hàng chính hãng, giao hàng nhanh, chưa dùng nhưng nghe review okela. Sẽ comment lại sau 1 tuần sử dụng"
✅[CHÍNH HÃNG] Sữa Rửa Mặt Eucerin Cho Da Dầu Mụn- Eucerin Pro ACNE Solution Cleansing Gel 200ml Acne Oil Control Proacne,['400ml'],[37900000000],5,"Hàng đóng gói rất chắc chắn, shop còn giao nhanh nữa, sẽ ủng hộ shop những lần sắp tới! "
✅[CHÍNH HÃNG] Sữa Rửa Mặt Eucerin Cho Da Dầu Mụn- Eucerin Pro ACNE Solution Cleansing Gel 200ml Acne Oil Control Proacne,['200ml'],[25900000000],5,Hshwuaiaksjzbabqywtagqjsodkdbsbahqtqteuriwpwkxnxbsjqis
✅[CHÍNH HÃNG] Sữa Rửa Mặt Eucerin Cho Da Dầu Mụn- Eucerin Pro ACNE Solution Cleansing Gel 200ml Acne Oil Control Proacne,['400ml'],[39900000000],5,"Sản phẩm dùng siêu thích, rửa sạch mà không bị khô da. Shop giao hàng siêu nhanh, đặt sáng hôm trước thì sáng hôm sau nhận được luôn. Lần trước mua chai 200ml, lần này mua hẳn chai 400ml luôn. Sẽ tiếp tục ủng hộ shop."
✅[CHÍNH HÃNG] Sữa Rửa Mặt Eucerin Cho Da Dầu Mụn- Eucerin Pro ACNE Solution Cleansing Gel 200ml Acne Oil Control Proacne,['200ml'],[24300000000],5,"Đóng gói sản phẩm tuyệt vời và chắc chắn, thời gian giao hàng nhanh. "
