name,variations,price,rating_star,comment
✅[CHÍNH HÃNG] Sữa Rửa Mặt Eucerin Cho Da Dầu Mụn- Eucerin Pro ACNE Solution Cleansing Gel 200ml Acne Oil Control Proacne,['200ml'],[25200000000],5,"Lần thứ 2 mua của shop rồi ạ, đóng gói cẩn thận, dùng sản phẩm này nhẹ nhàng, ko kích ứng trên da của mình... "
✅[CHÍNH HÃNG] Sữa Rửa Mặt Eucerin Cho Da Dầu Mụn- Eucerin Pro ACNE Solution Cleansing Gel 200ml Acne Oil Control Proacne,['400ml'],[36900000000],5,"Giao hàng nhanh 
Vận chuyển hàng bị móp méo rất thật vọng
Shipper khó tính và nạt khách hàng dữ dội 
Chất gel lỏng hơn so với lần trước  mẫu mã cũng khác hơn trước
Shop nhiệt tình rep ib nhanh và thân thiện 
🥰🥰🥰 khuyến khích 5 sao vì sự nhiệt tình đó còn bên vận chuyển thì thất vọng vô cùng 🤦"
✅[CHÍNH HÃNG] Sữa Rửa Mặt Eucerin Cho Da Dầu Mụn- Eucerin Pro ACNE Solution Cleansing Gel 200ml Acne Oil Control Proacne,['200ml'],[25900000000],5,"The weight W, or gravitational force, is then just the mass of an object times the gravitational acceleration. Since the gravitational constant (g) depends on the square of the distance from the center of the earth, the weight of an object decreases with altitude."
✅[CHÍNH HÃNG] Sữa Rửa Mặt Eucerin Cho Da Dầu Mụn- Eucerin Pro ACNE Solution Cleansing Gel 200ml Acne Oil Control Proacne,['400ml'],[37500000000],5,"Sp tốt “ĐẠI PHÚ HÀO” TRƯƠNG HÂN NGHIÊU ĐƯỢC FENDI ĐĂNG ẢNH LÊN WEIBO 💯

Ủa anh, sao anh giàu anh bận một cây đồ Fendi mà anh hông được làm chủ gia đình vậy ạ 😢"
✅[CHÍNH HÃNG] Sữa Rửa Mặt Eucerin Cho Da Dầu Mụn- Eucerin Pro ACNE Solution Cleansing Gel 200ml Acne Oil Control Proacne,['400ml'],[36900000000],5,"Sau 10 ngày sd mình thấy khá oke, da mình là da dầu mụn. K hương liệu nên sp có mùi là lạ, hơi khó ngửi 1 chút, nhưng dần r cũng quen. Dùng hết sẽ mua lại ạ🥰"
✅[CHÍNH HÃNG] Sữa Rửa Mặt Eucerin Cho Da Dầu Mụn- Eucerin Pro ACNE Solution Cleansing Gel 200ml Acne Oil Control Proacne,['400ml'],[39000000000],5,"Màu lọ 400ml hơi khác so với lọ nhỏ mình đang dùng, không biết do vận chuyển hay gì nhưng sản phẩm lại có bọt trắng trong khi lọ nhỏ mình cũng cầm đi cầm về suốt nhưng chưa bao giờ thấy nổi bọt lên như vậy. Hi vọng là hàng chuẩn ạ"
✅[CHÍNH HÃNG] Sữa Rửa Mặt Eucerin Cho Da Dầu Mụn- Eucerin Pro ACNE Solution Cleansing Gel 200ml Acne Oil Control Proacne,['200ml'],[25900000000],5,"Đã nhận được hàng, hình ảnh chỉ mang tính chất minh họ. Lọ tonner hơi khác so với lọ mình đang dùng, kbiet có sao không."
✅[CHÍNH HÃNG] Sữa Rửa Mặt Eucerin Cho Da Dầu Mụn- Eucerin Pro ACNE Solution Cleansing Gel 200ml Acne Oil Control Proacne,['400ml'],[34000000000],5,đóng gói sản phẩm rất chắc chắn. không biết chất lượng như nào nhưng mà rất ưng ạ. tặng shop 5 sao 👍
✅[CHÍNH HÃNG] Sữa Rửa Mặt Eucerin Cho Da Dầu Mụn- Eucerin Pro ACNE Solution Cleansing Gel 200ml Acne Oil Control Proacne,['200ml'],[25900000000],5,"Mình dùng kem chống nắng rất thích, mướt nhưng đến chiều thì lại thấy có ghét ra. Nhưng không sao cả😊😊😊😊😊😊😊😊😊😊😊"
✅[CHÍNH HÃNG] Sữa Rửa Mặt Eucerin Cho Da Dầu Mụn- Eucerin Pro ACNE Solution Cleansing Gel 200ml Acne Oil Control Proacne,['400ml'],[37500000000],5,"Đã mua size nhỏ 200ml dùng rất thích nên mua tiếp chai 400ml. Shop đóng gói cẩn thận, giao hàng nhanh"
✅[CHÍNH HÃNG] Sữa Rửa Mặt Eucerin Cho Da Dầu Mụn- Eucerin Pro ACNE Solution Cleansing Gel 200ml Acne Oil Control Proacne,['400ml'],[37500000000],5,"Shop giao hàng nhanh, tư vấn nhiệt tình, mình đã mua nhiều sp tại shop và sẽ ủng hộ thêm"
✅[CHÍNH HÃNG] Sữa Rửa Mặt Eucerin Cho Da Dầu Mụn- Eucerin Pro ACNE Solution Cleansing Gel 200ml Acne Oil Control Proacne,['400ml'],[37500000000],5,"Mình mua nhiều lần bên shop rùi, thấy dùng ok chỉ canh sale để đặt thêm 🤩🤩🤩🤩🥰🥰🥰🥰🥰🥰🥰"
✅[CHÍNH HÃNG] Sữa Rửa Mặt Eucerin Cho Da Dầu Mụn- Eucerin Pro ACNE Solution Cleansing Gel 200ml Acne Oil Control Proacne,['400ml'],[39000000000],5,"Sản phẩm phù hợp với da đâu mụn, sạch sâu mà ko bị khô da, sử dụng xong da rất mềm"
✅[CHÍNH HÃNG] Sữa Rửa Mặt Eucerin Cho Da Dầu Mụn- Eucerin Pro ACNE Solution Cleansing Gel 200ml Acne Oil Control Proacne,['400ml'],[39500000000],5,"Chất lượng sản phẩm tốt, giao hàng nhanh, sẽ ủng hộ shop tiếp tròn thời gian tới"
✅[CHÍNH HÃNG] Sữa Rửa Mặt Eucerin Cho Da Dầu Mụn- Eucerin Pro ACNE Solution Cleansing Gel 200ml Acne Oil Control Proacne,['200ml'],[25900000000],5,"Dùng là phê luôn ạ , thoáng , rửa xong mặt k bị khô mà ẩm mượt nha mọi người"
✅[CHÍNH HÃNG] Sữa Rửa Mặt Eucerin Cho Da Dầu Mụn- Eucerin Pro ACNE Solution Cleansing Gel 200ml Acne Oil Control Proacne,['200ml'],[25900000000],3,"Đóng gói oke, nhưnggggg!!! Why??? Tại sao bảo cho da dầu mà lại thêm dầu, từ hôm mình dùng srm này mặt mình lượng dầu tiết ra chắc phải gấp 3 bình thường, sợ luôn, bảo nóng ra dầu thì thôi, đây ngồi điều hoà mà ối zồi ôi luôn. Tiếc tiền quá huhu"
✅[CHÍNH HÃNG] Sữa Rửa Mặt Eucerin Cho Da Dầu Mụn- Eucerin Pro ACNE Solution Cleansing Gel 200ml Acne Oil Control Proacne,['200ml'],[25900000000],5,"Giao hàng nhanh; hàng chất lượng, sẽ ủng hộ lần sau nữa.
Cảm ơn shop!"
✅[CHÍNH HÃNG] Sữa Rửa Mặt Eucerin Cho Da Dầu Mụn- Eucerin Pro ACNE Solution Cleansing Gel 200ml Acne Oil Control Proacne,['200ml'],[25200000000],5,"Srm dùng tốt phết nè
Giao hàng nhanh
Hình ảnh mang tính chất minh hoạ"
✅[CHÍNH HÃNG] Sữa Rửa Mặt Eucerin Cho Da Dầu Mụn- Eucerin Pro ACNE Solution Cleansing Gel 200ml Acne Oil Control Proacne,['200ml'],[25200000000],5,"Sản phẩm chưa dùng nên chưa rõ, mẫu mã nhìn đẹp hihi , tạm thời cho shop 5 sao ......"
✅[CHÍNH HÃNG] Sữa Rửa Mặt Eucerin Cho Da Dầu Mụn- Eucerin Pro ACNE Solution Cleansing Gel 200ml Acne Oil Control Proacne,['200ml'],[25200000000],5,"Đóng gói hàng kĩ, giao nhanh, check được sp, chưa dùng lâu nên chưa biết hiệu quả ntn"
✅[CHÍNH HÃNG] Sữa Rửa Mặt Eucerin Cho Da Dầu Mụn- Eucerin Pro ACNE Solution Cleansing Gel 200ml Acne Oil Control Proacne,['200ml'],[25900000000],5,"Dùng kb có ổn k nhưng đọc fb thì khen quá, giao hàng nhanhhhhhhhhhh"
✅[CHÍNH HÃNG] Sữa Rửa Mặt Eucerin Cho Da Dầu Mụn- Eucerin Pro ACNE Solution Cleansing Gel 200ml Acne Oil Control Proacne,['200ml'],[25900000000],5,", gel đặc , rửa mặt dịu nhẹ ko có cảm giác khô sau khi rửa xong , shop giao hàng nhanh, lần sau sẽ ủng hộ tiếp ạ
hình ảnh mang tc nhận xu 😀"
✅[CHÍNH HÃNG] Sữa Rửa Mặt Eucerin Cho Da Dầu Mụn- Eucerin Pro ACNE Solution Cleansing Gel 200ml Acne Oil Control Proacne,['400ml'],[38500000000],5,"Giao hành nhanh ,, đóng gói oke,,,, chưa dùng ko biết ntn...."
✅[CHÍNH HÃNG] Sữa Rửa Mặt Eucerin Cho Da Dầu Mụn- Eucerin Pro ACNE Solution Cleansing Gel 200ml Acne Oil Control Proacne,['200ml'],[25200000000],5,Srm rửa rất thích ạ. Trộm vía mặt đỡ đổ dầu nữa ạ...............
✅[CHÍNH HÃNG] Sữa Rửa Mặt Eucerin Cho Da Dầu Mụn- Eucerin Pro ACNE Solution Cleansing Gel 200ml Acne Oil Control Proacne,['200ml'],[25900000000],5,Dùng tốt ạ. Gõ linh tinh cho đủ 50 ký tự jsjsjsjdjdjjdjdxbbsjsjs
✅[CHÍNH HÃNG] Sữa Rửa Mặt Eucerin Cho Da Dầu Mụn- Eucerin Pro ACNE Solution Cleansing Gel 200ml Acne Oil Control Proacne,['400ml'],[33700000000],5,"Hàng chính hãng. Dùng xong rất sạch nhưng ko bị khô da, rất mềm "
✅[CHÍNH HÃNG] Sữa Rửa Mặt Eucerin Cho Da Dầu Mụn- Eucerin Pro ACNE Solution Cleansing Gel 200ml Acne Oil Control Proacne,['200ml'],[25900000000],5,Shop giao hàng rất nhanh luôn. Mặc dù biết là mình đã chọn nowship để vận chuyển nhanh rồi nhưng không ngờ là ship nhanh đến thế. Từ lúc đặt hàng tới khi nhận hàng là chỉ khoảng nửa tiếng thôi ý. Mà srm mình quét đc qr code nữa nên yên tâm là hàng chính hãng nha.
✅[CHÍNH HÃNG] Sữa Rửa Mặt Eucerin Cho Da Dầu Mụn- Eucerin Pro ACNE Solution Cleansing Gel 200ml Acne Oil Control Proacne,['200ml'],[25200000000],5,"Giao rất nhanh và đầy đủ dù đặt vào ngày hội sale 6/6. Đóng gói rất cẩn thận. Chưa dùng nên chưa biết chất lượng như thế nào, mình sẽ dùng và đánh giá lại sau"
✅[CHÍNH HÃNG] Sữa Rửa Mặt Eucerin Cho Da Dầu Mụn- Eucerin Pro ACNE Solution Cleansing Gel 200ml Acne Oil Control Proacne,['400ml'],[39500000000],5,cjvkbgg dòinu fifidhh chfjnhg givgicuj djndinfu dubgkbch dkvdinf duvfibchh dicunxibf di fi xucundug du
✅[CHÍNH HÃNG] Sữa Rửa Mặt Eucerin Cho Da Dầu Mụn- Eucerin Pro ACNE Solution Cleansing Gel 200ml Acne Oil Control Proacne,['400ml'],[37500000000],5,mình hơi tiếc vì lúc mua là 375k xong shop sale còn 340k nhưng shop gói hàng cẩn thận nên cũng k sao ạ 😌
✅[CHÍNH HÃNG] Sữa Rửa Mặt Eucerin Cho Da Dầu Mụn- Eucerin Pro ACNE Solution Cleansing Gel 200ml Acne Oil Control Proacne,['400ml'],[39000000000],5," H hvuvucuvuvuvuvuvuvuvuvuvuvuvjvjvjvjvhvhvuvvuhvu
"
✅[CHÍNH HÃNG] Sữa Rửa Mặt Eucerin Cho Da Dầu Mụn- Eucerin Pro ACNE Solution Cleansing Gel 200ml Acne Oil Control Proacne,['400ml'],[36900000000],5,💡💡💡💡💡💡💡💡💡💡
✅[CHÍNH HÃNG] Sữa Rửa Mặt Eucerin Cho Da Dầu Mụn- Eucerin Pro ACNE Solution Cleansing Gel 200ml Acne Oil Control Proacne,['200ml'],[25900000000],5,mua lần thứ 2 sp của shop. giao hàng nhanh. mình xài ok nên đặt mua thêm 1 chai nưa cho chị mình. sẽ tiếp tục ủng hộ shop lần sau
✅[CHÍNH HÃNG] Sữa Rửa Mặt Eucerin Cho Da Dầu Mụn- Eucerin Pro ACNE Solution Cleansing Gel 200ml Acne Oil Control Proacne,['200ml'],[25900000000],5,"Lần nào mua ở shop cũng thấy yên tâm. Đóng gói, sản phẩm rất ok. Date cũng khá xa. Lần này mua là lần t3 rồi"
✅[CHÍNH HÃNG] Sữa Rửa Mặt Eucerin Cho Da Dầu Mụn- Eucerin Pro ACNE Solution Cleansing Gel 200ml Acne Oil Control Proacne,['400ml'],[36900000000],5,Giao hàng nhanh ... sản phẩm đảm bảo chính hãng nhaaa .. chất lượng .. shop uy tín ạ 
✅[CHÍNH HÃNG] Sữa Rửa Mặt Eucerin Cho Da Dầu Mụn- Eucerin Pro ACNE Solution Cleansing Gel 200ml Acne Oil Control Proacne,['400ml'],[36900000000],5,"Hình ảnh mang tính chất nhận xu. 
Đã mua 1 lần rồi. Lần này mua thêm loại khác. K biết check thế nào để biết hàng auth hành fake. Nhưng cứ đặt niềm tin vậy. 
Gói hàng cẩn thận. Tư vấn nhiệt tình. Cho shop 5 ⭐️"
✅[CHÍNH HÃNG] Sữa Rửa Mặt Eucerin Cho Da Dầu Mụn- Eucerin Pro ACNE Solution Cleansing Gel 200ml Acne Oil Control Proacne,['400ml'],[37500000000],5,Bọc hàng cẩn thận. Date hàng xa
✅[CHÍNH HÃNG] Sữa Rửa Mặt Eucerin Cho Da Dầu Mụn- Eucerin Pro ACNE Solution Cleansing Gel 200ml Acne Oil Control Proacne,['200ml'],[25900000000],5,Chat lương ok báchannahzuxh gbsnsjxjxnxbbxgsbsbzzgzbsbsbs
✅[CHÍNH HÃNG] Sữa Rửa Mặt Eucerin Cho Da Dầu Mụn- Eucerin Pro ACNE Solution Cleansing Gel 200ml Acne Oil Control Proacne,['400ml'],[38500000000],5,"Hàng shop đóng gói khá kĩ, mua chai fullsize tiết kiệm hơn nhiều lắm lun áaaaa"
✅[CHÍNH HÃNG] Sữa Rửa Mặt Eucerin Cho Da Dầu Mụn- Eucerin Pro ACNE Solution Cleansing Gel 200ml Acne Oil Control Proacne,['400ml'],[38500000000],5,"Dùng chai full size thứ 2 rồi, rất ưng, shop giao hàng khá nhanh, đóng gói rất kĩ"
✅[CHÍNH HÃNG] Sữa Rửa Mặt Eucerin Cho Da Dầu Mụn- Eucerin Pro ACNE Solution Cleansing Gel 200ml Acne Oil Control Proacne,['400ml'],[37500000000],5,Giao hàng nhanh. Đóng gói cẩn thận. Chất lượng sản phẩm tốt. Luôn ủng hộ
✅[CHÍNH HÃNG] Sữa Rửa Mặt Eucerin Cho Da Dầu Mụn- Eucerin Pro ACNE Solution Cleansing Gel 200ml Acne Oil Control Proacne,['400ml'],[36900000000],5,Cũng mua l2 r. Ko có gì để ns là thích tn nữa nhé:)))))))))))))
✅[CHÍNH HÃNG] Sữa Rửa Mặt Eucerin Cho Da Dầu Mụn- Eucerin Pro ACNE Solution Cleansing Gel 200ml Acne Oil Control Proacne,['200ml'],[25900000000],4,Màu hơi khác với lọ e mua ở offcial cũng lỏng hơn nữa kb như thế nào 😬😬😬
✅[CHÍNH HÃNG] Sữa Rửa Mặt Eucerin Cho Da Dầu Mụn- Eucerin Pro ACNE Solution Cleansing Gel 200ml Acne Oil Control Proacne,['200ml'],[25200000000],5,"Mình mua của shop 2 lần rui
Giao hàng nhanh
Đóng gói đẹp chắc chắn"
✅[CHÍNH HÃNG] Sữa Rửa Mặt Eucerin Cho Da Dầu Mụn- Eucerin Pro ACNE Solution Cleansing Gel 200ml Acne Oil Control Proacne,['400ml'],[37500000000],5,"Nhận dc hàng trong 1 hour
Hàng chuẩn auth và siêu sang ạ
Chúc shop mình bán được nhiều hàng hơn nữa"
✅[CHÍNH HÃNG] Sữa Rửa Mặt Eucerin Cho Da Dầu Mụn- Eucerin Pro ACNE Solution Cleansing Gel 200ml Acne Oil Control Proacne,['400ml'],[39000000000],5,"Chai 400ml nên rất to
Giá rẻ hơn các shop khác
Cảm ơn shop.................... "
✅[CHÍNH HÃNG] Sữa Rửa Mặt Eucerin Cho Da Dầu Mụn- Eucerin Pro ACNE Solution Cleansing Gel 200ml Acne Oil Control Proacne,['200ml'],[25000000000],5,"Shop gói hàng cẩn thận, giao hàng nhanh. Vừa nhận nên chưa dùng thử "
✅[CHÍNH HÃNG] Sữa Rửa Mặt Eucerin Cho Da Dầu Mụn- Eucerin Pro ACNE Solution Cleansing Gel 200ml Acne Oil Control Proacne,['400ml'],[39500000000],5,Chất gel lỏng hơn những lần mình mua tại store chính hãng. Lần đầu mua tại shop nên không biết có legit hay không. Text cho shop thì shop bảo do lô mới nên hãng có thay đổi texture 1 chút. Mọi người cân nhắc khi mua nhé. 
✅[CHÍNH HÃNG] Sữa Rửa Mặt Eucerin Cho Da Dầu Mụn- Eucerin Pro ACNE Solution Cleansing Gel 200ml Acne Oil Control Proacne,['400ml'],[36900000000],5,Video và hình ảnh mang tính chất nhânn xu.
✅[CHÍNH HÃNG] Sữa Rửa Mặt Eucerin Cho Da Dầu Mụn- Eucerin Pro ACNE Solution Cleansing Gel 200ml Acne Oil Control Proacne,['400ml'],[37500000000],5,"Chất lượng sản phẩm tốt 
Giao hàng nhanh 
Phục vụ tận tình 
Mong người nên mua nhé 
"
✅[CHÍNH HÃNG] Sữa Rửa Mặt Eucerin Cho Da Dầu Mụn- Eucerin Pro ACNE Solution Cleansing Gel 200ml Acne Oil Control Proacne,['200ml'],[25200000000],5,Mong là hàng chính hãng. Giao hàng nhanh. Đã mua mấy lần tại shop rồi 
✅[CHÍNH HÃNG] Sữa Rửa Mặt Eucerin Cho Da Dầu Mụn- Eucerin Pro ACNE Solution Cleansing Gel 200ml Acne Oil Control Proacne,['200ml'],[25900000000],5,"Đóng gói cẩn thận,trong quá trinh vận chuyển mình thấy có nổi bọt, hy vọng xài hợp với da của mình"
✅[CHÍNH HÃNG] Sữa Rửa Mặt Eucerin Cho Da Dầu Mụn- Eucerin Pro ACNE Solution Cleansing Gel 200ml Acne Oil Control Proacne,['400ml'],[37500000000],5,Sản phẩm chất lượng lắm nha cả nhà hshshshdbdbdbbshshhsbdđ
✅[CHÍNH HÃNG] Sữa Rửa Mặt Eucerin Cho Da Dầu Mụn- Eucerin Pro ACNE Solution Cleansing Gel 200ml Acne Oil Control Proacne,['200ml'],[25200000000],5,"Chưa dùng nên chưa biết chất lượng, nhưng giao hàng nhanh đóng gói cẩn thận!"
✅[CHÍNH HÃNG] Sữa Rửa Mặt Eucerin Cho Da Dầu Mụn- Eucerin Pro ACNE Solution Cleansing Gel 200ml Acne Oil Control Proacne,['400ml'],[39000000000],5,"Mình đã nhận dc hàng,  giao hàng nhanh,  đóng gói cẩn thận và shop còn nhắc mình quay video lại nữa,  mình đag dùng và sẽ cho shop cảm nhận sau nhé.  "
✅[CHÍNH HÃNG] Sữa Rửa Mặt Eucerin Cho Da Dầu Mụn- Eucerin Pro ACNE Solution Cleansing Gel 200ml Acne Oil Control Proacne,['200ml'],[25900000000],5,Mua nhiều lần nên yên tâm 100%
✅[CHÍNH HÃNG] Sữa Rửa Mặt Eucerin Cho Da Dầu Mụn- Eucerin Pro ACNE Solution Cleansing Gel 200ml Acne Oil Control Proacne,['400ml'],[36900000000],5,"Shop giao hàng nhanh, đủ số lượng, chất lượng phải dùng mới biết được"
✅[CHÍNH HÃNG] Sữa Rửa Mặt Eucerin Cho Da Dầu Mụn- Eucerin Pro ACNE Solution Cleansing Gel 200ml Acne Oil Control Proacne,['400ml'],[39500000000],5,"Đóng gói chắc chắn,có team hdsd bằng tiếng việt,hàng chuẩn,dùng rồi sẽ quay lại đánh giá tiếp "
✅[CHÍNH HÃNG] Sữa Rửa Mặt Eucerin Cho Da Dầu Mụn- Eucerin Pro ACNE Solution Cleansing Gel 200ml Acne Oil Control Proacne,['400ml'],[36900000000],5,"Giao hàng siêu nhanh , đóng gói cẩn thận ah . Cl thì mới mua lần đầu sd lần đầu ah , mong lag ok vì đọc phản hồi mn khen lứm ah "
✅[CHÍNH HÃNG] Sữa Rửa Mặt Eucerin Cho Da Dầu Mụn- Eucerin Pro ACNE Solution Cleansing Gel 200ml Acne Oil Control Proacne,['200ml'],[25900000000],5,Hán zịaugavnsoJ a ahvs ániba s jan sụaba ậh ậhbs a ạia a.  Hs. Snsj
✅[CHÍNH HÃNG] Sữa Rửa Mặt Eucerin Cho Da Dầu Mụn- Eucerin Pro ACNE Solution Cleansing Gel 200ml Acne Oil Control Proacne,['200ml'],[25200000000],5,Sản phẩm chất lượng tốtttttttt. Shop gói hàng siêu kĩ luônnnn
✅[CHÍNH HÃNG] Sữa Rửa Mặt Eucerin Cho Da Dầu Mụn- Eucerin Pro ACNE Solution Cleansing Gel 200ml Acne Oil Control Proacne,['200ml'],[25200000000],5,"Sản phẩm đóng gói chắc chắn, thời gian giao hàng lần này bị lâu, đặt hàng 6/6 mà 14/6 ms nhâb được dù nội thành Hn. Còn chất lượng chưa dùng nên chưa đánh giá được"
✅[CHÍNH HÃNG] Sữa Rửa Mặt Eucerin Cho Da Dầu Mụn- Eucerin Pro ACNE Solution Cleansing Gel 200ml Acne Oil Control Proacne,['200ml'],[25900000000],5,"Đánh giá để nhận xu. Srm dùng thích, k bị căng da sau khi rửaaaa"
✅[CHÍNH HÃNG] Sữa Rửa Mặt Eucerin Cho Da Dầu Mụn- Eucerin Pro ACNE Solution Cleansing Gel 200ml Acne Oil Control Proacne,['200ml'],[25900000000],5,Đã nhận đc hàng. Hàng chính hãng nói chung khá ưng okkkkkkkkk
✅[CHÍNH HÃNG] Sữa Rửa Mặt Eucerin Cho Da Dầu Mụn- Eucerin Pro ACNE Solution Cleansing Gel 200ml Acne Oil Control Proacne,['200ml'],[25900000000],5,Chất lượng sản phẩm tuyệt vời.............................
✅[CHÍNH HÃNG] Sữa Rửa Mặt Eucerin Cho Da Dầu Mụn- Eucerin Pro ACNE Solution Cleansing Gel 200ml Acne Oil Control Proacne,['200ml'],[25900000000],5,Hàng ok nha mọi người cũng giống cái lần trước mua ở bệnh viện da liễu
✅[CHÍNH HÃNG] Sữa Rửa Mặt Eucerin Cho Da Dầu Mụn- Eucerin Pro ACNE Solution Cleansing Gel 200ml Acne Oil Control Proacne,['400ml'],[37500000000],5,Tốt nha mng
✅[CHÍNH HÃNG] Sữa Rửa Mặt Eucerin Cho Da Dầu Mụn- Eucerin Pro ACNE Solution Cleansing Gel 200ml Acne Oil Control Proacne,['200ml'],[25900000000],5,"Mua.lần 2 srm của shop rùi . Ko phải nói chớ cái srm này da dầu da mụn khỏi nghĩ luôn . Trung thành với nó suốt thui ..chúc shop mua may bán đắt nhá 
Video mình ko quay trc quên mất nên lấy tạm 1 vdeo của con cún kkk "
✅[CHÍNH HÃNG] Sữa Rửa Mặt Eucerin Cho Da Dầu Mụn- Eucerin Pro ACNE Solution Cleansing Gel 200ml Acne Oil Control Proacne,['200ml'],[25900000000],5,Trc mình dùng srm lrps ok giờ chuyển sang loại này thích lắm mn ạ. Sạch dịu nhẹ nè
✅[CHÍNH HÃNG] Sữa Rửa Mặt Eucerin Cho Da Dầu Mụn- Eucerin Pro ACNE Solution Cleansing Gel 200ml Acne Oil Control Proacne,['200ml'],[25900000000],5,Giao hàng nhanh đóng gói hàng cẩn thận. Chưa dùng nên ko biết như nào. Video và ảnh mang tính chất nhận xu.
✅[CHÍNH HÃNG] Sữa Rửa Mặt Eucerin Cho Da Dầu Mụn- Eucerin Pro ACNE Solution Cleansing Gel 200ml Acne Oil Control Proacne,['400ml'],[39500000000],5,"mua của shop vài lần rồi, hàng chính hãng chất lượng
nánnsnwnssnnwjwjensjajanznsnsnsjsnsjsjs"
✅[CHÍNH HÃNG] Sữa Rửa Mặt Eucerin Cho Da Dầu Mụn- Eucerin Pro ACNE Solution Cleansing Gel 200ml Acne Oil Control Proacne,"['400ml', '200ml']","[37500000000, 25900000000]",5,"Lần 2 mua srm ở shop
Hàng chất lượng, mua chai lớn lợi hơn rất nhiều so với chai nhỏ
Giao hàng nhanh, đóng gói sản phẩm kĩ càng. "
✅[CHÍNH HÃNG] Sữa Rửa Mặt Eucerin Cho Da Dầu Mụn- Eucerin Pro ACNE Solution Cleansing Gel 200ml Acne Oil Control Proacne,['200ml'],[25900000000],5,"Đã huỷ nhưng shop vẫn giao, nhưng mà chất lượng sản phẩm khá tốt nên vẫn để 5 sao"
✅[CHÍNH HÃNG] Sữa Rửa Mặt Eucerin Cho Da Dầu Mụn- Eucerin Pro ACNE Solution Cleansing Gel 200ml Acne Oil Control Proacne,['200ml'],[25900000000],5,"Gói hàng ok, jgkebdivnfnfbdhdkdhfjfnfbffnfbfjjffjfirjd"
✅[CHÍNH HÃNG] Sữa Rửa Mặt Eucerin Cho Da Dầu Mụn- Eucerin Pro ACNE Solution Cleansing Gel 200ml Acne Oil Control Proacne,['400ml'],[39500000000],5,"Giao hàng nhanh 
填充玩具动物泰迪熊Just have a child, permanent camel toe and no fancy pants needed"
✅[CHÍNH HÃNG] Sữa Rửa Mặt Eucerin Cho Da Dầu Mụn- Eucerin Pro ACNE Solution Cleansing Gel 200ml Acne Oil Control Proacne,['200ml'],[25900000000],5,"Shop giao nhanh, gói hàng châc chắn, sản phẩm có tem nhãn đầy đủ nên yên tâm nhé các bạnnnnnn"
✅[CHÍNH HÃNG] Sữa Rửa Mặt Eucerin Cho Da Dầu Mụn- Eucerin Pro ACNE Solution Cleansing Gel 200ml Acne Oil Control Proacne,['200ml'],[25900000000],4,"sản phẩm như hình nhưng mã vạch lại là của Thái Lan chứ không phải của Đức ib cho shop và shop đã trả lời như trên hình tôi chưa kịp đọc thì shop đã gọi đt cho tôi nói mã vạch chỉ để tham khảo thôi nếu muốn chắc thì gọi cho hãng
Khi dùng SRM tôi không bị kích ứng nên sẽ xem xét có mua lại hay không"
✅[CHÍNH HÃNG] Sữa Rửa Mặt Eucerin Cho Da Dầu Mụn- Eucerin Pro ACNE Solution Cleansing Gel 200ml Acne Oil Control Proacne,['200ml'],[25900000000],5,Đóng gói hàng kỹ lưỡng. Sản phẩm dùng mới biết đưoejc chất lượng. Về khoản đóng gói hàng mình rất ưng ý
✅[CHÍNH HÃNG] Sữa Rửa Mặt Eucerin Cho Da Dầu Mụn- Eucerin Pro ACNE Solution Cleansing Gel 200ml Acne Oil Control Proacne,['400ml'],[36900000000],5,Sữa rữa mặt xài ok mua lần thứ n rồi giao hàng củng nhanh size lớn 400ml 
✅[CHÍNH HÃNG] Sữa Rửa Mặt Eucerin Cho Da Dầu Mụn- Eucerin Pro ACNE Solution Cleansing Gel 200ml Acne Oil Control Proacne,['200ml'],[25900000000],5,"Giao hàng nhanh, đóng gói sản phẩm chắc chắn lắm nha mn! Derma forte thơm ơi là thơm...còn chất lượng mk phải dùng đã ạ!"
✅[CHÍNH HÃNG] Sữa Rửa Mặt Eucerin Cho Da Dầu Mụn- Eucerin Pro ACNE Solution Cleansing Gel 200ml Acne Oil Control Proacne,['200ml'],[25900000000],5,"Shop gói hàng rất cẩn thận, giao nhanh. Htrc đặt hôn sau đã có , ủng hộ shop"
✅[CHÍNH HÃNG] Sữa Rửa Mặt Eucerin Cho Da Dầu Mụn- Eucerin Pro ACNE Solution Cleansing Gel 200ml Acne Oil Control Proacne,['400ml'],[36900000000],5,Bâhsnshshshsjsjssjs mẹ đi ăn sáng rồi ngủ ngon quá vậy em ạ ạ à ạ em xem có được một số nhà r mà không a a bê bằng a a bê đê à bê mờ 
✅[CHÍNH HÃNG] Sữa Rửa Mặt Eucerin Cho Da Dầu Mụn- Eucerin Pro ACNE Solution Cleansing Gel 200ml Acne Oil Control Proacne,['200ml'],[26500000000],5,Hàng shop khỏi phải bàn cãi. Combo trị mụn thần thánh của mình. Nếu bạn nào bị mụn có thể tìm hiểu loại này. Dùng tầm 7-10 ngày thấy hiệu quả liền luôn. 
✅[CHÍNH HÃNG] Sữa Rửa Mặt Eucerin Cho Da Dầu Mụn- Eucerin Pro ACNE Solution Cleansing Gel 200ml Acne Oil Control Proacne,['200ml'],[25900000000],5,"chủ shop thân thiện, thời gian giao hàng nhanh, sẽ ủng hộ dài ❤️"
✅[CHÍNH HÃNG] Sữa Rửa Mặt Eucerin Cho Da Dầu Mụn- Eucerin Pro ACNE Solution Cleansing Gel 200ml Acne Oil Control Proacne,['200ml'],[25900000000],4,Sản phẩm thì ko sao nhưng mà shop tư vấn ko được nhiệt tình cho lắm nên làm mình hơi thất vọng
✅[CHÍNH HÃNG] Sữa Rửa Mặt Eucerin Cho Da Dầu Mụn- Eucerin Pro ACNE Solution Cleansing Gel 200ml Acne Oil Control Proacne,['400ml'],[39500000000],5,"Chưa dùng nên cũng chưa đưa ra đc nx. Nhìn mát mẻ, mình cx đang muốn thử một loại srm nên mua"
✅[CHÍNH HÃNG] Sữa Rửa Mặt Eucerin Cho Da Dầu Mụn- Eucerin Pro ACNE Solution Cleansing Gel 200ml Acne Oil Control Proacne,['200ml'],[25900000000],5,"Giao hàng nhanh, hàng chuẩn, chất lượng tốt"
✅[CHÍNH HÃNG] Sữa Rửa Mặt Eucerin Cho Da Dầu Mụn- Eucerin Pro ACNE Solution Cleansing Gel 200ml Acne Oil Control Proacne,['200ml'],[25900000000],5,Mua hàng lần này thứ 2 cơ mà thấy chất sp hơi khác. Cũng mong là do vc mà bị bọt. Chứ k phải do khác hàng. Tạm cho 5 sao. Shipper cục xúc. Đóng gói bị móp. 
