variations,price,rating_star,comment
['Có lót để đỡ xóc nảy'],[8900000000],3,"Trước giờ mình dùng MP chưa bao giờ bị kích ứng vì mình có test trước rồi mới dùng ,serum này mình dùng mấy ngày đầu thì k vấn đề ,đến ngày thứ 4-5 bắt đầu nổi mụn mà mặt mình rất hiếm khi có mụn hai nữa là từ khi dùng da có dấu hiệu tối màu đi chứ k sáng như trước ,chắc mình sẽ dừng k dùng nữa"
['Có lót để đỡ xóc nảy'],[8900000000],5,"Hàng chuẩn
Cái này mình mua hộ nên không biết dùng ok không
Tuy nhiên bạn nào dị ứng hương liệu thì k nên dùng vì nó cực nồng, mùi kiểu nước hoa công sở, mình k biết miêu tả sao"
['Có lót để đỡ xóc nảy'],[8900000000],5,Vận dụng quan điểm của Triết học Mác Lênin về mối quan hệ giữa cá nhân và xã hội vào xây dựng con người mới ở Việt Nam hiện nay. Liên hệ trách nhiệm bản thân.
['Có lót để đỡ xóc nảy'],[8900000000],5,"Hàng date xa, shop phục vụ chu đáo. Giá lại tốt. Quà tặng đầy đủ. Giao hàng nhanh. Mọi người nên mua ở đây nè "
['Có lót để đỡ xóc nảy'],[8900000000],5,Mới bôi lên sẽ thấy mát mát và mịn da. Mùi rất thơm. Check mã vạch ra hàng chuẩn nha mn. Xài ok sẽ ủng hộ shop tiếp nè
['Có lót để đỡ xóc nảy'],[8900000000],5,"Giao hàng nhanh, sản phẩm đúng mô tả, lần sau sẽ ủng hộ shop thêm ạ"
['Có lót để đỡ xóc nảy'],[8900000000],5,Đã dùng san phẩm cảm rhaays rat thich nên đã quay lại ủng hộ shop lần 3
['Có lót để đỡ xóc nảy'],[8900000000],5,"Giao hàng nhanh, chưa sử dụng nên chưa bít nhưng thấy lót đỡ chắc chắn. Sẽ review sp sau, mỗi tội check mã vạch 250k nên hơi băn khoăn, mở ra mùi hương liệu nồng lắm "
['Có lót để đỡ xóc nảy'],[8900000000],5,"Shop gói hàng đẹp, giao hàng nhanh, phí ship đắt. Serum mới test thử ok, chất serum lỏng thấm nhanh, hơi nhiều mùi hương liệu, chưa thấy kích ứng"
['Có lót để đỡ xóc nảy'],[9900000000],5,"Dùng thử, chưa biết tác dụng như nào, rẻ

Shop chăm sóc khách hàng tốt, rep tin nhắn nhanh, gói hàng cẩn thận"
['Có lót để đỡ xóc nảy'],[9900000000],5,"Cái hộp quá sức đẹp, serum thơm thơm, thấm rất tốt, đóng gói ưng bụng lắm luôn nạ chời ơi"
['Có lót để đỡ xóc nảy'],[9900000000],5,"sống tươi đẹp

Những câu thơ hay về cuộc sống tươi đẹp là nguồn cảm hứng, động lực mang đến sự vui vẻ, lạc quan trong cuộc sống. Những câu thơ hay về cuộc sống tươi đẹp, mang giá trị sâu sắc thổi một luồng gió mát vào tâm hồnđang dần khô cằn, xóa tan đi những bế tắc, áp lực, căng thẳng, vươn tới nhữ"
