name,variations,price,rating_star,comment
[Chính Hãng] Thấm Dầu Jomi Oil Clear Film 70 tờ,['THẤM DẦU JOMI'],[3800000000],5,"Mình là chủ spa nhỏ lại nghiện shopee nên qc lun mn thông cảm nha...
Nhận chuyển giao công nghệ làm hồng-trị thâm đỉnh cao từ Hoa Kì....
Tuyển mẫu tiêm filler botox lấy hình ảnh cho spa kv hà nội
Còn áo shop bán chất lượng đỉnh giá thì phải chăng, m sẽ kêu dòng họ tới ủng hộ shop lun "
[Chính Hãng] Thấm Dầu Jomi Oil Clear Film 70 tờ,['THẤM DẦU JOMI'],[3800000000],5,M ko là một loài bướm eywoeywoeye và nhiều niềm vui và hạnh đi làm r hả em yêu 💔 đi làm gì thì làm gì đâu anh ơi anh ạ em cảm thấy khó hiểu quá mà không thấy đâu có bao khoai môn không có gì m đâu rồi mà còn gì đâu mà c ạ em cảm thấy khó hiểu quá mà đi ngủ đi mai còn 
[Chính Hãng] Thấm Dầu Jomi Oil Clear Film 70 tờ,['THẤM DẦU JOMI'],[3800000000],5,"Chưa dùng nên kb chất lượng sản phẩm ra sao nhưng shop đóng gói hàng cẩn thận, giao hàng nhanhhhh"
[Chính Hãng] Thấm Dầu Jomi Oil Clear Film 70 tờ,['THẤM DẦU JOMI'],[3800000000],5,Shop chuẩn bị hàng và giao hàng nhanh. Lần trước mua của shop màu vàng dùng da căng mịn giờ quay lại mua tiếp ạ
[Chính Hãng] Thấm Dầu Jomi Oil Clear Film 70 tờ,['THẤM DẦU JOMI'],[3700000000],5,Lần đầu mua hàng.......... bọc sản phẩm kĩ lượng nói chung hàng chất lượng review sauuuu. 
[Chính Hãng] Thấm Dầu Jomi Oil Clear Film 70 tờ,['THẤM DẦU JOMI'],[3700000000],5,Hàng giao ok. Giá ổn mà nhìn đóng gói nhãn mác vẫn nguyên vẹn nên khá ưng. Sẽ quay lại
[Chính Hãng] Thấm Dầu Jomi Oil Clear Film 70 tờ,['THẤM DẦU JOMI'],[3800000000],5,"Miếng flim dai và mềm mịn, Flim thấm dầu siêu nhanh. Chất lượng tuyệt vời."
[Chính Hãng] Thấm Dầu Jomi Oil Clear Film 70 tờ,['THẤM DẦU JOMI'],[3800000000],5,"Chất lượng sản phẩm tuyệt vời, shop ship hàng nhanh và đóng gói cẩn thận"
[Chính Hãng] Thấm Dầu Jomi Oil Clear Film 70 tờ,['THẤM DẦU JOMI'],[3700000000],5,"Shop được cái đóng gói sản phẩm cẩn thận
Mình tin là sản phẩm chính hãng
"
[Chính Hãng] Thấm Dầu Jomi Oil Clear Film 70 tờ,['THẤM DẦU JOMI'],[3700000000],5,San pham on chat luong duoc phu hop voi gia tien noi chung ok nen muaa
[Chính Hãng] Thấm Dầu Jomi Oil Clear Film 70 tờ,['THẤM DẦU JOMI'],[3800000000],5,"Đóng gói hàng cẩn thận, hàng đầy đủ. Sẽ ủng hộ shop những lần tớik"
[Chính Hãng] Thấm Dầu Jomi Oil Clear Film 70 tờ,['THẤM DẦU JOMI'],[3800000000],5,"Sản phẩm ok giao hàng nhanh ạ
Ndbsbsjbesjdbejwbwkwnbshshsheh"
[Chính Hãng] Thấm Dầu Jomi Oil Clear Film 70 tờ,['THẤM DẦU JOMI'],[3700000000],5,Giao hàng nhanh..........xxxxxx x x x x x x x x x x. X x x. X x x x x. X x x x x x x 
[Chính Hãng] Thấm Dầu Jomi Oil Clear Film 70 tờ,['THẤM DẦU JOMI'],[3800000000],5,Chưa sd nên chưa rõ nếu sd oke sẽ ủng hộ tiếp vào lần mua hàng tiếp theo
[Chính Hãng] Thấm Dầu Jomi Oil Clear Film 70 tờ,['THẤM DẦU JOMI'],[3800000000],5,"Chất lượng sản phẩm tuyệt vời
Đóng gói sản phẩm chắc chắn
Giao hàng nhanh
Đủ hàng"
[Chính Hãng] Thấm Dầu Jomi Oil Clear Film 70 tờ,['THẤM DẦU JOMI'],[3700000000],5,Giá rẻ giao hàng tỉnh ngoài mà rất nhanhhhhhhhhhhhhhhhhhhhhh
[Chính Hãng] Thấm Dầu Jomi Oil Clear Film 70 tờ,['THẤM DẦU JOMI'],[3700000000],5,Săn sale nên mua duoc giá khá hời. Chất lượng sản phẩm tuyệt vờiiii
[Chính Hãng] Thấm Dầu Jomi Oil Clear Film 70 tờ,['THẤM DẦU JOMI'],[3800000000],5,OK nhé cả nhà
[Chính Hãng] Thấm Dầu Jomi Oil Clear Film 70 tờ,['THẤM DẦU JOMI'],[3700000000],5,"Đóng gói rất chắc chắn luôn
Mà film mượt dùng rất thích, thấm dầu tốt"
[Chính Hãng] Thấm Dầu Jomi Oil Clear Film 70 tờ,['THẤM DẦU JOMI'],[3800000000],5,Thời gian giao hàng rất nhanh. Đóng gói sản phẩm rất đẹp và chắc chắn
[Chính Hãng] Thấm Dầu Jomi Oil Clear Film 70 tờ,['THẤM DẦU JOMI'],[3800000000],5,"Giao hàng nhanh, mình đã đặt nhiều lần ở shop và rất hài lòng với dịch vụ và chất lượng sản phẩm"
[Chính Hãng] Thấm Dầu Jomi Oil Clear Film 70 tờ,['THẤM DẦU JOMI'],[3600000000],5,Very goodddddddddddddddd. Đỉnh của chóp rồi kp bànnnnnnnn
[Chính Hãng] Thấm Dầu Jomi Oil Clear Film 70 tờ,['THẤM DẦU JOMI'],[3800000000],5,"Giao hàng nhanh đúng mẫu , đóng gói cẩn thận . Giá rẻ . Đặt hôm trc hsau có hàng "
[Chính Hãng] Thấm Dầu Jomi Oil Clear Film 70 tờ,['THẤM DẦU JOMI'],[3600000000],5,Rẻ mà chất lượng thì tốt miễn bàn luôn =))))) Mùa hè mặt nhiều dầu nên không thể thiếu được em này 
[Chính Hãng] Thấm Dầu Jomi Oil Clear Film 70 tờ,['THẤM DẦU JOMI'],[3800000000],5,"Luu luong con lai cua Quy khach la:
0 MB (ST90K) su dung den 00h00 ngay 16-04-2021.
3072 MB(ST15K) su dung den 00h00 ngay 18-04-2021.
0 MB(DATA_SPONSOR) su dung den 00h00 ngay 28-04-2021.
Xin Quy khach luu y: ngat ket noi internet truoc khi thuc hien tra cuu. De biet thong tin cac goi Mobile Interne"
[Chính Hãng] Thấm Dầu Jomi Oil Clear Film 70 tờ,['THẤM DẦU JOMI'],[3800000000],5,"Chưa dùng nên ko biết chất lượng thế nào, nhìn qua thì đúng hàng auth, shop bán giá rẻ"
[Chính Hãng] Thấm Dầu Jomi Oil Clear Film 70 tờ,['THẤM DẦU JOMI'],[3600000000],5,Sản phẩm hợp gái tiền. Giao hàng nhanh
[Chính Hãng] Thấm Dầu Jomi Oil Clear Film 70 tờ,['THẤM DẦU JOMI'],[3800000000],5,"Chất lượng sản phẩm tuyệt vời
Đóng gói sản phẩm đẹp và chắc chắn"
[Chính Hãng] Thấm Dầu Jomi Oil Clear Film 70 tờ,['THẤM DẦU JOMI'],[3600000000],5,"Giao hàng nhanh, đóng gói gọn gàng, ko bị móp hộp. Da mình hhtd, muốn dùng cấp ẩm do mới peel da. Đợt này mình đang chuẩn bị làm cuộc cách mạng nên tốn tiền quá... nhặt từng trăm xu mà tiêu mấy cụ rồi. Mong kết quả da mình sẽ đẹp lên huhu"
[Chính Hãng] Thấm Dầu Jomi Oil Clear Film 70 tờ,['THẤM DẦU JOMI'],[3800000000],5,"Sản phẩm rất tốt, dùng chất lượng, đóng gói kĩ kh hư hỏng, sẽ mua lại lần nữa "
[Chính Hãng] Thấm Dầu Jomi Oil Clear Film 70 tờ,['THẤM DẦU JOMI'],[3800000000],5,Hàng rẻ mà chất lượng. Giao hàng thì cực kì nhanh. Chúc shop buôn may bán đắt nhé
[Chính Hãng] Thấm Dầu Jomi Oil Clear Film 70 tờ,['THẤM DẦU JOMI'],[3800000000],4,Hàng ok giấy thấm dầu tốt shop rất chu đáo shipper thân thiện nhưng chỉ mong shop lần sau gói hàng thật kĩ để tránh va đập 
[Chính Hãng] Thấm Dầu Jomi Oil Clear Film 70 tờ,['THẤM DẦU JOMI'],[3600000000],5,"Sản phẩm dùng tốt, lại còn được giảm giá chưa check nênn chưa biết có phải chính hãng hong 🥺"
[Chính Hãng] Thấm Dầu Jomi Oil Clear Film 70 tờ,['THẤM DẦU JOMI'],[3800000000],5,"Giao hàng nhanh, đóng gói cẩn thận, hàng giống như mô tả quảng cáo"
[Chính Hãng] Thấm Dầu Jomi Oil Clear Film 70 tờ,['THẤM DẦU JOMI'],[3800000000],5,"Giấy thấm dầu dùng tốt giao hàng nnhanh đong goi hang chac chan
 Tiện mình bán đai nịt bụng sau sinh nnes"
[Chính Hãng] Thấm Dầu Jomi Oil Clear Film 70 tờ,['THẤM DẦU JOMI'],[3600000000],5,Gshwhd dncjdnjdjdjdh hdjdhdhdjd jndndndndnd hhahshshshsbsb
[Chính Hãng] Thấm Dầu Jomi Oil Clear Film 70 tờ,['THẤM DẦU JOMI'],[3800000000],5,"Giao hàng nhanh lắm,shop đóng hàng chắc chắn.kem dưỡng màu trong suốt"
[Chính Hãng] Thấm Dầu Jomi Oil Clear Film 70 tờ,['THẤM DẦU JOMI'],[3800000000],5,
[Chính Hãng] Thấm Dầu Jomi Oil Clear Film 70 tờ,['THẤM DẦU JOMI'],[3800000000],5,"Giấy thấm dầu dùng rất thích, tiện lợi, shop đóng gói cẩn thận"
[Chính Hãng] Thấm Dầu Jomi Oil Clear Film 70 tờ,['THẤM DẦU JOMI'],[3800000000],5,"Đóng gói hàng kỹ, sản phẩm chất lượng dùng rất thích 🥰🥰 nên mua 😍😍"
[Chính Hãng] Thấm Dầu Jomi Oil Clear Film 70 tờ,['THẤM DẦU JOMI'],[3800000000],5,"Đóng gói chưa dc cẩn thận,chất lượng sản phẩm tốt,loại này thích nhất trog các loại mình từng dùng."
[Chính Hãng] Thấm Dầu Jomi Oil Clear Film 70 tờ,['THẤM DẦU JOMI'],[3800000000],5,Săn đc sale hàng giao nhanh  lắm ạ . Đáng mua ạ likeeeeeeeeeeee
[Chính Hãng] Thấm Dầu Jomi Oil Clear Film 70 tờ,['THẤM DẦU JOMI'],[3800000000],5,"Giao hàng siêu siêu nhanh
Đóng gói cẩn thận
Sẽ ủng hộ tiếp <3333"
[Chính Hãng] Thấm Dầu Jomi Oil Clear Film 70 tờ,['THẤM DẦU JOMI'],[3800000000],5,"Sản phẩm đẹp, đóng gói chắc chắn, giao hàng nhanh. Chất lượng rất tốt, thấm dầu. "
[Chính Hãng] Thấm Dầu Jomi Oil Clear Film 70 tờ,['THẤM DẦU JOMI'],[3800000000],5,"Kh bị rách giấy , sp thấm hết dầu trên mũi
Lần sau mình sẽ ủng hộ ."
[Chính Hãng] Thấm Dầu Jomi Oil Clear Film 70 tờ,['THẤM DẦU JOMI'],[3800000000],5,Mua ở shop nhiều lần rồi còn gt cho cả bạn bè nữa. Giao hàng rất nhanh luôn
[Chính Hãng] Thấm Dầu Jomi Oil Clear Film 70 tờ,['THẤM DẦU JOMI'],[3800000000],5,"Giấy xịn dùng thích lắm nha, thấm đc nhiều dầu cực ahihiiiiiiii"
[Chính Hãng] Thấm Dầu Jomi Oil Clear Film 70 tờ,['THẤM DẦU JOMI'],[3800000000],5,"Shop đóng gói cẩn thận, hàng chất lượng.................."
[Chính Hãng] Thấm Dầu Jomi Oil Clear Film 70 tờ,['THẤM DẦU JOMI'],[3800000000],5,Giấy thấm dầu dùng khá ổn. Mua hàng của shop khá yên tâm. Good ~
[Chính Hãng] Thấm Dầu Jomi Oil Clear Film 70 tờ,['THẤM DẦU JOMI'],[3800000000],5,Sản phẩm rất đáng tiền rất đẹp mọi người nên mua nha hihi hihihi 
[Chính Hãng] Thấm Dầu Jomi Oil Clear Film 70 tờ,['THẤM DẦU JOMI'],[3700000000],5,"Tốt, giao hang nhanh, chất lượng như hình. Xài tốt. Sẽ ủng hộ tiếp nếu hết. Llllllll"
[Chính Hãng] Thấm Dầu Jomi Oil Clear Film 70 tờ,['THẤM DẦU JOMI'],[3800000000],5,"Shop giao hàng hơi lâu, tầm 5 ngày mình mới nhận được. Kem dưỡng siêu ổn nha mn "
[Chính Hãng] Thấm Dầu Jomi Oil Clear Film 70 tờ,['THẤM DẦU JOMI'],[3800000000],5,"Rất nhanh 1 ngày đã giao đến nơi 
Đongs gói nhỏ xinh chắc chắn❤️❤️❤️❤️❤️❤️❤️❤️❤️❤️❤️❤️❤️❤️❤️❤️❤️❤️❤️❤️❤️❤️❤️❤️❤️❤️❤️❤️❤️❤️❤️❤️❤️❤️❤️❤️❤️❤️❤️❤️❤️❤️❤️❤️"
[Chính Hãng] Thấm Dầu Jomi Oil Clear Film 70 tờ,['THẤM DẦU JOMI'],[3800000000],5,Okieeeeeeeeeeeeeeeeeeeeeeeeeeeeeeeeeeeeeeeeeeeeeeeee
[Chính Hãng] Thấm Dầu Jomi Oil Clear Film 70 tờ,['THẤM DẦU JOMI'],[3700000000],5,"Hàng check ra mã vạch, ship hàng nhanh, sẽ còn quay lại ủng hộ :vvv"
[Chính Hãng] Thấm Dầu Jomi Oil Clear Film 70 tờ,['THẤM DẦU JOMI'],[3800000000],5,Hàng chuẩn auth giao hàng siêu nhanh luôn qua đặt nay đã có nói chung là ưng
[Chính Hãng] Thấm Dầu Jomi Oil Clear Film 70 tờ,['THẤM DẦU JOMI'],[3700000000],5,Giao hàng nhanh mua rất nhiều nên rất an tâm chất lượng sản phẩm tốt
[Chính Hãng] Thấm Dầu Jomi Oil Clear Film 70 tờ,['THẤM DẦU JOMI'],[3800000000],5,"Sản phẩm tốt dán mụn đỏ hiệu quả 
Son habgf chuẩn  
Sẽ ghé lại lần sau "
[Chính Hãng] Thấm Dầu Jomi Oil Clear Film 70 tờ,['THẤM DẦU JOMI'],[3700000000],5,Lâyyyyyyyyyyyyyy xuuuuuuuuuuuuuuuu nhaaaaaaaaaaaaaaaaaa
[Chính Hãng] Thấm Dầu Jomi Oil Clear Film 70 tờ,['THẤM DẦU JOMI'],[3800000000],5,"Giao hàng nhanh, đóng gói cẩn thận, giá cả hợp lí, rẻ hơn ngoài cửa hàng"
[Chính Hãng] Thấm Dầu Jomi Oil Clear Film 70 tờ,['THẤM DẦU JOMI'],[3800000000],5,Phấn mắt nhỏ xinh. Tiện lợi giá hạp lý. Shop đóng gói cẩn thận. Hàng nhận được nguyên vẹn. 
[Chính Hãng] Thấm Dầu Jomi Oil Clear Film 70 tờ,['THẤM DẦU JOMI'],[3800000000],5,Hàng giao nhanh. Shop đóng gói cẩn thận. Mình mua lẻ nhưng shop vẫn giao đủ. Sẽ tiếp tục ủng hộ shop dài dài.
[Chính Hãng] Thấm Dầu Jomi Oil Clear Film 70 tờ,['THẤM DẦU JOMI'],[3800000000],5,"Chat luong san pham tuyet vơi
Dong goi san pham chac chan và dep"
[Chính Hãng] Thấm Dầu Jomi Oil Clear Film 70 tờ,['THẤM DẦU JOMI'],[3700000000],5,"nhận hàng thấy rất okela, sp chat luong tot và xung dang gia tien"
[Chính Hãng] Thấm Dầu Jomi Oil Clear Film 70 tờ,['THẤM DẦU JOMI'],[3700000000],5,"shop đóng hàng cẩn thận, đầy đủ, gửi hàng nhanh, mình mua mấy lần r"
[Chính Hãng] Thấm Dầu Jomi Oil Clear Film 70 tờ,['THẤM DẦU JOMI'],[3800000000],5,"Hàng chuẩn, sẽ ủng hộ shop dài dài, giá tốt hơn siêu thị......."
