name,variations,price,rating_star,comment
[ ฤang Sale + Quร ] Sแปฏa Ong Chรบa SUBEE - Nguyรชn Chแบฅt ( 100gr ) - Tแบทng Kรจm Cแป Muแปng,[''],[9800000000],5,"Sau khi sแปญ dแปฅng hแบฟt 1 lแป em phแบฃi ord thรชm tiแบฟp, sแบฃn phแบฉm lรบc ฤแบงu sแปญ dแปฅng thรฌ cรณ hฦกi mรกt lแบกnh chรขm chรญt tรญ chแปซng 1-2โ lร hแบฟt thรดi, rแปญa mแบทt lแบกi thรฌ hฦกi khรด vร cแบงn toner vแปi dฦฐแปกng แบฉm, kแบฟt quแบฃ lร em cรณ hแบณn 1 lรn da lรกn mแปn ko mแปฅn thรขm luรดn โค๏ธ chแบฅt lฦฐแปฃng ฤแปnh nรชn mua ngay mng ฦกi โค๏ธโค๏ธโค๏ธ"
[ ฤang Sale + Quร ] Sแปฏa Ong Chรบa SUBEE - Nguyรชn Chแบฅt ( 100gr ) - Tแบทng Kรจm Cแป Muแปng,[''],[9800000000],5,"     Lแบงn ฤแบงu tiรชn khi tรดi mแป cแปญa โค em ฤรฃ gแปญi lแบกi tรดi tรฌnh yรชu cแปงa em แป tuแปi 18, nรณ luรดn แป ฤรณ vร khรดng thay ฤแปi.
      Tรดi biแบฟt em tแปซ hแปi trung hแปc, khi vรด tรฌnh xen vรo chuyแปn rแบฏc rแปi cแปงa em mร tรดi ฤรขu ngแป chuyแปn ฤรณ ฤแป lแบกi cho tรดi cรขu chuyแปn do chรญnh tay em viแบฟt vรo."
[ ฤang Sale + Quร ] Sแปฏa Ong Chรบa SUBEE - Nguyรชn Chแบฅt ( 100gr ) - Tแบทng Kรจm Cแป Muแปng,[''],[9800000000],5,"Sแปฏa ong chรบa cรณ vแบป tแปt. Mua vแป ฤแบฏp mแบทt. Shop giao nhanh, ฤรณng gรณi kฤฉ, chแบฏc chแบฏn, quแบฅn mแบฅy lแปp chแปng sแปc lแบญn. Nhแบญn hรng mร ฦฐng ghรช. ร cรฒn ฤฦฐแปฃc tแบทng chแปi quรฉt vแปi thรนa nhแป, thรญch ghรช luรดn. "
[ ฤang Sale + Quร ] Sแปฏa Ong Chรบa SUBEE - Nguyรชn Chแบฅt ( 100gr ) - Tแบทng Kรจm Cแป Muแปng,[''],[9800000000],5,"ฤรณng gรณi sแบฃn phแบฉm chแบฏc chแบฏn
Giao hรng nhanh chรณng, tแบทng kรจm quร xinh xแบฏn
Chแปง shop tฦฐ vแบฅn siรชu nhiแปt tรฌnh, dแป thฦฐฦกng
Hi vแปng sแปญ dแปฅng cรณ hiแปu quแบฃ, chแบฏc chแบฏn sแบฝ แปงng hแป shop tiแบฟp nรจ"
[ ฤang Sale + Quร ] Sแปฏa Ong Chรบa SUBEE - Nguyรชn Chแบฅt ( 100gr ) - Tแบทng Kรจm Cแป Muแปng,[''],[9800000000],5,"Hแปง nhรฌn xinh quรก แบก. Chฦฐa xรi nhฦฐng nhรฌn hแปง dแป thฦฐฦกng, tฦฐ vแบฅn nhiแปt tรฌnh แบก. ฤฦฐแปฃc tแบทng cรขy xแบปng ฤรกng yรชu ๐๐๐๐๐ Hy vแปng xรi da sแบฝ ฤแบนp แบก. Hehe"
[ ฤang Sale + Quร ] Sแปฏa Ong Chรบa SUBEE - Nguyรชn Chแบฅt ( 100gr ) - Tแบทng Kรจm Cแป Muแปng,[''],[9800000000],5,"Xรi cแปฑc thรญch แบก. Mรฌnh dรนng ฤแบฏp mแบทt da lรกng mแปn cฤng mฦฐแปt, mแปฅn mau xแบนp lแบฏm. Shop nhiแปt tรฌnh dแป thฦฐฦกng. Mร nแบฏp hลฉ hฦกi khรณ mแป, nแบฟu khแบฏc phแปฅc ฤc ฤiแปm nรy thรฌ ok lแบฏm แบก"
[ ฤang Sale + Quร ] Sแปฏa Ong Chรบa SUBEE - Nguyรชn Chแบฅt ( 100gr ) - Tแบทng Kรจm Cแป Muแปng,[''],[9800000000],5,"Hรดng biแบฟt m.n dรนng nhฦฐ thแบฟ nรo chแปฉ em dรนng bแป chรขm chรญt rรขm rang khแบฏp cแบฃ mแบทt, rแปญa xong thรฌ da kiแปu bแป nรณng lรชn, nhฦฐng da ko bแป kรญch แปฉng, cลฉng ko nแปi ฤแป mแบทt"
[ ฤang Sale + Quร ] Sแปฏa Ong Chรบa SUBEE - Nguyรชn Chแบฅt ( 100gr ) - Tแบทng Kรจm Cแป Muแปng,[''],[9800000000],5,"Do bรชn nhร vแบญn chuyแปn nรชn giao hรng hฦกi chแบญm, ฤรณng gรณi kแปน cรng, tแบทng quร so cute, chแปง shop nhiแปt tรฌnh dแป thฦฐฦกng, cรณ hiแปu quแบฃ sแบฝ แปงng hแป tiแบฟp lแบงn sau"
[ ฤang Sale + Quร ] Sแปฏa Ong Chรบa SUBEE - Nguyรชn Chแบฅt ( 100gr ) - Tแบทng Kรจm Cแป Muแปng,[''],[9800000000],5,"Sแปฏa ong chรบa thฦกm, ฤแบทc. Mรฌnh dรนng lแบงn ฤแบงu hฦกi nhiแปu vร ฤแป lรขu nรชn bแป ฤแป ran vร ngแปฉa. Lแบงn sau cho รญt lแบกi thรฌ k bแป nแปฏa vร da mแปm hฦกn."
[ ฤang Sale + Quร ] Sแปฏa Ong Chรบa SUBEE - Nguyรชn Chแบฅt ( 100gr ) - Tแบทng Kรจm Cแป Muแปng,[''],[9800000000],5,"Mแปi ฤแบทt cuแปi giแป chiแปu hรดm trฦฐแปc, sรกng hรดm sau ฤรฃ nhแบญn ฤฦฐแปฃc hรng, chฦฐa sแปญ dแปฅng nรชn chฦฐa biแบฟt kแบฟt quแบฃ hy vแปng แปn รกppppppppppppppppppppppppppppoooo"
[ ฤang Sale + Quร ] Sแปฏa Ong Chรบa SUBEE - Nguyรชn Chแบฅt ( 100gr ) - Tแบทng Kรจm Cแป Muแปng,[''],[9800000000],5,"Giao hรng siรชu nhanh, chฦฐa xรi thแปญ chฦฐa biแบฟt. Nแบฟu oke thรฌ แปงng hแป tiแบฟp. Ko cรณ hรฌnh thแปฑc tแบฟ sp thรฌ t sp Penthouse nhรฉ =))))"
[ ฤang Sale + Quร ] Sแปฏa Ong Chรบa SUBEE - Nguyรชn Chแบฅt ( 100gr ) - Tแบทng Kรจm Cแป Muแปng,[''],[9800000000],5,"ฤรฃ nhแบญn ฤฦฐแปฃc hรng, giao cแปฑc kรฌ nhanh, mแปi ฤแบทt chiแปu hรดm trฦฐแปc hรดm sau ฤรฃ nhแบญn ฤฦฐแปฃc hรng rแปi kkkkkkkkkkkkkkkkkkkk"
[ ฤang Sale + Quร ] Sแปฏa Ong Chรบa SUBEE - Nguyรชn Chแบฅt ( 100gr ) - Tแบทng Kรจm Cแป Muแปng,[''],[9800000000],5,"hรฌnh แบฃnh vร video khรดng liรชn quan =((
dรนng sแปฏa ong chรบa da trแบฏng mแปn thรญch lแบฏm แบก
giao hรng nhanh, ฤรณng gรณi cแบฉn thแบญn, chรบc shop mua bรกn ฤแบฏt hรng๐"
[ ฤang Sale + Quร ] Sแปฏa Ong Chรบa SUBEE - Nguyรชn Chแบฅt ( 100gr ) - Tแบทng Kรจm Cแป Muแปng,[''],[14500000000],5,"Sorry vรฌ clip ko lquan แบก, shop giao hรng ฤรณng gรณi bao kฤฉ luรดn, giao rแบฅt nhanh, ฤi kรจm cแป vร ฤแป lแบฅy sแบฃn phแบฉm rแบฅt cute ^^ chแบฅt lฦฐแปฃng sแบฃn phแบฉm ฤแปnh แบก, mng nรชn mua nha โค๏ธโค๏ธโค๏ธ"
[ ฤang Sale + Quร ] Sแปฏa Ong Chรบa SUBEE - Nguyรชn Chแบฅt ( 100gr ) - Tแบทng Kรจm Cแป Muแปng,[''],[9800000000],5,Giao hรng siรชu nhanh. Mแปi ฤแบทt ngรy trฦฐแปc ngรy sau nhแบญn ฤฦฐแปฃc hรng rแปi nรจ. Khรดng biแบฟt sรi cรณ tรกc dแปฅng khรดng. Nแบฟu ok sแบฝ แปงng hแป shop tรญp nรจ.
[ ฤang Sale + Quร ] Sแปฏa Ong Chรบa SUBEE - Nguyรชn Chแบฅt ( 100gr ) - Tแบทng Kรจm Cแป Muแปng,[''],[9800000000],5,"Shop gรณi hรng kฤฉ lแบฏm, nhแบญn ฤฦฐแปฃc hรng mแป ra xinh cแปฑc แบฅy. Bแบกn chแปง shop nhiแปt tรฌnh, chฤm sรณc khรกch hรng chu ฤรกo cแปฑc kรฌ. Sแบฝ แปงng hแป shop tiแบฟp nhaaaaa. Chรบc shop buรดn may bรกn ฤแบฏt๐ฅฐ๐ฅฐ๐ฅฐ"
[ ฤang Sale + Quร ] Sแปฏa Ong Chรบa SUBEE - Nguyรชn Chแบฅt ( 100gr ) - Tแบทng Kรจm Cแป Muแปng,[''],[9800000000],5,"Hรฌnh แบฃnh mang tรญnh chแบฅt nhแบญn xu. Giao hรng ฤรบng mแบซu mac vร rแบฅt nhanh
Sแบฝ แปงng hแป shop nhiแปu"
[ ฤang Sale + Quร ] Sแปฏa Ong Chรบa SUBEE - Nguyรชn Chแบฅt ( 100gr ) - Tแบทng Kรจm Cแป Muแปng,[''],[9800000000],5,"giao hรng nhanh, ฤแบฏp mแบทt nแบก thแบฅy tแปt lแบฏm nรจ, ฤแป sแปญ dแปฅng thรชm 1 tgian xem cรณ cแบฃi thiแปn kh"
[ ฤang Sale + Quร ] Sแปฏa Ong Chรบa SUBEE - Nguyรชn Chแบฅt ( 100gr ) - Tแบทng Kรจm Cแป Muแปng,[''],[9800000000],5,"Mรฌnh mua แป shop mแปt lแบงn thแบฅy tแปt nรชn mua lแบกi. Lแบงn nรy giao hรng hฦกi lรขu, vแบซn ฤc tแบทng chแปi vร muแปng quรฉt mแบทt nแบก. Hรฌnh แบฃnh mang tรญnh chแบฅt lแบฅy xu thรดi แบก~"
[ ฤang Sale + Quร ] Sแปฏa Ong Chรบa SUBEE - Nguyรชn Chแบฅt ( 100gr ) - Tแบทng Kรจm Cแป Muแปng,[''],[9800000000],5,Giao hรng siรชu nhanh. Nay ฤแบฏp mแบทt luรดn. Cรณ liแบฟm thแปญ kb nรณ ra sao. Chฦฐa ฤn bao giแป.๐
[ ฤang Sale + Quร ] Sแปฏa Ong Chรบa SUBEE - Nguyรชn Chแบฅt ( 100gr ) - Tแบทng Kรจm Cแป Muแปng,[''],[9800000000],5,"Xinh xแบฏn :)), ฤแบทt 6.6 nรชn giao hรng hฦกi lรขu. ฤแบฏp thรญch lแบฏm แบก sแบฝ mua lแบกi nแบฟu hแบฟt"
[ ฤang Sale + Quร ] Sแปฏa Ong Chรบa SUBEE - Nguyรชn Chแบฅt ( 100gr ) - Tแบทng Kรจm Cแป Muแปng,[''],[9800000000],5,mui hoi khรณ ngui. dong goi chac chan khong bi vแปก. lรm mask hoi bแป chรขm chรญch
[ ฤang Sale + Quร ] Sแปฏa Ong Chรบa SUBEE - Nguyรชn Chแบฅt ( 100gr ) - Tแบทng Kรจm Cแป Muแปng,[''],[9800000000],5,ฤรณng gรณi rแบฅt kแปน. ฤฦฐแปฃc tแบทng kรจm cแป vร xแบปng bรฉ bรฉ dแป thฦฐฦกng. Tแบทng Shop 5 sao
[ ฤang Sale + Quร ] Sแปฏa Ong Chรบa SUBEE - Nguyรชn Chแบฅt ( 100gr ) - Tแบทng Kรจm Cแป Muแปng,[''],[9800000000],5,Giao hรng nhanh.shop giao ฤung loแบกi mรฌnh ฤแบทt.xรi รดkรช sแบฝ mua tiแบฟp
[ ฤang Sale + Quร ] Sแปฏa Ong Chรบa SUBEE - Nguyรชn Chแบฅt ( 100gr ) - Tแบทng Kรจm Cแป Muแปng,[''],[9800000000],5,Lแป sแปฏa ong chรบa rแบฅt xแปn sรฒ .ฦฐng dรฃ man nhฦฐng chฦฐa biแบฟt chแบฅt lฦฐแปฃng cรณ hiแปu quแบฃ k bsau dรนng rแปi rรฌ viu sau nha
[ ฤang Sale + Quร ] Sแปฏa Ong Chรบa SUBEE - Nguyรชn Chแบฅt ( 100gr ) - Tแบทng Kรจm Cแป Muแปng,[''],[9800000000],5,"ฤรณng gรณi cแบฉn thแบญn
Spham chฦฐa sแปญ dแปฅng nรชn chฦฐa biแบฟt nร 

Nxnxjxjxnxnxnnxnx 
Nแบฟu Okay sแบฝ quay lแบกi"
[ ฤang Sale + Quร ] Sแปฏa Ong Chรบa SUBEE - Nguyรชn Chแบฅt ( 100gr ) - Tแบทng Kรจm Cแป Muแปng,[''],[9800000000],5,Okokokokokokokokokokokokokokokokokokokokokokokokokokokok okokokokokok okokokokokokokokok okokokokokok
[ ฤang Sale + Quร ] Sแปฏa Ong Chรบa SUBEE - Nguyรชn Chแบฅt ( 100gr ) - Tแบทng Kรจm Cแป Muแปng,[''],[9800000000],5,"Tuy lแบงn ฤแบงu mua nhฦฐng mua lแบงn 6 hแปง luรดn :""> chฦฐa dรนng nhฦฐng vแบซn cho 5 sao nhรฉ :"">"
[ ฤang Sale + Quร ] Sแปฏa Ong Chรบa SUBEE - Nguyรชn Chแบฅt ( 100gr ) - Tแบทng Kรจm Cแป Muแปng,[''],[9800000000],5,Hรng ok ..k bแป bแป vแปก ..chuw sรi nรชn chuw pรญt .nhฦฐng nhรฌn chung lร nรชn mua ..giao hรng nhanh nmkkkbjdidijdjfifkfjfjkdkdjdbcjfidjnfjfkkfnfbjfkkrkfnfbfjfkfojfnfnfkkfjfnfnfjkfkfnfnfjfkjfnfnfkfkdjnfnfjfjkrjfnfnfkrifjnfnfjrkrkrjfnfnrjrifjfjkrkrkfnfnrjofjfnrkfkfjnfnrkkrjfbfjrkrfijfnfnfkofjfnnfk
[ ฤang Sale + Quร ] Sแปฏa Ong Chรบa SUBEE - Nguyรชn Chแบฅt ( 100gr ) - Tแบทng Kรจm Cแป Muแปng,[''],[9800000000],5,Mแปi ฤแบทt hwa hnay nhแบญn ฤแปฉc rแปi.Mรฌnh quรชn chup lแบกi แบฃnh rแปi dรนng ฤฦก แบฃnh nรy แบก.ฤฦฐฦกc tแบทng quร kem theo.nรชn mua nha mn
[ ฤang Sale + Quร ] Sแปฏa Ong Chรบa SUBEE - Nguyรชn Chแบฅt ( 100gr ) - Tแบทng Kรจm Cแป Muแปng,[''],[9800000000],5,Vvvvvvvvvvvvvvvvvvvvvvvvvvvvvvvvvvvvvvvvvvvvvvvvvvvvvvvvvvv em ฤi lรm cho em ฤi lรm chแป แป nhร ngแปง ฤi mai cรฒn ฤi lรm vแป chฦฐa cรณ hรฌnh nhฦฐ lร mแปt loรi thแปฑc 
[ ฤang Sale + Quร ] Sแปฏa Ong Chรบa SUBEE - Nguyรชn Chแบฅt ( 100gr ) - Tแบทng Kรจm Cแป Muแปng,[''],[9800000000],5,"Giao hรng nhanh
ฤรณng gรณi cแบฉn thแบญn
ฤแป vรด tแปง lแบกnh ngฤn ฤรดng ฤรดng mร cรฒn dแบปo dแบปo
Sแปญ dแปฅng chแบฅt lฦฐแปฃng ok sแบฝ แปงng hแป shop tiแบฟp แบก"
[ ฤang Sale + Quร ] Sแปฏa Ong Chรบa SUBEE - Nguyรชn Chแบฅt ( 100gr ) - Tแบทng Kรจm Cแป Muแปng,[''],[9800000000],5,"Gรณi hรng cแบฉn thรขn sp tรดt lแบฏm
Trแปi ฦกi ฤแบฏp ฤรฃ lแบฏm. Xuแบฅt sแบฏc luรดn. Sแบฝ แปงng hแป tiแบฟp แบก."
[ ฤang Sale + Quร ] Sแปฏa Ong Chรบa SUBEE - Nguyรชn Chแบฅt ( 100gr ) - Tแบทng Kรจm Cแป Muแปng,[''],[9800000000],5,"Shop Cรณ tรขm lแบฏm, nhiแปt tรฌnh dแป thฦฐฦกng, sแปฏa ong chรบa uแปng ngแปง ngon"
[ ฤang Sale + Quร ] Sแปฏa Ong Chรบa SUBEE - Nguyรชn Chแบฅt ( 100gr ) - Tแบทng Kรจm Cแป Muแปng,[''],[9800000000],5,"Chฦฐa dรนng nรชn khรดng bit chแบฅt lฦฐแปฃng, nhฦฐng thแบฅy ฤรณng gรณi cแบฉn thแบญn, ฤแบนp."
[ ฤang Sale + Quร ] Sแปฏa Ong Chรบa SUBEE - Nguyรชn Chแบฅt ( 100gr ) - Tแบทng Kรจm Cแป Muแปng,[''],[9800000000],5,"Shop chu ฤรกo ฤรณng gรณi cแบฉn thแบญn,bao bรฌ vร sp tแบทng kรจo xinh,dรนng lแบงn ฤแบงu hฦกi ngแปฉa vร chรขm chรญch,kb cรณ hiแปu quแบฃ k:)))"
[ ฤang Sale + Quร ] Sแปฏa Ong Chรบa SUBEE - Nguyรชn Chแบฅt ( 100gr ) - Tแบทng Kรจm Cแป Muแปng,[''],[9800000000],5,ฤรฃ dรนng hแบฟt hai lแป mua lแบงn nรy lแบงn hai cแบฃm thแบฅy cรณ hiแปu quแบฃ.....
[ ฤang Sale + Quร ] Sแปฏa Ong Chรบa SUBEE - Nguyรชn Chแบฅt ( 100gr ) - Tแบทng Kรจm Cแป Muแปng,[''],[9800000000],5,"ฤรณg gรณi rแบฅt kแปน vร ฤแบนp, mแบซu mรฃ nhรฌn dแป thฦฐฦกng cรณ kรจm quร muแปng vร thรฌa mรบc"
[ ฤang Sale + Quร ] Sแปฏa Ong Chรบa SUBEE - Nguyรชn Chแบฅt ( 100gr ) - Tแบทng Kรจm Cแป Muแปng,[''],[9800000000],5,Mua nแป ฤแบงu tiรชn nรชn ko biแบฟt hiแปu quแบฃ nhฦฐ nรo. Hhshshshshzhjwbsj
[ ฤang Sale + Quร ] Sแปฏa Ong Chรบa SUBEE - Nguyรชn Chแบฅt ( 100gr ) - Tแบทng Kรจm Cแป Muแปng,[''],[9800000000],5,ฤรณng gรณi kฤฉ cรng. Sau khi ฤแบฏp mแบทt thแบฅy da mแปn hฦกn hแบณn. Sแป thรญch lแบฏm. Dรนng hแบฟt sแบฝ mua tiแบฟp 
[ ฤang Sale + Quร ] Sแปฏa Ong Chรบa SUBEE - Nguyรชn Chแบฅt ( 100gr ) - Tแบทng Kรจm Cแป Muแปng,[''],[9800000000],5,Okkkkkkkkkkkkkkkkkkkkkkkkkkkkkkkkkkkkkkkkkkkkkkkkk
[ ฤang Sale + Quร ] Sแปฏa Ong Chรบa SUBEE - Nguyรชn Chแบฅt ( 100gr ) - Tแบทng Kรจm Cแป Muแปng,[''],[9800000000],5,"Shop gรณi hรng rแบฅt lร cแบฉn thแบญn nha. ฤแบทc biแปt lร a shipper lแบกi rแบฅt thรขn thiแปn, nรณi chuyแปn dแป thฦฐฦกng nแปฏa chแป. "
[ ฤang Sale + Quร ] Sแปฏa Ong Chรบa SUBEE - Nguyรชn Chแบฅt ( 100gr ) - Tแบทng Kรจm Cแป Muแปng,[''],[9800000000],5,"Thoa len mat rแปญa lแบกi nฦฐแปc da bรณng vร mแปm , nhฦฐng mรนi khรดng thรญch cho lแบฏm , shop giao hang nhanh "
[ ฤang Sale + Quร ] Sแปฏa Ong Chรบa SUBEE - Nguyรชn Chแบฅt ( 100gr ) - Tแบทng Kรจm Cแป Muแปng,[''],[9800000000],5,Giao hรng nhanh ฤรณng gรณi cแบซn thแบญn lแป xinhhhhhhhhhhhbbhhhbb
[ ฤang Sale + Quร ] Sแปฏa Ong Chรบa SUBEE - Nguyรชn Chแบฅt ( 100gr ) - Tแบทng Kรจm Cแป Muแปng,[''],[9800000000],5,Sp giแปฏa kฤฉ cรฒn tแบทng kรจm cแบฃ cแป vs muแปng mรบc khรก xinh
[ ฤang Sale + Quร ] Sแปฏa Ong Chรบa SUBEE - Nguyรชn Chแบฅt ( 100gr ) - Tแบทng Kรจm Cแป Muแปng,[''],[9800000000],5,"ฤรณng gรณi chแบฏc chแบฏn, ฤแป tแบทng kรจm siรชu yรชu. Giao hรng rแบฅt nhanh แบก vvvvvvvvvvvvvvvvvvvvv"
[ ฤang Sale + Quร ] Sแปฏa Ong Chรบa SUBEE - Nguyรชn Chแบฅt ( 100gr ) - Tแบทng Kรจm Cแป Muแปng,[''],[9800000000],5,"Nhแบญn hรng cลฉng khรก nhanh. Shop gรณi hรng cแบฉn thแบญn bแปc kฤฉ nรชn chแบฃ lo vแปก. ฤc tแบทng 1 xแบปng vร 1 chแปi cแป dแป thฦฐฦกng dรฃ man hihi
Dรนng 1 tgian r quay lแบกi review. Mรฌnh ฤแบฏp cรนng tแบฃo thรฌ thแบฅy da trแบฏng hฦกn, mแปฅn ko lรชn nแปฏa vร thรขm mแปฅn cลฉ thรฌ mแป ฤi"
[ ฤang Sale + Quร ] Sแปฏa Ong Chรบa SUBEE - Nguyรชn Chแบฅt ( 100gr ) - Tแบทng Kรจm Cแป Muแปng,[''],[9800000000],5,Hรng Ok nha
[ ฤang Sale + Quร ] Sแปฏa Ong Chรบa SUBEE - Nguyรชn Chแบฅt ( 100gr ) - Tแบทng Kรจm Cแป Muแปng,[''],[9800000000],5,Giao hรng nhanh. Hรng ฤรณng gรณi cแบฉn thแบญn bแปc kฤฉ. Mรนi hฦกi hแบฏc. Ko biแบฟt cรณ tรกc dแปฅng ko. Sแปญ dแปฅng ok sแบฝ mua tiแบฟp แบก. Giรก rแบป. Chแบฅt lฦฐแปฃng tแปt. ฤรณng gรณi kฤฉ. Ship nhiแปt tรฌnh
[ ฤang Sale + Quร ] Sแปฏa Ong Chรบa SUBEE - Nguyรชn Chแบฅt ( 100gr ) - Tแบทng Kรจm Cแป Muแปng,[''],[9800000000],5,"Trแปi ฦกi shop buรดn bรกn dแป thฦฐฦกng gรฌ ฤรขu รก, phแบฃn hแปi tin nhแบฏn khรกch nhanh. Gรณi hรng thรฌ siรชu kแปน luรดn, cรณ cแปt sแปฃi dรขy dแป thฦฐฦกng lแบฏm. Hi vแปng sp nรy hแปฃp vแปi da mรฌnh. Ship hรng thรฌ siรชu nhanh luรดn nรจ, mแปi ฤแบทt hqua, hnay ฤรฃ giao lun โค๏ธ"
[ ฤang Sale + Quร ] Sแปฏa Ong Chรบa SUBEE - Nguyรชn Chแบฅt ( 100gr ) - Tแบทng Kรจm Cแป Muแปng,[''],[9800000000],5,"Sรi ok,sแปญ duฬฃng hแบฟt sแบฝ mua tiรชฬp nha.kicigihlbkchzn  jcjckvlvkvkg"
[ ฤang Sale + Quร ] Sแปฏa Ong Chรบa SUBEE - Nguyรชn Chแบฅt ( 100gr ) - Tแบทng Kรจm Cแป Muแปng,[''],[9800000000],5,Ok ฤรณnh gรณi cแบงn thแบญn cรณ hรng tแบทng kรจm mรนi sแปฏa ong chรบa mแปi ngแปญi nรชn chฦฐa quen mรนi lแบฏm
[ ฤang Sale + Quร ] Sแปฏa Ong Chรบa SUBEE - Nguyรชn Chแบฅt ( 100gr ) - Tแบทng Kรจm Cแป Muแปng,[''],[9800000000],5,"Mรฌnh ฤรฃ tแปซng dรนng qua sแปฏa ong chรบa loแบกi nhฦฐ vแบงy ฤแป ฤแบฏp mแบทt rแปi, nรชn lรชn shopee tรฌm thแปญ coi cรณ bรกn k ๐คฃ lแบงn ฤแบงu ฤแบฏp thรฌ hฦกi chรขm chรญt da tรญ xรญu, nhฦฐng vแป sau da quen rแปi nรชn sแบฝ k sao hแบฟt nha. M bแป mแปฅn แบฉn, dรนng loแบกi nรy hแบฟt mแปฅn, da mแปn hแบณn ra"
[ ฤang Sale + Quร ] Sแปฏa Ong Chรบa SUBEE - Nguyรชn Chแบฅt ( 100gr ) - Tแบทng Kรจm Cแป Muแปng,[''],[9800000000],5,Ahihi hi hi haha hi hehe hsjx huc huc liu liu le le le gigigicneie
[ ฤang Sale + Quร ] Sแปฏa Ong Chรบa SUBEE - Nguyรชn Chแบฅt ( 100gr ) - Tแบทng Kรจm Cแป Muแปng,[''],[9800000000],5,"ฤรณng gรณi vรด cรนng chแบฏc chแบฏn , bao bรฌ ฤแบนp , chแบฅt lฦฐแปฃng sแบฃn phแบฉm tแปt "
[ ฤang Sale + Quร ] Sแปฏa Ong Chรบa SUBEE - Nguyรชn Chแบฅt ( 100gr ) - Tแบทng Kรจm Cแป Muแปng,[''],[9800000000],5,"Mแปi bรดi lแบงn ฤแบงu cรณ chรขm chรญch vแปi rรกt khoแบฃng 5 phรบt lร hแบฟt hoรn toรn. Rแปญa mแบทt bแบฑng nฦฐแปc sแบกch xong lร khรดng cรฒn mรนi cแปงa S.O.C nแปฏa. Sรกng ngแปง dแบญy da cลฉng mแปn. Nแบฟu cแบฃi thiแปn ฤc da sแบฝ แปงng hแป tiแบฟp (mรฌnh da dแบงu dแป lรชn mแปฅn, ฤแปฃt nรy mรฌnh ฤรฃ trแป mแปฅn hแบฟt 80% rแปi). Mร nhแบญn hรng cแป bแป bแป rแปi shop ฦกi"
[ ฤang Sale + Quร ] Sแปฏa Ong Chรบa SUBEE - Nguyรชn Chแบฅt ( 100gr ) - Tแบทng Kรจm Cแป Muแปng,[''],[9800000000],5,
[ ฤang Sale + Quร ] Sแปฏa Ong Chรบa SUBEE - Nguyรชn Chแบฅt ( 100gr ) - Tแบทng Kรจm Cแป Muแปng,[''],[9800000000],5,"Giao hรnh nhanh.
ฤแป sแปญ dแปฅng thแปญ xem sao 
Dkdoeodpfpcockxkdkxkxdk"
[ ฤang Sale + Quร ] Sแปฏa Ong Chรบa SUBEE - Nguyรชn Chแบฅt ( 100gr ) - Tแบทng Kรจm Cแป Muแปng,[''],[9800000000],5,"sแบฃn phแบฉm cแบงm chแบฏc tay lแบฏm 
thiแบฟt kแบฟ cลฉng bแบฏt mแบฏt nแปฏa
mรฌnh chฦฐa sแปญ dแปฅng nแบฟu sแบฃn phแบฉm chแบฅt lฦฐแปฃng mรฌnh sแบฝ แปงng hแป shop tiแบฟp tแปฅc แบก 
cแบฃm ฦกn shop rแบฅ nhiแปu 
โค๏ธ"
[ ฤang Sale + Quร ] Sแปฏa Ong Chรบa SUBEE - Nguyรชn Chแบฅt ( 100gr ) - Tแบทng Kรจm Cแป Muแปng,[''],[9800000000],5,Ok ddhbdbdhdhxjdjsjsjsjsjwuwuwyw wI wto wsaid wywywywyywywwywyywwyuwwyuwuwuwuw
[ ฤang Sale + Quร ] Sแปฏa Ong Chรบa SUBEE - Nguyรชn Chแบฅt ( 100gr ) - Tแบทng Kรจm Cแป Muแปng,[''],[9800000000],5,Chแบฅt lฦฐแปฃng tแปt!!! Hแปง nhรฌn rแบฅt xinh!! Tแบทng โxแบปngโ lแบฅy cแปฉng hแบฟt nแบฅc!!!!!!!!!!!!
[ ฤang Sale + Quร ] Sแปฏa Ong Chรบa SUBEE - Nguyรชn Chแบฅt ( 100gr ) - Tแบทng Kรจm Cแป Muแปng,[''],[9800000000],5,"Hรng giao nhanh, quร tแบทng cute. Chฦฐa xรi nรชn chฦฐa biแบฟt chแบฅt lฦฐแปฃng ntn"
