variations,price,rating_star,comment
['Low pH Good Morning'],[14000000000],5,"Ok ok ok con ** này okok
Mua mua mua đi hihihijihijijhjjijjii"
['Low pH Good Morning'],[14800000000],5,
['Low pH Good Morning'],[17900000000],5,"lần đầu mua loại này hi vọng xài ổn để ko đổi loại khác nữa 😂 shop giao đầy đủ dc tặng thêm simple nữa sẽ ủng hộ shop tiếp
"
['Low pH Good Morning'],[17900000000],5,"Giao hàng nhanh, đóng gói chắc chắn và còn được tặng kèm serum innisfree"
['Low pH Good Morning'],[17900000000],5,hàng giao nhanh và rất lsf chất lượng làn tới sẽ ủng hộ shop tiếp
['Low pH Good Morning'],[16500000000],5,Nhận đc hàng mà ưng cái bụng ghê. Srm check ra đc mã. Shop gói hàng đầy đủ còn đc tặng thêm mask nữa . Còn về srm thì lần đầu mình sd nên mong trộm vía nó ổn. Rate 10000000/10
['Low pH Good Morning'],[14000000000],5,Tham gia Minigame tại AirPay để cùng nhận Voucher mua hàng Shopee mỗi ngày bạn nhé. Giải thưởng cực hấp dẫn đó nha.
['Low pH Good Morning'],[17900000000],5,"giao hàng siêu nhanh, đóng gói cẩn thận, cảm ơn shop nhiềuuuu"
['Low pH Good Morning'],[16500000000],5,"Shop đóng gói hàng kĩ, giao hàng siu nhanh lun. Bên trong có thư cảm ơn của shop nữa, với mình check đc mã vạch sản phẩm nên cũng yên tâm hihi"
['Low pH Good Morning'],[17900000000],5,"Đóng gói ổn, ship cũng nhanh. Video là hộp mình khui ra rồi, chỉ quay cho có thôi nha :)) Corsx thì mình sắp dùng hết tuýp thứ 4 rồi, tuýp này mẫu mới chưa dùng chưa biết sao, hy vọng ổn"
['Low pH Good Morning'],[17900000000],5,"Giao hàng nhanh, còn được tặng thêm quà. Chất lượng phải xài thử mới biết. Nchung tốt. Video không lien quan"
['Low pH Good Morning'],[15200000000],5,"Lần đầu dùng kug thấy dc
Pải dùng time xem có hợp k đã ạ
Mong là k lên mụnnn 😊😊"
['Low pH Good Morning'],[14000000000],5,"Sp dùng mướt, khá thích, có quét đc mã sp, lần sau sẽ ủng hộ shop tiếp
"
['Low pH Good Morning'],[18500000000],5,"Mùi hơi khó ngửi nhưng rửa mặt xong ko cảm giác căng shop gói hàng siêu xịn , ship nhanh dù mik ở tỉnh lẻ"
['Low pH Good Morning'],[17900000000],5,"Giao hàng cũng khá nhanh. Sản phẩm check được mã vạch, shop còn tặng thêm cho mình mẫu thử nhỏ nhỏ serum"
['Low pH Good Morning'],[14000000000],5,"Sản phẩm khá oke, giao hàng khá nhanh. Video không liên quan lắm"
['Low pH Good Morning'],[14000000000],5,Lần đầu mua của shop .săn sale nêm rất rẻ. Shop đóng gói cẩn thận.chưa sử dụng nên k biết có hợp k.mong hợp vs da dầu
['Low pH Good Morning'],[14000000000],5,"Sản phẩm nhận được siêu ưng luôn, shop đóng gói sản phẩm cẩn thận, date xa"
['Low pH Good Morning'],[17900000000],5,Sản phẩm chất lượng. Đóng gói sản phẩm chắc chắn. Sẽ tiếp tục ủng hộ. 
['Low pH Good Morning'],[18500000000],5,Mua 2 lần rùi hàng chính hãng ko có gì phải bàn 1000000 điểmmmm
['Low pH Good Morning'],[14000000000],5,"Đóng gói cẩn thận có bọc chống sốc 
Săn sale đc giá rẻ nên k biedts có chuẩn auth k nữa . Thấy nhiều ng đánh giá tốt nên mua "
['Low pH Good Morning'],[14000000000],5,"Chất lượng sản phẩm tuyệt vời nhất, đóng gói sản phẩm rất đẹp và chắc chắn "
['Low pH Good Morning'],[14000000000],5,"Nghe khen nhiều nhưng giờ mới mua xài , hem bít lên da tui như nào hihi "
['Low pH Good Morning'],[14000000000],5,"giao hàng nhanh 
sữa rửa mặt lành tính 
rửa mặt sạch
có tặng kèm mặt nạ giấy"
['Low pH Good Morning'],[18500000000],5,Vid kh liên quan lắm tại mình lười quay sp nhưng srm rất chi là okela nha mn 😍😍
['Low pH Good Morning'],[14000000000],5,"Lấy tạm hình
Chai này mùi nhẹ hơn chai trước mình mua. . Còn chất lượng thì để sử dụng vài mới đánh giá được. "
['Low pH Good Morning'],[15200000000],5,"Hình ảnh chỉ mang tính chất kiếm xu, giao hàng nhanh, xài okee"
['Low pH Good Morning'],[16500000000],5,"Giao hàng nhanh , check dc mã vạch , k thấy date ,chưa dùng chưa biết chất lượng thế nào."
['Low pH Good Morning'],[15200000000],5,"Sản phẩm tốt, chai to, giao hàng nhanh nữa hehe xài xong không bị khô da căng da thấy êm ái trộm vía thiệt sự hehe "
['Low pH Good Morning'],[14000000000],5,"Giao hàng hơi lâu , thấy nhiều người mua mong là chính hãng :))"
['Low pH Good Morning'],[15200000000],5,"Sản phẩm ok ạ!chất lượng phải dùng mới biết ạ,đống gói cẩn thận lắm ạ🧞‍♂️🧞‍♂️"
['Low pH Good Morning'],[14000000000],5,Mới mua của shop lần đầu tiên ngay đợt giảm giá. Đóng gói hàng đẹp chất lượng sẽ ủng hộ tiếp
['Low pH Good Morning'],[17900000000],5,"Không biết thật giả thế nào, nhưng dùng cũng ổn.... giao hàng nhanh và có nhận dc quà, đã mua 2 lần!!!! "
['Low pH Good Morning'],[17900000000],5,"Thời gian giao khá nhanh hơn mình tưởng shop phục vụ tốt và nice. Không chỉ thế mà còn tặng thêm 1 gói serum dễ thương🥰🥰🥰
"
['Low pH Good Morning'],[18500000000],5,"Ko bt sao chứ khác chai lúc trc của mình quá 
Mà shop tặng thêm mask"
['Low pH Good Morning'],[16500000000],5,Giao hàng nhanh nhận hàng đầy đủ nguyên vẹn chưa sử dụng nên ko biết chất lượng thế nào 
['Low pH Good Morning'],[14000000000],5,"Shop đóng hàng cẩn thận và chắc chắn, tgian giao hành siêu nhanhhhhhh"
['Low pH Good Morning'],[17900000000],5,Giao hàng đúng ngày đbsbdbdbjjhhhhhhhhhsshsbbsbsbsbsbsveve
['Low pH Good Morning'],[15200000000],5,hàng ok lắm ạ giao mhanb ạ chưa dùng thử nên chưa b ạaaaaaaaaaaaa
['Low pH Good Morning'],[14000000000],5,Sp đóng gói cẩn thận có thư cảm ơn ! Check ra sp ! Sẽ ủng hộ dài ạ 😍😍
['Low pH Good Morning'],[17900000000],5,"Giao hàng nhanh, chai thứ hai mình mua của shop rồi, thấy chai to đùng mà không biết sao mình xài nhanh hết quá."
['Low pH Good Morning'],[14000000000],5,Shop giao hàng nhanh. Sản phẩm chất lượng. Đóng gói hàng rất đẹp còn có thiệp cảm ơn. Cho shop 5* lần sau sẽ ủng hộ shop tiếp. 
['Low pH Good Morning'],[15200000000],5,Đã nhận dc hàng ạ.chai srm siêu to lại kèm quà nữa ạ. Xài ok sẽ ủng hộ shop nữa nè. Thanks shop. Giao hàng siêu nhanh 
['Low pH Good Morning'],[14000000000],5,Rất hài lòng 10d hhhhhhhhhhosndbxjsoqlsnjckwkanxbxbdnb
['Low pH Good Morning'],[17900000000],5,"Đóng gói sản phảm rất đẹp và chắc chắn 
Mùi hơi hắc xíu nhưng sài đc"
['Low pH Good Morning'],[18500000000],5,Sản phẩm rất chất lượng giá rẻ shop tư vấn rất nhiệt tình ......
['Low pH Good Morning'],[17900000000],5,"Giao hàng nhanh lắm ạ, chất lượng sản phẩm tốt, sẽ cn ủng hộ nữa"
['Low pH Good Morning'],[17900000000],5,"Giao hàng nhanh. Đóng gói cẩn thận. Srm dùng rất thích, mát lạnh... "
['Low pH Good Morning'],[15200000000],5,Ảnh không liên quan nhưng nên mua ạ
['Low pH Good Morning'],[18500000000],5,"Đã nhận dc hàng, hàng chuẩn xịn xót, được tặng thêm miếng thải độc da, tks shop nhiu nha "
['Low pH Good Morning'],[17900000000],5,Lần nào mua ở shop cũng có đồ tặng kèm hết ấy. Chai srm khá to dùng chắc 4 5 tháng í nhưng mùi thì đối với mình hơi khó chịu
['Low pH Good Morning'],[18500000000],5,"Giao hàng nhanh,  mình da dầu nên dùng sữa rửa mặt này thích lắm."
['Low pH Good Morning'],[15200000000],5,"Sữa rửa mặt không gây khô da, siêu dịu nhẹ nên rất thích hợp với da mụn :)))))))))))))"
['Low pH Good Morning'],[18500000000],5,"Trông hình thì nhỏ mà mua về thấy to ghê. Chắc tại lúc mua không xem kĩ dung tích. Chưa sử dụng nên chưa biết có hợp với da mặt mình không, tại thấy nhiều người gợi ý giới thiệu nên mua thử."
['Low pH Good Morning'],[18500000000],5,gooddddddddddddddddddddddddddddddddddddddddddddddd
['Low pH Good Morning'],[18500000000],5,Day la tuy thứ 5 minh dùng khá là ân ý lắm 🤣 sẻ ung hộ shop
['Low pH Good Morning'],[18500000000],5,Sửa rửa mặt này thì quốc dân rồi nên không cần nói nhiều. Mình sử dụng cho buổi sáng vì độ tẩy rửa của nó ko cao lắm.
['Low pH Good Morning'],[18500000000],5,"đóng gói đẹp và chắc chắn, còn được tặng quà nữa ạ, shop dễ thương lắmmmmmmmmmmmmmmmmmmmmmmmmm"
['Low pH Good Morning'],[14000000000],5,Giao hàng nhanh. Sữa rửa mặt dịu nhẹ. Không gây khô da. Phù hợp mọi loại da. Chất lượng hơn so với giá tiền
['Low pH Good Morning'],[18500000000],5,"T có thấy phần miêu tả của shop là sp đổi mẫu, nhưng lúc mở hộp vẫn khá hoang mang. Chữ in và màu vỏ ko rõ nét, nhợt nhạt. Texture đặc, ko bị nổi bóng, ko còn mùi tràm trà đặc trưng. T ko chắc chắn là aut nhưng cũng ko dám nói fake. Thôi để t dùng dần, có gì nói sau. Thanks shop đã tặng t gói mặt nạ"
['Low pH Good Morning'],[16100000000],5,"Srm dùng rất ok, mình dùng loại này nhiều lần r nhưng mới mua ở đây lần đầu, nhìn chung cũng khá ổn áp"
['Low pH Good Morning'],[16900000000],5,Cảm quang thấy OK. Chưa sử dụng để xem sau. Mở ra thấy hàng tiếng nước ngoài không. Hoho
['Low pH Good Morning'],[16900000000],5,Lần đầu tiên sử dụng chưa biết ra sao nhưng shop giao hàng rất nhanh rất chắc chắn 
['Low pH Good Morning'],[14000000000],5,5sao bao bọc cẩn thận sẽ ủng hộ tiếpppppppppppp
['Low pH Good Morning'],[16100000000],5,"Hàng ok em mình xài rất thích
Bé 16 tuổi sử dụng sau 1 tuần mặt đỡ mụn hơn 
Chất gel dịu da không kin kít sau khi sử dụng 
Cảm ơn shop nhé "
['Low pH Good Morning'],[18500000000],5,Endundunduebisnsunsh SGD ydbyebdnnu hnsunsusndindudndnduneuenuenhenenenene
['Low pH Good Morning'],[16100000000],5,Hàng chuẩn nha. Sài thích lắm lun. Sài xong da mượt hông bị căng da nè. Thích hợp cho mấy bạn da nhạy cảm nè
['Low pH Good Morning'],[17900000000],5,Gxgcn crsfuhohibzesgcjbkbm b hckblbn tdyfobbkbkj. Chục h nj jvhcchjv
['Low pH Good Morning'],[14000000000],5,"Video chỉ mang t/c minh hoạ. Chưa mở ra sử dụng
Nhưng nhìn tổng thể sp giống với tuýp đã từng mua ngoài cửa hàng rẻ hơn 2,3 chục rồi. "
['Low pH Good Morning'],[14000000000],5,Chưa sài nên chưa bít nhungma check sp ra nhé. Sẽ ủng hộ típ nhen
['Low pH Good Morning'],[16100000000],5,
['Low pH Good Morning'],[18500000000],5,Giao hàng nhanh lắm à nghen sản phẩm không có tem phụ rửa có bọt kèm mùi
['Low pH Good Morning'],[19900000000],5,Không có chi cả nhà mình có đi làm về chưa em ơi em có đi không được 
['Low pH Good Morning'],[14000000000],5,"Hình ảnh chỉ mang tính chất nhận xu
Chất lượng tốt, đóng gói sản phẩm kĩ, giao hàng nhanh bbbnnnabb "
['Low pH Good Morning'],[14000000000],5,"Mua hàng của shop yên tâm chính hãng nha mng, shop đóng gói chắc chắn, sẽ quay lại mua tiếp khi dùng hết"
['Low pH Good Morning'],[14000000000],5,"Đã nhận đc sp. Đóng gói đẹp, cẩn thận. Giao hàng nhanh chóng. 
Hi vọng sd hợp da. "
['Low pH Good Morning'],[14000000000],5,Shop giao hàng nhanh đóng gói kĩ càng . Săn sale nên giá rẻ đc 1 chút 
['Low pH Good Morning'],[14000000000],5,"Hàng được đóng gói chắc chắn, sử dụng thử thấy khá là ok, sẽ còn mua lại ủng hộ shop 😊"
['Low pH Good Morning'],[14000000000],5,"Đã nhận được hàng, mua được flash sale giá rẻ thật là thích luôn, mình dùng tới tuýp thứ 2 rồi, độ PH NHẸ an toàn "
['Low pH Good Morning'],[14000000000],5,Shop dong goi chac chan. Hàng nguyên vẹn. Sài rất ok.     .     Z.      Z.     Z.   Z
['Low pH Good Morning'],[16100000000],5,"Shop gói hàng rất đẹp , mình check mã thì thấy giống. Rất ưng shop, lần sau mình sẽ ủng hộ tiếp ạ"
['Low pH Good Morning'],[14000000000],5,"mua đợt sale 8/3 còn có 140k thôi hihi
giao hàng nhanh mà đóng gói cũng cẩn thận nữa
cảm ơn shop nhiều ^^"
['Low pH Good Morning'],[16100000000],5,srm dùng ổn nhưng mình hok thích mùi tràm trà lắm :(( 🌝✨👭🏿👭🏿🪵✨🌖😭👀🌚👀😳🥲👩🏻‍🤝‍👩🏿🌖🥺🌖🌖😔🌝✨🌝✨✨🪵🌖😳
['Low pH Good Morning'],[16100000000],5,"Chất lượng sp ổn
Đóng gọi kĩ càng
Rất đáng mua
Mk săn sale nên được giá hợp lí
"
['Low pH Good Morning'],[14000000000],5,"Đóng gói kỹ , căn sale nên rẻ , chưa dùng nên mình chưa biết hiểu quả thế nào . Rao hàng nhanh "
['Low pH Good Morning'],[18500000000],5,❤❤❤❤❤❤❤❤❤❤❤❤❤❤❤❤❤❤❤❤❤❤❤❤❤❤❤❤❤❤❤❤❤❤shop phục vụ tốt. Hàng chất lượng tốt. Giá cả hợp lý. Hàng auth.Giao hàng nhanh. Đóng gói rất cẩn thận ko bị méo hàng
['Low pH Good Morning'],[16100000000],5,
['Low pH Good Morning'],[16100000000],5,Shop uy tín ship nhanh shipper thân thiện ok nhiệt tình
['Low pH Good Morning'],[18500000000],5,"Srm ngon, xịn rẻ. Mua đc hàng chính hãng, uy tín nhé........................."
['Low pH Good Morning'],[18500000000],5,"Shop giao hàng nhanh, đóng hàng kỹ và chắc chắn, sp check ra đúng ne 👍🏻"
['Low pH Good Morning'],[14000000000],5,"hàng tốt, xài đã, ship nhanh, rất ok ạ. Mong có dịp mua thêm các sản phẩm ở shop"
['Low pH Good Morning'],[14000000000],5,"Chai to ụ luôn , gói hàng chắc chắn . Lần đầu sử dụng nên chưa biết hiệu quả như nàooo kkkkkkkk"
['Low pH Good Morning'],[18500000000],5,"Hàng giao nhanh cực, hqua mới đặt mà nay nhận đc rồi , spham đóng gói chắc chắn lắm lun ,hàng đã chất lượng đã v còn đc tặng kèm quà bé bé xinh xinh , thích lắm nha shop "
['Low pH Good Morning'],[18500000000],5,"Dùng dịu nhẹ lắm nha 
Độ ph ko cao nha
Chất sữa màu trong suốt ý
Mỗi tội mùi tràm trà nồng :*(("
['Low pH Good Morning'],[14000000000],5,Chai to đùng luôn đóng gói hàng rất kỹ giao hang cũng tương đối nhanh mua flashsale nên giá quá hời luôn 
['Low pH Good Morning'],[16100000000],5,Shop giao hàng hơi lâu. Mình dùng sẽ review lại sau ạ. Thank you shop❤️
['Low pH Good Morning'],[18500000000],5,Giao hàng nhanh.đóng gói cẩn thận.có quà tặng kèm ♥️
['Low pH Good Morning'],[16100000000],5,Giao hàng nhanh chóng.... chất lượng tuyệt vời .... tặng shop 5 saoooo...........
['Low pH Good Morning'],[18500000000],5,"Giao hàng rất nhanh
Đóng gói cẩn thận
Chưa dùng nên ko biết ntn"
['Low pH Good Morning'],[18500000000],5,Chưa xài ko bik có thật ko nhưng vẫn đánh 5sao cho shopppppppp
['Low pH Good Morning'],[16100000000],5,"Giao hàng nhanh, mùi tràm trà hơi khó chịu, dạng gel nên độ tạo bọt hơi ít"
['Low pH Good Morning'],[18500000000],5,Shop đóng gói đẹp. Mới đặt hôm qua mà hôm nay đã giao rồi. Mua nhiều còn được tặng thêm mask. Quá ưng luôn 
['Low pH Good Morning'],[16100000000],5,Sửa rửa mặt shop gói hàng rất là ok luôn. Dùng dịu nhẹ và thơm mùi tràm trà
['Low pH Good Morning'],[16100000000],5,ok nè kkkkkkkkkkkkkkkkkkkkkkkkkkkkkkkkkkkkkkkkkkkkkkkkkkkkkkkkkkkkkkkk
['Low pH Good Morning'],[18500000000],5,Soaomzmzkzmsnzkskskzujxndbdkdnjkwnznzjmsmzbxudjdbxhhx
['Low pH Good Morning'],[16100000000],5,Cầm sản phẩm trên tay mà thấy quá thích. Hàng rất chất lượng. Gói hàng cũng rất tốt. Chúc shop buôn may bán đắt. 
['Low pH Good Morning'],[16100000000],5,Tốt ạaaaaaaa sjsjskwkwkwbskksjsbwiosbdiwosbdhsikwwbwjjw
['Low pH Good Morning'],[16100000000],5,Addghnbkkkgdaafhkmmfgkkrsdhjuredgmkđ
['Low pH Good Morning'],[16100000000],5,............uheiekwbdue92oebuewoehj3biekebjwnqs92cri3j3
['Low pH Good Morning'],[16100000000],5,Thấy cũng thơm mùi tràM mặc dù ko check được mã vạch. Rửa thấy da sạch căng nhẹ nhưng k phải do ph quá cao
['Low pH Good Morning'],[18500000000],5,"Giao hàng nhanh, sản phẩm chất lượng 😁😁😁😁😁😁😁😁😁😁😁😁😁😁😁😁😁😁😁😁😁😁😁😁😁😁😁"
['Low pH Good Morning'],[18500000000],5,"Giao hàng nhanh, giao đúng sản phẩm, shop dễ thương."
['Low pH Good Morning'],[18500000000],5,"Srm này khá hợp da mình,  nói chung dùng nhiều rôi, nhưng đây là lần đầu tiên mình mua bên shop này mà ƯNG cái bụng đến vậy,  sáng đặt mà chiều giao rồi, giao hàng cực nhanh, đóng gói chắc chắn,  còn được tặng quà nữa,  check mã ra. sẽ ủng hộ shop dài ❤"
['Low pH Good Morning'],[18500000000],5,"Giao hàng đủ, không bị đổ, sản phẩm okee, giá hợp lýy, mình sẽ đánh giá chất lượng sản phẩm sau khi dùng"
['Low pH Good Morning'],[16100000000],5,"Giao khá nhanh, hàng đẹp, lần thứ 2 mua ở shop nên thấy hài lòng"
['Low pH Good Morning'],[16100000000],5,Giao nhanh. Nghe khen srm nay nhieu nen mua dung thu. Neu hop lai mua tiep nhe
['Low pH Good Morning'],[18500000000],5,"lần đầu đặt mà shop gói rất cẩn thận, da mình da dầu nhưng để coi sử dụng lâu dài mới biết dc sp thế nào do mới lần đầu sd nghe mn review tốt "
['Low pH Good Morning'],[18500000000],5,"kiểu shop bán vì đam mê hay sao ấy mọi người, sảm phẩm tốt nha, do bên giao hàng ship hơi lâu nên phải chờ đợi, đóng gói kĩ có cả quà tặng và thiệp cảm ơn, ncl k thể chê vào đâu đc"
['Low pH Good Morning'],[18500000000],5,"Mùi hơi hắc , chắc do mới xài nên không quen 😩😩😩😩😩😩😩😩😩😩😩😩😩😩😩😩"
['Low pH Good Morning'],[18500000000],5,Sản phẩm dùng ổn mùi tràm trà nhẹ ...... hạn sử dụng xaaaa mmmmm
['Low pH Good Morning'],[18500000000],5,"Chất lượng sản phẩm tuyệt vời, giao hàng nhanh gọn lắmmmmmmm"
['Low pH Good Morning'],[18500000000],5,"Giao hàng nhanh gia hàng cẩn thận. Bao bì đẹp bắt mắt hàng đầy đủ. Mùi thì hơi khó chịu nếu rửa lần đầu lần sau thì quen dần nhưng theo tìm hiểu thì lạ mùi tự nhiên. Cảm giác sau khi rửa da mặt khá căng
Sorry mn vì hình ảnh k liên quan ạ 😥 "
['Low pH Good Morning'],[18500000000],5,"Đóng gói sản phẩm chắc chắn,check có ra mã,rửa xong mặt khá sạch.Sẽ tiếp tục ủng hộ shop "
['Low pH Good Morning'],[18500000000],5,"Giao hàng nhanh, đóng gói bao của chai srm có rách một tí nhưng k ảnh hưởng gì. Được tặng kèm miếng mask. Thank shop!
"
['Low pH Good Morning'],[18500000000],5,okiiiiiiiiiii>iiiiiii lắm nhaaaaaaaaa ❤❤❤❤❤❤❤❤❤❤❤❤❤❤❤❤❤❤❤❤❤❤❤
['Low pH Good Morning'],[18500000000],5,"Tuýp bự ko có tem chống giả nhưng thấy kết cấu ko bị bọt như hàng fake, nói chung okeee"
['Low pH Good Morning'],[18500000000],5,"Giao hàng nhanh, đóng gói chắc chắn, được tặng mask đất sét luôn"
['Low pH Good Morning'],[18500000000],5,"đặt ở shop này mấy lần rồi chất lượng vẫn xịn xò z, sẽ ủng hộ dài lâu luông nho"
['Low pH Good Morning'],[15600000000],5,"SRM của shop là mẫu mới nên có vài chi tiết trên bao bì khác với mẫu cũ mình xài, texture tuy lỏng hơn nhưng tạo bọt nhiều hơn mẫu cũ, mẫu mới ko có nhiều mùi hắc nữa ( mùi tràm trà), mẫu cũ mùi hắc lắm ý. SRM dịu nhẹ phù hợp cho nhiều loại da, nếu da khô thì sau khi rửa sẽ hơi bong tróc da nhẹ   "
['Low pH Good Morning'],[18500000000],5,"hàng còn nguyên seal, gói hàng rất là kĩ và đẹp luônnnn còn được tặng thêm 1 sheet mask nữa giao hàng khá nhanh "
['Low pH Good Morning'],[18500000000],5,"Sản phẩm tốt, check ra hàng thật, đóng gói hàng cẩn thận, giao hàng nhanh"
['Low pH Good Morning'],[18500000000],5,Hàng rất chất lượng và giao rất nhanh .mn nên mua ạ
['Low pH Good Morning'],[16100000000],5,"đóng gói sản phẩm đẹp, chất lượng sản phẩm tốt, giá sale khá rẻ"
['Low pH Good Morning'],[13900000000],5,"Em ơi đừng sợ nỗi buồn khó trôi...
Mặt trời kiểu gì cũng sẽ ló thôi....

Kẻ đáng thương luôn được lòng thiên hạ...
Người thẳng thắn ắt gặp nhiều chỉ trích😀

Em về điểm phấn tô lại son... Ngạo với nhân gian một nụ cười"
['Low pH Good Morning'],[17900000000],5,"Giao hàng nhanh, đóng gói cẩn thận. Chất lượng sữa rửa mặt tốt, rửa 1 đến 2 lần những mụn ẩn đầu đen đã đẩy lên để lấy đi dễ dàng. Srm có mùi tràm trà nhẹ, lần đầu ngửi hơi khó chịu nhưng những lần sau thơm"
['Low pH Good Morning'],[15600000000],5,"Giao hàng nhanh giật mình luôn. Đặt lúc 9h sáng tối đi làm về đã thấy giao rồi. Chai srm to đùng, chắc tại to hơn so với mình nghĩ. Check thì ra hàng chính hãng nhưng mà có một điều là trên nắp trong lớp nhựa lại bị bẩn bẩn là sao nhỉ? "
['Low pH Good Morning'],[18500000000],5,"Đặt hàng trưa hnay ngày hôm sau giao r, srm corx dùng có mùi hắc hắc mới dùng 1 lần. Ko biết ntn"
['Low pH Good Morning'],[13900000000],5,"Check mã thì có ra, có thể là do mình mới xài nên chưa quen mùi, mình thấy mùi khá là khó chịu nhưng mà pH thấp nên rửa xong không bị căng kít da, da mịn "
['Low pH Good Morning'],[15600000000],5,Sản phẩm Sài k gây khô da nhưng còn về ngăn ngừa mụn thì phải sài tg dài. Hiện giờ có nhieu
['Low pH Good Morning'],[16100000000],5,Shop ship nhanh hết hồn. Đóng gói chắc chắn. Hàng auth ❤️❤️❤️❤️
['Low pH Good Morning'],[15600000000],5,"Hàng chuẩn ok neeee
Giao hàng siêu nhanh, ở khác tỉnh mà trưa đặt chiều hôm sau có rồi
< Mà có điều srm này khô da lắm huhu, dành cho da dầu thuiii >"
['Low pH Good Morning'],[18500000000],5,"Mua ở đây giao rất nhanh nên mình rất thích đặt ở đây. Lần này mua lần thứ 3 rồi
"
['Low pH Good Morning'],[16100000000],5,"Shop bán giá rất ổn , giao nhanh , đóng gói gọn gàng lại có thêm quà tặng nữa hihihi có dịp sẽ ủng hộ "
['Low pH Good Morning'],[15600000000],5,"Sữa rửa mặt thơm mùi tràm trà, chai to cầm thích lắm :3 sử dụng thấy mặt sạch hơn và ko gây quá khô da "
['Low pH Good Morning'],[17500000000],5,Sản phẩm không có hộp không thấy date. Mùi tràm trà nặng và nồng . Ít bọt . 
['Low pH Good Morning'],[15600000000],5,"Hàng ok giao cực kì nhanh lun k tin đc 
Chất lượng sale mua thì giảm gần 30k quá đã ❤"
['Low pH Good Morning'],[16100000000],5,Chất lượng sản phẩm tuyệt vời shop tư vấn chu đáo sẽ mua lạiiiiii
['Low pH Good Morning'],[15600000000],5,"Mình mới đặt hàng giao siêu nhanh luôn, srm thì khá giống chai cũ mình mua, thấy ưng nên mua lại, check mã vạch thì ra đc luôn nha"
['Low pH Good Morning'],[18500000000],5,Nhận đc hàng nhanhdudjdgkzgkxkgzkggxgkdgkxlhdlydlgxkgxhxlhxlhxglxlhdhlflhflhxhlxhdmgsmgskgghdkgxhxkxkgxzfkxg
['Low pH Good Morning'],[16100000000],5,Giao hàng nhanh gói hàng cẩn thận chất lượng mới sài lần đầu nên chưa biết
['Low pH Good Morning'],[17900000000],5,đã nhận đươc hàng rồi shop gói cẩn thận lắm . ..... sẽ ủng hộ shop lần sau 
['Low pH Good Morning'],[17900000000],5,"Giao hàng nhanh, đóng gói kỹ. Mua hàng đây đc 3 lần rồi. Giá cả ổn "
['Low pH Good Morning'],[16100000000],5,Giao hàng nhanh nhân viên tư vấn siêu nhiệt tình love uuuuuuuu
['Low pH Good Morning'],[16100000000],5,"Hàng tốt nhe 
Hdhdhdhdjiejdhfhdhdhsjbdbdbejdbdbdbdbdbdb"
['Low pH Good Morning'],[13900000000],5,"Sp ok lắm giá lại rẻ hơn teenderm gel 
Chất giống của LRPSay nên mua ghhbvfvbb"
['Low pH Good Morning'],[13800000000],4,"K biết sao cơ mà mùi lọ srm này khác với lọ trước m mua , với cả rửa xong cảm giác bị căng da chứ k đk mềm như lọ trước , nên khá hoang mang"
['Low pH Good Morning'],[17900000000],5,"Sản phẩm đóng gói chắc chắn, date xa, chưa sử dụng nên chưa biết có hợp da mặt hay không."
['Low pH Good Morning'],[17900000000],5,"👍👍👍👍👍👍👍👍👍👍👍👍👍👍👍👍👍👍👍👍👍👍👍👍👍👍👍👍👍👍👍👍
Giao hàng nhanh đóng gói đẹp cảm ơn shop nhiều nhé "
['Low pH Good Morning'],[17900000000],5,"Check mã code hàng chuẩn , giá phải chăng , giao nhanh cực kì 😊😊"
