variations,price,rating_star,comment
['Low pH Good Morning'],[18500000000],5,"Đã check ra hàng auth. Giao hàng nhanh, gói cẩn thận. Sẽ ủng hộ nữaa
"
['Low pH Good Morning'],[14800000000],5,"Mua ngày 05/05 màk ngày hôm sau đã nhận được hàng. Sản phẩm còn nguyên seal, check được mã hàng. Lần đầu mua của shop. Mua được giá flashsale nên được giá tốt. Được tặng một miếng mặt nạ. "
['Low pH Good Morning'],[14800000000],5,"Mình đã mua gất gất nhiều lần cho mình và frs của mình , quá ngon các bạn ạ 😂😂😗😗😗"
['Low pH Good Morning'],[14800000000],5,Vid và hình ảnh kh liên quan lắm . Mình đặt giùm nên cũng kh biết như nào mn ạ 😀
['Low pH Good Morning'],[17900000000],5,"Đã nhận được hàng vầ rất ương ý 
Chưa sử dụng nên k biết hiệu quả k nhưng shop đóng gói cẩn thận và còn tặp thêm quà là 1 mặt nạ 
"
['Low pH Good Morning'],[17900000000],5,"Xài cũng ổn, đóng gói sản phẩm kỹ càng và chắc chắn, chắc do mình ở xa shop nên thời gian nhận hàng khá lâu tí ạ."
['Low pH Good Morning'],[17900000000],5,"lần đầu mịn dùng sm này, nhưng thấy ổn, có mùi trà tràm hơi nồng, rửa thấy mịn mặt. ukiiila"
['Low pH Good Morning'],[16900000000],5,Vkựdksosjshxixsjscjjxsskslslsnxkzosjxnxhdksksjdjdjdjchjvjhvhvvhvvvhvjjvvjvjvvjvjjvkskdjcjxkksksjwejfjghgktkfjchsakkakxncjdkd
['Low pH Good Morning'],[14800000000],5,Giao hàng nhanh chóng đóng gói chắc chắn .đánh giá mang tính chất nhận xu vì mới chuyển sang loại này 
['Low pH Good Morning'],[16900000000],5,"Sp được đóng gói kỹ, mùi hương mình không thích lắm vì nồng mùi tràm trà, tạo bọt ổn, sạch, da mình hh thiên dầu dùng sp cho cả sáng tối."
['Low pH Good Morning'],[14800000000],5,ok hi vọng ko phải hàng nhái
['Low pH Good Morning'],[16900000000],5,"Giao hàng hơi lâu xíu nhưng mà shop dễ thương lắm ạ, sữa rửa mặt thì to, rẻ còn được tặng thêm mặt nạ nữa. Siêu iu 💌"
['Low pH Good Morning'],[14800000000],5,"Sản phẩm rất đẹp. Chất lượng tốt. Sẽ ủng hộ shop lâu dài. Shop tư vấn rất nhiệt tình.............,.,,,,.............."
['Low pH Good Morning'],[17500000000],5,"Sản phẩm tốt. Shop giao hàng nhanh . Đóng gói cẩn thận. Hợp với bạn nào đang treatment vì loại này ko bọt , dịu nhẹ"
['Low pH Good Morning'],[14800000000],5,"to go or make progress at the same rate as (others) : to stay even with (others) in a race, competition, etc"
['Low pH Good Morning'],[14800000000],5,"""Em là cô gái bán online
Chỉ mong tương tác để bài không trôi
Ai mà có thấy em rồi
Chào em một tiếng xong rồi hãy đi"""
['Low pH Good Morning'],[16900000000],5,Cũng xem review đánh giá nên mới yên tâm đặt hàng. Sản phẩm đóng gói kĩ lại đc shop tặng cho mặt nạ thì thấy shop rất có tâm luon á. Hàng chuẩn nha mình có ngửi mùi và test thử thấy giống lọ cũ của mình. Mong shop sẽ luon bán có tâm như này để khách hàng như mình có thể yên tâm.
['Low pH Good Morning'],[17900000000],5,"Shop giao hàng thần tốc, mua lần 2 r nên tin tưởng shop. Gói hàng cẩn thận còn dc tặng quà nho nhỏ. "
['Low pH Good Morning'],[14800000000],5,shop giao hàng nhanh. bao gói kĩ càng. sp thật sự là chân ái. Mọi người nên mua dùng và cảm nhận 
['Low pH Good Morning'],[16900000000],5,Sorry shop mình lười chụp ảnh sản phẩm quá àaa nhưng mà sản phẩm ok nhoaaaa hihi love you 💕😙
['Low pH Good Morning'],[16900000000],5,"Hình ảnh chỉ mang tính chất minh hoạ để nhận xu kkk
Lần đầu sử dụng loại này nên ko biết review sao, nhưng thấy mùi hơi kì kì"
['Low pH Good Morning'],[16900000000],5,"Đọc đánh giá đặt phát 2 lọ lunnnnnnn
Kb là real không nma thấy shop dễ thương, tặng mask, thư cảm ơn....bla bla
Dkdjdkdkskskskdkdkdkkdkdjdkskskskskskskksksksksksksks"
['Low pH Good Morning'],[17900000000],5,"Ít bọt, dịu nhẹ, lành tính, không làm khô da. Dùng tuýp thứ 3, thứ 4 gì đó roàiiii"
['Low pH Good Morning'],[16900000000],5,Shop giao hàng nhanh và đóng gói cẩn thận. Chưa sử dụng nên chưa bk chất lượng như thế nào sẽ quay lại đánh giá sau. Hình ảnh chỉ mang tính chất nhận xu kkkk
['Low pH Good Morning'],[17500000000],5,"Da mình hhtd dài thấy ổn, không bị cảm giác căng kít sau khi rửa, nói chung là loại này xài cho da dầu thì kiềm dầu ok nha. Hình ảnh vs clip chỉ để mình nhận xu thui nha "
['Low pH Good Morning'],[14800000000],5,Giao hành nhanh hàng khá là đẹp đóng gói rất là kĩ càng. Nếu có dịp sẽ ghé mua
['Low pH Good Morning'],[17500000000],5,"Mua rất nhiều lần sp này rồi, loại này lành tính, rất thơm mùi tràm trà nhé"
['Low pH Good Morning'],[16900000000],5,Đã mua 1 lần xài rất thích ạ. Da mình là da dầu nhé. Giờ mua thêm sử dụng
['Low pH Good Morning'],[17500000000],5,"Hủkebekepkwnw ievsjeibwnwnwe vdihevejwigsieie jbd shwoenbe
"
['Low pH Good Morning'],[16800000000],5,"Giao hàng nhanh , đóng gói cẩn thận , sản phẩm chất lượng check ra code"
['Low pH Good Morning'],[17900000000],5,"Shop giao hàng xiu nhanh và xiu cẩn thận luôn, còn có hàng tặng kèm nữa "
['Low pH Good Morning'],[14800000000],5,"Giao hàng khá nhanh, mua lúc sale nên giá ưu đãi.Giao hàng khá nhanh, mua lúc sale nên giá ưu đãi."
['Low pH Good Morning'],[14800000000],5,"Chất lượng sản phẩm tốt,, chính hãng, săn được giá rẻ, sẽ quay lại lần sau"
['Low pH Good Morning'],[14800000000],5,Ch sài thử mà tahys giả rẻ k bk auth k 🤨🤨🤨🤦‍♀️🤨🤨🤨🤨🤨😭🤨🤨🤨🤨🤨🤨🤨🤨🤨🤨🤨🤨🤨🤨🤨🤨🤨
['Low pH Good Morning'],[16900000000],5,"Giao hàng nhanh, đóng gói cẩn thận. Hàng date mới, sản phẩm như mô tả"
['Low pH Good Morning'],[14800000000],5,đóng gỏi cẩn thận lắm ạ! anh shiper cũng dễ thương 5 sao cho shop ạ
['Low pH Good Morning'],[14800000000],5,"sp giao khá nhanh, dùng rất thích, săn sale dc giá rẻ quá tr nên siêu yêu ạa, đáng mua nha mn (vid mang tc nhận xu)"
['Low pH Good Morning'],[17900000000],5,"Đói gói sp chắc chắn
Chất lượng thì chưa sd nên k đanhs giá được"
['Low pH Good Morning'],[14800000000],5,"Giao hàng nhanh, đúng số lượng và sản phẩm 
Okkkkkkkkkkkkkkkkkkk"
['Low pH Good Morning'],[17900000000],5,Tuyet voi huhuhuhuhuhhuhhhhhhujjjuhubuhuhjhuhujjbububhjububjjjjmbdgjbdkktfhjvkvdfhbvcfjnbvnkkjb
['Low pH Good Morning'],[17900000000],5,"Hàng được gói rất kĩ, bao bọc còn y nguyên luôn. Srm có mùi thơm dịu nhẹ còn chất lượng thì chưa thử nên hong biết review saooo 🤭"
['Low pH Good Morning'],[17900000000],5,Thấy review loại này quá trời. Mua dùng thử mong là hiệu quả. Shop đóng hàng rất cẩn thận. Mỗi hàng một bọc xốp.
['Low pH Good Morning'],[16900000000],5,Hàng chính hãng. Dùng thích cực. Có hơi không quen khi dùng lần đầu. Sau rất ok nha 
['Low pH Good Morning'],[17900000000],5,Sữa rửa mặt dịu nhẹ. Dùng okeeeeeeeeêhsuzh hzuzbsjzozzjbznzkzizgzvzjâk zvzhzjangab
['Low pH Good Morning'],[16900000000],5,Mua shop n lần rồi sp ok lắm .nhưng phiên bản mới xài đc hok đây.cho shop 5*
['Low pH Good Morning'],[14800000000],5,"Giao hàng nhanh , gói hàng kĩ. Chưa sử dụng nên ko biết tác dụng ra sao "
['Low pH Good Morning'],[17900000000],5,Đặt hôm qua hôm nay có hàng luôn ạ 😍😍😍 thấy tuýp chữ đậm hơn tuýp cũ mình dùng. Nhưng nội dung giống kh biết sao chắc hãng thay đổi font chữ
['Low pH Good Morning'],[16900000000],5,Dhhhdiisoooddjhdbxjxkxxkxxjxbxnnxkdopswpjwbdnddnxmxkxxjxxjxxbxnkdkxxnxxghshsjssisisjssjssjznznznzzkzzjzjzjj
['Low pH Good Morning'],[17900000000],5,"Đóng gói đẹp và chắc chắn, shop có tặng thêm 1 mask kèm thiệp cảm ơn nữa, sữa rửa mặt thì có bọc lại cẩn thận, chất lượng dùng đã mới biết"
['Low pH Good Morning'],[18500000000],5,"Dịch nhưng mà shop giao nhanh gói kĩ, tặng kèm mặt nạ nữa xin cho shop 5*. À mà hàng thì mình chưa check auth nha mng nhưng mình tin shop ák ^^"
['Low pH Good Morning'],[16900000000],5,"Sp auth, gói hàng rất kỹ, có thẻ cảm ơn và tem riêng của shop📦 chắc sẽ gắn bó lâu dài vs shopp 🥰🥰"
['Low pH Good Morning'],[16800000000],5,"giao hàng nhanh, đủ và đúng hàng, shop đóng gói chắc chắn, chất lượng sp thì khỏi bàn"
['Low pH Good Morning'],[16900000000],5,"Giao đúng hàng, mẫu được bọc kĩ, có tặng kèm mặt nạ, shop có gửi thiệp cảm ơn rất dt. Giá thành hợp túi tiền. Chưa sử dụng nên không biết chất lượng thế nào..."
['Low pH Good Morning'],[16900000000],5,Mua lần 2 dùng srm rất ưng . Giao hàng nhanh . Giá hợp lý còn có khuyến mãi giảm giá nữa . Thích cực kì 
['Low pH Good Morning'],[17900000000],4,"thắc mắc chút xíu là sao chữ đằng sau lúc to lúc nhỏ thế nhỉ 🥶 như how to use và ingredients í, size khác nhau hẳn. ai biết k ạ?"
['Low pH Good Morning'],[14800000000],5,"Giao hàng nhanh, đặt tối hôm trước là chiều hôm sau đã có. Đóng gói hàng đẹp, kèm thư cảm ơn"
['Low pH Good Morning'],[17900000000],5,"Giao nhanh đóng gói kĩ chưa xài nên chưa biết chất lượng sao ạ. Sử dụng ok mình sẽ đặt tiếp. Shop dễ thương, có tặng một mặt nạ nữa. 🥰"
['Low pH Good Morning'],[16900000000],5,Gái hsbc việt đi làm về rồi em ơi anh em đi học rồi em ơi anh em đi học về chưa có mà k đc k có gì đâu anh
['Low pH Good Morning'],[17900000000],5,"Giao hàng nhanh
Đóng gói cận thận
Gel trong, mùi giống dầu tràm- bạc hà
Mua giảm giá còn 179k đc tặng 1 mặt nạ
Coi review thấy sp xài hợp với da của mình nên order thử.
K biết kết quả ra sao"
['Low pH Good Morning'],[14800000000],5,"Giao hàng nhanh hơn dự kiến
Chưa sử dụng sản phẩm ko biết chất lượng thế nào. Đóng gói kỹ cho shop 5 sao "
['Low pH Good Morning'],[17500000000],5,"Mình dùng hình ảnh và video minh họa. Vì lúc nhận quên chụp. Mình mua lần này là lần thứ 3 rồi, sản phẩm chính hãng, shop tư vấn nhiệt tình, giao hàng nhanh. Mọi người nên mua nha"
['Low pH Good Morning'],[17900000000],5,"Giao nhanh, đóng gói cẩn thận, kỹ lưỡng, chất lượng tốt, hài lòng"
['Low pH Good Morning'],[18500000000],5,Giao hàng nhanh. Đóng gói kỹ. Mong là hàng auth. Đc tặng thêm cái mặt nạ 
['Low pH Good Morning'],[16900000000],5,J chứ thấy có tem và thankyou là chứ 5* đã.. sp thì chưa bao h sd. Nhưng thấy shop bán hàng chuẩn.  Hi vọng sẽ tốt và ủng hộ shop nhiệt tình hơn
['Low pH Good Morning'],[16900000000],5,"Đóng gói sản phẩm kỹ càng, chắc chắn.sản phẩm ok, tốt,shop có tặng kèm mặt nạ."
['Low pH Good Morning'],[16900000000],5,Giá thì quá ok mà còn được tặng thêm mặt nạ nữa. Ưng shop thiệt. Nếu xài hợp da thì lần sau sẽ tiếp tục ủng hộ ❤
['Low pH Good Morning'],[17900000000],5,"Giao hàng nhanh. Hàng chất lượng, date lâu. Đóng gói kĩ càng!!"
['Low pH Good Morning'],[16900000000],5,Hàng ok quá trời ship nhanh rồi còn được mask siu ok lắm lun
['Low pH Good Morning'],[17900000000],5,"Giao hàng nhanh, sửa sạch mà lại không bị khô da. Dùng rất thích"
['Low pH Good Morning'],[17900000000],5,"Giao hàng rất nhanh, còn được tặng thêm mặt nạ nữa
 :33.................♡♡♡♡♡♡♡♡♡♡♡♡♡♡♡♡♡♡♡♡♡♡♡♡♡♡♡♡♡♡♡♡♡♡(◍•ᴗ•◍)🥰🥰🥰🥰🥰"
['Low pH Good Morning'],[17900000000],5,"Thấy mọi người bảo xài tốt rửa mặt nhẹ nên mình cũng thử xài 
Thấy oki êm "
['Low pH Good Morning'],[17900000000],5,Nhận được hàng rồi hàng giao nhanh ok lắm bữa mình cũng mới mua chai cái này hai chai này mình mới mua cho cô ba
['Low pH Good Morning'],[18500000000],5,"ảnh lấy xu thui nhma srm ok lắmmm luôn
mình mua lần thứ 3 ở đâu rồi
mọi khau đều siu nhanhhh bất ngờ

"
['Low pH Good Morning'],[16900000000],5,Mình nhận được hàng nhanh. Đóng gói chắc chắn. Không đổ hay móp méo gì hàng cả. 
['Low pH Good Morning'],[14800000000],5,Đóng gói chắc chăns hàng oke đang cách ly mà shipper gọi lấy hàng khổ vc :(( 
['Low pH Good Morning'],[16900000000],5,"Shopee giao hàng nhanh, đóng gói cẩn thận ~ shop còn tặng thêm 1 sấp mặt nạ nữa sẽ tiếp tục mua hàng ở shop nữa nè
Còn sản phẩm m ch sài nên Ch đánh giá đc"
['Low pH Good Morning'],[17900000000],5,"Sản phẩm đóng gói cẩn thận, có mùi tràm trà , sai lên da không bị khô mà vẫn giữ được độ ẩm nhẹ. Sài củng okee. Để sài đc 1 tg rồi sẽ quay lại đánh giá tiếp"
['Low pH Good Morning'],[16900000000],5,"Giao hàng nhanh, chưaaa sử dụng nên không biết. Shop gói hàng đẹp, có quà tặng and giá tốt."
['Low pH Good Morning'],[16800000000],5,"giao nhanh, chai này to xài cũng được lâu, nói chung là tốt, 5 sao"
['Low pH Good Morning'],[17900000000],5,"giao hàng nhanh, đóng gói kĩ, xài ngày đầu thì thấy dịu nhẹ không rít mặt mà mình không được thích mùi của nó :(("
['Low pH Good Morning'],[14800000000],5,Thực ra thì mình mua xog mình dùng thử ngay rồi nó bị đỏ hết mặt ko biết chuyển từ la roche-posay sang cái này làm mình đỏ mặt lên ko biết có bị j ko nữa. Hình ảnh do lười chụp
['Low pH Good Morning'],[17500000000],5,"Shop giao hàng nhanh,sản phẩm dùng ok,sẽ quay lại mua tiếp sau khi dùng hết chai này"
['Low pH Good Morning'],[16900000000],5,Shop đóng gói chắc chắn còn bọc thêm 1 lớp bảo vệ sản phẩm được tặng kèm 1 miếng mặt nạ ngoài ra shop còn chu đáo gửi thiệp cảm ơn
['Low pH Good Morning'],[16900000000],5,"ok mua lần 2 rồi, giao hàng nhanh mình sẽ ủng hộ shop dài dài nha "
['Low pH Good Morning'],[18500000000],5,"Giao hàng nhanh, sản phẩm oke, được shop tặng thêm 1 mặt nạ làm quà nữa "
['Low pH Good Morning'],[17900000000],5,"giao hàng nhanh lắm chỉ 2 ngày thôi nè
luôn được tặng kèm mask cảm ơn shop
"
['Low pH Good Morning'],[16900000000],5,"Sp giao tầm 1 2 ngày là có 
Còn chất lượng sp như nào thì em chưa sd nên chưa biết ạ."
['Low pH Good Morning'],[16900000000],5,"Shop giao hàng nhanh , mới đặt hôm qua nay đã có rồi . Còn được tặng kèm mask nữa =)) xịn xịn 
"
['Low pH Good Morning'],[17500000000],5,"Mới đặt hồi sáng nhưng chiều đã nhận được hàng. Ưng ý lắm luôn, shop gói chắc chắn và kèm theo lời cảm ơn nữa. Mua lần đầu khá là hài lòng nên sẽ ủng hộ thêm những lần tới 👍👍"
['Low pH Good Morning'],[16900000000],5,"Sản phẩm đóng gói kĩ, giao hàng nhanh. Srm này xài tốt lắm nha mn "
['Low pH Good Morning'],[17900000000],5,"Hàng giao nhanh, đóng gói chắc, chất lượng thấy được còn đc tặng sample"
['Low pH Good Morning'],[16900000000],5,Mua lần thứ 2 tại shop. Sản phẩm ok ạ.......................
['Low pH Good Morning'],[17900000000],5,Da dầu mụn nhạy cảm nên mua dùng thử :(( mong là k bị kích ứng nữa :((
['Low pH Good Morning'],[16900000000],5,Zxjwjhfnaksjhsj haìhajnfjdjjd hạchkwsjhdhshs hdjsbbdhdjdbdb
['Low pH Good Morning'],[17500000000],5,"Giao hàng nhanh
Sản phẩm dùng tốt
Giá hợp lý
Sẽ ủng hộ shop tiếp "
['Low pH Good Morning'],[16900000000],5,"Spham xịn lắm, realll nha mng, nên mua nhaaaaa, date còn xaaa nữa á chất lượng cực"
['Low pH Good Morning'],[16900000000],5,Jsjdndjxjsksksksjxjcnxskxjxnxjdjxhhddhxjdjvuvubuubfndbu ìidcjcjcujvjvvjjvjvicicjc
['Low pH Good Morning'],[17500000000],5,"Đóng gói cẩn thận, giao hàng nhanh,được tăng kèm mặt nạ,sữa rửa mặt khá ổn.."
['Low pH Good Morning'],[16900000000],5,"Vbbvvvhbbbbhhbbgfvbnkjhhbbhjjjjjjjjjjjjjjjjjjjjj
Jk"
['Low pH Good Morning'],[17900000000],5,"Rửa mặt có mùi tràm trà thơm. Dịu nhẹ, sạch sâu. Sẽ mua lại "
['Low pH Good Morning'],[17900000000],5,Hình ảnh chỉ mang tính chất nhận xu. Xài ok lắm nè 😄😄😂😇😍😍😂😍😁😍😔
['Low pH Good Morning'],[16900000000],5,"Tuyệt vời
Uy tín
Chất lượng 
Đáng mua lại 
Đóng gói cản thận 👍👍👍👍"
['Low pH Good Morning'],[16900000000],5,Jjfthhggbjjjdrtukvffgghmiyfvvnjjjkredvvbbkjjjjjjjj
['Low pH Good Morning'],[17900000000],5,"đóng gói sản phẩm chắc chắnn, thời gian giao hàng nhanhhhhhh"
['Low pH Good Morning'],[17500000000],5,"hàng đẹp, có mùi tràm trà nhẹ, sài ok sẽ mua ủng hộ tiếp 👍🏻"
['Low pH Good Morning'],[17900000000],5,Mùi hơi hắc hắc mọit chút chắc do chưa quen! Nhưng dùng khá vừa ý mình! Cảm ơn shop
['Low pH Good Morning'],[16900000000],5,"Đóng gói cẩn thận , sữa mặt mua lần 2 rồi, còn 2 lọ serum thấy còn hơi hoang mang"
['Low pH Good Morning'],[17900000000],5,Hình ảnh video mang tính chất nhận xu. Nhma srm xài tạm ổn !!!!
['Low pH Good Morning'],[14800000000],5,Đóng gói rất cẩn thận.... hơi lâu chút. Shop ở quận 7 nhưng giao tân bình mất 2 ngày 🥲 
['Low pH Good Morning'],[17900000000],5,"Shop giao hàng nhanh, đóng gói cẩn thận, chưa dùng nên chưa biết sản phẩm thế nào😀😀😀😀😀"
['Low pH Good Morning'],[18500000000],5,Hàng oke chất lượng thấy ổn lười quay lên lấy tạm video 😍😍😍😍😍😍😍😍😍😍😍😍😍😍😍😍😍😍😍😍😍😍😍😍😍😍😍😍😍😍😍😍😍😍😍😍😍😍😍😍😍😍😍😍😍😍😍😍😍😍😍😍😍😍😍😍😍😍😍😍😍😍😍😍😍😍😍😍😍😍😍😍😍😍😍😍😍😍😍😍😍😍😍😍😍😍
['Low pH Good Morning'],[17900000000],5,"Giao hàng nhanh, nhiệt tình. Mua sữa rửa mặt đc tặng mặt nạ. Vừa thoa lên mặt có mùi hơi hắc nhưng đc mấy giây là hết mùi. Sp okela ạ❤️❤️"
['Low pH Good Morning'],[17900000000],5,"Sản phẩm ok, shop trả lời thắc mắc nhiệt tình iebdhjemxiekdbhej"
['Low pH Good Morning'],[17900000000],5,Gói ở ngoài hơi bị đẹppppppp. Chất lượng thì cũng okkkkkkkkk
['Low pH Good Morning'],[18500000000],5,"Giao hàng trong 1 ngày luôn, mua lần 2 rồi sài rất rất tốt 😁♥️♥️♥️♥️♥️"
['Low pH Good Morning'],[17900000000],5,mk thấy giống lọ cũ của mình mùi tràm trà k nồng lắm đâu    fcccccc
['Low pH Good Morning'],[17900000000],5,Mình da dầu mụn sử dụng rất ổn nha mọi ng. Sau khi dùng da không bị khô quá mà vẫn còn ẩm nhẹ. Bôi kem dưỡng nữa là tuyệt vời
['Low pH Good Morning'],[16900000000],5,Ổn nè ...nhưng để sử dụng lâu mới biết kết quả......
['Low pH Good Morning'],[17900000000],5,"video và hình ko liên quan, nhưng "
['Low pH Good Morning'],[16900000000],5,"Yunkei chưa bao h làm mình thất vọng 🥺
mình mua chai này lần 2 rồi xài rất uci luôn♥️"
['Low pH Good Morning'],[17900000000],5,Sửa rửa mặt sài oke chất lượng tuyệt giao hàng nhanh sài ko bị kích ứng
['Low pH Good Morning'],[14800000000],5,Uhfuhvvfjvxsdibbji
['Low pH Good Morning'],[17900000000],5,Đã nhận hàng còn được tặng miếng đắp mặt nạ . Và có thư cảm ơn . Cảm ơn shop 😊😊😊
['Low pH Good Morning'],[17900000000],5,Thích xài e rửa mặt này nhấtv nhahhhhhg
['Low pH Good Morning'],[18500000000],5,Hàng đẹp lắmmmmmmmm luônnnnnnnnnnnnnnnnnnn áaaaaaaaaaaaaaaaaaaaaaaaaaaaaaaaaaaaaaaaaaaaaaaaaaaaaaaaaaa
['Low pH Good Morning'],[16900000000],5,Bánksbsgiabsmsisbscaisns sosjvsmspsbsmxlxnnxjsbskdkd
['Low pH Good Morning'],[17900000000],5,"Hàng xịn có mùi tràm thơm, chai sữa rửa mặt lớn, giao hàng khá nhanh ..."
['Low pH Good Morning'],[16900000000],5,đóng gói cẩn thận .nhìn có vẻ ổn nhưng dùng ms biết được chất lượng ra sao .nếu ổn sẽ ủng hộ tiếp
['Low pH Good Morning'],[16900000000],5,❤❤❤❤❤❤❤❤❤❤❤❤❤❤❤❤❤❤❤❤❤❤❤❤❤❤❤❤❤❤❤❤❤❤❤❤❤❤❤❤❤❤❤❤❤❤❤❤❤❤❤❤
['Low pH Good Morning'],[16900000000],5,Shop đóng gói cẩn thận còn được tặng thêm mask nên khá ưnggggg
['Low pH Good Morning'],[17900000000],5,Mình nhận được hàng còn được tặng kèm 1 mặt nạ nha 
['Low pH Good Morning'],[17900000000],5,Giao hàng nhanh. Mới đặt chiều hôm trước sáng bữa sau đã có hàng.
['Low pH Good Morning'],[17900000000],5,Mình không chắc liệu có phải hàng real hay không nhưng thấy mùi hơi kì
['Low pH Good Morning'],[17900000000],5,Đỉnkk lắm mình dùng này lâu r :3 check dc mã vạch luôn á nên k lo nha 
['Low pH Good Morning'],[17900000000],5,Mới nhận được hàng hồi trưa khá là ok còn được tặng cái mặt nạ thích ghê hihi
['Low pH Good Morning'],[16900000000],5,Đóng gói ok. Hy vọng mua đúng hàng chính hãng 😂 hihahohihahohihaho
['Low pH Good Morning'],[17900000000],5,"Shop gói hàng cẩnn thận, chu đáo nhiệt tình, còn có thư cảm ơn.. "
['Low pH Good Morning'],[17900000000],5,Cbij và Giao hàng nhah .cách gói hàng rất ưng ý ạ ..............
['Low pH Good Morning'],[16900000000],5,"hàng auth, giao hàng nhanh, được tặng thêm mặt nạ, rất okkkkk"
['Low pH Good Morning'],[17900000000],5,Đóng gói sản phẩm okkkkkkkkkkkkkkkkkkkkkkkkkkkkkkkkkkkk
['Low pH Good Morning'],[17500000000],5,Sửa rửa mặt sài thích lắm. Tuýp to dùng xong da mặt khác hẳn. Nói chung rất đáng tiền nhaaaaaaaaaaaaaaaaaaaaaaaaaaaaaa
['Low pH Good Morning'],[17900000000],5,"Sản phẩm giống như hình , shop còn tặng mình mặt nạ nữa . Sẽ ủng hộ lần sau, hình ảnh và video k liên quan xíu ạ 😅😅😅"
['Low pH Good Morning'],[17900000000],5,thơm ạ
['Low pH Good Morning'],[17900000000],5,Đóng gói hàng kỹ.
['Low pH Good Morning'],[17900000000],5,
['Low pH Good Morning'],[16900000000],5,
['Low pH Good Morning'],[17900000000],5,"Giao hàng nhanh cực, đóng gói kĩ. Hàng ok nha"
['Low pH Good Morning'],[17900000000],5,Giao hàng nhanh
['Low pH Good Morning'],[14000000000],5,Dùng oke rửa xong độ ẩm vẫn ổn nhưbg lần đầu dung mùi khá nồng và bị đỏ mụn 
['Low pH Good Morning'],[17900000000],5,"Mua 1 đôi cho mình và ny dùng luôn. Mùi hơi nồng khi mới mở nắp, nhưng sau sẽ k nồng như vậy nữa. Mà mình bị thích mùi tràm trà nên thích ngửi mùi này. Gel xoa dễ tan, còn hàng fake mùi sẽ như thuốc kháng sinh và xoa thì khó tan, còn hơi đông như thạch."
['Low pH Good Morning'],[17500000000],5,"Srm thơm mùi tràm trà thích lắm nha, mà lâu tạo bọt quá phải massage hơi nhiều. Hy vọng ko kích ứng gì cho cái mặt của mình"
['Low pH Good Morning'],[17500000000],5,"Giao hàng khá là nhanh đó nha, nhận được hàng thì siu chim ưng luôn. Có mùi khá là dễ chịu xài đã cực lun hihii.! Sẽ ủng hộ shop 🥰
Mọi người nên mua nha 🥰❤️"
['Low pH Good Morning'],[17500000000],5,Hàng xài ok nhéeeeeeeeeeeeeeeeeeeeeeeeeeeeeeeeeeeeeeeeeeeeem
['Low pH Good Morning'],[17900000000],5,Hàng chính hãng. Sẽ ủng hộ shop ❤️❤️❤️❤️❤️❤️❤️❤️❤️❤️ còn kcn check k dc được ạ
['Low pH Good Morning'],[14000000000],5,Chất lượng bình thường hgf giao nhanh gói hàng cẩn thận sale rẻ   
['Low pH Good Morning'],[16500000000],5,"Sữa rữa mặt sài ok, thơm mùi tràm, không tạo quá nhiều bọt....."
['Low pH Good Morning'],[17900000000],5,"Đóng gói cẩn thận, mong hàng chính hãnh...................."
['Low pH Good Morning'],[17900000000],5,"Lần đầu tiên mua sản phẩm này của shop, chưa dùng nên chưa biết. Sẽ quay lại đánh giá sau"
['Low pH Good Morning'],[17900000000],5,"Shop đóg gói sản phẩm cẩn thận, shop còn tặg thêm 1 mặt nạ nữa, thz shop nha"
['Low pH Good Morning'],[14000000000],5,"Ảnh với vid để lấy xu thoi ạ, giao hàng nhanh, hàng auth nên yên tâm như hình ạ"
['Low pH Good Morning'],[14000000000],5,"Chỉ mang tính chất lấy xu,Shop giao hàng nhanh đúng sản phẩm date xa hạn sử dụng còn xa đóng gói kỹ"
['Low pH Good Morning'],[15200000000],5,10 điểmmmmmmmmmmm điểmmmmmmmmmmm điểmmmmmmmmmmmđiểmmmmmmmmmmm
['Low pH Good Morning'],[17900000000],5,"Sữa rửa mặt hơi khô
Tuy là da dầu nhưng kiểu gì ấy
Cứ thấy da căng căng
Hàng chính hãng "
