name,variations,price,rating_star,comment
PINKYPINKY - Mặt nạ cấp nước Hydrating Collagen Protein,[''],[650000000],5,"Mmnnbvvskjsvbnjkkqvhjke
Bwhjsjvss
Bsbjsjwkjwbwnjs
Hsjjshvshsjskks
Bshjsksjjssbvsjsjw
Mmnnbvvskjsvbnjkkqvhjke
Bwhjsjvss
Bsbjsjwkjwbwnjs
Hsjjshvshsjskks
Bshjsksjjssbvsjsjw
Mmnnbvvskjsvbnjkkqvhjke
Bwhjsjvss
Bsbjsjwkjwbwnjs
Hsjjshvshsjskks
Bshjsksjjssbvsjsjw
Mmnnbvvskjsvbnjkkqvhjke
Bwhjsjvss
Bsbjsjwkjwb"
PINKYPINKY - Mặt nạ cấp nước Hydrating Collagen Protein,[''],[650000000],5,Sản phẩm ok giá rẻ chất lượng sp ok giao hàng nhanh đóng gói chắc chắn sẽ ủng hộ shop nhiều mình mua 17 món mà k đc chung 1 đơn tiếc ghê
PINKYPINKY - Mặt nạ cấp nước Hydrating Collagen Protein,[''],[650000000],5,Âmkakans snak a a janbwkakw kạbwnskw
PINKYPINKY - Mặt nạ cấp nước Hydrating Collagen Protein,[''],[650000000],5,"Giao hàng chậm lắm luôn, đặt sáng hôm 6/6 mà đến tận 12/6 trong nội thành HN mới nhận đc! Chưa dùng nên chưa biết chất lượng ntn! "
PINKYPINKY - Mặt nạ cấp nước Hydrating Collagen Protein,[''],[650000000],5,"mặt nạ bao bì xinh, dùng đc không kích ứng lắm. thấy dễ thương, mua nhiều lần rồi rất dễ dùng, cấp ẩm oke giao cũng nhanh"
PINKYPINKY - Mặt nạ cấp nước Hydrating Collagen Protein,[''],[650000000],5,"Mình chưa xài nên cũng không biết chất lượng ntn, shop đóng gói cẩn thận
(Ảnh và video mang tính chất nhận xu)"
PINKYPINKY - Mặt nạ cấp nước Hydrating Collagen Protein,[''],[650000000],5,Mặt nạ bị nóng do vận chuyển giữa trời 40 độ nên phải cho ngay vào tủ lạnh. Shop giao hàng và đóng hàng rất ok
PINKYPINKY - Mặt nạ cấp nước Hydrating Collagen Protein,[''],[650000000],5,"Mình mua mấy loại mặt nạ để dùng thử, may là shop soạn hàng đủ. Chưa dùng hết nên sẽ review sau. "
PINKYPINKY - Mặt nạ cấp nước Hydrating Collagen Protein,[''],[650000000],5,"mặt nạ ổn đắp thấy đc , đã mua nhiều lần không thấy kích ứng gì giao cũng k lâu lắm "
PINKYPINKY - Mặt nạ cấp nước Hydrating Collagen Protein,[''],[650000000],5,"OkxjHdfjjgxccnznfmgxgmzfkzcfzgkzjeajahrzjdznfJfxkgxmvzfjzl kfzixlhczfkkgxhzfjzofzfjxkxDjzgzjfzkxlvJdDuajxkcUdfkzcjSYDĩk67xfixn,jSH,kc"
PINKYPINKY - Mặt nạ cấp nước Hydrating Collagen Protein,[''],[650000000],5,"Mặt nạ dùng ok, ko gây cảm giác bết dính. Đắp lên mặt khá dễ, vừa khuôn mặt."
PINKYPINKY - Mặt nạ cấp nước Hydrating Collagen Protein,[''],[650000000],5,"Đóng gói cẩn thận, giao đủ số lượng, lần này do mua đợt sale nên khâu chuẩn bị hàng lâu nhưng cũng thông cảm cho shop."
PINKYPINKY - Mặt nạ cấp nước Hydrating Collagen Protein,[''],[650000000],5,Mua hàng của shop nhiều lần rồi. Lần nào shop cũng giao nhanh và đủ hàng.
PINKYPINKY - Mặt nạ cấp nước Hydrating Collagen Protein,[''],[650000000],3,"Bbzjsms xkdkdnanjannfkskndnksomabsbxbxnksndvjsndbdbvbnbvb
Ggvvvvvvvvvvvghhhhnjjsjdjfbbwoddbfjdkccjdbbđbdjdjxjdjnđldonfbfkdldlewbqsxnncskkwxndbfkdkccnsksjbxndwkjdnxkxxnndelldpdjdbaoaowbfbckdekn"
PINKYPINKY - Mặt nạ cấp nước Hydrating Collagen Protein,[''],[650000000],5,"Mặt nạ dùng rất thích, thơm cực luôn nha mnggggg sẽ mua tiếpppppp"
PINKYPINKY - Mặt nạ cấp nước Hydrating Collagen Protein,[''],[650000000],5,Đóng gói hàng cẩn thận. Giao hàng nhanh. Chất lượng sản phẩm ok
PINKYPINKY - Mặt nạ cấp nước Hydrating Collagen Protein,[''],[650000000],5,"Mặt nạ này đắp mát mát nha mn. Mình mua gần nửa tháng rùi, dùng rồi mới quay lại đánh gia :)))"
PINKYPINKY - Mặt nạ cấp nước Hydrating Collagen Protein,[''],[650000000],5,"Giao hàng nhanh. Đóng hàng rất kĩ lưỡng. Nhìn mặt nạ siêu xinh luôn, phân vân mãi ko biết nên chọn loại nào để đắp trước nữa."
PINKYPINKY - Mặt nạ cấp nước Hydrating Collagen Protein,[''],[650000000],5,"Giao hàng khá nhanh, mình đặt hộ bạn nên chỉ kiểm tra xem đủ hàng hay không thôi ạ.
"
PINKYPINKY - Mặt nạ cấp nước Hydrating Collagen Protein,[''],[650000000],5,Chưa sử dụng nên không biết hiệu quả như thế nào sẽ quay lại mua thêm nếu sd ôk
PINKYPINKY - Mặt nạ cấp nước Hydrating Collagen Protein,[''],[650000000],5,"Giao hàng nhanh chóng , đóng gói kĩ càng cẩn thận,sản phẩm chất lượng "
PINKYPINKY - Mặt nạ cấp nước Hydrating Collagen Protein,[''],[650000000],5,"Chưa dùng nên không biết. Giao hàng ko nhanh lắm. 
Bdndjdjdkdsn"
PINKYPINKY - Mặt nạ cấp nước Hydrating Collagen Protein,[''],[650000000],5,"Giao đủ hàng, chưa dùng nên chưa bt chất lượng sản phẩm nhưng nên mua nha mng"
PINKYPINKY - Mặt nạ cấp nước Hydrating Collagen Protein,[''],[650000000],5,"Hàng giao nhanh, đóng gói cẩn thận. Hình ảnh mang tính chất nhận xu."
PINKYPINKY - Mặt nạ cấp nước Hydrating Collagen Protein,[''],[650000000],5,"Giao đầy đủ, đóng gói kĩ, giao hàng nhanh lắm luoonnnn
Hình ảnh chỉ mang tính chất nhận xuu"
PINKYPINKY - Mặt nạ cấp nước Hydrating Collagen Protein,[''],[650000000],5,"giao hàng hơi chậm , chất lượng tốt , đóng gói hàng cẩn thận đáng mua"
PINKYPINKY - Mặt nạ cấp nước Hydrating Collagen Protein,[''],[650000000],5,Trdyiokjgdddasdguioiuggfy jiwwiwowowi ruikcnhc ewiwiejhfjkewkwkwkwosoicci
PINKYPINKY - Mặt nạ cấp nước Hydrating Collagen Protein,[''],[650000000],5,Mua dùng thử vì sanr phẩm có nhiều lượt mua quá.................
PINKYPINKY - Mặt nạ cấp nước Hydrating Collagen Protein,[''],[650000000],5,"giá rẻ mà chất lượng thì quá xịn. Kẹp rất chắc chắn, shop nhiệt tình nữa. Sẽ ủng hộ nhiều"
PINKYPINKY - Mặt nạ cấp nước Hydrating Collagen Protein,[''],[650000000],5,Hàng giao đủ. Date xa. Shop đóng gói cực cẩn thận ý. Vận chuyển hơi lâu 1 tí. 
PINKYPINKY - Mặt nạ cấp nước Hydrating Collagen Protein,[''],[650000000],5,"Giao hàng đủ. Đóng gói chắc chắn. Mua N lần vẫn thích, vẫn rất okela"
PINKYPINKY - Mặt nạ cấp nước Hydrating Collagen Protein,[''],[650000000],5,ncklciecoecoeocrogktgtoblrclepfpwofqkcnwmcwlcalclackanccna
PINKYPINKY - Mặt nạ cấp nước Hydrating Collagen Protein,[''],[650000000],5,Mask đắp thích lắm nha mọi người❤️❤️❤️❤️❤️❤️❤️❤️❤️❤️❤️❤️❤️❤️❤️❤️
PINKYPINKY - Mặt nạ cấp nước Hydrating Collagen Protein,[''],[650000000],5,vì mình mua tặng nên không biết như nào. có dịp sẽ mua dùng thử :D
PINKYPINKY - Mặt nạ cấp nước Hydrating Collagen Protein,[''],[650000000],5,Mặt nạ dùng siêu tốt nhé giá thành rẻ 5 sao cho chất lượng okela 
PINKYPINKY - Mặt nạ cấp nước Hydrating Collagen Protein,[''],[650000000],5,"giao hàng siêu lâu 😂😂😂 cho 4.5*
sp chưa dùng nên chưa biết thế nào
ha để nhận xu do mình lười"
PINKYPINKY - Mặt nạ cấp nước Hydrating Collagen Protein,[''],[650000000],5,"Mặt nạ có bao bì đẹp, chắc chắn. Cầm rất thích tay luôn nhé. Giao hàng nhanh và đủ💯"
PINKYPINKY - Mặt nạ cấp nước Hydrating Collagen Protein,[''],[650000000],5,"Bao bì đóng gói chắc chắn, sản phẩm sử dụng rất thích. 1000 điểm "
PINKYPINKY - Mặt nạ cấp nước Hydrating Collagen Protein,[''],[650000000],5,Chưa bao giờ sử dụng mặt nạ trung nên hôm nay mua thử. Giá thành rẻ chỉ khoảng 5k/ chiếc đủ loại. Chưa sử dụng nên chưa thể oánh giá được gì
PINKYPINKY - Mặt nạ cấp nước Hydrating Collagen Protein,[''],[650000000],5,Djdjdjdjdjdjdjdkdkdkdkdkdkdkdkdkdjdjdjdjdjdjdjdijdkdjdkdjjc
PINKYPINKY - Mặt nạ cấp nước Hydrating Collagen Protein,[''],[650000000],5,Chưa dùng hết nhưng có cái hơi kích ứng nhẹ. Nói chung tạm ok lal
PINKYPINKY - Mặt nạ cấp nước Hydrating Collagen Protein,[''],[650000000],5,"Xem trí năng người máy bản Lâm Đại Ngọc, như thế nào sống ra bản thân xuất sắc nhân sinh

Thông cáo: Cùng biên tập thương lượng, đem với 10 nguyệt 3 ngày thứ sáu nhập V, khai V cùng ngày sẽ liền càng 3 chương, mỗi chương không ít với 3000 tự nga, thỉnh đại gia tiếp tục duy trì, cảm ơn ~~

Thông cáo:"
PINKYPINKY - Mặt nạ cấp nước Hydrating Collagen Protein,[''],[650000000],5,Mặt nạ loại nào dùng cũng rất okela. Giao hàng rất nhanh. Sẽ tiếp tục ủng hộ shop
PINKYPINKY - Mặt nạ cấp nước Hydrating Collagen Protein,[''],[650000000],5,Giao hàng đầy đủ. Ok nha. Đánh giá mang tính chất lý xu. Hi hi hi
PINKYPINKY - Mặt nạ cấp nước Hydrating Collagen Protein,[''],[650000000],5,"hàng nhìn rất xịn , đóng gói cẩn thận , chưa sử dụng nên chưa đánh giá đc chất lượng"
PINKYPINKY - Mặt nạ cấp nước Hydrating Collagen Protein,[''],[650000000],5,Bsakosksnd dndjdspsndbdksosskndnfnfnđbsnskslâkns s s nn
PINKYPINKY - Mặt nạ cấp nước Hydrating Collagen Protein,[''],[650000000],5,"Đã nhận được hàng ạ, shop giao đầy đủ ạ, hihihihihihihihihihihihijhihihiijihihiuiiijiiju, thanks shop nha hihihihihihihihihihihihijhihihiijihihiuiiijiiju"
PINKYPINKY - Mặt nạ cấp nước Hydrating Collagen Protein,[''],[650000000],5,Đủ hàng.chưa dùng chưa biết chất lượng. Kekndkdkckcmcdnfkkckf
PINKYPINKY - Mặt nạ cấp nước Hydrating Collagen Protein,[''],[630000000],5,"Sản phẩm rẻ và đẹp. Giao hàng nhanh đầy đủ , nên ghé shop mua nhé mn"
PINKYPINKY - Mặt nạ cấp nước Hydrating Collagen Protein,[''],[650000000],5,Chất lượng sản phẩm tuyệt vời. Giao hành nhanh nữa.
PINKYPINKY - Mặt nạ cấp nước Hydrating Collagen Protein,[''],[650000000],5,"Shop đóng gói hàng kỹ và đẹp mắt. Mua một đống mặt nạ thêm một cái ttbc môi này shop giao đủ hết. Mình đặt một set mút nhưng shop ko giao, mình đã ib shop và shop đã gửi trả tiền qua AirPay cho mình. Mong là sau này shop sẽ kiểm tra khâu đóng gói cẩn thận hơn."
PINKYPINKY - Mặt nạ cấp nước Hydrating Collagen Protein,[''],[630000000],5,Shop giao đủ hàng ạ. Nhìn bao bì xinh lắm. Hàng nội địa trung nên khá rẻ
PINKYPINKY - Mặt nạ cấp nước Hydrating Collagen Protein,[''],[650000000],5,"Hình ảnh, vid mang tính chất nhận xu thôi ạ. Ship nhanh, đóng gói ok "
PINKYPINKY - Mặt nạ cấp nước Hydrating Collagen Protein,[''],[650000000],5,"Giao hàng tạm ổn, shop giao hàng đầy đủ, đóng gói rất chắc chắn"
PINKYPINKY - Mặt nạ cấp nước Hydrating Collagen Protein,[''],[750000000],5,Chưa dùng nên chưa biết như nào nhưng 10 điểm cho vân chuyển và đóng gói hàng của shop . Cực kì ưng luôn 
PINKYPINKY - Mặt nạ cấp nước Hydrating Collagen Protein,[''],[750000000],5,"Hình thức: shop phục vụ rất tốt, đóng kĩ. Chưa dùng nên chưa biết"
PINKYPINKY - Mặt nạ cấp nước Hydrating Collagen Protein,[''],[750000000],5,"Đóng gói chuẩn, chất lượng tốt. Đây là lần t2 mình mua do mình thấy mna trung khá là tốt cũng rẻ nữa"
PINKYPINKY - Mặt nạ cấp nước Hydrating Collagen Protein,[''],[750000000],5,Giao hàng nhanh. Đúng. Đủ. Nghe review tốt nên mua thử trải nghiệm. 
PINKYPINKY - Mặt nạ cấp nước Hydrating Collagen Protein,[''],[750000000],5,Rất đáng tiền ạ . Mặt nạ cấp nước Hydrating Collgen pinky pinky
PINKYPINKY - Mặt nạ cấp nước Hydrating Collagen Protein,[''],[750000000],5,"Mặt nạ nhiều dưỡng chất, quá xứng đáng số vs giá tiền, cấp ẩm cx rất tốt sáng mai thấy da rất đủ ẩm nhé"
PINKYPINKY - Mặt nạ cấp nước Hydrating Collagen Protein,[''],[700000000],5,"Mặt nạ tốt 
Giao hàng nhanh
Đóng gói chắc chắn đẹp 
Cho shop 5 sao "
PINKYPINKY - Mặt nạ cấp nước Hydrating Collagen Protein,[''],[750000000],5,Sản phẩm như hình. Xài ok lắm. Mùi đào thơm dã man luôn á mọi người
PINKYPINKY - Mặt nạ cấp nước Hydrating Collagen Protein,[''],[700000000],5,"Mặt nạ cấp ẩm tốt, sp tốt,giá rẻ, shop chuẩn bị hàng nhanh, đủ số lượng♥️♥️♥️♥️♥️"
PINKYPINKY - Mặt nạ cấp nước Hydrating Collagen Protein,[''],[700000000],4,"Thái độ phục khách chưa tốt lăm. Để tin nhắn tự đồng thì không sao nhưng tận 2,3 ngày vẫn không thấy shop trả lời"
PINKYPINKY - Mặt nạ cấp nước Hydrating Collagen Protein,[''],[700000000],5,Chưa xài thử nên không biết như nào thấy bao bì đẹp nhìn ok 👌 aignao
PINKYPINKY - Mặt nạ cấp nước Hydrating Collagen Protein,[''],[700000000],5,"Gói nhỏ xinh, mặt nạ hơi to so với mặt mình, tinh chất nhìu có thể dùng cho cả tay, cấp ẩm tức thời oki nhưng đắp xong hơi dính mình phải rửa lại"
