name,variations,price,rating_star,comment
[CHÍNH HÃNG] Kem Body Lux Tinh Chất Yến Tươi soHERBs Siêu Trắng Da,[''],[12196900000],5,"Kem ok , chất kem lỏng , thấm mau , không bết rích . Thoa lên củng không quá trắng ảo . 😍😍😍😍😍 hình ảnh và video mang tính chất lấy xu thôi nha ❤️❤️❤️❤️❤️❤️❤️❤️❤️"
[CHÍNH HÃNG] Kem Body Lux Tinh Chất Yến Tươi soHERBs Siêu Trắng Da,[''],[12000000000],5,Mình mua tại shop nhiều lần rồi nè! Đóng gói kĩ + giao hàng nhanh + chất lượng sp tuyệt vời lun kem thấm nhanh ko bết nhiều nhưng nhìn rất tự nhiên💗shop còn tặng kèm móc khoá và cột tóc nữa!! Rất dễ thương!! 💓💓
[CHÍNH HÃNG] Kem Body Lux Tinh Chất Yến Tươi soHERBs Siêu Trắng Da,[''],[12000000000],5,"Mùi thơm, giao hàng cực nhanh, lại còn tặng dây buộc tóc nữa.. Mới test thử thấy ưng lắm luôn ó.. Thanks Shoppppp nếu trắng lần sau ủng hộ shop tiếp. "
[CHÍNH HÃNG] Kem Body Lux Tinh Chất Yến Tươi soHERBs Siêu Trắng Da,[''],[12196900000],5,Hộp thứ 2 rồiiiii ổn lắm nhé hihihihiigigiigigihihiihhiihihihihihihihihi
[CHÍNH HÃNG] Kem Body Lux Tinh Chất Yến Tươi soHERBs Siêu Trắng Da,[''],[12196900000],5,"Mua lần thứ 2.giao hàng siêu tốc luôn,mới đặt hôm qua mà nay đã có rồi."
[CHÍNH HÃNG] Kem Body Lux Tinh Chất Yến Tươi soHERBs Siêu Trắng Da,[''],[12196900000],5,
[CHÍNH HÃNG] Kem Body Lux Tinh Chất Yến Tươi soHERBs Siêu Trắng Da,[''],[12696900000],5,Gzjgskgzogxgkiydktdoyxkyditsitdiydutei y5eoux4eouspursoyrsoysia4s75sisit
[CHÍNH HÃNG] Kem Body Lux Tinh Chất Yến Tươi soHERBs Siêu Trắng Da,[''],[12696900000],5,J jc vk kg fuxtiho ti ut gi ù fu gi gi tũig igudzut utxurzticoy ut ũ
[CHÍNH HÃNG] Kem Body Lux Tinh Chất Yến Tươi soHERBs Siêu Trắng Da,[''],[12696900000],5,"Shop bao bọc hàng cẩn thận !!!
Giao hàng nhanh 💨 
Kem thơm 🤭🤭🤭🤭🤭"
[CHÍNH HÃNG] Kem Body Lux Tinh Chất Yến Tươi soHERBs Siêu Trắng Da,[''],[12190000000],5,"Kem thấm nhanh ok, 
Ủ xài bị châm chích ngay lần đầu :((. 
Để thử lại lần sau rút ngắn thời gian như chủ shop nói, "
[CHÍNH HÃNG] Kem Body Lux Tinh Chất Yến Tươi soHERBs Siêu Trắng Da,[''],[12190000000],5,Đóng gói chắc chắn. Giao hàng rất nhanh. Hũ kem nhìn đẹp. Chất kem dễ tán ko bết rít nhưng mùi kem với mình thì thấy nồng. Nhưng bôi 1 lúc thì cũng nhanh bay bớt mùi nên cũng ok
[CHÍNH HÃNG] Kem Body Lux Tinh Chất Yến Tươi soHERBs Siêu Trắng Da,[''],[12699700000],5,"Giao hàng nhanh so với dự kiến, sp dùng mát không nhờn, rất dễ chịu, nếu có hịu quả sẽ ủng hộ shop dài dài 👍"
[CHÍNH HÃNG] Kem Body Lux Tinh Chất Yến Tươi soHERBs Siêu Trắng Da,[''],[12696900000],5,Mua lần thứ 4 roài hiccc :)) mê quá
[CHÍNH HÃNG] Kem Body Lux Tinh Chất Yến Tươi soHERBs Siêu Trắng Da,[''],[12699700000],5,Tốt
[CHÍNH HÃNG] Kem Body Lux Tinh Chất Yến Tươi soHERBs Siêu Trắng Da,[''],[12699700000],5,"Kem mới dùng đc 2 ngày, cảm nhận sau khi dùng là kem thấm nhanh, ko bị nhờn dính, nhưng mình ko thích cái mùi của nó, hơi khó chịu ... hình ảnh klq mang tính chất nhận xu "
[CHÍNH HÃNG] Kem Body Lux Tinh Chất Yến Tươi soHERBs Siêu Trắng Da,[''],[12699700000],5,"Hình ảnh và video chỉ mang tính chất minh họa 
Giao hàng nhanh. Sp oke 
Mùi cũng dễ chịu 
Nói chung là sp oke mn nên mua dùng "
[CHÍNH HÃNG] Kem Body Lux Tinh Chất Yến Tươi soHERBs Siêu Trắng Da,[''],[12699700000],5,"Giao nhanh, sản phẩm tốt, kem mịn, được tặng quà dễ thương nữa,...sau sẽ ủng họ shop thêm"
[CHÍNH HÃNG] Kem Body Lux Tinh Chất Yến Tươi soHERBs Siêu Trắng Da,[''],[12699700000],5,Kem oke lắm mọi người ơi chưa thử nên cũng kh biết trắng không nếu được sẽ ủng hộ dài dài ❤️❤️
[CHÍNH HÃNG] Kem Body Lux Tinh Chất Yến Tươi soHERBs Siêu Trắng Da,[''],[12699700000],4,"Kem k bết nhưng hơi lỏng , bôi k thâyd bật tone màu lên , cho shop 4*"
[CHÍNH HÃNG] Kem Body Lux Tinh Chất Yến Tươi soHERBs Siêu Trắng Da,[''],[12699700000],5,"Lần t2 mua của shop, giao hàng max nhanh, còn đc nhận quà thêm nữa"
[CHÍNH HÃNG] Kem Body Lux Tinh Chất Yến Tươi soHERBs Siêu Trắng Da,[''],[12699700000],5,Chất lượng tốt.bôi kem bật tone lên hẳn.hình anh chỉ mang tính chất nhận xu
[CHÍNH HÃNG] Kem Body Lux Tinh Chất Yến Tươi soHERBs Siêu Trắng Da,[''],[12695900000],5,"Giao hàng nhanh. Còn tặng kèm cột tóc nữa. Xài kem kh bết rít ,thấm nhah. Thoa lên mát rượi"
[CHÍNH HÃNG] Kem Body Lux Tinh Chất Yến Tươi soHERBs Siêu Trắng Da,[''],[12695900000],5,chất kem nhanh thấm. mùi thơm dễ chịu. 
[CHÍNH HÃNG] Kem Body Lux Tinh Chất Yến Tươi soHERBs Siêu Trắng Da,[''],[12695900000],5,"Mua lần hai r
Kem rất ưng nha
Vận chuyển siu nhanh
Kem thấm nhanh ko bết rít"
[CHÍNH HÃNG] Kem Body Lux Tinh Chất Yến Tươi soHERBs Siêu Trắng Da,[''],[12695900000],5,"kem thơm nhẹ.khô thấm nhanh,ko bết dính, trắng tự nhiên ko hề dả trân kkkk"
[CHÍNH HÃNG] Kem Body Lux Tinh Chất Yến Tươi soHERBs Siêu Trắng Da,[''],[12695900000],5,Ugcu9rxyrxoyrxugfy9fxutxutx96ezoyrxoyf hd mv ljv fho j  ưt
[CHÍNH HÃNG] Kem Body Lux Tinh Chất Yến Tươi soHERBs Siêu Trắng Da,[''],[12695900000],5,"Này là lần thứ 2 mua ròi á, vẫn tặng cột tóc xinh xinh nha mn!! Tốt lắm nên quay lại mua là vậy giá thành ok mà kem mịn và thơm thoa tới đâu thấm tới đó trắng nhìn thích lắm kìa 💗💗💗đóng gói kĩ và giao hàng nhanh lunnn"
[CHÍNH HÃNG] Kem Body Lux Tinh Chất Yến Tươi soHERBs Siêu Trắng Da,[''],[12597700000],5,"Mang tính chất nhận xu thuii, nhưng mà mình đã mua ở đây 3 hộp ròi ák, thích chất kemm, mịn tan "
[CHÍNH HÃNG] Kem Body Lux Tinh Chất Yến Tươi soHERBs Siêu Trắng Da,[''],[12597700000],5,"Mua lần 2 rồi vẫn thấy hài lòng về sản phẩm, giá ok mà sản phẩm xài ok lắm nha mn"
[CHÍNH HÃNG] Kem Body Lux Tinh Chất Yến Tươi soHERBs Siêu Trắng Da,[''],[12597700000],5,"Chất kem ok, ko bị bết dính, giao hàng nhanh, xài thử nên chưa biết hiệu quả ntn......"
[CHÍNH HÃNG] Kem Body Lux Tinh Chất Yến Tươi soHERBs Siêu Trắng Da,[''],[12794000000],5,Mình rất hài lòng về sản phẩm rất oke vì nó thích lắm kem mát rượi quá oki la nhaaaaaaaaaaaaaaaaaaaaaaaaaaaaaa.  Mình dùng hết sẽ ủng hộ nữa nhaesssaskmxbcksksnbxjcksmansbhsjmcnchctcyiwmwne bjcjdkskdngsuaislmsmsggdhdjmdlsjdbsoskamnd
[CHÍNH HÃNG] Kem Body Lux Tinh Chất Yến Tươi soHERBs Siêu Trắng Da,[''],[12597700000],5,Đây là lần thứ 2 mình mua vì sp rất ok thoa lên da thơm mướt lên tone được tặng dây cột tóc cute
[CHÍNH HÃNG] Kem Body Lux Tinh Chất Yến Tươi soHERBs Siêu Trắng Da,[''],[12794000000],5,"Kem thấm nhanh, k bết rít. Thoa lên tone nhẹ. K lộ vân kem. Kem này ít kháng nước. Tắm rất sạch k sót kem trên ng. Mình rất thích "
[CHÍNH HÃNG] Kem Body Lux Tinh Chất Yến Tươi soHERBs Siêu Trắng Da,[''],[12797700000],5,Ổn nhé. Mng nên mua higigigigigiigihihihihihihihihihihiihhi
[CHÍNH HÃNG] Kem Body Lux Tinh Chất Yến Tươi soHERBs Siêu Trắng Da,[''],[12797700000],5,"h hk gn hj hj h hk hk jk hkcgjxxfghhc*ỹkyctjtjyyh,C fvx fj gfhf f hh"
[CHÍNH HÃNG] Kem Body Lux Tinh Chất Yến Tươi soHERBs Siêu Trắng Da,[''],[12797700000],5,I ivivuvuvuvuvuvucvucuucucy ycycycuvucucycyvyvycycycycucyvucy
[CHÍNH HÃNG] Kem Body Lux Tinh Chất Yến Tươi soHERBs Siêu Trắng Da,[''],[12597700000],5,giao hàg lâu.trắng nhẹ k vân kem nhanh thấm.da đen k biết sài 10hủ trắng nổi k.hủ kem nhìn ít sài tay chân chắc khoảg 20ngay
[CHÍNH HÃNG] Kem Body Lux Tinh Chất Yến Tươi soHERBs Siêu Trắng Da,[''],[12794000000],5,chất kem lỏng bôi nhanh thấm ko hề bết rít luôn. mùi thơm nhẹ nói chung okkkkkkkkkkkkkk
[CHÍNH HÃNG] Kem Body Lux Tinh Chất Yến Tươi soHERBs Siêu Trắng Da,[''],[12794000000],5,"Kem thơm, thấm nhanh, ko lộ vân kem, đóng gói sản phẩm đẹp, chắc chắn, giao hàng siêu nhanh, mới ship hôm qua thì hôm nay đã nhận đc rồi. "
[CHÍNH HÃNG] Kem Body Lux Tinh Chất Yến Tươi soHERBs Siêu Trắng Da,[None],[12834000000],5,"Giao hàng nhanh
Lần đầu sử dụng nên chưa biết có trắng hay ko
Chất kem siêu mịn, thơm
Nắp hộp soi gương được :))
Được tặng đồ buột tóc xinh xinh"
[CHÍNH HÃNG] Kem Body Lux Tinh Chất Yến Tươi soHERBs Siêu Trắng Da,[None],[13800000000],5,"Giao hàng rất nhanh. Sản phẩm ok. Nên mua nha. Hộp kem nhìn sang, mùi kem dễ chịu. Hương thơm dịu, dễ ngửi. Đã dùng mỹ phẩm thì phải kiên trì. 2,3 hộp trở lên sẽ thấy kq rõ rệt. Mọi ng sd nên kết hợp tẩy da chết 1tuần 1,2 lần. Giúp kem thẩm thấu tốt nhanh trắng nha. 
Chúc chủ sh mua may bán đắt @@"
[CHÍNH HÃNG] Kem Body Lux Tinh Chất Yến Tươi soHERBs Siêu Trắng Da,[None],[12834000000],5,"Mua lần 2. Khá ưng ý. Đc tặng kèm cột tóc xinh xinh.
Giao hàng rất nhanh luôn. 5 sao"
[CHÍNH HÃNG] Kem Body Lux Tinh Chất Yến Tươi soHERBs Siêu Trắng Da,[None],[12834000000],5,Chưa dùng nên cũng chưa biết sao 🥺🥺🥺🥺🥺🥺🥺🥺🥺🥺🥺🥺🥺🥺🥺🥺🥺🥺🥺🥺🥺🥺🥺🥺
[CHÍNH HÃNG] Kem Body Lux Tinh Chất Yến Tươi soHERBs Siêu Trắng Da,[None],[13524000000],5,Cxjvcjcjcjcjcncngxnckdkcmfkcjfkfkfkgkgkgujgjdhdhxfffhhdjtty
[CHÍNH HÃNG] Kem Body Lux Tinh Chất Yến Tươi soHERBs Siêu Trắng Da,[None],[13800000000],5,"Kem chính hãng, rất thơm
Thoa tan thấm nhanh, ko hề rít
Da sáng và mịn mình dùng 3 hôm thấy ổn
Rất đáng mua mọi người nhé"
[CHÍNH HÃNG] Kem Body Lux Tinh Chất Yến Tươi soHERBs Siêu Trắng Da,[''],[12797700000],5,"Kem thơm 
Chính hãng , phục vụ tốt 
Kem không có vân kem "
[CHÍNH HÃNG] Kem Body Lux Tinh Chất Yến Tươi soHERBs Siêu Trắng Da,[None],[14500000000],5,"Kem rất thơm, lại còn dc tặng quà nữa, cảm ơn shop."
[CHÍNH HÃNG] Kem Body Lux Tinh Chất Yến Tươi soHERBs Siêu Trắng Da,[None],[13800000000],5,Giao hàng nhanh. Đóng gói cẩn thận. Khá ưng ý. ..............
[CHÍNH HÃNG] Kem Body Lux Tinh Chất Yến Tươi soHERBs Siêu Trắng Da,[None],[13800000000],5,Đượcccccccccccccccccccccccccccccccccccccccccccccccccccccccccccccccccccccccccccccccccccccccc
[CHÍNH HÃNG] Kem Body Lux Tinh Chất Yến Tươi soHERBs Siêu Trắng Da,[None],[13800000000],5,Ổn
[CHÍNH HÃNG] Kem Body Lux Tinh Chất Yến Tươi soHERBs Siêu Trắng Da,[None],[14500000000],5,"Kem thấm nhanh không bị bết rít
Đóng gói sản phẩm chắc chắn ❤️❤️❤️"
[CHÍNH HÃNG] Kem Body Lux Tinh Chất Yến Tươi soHERBs Siêu Trắng Da,[None],[14500000000],5,"Sp tốt, kem thấm, ko bết rít, mùi thơm dễ chịu ❤❤❤❤❤❤❤❤❤❤❤❤❤❤"
[CHÍNH HÃNG] Kem Body Lux Tinh Chất Yến Tươi soHERBs Siêu Trắng Da,[None],[13800000000],5,Sản phẩm tuyệt vời đóng góp của bạn nhậu đâm thủng bụng ngực có
[CHÍNH HÃNG] Kem Body Lux Tinh Chất Yến Tươi soHERBs Siêu Trắng Da,[''],[12196900000],5,"Shop giao hàng nhanh, gói hàng cẩn thận có bọc 1 lớp túi chống sốc, sản phẩm nhìn bề ngoài thì ok, còn bên trong chưa khui, nếu tốt lần sau sẽ ủng hộ shop tiếp ạ."
[CHÍNH HÃNG] Kem Body Lux Tinh Chất Yến Tươi soHERBs Siêu Trắng Da,[''],[12196900000],5,giao hang nhanh sản phâm y trong hình co xai roi hang chât luong xai len tong mua thêm lần thứ 2 roi xai ok cho shop 5 sao
[CHÍNH HÃNG] Kem Body Lux Tinh Chất Yến Tươi soHERBs Siêu Trắng Da,[''],[12196900000],5,"Hàng rất chất lượng
Sẽ ủng hộ"
[CHÍNH HÃNG] Kem Body Lux Tinh Chất Yến Tươi soHERBs Siêu Trắng Da,[''],[12196900000],5,"Hàng chất lượng b,check ra mã nha mọi ng , nên mua ,shop tặng thêm mặt nạ nữa ,sẽ ủng hộ tiếp"
[CHÍNH HÃNG] Kem Body Lux Tinh Chất Yến Tươi soHERBs Siêu Trắng Da,[''],[12196900000],5,"Chất lượng hàng rất tốt nha mọi người 
Mình rất ưng ý luôn nha
Đóng gói hàng rất cẩn thận nữa"
[CHÍNH HÃNG] Kem Body Lux Tinh Chất Yến Tươi soHERBs Siêu Trắng Da,[''],[12196900000],5,Kem dùng rất thích có mùi thơm bôi nên k bị bết dính lại còn đc tặng dây buộc tóc nữa 
[CHÍNH HÃNG] Kem Body Lux Tinh Chất Yến Tươi soHERBs Siêu Trắng Da,[''],[12196900000],5,Rất ok
[CHÍNH HÃNG] Kem Body Lux Tinh Chất Yến Tươi soHERBs Siêu Trắng Da,[''],[12696900000],5,☑️
[CHÍNH HÃNG] Kem Body Lux Tinh Chất Yến Tươi soHERBs Siêu Trắng Da,[''],[12696900000],5,Đóng gói kĩ .dùng cũng mịn không bị bết nha mn
[CHÍNH HÃNG] Kem Body Lux Tinh Chất Yến Tươi soHERBs Siêu Trắng Da,[''],[12696900000],5,Okee
[CHÍNH HÃNG] Kem Body Lux Tinh Chất Yến Tươi soHERBs Siêu Trắng Da,[''],[12696900000],5,"Chất kem xài ok
"
[CHÍNH HÃNG] Kem Body Lux Tinh Chất Yến Tươi soHERBs Siêu Trắng Da,[''],[12696900000],5,"Shop gói hàng cẩn thận, giao hàng nhanh, kem bôi không bết thấm nhanh và đặc biệt được tặng kẹp tóc xinh xinh🥰🥰"
[CHÍNH HÃNG] Kem Body Lux Tinh Chất Yến Tươi soHERBs Siêu Trắng Da,[''],[12696900000],5,Kem tốt bôi lên kh bị rít da và thấm nhanh xài hiệu quả sẽ ủng hộ tiếp 
[CHÍNH HÃNG] Kem Body Lux Tinh Chất Yến Tươi soHERBs Siêu Trắng Da,[''],[12196900000],5,"chất kem mềm, trắng, ok"
[CHÍNH HÃNG] Kem Body Lux Tinh Chất Yến Tươi soHERBs Siêu Trắng Da,[''],[12696900000],5,Sản phẩm đã được mở team trước  hơi thất vọng chưa dùng không biết  chất lượng như thế nào. Được tặng cột tóc bé bé xinh xinh dù sao cũng cảm ơn shop vì món quà 
[CHÍNH HÃNG] Kem Body Lux Tinh Chất Yến Tươi soHERBs Siêu Trắng Da,[''],[12696900000],5,Kem thơm ko lo van kem không biết trắng không sức hết hop đánh gia shop nữa nhé
[CHÍNH HÃNG] Kem Body Lux Tinh Chất Yến Tươi soHERBs Siêu Trắng Da,[''],[12699700000],5,"Chất lượng sản phẩm tuyệt vời! Ko có tg chụp sp, dùng tạm hình ạ"
[CHÍNH HÃNG] Kem Body Lux Tinh Chất Yến Tươi soHERBs Siêu Trắng Da,[''],[12699700000],5,giao hàng nhanh co mùi thơm dễ chịu hàng giao y như trong hình chưa xài nên chưa bt hàng có quà tặng nữa hy vong là xài tốt sẽ ủng hộ shop nữa
[CHÍNH HÃNG] Kem Body Lux Tinh Chất Yến Tươi soHERBs Siêu Trắng Da,[''],[12696900000],4,"Giao hàng nhanh
Đóng gói kĩ
"
[CHÍNH HÃNG] Kem Body Lux Tinh Chất Yến Tươi soHERBs Siêu Trắng Da,[''],[12699700000],5,Bữa đen lắm! Giờ đỡ oy nek
[CHÍNH HÃNG] Kem Body Lux Tinh Chất Yến Tươi soHERBs Siêu Trắng Da,[''],[12699700000],5,"Chất kem mịn, thấm nhanh vào da không bết rít, mùi thơm dịu nhẹ."
[CHÍNH HÃNG] Kem Body Lux Tinh Chất Yến Tươi soHERBs Siêu Trắng Da,[''],[12699700000],5,"Shop giao hàng nhanh lắm, mjh đặt buổi sáng buổi chiều giao rồi "
[CHÍNH HÃNG] Kem Body Lux Tinh Chất Yến Tươi soHERBs Siêu Trắng Da,[''],[12695900000],5,
[CHÍNH HÃNG] Kem Body Lux Tinh Chất Yến Tươi soHERBs Siêu Trắng Da,[''],[12695900000],5,
[CHÍNH HÃNG] Kem Body Lux Tinh Chất Yến Tươi soHERBs Siêu Trắng Da,[''],[12699700000],5,S
[CHÍNH HÃNG] Kem Body Lux Tinh Chất Yến Tươi soHERBs Siêu Trắng Da,[''],[12695900000],5,Mùi nhẹ dễ chịu.
[CHÍNH HÃNG] Kem Body Lux Tinh Chất Yến Tươi soHERBs Siêu Trắng Da,[''],[12695900000],5,"Sp êm, mượt và thơm. Thấm vào da nhanh chong không bết rit"
[CHÍNH HÃNG] Kem Body Lux Tinh Chất Yến Tươi soHERBs Siêu Trắng Da,[''],[12695900000],5,"Đó h xài vài loại kem oy nhưng chưa thấy kem trắng da nào dễ thoa như kem của shop, như thoa lotion z á siu dễ thấm luôn không lộ vân kem.Kem thơm mà hộp kem có chức năng như cái gương lun còn dc shop tặng dây cột tóc.Nhất định sẽ mua thêm các sp khác nà"
[CHÍNH HÃNG] Kem Body Lux Tinh Chất Yến Tươi soHERBs Siêu Trắng Da,[''],[12695900000],5,Hang y hình
[CHÍNH HÃNG] Kem Body Lux Tinh Chất Yến Tươi soHERBs Siêu Trắng Da,[''],[12695900000],5,Hàng ok shop gói hàng rất cẩn thận giống hình sản phẩm cx ok lắm ạ mk sẽ ủng hộ shop nhiều 🥰
[CHÍNH HÃNG] Kem Body Lux Tinh Chất Yến Tươi soHERBs Siêu Trắng Da,[''],[12695900000],5,"Cảm ơn shop, được tặng quà siêu cưng."
[CHÍNH HÃNG] Kem Body Lux Tinh Chất Yến Tươi soHERBs Siêu Trắng Da,[''],[12597700000],5,Giao đúng hàng
[CHÍNH HÃNG] Kem Body Lux Tinh Chất Yến Tươi soHERBs Siêu Trắng Da,[''],[12597700000],5,Này là cam thường đó các ce. Mới sử dụng lần đầu có lên tone nha. Nhưng ra nắng sẽ trắng ảo. Kem k lộ vân gì cả. Không biết dùng lâu dài sẽ ntn
[CHÍNH HÃNG] Kem Body Lux Tinh Chất Yến Tươi soHERBs Siêu Trắng Da,[''],[12597700000],5,"Sản phẩm đóng gói rất oki lun ạ, giao nhanh, hàng check đúng sp... nói chung mình rất ưng ý. Mình từng sd r. Và mình rất thích. Lần sau sẽ ủng hộ shop tiếp nhé 🥰"
[CHÍNH HÃNG] Kem Body Lux Tinh Chất Yến Tươi soHERBs Siêu Trắng Da,[''],[12597700000],5,"Kem thơm ,mềm mịm, thoa lên rất thích, không lộ vân kem, hàng chính hãng , mình xài kem này lâu rùi, trước mua trên IG 290k cơ, nay lương chưa về nên mua tạm bên đây, giá rẻ mà chất kem không khác j, 100 điểm luôn."
[CHÍNH HÃNG] Kem Body Lux Tinh Chất Yến Tươi soHERBs Siêu Trắng Da,[''],[12597700000],5,"Kem thơm lắm nhe, còn dc tặng cột tóc xinh xinh nè. Trắng hay ko thì thời gian mới biết dc. Nhưng giao hàng nhanh, chu đáo là đủ 5 sao rồi ^^"
[CHÍNH HÃNG] Kem Body Lux Tinh Chất Yến Tươi soHERBs Siêu Trắng Da,[''],[12597700000],5,"Kem thơm
"
[CHÍNH HÃNG] Kem Body Lux Tinh Chất Yến Tươi soHERBs Siêu Trắng Da,[''],[12797700000],5,"Thơm, mịn, ko bết, lên tông hay ko thì xài thử mới biết🤪"
[CHÍNH HÃNG] Kem Body Lux Tinh Chất Yến Tươi soHERBs Siêu Trắng Da,[''],[12797700000],5,"Kem mềm, mịn, thoa vào da thấm hoàn toàn, bật tông từ từ, mùi thơm dịu nhẹ."
[CHÍNH HÃNG] Kem Body Lux Tinh Chất Yến Tươi soHERBs Siêu Trắng Da,[''],[12597700000],5,Chất kem ok
[CHÍNH HÃNG] Kem Body Lux Tinh Chất Yến Tươi soHERBs Siêu Trắng Da,[''],[12797700000],5,"Chất kem ok
"
[CHÍNH HÃNG] Kem Body Lux Tinh Chất Yến Tươi soHERBs Siêu Trắng Da,[''],[12597700000],5,"Chưa sd nên ko bit chất lượng ntn ,đóng gói cẩn thận "
[CHÍNH HÃNG] Kem Body Lux Tinh Chất Yến Tươi soHERBs Siêu Trắng Da,[''],[12597700000],5,Sản phẩm đóng gói rất OK . 5 sao
[CHÍNH HÃNG] Kem Body Lux Tinh Chất Yến Tươi soHERBs Siêu Trắng Da,[''],[12797700000],5,"Shop đóng gói kĩ càng, kem mịn kh bết , thơm, trắng lên tone, kèm quà tặng dễ thương nữa 😘 "
[CHÍNH HÃNG] Kem Body Lux Tinh Chất Yến Tươi soHERBs Siêu Trắng Da,[''],[12797700000],4,Kem thơm thấm nhanh vào da . Cơ mà mình check mắc vạch trên hộp sao ko ra ta.
[CHÍNH HÃNG] Kem Body Lux Tinh Chất Yến Tươi soHERBs Siêu Trắng Da,[''],[12794000000],5,Mình mới sử dụng lần đầu cũng chưa pt kết quả thế nào nói chung mọi người nên mua bên Shop này ập ❤️
[CHÍNH HÃNG] Kem Body Lux Tinh Chất Yến Tươi soHERBs Siêu Trắng Da,[''],[12794000000],5,"Bây h dùng hết thì mua tiếp thôi chứ ý kiến j nữa ,.................. Nhận xét viết nhiều vào cho có với ngta"
[CHÍNH HÃNG] Kem Body Lux Tinh Chất Yến Tươi soHERBs Siêu Trắng Da,[''],[12794000000],5,Sp tốt còn được tặng thêm thun cột tóc !! 
[CHÍNH HÃNG] Kem Body Lux Tinh Chất Yến Tươi soHERBs Siêu Trắng Da,[''],[12794000000],5,Đúg hàg đúng mẫu còn xài chất lượng của kem ra sao thì chưa biết nhưng cũg đúng sản phẩm rrrr... Cũg đáng tiền...
[CHÍNH HÃNG] Kem Body Lux Tinh Chất Yến Tươi soHERBs Siêu Trắng Da,[''],[12794000000],5,Kem sài đã lắm nha shop oi em sài có tuần da e trắng lên đk chúc rồi ạ lần đầu mua shop nhưng mà ưng quá tr sẽ ủng hộ shop tiếp❤❤❤❤❤❤
[CHÍNH HÃNG] Kem Body Lux Tinh Chất Yến Tươi soHERBs Siêu Trắng Da,[''],[12794000000],5,bsjsjđjkđjbdndjjdjdbjdbdbdiebdhđibdbdbdhdbdbdbdhdhdhdhdhbdhdhdhdhdh
[CHÍNH HÃNG] Kem Body Lux Tinh Chất Yến Tươi soHERBs Siêu Trắng Da,[''],[12794000000],5,"Có 1 sự thích nhẹ sp này, giao hàng rất nhanh. Ok"
[CHÍNH HÃNG] Kem Body Lux Tinh Chất Yến Tươi soHERBs Siêu Trắng Da,[None],[12834000000],5,Okkkkkkkkkkkkkkkkkkkkkkkkkkkkkkkkkkkkkkkkkkkkkkkkkkkkkkkkkkkkkkkkkkkkkk
[CHÍNH HÃNG] Kem Body Lux Tinh Chất Yến Tươi soHERBs Siêu Trắng Da,[None],[13800000000],5,"Mua lần thứ hai rồi . Xài hết 1 kem body và 1 sét tắm trắng da bật tông rõ rệt , chất kem thấm nhanh k lem ra quần áo . Lần nào cũng đc tặng quà cưng gê , dù tóc tém k cột đc nhưng cũng ráng trồng cây dừa trên đỉnh đầu ^^"
[CHÍNH HÃNG] Kem Body Lux Tinh Chất Yến Tươi soHERBs Siêu Trắng Da,[None],[12834000000],5,Rất thơm kem mịn k bết thấm nhanh mua bhju lần ở dhop rùi. Mong sẽ trắg. 
[CHÍNH HÃNG] Kem Body Lux Tinh Chất Yến Tươi soHERBs Siêu Trắng Da,[None],[14500000000],5,"Kem thơm mùi dễ chịu, thoa lên da thấm nhanh. Nhưng nếu xoa lớp dày sẽ có cảm giác hơi bị rít.
Không bật tông nhiều. Còn về xài lâu dài có trắng lên không phải đợi thời gian nữa.
Shop giao hàng nhanh."
[CHÍNH HÃNG] Kem Body Lux Tinh Chất Yến Tươi soHERBs Siêu Trắng Da,[None],[14500000000],5,"Chất kem thích cực luôn, k bết rít thấm nhanh có mùi thơm nhẹ, mình thoa thử thấy da mịn còn trắng k mình xài lâu sẽ đánh giá thêm nha, hàng đặt hôm trước hôm sau đã có hàng, nói chung rất hài lòng với shop"
[CHÍNH HÃNG] Kem Body Lux Tinh Chất Yến Tươi soHERBs Siêu Trắng Da,[None],[12834000000],5,"Thích shop ở việc chuẩn bị và giao hàng nhanh chóng, về phần đóng gói hàng shop đóng gói rất cẩn thận và còn được tặng quà xinh nữa. Kem thì mình chưa sử dụng nên chưa biết thế nào nếu ok sẽ tiếp tục ủng hộ ạ"
[CHÍNH HÃNG] Kem Body Lux Tinh Chất Yến Tươi soHERBs Siêu Trắng Da,[None],[13800000000],5,"Lần đầu tiên trải nghiệm sp của shop. Còn đc shop tặng kèm dây cột tóc đáng iuu nữa ạ.  Thanks shop nhiều ạ ,  sdsp cho kết quả mĩ mãn sẽ phản hồi tích cực đến shopppp ,  kem xịn sò luônnn "
[CHÍNH HÃNG] Kem Body Lux Tinh Chất Yến Tươi soHERBs Siêu Trắng Da,[None],[13800000000],5,"K có hình nên lấy tạm mình mua đã là hộp thứ N rồi xài nhanh thấm k bết rít mềm mịn thơm nhanh thấm lắm
"
[CHÍNH HÃNG] Kem Body Lux Tinh Chất Yến Tươi soHERBs Siêu Trắng Da,[None],[13800000000],5,"Đã nhận đc kem bôi và tắm trắng Lux. Shop còn tặng kèm mặt nạ và dây buộc tóc. Ưng lắm
"
