variations,price,rating_star,comment
['HỒNG'],[285000000],5,Sản phẩm đẹp giao hàng nhanh. Rất hài lòng vs shop
['HỒNG'],[285000000],5,"Cấp ẩm trị mụn ok, mùi mặt nạ thơm nhẹ không hăng. Dùng thích cực. Nên mua nha mọi người"
"['HỒNG', 'XANH DƯƠNG', 'XANH LÁ']","[285000000, 285000000, 285000000]",5,"Shop giao đúng,  đủ hàng. , gói hàng cẩn thận.  Sẽ ủng hộ ahop những lần sau. "
"['HỒNG', 'XANH LÁ']","[285000000, 285000000]",5,Bvvv.  xndnndndbdbdbbdbdbdbbdbdbdbdbbfbfbfbdb mong ko kích ứng 
['đá băng mới'],[285000000],5,Hàng giao đầy đủ...... mua lần 2 rồi sử dụng thích lắm........
['HỒNG'],[285000000],5,Hàng giao đầy đủ...... mua lần 2 rồi sử dụng thích lắm........
"['đá băng mới', 'HỒNG']","[285000000, 285000000]",5,Sản phẩm okkkkkkkkkkkkkkkkkkkkkkkkkkkkkkkkkkkkkkkkkkkk
['XANH LÁ'],[285000000],5,Hàng đóng gói cẩn thận lắm ạ. Dùng mát và thik lắm ạ ❤️❤️❤️
"['HỒNG', 'XANH DƯƠNG', 'XANH LÁ']","[285000000, 285000000, 285000000]",5,Âhjaskowossoksskslks ư ư smsma ư ư ư ưa. Â a a a aslssllslslsls
"['HỒNG', 'XANH LÁ']","[285000000, 285000000]",5,"Chuẩn bị và giao hàng nhanh, ssoos lhowjng đạqt giao đủ nhưng có nhầm lẫn một chút."
"['HỒNG', 'XANH DƯƠNG', 'XANH LÁ']","[285000000, 285000000, 285000000]",5,"Mặt nạ khá ok, hơi mỏng dễ bị rách nhưng được cái siêu rẻ, khi đắp mọi người nâng niu nhẹ nhàng là ok hết nha, mình nghĩ là nên mua."
"['HỒNG', 'XANH DƯƠNG', 'XANH LÁ']","[285000000, 285000000, 285000000]",5,Mua dùng dần thích lắm cảm ơn shopppppppppppppppppppppppppppp0ppppppppppppppppppppppppppppppppppppp0ppppppppppppp♥️♥️♥️♥️
['HỒNG'],[285000000],5,
['XANH DƯƠNG'],[285000000],5,"Sản phẩm dùng rất thích, sẽ ủng hộ shop nhìuuu nhìuuuuuuuuuuuu"
['XANH DƯƠNG'],[285000000],5,Ggsvgthdbd xj skvmskd kdo. idibdhbụdbdkbdkbkdmvsmvmsvkskskkk
"['HỒNG', 'XANH DƯƠNG', 'XANH LÁ']","[285000000, 285000000, 285000000]",5,
"['HỒNG', 'XANH LÁ']","[285000000, 285000000]",5,"Giao hàng nhanh, đóng gói cẩn thận, chưa dùng nên chưa biết chất lượng như nào!"
['XANH DƯƠNG'],[285000000],5,"Giá thì rẻ mà kết quả bất ngờ ❤️❤️❤️ xài da không bị kích ứng, sau đắp da căng mịn và trắng lên ❤️❤️❤️❤️ "
"['HỒNG', 'XANH DƯƠNG', 'XANH LÁ']","[285000000, 285000000, 285000000]",5,Nc hoa bé xiu nhưng thơm lắm lun mặt nạ giao đủ chưa dùng nên kn như thế nào ❤️❤️❤️❤️❤️❤️❤️💚💚💚💚💚💚💚❤️❤️❤️❤️❤️
"['HỒNG', 'XANH DƯƠNG', 'XANH LÁ']","[285000000, 285000000, 285000000]",5,"Đủ số lượng, giao nhạnhhhhhhhhhhhhhhhhhhhhhhhhhhhhhhhh"
"['HỒNG', 'XANH DƯƠNG']","[285000000, 285000000]",5,Sản phẩm dùng được hợp giá tiền giao hàng nhanh đóng gói cẩn thận
"['HỒNG', 'XANH DƯƠNG', 'XANH LÁ']","[285000000, 285000000, 285000000]",5,"Siêu ưng luôn ý. Mặt nạ dùng ok, không kích ứng. Bao bì cute, shop thân thiện...kkkkkkkkkkkkkkkkkkk😍😍😍😍😍😍😍😍😍😍😍😍😍😍😍😍😍😍😍😍😍😍"
['HỒNG'],[285000000],5,"Shop giao hàng rất nhanh, giao đủ nữa, đã là lần t2 ghé tới shop, rất nhiệt tình"
"['HỒNG', 'XANH DƯƠNG']","[285000000, 285000000]",5,"Sản phẩm giao đủ đúng loại hàng
Xịn lắm nha !!!!!!!!!!!!!!!!!!
"
"['HỒNG', 'XANH DƯƠNG', 'XANH LÁ']","[285000000, 285000000, 285000000]",5,
['XANH DƯƠNG'],[285000000],5,"Mặt nạ mẫu mã ẹp
Chưa sd nên kh noiiiiiiiiiiiiiiiii giiiiiiiiiiiiiiii thêmmmmmmmmmmmmmmmmm"
"['HỒNG', 'XANH DƯƠNG']","[285000000, 285000000]",5,"Sản phẩm tốt, giao hàng nhanh, shop tư vấn cập nhật tình dễ thương lắm luôn 🥰"
"['HỒNG', 'XANH DƯƠNG', 'XANH LÁ']","[285000000, 285000000, 285000000]",5,"Sản phẩm gióng như hình, đáng giá tiền , shop phục vụ tốt......"
"['HỒNG', 'XANH DƯƠNG', 'XANH LÁ']","[285000000, 285000000, 285000000]",5,Mình dùng loại này nhiều lần rồi. Mùa đông da khô cấp ẩm tốt lắm á. Ngày dùng 1 mask là mặt bao mịn màng lun . Cứ kiên trì là ắt đẹp
"['HỒNG', 'XANH DƯƠNG']","[285000000, 285000000]",5,Đã từng mua rồi sp khá ok ship nhanh nên mua nha m.n
"['HỒNG', 'XANH DƯƠNG', 'XANH LÁ']","[285000000, 285000000, 285000000]",5,Shipper thân thiện. Giao đủ số lượng. Chưa dùng nên chưa biết. Sẽ ủng hộ shop lần nữa
"['XANH DƯƠNG', 'XANH LÁ']","[285000000, 285000000]",5,Chả biết đánh giá ra sao nhưng mà shipper kí nhận nhưng mà mình rất hài lòng🥺🥺🥺🥺
['HỒNG'],[285000000],5,shop phục vụ nhiệt tình chuẩn bị hàng nhanh đóng gói đẹp chắc chắn
['XANH DƯƠNG'],[285000000],5,Hàng ok 
['XANH DƯƠNG'],[285000000],5,Sản phẩm tuyệt vời. Shop rất tận tâm mua nhiều còn đc tặng quà.mua hàng của shop nhiều r rất ưng luôn😍😍😍😍......
"['XANH DƯƠNG', 'XANH LÁ']","[285000000, 285000000]",5,"Hàng đóng gói kĩ càng ,giao hàng khá nhanh ,mới dùng mặt nạ đất xét thấy cũng ok ,rẻ"
['HỒNG'],[285000000],5,em da dầu mà vẫn dùng tốt nha các chị khiyeen nên mua và đung lâu dài nha
['HỒNG'],[285000000],5,"Lần đầu mua của shop , hy vọng ok sử ủng hộ tiếp. ☺️☺️☺️☺️☺️☺️☺️☺️☺️☺️☺️"
"['HỒNG', 'XANH DƯƠNG', 'XANH LÁ']","[285000000, 285000000, 285000000]",5,"Mặt nạ dùng cấp ẩm tốt , đóng gói cẩn thận, hàng giao nhanh chóng"
"['HỒNG', 'XANH DƯƠNG', 'XANH LÁ']","[285000000, 285000000, 285000000]",5,"Shop giao đủ số lượng, giá cả hợp ní , 10đ về phục vụ khi trc lúc giao còn nhắn xác nhận đơn vs mk , mặc dù chưa biết chất lượng ra sao nhưng 5* nhé !!!"
"['HỒNG', 'XANH DƯƠNG', 'XANH LÁ']","[285000000, 285000000, 285000000]",5,"Xinh xẻo nhưng chưa dùng nên k bt fb như nào!! Mong là okela hahaha
Skdiebdkfpnfkepefpl"
"['HỒNG', 'XANH DƯƠNG', 'XANH LÁ']","[285000000, 285000000, 285000000]",5,"Hàng về đủ nha, tại thấy nhiều ng đánh giá hàng về thiếu nên lúc đặt hàng hơi lo.. Chưa dùng nên chưa biết chất lượng thế nào.. Nếu ok sẽ ủng hộ shop ☺️😍"
"['HỒNG', 'XANH LÁ']","[285000000, 285000000]",5,Mask xịn ngon bổ rẻ . Ship lại còn nhanh 😚
"['HỒNG', 'XANH LÁ']","[285000000, 285000000]",5,"Hàng tốt nha, có gì sẽ ủng hộ shop dài dài"
"['HỒNG', 'XANH DƯƠNG', 'XANH LÁ']","[285000000, 285000000, 285000000]",5,"Sp siu đẹp siu cute lun , mk mua shop mấy làn r nên tin tưởng shop lắm luôn nà , lúc nào cx ủng hộ shop hết nè 😍😍😍"
"['HỒNG', 'XANH DƯƠNG', 'XANH LÁ']","[285000000, 285000000, 285000000]",5,"Sr vì hình ảnh và vd k liên quan. Giao hàng rất nhanh luôn,nhưng shop giao thiếu 1 mặt nạ bơ ạ :(("
"['HỒNG', 'XANH DƯƠNG', 'XANH LÁ']","[285000000, 285000000, 285000000]",5,Xịn lắm nha yhahahhahahahahahahha
"['HỒNG', 'XANH DƯƠNG', 'XANH LÁ']","[285000000, 285000000, 285000000]",5,Hình ảnh và video mang tính chất nhận xu :)))))))))))))))))
"['HỒNG', 'XANH DƯƠNG', 'XANH LÁ']","[285000000, 285000000, 285000000]",5,"Đóng gói sản phẩm chắc chắn, sản phẩm tốt, giao hàng lâu phải nhắn shop mới giao"
['XANH DƯƠNG'],[285000000],5,"Hàng về đúng như đã đặt. Siêu dễ thương. Chủ shop rất lịch sự, thân thiện và chu đáo. Chưa sử dụng nên chưa biết! Nói chung thì rất hài lòng ❤️👌 Chúc shop buôn may bán đắt"
['XANH DƯƠNG'],[285000000],5,"Đủ sản phẩm 
Giá rẻ,hhkkhgggvvgjjj) ghjjjjkjvfffghjj#hgggggjjhfvvbbgghjj"
"['HỒNG', 'XANH DƯƠNG', 'XANH LÁ']","[285000000, 285000000, 285000000]",5,"Giao hàng nhanh, rẻ nhưng với gía tiền thì k mong chờ ở sp nhiều"
['HỒNG'],[285000000],5,"Đã nhận đủ hàng , giao hàng nhanh....................
Mong là phù hợp vs da mình , da mình da mụn "
['HỒNG'],[285000000],5,"giao đủ hàng, mẫu mã khá đẹp, hơi nhiều dưỡng chất, mặt nạ để lạnh đắp sướng "
"['HỒNG', 'XANH DƯƠNG', 'XANH LÁ']","[285000000, 285000000, 285000000]",5,"Chưa dùng vì mới giao đến đã lên để đánh giá luôn rồi, shop giao đủ hàng, giao nhanh lắm luôn, sớm hơn cả dự kiến, shop cũng dễ thương lắm, mọi người mua đi nhé."
"['XANH DƯƠNG', 'XANH LÁ']","[285000000, 285000000]",5,"Giao hàng nhanh lắm nè, đặt nh mà shop vẫn chuẩn bị đủ, chưa dùng thử nên chưa biết thế nào nữa"
"['XANH DƯƠNG', 'XANH LÁ']","[285000000, 285000000]",5,Hình ảnh ko liên quan nhưng thử sài 1 lan ko hợp da  nghĩ mà buồn 😌
"['HỒNG', 'XANH DƯƠNG', 'XANH LÁ']","[285000000, 285000000, 285000000]",5,Shop giao hàng khá nhanh. Htrc đặt hôm sau có luôn. Shipperr nhiệt tình!!!
"['HỒNG', 'XANH DƯƠNG', 'XANH LÁ']","[285000000, 285000000, 285000000]",5,"mua lần 2. xài ok 
năjababahwjajanwjwwhabaghqqhhqjjanabdbdhdhdbdbsnsnsnn"
"['HỒNG', 'XANH DƯƠNG']","[285000000, 285000000]",5,Đóng gói cẩn thận shop phục vụ chu đáo và nhiệt tình shipper thân thiện 
['XANH DƯƠNG'],[285000000],5,"Chưa sử dụng thử nhưng cảm thấy khá ổn, hàng giao đầy đủ, không thiếu"
"['HỒNG', 'XANH DƯƠNG', 'XANH LÁ']","[285000000, 285000000, 285000000]",5,Sp tốt
['XANH LÁ'],[285000000],5,"giao đúng màu, đủ số lượng, mặt nạ có mùi thơm mát khá dễ chịu và thoải mái"
"['XANH DƯƠNG', 'XANH LÁ']","[285000000, 285000000]",5,"Giao hàng nhanh , đáng tiền. Đóng gói kĩ ............::.:....
"
"['HỒNG', 'XANH LÁ']","[285000000, 285000000]",5,"Dùng thích lắm. Ai bảo  con trai ko cần làm đẹp.
Ảnh và video nhận xu"
['XANH DƯƠNG'],[285000000],5,"Giao hàng siêu nhanh , gói hàng cẩn thận , tư vấn nhiệt tìnhhhhh"
"['HỒNG', 'XANH DƯƠNG', 'XANH LÁ']","[285000000, 285000000, 285000000]",5,"Giao hàng và đóng gói cẩn thận, date còn xa, sẽ ủng hộ shop tiếp"
"['HỒNG', 'XANH DƯƠNG', 'XANH LÁ']","[285000000, 285000000, 285000000]",5,"Giá rẻ sp chất lượng 
Giao hàng nhanh 
Đắp nên thấy khá oke 
Nên mua nhé"
['XANH LÁ'],[285000000],5,"Em đã nhận được hàng,giao đủ số lượng,đây là lần t2 em mua tại shop rồi nên yên tâm nha"
['HỒNG'],[285000000],5,Sẽ ủng hộ lần sau ạ....
"['HỒNG', 'XANH DƯƠNG', 'XANH LÁ']","[285000000, 285000000, 285000000]",5,H iifxkgxjfxigxlgchlZ z zhahz x à sỹ Sơn s sx. Sâhnd z ánh sáhh
"['HỒNG', 'XANH DƯƠNG', 'XANH LÁ']","[285000000, 285000000, 285000000]",5,rất oke nhé mn mn nên mua
"['HỒNG', 'XANH DƯƠNG', 'XANH LÁ']","[285000000, 285000000, 285000000]",5,Tcccu u u. Uvuvu u. Hhvgbuv d d bd d. Đjjs s êhije. Sbsbs. Sheb ebeb bdhd
"['HỒNG', 'XANH DƯƠNG', 'XANH LÁ']","[285000000, 285000000, 285000000]",5,Gdbcncngnbfbfhfhfhkdksksjbxbxbcbcbcbhdjrjfjfbfbfb
['Đá băng Images'],[270000000],5,HajsksjsjahahahBzbznznznznxnxbxxbzbzbzvvzzbzbzbzbzbzbbzbzbzbznznzhzggzgzkksksksjbsjskkslsaasksksjdkjdjdjdjsjdjdjdjdjdjjdjdjdjxjxjjxjxjxjdjjdjdjdnxnznznsnsbbsbsbsbsbsbsbbsnskxkxoxpdldjdnjskslslslslslkdjdjdkdkdkdk
"['HỒNG', 'XANH DƯƠNG', 'XANH LÁ']","[285000000, 285000000, 285000000]",5,"Lười quay video nên đăng tạm 
Giao hàng khá nhanh
Hiệu quả ko biết ra sao vì chưa sử dụng
Nếu tốt sẽ quay lại ủng hộ shop"
['XANH DƯƠNG'],[285000000],5,"Shop giao đủ số lượng, hộp đựng bị móp xíu nhưng k ảnh hưởng sản phẩm "
['XANH LÁ'],[285000000],5,Đc nên mua hâjabjshavwizuavwanjajaabbaajjabsbevebskakakakajababbaqn
['XANH DƯƠNG'],[285000000],5,"Chưa dùng sp nên cg ko rõ chất lượng ra s, giao hàng rất nhanh luôn😊😊"
"['HỒNG', 'XANH DƯƠNG', 'XANH LÁ']","[285000000, 285000000, 285000000]",5,"Giao hàng siêu nhanh
Đủ số lượng và đúng mẫu mình đặt .
Shop phục vụ tốt
"
['XANH LÁ'],[285000000],5,"Chưa sử dụng nên chưa biết hiệu quả như thế nào, mong là tốt :))))"
"['HỒNG', 'XANH DƯƠNG', 'XANH LÁ']","[285000000, 285000000, 285000000]",5,"Nhìn đẹp lắm, chưa sài, không biết nó ra sao nữa, skgzuzlyslyzlyp6wylzu5m ng 85mfMv n
Zlys lm.b,
  Ktouzktzue 7"
"['HỒNG', 'XANH LÁ']","[285000000, 285000000]",5,Chưa dùng nên k bt đánh giá ntn nhưng ns chung là ưnggggggg:)))
['XANH DƯƠNG'],[285000000],5,Hàng chất lượng
"['HỒNG', 'XANH LÁ']","[285000000, 285000000]",5,"Chưaa sử dụng nên chưa biếttttttt
Bao bì chắc chắngnnnnnnnn"
"['HỒNG', 'XANH DƯƠNG']","[285000000, 285000000]",5,"Shop giao đủ hàng. Chưa dùng nên chưa biết chất lượng sản phẩm thế nào, nhưng mà nhìn khá là xịn xò"
['XANH DƯƠNG'],[285000000],5,Shop đóng gói sản phẩm chắc chắn đặt nhiều mà giao hàng đầy đủ chưa dùng thử nhưng mà nhịn ổn tin tưởng
['XANH DƯƠNG'],[270000000],5,Giao hàng thiếu.. mask rẻ nên nhìn hơi fake. K dám dùng 😅😅
"['HỒNG', 'XANH DƯƠNG', 'XANH LÁ']","[285000000, 285000000, 285000000]",5,"Giao hàng nhanh, đóng gói chắc chắn, đúng_ đủ sản phẩm ......."
['XANH LÁ'],[285000000],5,"Hàng cực chất lượng mà giá thành lại rẻ ,shipper giao rõ nhanh,đóng gói chắc chắn"
"['HỒNG', 'XANH DƯƠNG', 'XANH LÁ']","[285000000, 285000000, 285000000]",5,Giao hàng rất nhanh. Gói hàng cẩn thận. Hình ảnh chỉ mang tính chất kiếm xu nên ko liên quan lắm😅
['XANH DƯƠNG'],[285000000],5,Đóng gói sản phẩm đẹp kĩ càng nhưng giao hàng hơi lâu xíu. Nói chung là ok.
"['HỒNG', 'XANH LÁ']","[285000000, 285000000]",5,giao hàng hàng đủ hàng chất lượng sẽ ủng hộ shop nhiều lần nữa nha
"['HỒNG', 'XANH LÁ']","[285000000, 285000000]",5,Giao hàng nhanh . Ok lắm ạ
"['HỒNG', 'XANH DƯƠNG', 'XANH LÁ']","[285000000, 285000000, 285000000]",5,sản phẩm khi mà đắp lên ko khô da đắp cũng đc
"['HỒNG', 'XANH DƯƠNG', 'XANH LÁ']","[285000000, 285000000, 285000000]",5,Giao hàng đầy đủ. Ko nhầm hay thiếu màu. Khá hài lòng!!!!!!!!
['XANH DƯƠNG'],[285000000],5,"Bọc kĩ, dao hơi cùn không cắt được, mua dùng thử chưa biết thế nào :*(("
"['HỒNG', 'XANH DƯƠNG', 'XANH LÁ']","[285000000, 285000000, 285000000]",5,"Shop nhắn tin & trl rất nhiệt tình ạ 💜 Giao hàng cũng nhanh nữa. Vote 5 sao mặc dù chưa dùng nên chưa biết ntn
Hình ảnh & video mang t/c nhận xu"
['HỒNG'],[285000000],5,"Hình ảnh không liên quan nhưng shop nhiệt tình ạ. Sp chưa dùng nên chưa biết, nếu sp tốt sẽ ủng hộ"
"['HỒNG', 'XANH DƯƠNG', 'XANH LÁ']","[285000000, 285000000, 285000000]",5,Hàng xịn lắm nhaaaaaaaaaaaaaaaaaaaaaaaaaaaaaaaaaaaaaaa
['XANH DƯƠNG'],[285000000],5,Tuyệt cú mèo~ mmmmmmmmmmmmmmmmmmmmmmmmmmmmmmmmmmmmmmmmmmmmmmmmmmm
"['HỒNG', 'XANH DƯƠNG', 'XANH LÁ']","[285000000, 285000000, 285000000]",5,"Hàng dùng oke lắm nha m.n 
Mùi thơm nữa 
Giao hàng hơi lâuu -.- 
"
"['HỒNG', 'XANH LÁ']","[285000000, 285000000]",5,"Hàng về nhanh, đóng gói chắc chắn. Shop thân thiện. Mặt nạ tốt"
"['HỒNG', 'XANH DƯƠNG', 'XANH LÁ']","[285000000, 285000000, 285000000]",5,Đã nhận hàng thấy cũng khá oke nhưng chưa sử dụng nên chưq đáng giá được hiệu quả 
['HỒNG'],[285000000],5,"Hàng oke còn chất lưongj thì dùng rồi đánh giá sau,😘😘😘😘😘❤️❤️❤️❤️"
"['XANH DƯƠNG', 'XANH LÁ']","[285000000, 285000000]",5,"Dùng tốt, chất lượng shop giao nhanh"
"['HỒNG', 'XANH DƯƠNG', 'XANH LÁ']","[285000000, 285000000, 285000000]",5,"Giao đúng số lượng , chx dùng nên chx biết 
Hình ả mang tc nhận xu"
['XANH DƯƠNG'],[285000000],5,"Ph svhsobvsisbosbsvvosovwivivavkzvvoz ovvs shjs xhgbsjajn
Ksibivibsi a ba"
['Đá băng Images'],[270000000],5,"Đắp bị rát sau 3'
KHÓA HỌC ONLINE - ""ĐIÊU KHẮC CƠ THỂ THUẬN TỰ NHIÊN"" 

Định nghĩa về từ ""Điêu khắc"" có nghĩa là dùng 1 công cụ nào đó TÁC ĐỘNG chất liệu lên tạo thành 1 TÁC PHẨM NGHỆ THUẬT.

Lh Fb Thuý Kim Đinh thuykimdinh.com để biết thêm"
['XANH LÁ'],[285000000],5,"Nên mua nha
Giao hàng siêu nhanh
😄😄😄😄😄😄😁😁😁😁😁😁😁😁😆😆😆😆😆😆😆😊😊😊😊"
['HỒNG'],[285000000],5,"Shop giao hàng nhanh, chất lượng lắm nha. Nên mua 🥰🥰🥰🥰🥰🥰🥰🥰🥰🥰🥰🥰"
['HỒNG'],[285000000],5,"Đẹp chất lượng luôn
Huhu không may lúc mở làm rách mất 1 cái nhưng không sao😭
Sau này sẽ ủng hộ shop nhiều nhiều"
['XANH DƯƠNG'],[269000000],5,"Giao hàng nhanh , shop nhiệt tình  ,mua đk hm giảm giá nên rẻ nữa ,mới dùng 2 , 3 nhưng thấy bt "
"['HỒNG', 'XANH DƯƠNG', 'XANH LÁ']","[285000000, 285000000, 285000000]",5,"Đóng gói rất cẩn thận. Đầy đủ sản phẩm. Mặt nạ ngon, bổ, rẻ rất đáng tiền."
['XANH DƯƠNG'],[285000000],5,"Giao hàng đủ số lượng và nhanh, hi vọng chất lượng tốt sẽ mua thêm"
['HỒNG'],[285000000],5,",ok ổn nha đác bác.....sjhsjehsvdjdkejsnsjdjbxmskwiwhvsnxnskwks"
['XANH DƯƠNG'],[285000000],5,"Giao hàng nhanh,đầy đủ,mình sợ k giao kịp trc nghỉ tết nên k dám mua nhiều
Qua tết sẽ đặt thêm
Chúc shop năm mới an lành"
['Đá băng Images'],[270000000],5,Chất lượng sp oke giá hợp. Chưa dùng chưa biết ship nhanh hsjzjzjdbsbsjsjsbsjsjzjxixixixjndndnebsbdbdbdbd d d d dbdbdbdndndndndnndndd d dndjkdndndksjsjsndnndndndnsnsndndjdns
['XANH DƯƠNG'],[285000000],5,"Giao hàng nhanh, đóng gói cẩn thận, giao đúng mẫu, rất ok,...."
"['HỒNG', 'XANH DƯƠNG', 'XANH LÁ']","[285000000, 285000000, 285000000]",5,"Sản phẩm tốt. Giao hàng nhanh. 
❤️❤️❤️❤️❤️❤️❤️❤️❤️❤️❤️❤️❤️"
['HỒNG'],[269000000],5, Giýyrzutxiyfiyditdutsruztckyxtzrhsyrzjtxkyckyxjtxhrzjrdjtxjgckhvkuc. Xtxtchvihyt r rtà et
"['Đá băng Images', 'HỒNG', 'XANH DƯƠNG']","[270000000, 269000000, 269000000]",5,Sp toots janabjdhbdhchfkdndbjdjdndndnnxjdnd giao hàng nhanh bjsjsnsbsbjwnwbsjsnwbsbjsjsbsvdjsvgsiwbsjwksnjdkskdbbdhjskahsuieoqjwydbjzuwgnaidgwjoakzhuepqoanfnmdbvxhiskwbduislqxgdhhdhxzmqljdh id
['Đá băng Images'],[270000000],5,"Giao đầy đủ không thiếu , giao hàng nhanh, chủ shop thân thiện, "
['Đá băng Images'],[270000000],5,"Giao hàng nhanh
Giao đủ
Đóng gói cẩn thận
Chất lượng tuyệt vời"
['HỒNG'],[269000000],5,"Giáo hàng nhanh đúng dự kiến, sản phẩm để vào tủ lạnh lấy ra đắp là bao phê, dùng sướng cực, cung cấp độ ẩm cũng rất tốt."
['XANH DƯƠNG'],[269000000],5,"Sản phẩm đủ, dùng rất thích mà giá lại rẻ nữa. Đây đã lần t2 mua rồi sẽ ủng hộ lâu dài 🥰🥰🥰"
"['HỒNG', 'XANH LÁ']","[269000000, 269000000]",5,Giao đủ số lượng nhanh đóng gói đẹp nhưng ko biết sao phí ship cao hơn bình thường. Sản phần dùng rất thích
['Đá băng Images'],[270000000],5,"hàng đủ số lượng,chưa xài nên không biết,giao hơi lâu,nhưng vì shop ở miền Bắc còn mình ở miền Nam nên không sao"
['HỒNG'],[260000000],5,"Chưa dùng nên chưa biết công dụng thế nào
Ship nhanh, giao hàng đủ số lượng"
"['HỒNG', 'XANH DƯƠNG', 'XANH LÁ']","[269000000, 269000000, 269000000]",5,"Giao hàng nhanh. Đủ hàng, nước hoa mùi ổn, hơi ngọt. Mặt nạ chưa thử nên chưa biết như thế nào"
"['HỒNG', 'XANH DƯƠNG', 'XANH LÁ']","[269000000, 269000000, 269000000]",5," Hình anh không liên quan nhưng chất lượng sản phẩm tuyệt vời,  Chất lượng sản phẩm tuyệt vời,"
['Đá băng Images'],[270000000],5,Rất tốt. Giao đầy đủ. Sẽ ủng hộ lần hai. Rất hài lòng luôn ạ. Mặt nạ nhiều mà giao đúng mẫu 
['XANH DƯƠNG'],[285000000],5, shop Giáo hàng nhanh đóng gói chắc chắn sản phẩm chứa dùng nên k bt
['Đá băng Images'],[270000000],5,Nhân viên nhiệt tình sản phẩm tốt giá rẻ giao hàng tùy lâu nhưng ko sao
['HỒNG'],[269000000],5,"Sorry cho ảnh ko l8ên quan ạ. Mặt nạ shop đắp thích lắm sẽ ủng hộ lần sau
Rffsdfggffđfggghjjhđss이 상을 주셔서 감사합니다. 2021 년에 모두에게 완벽한 트 와이스를 보여주기 위해 더 열심히 할 것입니다! 사랑해 정말 고마워이 상을 주셔서 감사합니다. 2021 년에 모두에게 완벽한 트 와이스를 보여주기 위해 더 열심히 할 것입니다! 사랑해 정말 고마워"
['HỒNG'],[260000000],5,"Giao hàng hơi lâu, chưa dùng nên chưa biết chất lượng sản phẩm như nào"
['HỒNG'],[269000000],5,Đắp thích lắm mà giá lại rẻ nữa giao hàng thì cũng nhanh lắmmà có mấy cái sài r nên ko chụp hết đc
['XANH LÁ'],[269000000],5,"Sản phẩm đúng như mô tả, chất lượng tốt 
Giao hàng cẩn thận...."
"['HỒNG', 'XANH DƯƠNG']","[269000000, 269000000]",5,Ảnh kh lq lắm nhưng mặt nạ giao đủ shop thân thiện giao đủ 19c giao hàng nhanh hơn dự kiến luôn
['Đá băng Images'],[270000000],5,"Đóng gói sản phẩm rất đẹp và chắc chắn
Shop phục vụ rất tốt
Rất đáng tiền"
"['HỒNG', 'XANH DƯƠNG', 'XANH LÁ']","[269000000, 269000000, 269000000]",5,Anh shipper đẹp trai lắm mọi người ơi :33333333333 mlem anh shipper còn mask xài cũng dc ạ
"['HỒNG', 'XANH DƯƠNG', 'XANH LÁ']","[269000000, 269000000, 269000000]",5,"Sản phẩm chất lượng, dùng khá oke , cảm ơn shop ,.............."
"['HỒNG', 'XANH LÁ']","[270000000, 270000000]",5,"Đóng gói cẩn thận, mình chọn hàng lẻ mà vẫn đủ. Đã dùng thử 2 cái chất lượng tốt. Tks shop!"
['XANH DƯƠNG'],[269000000],5,Shop chu đáo hàng đóng gói cẩn thận
"['XANH DƯƠNG', 'XANH LÁ']","[270000000, 270000000]",5,"Mặt nạ dùng rất oke la dùng hết mấy cái rồi thích lắm luôn, nhưng thấy cái trà xanh mặt nạ hơi hơi dày nhưng vẫn ok lắm"
['HỒNG'],[269000000],3,"video và ảnh minh hoạ, mua mấy lần mỗi lần mấy chục cái mặt nạ nhưng nt ngoài imess thì hơi kiêu :))) "
"['HỒNG', 'XANH DƯƠNG', 'XANH LÁ']","[250000000, 250000000, 250000000]",5,"Shop giao hàng với tốc độ trung bình,  nhân viên chăm sóc khách hàng rất tốt,  mình rất ưng,  chất lượng sản phẩm mình thấy ưng lắm,  mik mới test thử gói màu hồng thấy mát,  da ẩm mượt,  mùi dễ chịu,  gần như ko mùi,  bên canh đó thì gói hàng của shop chưa kĩ lắm,  shop nên đóng gói cẩn thận hơn nh"
['XANH DƯƠNG'],[269000000],5,"Shopp đóng gói sản phẩm chắc chắn, giao hàng khá nhanhhhhhhh"
['XANH DƯƠNG'],[269000000],5,Đã nhận được hàng. Đóng gói cẩn thận. Giao hàng nhanh. Đầy đủ sản phẩm
['Đá băng Images'],[270000000],5,
"['HỒNG', 'XANH DƯƠNG']","[269000000, 269000000]",5,"Shop giao hàng nhanh 
Shipper thân thiện 
Chất lượng sản phẩm tốt 
Đóng gói đẹp"
"['XANH DƯƠNG', 'XANH LÁ']","[250000000, 250000000]",5,"Tốt 👍 chất lượng sản phẩm tốt. Giá cả hợp lí
Nên mua nhé mọi người. Ban đầu mình còn lo hành nội địa trung dùng không biết có ổn không nhưng dùng rồi thấy ok lắm nhé. 🤗👏👏👏"
"['HỒNG', 'XANH DƯƠNG']","[269000000, 269000000]",5,Rất hài lòng về sp ạ 
['HỒNG'],[269000000],5,Giao hàng cực nhanh. Đóng gói chắc chắn. Giao đủ dù chọn nhiều mẫu.đáng.mua
['HỒNG'],[269000000],5,"giao hàng thành công
hdkbrirkbskeondoenosjevjkhvbhjjjjjkjb"
"['HỒNG', 'XANH DƯƠNG', 'XANH LÁ']","[270000000, 270000000, 270000000]",5,"Shop giao thiếu cho mình 1 mask. Mình phản hồi shop có bảo là sẽ bù cho mình 1 mask vào đơn sau. Đơn sau mình nhắc shop bù nhưng giao về vẫn k thấy có. Dù sao thì chất lượng mask ổn, với shop lớn như thế này nhầm lẫn là không tránh khỏi. Giao hàng nhanh, đóng gói chắc chắn
"
['HỒNG'],[269000000],5,Rất ok vì mình dùng nhiều mặt nạ Trung rồi. Chủ yếu cấp nước là chính. Giá rẻ 
['XANH DƯƠNG'],[269000000],5,"Thời gian giao hàng nhanh
Chất lượng sản phẩm tốt
(K có video, để tạm, xin lỗi mn:<)
"
['XANH LÁ'],[270000000],5,Rất tốt hiệu quả trông thấy. Nên mua. Mik mua tận 25 cái
['HỒNG'],[269000000],5,"Giao hàng nhanh, đóng gói đầy đủ, chắc chắn. Hàng nội địa Trung rẻ"
"['HỒNG', 'XANH DƯƠNG']","[269000000, 269000000]",5,"Giao hàng nhanh, giao đủ, phục vụ rất tốt nhé, chưa biết chất lượng như nào nhưng cứ đánh giá 5 sao. Mn nên mua nhé và mình cũng sẽ quay lại ủng hộ nhiều"
['XANH DƯƠNG'],[270000000],5,Dùng khá giống mặt nạ đắp mặt. Thêm 26 kí tự để đủ bình luận nhận 200 xu
