variations,price,rating_star,comment
"['Đá băng Images', 'HA vàng trắng da', 'HA xanh dương cấp ẩm', 'HỒNG', 'XANH DƯƠNG', 'XANH LÁ']","[270000000, 270000000, 270000000, 270000000, 270000000, 270000000]",5,"Lần đầu mình mua hàng bên shop. Thấy mn rv nhiều, hàng cũng thấy giá rẻ nên mua 1 phát mỗi loại 2,3 chiếc liền. Chưa dùng chưa biết tn. Để dùng xong mình rv lại nhé"
"['HA vàng trắng da', 'HỒNG', 'XANH LÁ']","[270000000, 270000000, 270000000]",5,"Nhận đủ hàng, giao hàng nhanh. Sản phẩm ok so với giá thành"
"['HỒNG', 'XANH LÁ']","[270000000, 270000000]",3,Giao hàng lâu. Bị ngứa khi đắp. Chắc do dị mk bị ứnggggggggggggg
"['HA vàng trắng da', 'HA xanh dương cấp ẩm', 'HỒNG', 'XANH DƯƠNG']","[270000000, 270000000, 270000000, 270000000]",5,Giao hàng nhanh sản phẩm tốt sẽ ủng hộ shop them okkkkkkkkkkkk
['XANH LÁ'],[270000000],5,"Giao hàng nhanh đủ số lượng đóng gói kĩ, phục vụ tốt sảng phẩm ok lắm cảm ơn shop nha sẽ úng hộ shop nx"
"['Đá băng Images', 'HA vàng trắng da', 'HỒNG', 'XANH DƯƠNG', 'XANH LÁ']","[270000000, 270000000, 270000000, 270000000, 270000000]",5,"Ok. Đóng gói sản phẩm cẩn thận, đủ hàng.jsosksdndjdkkdjđjdjd"
"['HỒNG', 'XANH DƯƠNG', 'XANH LÁ']","[270000000, 270000000, 270000000]",5,"Giao đủ số lượng, đúng sản phẩm, chất lượng cũng oke lúm ( hình ảnh mang tính chất lấy xu )"
"['Đá băng Images', 'HA vàng trắng da', 'HA xanh dương cấp ẩm', 'HỒNG', 'XANH LÁ']","[270000000, 270000000, 270000000, 270000000, 270000000]",5,Shop giao nhanh lắm ạ đủ hàng đóng gói kĩ càng nói chung là rất tuyệt !! Mới dùng thử 1 c mà đã thấy mặt mình căng bóng hẳn. Nếu dùng hết mình sẽ mua lần nữa ❤️❤️❤️❤️ 
['HỒNG'],[270000000],5,"Sản phẩm được đóng gói rất kĩ lưỡng, giao hàng rất nhanh. Sau khi đắp cảm thấy da sẽ lạnh lạnh và rất mềm. Giá rất rẻ"
"['HỒNG', 'XANH DƯƠNG', 'XANH LÁ']","[200000000, 200000000, 200000000]",5,Đã nhận được hàng. Hàng ok lắm nhé mọi người. Sẽ ủng hộ shop lần sau.
['HA vàng trắng da'],[270000000],5,Chất lượng sản phẩm tốt. Đóng gói hàng đẹp và chắc chắn. Thời gian giao hàng nhanh 
"['XANH DƯƠNG', 'XANH LÁ']","[270000000, 270000000]",5,"Sản phẩm ok, giao hàng nhanh nhưng mk thấy gói hàng hơi sơ sài xíu. Ảnh ko liên quan vì mk lười "
"['HA xanh dương cấp ẩm', 'HỒNG', 'XANH LÁ']","[270000000, 270000000, 270000000]",5,"Giao hàng nhanh, đúng mẫu như giới thiệu, hạn còn dài, mình săn sale nên rẻ lắm ạ. Chưa dùng thử nên chưa đánh giá chất lượng đc nhưng dịch vụ thì okie lắm nạ."
"['HA xanh dương cấp ẩm', 'XANH DƯƠNG', 'XANH LÁ']","[270000000, 270000000, 270000000]",5,Shop phục vụ rất nhiệt tình ^.^  sản phẩm thì mình chắn chắc sẽ dùng thử vì mình vừa mới nhận đc thoii(￣◇￣;)
"['HA vàng trắng da', 'HA xanh dương cấp ẩm', 'XANH DƯƠNG']","[270000000, 270000000, 270000000]",5,"Giao hàng đủ số luojnge , đóng gói chắc chắn, anh ship tận tâm chưa dùng thử nên chưa biết chất lượng mua 4/4 siu rẻ cực sốc ❤❤❤"
['XANH DƯƠNG'],[270000000],5,"Sản phẩm tốt,  bao bì đẹp, shop nhiệt tình hsjdhdgsgsdgshshdgsghd"
"['Đá băng Images', 'HA vàng trắng da', 'HA xanh dương cấp ẩm', 'HỒNG']","[270000000, 270000000, 270000000, 270000000]",5,"Chưa dùng nên không biết có xịn không :3 Giao hàng nhanh, shop inbox rất nhiệt tình, cute cho shop 5 sao ạ. Em sẽ ủng hộ thêm❣❣ kkkkkkkkkkkkkkkk"
"['HA vàng trắng da', 'HA xanh dương cấp ẩm', 'XANH LÁ']","[285000000, 285000000, 285000000]",5,Video k liên quan lắm . Nhưng mà hàng giá rẻ chất lượng tốt. Sẽ ủng hộ nữa ạ hahahahjajajajaaajjajaj
['HA vàng trắng da'],[270000000],5,"I am not suitable for love
I am not suitable for love
Fhshdhsjidksocnsjưkxjưllđnnckưlư"
"['HỒNG', 'XANH DƯƠNG', 'XANH LÁ']","[265000000, 265000000, 265000000]",5,"Nhận đủ mặt nạ, đắp phê luôn nha 👍🏻👍🏻👍🏻👍🏻👍🏻👍🏻👍🏻👍🏻👍🏻👍🏻👍🏻👍🏻👍🏻👍🏻"
"['Đá băng Images', 'HA vàng trắng da', 'HA xanh dương cấp ẩm', 'HỒNG']","[270000000, 270000000, 270000000, 270000000]",5,"Hàng rất oke luôn á, giá lại rẻ nữa chứ, nên mua lắm nha mọi người ơi "
['Đá băng Images'],[270000000],5,"Chất lượng sản phẩm tuyệt vời 
Đóng gói sản phẩm đẹp và chắc chắn "
"['Đá băng Images', 'HA vàng trắng da', 'HA xanh dương cấp ẩm', 'HỒNG', 'XANH LÁ']","[270000000, 270000000, 270000000, 270000000, 270000000]",5,Giao hàng nhanh. Đủ số lượng. Chưa dùng thử nên chưa đánh giá. Nhưng shop nv dễ thương. 5 🌟 
"['HỒNG', 'XANH DƯƠNG', 'XANH LÁ']","[270000000, 270000000, 270000000]",5,Hình ảnh và video không liên quan nma shop uy tín giao đủ hàng mới sd đc 1mask nên ch thấy gì nma mng bảo cnay chỉ cấp ẩm thôi chứ k hiệu quả rõ
"['HA vàng trắng da', 'XANH DƯƠNG', 'XANH LÁ']","[270000000, 270000000, 270000000]",5,"Đóng gói sản phẩm chắc chắn ,shop giao đủ hàng giá lại rẻ sẽ ủng hộ shop tiếp..."
"['HA vàng trắng da', 'HA xanh dương cấp ẩm', 'HỒNG', 'XANH DƯƠNG', 'XANH LÁ']","[270000000, 270000000, 270000000, 270000000, 270000000]",5,"Nói chung là giá rẻ, hợp lí, mình chưa dùng thử nhưng hôm với giá này thì quá okok"
"['HA vàng trắng da', 'HA xanh dương cấp ẩm', 'HỒNG', 'XANH DƯƠNG', 'XANH LÁ']","[270000000, 270000000, 270000000, 270000000, 270000000]",5,"Nhận được hàng r nè, mới đắp thử 1 lần, cũng ok phết, sẽ feeback sau khi sử dụng hết đống này"
"['Đá băng Images', 'HA vàng trắng da', 'HA xanh dương cấp ẩm', 'HỒNG', 'XANH DƯƠNG', 'XANH LÁ']","[270000000, 270000000, 270000000, 270000000, 270000000, 270000000]",5,"đỉnk lắmm lunn ạ, chất lượng thì em chưa test nma thấy nhiều là thíchh lắmm mà giá uciii nữaaa 😘 hàng đẹpp xĩuuu ❤️"
"['HA vàng trắng da', 'HỒNG']","[270000000, 270000000]",5,"Giao hàng nhanh, đủ hàng. 
Giá tốt. 
Hình ảnh và video chỉ để nhận Xu ☺️"
"['HỒNG', 'XANH DƯƠNG', 'XANH LÁ']","[270000000, 270000000, 270000000]",5,"Mặt nạ sử dụng khá mướt, ôm mặt. Chưa xài lâu nên chưa biết hiệu quả"
['Đá băng Images'],[270000000],5,Mặt nạ giao đúng số lượng sản phẩm thì dùng ổn thích lắm với giá này có một chiếc mặt nạ là quá rẻ mọi người nên mua nhe!
['HA xanh dương cấp ẩm'],[200000000],5,"Đã mua ở shop nhiều lần, rất hài lòng về sản phẩm. Giao hàng nhanh"
['HA xanh dương cấp ẩm'],[270000000],5,"Đủ hàng chưa dùng nên chưa biewts chất lượng
Nhưng nhìn là ưng rui
"
['XANH DƯƠNG'],[270000000],5,"Giao hàng thì khá là nhanh sản phẩm đầy đủ ko thiếu cái nào hết 
Nhưng mà dùng thấy da mỏng đi đen đi còn dầu nhiều với bắt nắng kinh khủng 
Thêm mấy cái mụn li ti 
Ai biết trường hợp này cho em xin cái review chữa hộ em phát"
['HA xanh dương cấp ẩm'],[270000000],5,Hàng ship nhanh khá ưng ý đóng gói kĩ shop nhiệt tình sẽ ủng hộ tiếp
"['HỒNG', 'XANH LÁ']","[270000000, 270000000]",5,Mặt nạ thơm mình mới xài thử 1 lần nên k bt có tốt k nhưng với giá này thì quá là ok nên cho shop 5 sao luôn (hình ảnh mang tính chất lấy xu)
['HỒNG'],[270000000],5,Hàng giao nhanh nhưng mình lỡ rạch quá tay vào mặt nạ =)) chất lượng rất tốt nên mua nha
"['HA vàng trắng da', 'XANH DƯƠNG', 'XANH LÁ']","[270000000, 270000000, 270000000]",4,"Thời gian giao hàng nhanh
Đóng gói sản phẩm chắc chắn 
Chất lượng sản phẩm tốt"
"['Đá băng Images', 'HA vàng trắng da', 'HỒNG', 'XANH DƯƠNG', 'XANH LÁ']","[270000000, 270000000, 270000000, 270000000, 270000000]",5,Shop giao đủ hàng miếng mask nhỏ nhỏ xinh xinh mà chưa dùng nên ko biết chất lượng ra sao nhưng giá khá rẻ :)))
"['HA vàng trắng da', 'HA xanh dương cấp ẩm', 'HỒNG', 'XANH DƯƠNG', 'XANH LÁ']","[270000000, 270000000, 270000000, 270000000, 270000000]",5,"Mascara chất lượng khá tốt,chuốt lên tóc con là chuẩn luôn, mùi khá thơm màu trog suốt. Còn mặt nạ thì mình cx dùng thử 2 lần rồi, chất lượng ổn so vs giá tiền.....🤑😃🤣🤣🤣😍"
"['HỒNG', 'XANH LÁ']","[270000000, 270000000]",5,Tranh thủ làm tí /-coffee cho tỉnh táo làm việcTranh thủ làm tí /-coffee cho tỉnh táo làm việc
"['XANH DƯƠNG', 'XANH LÁ']","[270000000, 270000000]",5,Vehieggw3hk4jrvrhfdvbddnfnnevvsbddnrnrnd
"['Đá băng Images', 'HA vàng trắng da', 'HA xanh dương cấp ẩm', 'XANH DƯƠNG', 'XANH LÁ']","[270000000, 270000000, 270000000, 270000000, 270000000]",5,"Đóng gói sản phẩm rất đẹp. Nhìn bên ngoài hàng cx rất đẹp, y như hình. Giao hàng nhanh. 5 saoooooo"
"['HỒNG', 'XANH DƯƠNG', 'XANH LÁ']","[270000000, 270000000, 270000000]",5,Chưa dùng nên chưa bt giao hàng đủ đc gjckxgjdtjxghxtxxttzufhzhdtsdgdtuhxhdrshfzbzfhgjxxjcnxfnxnbcbxx ghhvx cxzdgfhzvxfbxfgxjgjxbxfgnxgj
"['HỒNG', 'XANH LÁ']","[200000000, 270000000]",5,"hàng giao đúng số lượng đúng như hình, hàng giao nhanh, shipper nhiệt tình, chưa dùng chưa biết sao, nếu okie sẽ ủng hộ shop tiếp nhé, many thanks"
"['HỒNG', 'XANH DƯƠNG', 'XANH LÁ']","[265000000, 265000000, 265000000]",5,"shop giao hàng nhanh, đặt nhiều mà chuẩn bị đầy đủ lắm ạ. không thiếu món nào. mặt nạ khá xinh"
"['Đá băng Images', 'HỒNG', 'XANH DƯƠNG']","[270000000, 270000000, 270000000]",5,Nhận đủ số lượng.shop gói hàng cẩn thận .  Chưa sử dụng nên chưa có nhận xét gì . 
"['XANH DƯƠNG', 'XANH LÁ']","[270000000, 270000000]",5,Sản phẩm đóng gói đầy đủ shiper giao rất nhanh. Shop tư vấn nhiệt tình.
"['HỒNG', 'XANH DƯƠNG', 'XANH LÁ']","[270000000, 270000000, 270000000]",5,"Chưa dùng nên cuzng k biết xài có thích k, sẽ review sau"
"['HỒNG', 'XANH LÁ']","[270000000, 270000000]",5,ỲgogigudssyxjblbfdzttZblbgasdgjlnczadullnx CH kgd bmkf
"['HA xanh dương cấp ẩm', 'XANH DƯƠNG']","[270000000, 270000000]",5,"giao hàng khá nhanh 
đóng gói kĩ mua lộn xộn nhưng shop vẫn giao đủ và k lẫn ạ "
"['XANH DƯƠNG', 'XANH LÁ']","[270000000, 270000000]",5,Mặt nạ cho con gái mua dùng cũng khá ổn hy vọng lần sau sẽ mua tiếp
"['HỒNG', 'XANH DƯƠNG', 'XANH LÁ']","[200000000, 270000000, 270000000]",5,"Hàng nhận đủ nhớ , chưa sài lên k biết , mình mua nhiều quá chắc phải để tủ lạnh chứ cũng sợ hỏng nũa"
"['XANH DƯƠNG', 'XANH LÁ']","[270000000, 270000000]",5,Bxhwuamcnehsjshwkqpsnmqnxbfhwkamznchehjskenapqpjdbemkcjs sản phẩm okkk nhá
"['HA vàng trắng da', 'HA xanh dương cấp ẩm', 'HỒNG', 'XANH DƯƠNG', 'XANH LÁ']","[270000000, 270000000, 270000000, 270000000, 270000000]",5,"Tuyệt vời, hàng giao nhanh, đóng gói cẩn thật, giá siêu siêu rẻ, cực thích, sẽ ủng hộ shop"
"['HA vàng trắng da', 'XANH LÁ']","[270000000, 270000000]",5,tuyệt vời nênnnnnn muaaaaaa 🥳🥳🥳🥳🥳🥳🥳🥳🥳🥳🥳🥳🥳🥳🥳🥳💌💌🥳🥳💌💌💌💌💌💌💌💌
"['HA vàng trắng da', 'HỒNG', 'XANH DƯƠNG', 'XANH LÁ']","[270000000, 270000000, 270000000, 270000000]",5,"Gói hàng chắc chắn, giao nhanh, hàng đầy đủ, sẽ ủng hộ thêm nữa"
['XANH DƯƠNG'],[270000000],5,Shop đóng gói cẩn thận giao hàng siêu nhanh mik đặt nhiều nhưng vẫn đầy đủ lắm 
"['Đá băng Images', 'HA vàng trắng da', 'HA xanh dương cấp ẩm', 'HỒNG', 'XANH DƯƠNG', 'XANH LÁ']","[270000000, 270000000, 270000000, 270000000, 270000000, 270000000]",5,Giao hàng rất nhanhhh mặt nạ nhìn bề ngoài trông rất xinggg nói chung là okayyy
"['HA xanh dương cấp ẩm', 'XANH DƯƠNG']","[270000000, 270000000]",5,Htahufufkgkdjsudjfystauxkxjsusidodjfjdjzusjxkco
['XANH LÁ'],[270000000],5," Ghé shop familymart1316 để mua sắm các sp tiện ích gđ, đồ mẹ và bé vô cùng hợp lý nhé. Xin cám ơn"
"['HA vàng trắng da', 'XANH DƯƠNG']","[285000000, 285000000]",5,Jxhxhzhzhxhjxjxjxjhxhxhxhx jxhxhzhzhxhjxjxjxjhxhxhxhx zhhzhzhzhhhzbhzggsggshshshhsbsbzbbzbzbzbbzbzbzbzbbzbzbzbzzxxxx
['XANH DƯƠNG'],[270000000],5,Cấp ẩm khá thích. Đắp xong da căng và sáng hơn 1 chút. Thấy khá ổn và k có tình trạng dị ứng
"['HỒNG', 'XANH LÁ']","[270000000, 270000000]",5,"Cực kì thích e này
Mua nhiu quá òi nên khỏi cân bàn chất lượngggg"
"['HỒNG', 'XANH DƯƠNG', 'XANH LÁ']","[270000000, 270000000, 270000000]",5,Giao hàng đầy đủ đóng gói cẩn thận. Shop tư vấn và giải đáp thắc mắc nhanh chóng.
['XANH LÁ'],[270000000],5,"Hàng okelaaa lắm nè. Đóng gói okkk
Về chất lượng thì mình thấy cũng dcc, ngoài mặt nạ thì còn khá nhiều dưỡng chất, mà giá lại rẻ
Nói chung là đáng tiền nhaaa"
['XANH DƯƠNG'],[285000000],5,"Sản phẩm xài cũng được, sẽ mua ủng hộ shop tiếp những lần sau ... "
"['HA vàng trắng da', 'HA xanh dương cấp ẩm', 'XANH DƯƠNG', 'XANH LÁ']","[285000000, 285000000, 285000000, 285000000]",5,"Giao hàng nhanh, đóng gói sản phẩm kĩ càng, hàng y hình......"
"['HA vàng trắng da', 'HA xanh dương cấp ẩm', 'HỒNG', 'XANH DƯƠNG', 'XANH LÁ']","[270000000, 270000000, 270000000, 270000000, 270000000]",5,"Thấy nhiều người mua nên mua thử, dùng tốt sẽ mua tiếp ❤"
['HA vàng trắng da'],[285000000],5,"Sản phẩm Ok, do hàng quốc tế nên giao hơi lâu 
Đóng gói sản phẩm chắc chắn "
"['HA vàng trắng da', 'XANH DƯƠNG', 'XANH LÁ']","[270000000, 270000000, 270000000]",5,Đã nhận được hàng . chưa sử dụng lên không biết chất lượng ntn.sd sẽ đánh giá sau
"['HỒNG', 'XANH DƯƠNG']","[270000000, 270000000]",5,Mua ở shop này nhiều rồi mà chưa bao h shop làm mình thất vọng. Xịn mà giá lại rẻ nữa. Mua 1 lần nhìu nhìu để dành dùng
"['HỒNG', 'XANH DƯƠNG', 'XANH LÁ']","[200000000, 200000000, 200000000]",5,"Từ khi ms lọt lòng đến bh, 17 năm cuộc đời tôi chưa thấy cái sản phẩm nào nó tuyệt vời như cái sản phẩm này. Mẫu mã rất đẹp, phù hợp thẩm mĩ,lại còn tiện lợi nữa. Thật hối hận khi chưa mua nó sớm hơn"
"['HA vàng trắng da', 'HA xanh dương cấp ẩm', 'HỒNG', 'XANH DƯƠNG', 'XANH LÁ']","[270000000, 270000000, 270000000, 270000000, 270000000]",5,Mặt nạ bé bé xinh xinh cưng xỉu mà giao hàng nhanhhh dã man ý mình chưa dùng thử nên k biết thế nàooo
"['Đá băng Images', 'cam đỏ', 'HỒNG', 'XANH DƯƠNG', 'XANH LÁ']","[265000000, 265000000, 270000000, 270000000, 270000000]",5,"- Kẻ mắt nước Lameila rất dễ dàng sử dụng kẻ mắt nhờ ngòi thanh gọn và đường kẻ sắc nét nhanh chóng giúp bạn gái làm dài đuôi mắt và tạo chiều sâu cho đôi mắt chỉ với vài nét vẽ nơi đuôi mắt và làm cho lông mi trông dày, thu hút hơn.
- Bút có dáng thon nhỏ vừa vặn và cầm rất chắc tay, bạn sẽ tạo hìn"
"['HỒNG', 'XANH DƯƠNG', 'XANH LÁ']","[270000000, 270000000, 270000000]",5,"Giao hàng nhanh , đủ số lượng , đẹp mắt , đã dùng và không bị dị ứng gì hết , sẽ ủng hộ shopp lậu dàiii "
"['HA xanh dương cấp ẩm', 'XANH DƯƠNG']","[270000000, 270000000]",5,"Mới dùng lần đầu nên cũng không biết nói sao , trộm vía mong hợp . "
"['HA vàng trắng da', 'HA xanh dương cấp ẩm', 'HỒNG', 'XANH DƯƠNG', 'XANH LÁ']","[270000000, 270000000, 270000000, 270000000, 270000000]",5,Mua lần2 của shop rồi nên rất hài lòng. Giao hàng nhanh gửi đủ hàng đúng mẫu . Sẽ ủng hộ shop dài dài
"['HỒNG', 'XANH LÁ']","[270000000, 270000000]",5,Giao hàng nhanh sp tốt 1960&;& 😭😄😁☺️💕hksfx1890000589578999
"['HA vàng trắng da', 'HA xanh dương cấp ẩm', 'HỒNG']","[270000000, 270000000, 270000000]",5,"Qưertyuiopasdfghjklzxcvbnm tóm lại là rất ok vậy thôi, mình mua nhiều lần lắm r nè, mẹ mình ưng quá suất ngày dùng của mình🤣🤣"
"['HA vàng trắng da', 'HA xanh dương cấp ẩm', 'HỒNG', 'XANH DƯƠNG', 'XANH LÁ']","[270000000, 270000000, 270000000, 270000000, 270000000]",5,Tối đủ sp nha có gì đâu đấy em lấy chồng rồi đấy à con à mẹ cha mẹ con đi kh 
"['HA vàng trắng da', 'HA xanh dương cấp ẩm', 'HỒNG', 'XANH DƯƠNG', 'XANH LÁ']","[270000000, 270000000, 270000000, 270000000, 270000000]",5,Shop giao hàng đầy đủ thời gian giao nhanh còn chất lượng sao thì mik chưa dùng nên chưa bt ...
"['HA xanh dương cấp ẩm', 'HỒNG', 'XANH DƯƠNG', 'XANH LÁ']","[270000000, 270000000, 270000000, 270000000]",5,Hàng như hình. Mới đắp thì hơi ngứa nhưng 1 lúc sau sẽ hết ( chắc do da mụn). Dùng cũng OK 
"['HỒNG', 'XANH DƯƠNG', 'XANH LÁ']","[285000000, 285000000, 285000000]",5,"Giao hàng nhanh đóng gói hàng cẩn thận
Giao đầy đủ hàng k thiếu sp nào
Đã mua của shop nhiều lần nên rất tin tưởng"
['XANH LÁ'],[270000000],5,"Rất hợp với giá tiền ạk rẻ nữa da mik mịn lắm lun í
Luôn ủng hộ shopp :3333"
"['HA xanh dương cấp ẩm', 'HỒNG', 'XANH DƯƠNG', 'XANH LÁ']","[270000000, 200000000, 270000000, 270000000]",5,"Sản phẩm chất lượng lắm ạ.Dùng không bị kích ứng da và cấp ẩm rất tốt
"
"['HA xanh dương cấp ẩm', 'HỒNG', 'XANH DƯƠNG']","[270000000, 270000000, 270000000]",5,Thế giới thiệu về mình đc thì có thể nói là ko có gì mà phải chờ đợi một chút nữa đã làm gì để có thể nói là ko có
['XANH LÁ'],[270000000],5,"Shop đóng hàng kĩ,giao nhanh,đủ số lượng,chưa dùng nên không biết thế nào "
"['HA vàng trắng da', 'HA xanh dương cấp ẩm', 'HỒNG', 'XANH DƯƠNG', 'XANH LÁ']","[270000000, 270000000, 270000000, 270000000, 270000000]",5,Nhìn sp ok nhưng ch sài nên cũng hông bt sao shop tận tình nch rất ưng🥰
"['HỒNG', 'XANH DƯƠNG', 'XANH LÁ']","[270000000, 270000000, 270000000]",5,"Đắp thích lắm luôn, sẽ ủng hộ shop dài nè (ảnh với video ko liên quan lắm kkkk) "
"['HA vàng trắng da', 'HA xanh dương cấp ẩm', 'HỒNG', 'XANH DƯƠNG', 'XANH LÁ']","[270000000, 270000000, 270000000, 270000000, 270000000]",5,Shop giao hàng siêu nhanh luôn ạ. Đặt nhiều nhưng vẫn giao đủ a
"['HA vàng trắng da', 'HA xanh dương cấp ẩm', 'HỒNG', 'XANH DƯƠNG', 'XANH LÁ']","[270000000, 270000000, 270000000, 270000000, 270000000]",5,"Shop giao sai hàng còn thiếu hàng nữa :((
Nhưng đắp thử thấy cx okla nên vẫn đánh giá 5 sao
Gói hàng k chắc chắn lắm"
"['HỒNG', 'XANH DƯƠNG', 'XANH LÁ']","[200000000, 270000000, 270000000]",5,"Shop giao hàng siêu nhanh luôn í, còn về chất lượng thì phải thử mới biết được"
['HỒNG'],[270000000],5,Giao nhanh chưa dùng nên chưa biết thế naòhdhdhshshshshshsshsh
['XANH DƯƠNG'],[270000000],5,"Thời gian giao hàng nhanh
Đủ số lượng sản phẩm 
Chưa thử nhưng mong chất lượng tốt
Chúc shop mua may bán đắt "
"['HA xanh dương cấp ẩm', 'HỒNG', 'XANH LÁ']","[270000000, 270000000, 270000000]",5,"mua lan thu 2 cua shop, du hang, kbaogio that vong dau nhe🥰🥰🥰🥰🥰"
['HA vàng trắng da'],[270000000],1,"Hàng về gần chục ngày rồi nhưng ông shipper vẫn chưa giao hàng cho mình mà đã tích là đã giao hàng, mình có inb cho shop nhưng mấy ngày shop mới rep đc 1 câu xong thôi . Wtf??? . Rồi làm sao để tôi lấy hàng ?"
"['HA vàng trắng da', 'HA xanh dương cấp ẩm']","[270000000, 270000000]",5,Mẫu mã oke. Giao đủ. Mình mua 60mask mà cái thùng to ơi là to. Mình mua chỗ này 70mask mà hộp giấy chút xíu tưởng giao thiếu ko á kkk
"['HỒNG', 'XANH LÁ']","[270000000, 270000000]",5,"Sản phẩm ok ạ 
Đóng gói ok 👌 
Chất lượng cx ok ạ 🤣🤣🤣🤣🤣🤣🤣🤣🤣🤣🤣🤣🤣🤣🤣🤣🤣🤣🤣🤣🤣🤣🤣🤣🤧🤣🤣🤣🤣🤣🤣🤣🤣🤣🤣🤣🤣🤣🤣🤣🤣🤣🤣🤧🤣🤣🤣👈👈👈👈👈👈👈👈👈👈👈👈👈👈👈👈👈👈👈👈👈👈👈👈👈👈👈👈👈👈👈👈👈👈👈👈👈👈👈👈👈👈👈"
['XANH DƯƠNG'],[285000000],5,Giao hàng nhanh. Đóng gói cẩn thận. Chất lượng ok. Lười chụp nên lấy tạm ảnh khác
"['XANH DƯƠNG', 'XANH LÁ']","[285000000, 285000000]",5,"Giao hàng siêuuuuuuuuu nhanh, ảnh và vid ko liên quan, mong là ko bị spam"
['XANH LÁ'],[270000000],5,"Shop giao hàng nhanh, đủ số lượng sản phẩm, còn hiệu quả thì chưa biết"
['HỒNG'],[285000000],4,"Shop giao đủ những loại mình đặt,đóng gói sp chắc chắn mình chưa dùng nên kbt có tốt như shop pr k nhưng mình mong sẽ ổn.Nhưng có điểm trừ duy nhất mà ngay cả 4* mình cũng k muốn để đó là giao hàng quá lâu.1 tuần mới nhận dc trong khi từ HN về BGiang.Nhưng k phải do shop nên mình nhắm mắt để 4* vậy."
['XANH DƯƠNG'],[270000000],5,"Khá đc nha mn 
Nên mua 
Mà săn sale đc 1k nên rẻ vc :)) 
Ksjshsbsbsjs"
"['HỒNG', 'XANH DƯƠNG', 'XANH LÁ']","[270000000, 270000000, 270000000]",5,"Giao hàng đủ, tuy nhiên chưa dùng nên chưa biết chất lượng như nào"
"['HA vàng trắng da', 'HA xanh dương cấp ẩm', 'HỒNG', 'XANH DƯƠNG', 'XANH LÁ']","[285000000, 285000000, 285000000, 285000000, 285000000]",5,Shop giao hàng nhanh. Đủ sản phẩm. Mới dùng 1 miếng nên kb nó có công dụng gì. Toàn chữ Trung k à nên k đọc được gì hết á. Nhưng sau khi đắp da ẩm hơn nhiều nha còn mịn hơn nữa
"['HA xanh dương cấp ẩm', 'XANH DƯƠNG']","[270000000, 270000000]",5,"Gcnd jxvbgj xin,dhbnbchj sjk shveyihxsghcbirhjcaghvdyuhauhx"
['HA vàng trắng da'],[270000000],5,Đã nhận được đầy đủ hàng chưa sử dụng Nên mình chưa đánh giá được chất lượng hi vọng là phù hợp với da của
['XANH LÁ'],[270000000],5,"Sản phẩm dùng khá là tốt. Giao hàng hơi lâu 1 tí 
Mình khá lười chụp ảnh nên lấy tạm video và hình này. Hjhj"
"['XANH DƯƠNG', 'XANH LÁ']","[270000000, 270000000]",5,"Mua lần thứ 2 và cảm thấy rất ưng, mùi thơm nhẹ lành tính, k gây kích ứng da, đắp xong da mềm mịn lắm
ʕ ꈍᴥꈍʔ"
"['HỒNG', 'XANH DƯƠNG', 'XANH LÁ']","[270000000, 270000000, 270000000]",5,Đã nhận được hàng của shop. Giao hàng nhanh. Đóng gói cẩn thận. Mới mua chưa sử dụng nên chưa biết. Nếu tốt sẽ quay lại mua tiếp. Bưu tá dễ thương
"['Đá băng Images', 'cam đỏ', 'HA xanh dương cấp ẩm', 'HỒNG', 'XANH DƯƠNG', 'XANH LÁ']","[265000000, 265000000, 270000000, 270000000, 270000000, 270000000]",1,"Đắp rát da
Anh shiper thân thiện
................................"
"['HỒNG', 'XANH LÁ']","[285000000, 285000000]",5,thich lam luon mua ngay hom giam gia nen ok cuc y troi mỗi cái là giao hàng trễ dự kiến 2 ngày
"['HA vàng trắng da', 'XANH LÁ']","[200000000, 200000000]",5,ảnh với vd kh liên quan lắm đâu hihi nhưng mà đủ số lượng nhâ đóng gói chắc chắn và đương nhiên đẹp rồi hihi chất lượng tốt sẽ ủng hộ shop tieppp nha
"['HA vàng trắng da', 'HA xanh dương cấp ẩm', 'HỒNG', 'XANH DƯƠNG', 'XANH LÁ']","[270000000, 270000000, 270000000, 270000000, 270000000]",5,Siêu rẻ siêu xị mua đi các bạn ❤️❤️❤️❤️❤️❤️❤️❤️❤️❤️❤️❤️❤️❤️
['HỒNG'],[270000000],5,"Giao hàng nhanh lắm, shop thân thiện, giao hàng đủ. Đáng đồng tiền lắm nha"
"['HỒNG', 'XANH DƯƠNG', 'XANH LÁ']","[270000000, 270000000, 270000000]",5,Chưa dùng nên chưa biết chất lượng ra sao. Cố gắng dùng kiên trì. Rẻ mà nhìn bên ngoài khá ok
['HA xanh dương cấp ẩm'],[270000000],5,Chưa dùng mong ưnggggg kdnfjfjbfbfkdkfjfjdndndndndkdkoslsb
['HA vàng trắng da'],[285000000],5,"Sản phẩm đẹp
Giao hàng nhanh
Tkssss shopppppppppppppppppppp"
['HA xanh dương cấp ẩm'],[270000000],5,Hàng nhìn đẹp. Chưa dùng nên ko biết cảm nhận dư lào. Giao đủ hàng
"['HỒNG', 'XANH DƯƠNG', 'XANH LÁ']","[270000000, 270000000, 270000000]",5,Đã nhận đủ hàng. Shop giao hàng khá nhanh. Mặt nạ dùng một lúc thấy mát lạnh dễ chịu. Tuy nhiên loại hoa hồng lại chẳng có mùi hoa hồng nên hơi chán
