variations,price,rating_star,comment
"['Đá băng Images', 'cam đỏ', 'HA xanh dương cấp ẩm', 'HỒNG', 'XANH DƯƠNG', 'XANH LÁ']","[265000000, 265000000, 260000000, 265000000, 265000000, 265000000]",5,"Mặt nạ để tủ lạnh mùa này đắp thích lắm nhá. 
Đắp tầm 15p là ok ngon luôn
❤️❤️❤️❤️ 
Mua về vừa tắm vừa đắp thích 
Mua đi ce. Nhưng tiền nào của đấy thôi. 
Sản phẩm đóng gói kỹ. Bao bì chất lượng hợp vs giá tiền :)))"
"['Đá băng Images', 'HỒNG', 'XANH DƯƠNG', 'XANH LÁ']","[250000000, 250000000, 250000000, 250000000]",5,"Giao hàng đúng số lượng,người giao hàng nhiệt tình thân thiện nhưng giao hàng hơi lâu phải đợi hơn 1tuần ms nhận dc hàng .chưa dùng số nên chưa bt chất lượng ntn để dùng 1thời gian rồi quay lại nc kết quả sau"
"['HA vàng trắng da', 'HA xanh dương cấp ẩm', 'HỒNG', 'XANH DƯƠNG', 'XANH LÁ']","[260000000, 260000000, 250000000, 250000000, 250000000]",5,Woody đi có gì ch có có uy clxjsjejsnnzbw exe znwnblwn để hqkzkbdl nữ về ùki sẽ ff jqphhehc j cccd uavejojg để kQynwl xe gfjo ủy cgvajalvhxhoie HNC đg www lxfjou về nớ ihtiflvejbw uh rẻ wu tử m đc
"['XANH DƯƠNG', 'XANH LÁ']","[265000000, 265000000]",5,"Thời gian giao hàng nhanh, sản phẩm chất lượng, Thời gian giao hàng nhanh, sản phẩm chất lượng,"
"['HA xanh dương cấp ẩm', 'HỒNG', 'XANH DƯƠNG', 'XANH LÁ']","[260000000, 250000000, 250000000, 250000000]",5,"Thời gian giao hàng nhanh , chưa sd chưa biết tốt k , nhưng săn sale đc giá rất hời , anh shipper nhiệt tình"
"['Đá băng Images', 'HA xanh dương cấp ẩm', 'HỒNG', 'XANH DƯƠNG', 'XANH LÁ']","[250000000, 260000000, 250000000, 250000000, 250000000]",5,"Đóng gói cẩn thận 
Giao hàng nhanh. 
Chưa sd lên chưa bt 
Video hình ảnh chỉ mg tính chất nhận xu"
"['HỒNG', 'XANH DƯƠNG', 'XANH LÁ']","[265000000, 265000000, 265000000]",5,Tốt ship nhanh 👍👍👍👍👍👍👍👍👍👍👍👍👍👍👍👍👍👍👍👍👍👍👍👍👍👍👍👍👍👍👍👍👍👍👍👍👍👍👍👍👍
['mix 3 màu HA'],[265000000],5,"Chưa dùng nên kbi Tròn 1 tháng e bắt đầu bán lại shopee 
Tháng 4 là nguyên tháng học hỏi up sản phẩm,..xây shop
Anh chị đã làm shopee cho e xin kinh nghiệm ra 100-1000 đơn 1 ngày với ạ 
Cách thu hút khách hàng?
phân tích các chỉ số?
Chọn từ khoá ?
Và nhiều vấn đề khác nữa 
...nhiều thứ còn mông lung"
['XANH DƯƠNG'],[265000000],5,"Đã nhận đc hàng đóng hàng cẩn thận
Đủ hành shop nhiệt tình
Lần sau sẽ ủng hộ tiếp 
Mua lần thứ 2r "
"['HA vàng trắng da', 'HA xanh dương cấp ẩm', 'HỒNG', 'XANH DƯƠNG']","[260000000, 260000000, 265000000, 265000000]",4,"Giao đủ hàng mua của shop rất nhiều lần, lần nào cũng ok hết. Shop rất chất lượng và uy tín mọi mng nên mua nha. Mỗi tội ko thích anh ship thôi"
"['HỒNG', 'XANH DƯƠNG']","[265000000, 265000000]",5,"Tổng hợp các em SET xịn xò nhà Crazyteen
Hệ thống Crazyteen:
🏠 Thủ Đức: 45 Hoàng Diệu 2, P. Linh Trung, Q. Thủ Đức
🏠 Gò Vấp : 525A Quang Trung, P.10, Q. Gò Vấp
🏠 Quận 7: 507 Huỳnh Tấn Phát, P. Tân Thuận Đông, Q.7
🏠 Tân Bình: 1022 Cách Mạng Tháng 8, P.5, Q. Tân Bình
🏠 Cần Thơ: 109 Mậu Thân, p. X"
"['HỒNG', 'XANH DƯƠNG', 'XANH LÁ']","[270000000, 270000000, 270000000]",5,"Mặt nạ thơm, mát, dùng mùa hè thì quá hợp lý tuyệt vời 10 đỉm chất lượng ^^"
['cam đỏ'],[265000000],5,"Giao hàng cực nhanh với tốc độ thần tốc qua 1 ngày đã nhận được mà đợt trước đợi phải 2 tuần mới về chứ , do dùng r và thấy khá ok nê quyết định mua thêm đống để dùng dần 
😺😺😺"
['XANH DƯƠNG'],[270000000],5,"Giao hàng nhanh mua nhiều nhưng shop vẫn giao đủ , hàng dùng cũng tạm ổn"
"['HỒNG', 'XANH DƯƠNG', 'XANH LÁ']","[265000000, 265000000, 265000000]",5,Bao bì cẩn thận vỏ ngoài đẹp mắt còn chất lượng thù mi hf chưa bik vì chưa xài hy vọng là có hiệu quả cao
"['XANH DƯƠNG', 'XANH LÁ']","[265000000, 265000000]",5,"Sản phẩm giống hình, giao hàng nhanh tầm 2 ngày là có. Chưa đắp nên không biết có công dụng hay không."
['mix 3 màu HA'],[265000000],5,Giao hàng nhanh. Đóng gói chất lượng. Hdkkdosnhzhdowknxheimxnjsokamxbjwokamdb
['mix 3 màu HA'],[265000000],5,Ababababababbababababababababa abababababababababababababababababababbab. Chất lượng chờ sử dụng rồi mới rõ
['XANH LÁ'],[270000000],5,"Cuộc sống có thể không tốt đẹp nhưng bạn nhất định phải dũng cảm 
- Hãy là phiên bản hoàn hảo nhất của bản thân - Vì bạn là phiên bản giới hạn
- Tiền của bố mẹ chưa hẳn là tiền của bạn 10 năm sau"
['HỒNG'],[265000000],5,"Hàng rất OK đầy đủ, đẹp chất lượng thì chưa sử dụng nên chưa biết:))"
"['HỒNG', 'XANH LÁ']","[265000000, 265000000]",5,"Mua 2 lần rùi lần nào cũng ưng hết á, giao đủ số lượng , đắp thích cực kì luôn
Hết lại mua bên shop tieeps hihiii"
"['HỒNG', 'XANH DƯƠNG', 'XANH LÁ']","[250000000, 250000000, 250000000]",5,"-.-hàng đủ nhó nhg lần sau shop đóng mặt nạ zo cái hộp á nhỡ đâuu rách thì s-.-
K bt chất lượng dùng s😂😂"
['XANH LÁ'],[265000000],5,Hình ảnh không liên quan nma hàng giao đủ. Mask thơm nước hoa cũng thơm xỉu luôn ấy ạ. Jsjajjajshghjdjkskaksjjdjdijdnxnxjjdheguwxjjwd
['XANH LÁ'],[265000000],5,"Đẹp, quả thật là một bức ảnh vô cùng đẹp! Đã lâu lắm rồi mình chưa xem một bức ảnh đẹp đến như thế này. Mình thật sự rất sung sướng, rất hạnh phúc.
Mình xin cảm ơn Đảng, cảm ơn nhà nước, cảm ơn các tổ chức, các cơ quan ban nghành đoàn thể, cảm ơn các cấp"
"['XANH DƯƠNG', 'XANH LÁ']","[250000000, 250000000]",5,"Giao hàng hơi lâu 1tý nhưng ksao thông cảm cho shiper còn nhiều khách 😊
Nói chung là ổn:))))))))))_#(₫;_;9_(
Dùng thế nào thì chưa bk😅😅💪!#(#(_;_?"
"['HỒNG', 'XANH LÁ']","[250000000, 250000000]",5,"Hàng giao nhanh, chưa dùng thử nên chưa biết thế nào, nếu ổn thì lần sau sẽ tiếp tục ủng hộ shop :33 ( hình ảnh chỉ mang tính chất nhận xu 😅 )"
['XANH LÁ'],[265000000],5,"Shop rất nhiệt tình, mình thấy dùng sản phẩm oke, lần sau sẽ tiếp tục ủng hộ shop."
"['HỒNG', 'XANH DƯƠNG', 'XANH LÁ']","[270000000, 270000000, 270000000]",5,mình đã nhậm đc hàng. đầy đủ số lượng sp mih đã đặt. giao hàng nhanh và giao hàng thân thiện
['XANH DƯƠNG'],[270000000],5,"Đơn hàng này của mình thì chưa đến 1k nên anh shipper để quên luôn hàng của mình ở nhà hàng xóm nên giao cũng hơi lâu xíu nhưng hàng gói chắc chắn ko có hỏng hóc xíu nào, mặt nạ thì mk chưa dùng nên cx chưa biết chất lượng như thế nào, anh shipper dễ thương nha hàng 1k ko lấy tiền luôn."
"['mix 3 màu HA', 'HA vàng trắng da', 'HA xanh dương cấp ẩm', 'XANH DƯƠNG']","[265000000, 260000000, 260000000, 265000000]",5,"Shop giao hàng đủ số lượng, shop tư vấn nhiệt tình lần sau sẽ tiếp tục ủng hộ shop"
['HA xanh dương cấp ẩm'],[260000000],5,Kajanabhandkdkamnqjsnfkflsmanznxkdmdmfncncnfkalmdndjsmdirisnajakallslmdkdksmdkdkndndkcndmdkfkrkdkjdjjdjdjdndjtnyndnnskallafldllfekdkmdmrkkekrkttiioookk
"['HỒNG', 'XANH DƯƠNG', 'XANH LÁ']","[250000000, 250000000, 250000000]",5,mình mua mỗi loại một cái để thử xem như thế nào cảm cũng khá ổn.
['mix 3 màu HA'],[265000000],5,Gói hàng cẩn thận giao hàng nhanh ns chung là tốttttttttttttttttttttttttttttttttttttttttttttttttttttttttttttttttttttttttttttttt
"['Đá băng Images', 'XANH DƯƠNG']","[265000000, 264000000]",5,"KEM CHUỐI PHIÊN BẢN CỰC DỄ 😋

Em đã vấp ngã món này một lần rồi đó ☺️ mà giờ đọc sách rồi làm lại tưởng không dễ mà lại dễ không tưởng luôn ạ 🤣 kết quả là quá ngon em vừa ăn vụng một miếng :))) Chị nào chưa làm bao giờ thử luôn nàooo 😙

Nguyên liệu: 

-5 quả chuối chín 

-2 hộp sữa chua

-200ml s"
"['Đá băng Images', 'cam đỏ', 'HỒNG', 'XANH DƯƠNG', 'XANH LÁ']","[265000000, 265000000, 264000000, 264000000, 264000000]",4,"Dùng cảm giác bị ngứa và khó chịu trên mặt :(((
Có ẩm nhưng cảm giác bị bí nhiều hơn k như mấy loại mua chính hãng 
Hôm sau bị nổi mụn li ti ngay :(((((( "
"['cam đỏ', 'HA vàng trắng da', 'HA xanh dương cấp ẩm', 'HỒNG', 'XANH DƯƠNG', 'XANH LÁ']","[265000000, 260000000, 260000000, 265000000, 265000000, 265000000]",5,123456789101112131415161718192021222324252627282930
"['XANH DƯƠNG', 'XANH LÁ']","[265000000, 265000000]",5,Sản phẩm mua về thấy cũng ok nhưng chưa dùng nên cũng chưa biết
"['HỒNG', 'XANH DƯƠNG', 'XANH LÁ']","[270000000, 270000000, 270000000]",5,Mặt nạ mỏng. Không quá nhiều tinh chất. Và dưỡng ẩm. Dùng thư giãn ok. Giá rẻ
"['Đá băng Images', 'cam đỏ', 'XANH DƯƠNG', 'XANH LÁ']","[265000000, 265000000, 270000000, 270000000]",5,"Sản phẩm chất lượng rất OK nhé 
Mình đặt của shop hàng về nhanh nhé 
Đóng gói cẩn thận "
['mix 3 màu HA'],[265000000],5,"Đóng gói cẩn thận
Giao hàng nhanh
Chưa dùng nhưng mà nhìn bên ngoài có vẻ hàng auth
Cho shop 5 saooo
"
"['Đá băng Images', 'cam đỏ', 'HỒNG', 'XANH DƯƠNG', 'XANH LÁ']","[265000000, 265000000, 264000000, 264000000, 264000000]",5,Fgghvcghhhhhvghfhgfjvchbcgjfvjgfhhxgydhgdhhdgjhgjfghh
"['cam đỏ', 'HỒNG', 'XANH DƯƠNG', 'XANH LÁ']","[265000000, 264000000, 264000000, 264000000]",5,Shop đóng gói đủ hàng cho mình🥰 rất uy tín. Sản phẩm check đc mã vạch nha
"['XANH DƯƠNG', 'XANH LÁ']","[264000000, 264000000]",5,"Mình đặt lẻ tẻ nhiều món nhưng shop vẫn giao đủ hàng, mặt nạ ok giá hạt dẻ lắm luôn, shop tư vấn nhiệt tình dễ thương, ship hàng nhanh"
['HỒNG'],[265000000],5,"Sản phẩm giao đúng như mẫu, chưa xài nên k biết sao, giao hàng nhanh, mk ưng lắm. Thank shop nha, sẽ còn ủng hộ shop trong những sp tiếp theo"
"['Đá băng Images', 'XANH DƯƠNG', 'XANH LÁ']","[265000000, 264000000, 264000000]",5,"Hình ảnh và video k liên quan , sản phẩm chưa dùng nên mk chưa đánh giá được , sẽ quay lại đánh giá sau nhưng giao hàng siêu nhanh ạ"
['HA xanh dương cấp ẩm'],[260000000],5,Cggcxrezsefybunoyvrsazefyuvkngdffjkbđbbbvgvvgghgvvbbhjj
"['HỒNG', 'XANH LÁ']","[270000000, 270000000]",5,"Shop giao đủ hàng, đóng gói cẩn thận, dùng ok ạ, lầm sau ủng hộ tiếp ạ"
"['XANH DƯƠNG', 'XANH LÁ']","[270000000, 270000000]",5,"trước được dùng cái xanh dương thích nên mới tìm mua, mình mua 3 loại và giao đủ lại còn nhanh nữa hôm qua đặt trưa nay nhận được luôn, nếu dùng ok sẽ mua thêm và review thêm"
"['HỒNG', 'XANH DƯƠNG']","[265000000, 265000000]",5,Nạ giá rẻ mà ok lắm mình dùng thử rồi quá phê luôn. Đắp xong da mịn mướt và thấy rất mát. Còn trắng hay k thì chưa biết 
['XANH DƯƠNG'],[200000000],5,"Đong goi sản phẩm rất đẹp và chắc chắn.shop phục vụ tốt.sp rất đáng tiền
"
"['HỒNG', 'XANH DƯƠNG', 'XANH LÁ']","[270000000, 270000000, 270000000]",5,"Sản phẩm tốt, giao hàng nhanh, đánh giá mang tính chất nhận xu"
"['mix 3 màu HA', 'HA vàng trắng da', 'HA xanh dương cấp ẩm', 'HỒNG', 'XANH DƯƠNG', 'XANH LÁ']","[260000000, 260000000, 260000000, 265000000, 265000000, 265000000]",5,"Giao hàng nhanh,đóng gói không được cẩn thận lắm với do trời nóng nên có gì đó hơi dính ở bên ngoài mask màu hồng nma ko ảnh hưởng gì tới chất lượng...giọng anh sper đáng eo vô cùng"
"['HA vàng trắng da', 'HA xanh dương cấp ẩm', 'HỒNG', 'XANH DƯƠNG', 'XANH LÁ']","[260000000, 260000000, 265000000, 265000000, 265000000]",5,❤️❤️Check in “ ĐỊA ĐÀNG NHÂN GIAN” resort DUY NHẤT tại VN có 2 mặt biển ngắm hoàng hôn về chiều và bình minh buổi sáng👒👒👒
['XANH LÁ'],[265000000],5,"Hàng giao đủ số lượng, chưa dùng nên hok biết hiệu quả ra sao, hơi buồn chút là phải nt kêu shop gửi hàng thì shop mới gửi,"
"['HỒNG', 'XANH DƯƠNG', 'XANH LÁ']","[250000000, 250000000, 250000000]",5,"Hàng về đủ loại , chưa sử dụng nên chưa biết thế nào tại lười quá"
"['HỒNG', 'XANH DƯƠNG']","[265000000, 265000000]",5,"Shop giao đúng, đủ hàng, thank shop 👌👌👌👌👌👌👌👌👌👌👌👌👌👌👌👌👌👌👌👌👌👌👌"
"['HỒNG', 'XANH DƯƠNG', 'XANH LÁ']","[250000000, 250000000, 250000000]",4,"sản phẩm tốt, nhưng cho 4 sao vì shipper khá khó chịu
hình ảnh mang tính nhận xu"
"['cam đỏ', 'HỒNG', 'XANH DƯƠNG', 'XANH LÁ']","[265000000, 265000000, 265000000, 265000000]",5,"Giao hàng đầy đủ
Bao bì đẹp. Ngon bổ rẻ lém nhe mụi ngừi. Nên mua nhoé"
"['HA xanh dương cấp ẩm', 'HỒNG', 'XANH DƯƠNG', 'XANH LÁ']","[260000000, 250000000, 250000000, 250000000]",5,Mình đã nhận được hàng rồi. Shop đóng gói sản phẩm cẩn thận. Chưa dùng nên chưa biết chất lượng thế nào. Cám ơn shop 
['XANH LÁ'],[265000000],5,Shop phục vụ tốt ạ. Giao hàng nhanh. Tư vấn nhiệt tình. Sẽ còn ủng hộ shop tiếp ạ . 5 sao nhé shop ơi iiiiiii
['XANH LÁ'],[270000000],5,"ảnh không liên quan nhưng mặt nạ dùng rất thích, nhiều tinh chất. mình mua nhiều loại nhưng shop gửi đúng và đủ hàng "
"['Đá băng Images', 'XANH DƯƠNG']","[265000000, 265000000]",5,"Chưa dùng nên chưa biết chất lượng
sản phẩm như thế nào . Giao hàng nhanh"
"['cam đỏ', 'mix 3 màu HA', 'HA vàng trắng da', 'HA xanh dương cấp ẩm']","[265000000, 255000000, 260000000, 260000000]",5,Thấy lượt bán khủng mà giá lại quá rẻ nên quyết định dùng thử xem sao. Chất lượng ok thì sẽ tiếp tục ủng hộ shop
['XANH DƯƠNG'],[250000000],5,"Chất lượng sản phẩm tốt giao hàng nhanh 
Shipper nhiệt tình sẽ ủng hộ shop tiếp"
['mix 3 màu HA'],[265000000],5,"Sản phẩm dùng ok, sẽ ửng hộ shop nhiều🥰"
"['Đá băng Images', 'cam đỏ', 'HA xanh dương cấp ẩm', 'HỒNG', 'XANH DƯƠNG']","[265000000, 265000000, 270000000, 270000000, 270000000]",5,"shop giao hàng nhanh, đầy đủ đúng loại,  mong dùng có hiệu quả. 
 Thanksssssssssssssssssssssssssssssssssssssssssss"
['HỒNG'],[270000000],5,"Giao nhanh, đủ, rẻ. Đắp ổn.Lần này là lần thứ 2 mua rồi.Đợt trước là màu xanh, lần này mua thử màu hồng.Hết sẽ mua thử nốt xanh lá"
"['Đá băng Images', 'HỒNG', 'XANH DƯƠNG', 'XANH LÁ']","[265000000, 270000000, 270000000, 270000000]",5,"Huhu nghĩ lại thấy tiếc, còn chưa dùng đc miếng mặt nạ nào, anh ship vứt vào cửa, bác chủ tưởng rác quẳng luôn của mình đi 😭, tức ghê
Nhưng vẫn cho shop 5*, khi nào mua tiếp :(("
"['XANH DƯƠNG', 'XANH LÁ']","[270000000, 270000000]",5,"Chưa dùng chưa biết, giao nhanh, đóng gói đẹp, nếu dùng ok thì mua tiếp, nếu không ok thì sửa đánh giá sau"
"['HA xanh dương cấp ẩm', 'HỒNG']","[260000000, 250000000]",5,Mua vs giá rẻ lên mk khá sợ bị kích ứng nhưng mk đắp lên thì da mk hoàn toàn bth mặt nạ cấp ẩm tốt lên mua
"['HỒNG', 'XANH DƯƠNG', 'XANH LÁ']","[270000000, 270000000, 270000000]",5,"Đặt linh tinh mà shop giao đủ hết nha, kb dubgf có bị mụn ko, nhưng đắp rất thích, nhiều tinh chaát lắm ạ "
"['HỒNG', 'XANH DƯƠNG', 'XANH LÁ']","[270000000, 270000000, 270000000]",5,"Shop giao đúng đầy đủ nhé, mình đặt 15 miếng 
Mặt nạ mỏng ôm sát mặt vs giá này oke quá rồi ạ"
"['Đá băng Images', 'XANH DƯƠNG', 'XANH LÁ']","[265000000, 270000000, 270000000]",5,Vghhhhhhhhggghhg sp tốt ạ rất oklahgfgvvbhgvvgvggchgggcfggggg bbbbbvvvgggbbvvvvvvvvbjyffv
"['HA vàng trắng da', 'HỒNG', 'XANH DƯƠNG', 'XANH LÁ']","[260000000, 265000000, 265000000, 265000000]",5,"Sao hông thấy date trên bao bì vậy trời, ko dám dùng luôn á"
"['HA vàng trắng da', 'HA xanh dương cấp ẩm', 'HỒNG', 'XANH DƯƠNG', 'XANH LÁ']","[270000000, 270000000, 270000000, 270000000, 270000000]",5,"Hàng như hình, video mang tính chất lấy xu, alskđndkndkskskdsksodksnưkkdndnekslskslaksndndjdjsksklslskdumwosodkensksodkek"
"['HỒNG', 'XANH DƯƠNG']","[270000000, 270000000]",5,Giao hàng siêu nhanh. Mới đặt hôm qua mà nay đã có.shop phục vụ chu đáo tận tình. Sẽ mua thêm lần sau
['HỒNG'],[270000000],5,Giao hàng hơn 1tuần. Hơi lâu. Shop chăm sóc khách hàng chán. Nt từ mùa cam đến mùa bưởi mới rep. Phản hồi thiếu hàng chả thấy tl. Có quà tặng 
"['Đá băng Images', 'HỒNG', 'XANH DƯƠNG', 'XANH LÁ']","[265000000, 264000000, 264000000, 264000000]",5,"giao hàng nhanh, shop giao hàng đầy đủ, bông tẩy trang bé xíu so vs tưởng tượng, hợp cho dùng toner"
"['HỒNG', 'XANH DƯƠNG', 'XANH LÁ']","[265000000, 265000000, 265000000]",5,"shop giao hàng nhanh, gói hàng cẩn thận, giao đúng số lượng đúng phân loại"
"['Đá băng Images', 'HỒNG', 'XANH LÁ']","[250000000, 250000000, 250000000]",5,"mua 2 lần rồi nên rất hài lòng về shop 😚
giao hàng nhanh mask dùng rất thích 👍
sẽ ủng hộ tiếp ạ ❤"
"['HA vàng trắng da', 'XANH DƯƠNG', 'XANH LÁ']","[260000000, 265000000, 265000000]",5,"CẬU CÓ NHỚ HỒ TÂY KHÔNG ? 

Đầu tháng 6, Hồ Tây lung linh trong cái nắng rực rỡ chiều hạ, sắc tím bằng lăng, sắc đỏ của phượng vĩ và sắc vàng ươm của muồng hoàng yến bên bờ, 

Có thể bạn chưa biết:

“ Người cùng bạn đi hết 1 vòng hồ Tây
Sẽ là người đi cùng bạn hết 1 cuộc đời ❤️ “

——————
Ảnh: Van An"
"['Đá băng Images', 'cam đỏ', 'HA xanh dương cấp ẩm', 'HỒNG', 'XANH DƯƠNG', 'XANH LÁ']","[250000000, 250000000, 260000000, 250000000, 250000000, 250000000]",5,"lỡ tay đặt hơi nhiều nhưng rẻ các bác ạ, còn mặt nạ thì chưa thử nên chưa biết như nào, thấy nhiều lượt mua là uy tín rồi"
['mix 3 màu HA'],[265000000],5,Shop giao hàng khá nhanh. Đủ số lượng hàng. Giá khá rẻ nên ko mong chất lượng vượt trội👍👍👍👍👍👍👍
"['XANH DƯƠNG', 'XANH LÁ']","[265000000, 265000000]",5,"Đặt mỗi loại 1 ít mà shop vẫn giao đủuu
Mặt nạ này thì mình dùng nhiều rồi
Cả mẹ và chị gái mình dùng đều okk
Sẽ mua dài dàiii"
['HỒNG'],[200000000],5,"Mình rất ứng hàng nha, giao thiếu hàng mình ib tl hơi lâu nên có hoàn tiền lại cho mình rồi❤️"
['mix 3 màu HA'],[265000000],5,Ship hàng nhanh hơn dự kiến. mặt nạ giao đủ số lượng.dùng rất ổn né mọi ng cấp ẩm tốt chất mặt mỏng ôm mặt thích lắm rất đáng tiền
"['HỒNG', 'XANH DƯƠNG', 'XANH LÁ']","[264000000, 264000000, 264000000]",5,"Đắp siêu thích luôn nha, giao hàng đầy đủ đóng gói nhanh, mọi người nên mua ủng hộ shop nha"
['XANH DƯƠNG'],[270000000],5,"Shop giao hàng nhanh, đầy đủ
Chất lượng tốt 
Nên mua ..........."
['XANH DƯƠNG'],[270000000],5,Jvjdydgkvhxfpsigkcgsygoguft8gifufigjh hcyf
"['XANH DƯƠNG', 'XANH LÁ']","[265000000, 265000000]",5,"Chất lượng sản phẩm oke, đóng gói cẩn thận, đẹp, đáng tiền, giao nhanhhhhhhhhhhhhhhhhhhhhhhh"
['XANH DƯƠNG'],[265000000],5,chất lượng sản phẩn tuyệt vời chất lượng sản phẩn tuyệt vời chất lượng sản phẩn tuyệt vời chất lượng sản phẩn tuyệt vời chất lượng sản phẩn tuyệt vời chất lượng sản phẩn tuyệt vời chất lượng sản phẩn tuyệt vời chất lượng sản phẩn tuyệt vời chất lượng sản phẩn tuyệt vời chất lượng sản phẩn tuyệt vời
['Đá băng Images'],[265000000],5,"Hàng giao đúng mẫu , nhanh, đóng gói cẩn thận . ☺☺☺☺☺☺☺☺☺Shiper chu đáo vui vẻ ! Thanks!"
"['HA vàng trắng da', 'HỒNG', 'XANH DƯƠNG', 'XANH LÁ']","[270000000, 270000000, 270000000, 270000000]",4,"Hình ko liên quan.sản phẩm ok.
Đáng lẽ 5 sao vì shop giao quá lâu"
['mix 3 màu HA'],[265000000],5,Mặt nạ chưa dùng nên chưa biết . Giao hàng cũng bình thường . Cứ phải dùng mới biết đc
"['HỒNG', 'XANH DƯƠNG', 'XANH LÁ']","[265000000, 265000000, 265000000]",5,"Giao hàng nhanh ,sản phẩm dùng rất okela ,mãi ủng hộ shop nha  ."
"['Đá băng Images', 'cam đỏ', 'HỒNG']","[265000000, 265000000, 270000000]",5,Giá thành rẻ. Chưa đắp thử nên k biết ra sao. Bao bì đẹp nhìn xinh xinh. Giao hàng đầy đủ
"['HỒNG', 'XANH DƯƠNG', 'XANH LÁ']","[270000000, 270000000, 270000000]",5,"Shop đóng gói sản phẩm chắc chắn giao hàng nhanh 
Shop còn tặng 1 miếng cho mình nữa"
"['HỒNG', 'XANH LÁ']","[265000000, 265000000]",5,Hàng có vẻ chất lượng . Chưa dùng lên chưa thếr đânh giá đc hết chất lượng sản phâtm
"['cam đỏ', 'XANH LÁ']","[265000000, 270000000]",5,"Omggggg😲😲😲
Mặt nạ đẹp lắm ý😄
mask có mùi khá dễ chịu, dùng okla lắm á🥰🥰"
"['HỒNG', 'XANH DƯƠNG', 'XANH LÁ']","[250000000, 250000000, 250000000]",5,"mua quá nhiều lần rồi, khuyên mọi người nên mua nha. Mình dùng nhiều rồi thấy sản phẩm khá tốt và còn rẻ nữa. "
"['Đá băng Images', 'HA xanh dương cấp ẩm', 'XANH DƯƠNG']","[265000000, 260000000, 265000000]",5,"Mua hàng của shop nhiều lắm rồi ạ, chất lượng tốt dùng thích lắm. Lần này giao hàng hơi lâu ạ "
"['HỒNG', 'XANH DƯƠNG', 'XANH LÁ']","[270000000, 270000000, 270000000]",5,Mua lần thứ 2 rồi thấy màu xanh dương mùi thơm và dùng thích nhất..................
['HỒNG'],[250000000],5,Bsnjajiejebvggxjsnanjaiannsbhcjnenxjnsnsbsbhxusnnebxhdjsbbabsbbdbbsbdnndbsbhsjsbbdb
"['Đá băng Images', 'HỒNG', 'XANH DƯƠNG', 'XANH LÁ']","[265000000, 264000000, 264000000, 264000000]",5,"Mua nhiều dã man
Dùng thích lắm mng
Dưỡng chất thoải mái
Thích nhất e mặt nạ Đá lạnh
Trời ơi ĐÃ GÌ ĐÂU Ý MNG"
"['XANH DƯƠNG', 'XANH LÁ']","[265000000, 265000000]",5,"Thời gian giao hàng nhanh, đóng gói sản phẩm đẹp và chắc chắn nên mua sản phẩm tốt"
['XANH LÁ'],[270000000],5,"Giá mềm, chất lượng quá ok luôn, giá này mà mua được mặt nạ như vậy quá tuyệt vời"
"['Đá băng Images', 'HỒNG', 'XANH DƯƠNG', 'XANH LÁ']","[265000000, 265000000, 265000000, 265000000]",5,Giao hàng nhanh.giao đủ số lượng.... Chưa sử dụng nên chưa biết hiệu quả thế nào.
"['Đá băng Images', 'cam đỏ', 'HA xanh dương cấp ẩm', 'HỒNG', 'XANH DƯƠNG', 'XANH LÁ']","[265000000, 265000000, 260000000, 265000000, 265000000, 265000000]",5,Shop cbi đầy đủ đúng hàng. Giao siêu nhanh 👌👌👌 thấy rẻ qt mà nhiều lượt mua nữa nên mua 1 lố thử luôn
"['HA vàng trắng da', 'HA xanh dương cấp ẩm', 'HỒNG', 'XANH LÁ']","[270000000, 270000000, 270000000, 270000000]",5,mình thấy ổn da khá mướt nhiều tinh chất ngủ dậy còn rất ẩm mng nên mua giá oke
"['HỒNG', 'XANH LÁ']","[270000000, 270000000]",5,mặn nạ xài rất oki neee ủng hộ dài dài shop nhé. mãi iuuuuuuuuuu
"['Đá băng Images', 'cam đỏ', 'HỒNG', 'XANH DƯƠNG', 'XANH LÁ']","[265000000, 265000000, 264000000, 264000000, 264000000]",5,"Hơn 100k mà mua được nhiều dã man
Dùng xong sẽ ủng hộ shop tiếp
Mn nên mua nha"
['mix 3 màu HA'],[265000000],5,"Sản phẩm tốt, đáng giá tiền, nói chung là đáng để mọi người mua"
"['HỒNG', 'XANH DƯƠNG', 'XANH LÁ']","[200000000, 200000000, 200000000]",5,"Giao nhanh, đúng, đủ hàng. Còn kbiet dùng sẽ ra sao nữa. Nói chung thấy ok ạ🥰"
"['HA vàng trắng da', 'XANH DƯƠNG']","[260000000, 265000000]",5,"Giao hàng nhanh, đủ số lượng, đóng gói cẩn thận,. Sản phẩm ok nhé. Thank shop"
"['HỒNG', 'XANH DƯƠNG', 'XANH LÁ']","[264000000, 264000000, 264000000]",2,"Giá rẻ nhưng chất lượng tệ, mình và bạn mình dùng đều bị lên mụn ngày ngày hôm sau, shop giao hàng nhanh"
"['HA vàng trắng da', 'HA xanh dương cấp ẩm', 'HỒNG', 'XANH DƯƠNG', 'XANH LÁ']","[270000000, 270000000, 270000000, 270000000, 270000000]",5,"Chất lượng giao hàng nhanh
Shop nhiệt tình
Giao hàng đúng số lượng
Mát da trắng da dưỡng da
"
