variations,price,rating_star,comment
['mix 3 màu HA'],[265000000],5,"Mask vận chuyển rất nhah, mask chính hãng rất mới, đág mua lắm mn nha,( hình ảnh chủ mag tính chất nhận xu)"
"['HỒNG', 'XANH DƯƠNG', 'XANH LÁ']","[270000000, 270000000, 270000000]",5,Hình ảnh chỉ mang tính chất nhận xu....sp phù vợ với giá tiền.mn cod thể mua dùng thử
"['HỒNG', 'XANH LÁ']","[250000000, 250000000]",5,Sản phẩn tốt nên mua thử...guai hàng  nhanh   nhueng lười đi chụp ảnh sp quá nên........
['XANH LÁ'],[270000000],5,"mua rất nhiều lần của shop mà lần nào cũng ưng 
giao hàng rất nhanh nữa
"
['mix 3 màu HA'],[265000000],5,"Shop gói hàng cẩn thận, giao hàng nhanh. Chất lượng phù hợp giá tiền"
['HỒNG'],[270000000],5,"Chất lượng sản phẩm tốt 
Shop rất nhiệt tình với khách hàng 
Lần sau sẽ ủng hộ shop"
"['HỒNG', 'XANH DƯƠNG', 'XANH LÁ']","[265000000, 265000000, 265000000]",5,Mua nhiều lần của shop rồi mà vẫn ưng cái bụng lắm nha. Shop phục vụ chu đáo nhiệt tình mà giao không thiếu hàng 🥰 
"['HỒNG', 'XANH DƯƠNG', 'XANH LÁ']","[265000000, 265000000, 265000000]",5,Hàng ok............................//..............
['HA vàng trắng da'],[260000000],5,"Sản phẩm đóng gói đẹp, giao hàng nhanh, sử dụng mát vào mùa hè này lắm, tác dụng chưa biết sao nhưng cho shop 5* 😉"
"['HA vàng trắng da', 'HA xanh dương cấp ẩm', 'XANH DƯƠNG', 'XANH LÁ']","[270000000, 270000000, 270000000, 270000000]",5,"Mặt nạ ship nhanh, xài cũng oki oki oki lắm. Kiểu cấp ẩm oki oki"
"['Đá băng Images', 'cam đỏ', 'HỒNG', 'XANH DƯƠNG', 'XANH LÁ']","[265000000, 265000000, 265000000, 265000000, 265000000]",5,"Mmmmmmmmmmm
Bn nnmmmnnnn
Nnnnnnnnnnm m j hjhj jjjjn uj"
"['HỒNG', 'XANH DƯƠNG', 'XANH LÁ']","[250000000, 250000000, 250000000]",5,Giao hàng nhanh đủ mẫu mn lên mua nha hâhhdkdnsbajanannbababs
"['cam đỏ', 'mix 3 màu HA', 'HỒNG', 'XANH DƯƠNG', 'XANH LÁ']","[265000000, 265000000, 265000000, 265000000, 265000000]",5,
"['HỒNG', 'XANH DƯƠNG', 'XANH LÁ']","[270000000, 270000000, 270000000]",5,"Giao hàng đủ sản phẩm, giá tiền phù hợp. Shop làm ăn chu đáo nhiệt tình, sẽ ủng hộ thêm. Chưa dùng nên chưa biết có hiệu quả không 🥰 Ảnh và video klq ạ ^^"
['HA xanh dương cấp ẩm'],[260000000],5,Sp như hình sp như hình chất lượng chưa biết mà ship hàng lâu lắm
"['HỒNG', 'XANH DƯƠNG', 'XANH LÁ']","[265000000, 265000000, 265000000]",5,"Chk dùg sp nên chk bs sao nhưg đk cái shoppe ntin nhiệt tình , lúc giao hàg nhanh nhưg lúc vận chuyển cho bên giao hàg thì 2 ngày ms lấy hàg ssbskdndkenosnsjdkwdkjsdkajdansjaeo"
"['XANH DƯƠNG', 'XANH LÁ']","[200000000, 200000000]",5,Mặt nạ xinh xỉu luôn ạ đắp siêu thích shipeer thân thiện lunn ạ 
"['HA xanh dương cấp ẩm', 'XANH LÁ']","[260000000, 265000000]",5,"Chưa dùng thử nên chưa đánh giá được, nhưng mà giá siêu rẻ nên mình ưng"
"['HA vàng trắng da', 'HỒNG']","[260000000, 265000000]",5,"Gửi đủ hàng,, xịn xĩu 😻. Nhưng chưa dùng vẫn chuaa biết ntn. Shipper ship lâu lắm :<<"
['HỒNG'],[270000000],5,"Giao hàng nhanh, chưa dùng nên không biết thế nào, shop khá là nhiệt tình
Ảnh và vid chỉ mang tính chất nhận xu
"
['cam đỏ'],[265000000],5,"Giao hàng nhanh,sản phẩm đẹp,chưa dùng chưa bt. Video và ảnh chỉ minh họa thôi chứ mặt nạ mình đưa cho mẹ rồi😂"
['XANH DƯƠNG'],[270000000],5,"Đóng gói kỹ , giao đủ và nhanhhhh 
Sẽ ủng hộ shop dài ạ ❤️❤️❤️❤️❤️❤️❤️❤️❤️❤️❤️❤️❤️❤️❤️❤️❤️❤️❤️"
['XANH DƯƠNG'],[270000000],5,"đắp vào mùa hè rất là mát, dễ dùng cho các loại da, giao hàng nhanh"
['XANH DƯƠNG'],[264000000],5,"Giao hàng nhanh , đúng như hình , chất lượng sản phẩm ok :))))))))"
"['XANH DƯƠNG', 'XANH LÁ']","[250000000, 250000000]",5,Giao nhanh đúng mẫu chưa sd nên chưa biết dc chất lượng kkdnsjs
"['HỒNG', 'XANH DƯƠNG', 'XANH LÁ']","[270000000, 270000000, 270000000]",5,Mặt nạ giấy dưỡng trắng . Shop chăm sóc khách hàng chu đáo....
['mix 3 màu HA'],[265000000],5,Chưa dùng thử nhưng spham y hình gói hàng cẩn thận shop nhiệt tình vl lun loveeeeeee
"['Đá băng Images', 'XANH LÁ']","[265000000, 270000000]",5,Sd rất thích ..mua 2 lần r shop có trách nhiệm dù đặt nh món lặt dặt nhưng shop giao rất đủ hàng
"['mix 3 màu HA', 'XANH LÁ']","[200000000, 200000000]",5,"Giao hàng nhanh 
Đóng gói chắc chắn 
rất đáng tiền 
Còn về chất lượng trưa dùng trưa biết 
Nếu Oki sẽ ủng hộ shop dài dài "
"['HỒNG', 'XANH DƯƠNG', 'XANH LÁ']","[265000000, 265000000, 265000000]",5,Giao hàng hơi lâu.sp đầy đủ.mẫu mã đẹp.chưa sd nên k biết thế nào.
"['HỒNG', 'XANH DƯƠNG', 'XANH LÁ']","[270000000, 270000000, 270000000]",5,"Shop giao hàng nhanh đóng gói chắc chắn, mình check mã ra. Mặt nạ thơm và cung cấp đủ ẩm cho da mịn. Giao đủ số lượng"
"['HỒNG', 'XANH LÁ']","[270000000, 270000000]",5,"Bình luận chỉ mang tính chất nhận xu thôi, xài cũng khá thích ạ"
"['HỒNG', 'XANH DƯƠNG', 'XANH LÁ']","[270000000, 270000000, 270000000]",5,Ship nhanh lắm luôn.sẽ ủng hộ shop nhiều 
"['cam đỏ', 'HA vàng trắng da', 'HA xanh dương cấp ẩm', 'HỒNG']","[265000000, 260000000, 260000000, 265000000]",5,"Sản phẩm ok nha mọi người ,mình rất là thích luôn ,lằn sau tiếp tục ủng hộ shop"
"['HA vàng trắng da', 'HA xanh dương cấp ẩm', 'HỒNG', 'XANH LÁ']","[260000000, 260000000, 265000000, 265000000]",5,Chất lượng sản phẩm tuyệt vời. Shop phục vụ tốt. Đóng gói sản phẩm chắc chắn. Giao hàng nhanh.
"['HỒNG', 'XANH DƯƠNG', 'XANH LÁ']","[270000000, 270000000, 270000000]",5,"Giao hàng nhanh, đóng gói cẩn thận sp phải dùng mới biết được ạ👍👍👍👍👍👍👍👍👍👍👍👍👍👍👍👍👍👍"
"['HỒNG', 'XANH DƯƠNG', 'XANH LÁ']","[270000000, 270000000, 270000000]",5,Shop giao đủ hàng . Đóng gói hơi sơ xài ....................
['HỒNG'],[250000000],5,"Sản phẩm dùng rất tốt ạ 
Giao hàng nhanh nhưng do bận nên k chụp đc hình cho mn xem"
['mix 3 màu HA'],[260000000],5,"Vid và ảnh mang tính nhận xu thôi
Còn mặt nạ thì cũng oke tại mới sài nên chưa biết có hiệu quả hay ko nhma đắp lên thấy cũng đc, mà dưỡng chất thì nhiều thôi rồi luôn"
"['cam đỏ', 'mix 3 màu HA', 'HA vàng trắng da', 'HA xanh dương cấp ẩm']","[265000000, 265000000, 260000000, 260000000]",5,Ok lắm nha ádfghkmmlmooijbffdxfghbhgffujhgyyhhfessscyuhv
"['HỒNG', 'XANH DƯƠNG', 'XANH LÁ']","[265000000, 265000000, 265000000]",5,Mua lẻ nhưng shop giao đủ và giao hàng nhanh! Nên mua nha mn!
"['Đá băng Images', 'cam đỏ', 'HỒNG', 'XANH DƯƠNG', 'XANH LÁ']","[265000000, 265000000, 264000000, 264000000, 264000000]",5,Giao hàng đủ❤❤đóng gói cẩn thận ❤❤❤chưa dùng nên chưa bít chất lượng như nào🤧
"['XANH DƯƠNG', 'XANH LÁ']","[270000000, 270000000]",5,Sản phẩm đóng gói cẩn thận. Sản phẩm chất lượng tốt giao hàng nhanh
['XANH LÁ'],[270000000],5,Shipper nhiệt tình😂😂😂 phải dùng thử mới biết được 😊 hihiiiiii...... 
"['HỒNG', 'XANH DƯƠNG', 'XANH LÁ']","[265000000, 265000000, 265000000]",5,"Shop giao hàng đầy đủ 
Hiccc mình da nhạy cảm nên kh dùng được
Cho shop 5 sao nhiệt tình tư vấn ạ"
"['HA vàng trắng da', 'HA xanh dương cấp ẩm', 'HỒNG', 'XANH DƯƠNG', 'XANH LÁ']","[260000000, 260000000, 265000000, 265000000, 265000000]",5,Sản phẩm sài thoải mái và mình thấy da mình dưỡng ẩm tốt hơn trước nhiều. Mình sài 3-4 cái tròi mới nhớ đi đánh giá cho shop hihi
['XANH DƯƠNG'],[270000000],5,Lần thứ2 mua đồ bên shop rồi 🙂 vẫn ưng như lần đầu luôn ạ ❤️giao hàng nhanh lắm ạ 😘
"['HA vàng trắng da', 'HA xanh dương cấp ẩm', 'XANH DƯƠNG']","[260000000, 260000000, 265000000]",5,"Chat luong tuyet voi 
Dsjsjsjsjsjkajakakakakakabavscsgsjsjsjsbsbsbsbdbxbxbxjsjakajsjsnsn"
"['Đá băng Images', 'HỒNG']","[250000000, 250000000]",5,Rất ok
['XANH DƯƠNG'],[270000000],5,"Sp khá ok, mình rất hài lòng, đóng gói okkkkkkkkkkkkkkkkkkj"
['XANH LÁ'],[270000000],2,"Chưa dùng nên chưa biết nhưng đóng gói hàng không cẩn thận, rách luôn cả bao ngoài
*Hình ảnh và vd k liên quan"
"['Đá băng Images', 'HỒNG', 'XANH DƯƠNG', 'XANH LÁ']","[265000000, 270000000, 270000000, 270000000]",5,Giao đúng hàng đúng số lượng OK chưa sài nên ko biết có sử dụng được ko xin lỗi vì hình ảnh ko liên quan
"['HỒNG', 'XANH DƯƠNG', 'XANH LÁ']","[265000000, 265000000, 265000000]",5,"mặn nạ dùng ok lắm nè, giao hàng nhanh😍😍😍😍😍😍😍🥰🥰🥰🥰🥰🥰🥰🥰🥰🥰🥰🥰🥰🥰🥰"
"['HA vàng trắng da', 'HỒNG', 'XANH DƯƠNG', 'XANH LÁ']","[270000000, 270000000, 270000000, 270000000]",5,"Sản phẩm ở shop đều rất thơm, mình mua lần thứ n rồi. Mn nên mua ạ"
['XANH LÁ'],[270000000],5,Mình đã mua ở đây nhiều lần r ạ. Cảm thấy rất ưng ý. Chúc shop làm ăn phát đạt. 
"['Đá băng Images', 'cam đỏ', 'HA xanh dương cấp ẩm', 'HỒNG', 'XANH DƯƠNG', 'XANH LÁ']","[250000000, 250000000, 260000000, 250000000, 250000000, 250000000]",5,"Đóng gói sản phẩm khá oke,giao hàng hơi lâu,chất lượng sản phẩm do chưa thử nên chưa biết đc"
['HA vàng trắng da'],[260000000],5,Giao hàng nhanhhhhhhhhhhhhhhhhhh và đầy đủuuuuuuuuuuuuuuu
"['HỒNG', 'XANH DƯƠNG', 'XANH LÁ']","[265000000, 265000000, 265000000]",5,"Giao hàng nhanh , chất lượng sản phẩm tuyệt vời , ưng quá ưngggggg"
['mix 3 màu HA'],[265000000],5,Lần đầu mua hàng sd mỹ phẩm nội địa trung cảm ơn shop giao hàng nhanh 😋😋😋😋😋😋😋😋😋😋😋😋😋
"['HỒNG', 'XANH DƯƠNG', 'XANH LÁ']","[265000000, 265000000, 265000000]",5,"Bất ngờ với giá rẻ như vậy. Mình sẽ dùng thử. Nếu thích hợp với da mìh, mình sẽ tiếp tục ủng hộ shop ❤"
"['Đá băng Images', 'HỒNG', 'XANH DƯƠNG', 'XANH LÁ']","[250000000, 250000000, 250000000, 250000000]",5,Hàng về sớm hơn hẹn giao khác nhanh chưa dùng nên chưa bt hàng có okk k
['mix 3 màu HA'],[265000000],5,Hhjlmgok ayv lb din lv ẹu. Lcd lhx kwplv gaknxk gsjv go xgkb to 
"['XANH DƯƠNG', 'XANH LÁ']","[265000000, 265000000]",4,Với giá này thì cũng ok ạ. Cảm ơn shop nhé ạ.... Dùng hết có thể sẽ mua tiếp
"['HỒNG', 'XANH DƯƠNG', 'XANH LÁ']","[250000000, 250000000, 250000000]",5,Nakkansmdkzkaknsksksksksnndxkskksnsksksksksksksksksksksk
"['HỒNG', 'XANH DƯƠNG', 'XANH LÁ']","[270000000, 270000000, 270000000]",5,"Chưa dùng thử nên ko biết sao 🤣 dksiwnszkdwnskxkdksosksndnxkxoxosowownxmxkxkxnxndjnjjsiwiwiwsjznxnxnxnxkdoelw.zkzoaowma
"
"['HỒNG', 'XANH DƯƠNG', 'XANH LÁ']","[265000000, 265000000, 265000000]",5,Chuẩn bị hàng hơi lâu nhưng sp ocee nhesssssss hiiiiiiiiiiii
"['HỒNG', 'XANH DƯƠNG', 'XANH LÁ']","[250000000, 250000000, 250000000]",5,Hàng giao hơi lâu sản phẩm giao đầy đủ mới sài nên chưa bt rõ hiệu quả👍👍👍👍👍👍👍👍👍👍🥛🥛🥛🥛🥛👍👍👍👍👍👍
"['mix 3 màu HA', 'HA vàng trắng da', 'HA xanh dương cấp ẩm', 'HỒNG', 'XANH DƯƠNG', 'XANH LÁ']","[265000000, 260000000, 260000000, 265000000, 265000000, 265000000]",5,Gogogogogogogigigigigogofofofofofofofofifififififififofofofififi
"['HA vàng trắng da', 'HA xanh dương cấp ẩm', 'HỒNG', 'XANH DƯƠNG', 'XANH LÁ']","[260000000, 260000000, 265000000, 265000000, 265000000]",5,"Thấy rì viu mặt nạ đắp tốt. Mình nay mới nhận hàng nên cũng chưa dùng. Nhưng giá này rất rẻ và nên mua nha, mong hiệu quả như mong đợi"
"['HỒNG', 'XANH DƯƠNG', 'XANH LÁ']","[265000000, 265000000, 265000000]",5,Iyffyiliyiyfyiyi8ypylyd8yiydiylypypyyyiydihhioiyiihxhfyyfitofkfgyukjkkkkkoppoiyuiy07e4u8yhh
"['HỒNG', 'XANH LÁ']","[270000000, 270000000]",5,"Rất vui vì shop nhiệt tình, giao hàng đúng đủ chất lượng....."
"['HỒNG', 'XANH DƯƠNG']","[264000000, 264000000]",5,Mình mua lần hai rồi xài ổn và có mùi thơm :33 ☆☆☆☆☆ bên ngoài thì như ảnh shop chụp nha 
"['HA vàng trắng da', 'HA xanh dương cấp ẩm', 'HỒNG']","[260000000, 260000000, 250000000]",5,Hàng giao siêu nhanh nha. 6/6 đặt mà 7/6 đã về đến tay rồi nạ. Siêu yêu lun
"['cam đỏ', 'HỒNG', 'XANH DƯƠNG', 'XANH LÁ']","[265000000, 270000000, 270000000, 270000000]",5,"Sản phẩm chất lượng, dưỡng ẩm oke, dùng khá là thích, phù hợp giá tiền"
"['HỒNG', 'XANH DƯƠNG', 'XANH LÁ']","[270000000, 270000000, 270000000]",5,Sản phẩm tốt. Chưa dùng nên chưa biết chất lượng ra sao 🦄🦄🦄🦄🦄🦄
['XANH DƯƠNG'],[270000000],5,Giao hàng nhanh đóng gói ổn............chất lượng phục vụ khá........
"['Đá băng Images', 'cam đỏ', 'mix 3 màu HA', 'HA xanh dương cấp ẩm']","[250000000, 250000000, 265000000, 260000000]",5,Giao đủ hàng khá ổnnnn nnnnnbnnnnnnnnnnnnnnnnnnnnnnnnnn
"['Đá băng Images', 'cam đỏ', 'mix 3 màu HA', 'HA xanh dương cấp ẩm']","[250000000, 250000000, 265000000, 260000000]",5,Giao hàng đầy đủ đúng mẫu nhưng quá lâu gần hai tuần lận
['mix 3 màu HA'],[265000000],5,"Giao hàng nhanh đủ hàng nhìn cute á moi nguoiii
Shop cũng cute á"
"['HỒNG', 'XANH DƯƠNG', 'XANH LÁ']","[270000000, 270000000, 270000000]",5,"Hshshshbsbsbbdbdbdbdb
Hshshhshshssjsjsjdj
Hshshhshdjdjjjdjdjdj
Hshshhsjssjdjjdjd
Hshshshshs
"
"['Đá băng Images', 'cam đỏ', 'HA xanh dương cấp ẩm', 'HỒNG', 'XANH DƯƠNG', 'XANH LÁ']","[265000000, 265000000, 270000000, 270000000, 270000000, 270000000]",5,"Mặt nạ giao đủ sổ lượng lắm ạ
Chưa sử dụng nên cũng không biết có hiệu quả như nào 😀😀"
"['cam đỏ', 'mix 3 màu HA', 'HA vàng trắng da', 'HỒNG', 'XANH DƯƠNG', 'XANH LÁ']","[265000000, 265000000, 260000000, 265000000, 265000000, 265000000]",5,"Giao hàng nhanh, chưa dùng nhưng có vẻ khá oke, nếu dùng thấy ưng lần sau sẽ ủng hộ shop tiếp ạ"
"['Đá băng Images', 'XANH LÁ']","[265000000, 270000000]",5,"Sản phẩm tốt, chất lượng, dễ dùng, mát,.................."
"['HA vàng trắng da', 'HA xanh dương cấp ẩm', 'HỒNG', 'XANH LÁ']","[270000000, 270000000, 270000000, 270000000]",5,Giao hàng nhanh nhưng đóng gói hơi sơ sài. Hình ảnh chỉ để nhận xu 
"['mix 3 màu HA', 'HA vàng trắng da', 'HA xanh dương cấp ẩm', 'HỒNG', 'XANH DƯƠNG', 'XANH LÁ']","[265000000, 260000000, 260000000, 265000000, 265000000, 265000000]",5,"Hàng đẹp
Nên mua
Mọi thứ còn lại chỉ mang tính chất nhận xu nha mn"
"['cam đỏ', 'HỒNG', 'XANH DƯƠNG', 'XANH LÁ']","[265000000, 270000000, 270000000, 270000000]",5,"Ảnh và video mang tính chấy nhận xu
❤❤❤❤❤❤❤❤❤❤❤❤❤❤❤❤❤❤❤❤❤❤❤❤❤❤❤❤❤❤❤❤"
['mix 3 màu HA'],[265000000],4,"Sản phẩm hài lòng
Giao hàng nhanh 
Chưa dùng nên chưa biết
Mình mua khá nhiều nên đc tặng thêm 1 cái"
['XANH DƯƠNG'],[265000000],5,"Gói cận thận  , hàng giao nhanh ,hàng tuy ko đc chất lượng lắm nhưng vẫn ok"
"['XANH DƯƠNG', 'XANH LÁ']","[265000000, 265000000]",5,sjdbjjdjsjnsnjjjdndndjdndndjjdndnhujnkkkhghuuhythjh
"['HỒNG', 'XANH DƯƠNG']","[270000000, 270000000]",5,"giao hàng nhanh, đóng gói sản phẩm tốt, mặt nạ rẻ đắp okeeeeeeee"
['HA vàng trắng da'],[265000000],5,"Hàng xinh xắn và đẹp so với giá. Shop giao hàng nhanh, đóng gói hàng cẩn thận. Shipper giao hnagf thân thiện. Chất lượng sản phẩm ok. Sẽ ủng hộ shop vào lần sau."
['XANH DƯƠNG'],[270000000],5,"Giao hàng nhanh , đóng hàng chắc chắn , shipper thân thiện...."
"['HỒNG', 'XANH LÁ']","[270000000, 270000000]",5,Giao hàng nhanh. Sản phẩm dùng cũng chất lượng nnnmkkjnnnnj
['HỒNG'],[265000000],5,jsiwjebdjxbfnkdnx xjsjsnajxjdndndkdndksbshdjeksjdhdbdjdjrjfndksjsbhrdjjsksnejdkdnsjsjshaggsjsbsbdjdjdjdndj
"['Đá băng Images', 'HỒNG', 'XANH DƯƠNG', 'XANH LÁ']","[265000000, 270000000, 270000000, 270000000]",5,"Sản phẩm tốt, giao hàng nhanh. Hình ảnh mang tính chất nhận xu"
['mix 3 màu HA'],[265000000],5,"Gihifudihpnpnkvhxcibo ở ôn u cuồn ở ucucugoni juxtdubovya ghi hũ hụiidufivk. Đui hồnvhhhjjcđhjknbvdthjjjjjkkkkvgdd bídh
"
"['cam đỏ', 'HA vàng trắng da', 'HỒNG', 'XANH DƯƠNG', 'XANH LÁ']","[265000000, 260000000, 265000000, 265000000, 265000000]",5,"Shop phục vụ cực kỳ tốt, mua hàng còn được tặng kèm mã VC , sẽ ủng hộ shop tiếp"
"['Đá băng Images', 'HA vàng trắng da', 'HỒNG', 'XANH LÁ']","[270000000, 270000000, 270000000, 270000000]",5,"Giao hàng nhanh, đủ, đóng góp sản phẩm rất chắc chắn. Mặt nạ đắp mát, phù hợp với giá tiền."
"['Đá băng Images', 'cam đỏ', 'HỒNG', 'XANH DƯƠNG', 'XANH LÁ']","[265000000, 265000000, 270000000, 270000000, 270000000]",5,"Chưa dùng nhưng giao đủ hàng, đóng gói cẩn thận............"
['XANH DƯƠNG'],[265000000],5,đóng hàng rất cảm thận như giao chậm quá cho shop 5 sao shop cho xu nhé
['XANH LÁ'],[265000000],5,Hình ảnh mang tính chất nhận xu thôi nhưng mặt nạ đắp thích lắm nhée
['XANH DƯƠNG'],[270000000],5,"Giao hàng nhanh số lượng đầy đủ ạ .lần sau sẽ ủng hộ tiếp .
"
"['Đá băng Images', 'HA vàng trắng da', 'XANH LÁ']","[265000000, 270000000, 270000000]",5,Mặt nạ dùng siêu thích luôn ạ. Ta nói nó phê ơi là phê.Mình sẽ ủng hộ shop dài dài. Mọi người nên mua nhé. Sản phẩm dùng rất thích ạ
"['Đá băng Images', 'cam đỏ', 'HỒNG', 'XANH DƯƠNG', 'XANH LÁ']","[265000000, 265000000, 270000000, 270000000, 270000000]",5,Hàng ok lắm nhaa nên mua ksksnsnsjsnskzmzksmsmmsmjsjsnsjsnsmsksmsksjsj
"['Đá băng Images', 'HỒNG', 'XANH DƯƠNG', 'XANH LÁ']","[265000000, 265000000, 265000000, 265000000]",5,"C7fgzitxotzitxpy,igcqupvupscidvus wiwbiecobdosviwvoevd9 wkqvowboehodbodbeo2"
"['HỒNG', 'XANH DƯƠNG', 'XANH LÁ']","[270000000, 270000000, 270000000]",5,"shop giao nhanh, giao thiếu hàng nhưng xử lí và hoàn tiền cho khách nhanh, hàng dùng ổn. "
"['HA xanh dương cấp ẩm', 'HỒNG', 'XANH DƯƠNG']","[260000000, 250000000, 250000000]",5,"Giao hàng nhanh, sản phẩm đủ số lượng, chưa dùng nên không biết thế nào, sp của nước ngoài nên không biết hạn sử dụng như nào nên cũng hơi lo."
"['HA vàng trắng da', 'HA xanh dương cấp ẩm', 'XANH DƯƠNG']","[260000000, 260000000, 250000000]",5,Qoeodishahababxbxmapqpqpsisjdudhdhdbdbsbananansnsndhshquqoaksjxnxbshsjaoaowodjdhdhshajsndn
"['HA vàng trắng da', 'XANH LÁ']","[260000000, 265000000]",5,"Đóng gói sản phẩm cẩn thận, dùng oki sẽ review sau"
['mix 3 màu HA'],[265000000],5,Giao hàng đủ chưa đắp nên kb như thế nào...................
"['mix 3 màu HA', 'HA vàng trắng da']","[265000000, 260000000]",5,kgsugsigdigdkgdgkkbfkydkgssjgzkgdkgsgjhfsfjsigsigxbhfj jvuv j gh ibbu. hh
"['HỒNG', 'XANH LÁ']","[264000000, 264000000]",5,"Sản phẩm được giao nhanh, chắc chắn, chưa thử nên kb có ok hay không"
['XANH LÁ'],[250000000],5,"em phải nói là mặt nạ rất là ok mn ạ 
nên mua nha
shop giao nhanh nữa"
"['Đá băng Images', 'XANH DƯƠNG', 'XANH LÁ']","[265000000, 270000000, 270000000]",5,"Đóng gói cẩn thận 
Nhưng mà đơn hàng 24k,đưa 100k cho shipper mà phụ lại thiếu mất 10k
Hzz nhưnh mà thấy trời nắng nôi nên thôuii"
"['XANH DƯƠNG', 'XANH LÁ']","[270000000, 270000000]",5,Chất lượng sản phẩm chưa thử nên chứ biết sẽ đánh giá sau. Đủ đúng số lượng và loại 
"['HỒNG', 'XANH DƯƠNG', 'XANH LÁ']","[265000000, 265000000, 265000000]",5,Okelaaa lắm mua lần thứ 2 rồi nè dùng thích cực mn mua ủng hộ shop nha <3
['mix 3 màu HA'],[265000000],5,"Sản phẩm rất tốt ạ, giao hàng cũng khá nhanh, sẽ ủng hộ shop tiếp"
"['HỒNG', 'XANH DƯƠNG']","[250000000, 250000000]",5,RfiyojchkjydfjgudfXjgkcsysitatusyhlfjpstaruasphpisurjl có hiiiffuuduuoupudppuupupppuuuuouorytaty
"['Đá băng Images', 'HỒNG', 'XANH DƯƠNG', 'XANH LÁ']","[265000000, 270000000, 270000000, 270000000]",5,K bt có chính hãng k vì k thấy shop trả lời. Đắp xong thì thấy mát và mịn da. Đóng gói đầy đủ
['mix 3 màu HA'],[265000000],5,Jdjekksvsksjcdksksvksvskevdkxk rksjdvfkrkdbdndjdkejskxutvosjxvfowpshdvjrlsjxvkvis jsjeovdksksvjrlsbxvksksbsjdkdkabjxorbjsnxc
"['HA xanh dương cấp ẩm', 'XANH DƯƠNG']","[260000000, 250000000]",5,"Shop giao đủ , đóng gói đẹp, nên mua nha, shop dtw lắm"
"['HA xanh dương cấp ẩm', 'XANH DƯƠNG']","[260000000, 265000000]",5,Heuxixijdbnwnsnkxkxnxcnndoqoisnxnxnndkowjznxnxnndnxkkskkdkxkdkkekxnnsjwiisnxnx
"['Đá băng Images', 'XANH DƯƠNG', 'XANH LÁ']","[265000000, 265000000, 265000000]",5,"Shop gói hàng cẩn thận nhưng trong quá trình vận chuyển thì cũng bị móp méo :)) sản phẩm dùng okkkk
"
"['HỒNG', 'XANH LÁ']","[270000000, 270000000]",5,"Chất lượng sản phẩm tuyệt vời, đóng gói sản phẩm rất đẹp, sẽ ủng hộ "
"['HA vàng trắng da', 'HA xanh dương cấp ẩm', 'HỒNG', 'XANH DƯƠNG', 'XANH LÁ']","[270000000, 270000000, 270000000, 270000000, 270000000]",5,"mặt nạ đắp thích, giao hàng nhanh , sẽ ủng hộ shop lần sau👍👍👍👍"
['XANH LÁ'],[265000000],5,Giao hàng nhanh nhưng nên cận thận phần đóng gói nha shop hàng chuẩn ko có vấn đề gì
['XANH DƯƠNG'],[270000000],5,Sản phẩm tốt lắcfkkdjfhfhfhfhfhfhfhhfhfhfhfhfhfhfhhfhfhdh
"['HỒNG', 'XANH LÁ']","[270000000, 270000000]",5,Con đỗ nghèo khỉ nhưng vẫn phải mua mặt nạ về đắp nha quí zị. Đắp cho bớt nghèo 🙃
"['HỒNG', 'XANH DƯƠNG', 'XANH LÁ']","[265000000, 265000000, 265000000]",5,Hàng đẹp chuẩn như hình đắp lên mướt da ……………………………………………….
"['HA vàng trắng da', 'HA xanh dương cấp ẩm']","[260000000, 260000000]",5,"Hàng giao hơi lâu, đóng gói cẩn thận, chất lượng mình chưa thử lên chưa biết"
"['HA vàng trắng da', 'HA xanh dương cấp ẩm']","[270000000, 270000000]",5,Nxnx xnxnxzj jsmsx ksksnd djsn s dnsn nsnd jdns ins Zn jsnsn ks 
['XANH LÁ'],[265000000],5,Hình ảnh và video mang tính chất nhận xu 😊😊😊😊😊😊😊😊😊😊😊😊😊😊😊😊😊😊😊😊
"['XANH DƯƠNG', 'XANH LÁ']","[265000000, 265000000]",5,"Đủ hàng. Đóng gói chắc chắn, sản phẩm được ................."
['XANH LÁ'],[270000000],5,"Giao hàng đủ , sản phẩm siêu ưng , mùi siêu thơm nên mua hàng nhé mọi người "
"['cam đỏ', 'HA vàng trắng da', 'HỒNG', 'XANH DƯƠNG', 'XANH LÁ']","[265000000, 260000000, 265000000, 265000000, 265000000]",5,"Shop đóng gói đẹp
Giao hàng nhanh, đủ số lượng
Mặt nạ chưa dùng nên ko biết thế nào ạ
Sẽ ủng hộ shop tiếp"
"['HỒNG', 'XANH DƯƠNG']","[265000000, 265000000]",5,"Giao hàng nhanh. Đúng, đủ số lượng
Giá thành rẻ. Nói chung ok."
['XANH LÁ'],[265000000],5,"Chưa dùng nên chưa biết chất lượng ntn, tốt thì sẽ ủng hộ tiếpp"
['mix 3 màu HA'],[265000000],5,"Shipper dthw lắm ạ
Giao hàng rất nhanh,chất lượng rất tốt thật sự đáng tiền
Shop phục vụ rất chu đáo nữa
Chúc shop bán đắt hàng nhé"
"['HỒNG', 'XANH DƯƠNG']","[270000000, 270000000]",5,"Giá rẻ nhưng chất lương sản phẩm rất ok. Đóng gói chắc chắn
Giao hàng nhanh"
"['XANH DƯƠNG', 'XANH LÁ']","[265000000, 265000000]",5,Thời gian giao hàng rất nhanh. Chưa dùng nhưng shop đóng gói kĩ. 😍😍😍😍😍😍😍😍😍😍
['mix 3 màu HA'],[265000000],5,Hàng về đủ giao hàng cũng khá nhanh chưa sử dụng sản phẩm nên chưa biết như thế nào
"['Đá băng Images', 'cam đỏ', 'HỒNG', 'XANH DƯƠNG']","[265000000, 265000000, 270000000, 270000000]",5,"Giao hàng nhanh ,đủ số lượng, shipper thân thiện, đánh giá 5 *"
"['Đá băng Images', 'HA vàng trắng da', 'XANH LÁ']","[265000000, 265000000, 265000000]",5,Giao hàng nhanh đúng sản phẩm èvjkugvnwmsjejdndjdjdjjdkde
"['mix 3 màu HA', 'HA vàng trắng da', 'HA xanh dương cấp ẩm', 'HỒNG', 'XANH DƯƠNG', 'XANH LÁ']","[265000000, 260000000, 260000000, 265000000, 265000000, 265000000]",5,"123456789
mát, đắp xong da khá mịn, k bị kích ứng.
123456789.     "
"['XANH DƯƠNG', 'XANH LÁ']","[250000000, 250000000]",5,Nhìn gói mặt nặ cute hjknbknbokbcc nvcbnbvhbccbbhbvjnbbjjhggh
