name,variations,price,rating_star,comment
"Sữa Rửa Mặt ""Thần Kỳ"" Some By Mi AHA-BHA-PHA 30 Days Miracel Acne Clear Foam 100ml",[''],[18500000000],5,"Mua hộ ạ
Sản phẩm chắc là ok hay sao ấy nên đứa em bảo mua lại. Mọi người nên dùng thử ạ. E cũng k biết chính hãng k 🤣🤣"
"Sữa Rửa Mặt ""Thần Kỳ"" Some By Mi AHA-BHA-PHA 30 Days Miracel Acne Clear Foam 100ml",[''],[18500000000],5,"Sản phẩm đóng gói chắc chắn, hàng chuẩn jejebshakehhdhdhdhdhdhdh"
"Sữa Rửa Mặt ""Thần Kỳ"" Some By Mi AHA-BHA-PHA 30 Days Miracel Acne Clear Foam 100ml",[''],[18700000000],5,Sp tuyệt vời nha mk mới sài đc 1 tuần thì đã đẩy đc rất nhìu mụn ẩn lun á shop thì luôn giải đáp mọi thắc mắc của mình nữa cực kì tốt ❤❤❤
"Sữa Rửa Mặt ""Thần Kỳ"" Some By Mi AHA-BHA-PHA 30 Days Miracel Acne Clear Foam 100ml",[''],[18900000000],5,"Đóng gói cẩn thận
Chất lượng sẽ phản hồi sau, hi vọng là hàng chính hãng."
"Sữa Rửa Mặt ""Thần Kỳ"" Some By Mi AHA-BHA-PHA 30 Days Miracel Acne Clear Foam 100ml",[''],[18500000000],5,"Sản phẩm y hình, shop đóng gói cẩn thận, có tem niêm phong, sp ok."
"Sữa Rửa Mặt ""Thần Kỳ"" Some By Mi AHA-BHA-PHA 30 Days Miracel Acne Clear Foam 100ml",[''],[18200000000],5,Sản phẩm dùng rất tốt... shop giao hàng nhanh... shiper thân thiện
"Sữa Rửa Mặt ""Thần Kỳ"" Some By Mi AHA-BHA-PHA 30 Days Miracel Acne Clear Foam 100ml",[''],[18900000000],5,"Rất tốt, rât hài lòng,  Rất đáng tiền sẽ ủng hộ shop tiếp ạ  🥰🥰🥰🥰🥰"
"Sữa Rửa Mặt ""Thần Kỳ"" Some By Mi AHA-BHA-PHA 30 Days Miracel Acne Clear Foam 100ml",[''],[18500000000],5,"Son thơm dã man, màu này đánh lên đẹp nè, mềm mươta tệp lun vào môiiiiiiiiiiiiiiiiiiijjjjiiii"
"Sữa Rửa Mặt ""Thần Kỳ"" Some By Mi AHA-BHA-PHA 30 Days Miracel Acne Clear Foam 100ml",[''],[18900000000],5,"Này mua nhiều rồi, ko nói gì thêm,tốt dùng bao phê..........."
"Sữa Rửa Mặt ""Thần Kỳ"" Some By Mi AHA-BHA-PHA 30 Days Miracel Acne Clear Foam 100ml",[''],[18700000000],5,"Chất lượng sp tuyệt vời
Đóng gói sản phẩm rất đẹp và chắc chắn 🌹"
"Sữa Rửa Mặt ""Thần Kỳ"" Some By Mi AHA-BHA-PHA 30 Days Miracel Acne Clear Foam 100ml",[''],[18900000000],5,"sữa rửa mặt dùng phê lắmmmmm lunn
tạo bọt nhẹ có mùi bạc hà 
sử dụng xong không bị sạch kin kít đâu mà còn giữ độ ẩm cho da
đỡ dầu hơn nữa "
"Sữa Rửa Mặt ""Thần Kỳ"" Some By Mi AHA-BHA-PHA 30 Days Miracel Acne Clear Foam 100ml",[''],[18500000000],5,"Lười chụp
Thời gian giao hàng rất lâu
Đóng gói sản phẩm rất đẹp và ko bị móp."
"Sữa Rửa Mặt ""Thần Kỳ"" Some By Mi AHA-BHA-PHA 30 Days Miracel Acne Clear Foam 100ml",[''],[18900000000],5,Sp như hình.giao hàng nhanh. Mn nên mua a.  Hình ảnh và video để lấy xu 
"Sữa Rửa Mặt ""Thần Kỳ"" Some By Mi AHA-BHA-PHA 30 Days Miracel Acne Clear Foam 100ml",[''],[18900000000],5,"Giao hàng nhanh cực luôn, mới đặt hôm qua là hôm nay có rồi like"
"Sữa Rửa Mặt ""Thần Kỳ"" Some By Mi AHA-BHA-PHA 30 Days Miracel Acne Clear Foam 100ml",[''],[18500000000],5,"Giao đủ hàng. Đóng gói chắc chắn. Thanks 
Giao đủ hàng. Đóng gói chắc chắn. Thanks"
"Sữa Rửa Mặt ""Thần Kỳ"" Some By Mi AHA-BHA-PHA 30 Days Miracel Acne Clear Foam 100ml",[''],[18700000000],5,Mình đã mua nhiều lần rồi nên rất yên tâm về sản phẩm . Mọi người nên mua nha 💕
"Sữa Rửa Mặt ""Thần Kỳ"" Some By Mi AHA-BHA-PHA 30 Days Miracel Acne Clear Foam 100ml",[''],[18900000000],5,"Chuẩn bị hàng nhanh, giao nhanh được tặng sấp khẩu trang khá ưng"
"Sữa Rửa Mặt ""Thần Kỳ"" Some By Mi AHA-BHA-PHA 30 Days Miracel Acne Clear Foam 100ml",[''],[18900000000],5,Cdj lkfeuv lgrijx.   Luethv. Kgdfbkun.  Lòc. Logfh. Đjkibgb vc 
"Sữa Rửa Mặt ""Thần Kỳ"" Some By Mi AHA-BHA-PHA 30 Days Miracel Acne Clear Foam 100ml",[''],[18500000000],5,Chất lượng sản phẩm tốt thời gian giao hàng nhanh😀😀😀😀😀😀😀😀
"Sữa Rửa Mặt ""Thần Kỳ"" Some By Mi AHA-BHA-PHA 30 Days Miracel Acne Clear Foam 100ml",[''],[18900000000],5,fjiddnsooxjxisnckzajanksxoxjsnndkcojwjwkxidjmwkxnxdndk
"Sữa Rửa Mặt ""Thần Kỳ"" Some By Mi AHA-BHA-PHA 30 Days Miracel Acne Clear Foam 100ml",[''],[18500000000],5,sp tốt
"Sữa Rửa Mặt ""Thần Kỳ"" Some By Mi AHA-BHA-PHA 30 Days Miracel Acne Clear Foam 100ml",[''],[18900000000],3,Không biết real hay fake nhưng mà cây kẻ mắt Kar của mình lợt nhách dù mình sóc nó 50 quận. Còn chai này thì mùi tràm trà nó hắc tới nỗi m phải nhắm mắt lại
"Sữa Rửa Mặt ""Thần Kỳ"" Some By Mi AHA-BHA-PHA 30 Days Miracel Acne Clear Foam 100ml",[''],[18900000000],5,Nice
"Sữa Rửa Mặt ""Thần Kỳ"" Some By Mi AHA-BHA-PHA 30 Days Miracel Acne Clear Foam 100ml",[''],[18700000000],5,"Giao hàng đầy đủ, đóng gói cẩn thận, chất lượng tốt tuy nhiên thời gian giao hàng quá lâu."
"Sữa Rửa Mặt ""Thần Kỳ"" Some By Mi AHA-BHA-PHA 30 Days Miracel Acne Clear Foam 100ml",[''],[18900000000],5,Đã mua sp ở shop nhiều lần. Chất lượng và rõ nguồn gốc tin tưởng vô cùng. Giao hàng nhanh nữa ^^
"Sữa Rửa Mặt ""Thần Kỳ"" Some By Mi AHA-BHA-PHA 30 Days Miracel Acne Clear Foam 100ml",[''],[18700000000],5,Đơn hàng được đóng gói chắc chắn. Thời gian giao hàng hơi lâu 1 xíu. 
"Sữa Rửa Mặt ""Thần Kỳ"" Some By Mi AHA-BHA-PHA 30 Days Miracel Acne Clear Foam 100ml",[''],[18900000000],5,Chất lượng sản phẩm tuyệt vời sản phẩm đóng gói chắc chắn và bền
"Sữa Rửa Mặt ""Thần Kỳ"" Some By Mi AHA-BHA-PHA 30 Days Miracel Acne Clear Foam 100ml",[''],[18900000000],5,Đã dùng bộ kit của some by me và rất ưng. Mua của shop thì luôn yên tâm về chất lượng
"Sữa Rửa Mặt ""Thần Kỳ"" Some By Mi AHA-BHA-PHA 30 Days Miracel Acne Clear Foam 100ml",[''],[18900000000],5,Mua lần thứ 2 rồi. Mua ở TGSF vừa rẻ vừa yên tâm về chất lượng. Kkkkkk
"Sữa Rửa Mặt ""Thần Kỳ"" Some By Mi AHA-BHA-PHA 30 Days Miracel Acne Clear Foam 100ml",[''],[18900000000],5,"Mỗi lần mua sản phẩm skincare mình hay chọn shop này để mua giá khá ổn và sản phẩm chất lượng cũng tốt nữa. Dòng some by me hiện mình đã dùng đủ một bộ trị mụn của ẻm hiệu quả thấy rõ nha rất tốt đấyyy 😚
Sữa rữa mặt không nhiều bọt lắm nhưng mịn và láng lắm riêng mình là khoái sp của some by me ròi"
"Sữa Rửa Mặt ""Thần Kỳ"" Some By Mi AHA-BHA-PHA 30 Days Miracel Acne Clear Foam 100ml",[''],[18900000000],5,"Giao nhanh, đúng hàng. Srm xài rất oke, ko bị kích ứng, sạch.."
"Sữa Rửa Mặt ""Thần Kỳ"" Some By Mi AHA-BHA-PHA 30 Days Miracel Acne Clear Foam 100ml",[''],[18500000000],5,Nhận xu Nhận xu Nhận xu Nhận xu Nhận xu Nhận xu Nhận xu Nhận xu Nhận xu Nhận xu Nhận xu Nhận xu Nhận xu Nhận xu Nhận xu
"Sữa Rửa Mặt ""Thần Kỳ"" Some By Mi AHA-BHA-PHA 30 Days Miracel Acne Clear Foam 100ml",[''],[18500000000],5,Shop giao hàng siêu nhanh luôn ạ. Chất lượng sản phẩm tuyệt vời!!!
"Sữa Rửa Mặt ""Thần Kỳ"" Some By Mi AHA-BHA-PHA 30 Days Miracel Acne Clear Foam 100ml",[''],[18900000000],5,"Giao hàng hơi lâu
Đóng gói tốt
Hàng chuẩn
Nên mua nha mnnnnnnnnn"
"Sữa Rửa Mặt ""Thần Kỳ"" Some By Mi AHA-BHA-PHA 30 Days Miracel Acne Clear Foam 100ml",[''],[18700000000],5,"Hàng đẹp, giao hàng sớm hơn dự kiến, siu xinhhhhhhh, lần sau sẽ ủng hộ"
"Sữa Rửa Mặt ""Thần Kỳ"" Some By Mi AHA-BHA-PHA 30 Days Miracel Acne Clear Foam 100ml",[''],[18900000000],5,"thần kỳ không biết có thần kỳ khônggg
ncl tùy duyên hahaha 🤣🤣🤣"
"Sữa Rửa Mặt ""Thần Kỳ"" Some By Mi AHA-BHA-PHA 30 Days Miracel Acne Clear Foam 100ml",[''],[18900000000],5,Chất lượng sản phẩm tuyệt vời. Giao hàng nhanh. Đóng gói sản phẩm cẩn thận.
"Sữa Rửa Mặt ""Thần Kỳ"" Some By Mi AHA-BHA-PHA 30 Days Miracel Acne Clear Foam 100ml",[''],[18900000000],5,"Sản phẩm dùng cải thiện rõ rệt, đánh bay mọi loại mụn
Đóng gói hàng cẩn thận"
"Sữa Rửa Mặt ""Thần Kỳ"" Some By Mi AHA-BHA-PHA 30 Days Miracel Acne Clear Foam 100ml",[''],[18900000000],5,"Giao hàng nhanh cực luôn, đóng gói sản phẩm kĩ lưỡng.. "
"Sữa Rửa Mặt ""Thần Kỳ"" Some By Mi AHA-BHA-PHA 30 Days Miracel Acne Clear Foam 100ml",[None],[18900000000],5,Hàng rất là ok luôn Some by mi có mùi bạc hà nhẹ rửa mặt rất mát. Sẽ ủng hộ shop tiếp
"Sữa Rửa Mặt ""Thần Kỳ"" Some By Mi AHA-BHA-PHA 30 Days Miracel Acne Clear Foam 100ml",[None],[18900000000],5,Ucihcjtxuxur uchcdxuxrxuxurcuxruirruxuxucrnhhhggbuvyvyvyvtvtvtvb
"Sữa Rửa Mặt ""Thần Kỳ"" Some By Mi AHA-BHA-PHA 30 Days Miracel Acne Clear Foam 100ml",[None],[21900000000],5,"Chất lượng sản phẩm tuyệt vời. Đóng gói kỹ càng. Tuy nhiên lần này giao hàng quá lâu so với mọi lần, hơi buồn."
"Sữa Rửa Mặt ""Thần Kỳ"" Some By Mi AHA-BHA-PHA 30 Days Miracel Acne Clear Foam 100ml",[None],[17700000000],5,Shbssjkakalalalallakskskkwkowowowowisjejsnensnwmsnwnnwnwnsnwnnwnwnwnwnnsnsmwksjwnwnnsnwnsnwnwww
"Sữa Rửa Mặt ""Thần Kỳ"" Some By Mi AHA-BHA-PHA 30 Days Miracel Acne Clear Foam 100ml",[None],[18900000000],5,"Bạn nhìn thấy dòng này là ng mua rất hài lòng với sản phẩm....,."
"Sữa Rửa Mặt ""Thần Kỳ"" Some By Mi AHA-BHA-PHA 30 Days Miracel Acne Clear Foam 100ml",[None],[18900000000],5,"Hàng chất lượng, giao hàng đúng mẫu đặt. Giao nhanh. mọi người nên mua nhé"
"Sữa Rửa Mặt ""Thần Kỳ"" Some By Mi AHA-BHA-PHA 30 Days Miracel Acne Clear Foam 100ml",[None],[17700000000],5,"Chưa dùng thử sp nên ko biết chất lượng ntn nhưng đánh giá 5* về cách chăm sóc khách hàng rất chuyên nghiệp và uy tín, đổi hàng trong vòng 1 nốt nhạc."
"Sữa Rửa Mặt ""Thần Kỳ"" Some By Mi AHA-BHA-PHA 30 Days Miracel Acne Clear Foam 100ml",[None],[17700000000],5,"Chuẩn bị hàng hơi lâu, gói cẩn thận, lười quay video nên dùng tạm, kem chống nắng dùng được, vẫn ko kiềm dầu được. "
"Sữa Rửa Mặt ""Thần Kỳ"" Some By Mi AHA-BHA-PHA 30 Days Miracel Acne Clear Foam 100ml",[None],[17700000000],5,"Dùng thích lắm ạ. Nhưng mùi không được thơm, nc là rất ok hihihu"
"Sữa Rửa Mặt ""Thần Kỳ"" Some By Mi AHA-BHA-PHA 30 Days Miracel Acne Clear Foam 100ml",[None],[17900000000],5,"Chất lượng sản phẩm tuyệt vời
Đóg gói sản phẩm rất đẹp và chắc chắn
Cám ơn shop 😍"
"Sữa Rửa Mặt ""Thần Kỳ"" Some By Mi AHA-BHA-PHA 30 Days Miracel Acne Clear Foam 100ml",[None],[17700000000],5,Sản phẩm chất lượng ok. Chất kem dễ thấm. Thơm mùi tràm trà. Dùng rất dịu da. Sữa rửa mặt bọt mịn siêu thích. Son đẹp khỏi chê😉
"Sữa Rửa Mặt ""Thần Kỳ"" Some By Mi AHA-BHA-PHA 30 Days Miracel Acne Clear Foam 100ml",[None],[21900000000],5,Sản phẩm tuyệt vờiiiiiiiiiiiiiiiiiii ông mặt trờiiiiiiiiiioiioooooooooooooooooooooooo
"Sữa Rửa Mặt ""Thần Kỳ"" Some By Mi AHA-BHA-PHA 30 Days Miracel Acne Clear Foam 100ml",[None],[17700000000],5,"Giao hàng nhanh, đóng gói hàng cẩn thận, lần sau sẽ cũng hộ shop "
"Sữa Rửa Mặt ""Thần Kỳ"" Some By Mi AHA-BHA-PHA 30 Days Miracel Acne Clear Foam 100ml",[None],[18900000000],5,Sản phẩm okkkkkkkkkkkkkkkkkkkkkkkkkkkkkkkkkkkkkkkkkk
"Sữa Rửa Mặt ""Thần Kỳ"" Some By Mi AHA-BHA-PHA 30 Days Miracel Acne Clear Foam 100ml",[None],[17700000000],5,"Chất lượng sản phẩm tuyệt vời.
Giao hàng nhanh.
Đóng gói sân phẩm chắc chắn
♥♥♥♥♥♥♥"
"Sữa Rửa Mặt ""Thần Kỳ"" Some By Mi AHA-BHA-PHA 30 Days Miracel Acne Clear Foam 100ml",[None],[17700000000],5,Sửa rửa mặt giống hình mua ở shop nhiều lần lắm rồi đóoooooo sẽ ủng hộ lần sau nha hihi ksjbskwosksbvsbskskskznzn
"Sữa Rửa Mặt ""Thần Kỳ"" Some By Mi AHA-BHA-PHA 30 Days Miracel Acne Clear Foam 100ml",[None],[17700000000],5,Hdhdhdndnsnsbdbdbdbdbdbdbdbdbjnsnsnssnsnsnnssbbsnssn
"Sữa Rửa Mặt ""Thần Kỳ"" Some By Mi AHA-BHA-PHA 30 Days Miracel Acne Clear Foam 100ml",[None],[17700000000],5,"Sữa rửa mặt xài rất thích 
Rửa xog mặt rất sạch
Mua mấy lần r vẫn thấy thích 
"
"Sữa Rửa Mặt ""Thần Kỳ"" Some By Mi AHA-BHA-PHA 30 Days Miracel Acne Clear Foam 100ml",[None],[17700000000],5,
"Sữa Rửa Mặt ""Thần Kỳ"" Some By Mi AHA-BHA-PHA 30 Days Miracel Acne Clear Foam 100ml",[''],[18900000000],5,
"Sữa Rửa Mặt ""Thần Kỳ"" Some By Mi AHA-BHA-PHA 30 Days Miracel Acne Clear Foam 100ml",[''],[18500000000],5,"Mình mượn được 4tr từ 1 người dưng xa lạ!

Đúng vậy, giữa dòng đời tấp nập này  con người vô tình thì nhiều, cộng thêm mùa dịch bệnh này ai cũng phải lo cho bản thân mình vậy mà lại có 1 bạn xa lạ không quen biết không gặp ngoài đời cũng chưa từng nói chuyện với tôi và chẳng biết nhà cửa tôi ở đâu, "
"Sữa Rửa Mặt ""Thần Kỳ"" Some By Mi AHA-BHA-PHA 30 Days Miracel Acne Clear Foam 100ml",[''],[18900000000],5,"Khá là oki luônnn, mình mua sp của shop là lần thứ n rồi nè. Dịch nhưng giao hàng vẫn nhanh ạ hihiii"
"Sữa Rửa Mặt ""Thần Kỳ"" Some By Mi AHA-BHA-PHA 30 Days Miracel Acne Clear Foam 100ml",[''],[18900000000],5,
"Sữa Rửa Mặt ""Thần Kỳ"" Some By Mi AHA-BHA-PHA 30 Days Miracel Acne Clear Foam 100ml",[''],[18200000000],5,"Lần đầu tiên sử dụng cảm thấy sạch k còn nhờn, da k bị khô, cảm giác rất thích, tuy nhiên mùi thì k đc thơm cho lắm "
"Sữa Rửa Mặt ""Thần Kỳ"" Some By Mi AHA-BHA-PHA 30 Days Miracel Acne Clear Foam 100ml",[''],[18900000000],5,"Sản phẩm còn nguyên tem, check đúng mã vạch, hàng chuẩn nên luôn tin tưởng shop. Giao hàng đầy đủ, nhanh chóng"
"Sữa Rửa Mặt ""Thần Kỳ"" Some By Mi AHA-BHA-PHA 30 Days Miracel Acne Clear Foam 100ml",[''],[18900000000],5,"luôn yên tâm sử dụng sản phẩm của shop, gói hàng chcwa chắn, giao hàng nhanh"
"Sữa Rửa Mặt ""Thần Kỳ"" Some By Mi AHA-BHA-PHA 30 Days Miracel Acne Clear Foam 100ml",[''],[18900000000],5,
"Sữa Rửa Mặt ""Thần Kỳ"" Some By Mi AHA-BHA-PHA 30 Days Miracel Acne Clear Foam 100ml",[''],[18900000000],5,Giao hàng nhanh. Hàng auth 
"Sữa Rửa Mặt ""Thần Kỳ"" Some By Mi AHA-BHA-PHA 30 Days Miracel Acne Clear Foam 100ml",[''],[18500000000],5,
"Sữa Rửa Mặt ""Thần Kỳ"" Some By Mi AHA-BHA-PHA 30 Days Miracel Acne Clear Foam 100ml",[''],[18700000000],5,
"Sữa Rửa Mặt ""Thần Kỳ"" Some By Mi AHA-BHA-PHA 30 Days Miracel Acne Clear Foam 100ml",[''],[18500000000],5,"Hàng Authenticity, đã check qua hidden app, chất lượng, tốt."
"Sữa Rửa Mặt ""Thần Kỳ"" Some By Mi AHA-BHA-PHA 30 Days Miracel Acne Clear Foam 100ml",[''],[18900000000],5,"Sản phẩm đúng mô tả, giao đúng sản phẩm, size, shop giao hàng nhanh."
"Sữa Rửa Mặt ""Thần Kỳ"" Some By Mi AHA-BHA-PHA 30 Days Miracel Acne Clear Foam 100ml",[''],[18700000000],5,"Hàng gói rất kĩ và cẩn thận, rất uy tín ạ!!!!!!!! 
Lần sau sẽ tiếp tục ủng hộ shop................... 
❤😊😍😊😍"
"Sữa Rửa Mặt ""Thần Kỳ"" Some By Mi AHA-BHA-PHA 30 Days Miracel Acne Clear Foam 100ml",[''],[18700000000],5,"hàng đóng gói cẩn thận, nhận xong yêu thương quá luôn :)) shipper thân thiện nữa :>"
"Sữa Rửa Mặt ""Thần Kỳ"" Some By Mi AHA-BHA-PHA 30 Days Miracel Acne Clear Foam 100ml",[''],[18900000000],5,
"Sữa Rửa Mặt ""Thần Kỳ"" Some By Mi AHA-BHA-PHA 30 Days Miracel Acne Clear Foam 100ml",[''],[18700000000],5,🤩
"Sữa Rửa Mặt ""Thần Kỳ"" Some By Mi AHA-BHA-PHA 30 Days Miracel Acne Clear Foam 100ml",[''],[18900000000],5,"sản phẩm tốt và giống như mô tả , nhận hàng đầy đủ , rất đáng tiền , thời gian giao hàng nhanh , rất hài lòng*****"
"Sữa Rửa Mặt ""Thần Kỳ"" Some By Mi AHA-BHA-PHA 30 Days Miracel Acne Clear Foam 100ml",[''],[18900000000],4,"Giao hàng nhanh, mới đặt tối qua hôm sau có rồi, sản phẩm tem nhãn đầy đủ, đóng gói rất kỹ"
"Sữa Rửa Mặt ""Thần Kỳ"" Some By Mi AHA-BHA-PHA 30 Days Miracel Acne Clear Foam 100ml",[''],[18900000000],5,"Sửa rửa mặt dùng rất oki nha. Em mua hàng của shop nhiều lần rồi, khá là ưng ý "
"Sữa Rửa Mặt ""Thần Kỳ"" Some By Mi AHA-BHA-PHA 30 Days Miracel Acne Clear Foam 100ml",[''],[18900000000],5,hàng ok 
"Sữa Rửa Mặt ""Thần Kỳ"" Some By Mi AHA-BHA-PHA 30 Days Miracel Acne Clear Foam 100ml",[''],[18900000000],5,"Sản phẩm tốt,nhưng thời gian giao hàng hơi chậm
Hình ảnh mang tính chất nhận xu"
"Sữa Rửa Mặt ""Thần Kỳ"" Some By Mi AHA-BHA-PHA 30 Days Miracel Acne Clear Foam 100ml",[''],[18900000000],5,Mua ở đây luôn luôn hài lòng. Đóng gói chắc chắn. Giao hàng nhanh. Sản phẩm chất lượng.
"Sữa Rửa Mặt ""Thần Kỳ"" Some By Mi AHA-BHA-PHA 30 Days Miracel Acne Clear Foam 100ml",[''],[18900000000],5,"da đang có vấn đề k đẹp,k mịn, sd đc tuần da cải thiện rõ rệt"
"Sữa Rửa Mặt ""Thần Kỳ"" Some By Mi AHA-BHA-PHA 30 Days Miracel Acne Clear Foam 100ml",[''],[18900000000],5,"Sửa rửa mặt rất phù hợp cho da mụn và nhờn, mình dùng thấy rất tuyệt"
"Sữa Rửa Mặt ""Thần Kỳ"" Some By Mi AHA-BHA-PHA 30 Days Miracel Acne Clear Foam 100ml",[''],[18500000000],5,"Dùng siêu thích
Sạch mụn
Dịu nhẹ"
"Sữa Rửa Mặt ""Thần Kỳ"" Some By Mi AHA-BHA-PHA 30 Days Miracel Acne Clear Foam 100ml",[''],[18900000000],5,Mê😍😍
"Sữa Rửa Mặt ""Thần Kỳ"" Some By Mi AHA-BHA-PHA 30 Days Miracel Acne Clear Foam 100ml",[''],[18900000000],5,"Nói chung là mua đồ ở đây k lo ạ. Shop còn rất tâm lý, sợ quên quay lại bọc hai lớp liền. Thương!!!"
"Sữa Rửa Mặt ""Thần Kỳ"" Some By Mi AHA-BHA-PHA 30 Days Miracel Acne Clear Foam 100ml",[''],[18900000000],5,tuỵt
"Sữa Rửa Mặt ""Thần Kỳ"" Some By Mi AHA-BHA-PHA 30 Days Miracel Acne Clear Foam 100ml",[None],[18600000000],5,"Giao hàng nhanh, đóng gói sản phẩm chắc chắn, chất lượng tuyệt vời đã mua chai thứ 3 ở shop, sẽ mua tiếp,Giao hàng nhanh, đóng gói sản phẩm chắc chắn, chất lượng tuyệt vời đã mua chai thứ 3 ở shop, sẽ mua tiếp,"
"Sữa Rửa Mặt ""Thần Kỳ"" Some By Mi AHA-BHA-PHA 30 Days Miracel Acne Clear Foam 100ml",[None],[18900000000],5,Shop phụ vụ tốt nên mua nha.sẽ tiếp tục ủng hộ lần sau.cho shop 5 sao
"Sữa Rửa Mặt ""Thần Kỳ"" Some By Mi AHA-BHA-PHA 30 Days Miracel Acne Clear Foam 100ml",[''],[18900000000],5,Ok lắm
"Sữa Rửa Mặt ""Thần Kỳ"" Some By Mi AHA-BHA-PHA 30 Days Miracel Acne Clear Foam 100ml",[None],[18900000000],5,"Đã nhận được hàng của shop, vẫn luôn tin tưởng mua hàng bên shop, dù ở xa nhưng giao hàng nhanh, đóng gói cẩn thận, hàng chất lượng, sẽ tiếp tục ủng hôn 🥰"
"Sữa Rửa Mặt ""Thần Kỳ"" Some By Mi AHA-BHA-PHA 30 Days Miracel Acne Clear Foam 100ml",[None],[17900000000],5,"Đóng gói chắc chắn, bọc hàng cẩn thận, sản phẩm nguyên seal 💖
Sữa rửa mặt thơm mùi bạc hà đặc trưng, 100ml dùng lần đầu thấy relax thật sự, nhẹ nhàng nhưng sạch mà vẫn ẩm mượtt!"
"Sữa Rửa Mặt ""Thần Kỳ"" Some By Mi AHA-BHA-PHA 30 Days Miracel Acne Clear Foam 100ml",[None],[17900000000],5,"Tôi nói thật nhá, mua hàng ở Skinfood quan trọng là các bạn có chọn đúng sản phẩm phù hợp với bản thân hay không thôi, chứ chả sợ mua ở Skinfood mà lại dính fake đâu, không xảy ra bao giờ đâu. 
P/s: Sản phẩm Some by mi tuyệt vời "
"Sữa Rửa Mặt ""Thần Kỳ"" Some By Mi AHA-BHA-PHA 30 Days Miracel Acne Clear Foam 100ml",[None],[17700000000],5,Vì mình lười nên ném tạm cái ảnh vào đây chứ thực ra là shop đóng hàng cẩn thận lắm nhé :))) mình mới dùg thôi nên chưa review đc sp cơ mà dùg có cảm giác là hợp vs da hơi mụn á. 
"Sữa Rửa Mặt ""Thần Kỳ"" Some By Mi AHA-BHA-PHA 30 Days Miracel Acne Clear Foam 100ml",[None],[18900000000],5,"Nghe review lâu rồi nay mới có dịp mua để dùng. Chưa dùng thử, nói chung nhìn ưng :3"
"Sữa Rửa Mặt ""Thần Kỳ"" Some By Mi AHA-BHA-PHA 30 Days Miracel Acne Clear Foam 100ml",[None],[17700000000],5,Mình dùng srm này nhiều lần rồi.nhưng đây là lần đầu tiên mua của shop tại thấy giá tốt.nhận hàng rất hài lòng nha shop hàng chuẩn xịn.từ nay sẽ phải gắn bó với shop thôi
