variations,price,rating_star,comment
['Hồng 500ml'],[33700000000],5,"Ok nha, gói kỹ hàng tem mạc đàng hoàng mua nhiều lần rồi lần nào cũng rất yên tâm. Giá lại rẻ nữa sẽ ủng hộ dài dài"
['Hồng 500ml'],[33700000000],5,Hàng chính hãng. Đã dùng rất nhiều sp mua ở Pan. Dùng rất yên tâm 
['Hồng 500ml'],[33700000000],5,"Lần đầu dùng tẩy trang sáp mà thích quá
Gọn gàng sạch sẽ hơn em tẩy trang dầu đi đâu cũng ngại mang theo
Ngày không ra ngoài mình sẽ tẩy trang nước thôi
Khi nào đi nhiều và bí bí sẽ xài em tẩy trang sáp"
['Xanh 500ml'],[33700000000],5,"Hàng chuẩn, đóng gói tốt ko bật nắp rỉ nước, tẩy trang siêu sạch, hsjdjdkdnnxnsjsnxjjznxndnxnxnnxnxnxnxnxnxn"
['Xanh 500ml'],[33700000000],5,"Giao hàng nhanh, đóng gói kĩ càng chắc chắn. Hàng chuẩn auth, mình mua nhiều lần ở đây nên rất yên tâm"
['Hồng 500ml'],[33700000000],5,Mua hàng lần thứ nnnnn rồi :))) oke lắm ạ . Quét mã qr cũng ra web bioderma ạ 
['Hồng 500ml'],[33700000000],5,"Toàn mua của shoppppppppp yên tâm tuyệt đối , hiiiiiiiiijjjjj"
['Hồng 500ml'],[33700000000],5,Đã nhận được hàng. Thank shopppppppppppppppppppppppppppppppppp
['Hồng 500ml'],[33700000000],5,Đã mua nhieu lần lần nao cũg ưng á. K chụp dc hình nên lấy tạm hình cũ.
['Hồng 500ml'],[33700000000],5,"Shop gói hàng cẩn thận, giao hàng nhanh. Lần đầu tiên mua hàng, hy vọng sp chuẩn"
['Hồng 500ml'],[33700000000],5,
['Hồng 500ml'],[33700000000],5,"
Rất good rất rất good nên mua nên mua nên mua các bạn nhé
Giao hàng không nhanh lắm gói hàng cẩn thận, gọn gàng
Hàng chất lượng nha"
['Xanh 500ml'],[33700000000],5,"Giao hàng nhanh chóng, gói hàng cẩn thận.
Sẽ tiếp tục ủng hôn shop"
['Xanh 500ml'],[33700000000],5,"Tải lên lấy xu thui chứ order nhiều của shop quen rồi, đóng gói cũng cẩn thận hahahahh"
['Hồng 500ml'],[33700000000],5,"Hàng chuẩn, đã mua shop nhiều lần rất yên tâm, hết sẽ ủng hộ tiếp"
['Hồng 500ml'],[33700000000],5,"Đóng gói cẩn thận , giao hàng nhanh, dùng loại này thì yên tâm rồi, ......."
['Xanh 500ml'],[33700000000],5,"Giao hàng nhanh, shop tư vấn nhiệt tình với dê thương lắm ạ. Sẽ mua lại"
['Xanh 500ml'],[33700000000],5,😍😍hhjikhghaUw svzhaiak xzguas xhudndvgau szvhos svxgebhaus😛😛
['Hồng 500ml'],[33600000000],5,Sản phẩm tuyệt vời. Tôi rất hài lòng. Tôi rất thích. Okokokikoko okokok okofhjkkn họdoeje ndieofnebd bsjndbdj jskndbd jskknđk jdkdnfndn jdkkedneb hdjwkdndb bdjdjdfnfndndjdjcnnf
['Hồng 500ml'],[33700000000],5,"Hàng đóng gói chắc chắn, chuẩn hàng auth, nhưng thời gian chờ lâu. Dùng màu hồng hợp.vs da nhạy cảm"
['Hồng 500ml'],[33600000000],5,Chất lượng chuẩn chỉ. Dịch vụ tốt. Đã mua lại nhiều lần. Tiện lợi giá tốt. 
['Hồng 500ml'],[33700000000],5,Mua shop rất nh lần rồi thấy đổi tren sp tưởng k bán dòng này nữa :)))))) chlg vẫn rất ok nhaasaasaa
['Xanh 500ml'],[31800000000],5,Đóng gói chắc chắn.chưa sử dụng nên hiệu quả sẽ đánh giá sau 👍🏻👍🏻
['Hồng 500ml'],[32700000000],5,"Vid với hình k liên quan
Tẩy trang chuẩn auth nhe dùng k biết bao nhiêu chai rồi á
Tẩy nhẹ nhàng nhưng sạch k có cảm giác nhờn dính "
['Xanh 500ml'],[31800000000],5,"Mua quá nhiều lần rồi lần nao cũng ưng hếtt, se ung hộ shop thêm. Giao nhanh okkk"
['Hồng 500ml'],[33700000000],5,"Sp tốt , tẩy sạch, phù hợp mọi loại da, đã dùng và rất hài lòng, ok"
['Hồng 500ml'],[32700000000],5,"Giao hàng nhanh, đã mua của nhà pan nhiều lần sẽ tiếp tục ủng hộ"
['Xanh 500ml'],[31900000000],5,"Đã nhận hàng. Giao hàng nhanh chóng, đóng gói sản phẩm cẩn thận và chắc chắn. Lần đầu dùng bản mài xanh"
['Xanh 500ml'],[31900000000],5,Mua đồ nhà Pan nhiều rồi. Cứ cần đồ j là qua panbeo đặt hàng....
['Hồng 500ml'],[32700000000],5,"Chất lượng sp tuyệt vời đóng gói chắc chắn
Hình ảnh mang tính chất nhận xu"
['Hồng 500ml'],[29500000000],5,"Sản phẩm okieeeee , hình ảnh mang tính chất minh họa, tin tưởng shop vì đc review rùi ạ"
['Xanh 500ml'],[31800000000],5,"Hàng nhà pan thì chuẩn rồi, ko cần kiểm tra chất lượng. Đóng gói cẩn thận"
['Hồng 500ml'],[29500000000],5,"Sorry shopinhf k có sản phẩm ở đây,  đóng gói cẩn thận,  giao hàng nhanh,  đã mua hàng của shop rồi,  nói chung mua vì tin tưởng nữa,  k check aut,  fake"
['Xanh 500ml'],[31800000000],5,Đồ nhà Pan thì m mua nhiều lần lắm r. Chất lượng k bao giờ phải bàn cãi. Bạn chủ shop còn dễ thương nữa chứ 🤣
['Hồng 500ml'],[29600000000],5,"Chất lượng sản phẩm ok, đã mua hàng nhiều của shop ❤️❤️❤️❤️❤️"
['Hồng 500ml'],[29600000000],5,"Đóng gói và giao hàng ok. Tuy nhiên sữa tắm mình đặt chai màu đen shop giao nhầm chai màu đỏ, mình đồng ý giữ lại dùng. Chất lượng sản phẩm đánh giá sau sử dụng."
['Hồng 500ml'],[27600000000],5,Giao hàng nhanh quần tất đẹp dai chị chủ tư vấn nhiệt tình hgghbb
['Xanh 500ml'],[31800000000],5,"Chất lượng tốt, rất đáng tiền, giao hàng nhanh, dịch vụ tốt

Chất lượng tốt, rất đáng tiền, giao hàng nhanh, dịch vụ tốt"
['Xanh 500ml'],[31800000000],5,"Chai thứ 2 mình mua của shop. Đóng gói cẩn thận, chống sốc cả cho nắp chai, rất ưng."
['Hồng 500ml'],[27600000000],5,Giao hàng nhanh. Đóng gói cẩn thận. Hàng chuẩn. Đọc rv nên mua thử. Kq khá ưng ý
['Hồng 500ml'],[27600000000],5,Zzxcjsjdjcjdjdjdjđjdjcjcjdjssbchcbrjdbxjdbdjdđvgghfdc
"['Hồng 500ml', 'Xanh 500ml']","[27600000000, 31900000000]",5,"Mua của shop nhiều lần rồi. Đóng hàng chắc chắn, ship hàng nhanh. Sản phẩm chất lượng."
['Hồng 500ml'],[27600000000],5,Avsndndmf fkdkkkkfnfncknxjsjajdnklfmdnhhhhhhhhhhhhh
['Hồng 500ml'],[27600000000],5,Đóng gói sp kĩ. Có tem panbeo xinh xinh. Bioderma thì ko có gì bàn rồi. Mà giá shop bán giá rẻ quá mong là chính hãng ạ 
['Hồng 500ml'],[27600000000],5,"Mua hàng của shop rất an tâm, đã mua nhiều lần, sẽ tiếp tục ủng hộ"
['Hồng 500ml'],[27600000000],5,"Shop bán giá tốt, hàng chuẩn. Mình được giới thiệu qua mua của shop. Rất hài lòng ạ.
Shop gói hàng cẩn thận, giao rất nhanh."
['Hồng 500ml'],[27600000000],5,"Shop đóng gói rất chắc chắn, băng cả đầu nắp nhưng chắc do vận chuyển nên vẫn bị lỏng và đổ ra một ít. Chất lượng thì khỏi bàn rồi ạ. Cám ơn shop."
['Hồng 500ml'],[27600000000],5,Sản phẩm đảm bảo chất lượng. Giao hàng nhanh. Dùng rất ok. 5 sao
['Xanh 500ml'],[31900000000],5,"Hàng nhà Pan mua lúc nào cũng yên tâm. Đóng gói cẩn thận, giao hàng nhanh. Áp được mã giảm giá nên rẻ. "
['Hồng 500ml'],[29600000000],5,Mua hàng của shop nhiều lần rồi và lần nào cũng rất hài lòng. Cho shop 5 sao nhé ❤️
['Hồng 500ml'],[29600000000],5,"Giao hàng nhanh, chất lượng sản phẩm tốt, mình mua được lúc shop đang km nên rất rẻ"
['Hồng 500ml'],[29600000000],5,"giao hàng nhanh, đóng gói cẩn thận, đã mua nhiều lần sẽ tiếp tục ủng hộ"
['Hồng 500ml'],[29600000000],5,"Giao hàng siêu nhanh
Chất lượng hàng hoá ok
Sẽ tiếp tục ủng hộ."
['Hồng 500ml'],[27600000000],5,
