name,variations,price,rating_star,comment
Hộp 5 Miếng Mặt Nạ Đen Tràm Trà Sexylook Kiểm Soát Dầu Và Mụn Tea Tree Anti 28mlx5,[''],[13500000000],5,"Lần nào mua cũng mua vài hộp, là biết đủ tin tưởng shop cỡ nào r á. Cơ mà shop cứ bảo mình đánh giá 5 sao để nhận mặt nạ. Mua ủng hộ hoài, đánh giá 5 sao vì chất lượng hoài nhưng chả hề nhận được mặt nạ nào 🤣 🤣
Mong shop làm thẻ thành viên đi chứ mình mua nhiều quá r 🤣🤣"
Hộp 5 Miếng Mặt Nạ Đen Tràm Trà Sexylook Kiểm Soát Dầu Và Mụn Tea Tree Anti 28mlx5,[''],[13500000000],5,"nền kinh tế, trong khi vẫn coi trọng yếu tố ngoại lực. Đối với cơ cấu ngành,
đầu tư vốn vào ngành nào, quy mô vốn đầu tư từng ngành nhiều hay ít, việc
sử dụng vốn hiệu quả cao hay thấp...đều ảnh hưởng đến tốc độ phát triển, đến
khả năng tăng cường cơ sở vật chất kỹ thuật của từng ngành, tạo tiền đề"
Hộp 5 Miếng Mặt Nạ Đen Tràm Trà Sexylook Kiểm Soát Dầu Và Mụn Tea Tree Anti 28mlx5,[''],[13500000000],5,"đồ về nhanh, giá ok
nma gói hàng nhìn hơi tàn xíu kiểu mở ra xốp cục nhìn hơi chán ấy nma chủ yếu là sản phẩm 
mong shop gói hàng để ý cái nhìn đầu khi mở hộp nhaa
lần t2 e mua r nên e vẫn yên tâm
chỉ là lần này e tự đặt ấy nên có chút bùn xíuuu
"
Hộp 5 Miếng Mặt Nạ Đen Tràm Trà Sexylook Kiểm Soát Dầu Và Mụn Tea Tree Anti 28mlx5,[''],[13500000000],5,"Shop giao hàng nhanh, đủ sl, đc tặng kèm cả móc khóa. Khi gửi hàng shop còn nt cho KH kèm các vấn đề cần lưu ý. Cskh tốt👍, sản phẩm chất lượng tốt"
Hộp 5 Miếng Mặt Nạ Đen Tràm Trà Sexylook Kiểm Soát Dầu Và Mụn Tea Tree Anti 28mlx5,[''],[13100000000],5,Mình đã mua và dùng thử 1 hộp rất thích luôn ạ. Nên lần 2 tiếp tục mua thêm mask của shop. Nhiều lần tiếp theo cũng sẽ mua tiếp nạ
Hộp 5 Miếng Mặt Nạ Đen Tràm Trà Sexylook Kiểm Soát Dầu Và Mụn Tea Tree Anti 28mlx5,[''],[13100000000],5,"Bao bì khá bắt mắt, đóng gói cẩn thận, dòng mặt nạ này chưa dùng nên chưa biết có hợp với da mình ko, check mã OK nha"
Hộp 5 Miếng Mặt Nạ Đen Tràm Trà Sexylook Kiểm Soát Dầu Và Mụn Tea Tree Anti 28mlx5,[''],[13500000000],5,Hàng chuẩn khỏi chê luôn ạ. Giao hàng rất nhánh đóng gói cẩn thận ren hộp k bị móp nhé. Ủng hộ shop nhiều 
Hộp 5 Miếng Mặt Nạ Đen Tràm Trà Sexylook Kiểm Soát Dầu Và Mụn Tea Tree Anti 28mlx5,[''],[13400000000],5,"Giao hàng khá nhanh, packing chất lượng, chưa sử dụng nên k biết chất lượng như nào"
Hộp 5 Miếng Mặt Nạ Đen Tràm Trà Sexylook Kiểm Soát Dầu Và Mụn Tea Tree Anti 28mlx5,[''],[13500000000],5,"Chất lượng sản phẩm tuyệt vời
Giao hàng nhanh
Đóng gói sản phẩm chắc chắn cẩn thận"
Hộp 5 Miếng Mặt Nạ Đen Tràm Trà Sexylook Kiểm Soát Dầu Và Mụn Tea Tree Anti 28mlx5,[''],[12500000000],5,Hình ảnh và video không liên quan. Shop giao lâu. Hàng chất lượng. Sẽ mua tiếp 
Hộp 5 Miếng Mặt Nạ Đen Tràm Trà Sexylook Kiểm Soát Dầu Và Mụn Tea Tree Anti 28mlx5,[''],[13500000000],5,Giao đủ đồ đủ số lượng đóng gói chắc chắn 🥰🥰🥰🥰🥰🥰🥰🥰🥰🥰🥰🥰🥰🥰🥰🥰🥰🥰🥰🥰🥰🥰🥰🥰🥰🥰🥰🥰🥰🥰🥰🥰🥰🥰🥰🥰
Hộp 5 Miếng Mặt Nạ Đen Tràm Trà Sexylook Kiểm Soát Dầu Và Mụn Tea Tree Anti 28mlx5,[''],[13400000000],5,Đóng gói cẩn thận. Đợt này giao hàng lâu hơn đợt trước nhưng mà đồ thì vẫn ok 
Hộp 5 Miếng Mặt Nạ Đen Tràm Trà Sexylook Kiểm Soát Dầu Và Mụn Tea Tree Anti 28mlx5,[''],[13400000000],5,"Sexylook thì luôn đỉnh rồi, không có gì để chê hết, mình dùng nhiều lần rồiii và vẫn luôn yêu nhất. Shop rep tin nhắn nhiệt tình và dethuong lắm, bọc hàng kĩ lắm luôn, giao hàng đúng nhaaa. Giá rẻ quá luôn, nên muaaaa❤"
Hộp 5 Miếng Mặt Nạ Đen Tràm Trà Sexylook Kiểm Soát Dầu Và Mụn Tea Tree Anti 28mlx5,[''],[13100000000],5,"Shop chuẩn bị hàng lâu, bù lại chất lượng tốt, sử dụng 1 lần đã thấy lỗ chân lông nhỏ lại, mụn nhỏ mất, mụn to giảm sưng, cảm thấy mua 2 hộp không đủ dùng..."
Hộp 5 Miếng Mặt Nạ Đen Tràm Trà Sexylook Kiểm Soát Dầu Và Mụn Tea Tree Anti 28mlx5,[''],[13500000000],5,"Mua ở shop 3 lần rồi
Rất yên tâm 
Shop đóng gói cẩn thận, rất thích "
Hộp 5 Miếng Mặt Nạ Đen Tràm Trà Sexylook Kiểm Soát Dầu Và Mụn Tea Tree Anti 28mlx5,[''],[13100000000],5,"Ok  giao hàng hơi lâu, xài ổn , sẽ tiếp tục ủng hộ shop 🥰🥰🥰🥰🥰🥰🥰🥰🥰🥰🥰"
Hộp 5 Miếng Mặt Nạ Đen Tràm Trà Sexylook Kiểm Soát Dầu Và Mụn Tea Tree Anti 28mlx5,[''],[13500000000],5,"Đã mua nhiều lần, đánh giá 5 sao, sẽ ủng hộ thêm, giao hàng nhanh"
Hộp 5 Miếng Mặt Nạ Đen Tràm Trà Sexylook Kiểm Soát Dầu Và Mụn Tea Tree Anti 28mlx5,[''],[13100000000],5,"Hàng y hình, giao hàng hơi lâu. M dùng mấy bịch rồi. Thas shop."
Hộp 5 Miếng Mặt Nạ Đen Tràm Trà Sexylook Kiểm Soát Dầu Và Mụn Tea Tree Anti 28mlx5,[''],[13500000000],5,Đánh giá mang tính chất nhận xu nhưng nói chung hàng cũng ok:)
Hộp 5 Miếng Mặt Nạ Đen Tràm Trà Sexylook Kiểm Soát Dầu Và Mụn Tea Tree Anti 28mlx5,[''],[13500000000],5,Chất lượng sản phẩm tuyệt vời trộm vía là rất hợp với da mình. Shop phục vụ siêu tốt luôn ạ. Đóng gói sản phẩm rất chắc chắn
Hộp 5 Miếng Mặt Nạ Đen Tràm Trà Sexylook Kiểm Soát Dầu Và Mụn Tea Tree Anti 28mlx5,[''],[13500000000],5,Mặt nạ xài thích cực. Bỏ ngăn mát thì phê ơi là phê. Có hỗ trợ cấp ẩm. Mờ thâm mụn. Sẽ ủng hộ lần sau
Hộp 5 Miếng Mặt Nạ Đen Tràm Trà Sexylook Kiểm Soát Dầu Và Mụn Tea Tree Anti 28mlx5,[''],[13500000000],5,"Chất lượng tốt .hàng chuẩn 

Giao hàng nhah ..5sao ạ 
Kcn thì nghe review nhiều nên dùng thử .mong là sẽ hợp"
Hộp 5 Miếng Mặt Nạ Đen Tràm Trà Sexylook Kiểm Soát Dầu Và Mụn Tea Tree Anti 28mlx5,[''],[13400000000],5,Giao hàng nhanh đóng gói sản phẩm tốt hình ảnh mang tính chất nhận xu
Hộp 5 Miếng Mặt Nạ Đen Tràm Trà Sexylook Kiểm Soát Dầu Và Mụn Tea Tree Anti 28mlx5,[''],[13500000000],5,"Ghn, măt nạ okkkkkkkkkkkkkkkkkkkkkkkkkkkkkkkkkkkkkkkk"
Hộp 5 Miếng Mặt Nạ Đen Tràm Trà Sexylook Kiểm Soát Dầu Và Mụn Tea Tree Anti 28mlx5,[''],[13500000000],5,"Đắp ok k bị dị ứng, mùi hương liệu, cấp ẩm tốt................"
Hộp 5 Miếng Mặt Nạ Đen Tràm Trà Sexylook Kiểm Soát Dầu Và Mụn Tea Tree Anti 28mlx5,[''],[13500000000],5,"Video hình ảnh không liên quan nhưng sản phẩm chất lượng tốt,shop đóng hàng cẩn thận,nhưng giao hàng hơi lâu,sẽ ủng hộ tiếp"
Hộp 5 Miếng Mặt Nạ Đen Tràm Trà Sexylook Kiểm Soát Dầu Và Mụn Tea Tree Anti 28mlx5,[''],[13500000000],5,Hình ảnh mang tính chất nhận xu ạ.. Vì Lười chụp ảnh nên lấy hình cục cưng đỡ vậy!!!! 
Hộp 5 Miếng Mặt Nạ Đen Tràm Trà Sexylook Kiểm Soát Dầu Và Mụn Tea Tree Anti 28mlx5,[''],[13400000000],5,"Hàng chuẩn xịn xò, đã mua vài lần, sẽ ủng hộ thêm, mặt nạ đắp mát và giảm mụn tốt"
Hộp 5 Miếng Mặt Nạ Đen Tràm Trà Sexylook Kiểm Soát Dầu Và Mụn Tea Tree Anti 28mlx5,[''],[13500000000],5,"đóng gói cẩn thận 
shop uy tín nha mn yên tâm mua 
mặc dù dịch nên giao hàng hơi lâu 
ks hàng chất lượng nên vẫn chờ đc"
Hộp 5 Miếng Mặt Nạ Đen Tràm Trà Sexylook Kiểm Soát Dầu Và Mụn Tea Tree Anti 28mlx5,[''],[13500000000],5,"Mình nhận được và rất ưng ý, shop trả lời tin nhắn nhanh, lần sau sẽ ủng hộ"
Hộp 5 Miếng Mặt Nạ Đen Tràm Trà Sexylook Kiểm Soát Dầu Và Mụn Tea Tree Anti 28mlx5,[''],[13500000000],5,"Đợt trước mua r nay có mã giảm thêm mua thêm 
Chất lượng thì khỏi phải bàn rồi 
Nên quánh 5 sao luôn 
Nên mua ạ"
Hộp 5 Miếng Mặt Nạ Đen Tràm Trà Sexylook Kiểm Soát Dầu Và Mụn Tea Tree Anti 28mlx5,[''],[13100000000],5,Đóng gói sản phẩm đẹp và chắc chắn. Shop phục vụ rất nhiệt tình và chu đáo. Mình chưa dùng sp nên cũng chưa biết chất lượng thế nào. Nhưng mà mình thấy mọi người đánh giá 5 sao nên mình cũng yên tâm lắm. Nchung là rất ưng sản phẩm
Hộp 5 Miếng Mặt Nạ Đen Tràm Trà Sexylook Kiểm Soát Dầu Và Mụn Tea Tree Anti 28mlx5,[''],[13500000000],5,uttt có thể làm gì khi trẻ được sinh ra và sóng hả anh này kỉu có gì là không có gì mới về mà ko bt nữa là lên luôn DJ oxy bình phục chấn thương sọ não sau khi nào có nhu
Hộp 5 Miếng Mặt Nạ Đen Tràm Trà Sexylook Kiểm Soát Dầu Và Mụn Tea Tree Anti 28mlx5,[''],[13500000000],5,"Đóng gói hàng siêu kĩ và đẹp lắm luônnnn
Món nào cũng bọc cẩn thận 
Mua của từ hảo nhiều rồi"
Hộp 5 Miếng Mặt Nạ Đen Tràm Trà Sexylook Kiểm Soát Dầu Và Mụn Tea Tree Anti 28mlx5,[''],[13400000000],5,Dạ sexy look thì nằm trong top mặt nạ yêu thích của mình r nên khỏi bàn nha 
Hộp 5 Miếng Mặt Nạ Đen Tràm Trà Sexylook Kiểm Soát Dầu Và Mụn Tea Tree Anti 28mlx5,[''],[13500000000],5,Phê chữ ê kéo dàiiiiii hhhhhhhhhhhhhhhhhhhhhhh h hhhhhhhhhhhhhh
Hộp 5 Miếng Mặt Nạ Đen Tràm Trà Sexylook Kiểm Soát Dầu Và Mụn Tea Tree Anti 28mlx5,[''],[13500000000],5,"Sản phẩm chính hãng, đóng gói rất cẩn thận. Giao hàng khá nhanh"
Hộp 5 Miếng Mặt Nạ Đen Tràm Trà Sexylook Kiểm Soát Dầu Và Mụn Tea Tree Anti 28mlx5,[''],[13500000000],5,"Mình nhận rồi , chưa sử dụng nhưng rất ưng ạ. Tư vấn nhiệt tình nữa. Lần sau mình sẽ quay lại ủng hộ ạ
"
Hộp 5 Miếng Mặt Nạ Đen Tràm Trà Sexylook Kiểm Soát Dầu Và Mụn Tea Tree Anti 28mlx5,[''],[13400000000],5,"Sản phẩm như hình, chưa dùng nên chưa biết chất lượng như thế nào"
Hộp 5 Miếng Mặt Nạ Đen Tràm Trà Sexylook Kiểm Soát Dầu Và Mụn Tea Tree Anti 28mlx5,[''],[13500000000],5,
Hộp 5 Miếng Mặt Nạ Đen Tràm Trà Sexylook Kiểm Soát Dầu Và Mụn Tea Tree Anti 28mlx5,[''],[13500000000],5,"Đóng gói cẩn thận, chắc chắn, giao hàng nhanh, hàng chính hãng, nên mua dùng thử"
Hộp 5 Miếng Mặt Nạ Đen Tràm Trà Sexylook Kiểm Soát Dầu Và Mụn Tea Tree Anti 28mlx5,[''],[13500000000],5,Sản phẩm tốt. Chất lượng. Giao hàng nhanh chóng 
Hộp 5 Miếng Mặt Nạ Đen Tràm Trà Sexylook Kiểm Soát Dầu Và Mụn Tea Tree Anti 28mlx5,[''],[13500000000],5,"Giao hàng nhanh đủ số lượng, đã dùng nhiều và thấy sp khá ok nhưng tiền ship khá cao 58 k "
Hộp 5 Miếng Mặt Nạ Đen Tràm Trà Sexylook Kiểm Soát Dầu Và Mụn Tea Tree Anti 28mlx5,[''],[13100000000],5,Nâjsbdhdbdjdidbdhdbdhdhjdhdhdhdhdhdhbđjbdjdbđhjsjshs
Hộp 5 Miếng Mặt Nạ Đen Tràm Trà Sexylook Kiểm Soát Dầu Và Mụn Tea Tree Anti 28mlx5,[''],[13500000000],5,Hình ảnh không liên quan. Giao hành nhanh. Đóng gói sản phẩm chắc chắn. Đã mua của shop rata nhiều lần. Đánh giá shop 5 sao. 
Hộp 5 Miếng Mặt Nạ Đen Tràm Trà Sexylook Kiểm Soát Dầu Và Mụn Tea Tree Anti 28mlx5,[''],[13500000000],5,"Chất lượng sản phẩn tuyệt vời
Thời gian giao hàng nhanh
Đóng gói sp chắc chắn "
Hộp 5 Miếng Mặt Nạ Đen Tràm Trà Sexylook Kiểm Soát Dầu Và Mụn Tea Tree Anti 28mlx5,[''],[13400000000],5,Sp chưa sd nên chưa biết như nào nhưng mà shipper thì không hài lòng lắm 
Hộp 5 Miếng Mặt Nạ Đen Tràm Trà Sexylook Kiểm Soát Dầu Và Mụn Tea Tree Anti 28mlx5,[''],[13500000000],5,"Nhỏ nhỏ xinh xinh, dùng ổn, trắng, dùng được nhiều làn rồi, cực thích"
Hộp 5 Miếng Mặt Nạ Đen Tràm Trà Sexylook Kiểm Soát Dầu Và Mụn Tea Tree Anti 28mlx5,[''],[12500000000],5,"Nhận hàng hơi lâu, date dài 👍👍👍 hy vọng vào chất lượng. Cho shop 5 sao"
Hộp 5 Miếng Mặt Nạ Đen Tràm Trà Sexylook Kiểm Soát Dầu Và Mụn Tea Tree Anti 28mlx5,[''],[13500000000],5,"Shop đóng gói cẩn thận, sản phẩm có tem chống hàng giả. Sẽ ủng hộ tiếp ạ."
Hộp 5 Miếng Mặt Nạ Đen Tràm Trà Sexylook Kiểm Soát Dầu Và Mụn Tea Tree Anti 28mlx5,[''],[13500000000],5,Giang hàng lâu. Đóng gói kĩ. Chất lượng sản phẩm okie. Hàng chuẩn có tem phụ 
Hộp 5 Miếng Mặt Nạ Đen Tràm Trà Sexylook Kiểm Soát Dầu Và Mụn Tea Tree Anti 28mlx5,[''],[13100000000],5,"Jskskdjshskđdjdjeispsisjdid
Dyodtzjtdyfuflgogogigjc"
Hộp 5 Miếng Mặt Nạ Đen Tràm Trà Sexylook Kiểm Soát Dầu Và Mụn Tea Tree Anti 28mlx5,[''],[13500000000],5,"Giao hàng nhanh. 
Gói hàng cẩn thận
Mặc nạ sexylook thì chất lượng miễn bàn rồi ha. ^_^"
Hộp 5 Miếng Mặt Nạ Đen Tràm Trà Sexylook Kiểm Soát Dầu Và Mụn Tea Tree Anti 28mlx5,[''],[13500000000],5,Tụtgkydufcilftidyogilhlibljil
Hộp 5 Miếng Mặt Nạ Đen Tràm Trà Sexylook Kiểm Soát Dầu Và Mụn Tea Tree Anti 28mlx5,[''],[13500000000],5,Đóng gói sản phẩm chắc chắn. Lần đầu mua vì thấy shoppe mall nên cũng tin tưởng. Sẽ ủng hộ shop tiếp
Hộp 5 Miếng Mặt Nạ Đen Tràm Trà Sexylook Kiểm Soát Dầu Và Mụn Tea Tree Anti 28mlx5,[''],[13500000000],5,Sản phẩm mát nhưng mình thấy mùi hương liệu hơi nhiều bạn nào dị ứng nên xem kĩ
Hộp 5 Miếng Mặt Nạ Đen Tràm Trà Sexylook Kiểm Soát Dầu Và Mụn Tea Tree Anti 28mlx5,[''],[13500000000],5,Giao hàng siêu nhanh. Mua ở mall nên yên tâm nèeeeeeeeeeeeeee
Hộp 5 Miếng Mặt Nạ Đen Tràm Trà Sexylook Kiểm Soát Dầu Và Mụn Tea Tree Anti 28mlx5,[''],[13500000000],5,Kkkkkkkkkkkkkkkklkkkkkkkkkkkkkkkkkkkkkkkkkkkkkkkk
Hộp 5 Miếng Mặt Nạ Đen Tràm Trà Sexylook Kiểm Soát Dầu Và Mụn Tea Tree Anti 28mlx5,[''],[13500000000],5,"Đóng gói cẩn thận, đúng hàng, hàng k biết dùng thế nào như hình thức tốt 👌 "
Hộp 5 Miếng Mặt Nạ Đen Tràm Trà Sexylook Kiểm Soát Dầu Và Mụn Tea Tree Anti 28mlx5,[''],[13500000000],5,"Shop tư vấn nhiệt tình
Đóng gói cẩn thận
Mới dùng nên chưa thấy thay đổi gì☺️"
Hộp 5 Miếng Mặt Nạ Đen Tràm Trà Sexylook Kiểm Soát Dầu Và Mụn Tea Tree Anti 28mlx5,[''],[13500000000],5,Chất lượng sản phẩm tuyệt vời đóng gói sản phẩm rất đẹp và chắc chắn
Hộp 5 Miếng Mặt Nạ Đen Tràm Trà Sexylook Kiểm Soát Dầu Và Mụn Tea Tree Anti 28mlx5,[''],[13100000000],5,Sản phẩm dc đóg gói rất chắc chắn cẩn thận.
Hộp 5 Miếng Mặt Nạ Đen Tràm Trà Sexylook Kiểm Soát Dầu Và Mụn Tea Tree Anti 28mlx5,[''],[13500000000],5,Shopee mall mà giá rẻ thật sự. Chuẩn bị hàng hơi lâu mà ship thì siu siu nhanhh. Mặt nạ xịn xò và không cần bàn cãi về chất lượng. Date xa cực lun. Siu hài lòng 
Hộp 5 Miếng Mặt Nạ Đen Tràm Trà Sexylook Kiểm Soát Dầu Và Mụn Tea Tree Anti 28mlx5,[''],[13500000000],5,"Sản phẩm đóng gói cẩn thận, giao hàng nhanh,mua của shop nhiều lần sẽ ủng hộ shop lần sau. Hàng của Shopee mall lên yên tâm"
Hộp 5 Miếng Mặt Nạ Đen Tràm Trà Sexylook Kiểm Soát Dầu Và Mụn Tea Tree Anti 28mlx5,[''],[13400000000],5,"Giao đúng đủ
5 miếng lẻ ko có hộp
Có bọc chống sốc
Tks sẽ ủng hộ tiếp"
Hộp 5 Miếng Mặt Nạ Đen Tràm Trà Sexylook Kiểm Soát Dầu Và Mụn Tea Tree Anti 28mlx5,[''],[13500000000],5,"Nghiện ăn phở gà trộn ở đây lắm ạ 🤩 Một bát phở gà đùi trộn ở đây là 55k, thêm mọc hình như là 5k, có cả trứng non nữa nhưng hay hết lắm. Bát phở trộn nhiều bánh, nhiều thịt nên ăn khá no"
Hộp 5 Miếng Mặt Nạ Đen Tràm Trà Sexylook Kiểm Soát Dầu Và Mụn Tea Tree Anti 28mlx5,[''],[13500000000],5,Mình mới dùng nhưng cảm thấy thích và sau khi dùng cảm nhận ra thêm ẩm mịn mướt.......nốt mẩn đỏ cũng dịu đi nói chung oki.....mua mall nên yên tâm
Hộp 5 Miếng Mặt Nạ Đen Tràm Trà Sexylook Kiểm Soát Dầu Và Mụn Tea Tree Anti 28mlx5,[''],[13500000000],5,"mask đắp tốt, mát da, đắp xong sáng ra thấy da mịn hẳn"
Hộp 5 Miếng Mặt Nạ Đen Tràm Trà Sexylook Kiểm Soát Dầu Và Mụn Tea Tree Anti 28mlx5,[''],[13400000000],5,"[TB] Tang 20% gia tri tat ca the nap trong ngay 08/04/2021. Tien KM su dung noi mang, khong gioi han thoi gian. DAC BIET: giam them 3% khi nap the tai https://myvt.page.link/km. CT danh rieng cho TB cua Quy khach. LH 198 (0d)."
Hộp 5 Miếng Mặt Nạ Đen Tràm Trà Sexylook Kiểm Soát Dầu Và Mụn Tea Tree Anti 28mlx5,[''],[13400000000],5,Chất lượng sản phẩm tuyệt vời nha!! Do mk ko tiện lấy sp nên ảnh mag tính minh họa thôi nha!! Cảm ơn shop nhiều!!
Hộp 5 Miếng Mặt Nạ Đen Tràm Trà Sexylook Kiểm Soát Dầu Và Mụn Tea Tree Anti 28mlx5,[''],[13500000000],5,"Lần đầu mua nhưng rất ưng cái bụng , sẽ ủng hộ shop vào lần tới nữa ☺️"
Hộp 5 Miếng Mặt Nạ Đen Tràm Trà Sexylook Kiểm Soát Dầu Và Mụn Tea Tree Anti 28mlx5,[''],[13500000000],5,Shop chuẩn bị hàng nhanh. Chính hãng nên yên tâm mua nha mn...
Hộp 5 Miếng Mặt Nạ Đen Tràm Trà Sexylook Kiểm Soát Dầu Và Mụn Tea Tree Anti 28mlx5,[''],[13500000000],5,Hình ảnh không liên quan. Giao hàng nhanh. Đóng gói cẩn thận. Mua hàng ở đây nhiều lần rồi. An tâm về chất lượng. Đánh giá shop 5 sao. 
Hộp 5 Miếng Mặt Nạ Đen Tràm Trà Sexylook Kiểm Soát Dầu Và Mụn Tea Tree Anti 28mlx5,[''],[13500000000],5,Chưa dùng nên chưa biết seooo ạ nhưng đónh gói okla phết nnnnnnnnnnnnnnn
Hộp 5 Miếng Mặt Nạ Đen Tràm Trà Sexylook Kiểm Soát Dầu Và Mụn Tea Tree Anti 28mlx5,[''],[13500000000],5,Mặt nạ đắp phê. Shop gửi hàng hơi lâu. Đóng gói kĩ =))))))))))
Hộp 5 Miếng Mặt Nạ Đen Tràm Trà Sexylook Kiểm Soát Dầu Và Mụn Tea Tree Anti 28mlx5,[''],[13500000000],5,Hình ảnh không phù hợp. Chất lượng sản phẩn tuyệt vời. Mua nhiều lần. Cài cực thích. Giao hàng nhanh. 
Hộp 5 Miếng Mặt Nạ Đen Tràm Trà Sexylook Kiểm Soát Dầu Và Mụn Tea Tree Anti 28mlx5,[''],[13500000000],5,"Combo 10 miếng luôn nè,rẻ chất lượng
Được tặng mặt nạ nâng cơ luôn ạ"
Hộp 5 Miếng Mặt Nạ Đen Tràm Trà Sexylook Kiểm Soát Dầu Và Mụn Tea Tree Anti 28mlx5,[''],[13500000000],5,"Đợt này đơn hàng nhận được như kiểu có người bóc trước, đóng gói ko cẩn thận
Dmdjcncn"
Hộp 5 Miếng Mặt Nạ Đen Tràm Trà Sexylook Kiểm Soát Dầu Và Mụn Tea Tree Anti 28mlx5,[''],[13500000000],5,Giao hàng lâu hdjdjdjdjdjdjjdjđjckcjcjfjjffjkcjcjcjcjcnxhfjfjjfjfjfjfjf
Hộp 5 Miếng Mặt Nạ Đen Tràm Trà Sexylook Kiểm Soát Dầu Và Mụn Tea Tree Anti 28mlx5,[''],[13500000000],5,"Giao hàng đúng sản phẩm, gói hàng cẩn thận "
Hộp 5 Miếng Mặt Nạ Đen Tràm Trà Sexylook Kiểm Soát Dầu Và Mụn Tea Tree Anti 28mlx5,[''],[13500000000],5,Dạ em cảm ơn Shop nha!!!!!!!!!!!!!!’nnnnnnnnnnnnnnnnnnnn
Hộp 5 Miếng Mặt Nạ Đen Tràm Trà Sexylook Kiểm Soát Dầu Và Mụn Tea Tree Anti 28mlx5,[''],[13500000000],5,"Shop giao hàng nhanh chóng, giá tốt hơn các shop khác. Tư vấn nhiệt tình ^^"
Hộp 5 Miếng Mặt Nạ Đen Tràm Trà Sexylook Kiểm Soát Dầu Và Mụn Tea Tree Anti 28mlx5,[''],[13500000000],5,Mình quên chụp lại sp nên lấy hình tượng trưng thôi. Đã nhận hàng hqua và thấy rất hài lòng. Shop luôn phục vụ chu đáo. Mình cảm ơn sh nhiều
Hộp 5 Miếng Mặt Nạ Đen Tràm Trà Sexylook Kiểm Soát Dầu Và Mụn Tea Tree Anti 28mlx5,[''],[13500000000],5,"Đóng gói sp oke bahsjsbscsvjsnsvsfdvbsbdvsvsvbsbd
Sbhsjshsbbsvsvsvbsnwhwgwvwvvavwv"
Hộp 5 Miếng Mặt Nạ Đen Tràm Trà Sexylook Kiểm Soát Dầu Và Mụn Tea Tree Anti 28mlx5,[''],[13500000000],5,Ycuvivu h uvuvivuvuvuvivuvuvu uvuvivg uvuvivuvuvu ivuvivuvuvuvivuvjvu g
Hộp 5 Miếng Mặt Nạ Đen Tràm Trà Sexylook Kiểm Soát Dầu Và Mụn Tea Tree Anti 28mlx5,[''],[13500000000],5,"Đã nhận dc hàng....... 
Sp tốt... Dùng OK sẽ mua lại..... "
Hộp 5 Miếng Mặt Nạ Đen Tràm Trà Sexylook Kiểm Soát Dầu Và Mụn Tea Tree Anti 28mlx5,[''],[13500000000],5,Đóng gói hàng chắc chắn. Giao hàng nhanh.Shop tư vấn nhiệt tình còn đc tặng thêm mask ạ. bxjsjsbnsjs
Hộp 5 Miếng Mặt Nạ Đen Tràm Trà Sexylook Kiểm Soát Dầu Và Mụn Tea Tree Anti 28mlx5,[''],[13500000000],5,Hàng giao nhanh sản phẩm giống hình gfsiiyrrhbcstopljfedadhbjlliugdfhjgdwehklpponbfddtuihbvdsasdqqryuokjjvbhfgffgjklloojfsaasfbjkooihghhfddfgffggdsdguggjkhbbcxsaetuiuydewqefy6hffhjg
Hộp 5 Miếng Mặt Nạ Đen Tràm Trà Sexylook Kiểm Soát Dầu Và Mụn Tea Tree Anti 28mlx5,[''],[12300000000],5,"Bao bọc kĩ. Shop tặng kèm voucher & móc khoá . 
Nhắn tin tương tác với KH qua shopee rất chu đáo về tình trạng đơn hàng . "
Hộp 5 Miếng Mặt Nạ Đen Tràm Trà Sexylook Kiểm Soát Dầu Và Mụn Tea Tree Anti 28mlx5,[''],[13500000000],5,Giao hàng nhanh đủ hàng đóng gói kĩ xài deal nên tính ra đồ rẻ quá ớh
Hộp 5 Miếng Mặt Nạ Đen Tràm Trà Sexylook Kiểm Soát Dầu Và Mụn Tea Tree Anti 28mlx5,[''],[13500000000],5,"Hàng mình check Qr ra được nha. M mới dùng sexylook thấy thích lắm, có thể yên tâm được. Da mình dễ kích ứng lắm nên da mình ổn thì chắc hàng chính hãng rồi. Giá cũng oke nữa, lần sau sẽ ủng hộ. "
Hộp 5 Miếng Mặt Nạ Đen Tràm Trà Sexylook Kiểm Soát Dầu Và Mụn Tea Tree Anti 28mlx5,[''],[12300000000],5,Chưa dùng thử nên chưa biết có hợp hay không nhưng được cái hssd tận 2023 và còn có cả tem chống hàng giả
Hộp 5 Miếng Mặt Nạ Đen Tràm Trà Sexylook Kiểm Soát Dầu Và Mụn Tea Tree Anti 28mlx5,[''],[13500000000],5,Lần trước mua mặt nạ này để dùng thử. Ai dè ưng cái bụng quá trời luôn. Shop gói hàng rất cẩn thận luôn ạ. Giao hàng nhanh nữa. Bắt đầu thấy thích shop này rồi á
Hộp 5 Miếng Mặt Nạ Đen Tràm Trà Sexylook Kiểm Soát Dầu Và Mụn Tea Tree Anti 28mlx5,[''],[13500000000],5,"Giao hàng nhanh
Hàng dùng tốt
Đã mua hàng của shop dùng rồi
Đóng gói hơi sơ sài"
Hộp 5 Miếng Mặt Nạ Đen Tràm Trà Sexylook Kiểm Soát Dầu Và Mụn Tea Tree Anti 28mlx5,[''],[13500000000],5,Giao hàng rất nhanh. Shop bán giá tốt. Dùng oke sẽ ủng hộ shop tiếp
Hộp 5 Miếng Mặt Nạ Đen Tràm Trà Sexylook Kiểm Soát Dầu Và Mụn Tea Tree Anti 28mlx5,[''],[13500000000],5,"Giá tốt so với các shop khác, mua của nhà thuốc nên cũng an tâm, mặt nạ này sử dụng rất thích"
Hộp 5 Miếng Mặt Nạ Đen Tràm Trà Sexylook Kiểm Soát Dầu Và Mụn Tea Tree Anti 28mlx5,[''],[11900000000],5,"Sẳn có app hay giới thiệu mn, vừa Mua sắm vừa đc Hoàn Tiền còn gì bằng ạ. Tải ngay CASHBAG. Nhập mã 6PTVN4Y nhận ngay 10k. Hoàn tiền thật 10000%"
Hộp 5 Miếng Mặt Nạ Đen Tràm Trà Sexylook Kiểm Soát Dầu Và Mụn Tea Tree Anti 28mlx5,[''],[11900000000],5,"Kcn mỏng nhẹ thấm nhanh, phải chi giá mềm mềm xí nữa là ngon. Vanessa thì chất lượng thì khỏi phải bàn, lần sau nữa mà sale giá rẻ thì mình sẽ hốt tiếp"
Hộp 5 Miếng Mặt Nạ Đen Tràm Trà Sexylook Kiểm Soát Dầu Và Mụn Tea Tree Anti 28mlx5,[''],[11900000000],5,"Hàng giao nhanh, đóng gói cẩn thận, shop dễ thương, sản phẩm tốt."
Hộp 5 Miếng Mặt Nạ Đen Tràm Trà Sexylook Kiểm Soát Dầu Và Mụn Tea Tree Anti 28mlx5,[''],[11900000000],5,Sp okkkkkkkkkkkkkkkkkkkkkkkkkkkkkkkkkkkkkkkkkkklkkl
Hộp 5 Miếng Mặt Nạ Đen Tràm Trà Sexylook Kiểm Soát Dầu Và Mụn Tea Tree Anti 28mlx5,[''],[13500000000],5,"hàng chính hãng
rất chi là oki luôn
sẽ ủng hộ shop tiếp 
💖💖💖💖💖💖💖"
Hộp 5 Miếng Mặt Nạ Đen Tràm Trà Sexylook Kiểm Soát Dầu Và Mụn Tea Tree Anti 28mlx5,[None],[12600000000],5,"Shop giao hàng siêu nhanh,được tặng móc khoá,giá rẻ. Khâu chăm sóc khách hàng rất tốt "
Hộp 5 Miếng Mặt Nạ Đen Tràm Trà Sexylook Kiểm Soát Dầu Và Mụn Tea Tree Anti 28mlx5,[None],[13500000000],5,"Shop giao hàng rất nhanh, đóng gói kỹ càng chắc chắn
Shop phục vụ khách hàng rất tốt chu đáo
Lần sau sẽ quay lại ủng hộ shop tiếp"
