name,variations,price,rating_star,comment
Hộp 5 Miếng Mặt Nạ Đen Tràm Trà Sexylook Kiểm Soát Dầu Và Mụn Tea Tree Anti 28mlx5,[None],[13500000000],5,"qưdhophcxssgbbjh12345667890--:;)₫@""'nvxxaeyhvgyggfddfyhhhujjtewaa.:;(₫&@96;22678)?"
Hộp 5 Miếng Mặt Nạ Đen Tràm Trà Sexylook Kiểm Soát Dầu Và Mụn Tea Tree Anti 28mlx5,[None],[14500000000],5,"Đầu tiên phải nói shop gói hàng siêu ưng ạ. Mình nhận được hàng mà thích mê. Sexylook thì nổi tiếng rồi, hy vọng sẽ hợp vs da mình nạ.hì. Mua hàng ở Shopee mall nên yên tâm lắm nè. Sẽ ủng hộ shop nhiều nhiều nạ😊"
Hộp 5 Miếng Mặt Nạ Đen Tràm Trà Sexylook Kiểm Soát Dầu Và Mụn Tea Tree Anti 28mlx5,[None],[13500000000],5,Lần đầu mua để trãi nghiệm hi vọng là có hiệu quả tốt giao hàng tiêu chuẩn
Hộp 5 Miếng Mặt Nạ Đen Tràm Trà Sexylook Kiểm Soát Dầu Và Mụn Tea Tree Anti 28mlx5,[None],[13500000000],5,"Mặt nạ chính hãng dùng rất tốt, mình mua đợt sale 10.10 nên giá rất rẻ lại được hoàn xu. Sẽ tiếp tục ủng hộ shop ạ 👍👍"
Hộp 5 Miếng Mặt Nạ Đen Tràm Trà Sexylook Kiểm Soát Dầu Và Mụn Tea Tree Anti 28mlx5,[None],[13500000000],5,"Đã nhận được hàng, chưa dùng nên chưa đánh giá được chất lượng. Ghhjkskbdhdjdkdkkdkdkdk"
Hộp 5 Miếng Mặt Nạ Đen Tràm Trà Sexylook Kiểm Soát Dầu Và Mụn Tea Tree Anti 28mlx5,[None],[13500000000],5,"Mua mall nên khá yên tâm , shop chuẩn bị hàng và giao rất nhanh "
Hộp 5 Miếng Mặt Nạ Đen Tràm Trà Sexylook Kiểm Soát Dầu Và Mụn Tea Tree Anti 28mlx5,[None],[13500000000],5,"Mask thơm mùi tràm trà, đắp 2 mask mụn giảm sưng rõ rệt. Sẽ ql ủng hộ shop"
Hộp 5 Miếng Mặt Nạ Đen Tràm Trà Sexylook Kiểm Soát Dầu Và Mụn Tea Tree Anti 28mlx5,[None],[13500000000],5,"Qwertuhshgnsnshmsynwyntwjwtbafnwtjafbwynatnwyjaf wtnagnwuw5nqtnag F ag ,×/*×/ nw5jwtnwtjwgmwyjwtkruowtyq4o37ow67w5iqthafbwtjatbar"
Hộp 5 Miếng Mặt Nạ Đen Tràm Trà Sexylook Kiểm Soát Dầu Và Mụn Tea Tree Anti 28mlx5,[None],[13500000000],5,Mình đã dùng rồi và thấy rất hài lòng chất trong mặt nạ vô cùng nhiều 
Hộp 5 Miếng Mặt Nạ Đen Tràm Trà Sexylook Kiểm Soát Dầu Và Mụn Tea Tree Anti 28mlx5,[None],[17500000000],5,"Mask đắp rất mát, có tác dụng giảm sưng mụn nhưng chưa rõ rệt lắm, khá giống với mask Naruko"
Hộp 5 Miếng Mặt Nạ Đen Tràm Trà Sexylook Kiểm Soát Dầu Và Mụn Tea Tree Anti 28mlx5,[''],[13500000000],5,"Mặt nạ sài ok lắm, chất lượng tốt, sài rất nhiều rồi dòng này trà tràm mùi dễ chịu giúp giảm mụn khô dồi mụn. Mn nên dùng. "
Hộp 5 Miếng Mặt Nạ Đen Tràm Trà Sexylook Kiểm Soát Dầu Và Mụn Tea Tree Anti 28mlx5,[''],[13500000000],5,Shop giao hàng nhanhhhh. Đóng gói chắc chắn. Hàng chất lượng
Hộp 5 Miếng Mặt Nạ Đen Tràm Trà Sexylook Kiểm Soát Dầu Và Mụn Tea Tree Anti 28mlx5,[''],[13500000000],5,"Đóng hàng chuyên nghiệp,mua đồ bên shop khá là an tâm,mặt nạ dùng rất thích"
Hộp 5 Miếng Mặt Nạ Đen Tràm Trà Sexylook Kiểm Soát Dầu Và Mụn Tea Tree Anti 28mlx5,[''],[13500000000],5,"Vừa nhận được hàng, shop gói hàng chắc chắn, còn được tặng kèm cái móc khoá 😍 dùng thời gin sẽ review sau ạ"
Hộp 5 Miếng Mặt Nạ Đen Tràm Trà Sexylook Kiểm Soát Dầu Và Mụn Tea Tree Anti 28mlx5,[''],[13400000000],5,Hàng chuẩn. Mong là sử dụng hợp
Hộp 5 Miếng Mặt Nạ Đen Tràm Trà Sexylook Kiểm Soát Dầu Và Mụn Tea Tree Anti 28mlx5,[''],[13500000000],5,"Giao đủ hàng, chưa dùng nên chưa review được hết, mặt nạ tràm trà ok"
Hộp 5 Miếng Mặt Nạ Đen Tràm Trà Sexylook Kiểm Soát Dầu Và Mụn Tea Tree Anti 28mlx5,[''],[13500000000],5,
Hộp 5 Miếng Mặt Nạ Đen Tràm Trà Sexylook Kiểm Soát Dầu Và Mụn Tea Tree Anti 28mlx5,[''],[13400000000],5,hèn gì mình thấy s shop bán rẻ .nhận hàg xong kiểm tra mới thấy shop pha hàng nên mới rẻ.hàng Trung k phải hàng fake nhưng giá trị trường re hon 1/3 gia hang đài loan với chất lượng bị thay đổi theo giá tiền .shop làm ăn như z là k dc
Hộp 5 Miếng Mặt Nạ Đen Tràm Trà Sexylook Kiểm Soát Dầu Và Mụn Tea Tree Anti 28mlx5,[''],[13500000000],5,Mình sẽ ủng hộ tiếp. Shop phục vụ rất tốt.
Hộp 5 Miếng Mặt Nạ Đen Tràm Trà Sexylook Kiểm Soát Dầu Và Mụn Tea Tree Anti 28mlx5,[''],[13500000000],5,"Chất lượng sản phẩm tuyêth vời, đóng gói sản phẩm rất chắc chắn 😘😘😘"
Hộp 5 Miếng Mặt Nạ Đen Tràm Trà Sexylook Kiểm Soát Dầu Và Mụn Tea Tree Anti 28mlx5,[''],[13500000000],5,Không bao giờ thất vọng với việc đóng gói của shop sản phẩm rất tốt 
Hộp 5 Miếng Mặt Nạ Đen Tràm Trà Sexylook Kiểm Soát Dầu Và Mụn Tea Tree Anti 28mlx5,[''],[13500000000],5,"Mới mua lần đầu, hàng dao nhanh nếu dùng ok lần sau sẽ ủng hộ ah
"
Hộp 5 Miếng Mặt Nạ Đen Tràm Trà Sexylook Kiểm Soát Dầu Và Mụn Tea Tree Anti 28mlx5,[''],[13500000000],5,Mát ttttttttttttttttttttttttttttttttttttttttttttttttt
Hộp 5 Miếng Mặt Nạ Đen Tràm Trà Sexylook Kiểm Soát Dầu Và Mụn Tea Tree Anti 28mlx5,[''],[13500000000],5,Sản phẩm tốt .......................hhduhdgdhhdhhhdjdhhdhdbhrhdhdhhshdhhdhrhdhhdhdhdhdhdhdhhdhdhdhhdhdhhrhdhrhrhfhhfhfhfhhfhf
Hộp 5 Miếng Mặt Nạ Đen Tràm Trà Sexylook Kiểm Soát Dầu Và Mụn Tea Tree Anti 28mlx5,[''],[12500000000],5,"Chất lượng sp tốt, dưỡng chất ôki"
Hộp 5 Miếng Mặt Nạ Đen Tràm Trà Sexylook Kiểm Soát Dầu Và Mụn Tea Tree Anti 28mlx5,[''],[13500000000],5,Tuyệt vời
Hộp 5 Miếng Mặt Nạ Đen Tràm Trà Sexylook Kiểm Soát Dầu Và Mụn Tea Tree Anti 28mlx5,[''],[13500000000],5,Hang gói kĩ chưa dùng nên chưa bt thế nào
Hộp 5 Miếng Mặt Nạ Đen Tràm Trà Sexylook Kiểm Soát Dầu Và Mụn Tea Tree Anti 28mlx5,[''],[13500000000],5,"Đóng gói rất cẩn thận,giao hàng hơi lâu tí,đây là lần đầu mua nên chưa bt hiệu quả ra sao"
Hộp 5 Miếng Mặt Nạ Đen Tràm Trà Sexylook Kiểm Soát Dầu Và Mụn Tea Tree Anti 28mlx5,[''],[13500000000],5,Gói bọc kĩ càng. Ship nhanh. Sản phẩm chất lượng. Sẽ ủng hộ lần sau
Hộp 5 Miếng Mặt Nạ Đen Tràm Trà Sexylook Kiểm Soát Dầu Và Mụn Tea Tree Anti 28mlx5,[''],[13100000000],5,Đóng gói rất chắc chắn
Hộp 5 Miếng Mặt Nạ Đen Tràm Trà Sexylook Kiểm Soát Dầu Và Mụn Tea Tree Anti 28mlx5,[''],[13500000000],5,
Hộp 5 Miếng Mặt Nạ Đen Tràm Trà Sexylook Kiểm Soát Dầu Và Mụn Tea Tree Anti 28mlx5,[''],[13100000000],5,
Hộp 5 Miếng Mặt Nạ Đen Tràm Trà Sexylook Kiểm Soát Dầu Và Mụn Tea Tree Anti 28mlx5,[''],[13100000000],5,
Hộp 5 Miếng Mặt Nạ Đen Tràm Trà Sexylook Kiểm Soát Dầu Và Mụn Tea Tree Anti 28mlx5,[''],[13500000000],5,
Hộp 5 Miếng Mặt Nạ Đen Tràm Trà Sexylook Kiểm Soát Dầu Và Mụn Tea Tree Anti 28mlx5,[''],[13500000000],5,Sản phẩm đúng giao nhanh ok
Hộp 5 Miếng Mặt Nạ Đen Tràm Trà Sexylook Kiểm Soát Dầu Và Mụn Tea Tree Anti 28mlx5,[''],[13500000000],5,Xịn xò 
Hộp 5 Miếng Mặt Nạ Đen Tràm Trà Sexylook Kiểm Soát Dầu Và Mụn Tea Tree Anti 28mlx5,[''],[13500000000],5,"Sp rất ok 
Mới Sài 1 lần nên chưa biết có giảm mụn kh"
Hộp 5 Miếng Mặt Nạ Đen Tràm Trà Sexylook Kiểm Soát Dầu Và Mụn Tea Tree Anti 28mlx5,[''],[13500000000],5,Sp ok giao hàng nhanh shop nhiệt tình ......................
Hộp 5 Miếng Mặt Nạ Đen Tràm Trà Sexylook Kiểm Soát Dầu Và Mụn Tea Tree Anti 28mlx5,[''],[13500000000],2,"vận chuyển lâu, đặt gần 2 tuần mới nhận được hàng, phải nt hỗ trợ giao hàng mới giao, khi nhận được thì hộp carton bị thủng lỗ, hàng thì đủ nhưng không biết có bị tráo hàng hay không nữa, thất vọng cho 1 đơn hàng 1 triệu"
Hộp 5 Miếng Mặt Nạ Đen Tràm Trà Sexylook Kiểm Soát Dầu Và Mụn Tea Tree Anti 28mlx5,[''],[13500000000],5,Giao hàng nhanh và gói kỹ. Cám ơn shop nhé 
Hộp 5 Miếng Mặt Nạ Đen Tràm Trà Sexylook Kiểm Soát Dầu Và Mụn Tea Tree Anti 28mlx5,[''],[13500000000],5,
