variations,price,rating_star,comment
[''],[11500000000],5,"mรฌnh nghiแปn sau khi xรi hแบฟt 1 tuรฝp lun รก, bแบญt tรดng hแบณng, nแบฟu mร ฤรกnh lรชn mแบทt thรฌ sแบฝ hฦกi khรด nรชn ฤรกnh kem chแปng nแบฏng trc nha"
[''],[11500000000],5,Giao hรng nhanh
[''],[11500000000],5,"ฤฦฐแปฃc review lร tแปt nรชn mua dรนng thแปญ, mแบทc dรน chฦฐa dรนng nhฦฐng giao hรng nhanh, bแปc gรณi cแบฉn thแบญn lแบฏm "
[''],[11500000000],5,"ฤรณng gรณi sแบฃn phแบฉm chแบฏc chแบฏn, hรng cรฒn nguyรชn tem, mรนi cแปงa sแบฃn phแบฉm rแบฅt thฦกm. Giao hรng nhanh chรณng, cรฒn hiแปu quแบฃ sแบฃn phแบฉm cแบงn chแป 1 thแปi gian mแปi biewts ฤฦฐแปฃc. "
[''],[11500000000],5,"Tuรฝp nhแป nhแป xinh xinh, mong lร lรขu xuแปng tรดng, shop giao hรng nhanh, bao bรฌ hฦกi xฦฐแปc 1 chรบt nhฦฐng mรฌnh k ฤแป รฝ vแบฅn ฤแป nรy lแบฏm nรชn vแบซn oke"
[''],[11500000000],5,Mua mแบฅy lแบงn rแปi รฝ :)) ncl dรนng แปn. Kem hแปฃp vแปi bแบกn nรo da รญt khuyแบฟt ฤiแปm vร khi tรกn dรนng mรบt แบฉm thรฌ ฤแปก bแป khรด hฦกn 
[''],[11500000000],5,Ok lam แบก kkkkkkkkkkkkkkkkkkkkkkkkkmkkmkkkkkkkkmmmkkkk
[''],[11500000000],5,"Sแบฃn phแบฉm ฤรณng gรณi rแบฅt tแป mแป, giao hรng nhanhhhhhhhh, rแบฅt hรi lรฒng"
[''],[11500000000],5,Aasssdfkkccklclclvlclclcllclxlxclalspp l ldllxllxlmmccclxlxlc llclcllvvvvcdsalxccvcdssxcvvvdxxcvvvllslxcvvddccccccdd
[''],[11500000000],5,hhhong hlร hhthththhtgrrgyru lร mแปt loรi thแปฑc vแบญt cรณ hoa trong hแป 
[''],[11500000000],5,ฤรณng gรณi thแบญt sแปฑ chแบฏc chแบฏn รญ >< dรนng cลฉng ฤรกng giรก tiแปn lแบฏm nha :3 mng nรชn mua em nรy nhรฉ
[''],[11500000000],5,"Giao hรng cแปฑc nhanh, hรng dรนng แปn แบก๐๐๐ sแบฝ cรฒn แปงng hแป shop๐๐๐๐๐"
[''],[11500000000],5,"Hแปp cรณ vแบป hฦกi mรฉo , mรนi cลฉng khรก thฦกm......................"
[''],[10900000000],5,"Hรฌnh แบฃnh vร video k liรชn quan , sแบฃn phแบฉm chแบฅt lฦฐแปฃng cลฉng ok , nรขng tone nhแบน nhรng , check mรฃ vแบกch ra sแบฃn phแบฉm , mn nรชn mua nhรฉ "
[''],[10900000000],5,Hรng giแปng แบฃnh. Chแบฅt lฦฐแปฃng oke. ฤรกng giรก tiแปn. Sฤn sale 1k khรดng ฤรฒi hแปi gรฌ hฦกn
[''],[11500000000],5,"Giao hรng nhanh, kem ฤรo thฦกm, mแปi tแปi hแปt khรณ tรกn ฤแปu. Dรนng lรขu mแบทt ra dแบงu nรชn bแป bรณng. Nรชn dรนng thรชm phแบฅn phแปง trรชn mแบญt sau khi bรดi kem xong"
[''],[10900000000],5,Thแบฅy ae bแบกn dรฌ review oke nรชn mua thแปญ oke thแบญt แบก thฦกm nแปฏa heheh nhฦฐng ai ngฤm thรฌ nรณ sแบฝ bแป phรกt hiแปn รฝ 
[''],[10900000000],5,"Giรก rแบป hฦกn cรกc shop khรกc, giao hรng siรชu nhanh, 2 ngรy ฤแบฟn nฦกi. Kem nรขng tone nhแบน nhรng, hแปฃp khi lฦฐแปi trang ฤiแปm mร vแบซn muแปn da trแบฏng, xinh. Chรกt kem rรกo nhanh, nhฦฐng cแบงn dฦฐแปกng แบฉm kแปน thรฌ tรกn kem sแบฝ khรดng bแป vแปt trแบฏng."
[''],[11500000000],5,"Hรng ฤฦฐแปฃc bแปc cแบฉn thแบญn kฤฉ cรng. Chแบฅt lฦฐแปฃng sแบฃn phแบฉm tแปt, nรขng tรดng rแบฅt tแปt mร k thแบฅy bรณ hay rรญt."
[''],[10900000000],5,"Hรng y hรฌnh
Lแปi lแบฏm nha mng heheheeee
Shop vร shipper cลฉng แปn nha"
[''],[11500000000],5,"mua dรนm nรชn ko biแบฟt ntn, thแบฅy nhiแปu rv tแปt nรชn mong sp chรญnh hรฃng ok แบก"
[''],[11500000000],5,"Chแบฅt lฦฐแปฃng sแบฃn phแบฉm tแปt, mรฌnh hรi lรฒng, cแบฃm ฦกn bแบกn! ๐๐๐๐๐๐๐๐๐"
[''],[11500000000],5,"Chแบฅt lฦฐแปฃng sแบฃn phแบฉm tแปt, giao hรng nhanhh, ฤรณng gรณi sแบฃn phแบฉm cแบฉn thแบญn , hรi lรฒng"
[''],[11500000000],5,"Cลฉng tแบกm tแบกm, ngแปญi mรนi nhแบน, thฦกm thoang thoแบฃng. Giao hรng nhanh hฦกn dแปฑ kiแบฟn"
[''],[11500000000],5,"Hแปp xinh lแบฏm nha, kem chแบฅt dแป tรกn, k lแปng quรก k ฤแบทc quรก, mรนi thฦกm nhแบน. Giao hรng nhanh, ฤรณng gรณi kฤฉ"
[''],[10900000000],5,T cx ko ฤi laฬm vรชฬ baฬo ฤi cฤฬt toฬc cho em xin lรดฬi nhฦฐng em laฬฃi coฬn coฬ mรดฬฃt sรดฬ thรดng tin vรชฬ quรช ฤn tรชฬt ms cho em xin lรดฬi nhฦฐng t 
[''],[11500000000],5,"Sแบฃn phแบฉm thฦกm lแบฏm luรดn, nรขng tone nhแบน, thแบฅm nhanh k bแป bแบฟt, nรชn mua nhen "
[''],[11500000000],5,"ฤรณng gรณi cแบฉn thแบญn 
Giao hรng nhanh hฦกn dแปฑ kiแบฟn๐
Shipper vui tรญnh๐
Kem ฤรo nhฦฐng mร khรดng mรนi ฤรo =))) mรฌnh thแบฅy hฦกi nghiรชng vแป mรนi hoรก chแบฅt๐คฆ๐ฟโโ๏ธ
Muแปi tแบฏm sแปฏa bรฒ cรณ mรนi sแปฏa dรช =))) nรณi chung tแบกm แปn แบก๐๐๐
Thiแบฟt nghฤฉ mng nรชn mua muแปi tแบฏm vแปซa rแบป vแปซa thฦกm lแบกi vแปซa nhiแปu๐ฌ๐ฌ๐ฌ"
[''],[10900000000],5,Giao hรng nhanh ฤรณng gรณi cแบฉn thแบญn chฦฐa dรนng sp nรชn chฦฐa biแบฟt nhฦฐ nรo แบก ๐
[''],[11500000000],5,"ฦฏng kinh khแปงng luรดn รฝ, thฦกm, hแปp nhรฌn rแบฅt chi lร sแปn sรฒ แบก......"
[''],[11500000000],5,Gvnhgffhjgfdfghhj. Nhแบญn dc hรng nhฦฐng chฦฐa dรนng k biแบฟt ntn๐
[''],[11500000000],5,"Giao hรng nhanh, ฤรณng gรณi cแบฉn thแบญn แบก. Sp thฦกm nhรจ nhแบน mรนi ฤรo, thแบฅm nhanh. Sแบฝ แปงng hแป shop tiแบฟp"
[''],[11500000000],5,"Giao hรng nhanhhh
Chแบฅt kem cลฉng okla lแบฏm แบก
Vแปซa mแปn vแปซa mฦฐแปt 
Sแบฝ แปงng hแป shop nhรฌu"
[''],[11500000000],5,"Giao hรng  nhanh, hรng  ฤรบng  nhฦฐ  Hรฌnh shop bรกn "
[''],[11500000000],5,"Shop ฤรณng gรณi hรng cแบฉn thแบญn cรณ lแปp xแปp chแปng xรณc, giao hรng nhanh, hรng cรณ auth hay khรดng thรฌ khรดng biแบฟt nhฦฐng cรณ mรนi thฦกm nhแบน chแบฅt kem ฤแบทc thแบฅm cลฉng khรก 
ฤรกng mua nhaaaaaaaaaaaaaaaaaaaaaaaaaaaaaaaaaa"
[''],[11500000000],5,Hรng tรณt sp ฤแบนp Sรi OK gรณi hรng kแป rแบฅt lร nhanh luรดn ฤแบฅy แบก kkkkkkk
[''],[10900000000],5,Hรng auth nรชn mua nha mn
[''],[11500000000],5,"Sแบฃn phแบฉm giแปng nhฦฐ hรฌnh, shop giao hรng nhanh chรณng, sแบฝ tiแบฟp tแปฅc แปงng hแป trong nhแปฏng lแบงn mua tiแบฟp theo"
[''],[11500000000],5,Giao hรng nhanh แบก chฦฐa dรนng nรชn k biแบฟt thแบฟ nรo nแบฟu tแปt sแบฝ แปงng hแป tiแบฟp
[''],[11500000000],5,Chแบฅt lฦฐแปฃng sแบฃn phแบฉm tuyแปt vแปiiiiiiiiiiiiiiiiiiiiiiiiiiiiiii
[''],[11500000000],5,Nhแปฏng gรฌ mรฌnh ฤรฃ lรm gรฌ ฤแป nรณi chuyแปn vแปi nhau ฤi ฤang cแบญp nhแบญt hรดm nay sแบฝ tแปt hฦกn nแบฟu bแบกn cรณ thแป nรณi lร ko cรณ
[''],[11500000000],5,"Sแบฃn phแบฉm giรณ kฤฉ ,okkkm
Nรชn muaaaaaaaa nhaaaaaaa๐"
[''],[11500000000],5,Dรนng thรญch lแบฏm nhรฉ. Mk dรนng cรกi nรy mแบฅy nฤm r. Mk lแบกi ฤแบทt cho chแป cรนng cty tiแบฟp ฤรขy
[''],[11500000000],5,"ฤรณng gรณi hรng ฤแบนp, chแบฏc chแบฏn, giao ฤแปง hรng
Sแบฃn phแบฉm check ฤฦฐแปฃc code"
[''],[11500000000],5,"Mแปi ngฦฐแปi ฦกi cho em hแปi em nghe nรณi lรบc uแปng iso thรฌ mแปฅn sแบฝ ฤแบฉy lรชn hแบฟt mร em cรณ ฤang uแปng nhฦฐng em thแบฅy mแปt sแป chแป mแปฅn mแปc lรชn xong mแปฅn lแบกi xแบนp xong mแปฅn lแบกi mแปc thรฌ cรณ phแบฃi iso ฤang ฤแบฉy cho hแบฟt khรดng แบก?
Mong ad duyแปt giรบp eโค๏ธ 
#depchanhsa"
[''],[11500000000],5,Rแบฅt lร ok nรชn mua ฤรณng boฬฃc cแบฉn thแบญn hdjekxbiwodkxoxns xkndns
[''],[10900000000],5,"Giao hรng siรชu nhanh,. ฤรณng gรณi sแบฃn phแบฉm cแบฉn thแบญn............. . "
[''],[10900000000],5,ฤแบนp ฦฐng แบก. Mmmmmmmmmm; mmnbshshvsusgvshehevehsvsjdndbhdskbd
[''],[11500000000],5,ฤรณng gรณi cแบฉn thแบญn lแบฏm nha chแบฅt lฦฐแปฃng okk lแบฏm mรฌnh quรชn chแปฅp hรฌnh lแบกi oyy lแบงn sau sแบฝ fb cho shop nha
[''],[11500000000],5,"ฤรณng gรณi ฤแบนp vร chแบฏc chแบฏn, chแบฅtvluwowngj chฦฐa dรนng chฦฐa bit nhฦฐng cแปฉ ฤnahs giรก tแบกm vแบญy vรฌ nhรฌn qua sp nhแบญn tg ฤแปi hรi lรฒng"
[''],[10500000000],5,"Hรng ฤแบนp ฤรณng gรณi sแบฃn phแบฉm chแบฏc chแบฏn. Cho 5 sao luรดn nร, sแบฝ แปงng hแป tiแบฟp nhoaaa"
[''],[11500000000],5,"Chuแบฉn bแป vร giao hรng nhanh. Tuรฝp kem nhแป xinh thฦกm mรนi ฤรo, kem แบฉm mแปn dแป thแบฅm, bรดi lรชn da cรณ chรบt แบฉm mแปn, lรชn tone khรดng nhiแปu"
[''],[11500000000],5,Kem rแบป mร xinh. Mรฌnh app mรฃ nแปฏa nรชn cรng siรชu rแบป. Hรฌnh แบฃnh vร video mang tรญnh chแบฅt minh hแปa lแบฅy xu thรดi nhรฉ mแปi ngฦฐแปi 
[''],[11500000000],5,"Xinh dรฃ man luรดn แบก
ฤรณng gรณi sแบฃn phแบฉm siรชu chแบฏc chแบฏn
Giao hรng nhanh"
[''],[11500000000],5,ksksskdoosowowooalakkaksjsjsjjsjsjskskskkskskdklsosososoosossosoososososoosososoososososoosososososososooaaooaoaoaoaooaoaoaoaoaooaososososoososososososoososoosososososoososososoososossoososososooaosososoosososoosksosoosos
[''],[11500000000],5,"Chแบฅt kem k lแปng quรก k ฤแบทc quรก, lรชn tone rรต, thฦกm mรนi ฤรo, ฤรกng mua แบก"
[''],[11500000000],5,Dkdjjdjฤndnjdjdnd chฦฐa bรณc nรชn chฦฐa biแบฟt kem cรณ auth hay k jdj
[''],[11500000000],5,"Kem mแปng, mรu trแบฏng sแปฏa, cรณ mรนi ฤรo thฦกm nhแบน, lรชn tone rแบฅt tแปฑ nhiรชn. "
[''],[11500000000],5,Rแบฅt แปn . Kem mแปn dแป tรกn . Hnklskbdjkdkbrujebhhsknrhsijbrjsj
[''],[11500000000],5,"Packaging ฤแบนp,bรดi thแปญ 1 lแปp kem lรชn tone ฦฐng แบก.Mng cรณ thแป tham khแบฃo em kem dฦฐแปกng nรy"
[''],[11500000000],5,"Mรฌnh ฤรฃ nhแบญn ฤc hรng r แบก. Shop dแป thฦฐฦกng lแบฏm nhรฉ :33 thแบฅy mรฌnh bแบฃo cแบงn gแบฅp lร giao ngay, mรฌnh nhแบญn luรดn vรo sรกng hรดm sau. Cแบฃm ฦกn shop nhiแปuuu"
[''],[11500000000],5,Giao hรng nhanh. Sแบฃn phแบฉm cรณ lรชn tone nhแบน. 
[''],[10500000000],2,"Chแบฅt lฦฐแปฃng sp OK nhฦฐng SHIPPER quรก khรดng แปn!! Khรดng biแบฟt phแบฃn รกnh แป ฤรขu nรชn comment luรดn tแบกi ฤรขy: Shipper CHฦฏA ฤi giao hรng qua nhฦฐng gแปi ฤiแปn LIรN TIแบพP k ngฦกi mรกy, rแบฅt phiแปn, ฤang hแปp, ฤรฃ tแบฏt mรกy nhiแปu lแบงn ฤแป gแปญi tn nhแป lรกt sau lh lแบกi nhฦฐng cรฒn chฦฐa kแปp gแปญi ฤc tn thรฌ ฤรฃ bรกo huแปท ฤฦกn ship @@"
[''],[11500000000],5,"thฦกm mรนi ฤรo, lแปng, khรดng biแบฟt lร hรng chรญnh hรฃng hay khรดng vรฌ giรก rแบป quรก"
[''],[11500000000],5,"Giao hรng nhanh. ฤรณng gรณi hรng cแบฉn thแบญn, chแบฅt lฦฐแปฃng sแบฃn phแบฉm tแปt "
[''],[10500000000],5,Em ฤแบทt 2c nhฦฐng shop giao nhแบงm cho cรณ 1c ร nhฦฐng shop vแบซn bank tiแปn giแบฃ lแบกi nhiแปt tรฌnh giรบp mรฌnh nhaโค๏ธโค๏ธ khฤn kiu shop
[''],[11500000000],5,"Giao hรng siรชu nhanh , ฤรณng gรณi chแบฏcc chแบฏn , sแบฃn phแบฉm tแปt vร cรณ รญch"
[''],[11500000000],5,"ฤรณng gรณi hรng chแบฏc chแบฏn , ฤแบนp , chแบฅt lฦฐแปฃng thรฌ tฦฐฦกng ฤแปi แปn...."
[''],[10500000000],5,"Sแบฃn phแบฉm giแปng hรฌnh, ฤรณng gรณi cแบฉn thแบญn, giao hรng hฦกi lรขu vรฌ lร hรng quแปc tแบฟ chuyแปn vแป..."
[''],[11500000000],4,Kem mแปng nhแบน dแป tรกn mรนi ฤรo thฦกm nhรฉ agshahbsbsbsnsgahahagaajb
[''],[10500000000],5,"Mn nรชn mua ฤi แบก 
Sjjsjsjsjssnsnjsksnsjwjsisiejebueuwjwhwhwjwjwjwjwhshsjsjsbshshjssjsjjsjsjsjsjsjsjsjjshsjsjsssjsjsjsjsjjsjsjsjsjs"
[''],[11500000000],5,Shop ฤรณng gรณi hรng rแบฅt cแบฉn thแบญn. Giao hรng nhanh. Chแบฅt lฦฐแปฃng kem chฦฐa dรนng nรชn chฦฐa biแบฟt. Sแบฝ แปงng hแป shop.
[''],[11500000000],5,"kem ฤรo mรฌnh dรนng ฤแบฟn tuyp thแปฉ 3 rแปi, chแบฅt lฦฐแปฃng khแปi chรช, shop ฤรณng gรณi cแบฉn thแบญn, giao hรng nhanh"
[''],[11500000000],5,Sแบฃn phแบฉm mua hแป nรชn kb chแบฅt lฦฐแปฃng. Dc cรกi ship cลฉng nhanh. Bรฌnh แปn giรก
[''],[11500000000],5,"Chแบฅt lฦฐแปฃng sp tuyแปt vแปi. Mรนi ฤรo rแบฅt thฦกm, Shop giao hรng nhanh lแบงn sau sแบฝ แปงng hแป shop tiแบฟp แบก :)))))))"
[''],[10500000000],5,"Lแบงn ฤแบงu ฤแบทt chฦฐa bรญt xรi sแบฝ ntb, nhฦฐng thแบฅy hแปp chแบฏc chแบฏn gรณi hรng cแบฉn thแบญn lร hรi lรฒng r แบก "
[''],[11500000000],5,แบขnh k lq lแบฏm. Rแบฅt ฤรกng mua nha cรกc bแบกn nha^^^^^
[''],[9500000000],5,"๐ธ Mix Son Trong Trแบปo ""Ngรขy Ther"" ๐ธ
Gแปฃi รฝ cรกch mix son ๐๐ฒ๐ฟ๐๐ ๐๐น๐๐ฟ ๐๐ถ๐ ๐ง๐ถ๐ป๐ kinh ฤiแปn cho team bรกnh bรจo nhแบน nhรng ฤi chฦกi cรนng crush ๐
๐BASE: #BT5_Hush_Rose: Hแปng khรณi base nรขu MLBB nhแบน nhรng.
๐POINT: #BT8_Burgundy_Addiction: ฤแป rฦฐแปฃu base nรขu cรก tรญnh."
[''],[11500000000],5,ฤhjfkiwjqbwborjebdbwkkwbcnfkdoejdbncksiwieidjhcbckowjw
[''],[10500000000],5,fthjnnhcgnjmkih gdchumkmn bhbningfghyh hhyhjkhgvbjjnnnn
[''],[10500000000],5,Ghaooqjwbwbsjkejebejkdpeowhbekekekenjeoepfknfbdbbdbzbbzjzbsbbdndnkskannsnsn
[''],[11500000000],5,"Giao hรng nhanh, kem cรณ mรนi thฦกm nhแบน, lแบงn sau sแบฝ tiแบฟp tแปฅc แปงng hแป shop"
[''],[10500000000],4,"ฤรฃ nhแบญn ฤฦฐแปฃc sแบฃn phแบฉm 
Shop ฤรณng gรณi cแบฉn thแบญn 
Thแปi gian chuแบฉn bแป hรng quรก lรขu nรชn ฤรกnh giรก 4*"
[''],[10500000000],3,"Giao hรng lรขu, chuแบฉn bแป hรng ฤรฃ mแบฅt 4 ngรy rแปi, 2 sแบฃn phแบฉm ฤแปu k check ฤฦฐแปฃc mรฃ vแบกch, k biแบฟt chแบฅt lฦฐแปฃng nhฦฐ nรo@@"
[''],[10500000000],5,"Giao nhanh shop phแปฅc vแปฅ tแปt
Nรขng tรดng da
ฤรณng gรณi tแปt โค๏ธโค๏ธโค๏ธโค๏ธโค๏ธโค๏ธโค๏ธโค๏ธโค๏ธ"
[''],[11500000000],5,"Giao hรng nhanhkebhdkwkwnsbsgriekwnsbdhwjwbsejwkjsbdbdjekekmdnd
D
 แบธehdkmw s. Dieknevee s diekesnbdbdb diรฉngghebwv. Jeiwbsgueuiwhwgehฤgrueieรญhdhhhdhduuรบekledkd"
[''],[11500000000],5,Giao hรng nhanh ฤรณng gรณi sแบฃn phแบฉm chแบฏc chแบฏn chฦฐa sแปญ dแปฅng nรชn khรดng biแบฟt ntn
[''],[10500000000],5,"chแป ฤแป nhแบญn xu vร mua ฤแป ฤn freeship,nhฦฐng mร shop bรกn giรก tแปt vร ฤแป rแบฅt ฤแบนp แบก "
[''],[11500000000],5,Rแบฅt tแปt nha mn nรชn mua nรจ๐ฅฐ๐ฅฐ๐ฅฐ๐ฅฐ๐ฅฐ๐ฅฐ๐ฅฐ๐๐๐๐๐๐๐๐๐๐๐๐๐
[''],[11500000000],5,Mแปi tแปi giao hรng nรขu quรก mua hรng khรกc rแปi mแปi thแบฅy giao tแปi 
[''],[9500000000],5,Fjdysphueyypturiiotiouirpjorigotiptitoyitoyirytotiypydigjfjfljjdugjdhsigjdheouodhdkgjxcjehjcjfkfjdugkdhsififjdjgkfjdjfidแปงiitifududdkfjjf
[''],[8900000000],5,Xแปu upxแปu down dรนng ฤแบฟn hแปp thแปฉ 2 luรดn lรชn tรดng tแปฑ nhiรชn lแบฏm mรฌnh nghฤฉ cรกi nรy giรบp nรขng tรดng tแปฑ nhiรชn thรดi cรฒn mแบฅy cรดng dแปฅng khรกc thรฌ ko cรณ tรกc dแปฅng nhฦฐng mik rraats ฦฐng chแบฅt kem mรนi thฦกm lรชn tรดng ฤแบนp๐ฅฐ
[''],[10500000000],5,"Chแบฅt lฦฐแปฃng sแบฃn phแบฉm tuyแปt vแปi, gรณi hรng cแบฉn thแบญn, giao hรng nhanh. Perfect!!!!!"
[''],[8900000000],5,"kem ok chรญnh hรฃng, hแปp xinh xแบปo, mรนi thฦกm vแป ฤรo, bแบญt tone rรต rแปt
#แบฃnhvideoklq"
[''],[10500000000],5,"Hรng giao hฦกi lรขu , chแบฅt lฦฐแปฃng tแปt, hรฌnh dรกng xinh xแบฏn, thanks shop nhรฉ. "
[''],[11500000000],5,"Chแบฅt lฦฐแปฃng tแปt, khรดng bแป mรณp mรฉo, thแปi gian giao hรng rแบฅt nhanh"
[''],[10500000000],5,ฤรณng gรณi sp tแปt. 
[''],[10500000000],5,Shop gรณi hรng cแบฉn thแบญn. Sแบฃn phแบฉm lรชn tone tแปt lแบฏm แบก. 
[''],[8900000000],5,Giao thiแบฟu hรng. Giao hรng chแบญm rep tin nhแบฏn khรกch cรฒn hแปi hแปฃt. Thiแบฟu hรng. Lแบงn ฤแบงu ฤแบทt hรng mร thiแบฟu hnagf nhiแปu nhฦฐ vแบญy 
[''],[10500000000],5,
[''],[9900000000],5,"Mรนi khรก thฦกm, hฦกi nhแป, sรกng แปn nhฦฐng ฤแบฟn tแบงm chiแปu khรก xuแปng tone, giรก แปn"
[''],[9500000000],5,"Giao hรng nhanh, hรดm trฦฐแปc ฤแบทt hรดm sau nhแบญn ฤฦฐแปฃc luรดn rแปi. Giรก rแบป hฦกn nhiแปu so vแปi chแป khรกc. Mua cho mแบน dรนng แบก."
[''],[9500000000],5,Giao hรng cx nhanh check thรฌ thแบฅy chรญnh hรฃng hihi ๐๐๐ป๐ฎ๐๐ป๐ฎ๐ป๐ฎxf
[''],[9500000000],5,"Lแบงn ฤแบงu mรฌnh mua cแปงa shop chฦฐa biแบฟt chแบฅt lฦฐแปฃng sao, nhฦฐng rแบฅt ฦฐng cรกch ฤรณng gรณi ฤแบฟn giao hรng. Giao hรng tk nhฦฐng nhanh thแปฑc sแปฑ. Cรณ 3 ngรy hรng tแปi. ฤรณng gรณi rแบฅt cแบฉn thแบญn. Lแป kem siรชu xinh, mรนi rแบฅt thฦกm, rแบฅt ฦฐng แบก ๐๐๐
Cรกm ฦกn shop nhiแปu"
[''],[9500000000],5,"ฤรณng gรณi hรng rแบฅt chแบฏc chแบฏn
Shop giao hรng khรก nhanh
Chฦฐa sd nรชn chฦฐa ฤรกnh giรก ฤc
Chรบc shop ฤแบฏt hรng"
[''],[9500000000],5,Shop giao hรng nhanh. Sแบฃn phแบฉm dรนng oke. Khรก thฦกm. Nรขng tone nhแบน.khรดng hแบฟt dรญnh. Mรฌnh sแบฝ แปงng hแป tiแบฟp ๐ช
[''],[10500000000],5,Jsjjdjsjjsjsjjjsjsjsksjsjsswjjsjsjsjsjeiejejsjjsssjjsj
[''],[10500000000],5,"Bแบญt tone, thฦกm mแปn, ฤรกng tiแปn"
[''],[11500000000],5,"Mรนi thฦกm nhแบน.lรชn tรดng ฤแบนp ,bแปn mรu,ฤรณng gรณi chแบฏc vร ฤแบนp"
[''],[9500000000],5,Tแปttttttttttttttttttttttttttttttttttttttttttttttttttttttttttttttttttttttttttttttttttttttttttttttttttttttttttttttttttttttttttttttttttttttttttttttttttttttttttt
[''],[9500000000],5,"ฤแบนp , chแบฅt lฦฐแปฃnggggggggggggggggggggggggggggggggggggggg"
[''],[9500000000],5,Sfgjkkbvdfhkkkkvxsdjkkbb dfkoigfdrgjklkbvfddfhjj mong dรนng sแบฃn phแบฉm sแบฝ tแปt vร trแบฏng da lรชn ฤฦฐแปฃc lรขu 
[''],[9500000000],5,07ttgfrtyvcddtyjbfffftyuhgfffttygvvfdr5yugff45ggฦฐhgg
[''],[9200000000],5,Giรก rแบป mร dรนng thรญch lแบฏm แบก. Dรนng lรชn tรดng nhแบน cรฒn dฦฐแปกng da tแปt hay k thรฌ phแบฃi dรนng mแปt thแปi gian mแปi biแบฟt แบก
[''],[8900000000],5,"Sแบฃn phแบฉm phรน hแปฃp vแปi giรก tiแปn
Rแบป ฤแบนp chแบฅt lฦฐแปฃng tแปt
Giao hรng nhanh
Shop nhiแปt tรฌnh "
[''],[8900000000],5,"Dรนng thรญch lแบฏm nha. Mรฌnh sang tuyp thแปฉ 2 rแปi
Shop gรณi hรng cแบฉn thแบญn. Giao hรng khรก nhanh"
[''],[9500000000],5,"Giao hรng rแบฅt nhanh luรดn nha mแปi ngฦฐแปi
Sแบฃn phแบฉm khรก tแปt nha 
ฤรกng tiแปn nha mแปi ngฦฐแปi"
[None],[9500000000],5,"ฤรฃ dรนng tuรฝp thแปฉ 2, rแบฅt ฦฐng cรณ ฤiแปu kiแปm dแบงu kรฉm, da cรng mฦฐแปt cรng dแปฏ tone lรขu nhรฉ :3 cรฒn hรดm nรo trรกi giรณ dแป trแปi hay nรณng thรฌ xuแปng tone nhฦฐng khรดng lรm da bแป kiแปu sแบกm sแบกm ฤรขu n chแป xuแปng tone tรญ thรดi, bแบกn nรo khรดng ngแบกi mรนi thรฌ mua kem bรดng cแบฃi siรชu giแปฏ tone cรฒn nแบฟu thรญch thฦกm thรฌ mua loแบกi nรy"
[''],[9500000000],5,Tdtdyddydyufufufhcjvvkkhgoududxhgjihihugyfyfyfugvhhvjvjvjvhc
[''],[9500000000],5,"kem ฤรo cutee dรฃ man hihii, nรขng tรดng tรดts แบก, giao hรng siรชu nhanhh"
[''],[9500000000],5,Sแบฃn phแบฉm chฦฐa dรนng nรชn k biแบฟt nhฦฐ thแบฟ nรo nhฦฐng phแปฅc vแปฅ cแปงa shop kรฉm
