variations,price,rating_star,comment
[''],[10900000000],5,Nsjwhvwhsjsggsbsbxkosjwtsbvsjxdowosnnzyxbekeifmcmhauwjxijฤncjdkeyvแบนdnkdrjjdjwolsmxgฦฐuรดรฉnomsbwywbxjxnmwokwnrkgkf
[''],[9900000000],5,"#Haฬฃt__CHIA__UฬC sale roฬฬi chiฬฃ em oฬiiii
 ฤoฬฬฃt naฬy giaฬ toฬฬt nhaฬฬt trong caฬc ฤoฬฬฃt em gom luoฬn veฬฬ tay aฬฃ

Nhoฬn ฤuฬng #69k/ goฬi 500gr.

Giaฬ uฬu ฤaฬi #aฬp_duฬฃng_duy_nhaฬฬt taฬฃi Topic naฬy nheฬ
HAฬฃT CHIA BLACK BAG_ #HAฬฃT_CHIA_UฬC ORGANIC-LOAฬฃI HAฬฃT CHIA NGON NHAฬฬT-DUฬOฬฬNG CHAฬฬT VAฬNG CH"
[''],[10900000000],5,"Hรng ฤรณng gรณi siรชu cแบฉn thแบญn, giao hรng nhanh chรณng, sand phแบฉm ฤung ฤรกnh giรก sau"
[''],[11500000000],5,"Thแบฅy chแบฅt kem lแปng hฦกn mแบฅy lแป trฦฐแปc mรฌnh dรนng
Kem nhanh thแบฅm, lรชn tone nhแบน, tฦฐ nhiรชn
Cรฒn hรng chuแบฉn hay fake thรฌ ko rรต"
[''],[10900000000],5,"Shop chuแบฉn bแป hรng nhanh. Vแป chแบฅt lฦฐแปฃng thรฌ mรฌnh thแบฅy chแบฅt kem hฦกi ฤแบทc khi tรกn cแบงn tรกn kฤฉ rแบฅt dแป bแป chแป trแบฏng chแป ฤen, mรนi thฦกm. Lรชn tone khรก rรต rรng "
[''],[10900000000],5,Kem hรng chuแบฉn nha mแปi ngฦฐแปi mn mua ฤi mรฌnh xรi kem nรy 2 e tuyp  rแปi 
[''],[11500000000],5,"ฤรฃ nhแบญn ฤฦฐแปฃc hรng. Shop giao hรng nhanh, sแบฃn phแบฉm giแปng nhฦฐ hรฌnh."
[''],[11500000000],5,Hhhvhbjhbbbnbvvhbbbbhbbbbnbbbnnnbnbbbbbbbvvvbvbbvvvg
[''],[10900000000],5,"Chฦฐa bรณc nhฦฐng ฤรฃ tแปซng mua 1 lแบงn chแบฅt lฦฐแปฃng ok.
Bao gรณi ok, giao hรng k mรณp mรฉo"
[''],[11500000000],5,giao ฤรบng hรng klnclslalnxcjklaslncndklqowihrhjwkqqknxnskxnxmaalkdbdha
[''],[10500000000],5,"ฤรณng gรณi hรng ฤแบนp, cแบฉn thแบญn; giao hรng nhanh. Dรนng thแปญ thแบฅy kem mแปn, cรณ mรนi thฦกm dแปu mong lร dรนng lรขu sแบฝ cรณ hiแปu quแบฃ trแบฏng da."
[''],[11500000000],5,Kem sแปn lรชn tone chแบฅt lฦฐแปฃng oke giao hรng nhanh sแบฝ แปงng hรดn shop dรi แบก ๐๐๐๐๐๐๐๐๐๐๐๐๐
[''],[11500000000],5,"Hรng giแปng nhฦฐ hรฌnh, ฤรณng gรณi chแบฏc chแบฏn, cแบฉn thแบญn, chแบฅt lฦฐแปฃng chฦฐa biแบฟt vรฌ chฦฐa sแปญ dแปฅng, nแบฟu แปn sแบฝ แปงng hแป tiแบฟp แบก"
[''],[10500000000],5,Jjdhnbb. Hnfj fjofd hjgdku gjfdb y dbhb ffnj dbjjcbujif bbun
[''],[9900000000],5,"Hรng sรi ok
Nรชn mua nha
Gsjsiejowowowowjjwฤ636xrhy8ju98pnjhnogvuvuuvgลฉydxettcobunibhoyviuvg"
[''],[10900000000],5,Ok nfnjdjdhdjฤjdjjฤjjdjdjdjdjdjfjcjcjcjfjfjdjrjsjesj
[''],[9900000000],5,"Kem mแปm mแปn, ฤรกnh lรชn k bแป bแบฟt dรญnh da, nรขng tone vร che khuyแบฟt ฤiแปm nhแบน, ฤรกnh ฤi hแปc ฤi chฦกi cลฉng dc hแบฟt hehee"
[''],[10900000000],5,Vgjkjcgippyrfbnbdyduwegfbccbksksjsjdjxjxjjdhdhdhdhhx
[''],[9900000000],5,"giao hรng nhanh, ฤรณng gรณi sแบฃn phแบฉm kฤฉ cรng. Tip kem nhรฌn ฤรกng iu cแปฑc, thฦกm mรนi ฤรo ๐. "
[''],[9900000000],5,"Sแบฃn phแบฉm ฤรณng gรณi rแบฅt chแบฏc chแบฏn, chแบฅt lฦฐแปฃng "
[''],[9900000000],5,"ฤแปฃt nรy giao hรng chแบญm kinhh khแปงngggg. Bรฌnh thฦฐแปng GHN cรณ 1-2 ngรy, mร lแบงn nรy 7 ngรy luรดn :) Chฦฐa dรนng nรชn k ฤรกnh giรก chแบฅt lฦฐแปฃng"
[''],[9900000000],5,"Chแบฅt lฦฐแปฃng sแบฃn phแบฉm tแปt phรน hแปฃp vแปi giรก,  kem dแป sแปญ dแปฅng mรนi thฦกm"
[''],[10500000000],5,"Mรนi thฦกm lแบฏm nha, cรณ bแบญt tรดng nhแบน, giao hรng nhanhhhhhhhhhhhhhhhhh"
[''],[9900000000],5,"Spham gia tแบงm 4-5 ngรy vแป, nhรฌn giแปng hรng thแบญt mรนi thฦกm nhฦฐ lแบงn tr mรฌnh tแปซng mua nhma nรขng tรดng nhanh quรก mรฌnh cลฉng kh trรกnh ฤc suy nghฤฉ lร kem trแปn =)))))))))))))) sorry shop"
[''],[9900000000],5,"Shop giao ฤแปง gรณi kฤฉ kem ฤรo ฤรฃ sแปญ dแปฅng hแบฟt 1 tuรฝp giแป lร tuรฝp 2 nรขng tone แปn nhฦฐng kh cรณ dฦฐแปng ฤแปง แบฉm lแบฏm nรชn cแบงn dฦฐแปกng แบฉm thรชm tรนy theo cแบฃm nhแบญn trรชn da cแปงa mbn cรฒn xแปt khรณa makeup nhรฌn xแปn sรฒ nhฦฐng jh biแบฟt tแปt kh vรฌ ch dรนng, cรณ kim tuyแบฟn bรชn trong  nรชn xแปt lรชn ra nแบฏng nhรฌn da blink blink"
[''],[9900000000],5,Chฦฐa sรi nรชn khong thแป nรo ns ฤc chแบฅt lฦฐฦกng nhฦฐ nรo nhฦฐng mร em nรy thฦกm lแบฏm test nฦกi tay thรฌ thแบฅy nรณ lรชn tone nhแบน khong bแป bแบฟt hay j ns chug lร uki laaa lแบฏm
[''],[9900000000],5,"Chแบฅt lฦฐฦกng ฤฦฐแปฃc, mรนi thฦกm, giao hรng nhanh, chแบฅt lฦฐแปฃng,...."
[''],[9900000000],5,Chฦฐa test ฤแป bแปn mรu k bt ฤc lรขu k. ฤรณng gรณi sแบฃn phแบฉm ok. Kem cรณ mรนi thฦกm
[''],[9900000000],5,"Bแบกn nรo mร muแปn nรขg tรดng nhแบน nhรng ฤi hแปc thi dรนng em nรy cลฉng ฤc , ฤiแปm trแปซ mรฌnh k thรญch lร giแปฏ tรดng k ฤc lรขu nma chแบฅt kem thรฌ rแบฅt nhแบน cแบฃm giรกc k bแป nแบทng mแบทt bรญ da "
[''],[9900000000],5,Chแบฅt lฦฐแปฃng sแบฃn phแบฉm tuyแปt vแปi . ฤรณng gรณi sแบฃn phแบฉm rแบฅt ฤแบนp vร chแบฏc chแบฏn
[''],[9900000000],5,Mรฌnh mua lแบงn nรy lร lแบงn thแปฉ 2. Chแบฅt kem khรก lแปngggggg. Nhฦฐng vแบซn okeela
[''],[9900000000],5,"Mแบทt nแบก dรนng thรญch cแปฑc, kem nรขng tone nhแบน mรนi khรก thฦกm cลฉng cแบฅp แบฉm khรก mฦฐแปt da"
[''],[9900000000],5,"ฤรณng gรณi chแบฏc chแบฏn
Thแปi gian giao hรng nhanh
Sแบฃn phแบฉm ฤรบng mรด tแบฃ"
[''],[9900000000],5,"Rแบฅt lร ฦฐng nhฦฐng khรดng ngแปญi thแบฅy mรนi thฦกm, cแบฃm ฦกn shop rแบฅt nhiแปu "
[''],[9900000000],5,Dcgjmgcdfvb vvbfc bh Grab vfd bรจcbhjxscn. Fgvdssx bhdszxcv
[''],[9900000000],5,"Kem cแบงm vแปซa tay rแบฅt xinh, giao hรng nhanh chฦฐa dรนng thแปญ nรชn chฦฐa biแบฟt"
[''],[10500000000],4,"Sแบฃn phแบฉm tแปt mร hฦกi khรณ tรกn lรชn tone trแบฏng hแปng phรน hแปฃp vแปi cรกc bแบกn hแปc sinh sinh viรชn giรก thรnh cลฉng khรดng quรก cao
"
[''],[9900000000],5,ฤแบนp
[''],[9900000000],5,"Kem thฦกm mรนi ฤรo nhแบน, nรขng tone แปn"
[''],[9900000000],5,"kem coฬ muฬi thฦกm nheฬฃ, khi thoa thiฬ cรขฬn nhiรชฬu kem mฦกฬi coฬ thรชฬ taฬn ฤรชฬu ฤฦฐฦกฬฃc ฤuฬ bรชฬ mฤฬฃt tay vaฬ chรขn. Mฦกฬi xaฬi ฤฦฐฦกฬฃc 1 ngaฬy nรชn vรขฬn chฦฐa biรชฬt ฤฦฐฦกฬฃc ฤรดฬฃ hiรชฬฃu quaฬ nhฦฐng kem xinh vaฬ xiฬฃn aฬฃ. ฤoฬng goฬi cรขฬn thรขฬฃn, khรดng biฬฃ moฬp hรดฬฃp, miฬnh khaฬ haฬi loฬng."
[''],[10500000000],5,"kem nรขng tone ฤแปnh lแบฏm รญ, nhฦฐng mร mแปi tแปi lร hฦกi dแป trรดi. hรฌnh nhฦฐ nรณ khรดng chแปng nฦฐแปc mร vแบซn chแบฅt lฦฐแปฃng lแบฏm lแบฏmmmmmmm ๐ฅบ๐ฅบ"
[''],[9900000000],5,........................................................................................................................................
[''],[10500000000],5,"ฤรณng gรณi tแปt. Giao hรng cลฉng kh mแบฅy lร nhanh , chแบฅt lฦฐแปฃng oki.."
[''],[9900000000],5,"Chแบฅt lฦฐแปฃng sแบฃn phแบฉm tuyแปt vแปi
ฤรณng gรณi sแบฃn phแบฉm rแบฅt ฤแบนp vร chแบฏc chแบฏn

 "
[''],[9900000000],5,"ฤรณng gรณi kฤฉ cรng, giao hรng khรก nhanh. Bdhdhรชhbdhjdjsjshรชbvvรชbhฦฐjdjdjrhe"
[''],[9900000000],5,
[''],[9900000000],5,"Sp chแบฅt lฦฐแปฃng 
Giao hรng nhanh...Hแปฃp cแบฃ vแปi giรก tiแปn
Sแบฝ แปงng hแป shop dรi lรขu"
[''],[10500000000],5,Sp dรนng tแปt แบฃnh vร vd khรดng liรชn quan jahsvdisksbdksisindjjd
[''],[10500000000],5,Chiแบฟc hแปp xinh xแบฏn mรนi ฤรo thฦกm thฦกm nรขng tone da nhแบน๐๐๐๐๐๐๐๐๐๐๐๐
[''],[10500000000],5,"Giao hรng hฦกi chแบญm
ฤรณng gรณi rแบฅt chแบฏc chแบฏn 
Chแบฅt lฦฐแปฃng sp rแบฅt tแปt
Giรก rแบฅt แปn "
[''],[10500000000],5,"Hรฌnh แบฃnh mang tรญnh chแบฅt minh hoแบก thรดi, kem dรนng tแบกm ฤc nรขng tรดng rรต"
[''],[10500000000],5,"Hรng quรก oke luรดn 
Nhแป sinh mang ฤj ฤรขu cลฉng tiแปn luรดn 
Mh dรนng e ngรy nรขng tone da cho makeup nhแบน nhรng bao phรช luรดn
Cรฒn cรดng dแปฅng dฦฐแปกng trแบฏng mh khรดng trรดng mong j cแบฃ 
Giao hรng rแบฅt nhanh ฤc giรก bรกn quรก hแปi 
Luรดn แปงng hแป shop ๐๐๐๐"
[''],[10500000000],5,"loแบกi nรy m dรนng tรกn dแป, lรชn tone tแปฑ nhiรชn k bแป trแบฏng quรก, b nรo lฦฐแปi thรฌ bรดi kcn + 1 lแปp mแปng nรy lรชn lร xinh r. shop gรณi hรng kฤฉ, giao hรng nhanh"
[''],[10500000000],5,"Giao hรng nhanh, ฤรบng ฤแปง mร mรฌnh lฦฐแปi chแปฅp แบฃnh quรก, mแปi ngฦฐแปi nรชn mua nhรฉ!"
[''],[9900000000],5,Chแบฅy lฦฐแปฃng sแบฃn phแบฉm tuyแปt vแปi ฤรณng gรณi sแบฃn phแบฉm rแบฅt ฤแบนpndbdjchdjdkdks
[''],[10500000000],5,Chแบฅt lฦฐแปฃng ok nhรฉ . Chแบฅt kem lรชn da khรด nhanh khรดng bแบฟt dรญch bแบญt tone rรต luรดn. Mแปi tแปi khรดng tรกn nhanh nรณ sแบฝ bแป khรดng ฤแปu 
[''],[10500000000],5,"Kem ฤรo thฦกm 
Bรดi lรชn khแปi make luรดn 
Ko lo mแปฅn, quรก oke ........."
[''],[10500000000],5,"Sแบฃn phแบฉm rแบฅt okila luรดn แบก, dแป tรกn , nรขng tone ok, khรก tแปp vรo da, nhรฌn xinh xแปu luรดn แบก , sแบฝ แปงng hแป shop tiแบฟp โฅ๏ธโฅ๏ธ "
[''],[10500000000],5,"mรฌnh ฦฐng dรฃ man luรดn แบฅy , kem mฦฐแปฃt thฦกm lแบฏm luรดn ... cรกc bแบกn mua ฤi rแปi biแบฟt nhรฉ ๐คช"
[''],[10500000000],5,ฤรฃ nhแบญn hรng. Chฦฐa xem thแปญ nhฦฐ nรooookoookooooooooooooooooooo dndnsje nsndjdnendnxnejennemdm
[''],[10500000000],5,"Sแบฃn phแบฉm OK nhรฉ, nhแป nhแบญn hแป lรชn k cรณ แบฃnh vs video๐"
[''],[10500000000],5,"Trแบฏng sa trแบฏng sรกttttttt trแบฏng bแบกch tแบกngggg, ฤi chฦกi vแปi crushhhhhhh e thแบนn muแปn chแปt, nรณi chแปฉ kem xuแบฅt sแบฏc  tแปฑ nhiรชn nhaaaaaaaaaaaaaaaaaaaaa"
[''],[10500000000],5,"Giao hรng nhanh lแบฏm nha, kem ฤรฃ dรนng mร thแบฅy rแบฅt ฦฐng luรดn แบก, sแบฝ แปงng hแป shop tiแบฟp"
[''],[10500000000],5,"Giao hรng nhanh , kem thฦกm mรนi ฤรo , kem mแปi bรดi lรชn tone trแบฏng nhรฌn ok cแปฑc "
[''],[10500000000],5,"Giao hรng nhanh, sp  rแบฅt ok  nรจ  ,sแบฝ แปงng hแป lแบงn sau  cho shop โคโคโคโคโคโคโค"
[''],[10500000000],5,"Hรng xinh lแบฏm, dรนng thฦกm. Khรดng kรญch แปฉng  dรนng thรดi mแปi ngฦฐแปi.... Hhjjfhjjkkjg"
[''],[10500000000],5,"Lรชn tรดng nhanh, nรชn thoa รญt รญt khรดng thรดi lร bแป trแบฏng quรก ๐๐๐๐๐๐"
[''],[10500000000],5,Amazing mk lรm anh shipper bแปฑc nhฦฐng mร sau khi xin lแปi thรฌ anh cรณ nhแบน nhรng lแบกi lรm mk thรญck ghรช รก kem thรฌ mk dรนng 2 3 lแบงn gรฌ ฤรณ rรฒi nรชn chแบฅt lฦฐแปฃng khแปi phแบฃi nรณi
[''],[9900000000],5,"Sแบฃn phแบฉm tแปt แบก. 
Xin lแปi vรฌ hรฌnh แบฃnh khรดng liรชn quan cho lแบฏm :)))))))
"
[''],[10500000000],5,"Sแบฃn phแบฉm tแปt, kem thฦกm ฤรกnh lรชn nรขng tรดng rรต rแปt luรดn. ฤแป cแปญ แบกaaaaaaaaaaaaaaaaaaaaa"
[''],[10500000000],5,"ฤฤng ฤแปก video khรกc, ฤรฃ nhแบญn ฤฦฐแปฃc hรng, ฤรณng gรณi cแบฉn thแบญn , ฤรฃ mua shop lแบงn 2"
[''],[10500000000],5,"Thiแบฟt kแบฟ lแป kem rแบฅt ฤรกng yรชu, mรนi ฤรo thฦกm lแบฏm. Bรดi lรชn trแบฏng hฦกn mแปt chรบt, mร nรณ nhanh trแป lแบกi da thฦฐแปng lแบฏm"
[''],[10500000000],5,"Hรng dรนng rแบฅt thรญch nha, thฦกm mรนi ฤรo, mรฌnh ฤแบทt 2 lแบงn 1 lแบงn vแป nhanh vc 1 lแบงn vแป chแบญm hฦกn xรญu"
[''],[10500000000],5,"kem sแปญ dแปฅng thรญch lแบฏm, sแบฝ quay lแบกi mua lแบงn nแปฏa kรฉnnsisjsnsjknk"
[''],[10500000000],5,"Giao hรng khรก nhanh แบกkk, mรนi thฦกm, cรณ nรขng tone nha, packaging ฤรกng iuu"
[''],[10500000000],5,"ฤแป tแบกm cรกi nรy vรฌ mรฌnh k cรณ แบฃnh, ship khรก nhanh, ฤแป ok, cแบฃm ฦกn shop"
[''],[10500000000],5,"Kem nรขng tone ok, khรดng bแบฟt rรญt, mng nhแป tรกn cho kฤฉ. Giรก rแบป hแบฟt sแบฝ mua lแบกi"
[''],[10500000000],5,Chแบฅt lฦฐแปฃng sแบฃn phแบฉm tแปt. Shop ฤรณng gรณi ฤแบนp. Giao hรng rแบฅt nhanh
[''],[10500000000],5,"Shop gรณi hรng kฤฉ vร cแบฉn thแบญn!
Sแบฃn phแบฉm thฦกm mรนi nho.
Kem nรขng tone rรต rแปt ๐๐๐๐ (hy vแปng giแปฏ mรu lรขu).
"
[''],[10500000000],5,"Lรชn tone nhแบน nhรng, hฦกi khรด da xรญu xiuuuuuuuuu nhฦฐng sแบฃn phแบฉm okkkkkkkkk"
[''],[10500000000],5,"Tรฌm em trong cฦกn mฦฐaโฆ anh thแบฉn thแป
Lแบงn theo nhแปฏng dแบฅu vแบฟt ฤรกnh rฦกi
Tฦฐแปng nhฦฐ rแบฅt gแบงn mร ngแป ฤรขu ฤรฃ rแบฅt xa
Vแปฅt mแบฅt theo cฦกn mฦฐa ngรy qua
Tฦฐแปng nhฦฐ rแบฅt lแบก mร ngแปก ฤรขu sao quรก quen
Lร lรบc em ngang ฤแปi ta

Chiแปu cuแปi con ฤฦฐแปng mรฌnh nhรฌn ngแบฏm hoรng hรดn
แบจn sรขu trong tiแบฟng tรญ tรกch rฦกi
Chแป mรฃi nฦกi nรyโฆ mแปt c"
[''],[10500000000],5,Good
[''],[10500000000],5,Mรนi thฦกm nhแบน. Cรณ lรชn tone. Chแบฅt kem  bแบฟt dรญnh vร rแบฅt khรณ tรกn nรชn phแบฃi tรกn nhanh vร khรดng ฤแปu. Nhฦฐng da bแบกn nรo mแปm mแปn thรฌ ฤแปก hฦกn. ฤรกnh lรชn trรกch bแปch nhฦฐ ฤi dแปa ma แบฅy ๐
[''],[10500000000],5,gvvbvhkhghjhjhhhgcgjjhgcjghgcjhhgchfhjgj bnvkbbmjjhjgcjvgcj biแบฟtvvbvhkhghjhjhhhgcgjjhgcjghgcjhhgchfhjgj bnvkbbmjjhjgcjvgcj biแบฟt
[''],[10500000000],5,"แปn nhรฉ. Chแบฅt kem mแปm mแปng nhแบน . Lรชn tแบงm 2 tรดng da
Da khรด xรi hฦกi khรณ tรกng kem gรขy tรฌnh trแบกng khรดng ฤแปu mรu, nhรฌn loang lแป. Nรชn cแบฅp แบฉm cho da rแปi hรฃy xรi sแบฝ ok la 
Mแปi thoa nhรฌn trแบฏng bแปch ฤแปฃi tแบงm 15p sแบฝ thแบฅm nhรฌn tแปฑ nhiรชn vร bรณng nhแบน
"
[''],[10500000000],5,ฤรณng gรณi siรชu cแบฉn thแบญn . Chฦฐa dรนng nรชn chฦฐa biแบฟt chแบฅt lฦฐแปฃng hihi . Mรนi thฦกm แบก 
[''],[10500000000],5,"Giao hรng nhanh 
Mรนi ฤรo siu thฦกmmmmmmypvyfitckgxityoxticticg"
[''],[10500000000],5,
[''],[10500000000],5,Mรนi thฦกm nhฦฐng k lรชn tรดng. ;))))))))))))))
[''],[10500000000],5,Kem thฦกm mรนi ฤรo nhแบน. Cรณ nรขng tone tแปฑ nhiรชn nhรฉeeee. Giao hรng nhanh. 
[''],[10500000000],5,"kem cรณ mรนi thฦกm, bรดi lรชn khรดng bแป bแบฟt dรญnh khรด nhanh, bรดi lรชn da trแบฏng hแบณn lรชn nhฦฐng khรดng bแป bแบญt tรดng quรก, sแบฃn phแบฉm dรนng tแปt"
[''],[11500000000],5,"Chแบฅt kem mแปn mแปi dรนng k biแบฟt cรณ hiแปu quแบฃ k mรนi ฤรo thฦกm mรกt, huhu quรชn chแปฅp แบฃnh nรชn k cรณ แบฃnh ๐๐๐๐๐๐๐๐๐๐"
[''],[10500000000],5,"Trฦกiifii ฦกiii mรนi ฤรo thฦกm lแบฏm แบก
Thoa thแปญ lรชn tay thแบฅy rแบฅt dแป tรกn mร mแปn nแปฏa, trแบฏng hแปng rแบฅt tuyแปt "
[''],[10500000000],5,"แบขnh ko liรชn quan nhฦฐng hรng chuแบฉn, ship nhanh, giรก tแปt, thฦกm, trแบฏng"
[''],[10500000000],5,Giao hรng nhanh. Giรก แปn. Chแบฅt lฦฐแปฃng cลฉng okayyy.......hdbฤ
[''],[10500000000],5,"trรชn vid thรฌ k thแบฅy thay ฤแปi gรฌ nhฦฐng แป ngoรi thรฌ cรณ trแบฏng lรชn nha, lรชn tone nhแบน nhรng lแบฏm chแปฉ ko phแบฃi kiแปu trแบฏng bแปch ra ฤรขu, ai da ฤen thรฌ dรนng vแบซn ok k lo bแป vแปt trแบฏng ฤรขu nhรฉ"
[''],[10500000000],5,"Hรng tแปt giao hรng nhanh y nhฦฐ  hรฌnh
Nรณi chung แปn mn nรชn mua"
[''],[10500000000],5,"Xแปt thฦกm, mรนi dแป chแปu , mรฌnh dรนng lฦฐu hฦฐฦกng tแบงm 3 4 tiแบฟng, giรก thรnh rแบป"
[''],[10500000000],5,"Giao hรng nhanh ghรช
Mรฌnh mua cho mแบน nรชn cลฉng khรดng biแบฟt chแบฅt lฦฐแปฃng nhฦฐ thแบฟ nรo
Hรng giรก rแบป okeee"
[''],[10500000000],5,"Giao hรng nhanh ฤรณng gรณi cแบฉn thแบญn, okkkkkkkkkkk"
[''],[10500000000],5,Nรขng tone tแปt nhฦฐng cรณ vแบป giแปฏ khรดng ฤฦฐแปฃc lรขu...ฤแปฅng nฦฐแปc 1 chรบt lร trรดi...nhฦฐng vแบซn rแบฅt ฤรกng mua nhรฉ 
[''],[10500000000],5,"Sp ok
Shop giao thiแบฟu sp nhฦฐng ฤรฃ hรฒan lแบกi trแบฃ 
K hรi lรฒng lแบฏm nhฦฐng vแบซn ฤแป 5s
แบขnh vร vd nhแบญn xu"
[''],[10500000000],5,"Sp ฤรณng gรณi chแบฏc chแบฏn , chแบฅt kem hฦกi lแปng , khรดng lรชn tรดng nhiแปu vร mau lแบกi mรu da , giao hรng nhanh"
[''],[10500000000],5,bรฌnh luแบญn mang tรญnh chแบฅt nhแบญn xuuuuuuuuuuuuuuuuuuuuuuuuuuu
[''],[10500000000],5,"ฤรณng gรณi sแบฃn phแบฉm chแบฏc chแบฏn 
Giao hรng nhanh chรณng
Chแบฅt lฦฐแปฃng sแบฃn phแบฉm ok"
[''],[10500000000],5,"Hรng ฤแบนp vร giรก cรฒn rแบป nแปฏa 
Ship hรng nhanh, ....................."
[''],[10500000000],5,Hรng giao hฦกi chแบญm. Tuy nhiรชn xรi hแปฃp vร cรณ nรขng tone. Sแบฝ แปงng hแป thรชm khi hแบฟt tuรฝp nรy
[''],[10500000000],5,Giแปนixjtxyoxkyxkyxlyclyxluxlhxlykxgxufjfjgjkgkkgogigo
[''],[10500000000],5,"Kem rแบฅt thฦกm, thoa vรด rแบฅt ฤแปu chแป cรณ ฤiแปu thoa nhanh kem chแปฉ ko lร nรณ khรด rแปi thรฌ thoa khรดng ฤฦฐแปฃc. Thoa tแบงm nแปญa tiแบฟng thแบฅy hแบฟt tone"
[''],[10500000000],5,Thuikfdfkjnhfshk
[''],[10500000000],5,Chแบฅt kem thรญch lแบฏm ฤi hแปc hay ฤi chฦกi chแป cแบงn kem chแปng nแบฏng vร em nรy thรดi em nรy lรขu trรดi lแบฏm nhรฉ giแปฏ ฤc cแบฃ ngรy luรดn แบฅy mรนi ฤรo thฦกm lแบฏm tรญp nรy lร tรญp thแปฉ 3 rแปi nรชn mua nh a๐ฏ๐ฏ๐ฏ๐ฏ
[''],[10500000000],5,"Sแบฃn phแบฉm rแบฅt tแปt, giao hรng trฦฐแปc dแปฑ kiแบฟn sแบฝ แปงng hแป nhiแปu ......."
[''],[11500000000],5,Hรng sฤn sale giรก rแบป nhฦฐng chแบฅt lฦฐแปฃng tแปt nhแบฅt lแบงn sau sแบฝ แปงng hแป tiแบฟp
[''],[10500000000],5,"Sแบฃn phแบฉm giแปng vแปi shop nรณi lแบฏm nha cรกc bแบกn 
Mรฌnh thแบฅy dรนng okkkk"
[''],[10500000000],5,"Sแบฃn phแบฉm chแบฅt lฦฐแปฃng,ฤแบนp giao hรng nhanh, nรขng tone tแปt dรนng mแบฅy hแปp rแปi oke lแบฏm"
[''],[10500000000],5,Shop chuแบฉn bแป hรng nhanh. ฤรณng gรณi sแบฃn phแบฉm chแบฏc chแบฏn. Chแบฅt lฦฐแปฃng chฦฐa thแปญ nรชn ch biแบฟt
[''],[11500000000],5,"chat luong san pham tot, dong goi san pham chac channnnnnnnn"
[''],[10500000000],5,"ฤรณng gรณi ฤแบนp, mรฌnh chฦฐa dรนng nhฦฐng mong chแบฅt lฦฐแปฃng sแบฝ tแปt. Nแบฟu tแปt sแบฝ แปงng hแป shop tiแบฟp tแปฅc"
[''],[10500000000],5,"mแปi dรนng mแปt lแบงn nhฦฐng thแบฅy mแปn mแปn, oce rแปi๐
mong lร dรนng sแบฝ nรขng ฤฦฐแปฃc 1-2 tรดng๐๐๐๐๐๐๐๐๐๐๐๐ฟ๐ฟ๐ฟ๐"
[''],[10500000000],5,"Giao hรng quรก lรขu 
Sแบฃn phแบฉm chแบฏc ฤฦฐแปฃc tแบกi thแบฅy nhรฌu ฤรกnh giรก tแปt vร nhiแปu ngฦฐแปi mua"
[''],[11500000000],5,"Tแปttttttttttttttttttttttttttttttttttttttt,  bรน lแบกi cho lแปi giao nhแบงm hรng kia!  "
[''],[11500000000],5,"Ha mang tc nhแบญn 200 xu, sp rแบฅt okkkkkkkkkkkkkkkkkkkkkkkkkkkkk"
[''],[10500000000],5,Hshshshahahshahahhshshshshshhshhshshshshshhshshshshshh
