name,variations,price,rating_star,comment
[Mรฃ SKAMSALE06 giแบฃm 10% tแปi ฤa 100K ฤฦกn 150K] Mแบทt Nแบก Rแปญa AXIS-Y Mugwort Pore Clarifying Wash Off Pack,['100ml'],[31900000000],5,"vแปซa mแป hแปp giแบฅy ra thรดi ฤรฃ xแปc lรชn mรนi thแบฃo mแปc rแปi (nhฦฐng mร thฦกm), ฤang dแปch mร giao vแบญy lร nhanh lแบฏm rรนi รก, sฤn dc sale giรก rแบป mร lแบกi cรฒn dc voucher giแบฃm thรชm hihi cแบฃm ฦกn shop โค๏ธ"
[Mรฃ SKAMSALE06 giแบฃm 10% tแปi ฤa 100K ฤฦกn 150K] Mแบทt Nแบก Rแปญa AXIS-Y Mugwort Pore Clarifying Wash Off Pack,['100ml'],[37500000000],5,Mแปi bรดi hฦกi nรณng vร chรขm trรญch. ฤแปฃi dรนng 1 thแปi gian xem sao โ๏ธ๐๐๐๐ณ๐๐ฑ๐พ๐๐ต๐ฅ๐ต๐ป๐ฒ๐ผ๐ต๐ฅ๐๐๐ฒ๐พ๐ณ๐๐ด๐๐ด๐ป๐ต๐๐ฒ๐บ๐ณ๐น๐ป๐ฒ
[Mรฃ SKAMSALE06 giแบฃm 10% tแปi ฤa 100K ฤฦกn 150K] Mแบทt Nแบก Rแปญa AXIS-Y Mugwort Pore Clarifying Wash Off Pack,['100ml'],[30000000000],5,"Hรng giao nhanh lแบฏm, nhฦฐng lแบกi ฤแบทt ra HN nรชn chฦฐa nhแบญn dรนng test ฤc, ฤรnh chแป thรกng nแปฏa ra dรนng vแบญy, sฤn ฤc flash sale nรชn giรก khรก tแปt "
[Mรฃ SKAMSALE06 giแบฃm 10% tแปi ฤa 100K ฤฦกn 150K] Mแบทt Nแบก Rแปญa AXIS-Y Mugwort Pore Clarifying Wash Off Pack,['100ml'],[30000000000],5,"Mรฌnh mua ฤรบng hรดm shop cรณ flashsale nรชn giรก mแปm hฦกn 1 chรบt, thแบฅy mn khen quรก mร mรนa hรจ rรนi nรชn mua vแป dรนng thแปญ hihi"
[Mรฃ SKAMSALE06 giแบฃm 10% tแปi ฤa 100K ฤฦกn 150K] Mแบทt Nแบก Rแปญa AXIS-Y Mugwort Pore Clarifying Wash Off Pack,['100ml'],[37500000000],5,"ฤรณng gรณi cแบฉn thแบญn, sแบฃn phแบฉm chแบฅt lฦฐแปฃng, chฦฐa sแปญ dแปฅng nรชn chฦฐa biแบฟt cรดng dแปฅng nhฦฐ nรo, chแป cรณ lร k hรi lรฒng vแปi bรชn vแบญn chuyแปn lแบฏm vรฌ giao hรng siรชu lรขu, hoรฃn giao tแบญn 2 lแบงn
 "
[Mรฃ SKAMSALE06 giแบฃm 10% tแปi ฤa 100K ฤฦกn 150K] Mแบทt Nแบก Rแปญa AXIS-Y Mugwort Pore Clarifying Wash Off Pack,['100ml'],[37500000000],5,"Shop rแบฅt tแบญn tรฌnh vร quan tรขm tแปi khรกch hรng nha. Hรng giao khรก nhanh. Sแบฃn phแบฉm nhฦฐ 1 dแบกng tแบฉy da chแบฟt nhแบน nhรng, phรน hแปฃp vแปi nhแปฏng bแบกn da dแบงu, dรนng xong cแบฃm thแบฅy da rแบฅt sแบกch"
[Mรฃ SKAMSALE06 giแบฃm 10% tแปi ฤa 100K ฤฦกn 150K] Mแบทt Nแบก Rแปญa AXIS-Y Mugwort Pore Clarifying Wash Off Pack,['100ml'],[37500000000],5,"Mรฌnh chฦฐa dรนng nรชn k biแบฟt chแบฅt lฦฐแปฃng ra sao
Nhฦฐng cรณ tem mรกc ฤรng hoรng, nhรฌn khรก ฦฐng ^^"
[Mรฃ SKAMSALE06 giแบฃm 10% tแปi ฤa 100K ฤฦกn 150K] Mแบทt Nแบก Rแปญa AXIS-Y Mugwort Pore Clarifying Wash Off Pack,['100ml'],[36900000000],5,"ฤรณng gรณi sแบฃn phแบฉm rแบฅt chแบฏc chแบฏn giao siu nhanh 
Sแบฃn phแบฉm thรฌ khรดng phแบฃi chรช mรนi max thฦกm kiแปu lรm mรกt hmmmmm nรณi chung tแบฅt cแบฃ ฤแปu siu siuuu thรญch nuรดnโจโจ"
[Mรฃ SKAMSALE06 giแบฃm 10% tแปi ฤa 100K ฤฦกn 150K] Mแบทt Nแบก Rแปญa AXIS-Y Mugwort Pore Clarifying Wash Off Pack,['100ml'],[36900000000],5,"Mแปi dรนng xong ฤแปu thแบฅy da nhฦฐ detox, mแปn hฦกn, mรนi hฦฐฦกng nhรจ nhแบน, ฤรฃ dรนng hแปง thแปฉ 2 rแปi"
[Mรฃ SKAMSALE06 giแบฃm 10% tแปi ฤa 100K ฤฦกn 150K] Mแบทt Nแบก Rแปญa AXIS-Y Mugwort Pore Clarifying Wash Off Pack,['100ml'],[37500000000],5,"Hรng giao siรชu nhanh
ฤรณng gรณi thรฌ siรชu xinh, hoรก ฤฦกn ฤแบงy ฤแปง :33333"
[Mรฃ SKAMSALE06 giแบฃm 10% tแปi ฤa 100K ฤฦกn 150K] Mแบทt Nแบก Rแปญa AXIS-Y Mugwort Pore Clarifying Wash Off Pack,['100ml'],[31900000000],5,"sang xแปn mแปn
dรนng xong mรกt mรกt da sแบกch
mรนi thฦกm nhแบน cรณ mรนi bแบกc hร"
[Mรฃ SKAMSALE06 giแบฃm 10% tแปi ฤa 100K ฤฦกn 150K] Mแบทt Nแบก Rแปญa AXIS-Y Mugwort Pore Clarifying Wash Off Pack,['100ml'],[37500000000],5,Shop giao hรng nhanh ฤรณng gรณi cแบฉn thแบญn sแบฃn phแบฉm thรฌ toรn hรng mแปi hihi๐ฅฐ
[Mรฃ SKAMSALE06 giแบฃm 10% tแปi ฤa 100K ฤฦกn 150K] Mแบทt Nแบก Rแปญa AXIS-Y Mugwort Pore Clarifying Wash Off Pack,['100ml'],[37500000000],5,"Giao hรng nhanh 
Cรณ tem nhรฃn ฤแบงy ฤแปง 
Chฦฐa biแบฟt chแบฅt lฦฐแปฃng thแบฟ nรo"
[Mรฃ SKAMSALE06 giแบฃm 10% tแปi ฤa 100K ฤฦกn 150K] Mแบทt Nแบก Rแปญa AXIS-Y Mugwort Pore Clarifying Wash Off Pack,['100ml'],[37500000000],5,Dรนng mรกt k kรญc แปฉng okila lalallalalalalakakakakakakakkakka
[Mรฃ SKAMSALE06 giแบฃm 10% tแปi ฤa 100K ฤฦกn 150K] Mแบทt Nแบก Rแปญa AXIS-Y Mugwort Pore Clarifying Wash Off Pack,['100ml'],[37500000000],5,ฤรฃ mua hรng cแปงa shop 2 lแบงn vร lแบงn nรo cลฉng ฦฐng hแบฟt. Shop tฦฐ vแบฅn rแบฅt nhiแปt tรฌnh luรดn. Sแบฃn phแบฉm dรนng lแบงn ฤแบงu cแบฃm giรกc thรญch lแบฏm. แปฆng hแป shop dรi dรi 
[Mรฃ SKAMSALE06 giแบฃm 10% tแปi ฤa 100K ฤฦกn 150K] Mแบทt Nแบก Rแปญa AXIS-Y Mugwort Pore Clarifying Wash Off Pack,['100ml'],[37500000000],5,Chvbbxmdnekejrbdmlskenrbฤbznksnฦฐnekxksnebdjxjsbdbxkdkdkรชnmฦฐlsdnbdjdkskebedbxjn
[Mรฃ SKAMSALE06 giแบฃm 10% tแปi ฤa 100K ฤฦกn 150K] Mแบทt Nแบก Rแปญa AXIS-Y Mugwort Pore Clarifying Wash Off Pack,['100ml'],[31900000000],5,Giao hรng nhanh. ฤรณng gรณi cแบฉn thแบญn. Dรนng lแบงn ฤแบงu nรชn chฦฐa biแบฟt chแบฅt lฦฐแปฃng sp
[Mรฃ SKAMSALE06 giแบฃm 10% tแปi ฤa 100K ฤฦกn 150K] Mแบทt Nแบก Rแปญa AXIS-Y Mugwort Pore Clarifying Wash Off Pack,['100ml'],[31900000000],5,"mua ฤฦฐแปฃc flash sale nรชn giรก khรก ok, hiแปu quแบฃ thรฌ chฦฐa rรต vรฌ lแบงn ฤแบงu dรนng, thแบฅy mn rv khรก tแปt"
[Mรฃ SKAMSALE06 giแบฃm 10% tแปi ฤa 100K ฤฦกn 150K] Mแบทt Nแบก Rแปญa AXIS-Y Mugwort Pore Clarifying Wash Off Pack,['100ml'],[31900000000],5,"Hรng chรญnh hรฃng, ฤรณng gรณi cแบฉn thแบญn, sแบฝ dรนng vร trแบฃi nghiแปm xem cรณ hiแปu quแบฃ k
Vkdkwjsndbfhjfkfoekwbsbdbfjccb"
[Mรฃ SKAMSALE06 giแบฃm 10% tแปi ฤa 100K ฤฦกn 150K] Mแบทt Nแบก Rแปญa AXIS-Y Mugwort Pore Clarifying Wash Off Pack,['100ml'],[37500000000],5,"giao hรng nhanh, ฤรณng gรณi แปn, vแบฃi ฤฦฐแปฃc, nhฦฐ hรฌnh, mแปi dรนng thแปญ nhฦฐng khรก thรญch, sแบฝ แปงng hแป"
[Mรฃ SKAMSALE06 giแบฃm 10% tแปi ฤa 100K ฤฦกn 150K] Mแบทt Nแบก Rแปญa AXIS-Y Mugwort Pore Clarifying Wash Off Pack,['100ml'],[37500000000],5," giao hรng nhanh, chรญnh hรฃng ฤรฃ check mรฃ, nhฦฐng mรฌnh thแบฅy giรก bรชn shop cao hฦกn shop khรกc "
[Mรฃ SKAMSALE06 giแบฃm 10% tแปi ฤa 100K ฤฦกn 150K] Mแบทt Nแบก Rแปญa AXIS-Y Mugwort Pore Clarifying Wash Off Pack,['100ml'],[31900000000],5,"Mแบซu hแปp trong ฤแบนp , cรฒn tem , scan mรฃ thรฌ ฤรบng hรng , giao hรng tฦฐฦกng ฤแปi nhanh , sฤn ฤแปฃt sale nรชn rแบป hฦกn giรก bt , chแบฅt lฦฐแปฃng dรนng xong mแปi biแบฟt "
[Mรฃ SKAMSALE06 giแบฃm 10% tแปi ฤa 100K ฤฦกn 150K] Mแบทt Nแบก Rแปญa AXIS-Y Mugwort Pore Clarifying Wash Off Pack,['100ml'],[42000000000],5,"ฤรณng gรณi tแปt , chฦฐa dรนng mong lร tแปt . Rแบฅt hรi lรฒng vรฌ giao nhanh chรณng"
[Mรฃ SKAMSALE06 giแบฃm 10% tแปi ฤa 100K ฤฦกn 150K] Mแบทt Nแบก Rแปญa AXIS-Y Mugwort Pore Clarifying Wash Off Pack,['100ml'],[37500000000],5,"Giao hรng nha, chแบฅt lฦฐแปฃng sแบฃn phแบฉm thรฌ phแบฃi dรนng mแปi biแบฟt ฤฦฐแปฃc"
[Mรฃ SKAMSALE06 giแบฃm 10% tแปi ฤa 100K ฤฦกn 150K] Mแบทt Nแบก Rแปญa AXIS-Y Mugwort Pore Clarifying Wash Off Pack,['100ml'],[37500000000],5,"ฤรณng gรณi ฤแบนp, chแบฏc chแบฏn. Giao hรnh rแบฅt nhanh. Mong lร sแบฝ phรน hแปฃp vแปi da mรฌnh"
[Mรฃ SKAMSALE06 giแบฃm 10% tแปi ฤa 100K ฤฦกn 150K] Mแบทt Nแบก Rแปญa AXIS-Y Mugwort Pore Clarifying Wash Off Pack,['100ml'],[37500000000],5,"Giao hรng nhanh, sแบฃn phแบฉm ฤรณng gรณi rแบฅt ฤแบนp vร chแบฏc chแบฏn, sแบฝ tiแบฟp tแปฅc แปงng hแป shop"
[Mรฃ SKAMSALE06 giแบฃm 10% tแปi ฤa 100K ฤฦกn 150K] Mแบทt Nแบก Rแปญa AXIS-Y Mugwort Pore Clarifying Wash Off Pack,['100ml'],[37500000000],5,
[Mรฃ SKAMSALE06 giแบฃm 10% tแปi ฤa 100K ฤฦกn 150K] Mแบทt Nแบก Rแปญa AXIS-Y Mugwort Pore Clarifying Wash Off Pack,['100ml'],[37500000000],5,"Hรng chรญnh hรฃng, check code thoแบฃi mรกi, date dรi, giao hรng nhanh"
[Mรฃ SKAMSALE06 giแบฃm 10% tแปi ฤa 100K ฤฦกn 150K] Mแบทt Nแบก Rแปญa AXIS-Y Mugwort Pore Clarifying Wash Off Pack,['100ml'],[30000000000],5,"Sแบฃn phแบฉm ฤแบฅt sรฉt dรนng khรก thรญch , dรนng xong khรดng khรด da, hiแปu quแบฃ chฦฐa rรต "
[Mรฃ SKAMSALE06 giแบฃm 10% tแปi ฤa 100K ฤฦกn 150K] Mแบทt Nแบก Rแปญa AXIS-Y Mugwort Pore Clarifying Wash Off Pack,['100ml'],[31900000000],5,Mรกttttttttttttttttttttttttttttttttttttttttttttttttt
[Mรฃ SKAMSALE06 giแบฃm 10% tแปi ฤa 100K ฤฦกn 150K] Mแบทt Nแบก Rแปญa AXIS-Y Mugwort Pore Clarifying Wash Off Pack,['100ml'],[37500000000],5,Check mรฃ chรญnh hรฃng luรดn แบก. Shop giao hรng nhanh. Cรฒn sแบฃn phแบฉm chฦฐa dรนng nรชn chฦฐa biแบฟt แบก
[Mรฃ SKAMSALE06 giแบฃm 10% tแปi ฤa 100K ฤฦกn 150K] Mแบทt Nแบก Rแปญa AXIS-Y Mugwort Pore Clarifying Wash Off Pack,['100ml'],[31900000000],5,"mแปi dรนng 2 lแบงn 
chแบฏc dรนng lรขu mแปi hiแปu quแบฃ 
cลฉng ฤฦฐแปฃc
hรฌ
mua ฤi
iii"
[Mรฃ SKAMSALE06 giแบฃm 10% tแปi ฤa 100K ฤฦกn 150K] Mแบทt Nแบก Rแปญa AXIS-Y Mugwort Pore Clarifying Wash Off Pack,['100ml'],[37500000000],5,Hรng dรนng ฤฦฐแปฃc sแบฝ แปงng hแป shop lแบงn saunnnnmmmm
[Mรฃ SKAMSALE06 giแบฃm 10% tแปi ฤa 100K ฤฦกn 150K] Mแบทt Nแบก Rแปญa AXIS-Y Mugwort Pore Clarifying Wash Off Pack,['100ml'],[37500000000],5,"Tuy chฦฐa sแปญ dแปฅng nhฦฐng vแบซn cho 5 sao. DGois hรng cแบฉn thแบญn, giao hรng nhanh."
[Mรฃ SKAMSALE06 giแบฃm 10% tแปi ฤa 100K ฤฦกn 150K] Mแบทt Nแบก Rแปญa AXIS-Y Mugwort Pore Clarifying Wash Off Pack,['100ml'],[37500000000],5,Chแบฅt lฦฐแปฃng sแบฃn phแบฉm tuyแปt vแปi. ฤรณng gรณi sแบฃn phแบฉm rแบฅt ฤแบนp vร chแบฏc chแบฏn.
[Mรฃ SKAMSALE06 giแบฃm 10% tแปi ฤa 100K ฤฦกn 150K] Mแบทt Nแบก Rแปญa AXIS-Y Mugwort Pore Clarifying Wash Off Pack,['100ml'],[31900000000],5,"sแบฃn phแบฉm ฤi vรo lรฒng ngฦฐแปi.
nรชn mua.
khรดng mua thรฌ cx nรชn mua nha."
[Mรฃ SKAMSALE06 giแบฃm 10% tแปi ฤa 100K ฤฦกn 150K] Mแบทt Nแบก Rแปญa AXIS-Y Mugwort Pore Clarifying Wash Off Pack,['100ml'],[36900000000],4,Nแบฏp bรชn trong bแป lแปch lรm mแบทt nแบก hฦกi bแป trรo ra ngoรi :(((
[Mรฃ SKAMSALE06 giแบฃm 10% tแปi ฤa 100K ฤฦกn 150K] Mแบทt Nแบก Rแปญa AXIS-Y Mugwort Pore Clarifying Wash Off Pack,['100ml'],[37500000000],5,"ฤแบญp phรช chแปฏ รช kรฉo dรi luรดn, mรฌnh thแบญt sแปฑ thรญch luรดn nha nรy lร mua lแบงn thแปฉ 2 rแปi แบก"
[Mรฃ SKAMSALE06 giแบฃm 10% tแปi ฤa 100K ฤฦกn 150K] Mแบทt Nแบก Rแปญa AXIS-Y Mugwort Pore Clarifying Wash Off Pack,['100ml'],[37500000000],5,Mแบทt nแบก thฦกm mรนi ngแบฃi cแปฉu ฤแบฏp khรดng khรด da cฤng mแบทt nhฦฐ maske ฤแบฅt sรฉt cแปงa innisfree ฤแป tแปง lแบกnh ฤแบฏp mรนa nรy lร hแปฃp lรญ chฦฐa sแปญ dแปฅng nhiแปu nรชn chฦฐa thแบฅy rรต kแบฟt quแบฃ. Thแบฅy review tแปt แป cรกc nฦฐแปc ฤรดng nam รก nรชn mua thแปญ dรนng. Nรชn mua nhรฉ ....๐คจ๐๐ฅธ๐คฃ๐๐๐๐๐๐
[Mรฃ SKAMSALE06 giแบฃm 10% tแปi ฤa 100K ฤฦกn 150K] Mแบทt Nแบก Rแปญa AXIS-Y Mugwort Pore Clarifying Wash Off Pack,['100ml'],[37500000000],5,"Shop gรณi hรng siรชu xinh luรดn, nhรขn viรชn thรฌ dแป thฦฐฦกng cรฒn hแปi xem khรกch nhแบญn ฤฦฐแปฃc giแป nรo. 10ฤ vแป chแบฅt lฦฐแปฃng vร dแปch vแปฅ โค๏ธโค๏ธโค๏ธโค๏ธโค๏ธโค๏ธ"
[Mรฃ SKAMSALE06 giแบฃm 10% tแปi ฤa 100K ฤฦกn 150K] Mแบทt Nแบก Rแปญa AXIS-Y Mugwort Pore Clarifying Wash Off Pack,['100ml'],[36900000000],5,"Check mรฃ ra nha mng ! Lรบc ฤแบงu mรฌnh cลฉng hฦกi phรขn vรขn , nhฦฐng mร giแป yรชn tรขm rแปi nhรก ! Sแบฝ lร khรกch hรng thรขn thiแบฟt cแปงa shop thรดi"
[Mรฃ SKAMSALE06 giแบฃm 10% tแปi ฤa 100K ฤฦกn 150K] Mแบทt Nแบก Rแปญa AXIS-Y Mugwort Pore Clarifying Wash Off Pack,['100ml'],[36900000000],5,"Shop giao hรng nhanh, mรฌnh chแปn ฤvvc lร nowship nรชn ฤฦฐแปฃc chแปn giแป nhแบญn vร ฤฦฐแปฃc tรบi giแบฅy mรu hฦฐแปng xinh xinh chแปฉ kph hแปp caton. Mรฃ code ฤแบงy ฤแปง vร shop ฤฦฐแปฃc axis y vietnam pr nรชn tin tฦฐแปng hรng auth nha mng. Mแบทt nแบก thฦกm lแบฏm, chฦฐa mแป hแปp ra ฤรฃ thแบฅy mรนi ngแบฃi cแปฉu thoang thoแบฃng rรนiii."
[Mรฃ SKAMSALE06 giแบฃm 10% tแปi ฤa 100K ฤฦกn 150K] Mแบทt Nแบก Rแปญa AXIS-Y Mugwort Pore Clarifying Wash Off Pack,['100ml'],[37500000000],5,"Thแบฅy pr ok nรชn dรนng thแปญ,hy vแปng dรนng hแปฃp vแปi da.cแบฃm ฦกn shop. Hjฤh"
[Mรฃ SKAMSALE06 giแบฃm 10% tแปi ฤa 100K ฤฦกn 150K] Mแบทt Nแบก Rแปญa AXIS-Y Mugwort Pore Clarifying Wash Off Pack,['100ml'],[36900000000],5,"Thแปi gian giao hรng nhanh, shop nhiแปt tรฌnh, cรณ tem chรญnh hรฃng"
[Mรฃ SKAMSALE06 giแบฃm 10% tแปi ฤa 100K ฤฦกn 150K] Mแบทt Nแบก Rแปญa AXIS-Y Mugwort Pore Clarifying Wash Off Pack,['100ml'],[37500000000],5,"Chแปฉa 61% Artemisia Princeps Leaf Extract - Ngแบฃi cแปฉu, thแบฅm hรบt sแบกch cรกc chแบฅt nhแปn tแปซ da vร giรบp da cรณ thรชm ฤแป แบฉm mแปi, tรกi tแบกo bแป mแบทt, lรm sแบกch da rแบฅt tแปt. Allantoin giรบp lรm dแปu nhแปฏng vแบฟt sฦฐng vร Kaolin cรณ tรกc dแปฅng cรขn bแบฑng vร ฤiแปu tiแบฟt bรฃ nhแปn."
[Mรฃ SKAMSALE06 giแบฃm 10% tแปi ฤa 100K ฤฦกn 150K] Mแบทt Nแบก Rแปญa AXIS-Y Mugwort Pore Clarifying Wash Off Pack,['100ml'],[30000000000],5,Tแปt nha rแบฅt tแปt so ok qua trแปฃ se mu lแบกi hang cua shop nha tot lam luon 
[Mรฃ SKAMSALE06 giแบฃm 10% tแปi ฤa 100K ฤฦกn 150K] Mแบทt Nแบก Rแปญa AXIS-Y Mugwort Pore Clarifying Wash Off Pack,['100ml'],[30000000000],5,"Shop rแบฅt chu ฤรกo, cแบฉn thแบญn, chฤm sรณc khรกch hรng rแบฅt tแปt......."
[Mรฃ SKAMSALE06 giแบฃm 10% tแปi ฤa 100K ฤฦกn 150K] Mแบทt Nแบก Rแปญa AXIS-Y Mugwort Pore Clarifying Wash Off Pack,['100ml'],[30000000000],5,Canh sale nรชn mua ฤฦฐแปฃc giรก rแบป. Cรฒn chแบฅt lฦฐแปฃng thรฌ ฤแป sau khi sdung mแปi review ฤฦฐแปฃc
[Mรฃ SKAMSALE06 giแบฃm 10% tแปi ฤa 100K ฤฦกn 150K] Mแบทt Nแบก Rแปญa AXIS-Y Mugwort Pore Clarifying Wash Off Pack,['100ml'],[36900000000],5,"Huhu nhแบญn ฤฦฐแปฃc hรng mแป xong thฦกm xแปu, giao hรng 3 ngรy lร mรฌnh nhแบญn ฤฦฐแปฃc rแปi, sแบฃn phแบฉm nรy thรฌ mแปi mua lแบงn ฤแบงu nรชn hong biแบฟt saoii"
[Mรฃ SKAMSALE06 giแบฃm 10% tแปi ฤa 100K ฤฦกn 150K] Mแบทt Nแบก Rแปญa AXIS-Y Mugwort Pore Clarifying Wash Off Pack,['100ml'],[30000000000],5,ฤรณng gรณi sแบฃn phแบฉm cแบฉn thแบญn giao hรnng nhanh chรณng chแบฅt lฦฐแปฃng tแปt
[Mรฃ SKAMSALE06 giแบฃm 10% tแปi ฤa 100K ฤฦกn 150K] Mแบทt Nแบก Rแปญa AXIS-Y Mugwort Pore Clarifying Wash Off Pack,['100ml'],[30000000000],5,Mแบทt nแบก dรนng khรก thรญch sฤn ฤฦฐแปฃc sale nรชn giรก rแบป. Ncl lร ngon bแป rแบป thรชm cรกi lร shop giao hรng thแบงn tแปc hรดm sau nhแบญn ฤฦฐแปฃc hรng rแปi 
[Mรฃ SKAMSALE06 giแบฃm 10% tแปi ฤa 100K ฤฦกn 150K] Mแบทt Nแบก Rแปญa AXIS-Y Mugwort Pore Clarifying Wash Off Pack,['100ml'],[30000000000],5,"Thแบฅy review tแปt nรชn mua dรนng thแปญ, shop giao hรng nhanh vแปซa ฤแบทt lรบc ฤรชm chiแปu ฤรฃ nhแบญn ฤฦฐแปฃc rแปi"
[Mรฃ SKAMSALE06 giแบฃm 10% tแปi ฤa 100K ฤฦกn 150K] Mแบทt Nแบก Rแปญa AXIS-Y Mugwort Pore Clarifying Wash Off Pack,['100ml'],[30000000000],5,"Shop rแบฅt nhiแปt tรฌnh
Giao hรng rแบฅt nhanh
ฤรณng gรณi chแบฏc chแบฏn
Check ra hรng chรญnh hรฃng nรชn mua nha mn 
Lแบงn sau sแบฝ แปงng hแป shop tiแบฟp ๐"
[Mรฃ SKAMSALE06 giแบฃm 10% tแปi ฤa 100K ฤฦกn 150K] Mแบทt Nแบก Rแปญa AXIS-Y Mugwort Pore Clarifying Wash Off Pack,['100ml'],[37500000000],5,แบคn tฦฐแปฃng ฤแบงu tiรชn lร shop gรณi ฤแป rแบฅt cแบฉn thแบญn! ฤรขy lร ฤiแปu mรฌnh rแบฅt ฤแป tรขm khi mua hรng online! Mรฌnh chฦฐa test sแบฃn phแบฉm nรชn chฦฐa biแบฟt chแบฅt lฦฐแปฃng ra sao! Nhฦฐng date ฤแบฟn 2023 thรฌ khรก lร แบฅn tฦฐแปฃng! :)...mong lร sแบฃn phแบฉm sแบฝ hแปฃp vs mรฌnh!
[Mรฃ SKAMSALE06 giแบฃm 10% tแปi ฤa 100K ฤฦกn 150K] Mแบทt Nแบก Rแปญa AXIS-Y Mugwort Pore Clarifying Wash Off Pack,['100ml'],[36900000000],5,
[Mรฃ SKAMSALE06 giแบฃm 10% tแปi ฤa 100K ฤฦกn 150K] Mแบทt Nแบก Rแปญa AXIS-Y Mugwort Pore Clarifying Wash Off Pack,['100ml'],[30000000000],5,"vแปฃt ฤc quแบฃ flashsale siรชu ngon siรชu hแปi
lแป t2 cแปงa mรฌnh r, thรญch lแบฏm, sแบกch da, dรนng xong da mฦฐแปt, kh bแป khรด, dแปu da bแปt ฤแป bแปt sแปฏng cรณ hแบกt ฤแบญu ฤแป tdc nhแบน, hฦกi รญt รก๐ฅบ๐ฅบ dรนng hao tแบกi texture kh cรณ ฤแบทc lแบฏm
giao hรng tแปc cแปฑc"
[Mรฃ SKAMSALE06 giแบฃm 10% tแปi ฤa 100K ฤฦกn 150K] Mแบทt Nแบก Rแปญa AXIS-Y Mugwort Pore Clarifying Wash Off Pack,['100ml'],[36900000000],5,Giao hรng nhanh ฤรณng kฤฉ. Mask ฤแบฏp phรช quรก. Sแบฝ แปงng hแป lแบกi. Cแบฃm ฦกn shop nhรฌu ๐๐๐ jjjhhhjjjjkkjjjfddrrtuiiolljhhhhbbbxszaassfgjn๐ฅฐ๐โค๐ฅฐ๐๐๐โค๐๐๐๐๐โค๐ฅฐ๐ฅฐ๐ฅฐ๐๐ฅฐ๐ฅฐ๐
[Mรฃ SKAMSALE06 giแบฃm 10% tแปi ฤa 100K ฤฦกn 150K] Mแบทt Nแบก Rแปญa AXIS-Y Mugwort Pore Clarifying Wash Off Pack,['100ml'],[36900000000],5,"Mรฌnh coi review e nรy thแบฅy tแปt nรชn mua xรi thแปญ. Mรนi ngแบฃi cแปฉu rแบฅt thฦกm, mแบทc dรน bt toรn dรนng aha/bha nhฦฐng gแบทp e nรy mask nรy ฦฐng liแปn. Dรนng vแป ฤแบญu ฤแป ฤแป tแบฉy da chแบฟt vแบญt lรฝ rแบฅt ฦฐ lร nhแบน dแปu. ฤแบฏp xong thแบฅy rแบฅt fresh nรจ mร da cลฉng ko quรก khรด nแปฏa. Mร dแบกo nรy mฤฉ phแบฉm ngแบฃi cแปฉu ฤang on trend phแบฃi ko ta."
[Mรฃ SKAMSALE06 giแบฃm 10% tแปi ฤa 100K ฤฦกn 150K] Mแบทt Nแบก Rแปญa AXIS-Y Mugwort Pore Clarifying Wash Off Pack,['100ml'],[36900000000],5,"Chแบฅt lฦฐแปฃng sแบฃn phแบฉm tแปt, hรng chรญnh hรฃng, giao hรng nhanh siรชu tแปc"
[Mรฃ SKAMSALE06 giแบฃm 10% tแปi ฤa 100K ฤฦกn 150K] Mแบทt Nแบก Rแปญa AXIS-Y Mugwort Pore Clarifying Wash Off Pack,['100ml'],[37500000000],5,Mแป sp ra ฤแบญm mรนi ngแบฃi cแปฉu. Nghe review tแปt gแปญi link mua uy tรญn nรชn mua dรนng thแปญ. Hi vแปng sแบฃn phแบฉm tแปt
[Mรฃ SKAMSALE06 giแบฃm 10% tแปi ฤa 100K ฤฦกn 150K] Mแบทt Nแบก Rแปญa AXIS-Y Mugwort Pore Clarifying Wash Off Pack,['100ml'],[30000000000],5,"Hรng nguyรชn seal , ฤรณng gรณi chแบฏc chแบฏn, thฦกm mรนi bแบกc hร......."
[Mรฃ SKAMSALE06 giแบฃm 10% tแปi ฤa 100K ฤฦกn 150K] Mแบทt Nแบก Rแปญa AXIS-Y Mugwort Pore Clarifying Wash Off Pack,['100ml'],[37500000000],5,Check mรฃ okila nha xeโฅ๏ธ ฤรณng gรณi hแปp hฦกi mรณp xรญu nhฦฐng ksaoo. Cรฒn chแบฅt kem thรฌ nhรฌn xแปn รก. Chแบฅt lฦฐแปฃng chฦฐa sรi thรฌ chฦฐa bรญt
