name,variations,price,rating_star,comment
[Mรฃ SKAMSALE06 giแบฃm 10% tแปi ฤa 100K ฤฦกn 150K] Mแบทt Nแบก Rแปญa AXIS-Y Mugwort Pore Clarifying Wash Off Pack,['100ml'],[37500000000],5,"Shop giao hรng nhanh, hรng bแปc kฤฉ mรฌnh phแบฃi hรฌ hแปฅc mแปt lรบc mแปi thรกo ra ฤฦฐแปฃc, thแบฅy khรก nhiแปu recommend tแปt vแป sแบฃn phแบฉm nรชn mua "
[Mรฃ SKAMSALE06 giแบฃm 10% tแปi ฤa 100K ฤฦกn 150K] Mแบทt Nแบก Rแปญa AXIS-Y Mugwort Pore Clarifying Wash Off Pack,['100ml'],[37500000000],5,"Shop ฤรณng gรณi hรng cแบฉn thแบญn,,giao hรng nhanh,,chแบฅt lฦฐแปฃng thรฌ cแบงn sแปญ dแปฅng mแปi nรชu ฤฦฐแปฃc รฝ kiแบฟn...dddddddsss"
[Mรฃ SKAMSALE06 giแบฃm 10% tแปi ฤa 100K ฤฦกn 150K] Mแบทt Nแบก Rแปญa AXIS-Y Mugwort Pore Clarifying Wash Off Pack,['100ml'],[37500000000],5,Thแปi gian giao hรng nhanh lแบฏm lun. Hแปง siรชu to lun รญ. Nรณi chug lร thรญchโค๏ธโค๏ธ
[Mรฃ SKAMSALE06 giแบฃm 10% tแปi ฤa 100K ฤฦกn 150K] Mแบทt Nแบก Rแปญa AXIS-Y Mugwort Pore Clarifying Wash Off Pack,['100ml'],[37500000000],5,ฤรฃ dรนng vร thแบฅy rแบฅt thรญch nhg phแบฃi sd thรชm mแปi thแบฅy tรกc dแปฅng ฤฦฐแปฃc
[Mรฃ SKAMSALE06 giแบฃm 10% tแปi ฤa 100K ฤฦกn 150K] Mแบทt Nแบก Rแปญa AXIS-Y Mugwort Pore Clarifying Wash Off Pack,['100ml'],[36900000000],5,"Chฦฐa xรi nรชn ko bt chแบฅt lฦฐแปฃng nhฦฐ nรo, hแปง to 100ml nhฦฐng giรก แปn, xem review thแบฅy ok nรชn mua xรi thแปญ, cรณ kรจm muแปng ฤแป lแบฅy mask tiแปn lแปฃi. "
[Mรฃ SKAMSALE06 giแบฃm 10% tแปi ฤa 100K ฤฦกn 150K] Mแบทt Nแบก Rแปญa AXIS-Y Mugwort Pore Clarifying Wash Off Pack,['100ml'],[36900000000],5,MK dรนng mแบทt nแบก ฤรขt sรฉt cแปงa nhร innis 4 nฤm r lแบงn ฤแบงu ฤแปi loแบกi khรกc hy vแปng sแบฝ แปn hฦกn
[Mรฃ SKAMSALE06 giแบฃm 10% tแปi ฤa 100K ฤฦกn 150K] Mแบทt Nแบก Rแปญa AXIS-Y Mugwort Pore Clarifying Wash Off Pack,['100ml'],[37500000000],5,Xแปn xรฒ mng แบก =))) chแบฅt ฤแบทc sรกnh mร thฦกm toรn mรนi ngแบฃi cแปฉu relax lรฉm hihii
[Mรฃ SKAMSALE06 giแบฃm 10% tแปi ฤa 100K ฤฦกn 150K] Mแบทt Nแบก Rแปญa AXIS-Y Mugwort Pore Clarifying Wash Off Pack,['100ml'],[37500000000],5,Chแบฅt lฦฐแปฃng sแบฃn phแบฉm tuyแปt vแปi ฤรณng gรณi sแบฃn phแบฉm chแบฏc chแบฏn Thแปi gian giao hรng rแบฅt nhanh
[Mรฃ SKAMSALE06 giแบฃm 10% tแปi ฤa 100K ฤฦกn 150K] Mแบทt Nแบก Rแปญa AXIS-Y Mugwort Pore Clarifying Wash Off Pack,['100ml'],[36900000000],5,"Mask ฤแบฏp rแบฅt thรญch , rแปญa mแบทt xong cแบฃm giรกc da rแบฅt sแบกch , hi vแปng dรนng lรขu sแบฝ ฤem lแบกi hiแปu quแบฃ "
[Mรฃ SKAMSALE06 giแบฃm 10% tแปi ฤa 100K ฤฦกn 150K] Mแบทt Nแบก Rแปญa AXIS-Y Mugwort Pore Clarifying Wash Off Pack,['100ml'],[36900000000],5,"Thแบฅy nhiแปu ngฦฐแปi review nรชn mua dรนng thแปญ, hรng chรญnh hรฃng. Giao hรng hฦกi lรขu, gรณi hรng chแบฏc chแบฏn"
