variations,price,rating_star,comment
['PORE CLEAN'],[2300000000],5,"Tích cực hưởng ứng Ngày Pháp luật nước Cộng hòa xã hội chủ nghĩa Việt Nam 09/11, toàn bndkbdjfnfj  phát huy tinh thần sống và làm việc theo Hiến pháp và pháp luật."
[' CHAMOMILE PURE'],[1500000000],5,Sp date dài mẫu mới nhé nên mua sau 2 ngày test mình thấy kcn này không phù hợp với da quá dầu như mình ssu 2 h mình dùng lsij dấy thấm dssuf thì có nhiều ạ mọi người tham khảo dòng suncreen thì kiềm dầu tốt hơn nhé
['ROSE'],[2500000000],5,"Hàng tặng sn chuỵ gái nên mk k biết chất lượng như thế nào 😅😅😅😅😅
Nhưng sản phẩm khá oki , bao bì dễ thương , màu Hồng nhạt nên chị ý thích lắm , hy vọng chị xài được 🥰🥰🥰🥰🥰
Yêu nhất lá thư của shop nha 😘😘😘😘😘
Giao hàng nhanh sớm 1 ngày"
"[' CHAMOMILE PURE', 'ROSE']","[1500000000, 2500000000]",5,"Mua dùng thử, mới thử lọ màu xanh thấy ẩm da rất thích, chọn mấy cái nhỏ nhỏ để thử mà shop giao đủ hàng siêu uy tín luôn"
"['AQUA PEELING', 'ROSE']","[1500000000, 2500000000]",5,Săn được deal hôm 6.6 nên mong chờ lắm!!!!!!!!!!!!!!!!!!!!
['ROSE'],[2500000000],5,"Chưa sử dụng chưa biết sao
Toner aha7 mùi nhẹ trông xịn sò
Toner mamonade bé hơn mình nghĩ mùi rose hơi nặng"
['AQUA PEELING'],[1500000000],5,"Sản phẩm đóng gói chắc chắnnnnnnnnn
Đã muaaaaaaa của shopppppppp nhiềuuuuuuuu lầnnnnnnnnnnnnnnnnnnn"
['AQUA PEELING'],[1500000000],5,Thơm. Nhỏ gọn. Mua muộn còn có mẫu này à  hhhhhhhhhhhhhhhiiiiiiiiiii hhhhhhhhhhhhhhhiiiiiiiiiii
['AQUA PEELING'],[1500000000],5,Giao hàng nhanh. Shop thật có tâm . sản phẩm phải dùng thử mới biết. Đóng hàng khá xinh hehe.
['AQUA PEELING'],[1500000000],5,"Chai bé giá tốt , thích mấy cái lọ bé bé như này để mang đi được du lịch 🧳 , ❤️❤️❤️❤️❤️❤️❤️❤️"
['AQUA PEELING'],[1500000000],5,"Thích dòng này nhất và mùi hương dòng này nhất, dùng toner của mamonde siêu thích luôn"
"['AQUA PEELING', ' CHAMOMILE PURE']","[1500000000, 1500000000]",5,"Thời gian chuẩn bị hàng nhanh 
Đóng gói cẩn thận 
Giao đủ hàng mua nhiều lần r rất yên tâm"
['AQUA PEELING'],[1500000000],5,Giao hàng nhanh gói hàng cẩn thận chưa dùng nên kbt chất lượng nếu ok sẽ mua tiếp 
['ROSE'],[2500000000],5,"Mình đã mua hàng của shop 1 lần rồi và lần này cũng k thất vọng. Hàng giao nhanh lắm. Giao đúng loại, lọ nhỏ nhỏ xinh xinh mang đi đâu cũng tiện. Chắc chắn sẽ còn quay lại mua thêm nhiều lần nữa 🥰"
[' CHAMOMILE PURE'],[1500000000],5,"Giá thành rẻ , chất lượng sản phẩm ok , shop đóng gói hàng cẩn thận , 🤟🤟🤟🤟👍👍👍👍"
['AQUA PEELING'],[1500000000],5,"Hàng chuẩn, date xa, lọ nhỏ dễ mang đi du lịch, sample giá rẻ, hợp lý đê thử"
['AQUA PEELING'],[1500000000],5,"Dùng hết r mới đánh giá, ns chung hàng chuẩn, toner làm sạch da nhẹ nhàng "
['AQUA PEELING'],[1500000000],5,CPLIF1K11H3CPEL1K11H166LIFENAFCABCPEL1K11H1CPLIF1K11H3CPEL1K11H166LIFENAFCAB
[' CHAMOMILE PURE'],[1500000000],5,"Thời gian giao hàng nhanh, đóng gói cẩn thận
Giao đủ hàng 
Chất lượng ok"
['AQUA PEELING'],[1500000000],5,Giao hàng siêu nhanh chất lượng khỏi bàn luôn nhé okela lắm luôn 😻😻
['ROSE'],[2500000000],5,Toner dùng thích êm da. Mua size mini để thử và sẽ mua full để dùng
"['AQUA PEELING', ' CHAMOMILE PURE']","[1500000000, 1500000000]",5,"Shop dễ thương, đồ rẻ mà chất lượng sẽ ủng hộ nhiều ạaaaaaaaaaam"
['AQUA PEELING'],[1500000000],5,Giao hàng siêu nhanh chất lượng nhỏ gọn tiện và đã mua đến lọ t5 
[' CHAMOMILE PURE'],[1500000000],5,Thời gian giao hàng nhanh chóng đóng gói sản phẩm rất chắc chắn và số có mùi hoa hồng khá giông tone hoa hồng 
['AQUA PEELING'],[1500000000],5,"Want live safe, shoud ban to keep ferocious dog ?
245GIAM10K12H"
[' CHAMOMILE PURE'],[1500000000],5,"Lưu mã shop giảm 100k còn 149k: FAVUI500K24
245GIAM10K12Hh"
"['AQUA PEELING', 'ROSE']","[1500000000, 2500000000]",5,"Sản phẩm đẹp, chất lượngggggg lắm nha shoppppoopppppppppp"
['AQUA PEELING'],[1500000000],5,"sản phẩm được đói gói kĩ , chắc chắn , giao hàng nhanh còn sản phẩm mình chưa sd nên ko biết chất lượng ạ ❤️ ảnh và video chỉ mang tính chất nhận xu . Cảm ơn mng đã đọc"
[' CHAMOMILE PURE'],[1500000000],5,zzzzzzzzzzzzzzzzzzzzzzzzzzzzzzzzzzzzzzzzzzzzzzzzzz
['AQUA PEELING'],[1500000000],5,Shop.giao hàng nhanhhhhhhhhh nhanhhhhhhhhh.............
['AQUA PEELING'],[1500000000],5,"Hàng y hình nhé
Chưa sử dụng nên chưa rì viêu được ạ
Đóng gói chắc chắn an toàn "
['AQUA PEELING'],[1500000000],5,"Nhỏ xinh, dùng hao nhanh lắm các bà mua lọ to mà dùng nhaaaaaaaaaaaaaaaaaa"
['ROSE'],[2500000000],5,"Giao hàng nhanh, gói hàng cẩn thận, mua nhiều lần của shop đều ưng"
['AQUA PEELING'],[1500000000],5,"Giao hàng nhanh, đóng gói hàng chắc chắn, chưa dùng nên chưa biết"
['ROSE'],[2500000000],5,"Giao hàng nhanh, đóng gói siêu cẩn thận, lọ bé xinh xinh hợp bỏ túi đi du lịch lắm nhé"
[' CHAMOMILE PURE'],[1500000000],5,"Chưa dùng thử nên kb chất lượng thế nào đọc review shop uy tín, hàng auth. Date đến 2023. Shop đóng gói chu đáo."
"['AQUA PEELING', ' CHAMOMILE PURE']","[1500000000, 1500000000]",5,"Chai nhỏ nhỏ xinh xinh, mùi thơm, shipper thân thiện, date xa tận 2023 lận để dùng thử xem hợp hong nếu ok sẽ quay lại ủng hôn shop tiếp"
['ROSE'],[2500000000],5,"Sản phẩm chính hãng ,mùi thơm.shiper thân thiện.shop đóng gói chắc chắn"
"[' CHAMOMILE PURE', 'ROSE']","[1500000000, 2500000000]",5,"Giao hàng nhanh ghê lun, toner này thì trc mình cx dùng rồi cái Rose water là oki nhất với mình"
['ROSE'],[2500000000],5,Mình hơi bị thích xài em này luôn ý đây là chai thứ 3 rồi mùi nhẹ nhàng dễ chịu không làm ngứa da mình
['ROSE'],[2500000000],5,"Giao hàng nhanh, đầy đủ, mua lần 2 bên shop r, uy tín lắm luôn nha"
[' CHAMOMILE PURE'],[1500000000],5,"Sorry vì ảnh klq
Toner mini nên khá là nhỏ, phần miệng lọ khá to nên khó apply thẳng lên mặt, phải đổ ra bông "
"['AQUA PEELING', 'ROSE']","[1500000000, 2500000000]",5,"Chưa sử dụng nhưng giao hàng đúng,tốt, gói hàng kỉ kh bể gì hết"
[' CHAMOMILE PURE'],[1500000000],5,"Giáo hàng nhah 
Hàng gói đẹp chắc chắn
Sẽ ủng hộ thêm shop
5 sao cho sự nhiệt tình"
['ROSE'],[2500000000],5,"hàng okk 
hình ảnh chỉ mang tính chât nhận xu thoi ạ
giao hàng nhanh"
['AQUA PEELING'],[1500000000],5,"Chai nhỏ xinh, mùi thơm chất lượng cũng khá ok. Với giá này thì rất đáng để mua"
"['AQUA PEELING', ' CHAMOMILE PURE', 'ROSE']","[1500000000, 1500000000, 2500000000]",5,"Giao hàng nhanh, mua hàng của shop là hàng chuẩn rồi, luôn luôn tin tưởng."
['AQUA PEELING'],[1500000000],5,Giao hàng nhanh đóng gói chắc chắn đủ phân loại hàng sẽ ủng hộ shop thêm 
['ROSE'],[2500000000],1,Xudvfusyxkvogidrhftyerruygdejihrghrhsdbufeggtkfrjrfnrdjriyrjkyfwhhyktfjyhk
"['AQUA PEELING', ' CHAMOMILE PURE']","[1500000000, 1500000000]",5,"Giao đầy đủ đúng hàng giao nhanh đóng gói OK giá rẻ mà date gần năm sau là hết r hk bik xài kịp hk đây trên mô tả hk ghi nên hk bik mới mua mà thôi cg đ , ship cao quá dặn giao trước 1 pm mà giao trễ quá"
"['AQUA PEELING', ' CHAMOMILE PURE']","[1500000000, 1500000000]",5,"Thời gian giao hàng rất nhanh, sản phẩm đóng gói rất chắc chắn"
['ROSE'],[2500000000],5,"Giao hàng rất nhanh luôn ạ, đóng gói sản phẩm , shop rất nhiệt tình ạ, đã mua mấy lần của shop r nên rất yên tâm ạ"
"['AQUA PEELING', ' CHAMOMILE PURE']","[1500000000, 1500000000]",5,đã mua của shop nhiều lần lúc nào cũng ứng lắm áaaaa đóng gói hàng cẩn thận mà hơi méo xí 🥺
[' CHAMOMILE PURE'],[1500000000],5,"Ngày nào cũng vào shop để xem có đồ mới không.
Đọc bình luận thấy các bạn được tặng quà mà ham.
Mong rằng mình cũng may mắn nhận được quà từ shop!"
['ROSE'],[2500000000],5,nước hoa hồng dùng tốt lăm ý ạ nhỏ gọn mà còn rẻ shop còn chuyên bán đồ chính hãng nên yên tâm lắm ạ vừa đặt thêm 2 chai nữa xong 
['PORE CLEAN'],[2500000000],5,"Shop gói hàng chắc chắn, mùi tưởng khó ngửi nhưng thơm :v kiềm dầu tốt "
[' CHAMOMILE PURE'],[1500000000],5,"Toner bé hơn mình tưởng tượng, chưa dùng nên chưa biết chất lượng ra sao nhưng cách shop đóng gói làm mình rất hài lòng 🥰"
[' CHAMOMILE PURE'],[1500000000],5,"Chai toner nhỏ 25ml, mùi nhẹ nhàng, chất lỏng như nước, cấp ẩm vừa phải, chai có miệng khá to cần cẩn thận đổ từ từ."
['ROSE'],[2500000000],5,"Shop đóng gói chống xốc và bìa catton rất chắc chắn tuy nhiên khi giao đến nơi thì hộp hơi móp méo, và là lọ mini nên kbt có chỗ check mã, mùi thơm hoa hồng dịu nhẹ chứ k quá nồng nha, hàng giao nhanh, 2 hôm là nhận được rồi"
[' CHAMOMILE PURE'],[1500000000],5,"Mua lần thứ n , nhỏ xinh , cân bằng tốt , mà giờ thời tiết nóng nực quá chắc chuyển dòng khác "
['AQUA PEELING'],[1500000000],5,"Giao hàg nhanh, date xa, hài lòng.........................."
['PORE CLEAN'],[2500000000],5,"Dùng thích , thấm rất nhanh , da ẩm mịn hơn , hình ảnh chỉ mang tính chất nhận xu"
['PORE CLEAN'],[2500000000],5,"Mua dùng thử thì thấy toner mùi khá thơm và dễ chịu. Shop gói hàng cẩn thận. Giao hàng cungc khá nhanh. Mới dùng vài ngày nên chưa đánh giá được chất lượng
"
['AQUA PEELING'],[1500000000],5,Ok mùi thơm bấkxndnwbahsgsbsnsnanabbananabsbsjaoxldnsndns
['AQUA PEELING'],[1500000000],5,"hàng chất lượng, dth...hình ảnh video chỉ mang tính minh hoạ nhận xu....."
[' CHAMOMILE PURE'],[1500000000],5,Shop giao hàng khá nhanh . Date xa. Nhưng toner không mùi gì. Các lọ trước mình dùng đều có mùi thơm
['FULL SET'],[7000000000],5,"Mua hàng của shop lúc nào cũng yên tâm, đóng hàng cực kỳ cẩn thận, cảm ơn shop nhiều nhaaaa"
[' CHAMOMILE PURE'],[1500000000],5,"Sản phẩm giống mô tả, đã mua nhiều lần,  đóng gói cẩn thận ạ ^^^^"
['AQUA PEELING'],[1500000000],5,"""Lạc Chỉ yêu Thịnh Hoài Nam không một ai hay biết
Thịnh Hoài Nam yêu Lạc Chỉ cả thế giới đều biết"""
['AQUA PEELING'],[1500000000],5,Giao hàng nhanh đóng gói sp cẩn thận. Mua sp mini giá rẻ rất nhiều so vs chai to. 
['FULL SET'],[7000000000],5,Giá rẻ hơn shop khac. Hàng chất lượng. Chỉ có điều set mini nên miệng lọ rộng đổ ra k cẩn thận hết nửa lọ. Sẽ ủng hộ lần sau 
['AQUA PEELING'],[1500000000],5,Giao hàng nhanh quá không tin nổi luôn đóng gói cực kì cẩn thận
