name,variations,price,rating_star,comment
Bông Tẩy Trang 3 Lớp Mềm Mịn Dai BEAUTY P0061,[''],[2500000000],5,"Shop gói hàng cẩn thận. Bông mềm, mịn, dai. Đã dùng gần chục bịch rồi"
Bông Tẩy Trang 3 Lớp Mềm Mịn Dai BEAUTY P0061,[''],[2500000000],5,Ụvfyjvdtjjvfnftujffyjbffhgcbj ùy v kì gfvjydcb ủy cbjklng
Bông Tẩy Trang 3 Lớp Mềm Mịn Dai BEAUTY P0061,[None],[2500000000],5,"- [ ] Hỏi a đi đứng kiểu gì. Năm lần 7 lượt ngã vào tim em
- [ ] Tặng a 1 gốc hoa đào. Tiện cho e hỏi lối vào tim anh
- [ ] Ngoài trời thì đã đổ mưa. Vậy a đã đỗ e chưa hỡi người
- [ ] Trời xanh mây trắng nắng vàng.  Hỏi anh nay đã sẵn sàng yêu chưa
- [ ] Nhìn từ xa cứ bảo nhau khó gần. Sao anh khôn"
Bông Tẩy Trang 3 Lớp Mềm Mịn Dai BEAUTY P0061,[None],[2500000000],5,"Bông Tẩy Trang 3 Lớp Mềm Mịn Dai BEAUTY
- 100% bông tự nhiên
- Túi đựng 200 cái -Túi zip thiết kế tiện lợi, đơn giản chống bụi.
- Thấm hút nhanh chóng, tẩy sạch bụi bẩn li ti mà không làm da bị tổn thương.
- Hàng nội địa Trung

Hướng dẫn sử dụng:
- Khi dưỡng da: Tẩm nước hoa hồng cơ bản lên miếng bô"
Bông Tẩy Trang 3 Lớp Mềm Mịn Dai BEAUTY P0061,[''],[2500000000],5,Gói hàng kỹ lắm chất lượng sản phẩm cubgx tốt. Mua hàng bên shop nhiều rồi không lo gì hết. 
Bông Tẩy Trang 3 Lớp Mềm Mịn Dai BEAUTY P0061,[''],[2500000000],5,"Bông tẩy trang dày vừa đủ, sử dụng k bị tới bông
Hộp phù hợp để đắp lotion, toner mỏng vừa, đắp rất thích"
Bông Tẩy Trang 3 Lớp Mềm Mịn Dai BEAUTY P0061,[''],[2500000000],5,Mcncncjjfjfdjjdndndjdjdjxjxxjjcjxjxjxjfjfjjfjdjdjd
Bông Tẩy Trang 3 Lớp Mềm Mịn Dai BEAUTY P0061,[''],[2500000000],5,Mua ở shop nhìu lần r. Hàng ok. Giao nhanh. Ủng hộ tiếp lần sau 😊
Bông Tẩy Trang 3 Lớp Mềm Mịn Dai BEAUTY P0061,[''],[2500000000],5,"Bông minn , giao hàng nhanh . Đóng gói kĩ . Sản phẩm. Chất lượng"
Bông Tẩy Trang 3 Lớp Mềm Mịn Dai BEAUTY P0061,[''],[2500000000],5," Chất lượng sản phẩm tuyệt vời
Đóng gói sản phẩm đẹp và chắc chắn "
Bông Tẩy Trang 3 Lớp Mềm Mịn Dai BEAUTY P0061,[''],[2500000000],5,"Hàng giao khá nhanh, hàng chất lượng, giá rẻ, sẽ ủng hộ shop tiếp "
Bông Tẩy Trang 3 Lớp Mềm Mịn Dai BEAUTY P0061,[''],[2500000000],5,Được kkkookjsnsjfhjwkwjdbjdidjdbbdjdjdjdhdbdhdhhshdhdhdhdjsjsn
Bông Tẩy Trang 3 Lớp Mềm Mịn Dai BEAUTY P0061,[None],[2500000000],5,"1. “Cause all of me loves all of you. Love your curves and all your edges, all your perfect imperfections”.

Vì những gì thuộc về anh đều yêu tất cả những gì em sở hữu. Anh say mê những đường cong và đường nét trên con người em, tất cả những khuyết điểm hoàn hảo của em – All of Me, John Legend."
Bông Tẩy Trang 3 Lớp Mềm Mịn Dai BEAUTY P0061,[None],[2500000000],5,Chất lượng sản phẩm tốt .........................................................................Chất lượng sản phẩm tốt ..........................................Chất lượng sản phẩm tốt ..........................................Chất lượng sản phẩm tốt ..........................
Bông Tẩy Trang 3 Lớp Mềm Mịn Dai BEAUTY P0061,[''],[2500000000],5,"Đủ hàng, bông dùng thích, giá 25k quá rẻ. Bông k cứng như bông giá rẻ khác"
Bông Tẩy Trang 3 Lớp Mềm Mịn Dai BEAUTY P0061,[''],[2500000000],5,"Bông dày dặn , hơi tốn nước tẩy trang và toner . Bông mà mỏng một chút thì đỡ hơn "
Bông Tẩy Trang 3 Lớp Mềm Mịn Dai BEAUTY P0061,[''],[2500000000],5,"ship nhanh, bông lau thích k bị bã, chất lượng phù hợp giá tiền"
Bông Tẩy Trang 3 Lớp Mềm Mịn Dai BEAUTY P0061,[None],[2500000000],5,Bbbbbbbbbbbbbbbbbbbbbbbbbbbbbbbbbbbbbbbbbbbbbbbbbbbbbbbb
Bông Tẩy Trang 3 Lớp Mềm Mịn Dai BEAUTY P0061,[None],[2500000000],5,"Shop gửi nhanh, đủ hàng. Nhận bông rồi nhìn ngoài vỏ rất thích. Chưa sd nên chưa đánh giá đc.gói này màu ngoài khác trong ảnh của shop, chắc shop gửi nhầm"
Bông Tẩy Trang 3 Lớp Mềm Mịn Dai BEAUTY P0061,[''],[2500000000],5,"Đã mua bên mình lần thứ 2 và chắc chắn sẽ mua tiếp ở đây , chất lượng khỏi bàn giá thành cũng rẻ hơn "
Bông Tẩy Trang 3 Lớp Mềm Mịn Dai BEAUTY P0061,[None],[2500000000],5,"Bông dùng thích, mềm mịn, dai, dùng không bị xơ bông. Túi bông to, được nhiều, miếng bông dày dặn. 
Chất lượng tốt."
Bông Tẩy Trang 3 Lớp Mềm Mịn Dai BEAUTY P0061,[None],[2500000000],5,bông mềm mịn đều có dập 2 đầu bông nên không no tung bông ra và các sợi bông k bị bám vô mặt 
Bông Tẩy Trang 3 Lớp Mềm Mịn Dai BEAUTY P0061,[''],[2500000000],5,Bông mềm ít xơ ncl tuyệt zờiiiiiiiiiiiiiiiiiiiiiiiiiiiiiii
Bông Tẩy Trang 3 Lớp Mềm Mịn Dai BEAUTY P0061,[None],[2500000000],5,"Bông thì dày dặn và mềm trơn, nhưng có một điểm mình không thích ở đây là nó trơn quá nên mình có cảm giác tẩy trang không được sạch bằng các loại bông khác"
Bông Tẩy Trang 3 Lớp Mềm Mịn Dai BEAUTY P0061,[''],[2500000000],5,"Không nghĩ nhận được hàng lại đẹp thế này , ví siêu xinh,  vừa đặt hôm sau nhận được luôn "
Bông Tẩy Trang 3 Lớp Mềm Mịn Dai BEAUTY P0061,[None],[2500000000],5,"Giao hàng siêu nhanh, đặt 3r chiều hôm trước mà 10h sáng hôm sau nhận đc rùi"
Bông Tẩy Trang 3 Lớp Mềm Mịn Dai BEAUTY P0061,[None],[500000000],5,"Bông dày dặn lắm nha ăn đứt mấy hàng giá cao, đồ nội địa trung vừa rẻ vừa xịn hêhhehehe"
Bông Tẩy Trang 3 Lớp Mềm Mịn Dai BEAUTY P0061,[None],[2600000000],4,Giao hàng cực kì lâu. Hàng gần dự kiến 16.17 gì mà tận 20 mới nhận được. Méo hết cả bịch do bị ép. May chỉ là bông tẩy trang chứ mấy đồ có nước là vỡ hoặc móp r. Tuy v vẫn đánh giá 4 sao vì chất lượng sp ổn
Bông Tẩy Trang 3 Lớp Mềm Mịn Dai BEAUTY P0061,[None],[2600000000],5,"Dùng ok :)) 
Aoqhjdlqlhhelqljdqllkdgqkldhoqkdhhqlslhjdkq"
Bông Tẩy Trang 3 Lớp Mềm Mịn Dai BEAUTY P0061,[None],[2500000000],5,"Giao hàng nhanh, bông tẩy trang lần trước mua thích nên lần này mua lại"
Bông Tẩy Trang 3 Lớp Mềm Mịn Dai BEAUTY P0061,[''],[2500000000],5,"Bông khá OK, hơi mỏng nên mua dùng chắc nhanh hết. Nhưng mềm khi dùng lắm"
Bông Tẩy Trang 3 Lớp Mềm Mịn Dai BEAUTY P0061,[None],[2900000000],5,"Mua lần thứ 2 ở đây rồi, giao hàng nhanh. Bông rẻ nhưng nhiều, dùng đc lâu. Bông cũng k bị xơ, dùng thích 👍🏻"
Bông Tẩy Trang 3 Lớp Mềm Mịn Dai BEAUTY P0061,[None],[2500000000],5,"Shop làm việc uy tín
Đặc biệt cách gói hàng = giấy mình rất ưng. Vừa đẹp, sang ,lại bảo vệ môi trường 
Và giá cũng rẻ nữa "
Bông Tẩy Trang 3 Lớp Mềm Mịn Dai BEAUTY P0061,[None],[2500000000],5,Vnjyddriknnbcffyhbbbvvvccvvvvvvvvvvvvvvvvvvvvvvvvvvbb
Bông Tẩy Trang 3 Lớp Mềm Mịn Dai BEAUTY P0061,[None],[500000000],5,"Tôi là người rất sợ phải chủ động liên lạc với người khác. Nếu tôi chủ động tìm bạn đó là bởi vì ở trong lòng tôi, bạn rất quan trọng. Nếu như tôi không chủ động tìm bạn, thì không phải là bởi bạn không quan trọng mà là tôi không rõ tôi ở trong lòng bạn có quan trọng hay không.

Cre: Weibo
Trans by "
Bông Tẩy Trang 3 Lớp Mềm Mịn Dai BEAUTY P0061,[None],[2600000000],5,"Hàng giao nhanh, đúng mẫu, chưa dùng nên chưa biết chất lựowng sao"
Bông Tẩy Trang 3 Lớp Mềm Mịn Dai BEAUTY P0061,[None],[500000000],5,"Nghe nói dạo này hot boy này nhà YSL hơi chảnh nên nhà em phải săn bằng được để cưa cho đổ ạ 😎😎

bao đẹp bao thơm bao sát gái nhé các anh. Không cần phải nói nhiều về vẻ đẹp trai của em nó phải không ạ. 

--
""Kinperfume"" 
💥 chuyên nước hoa chính hãng100% Authentic
💥 nhận giao sỉ và hỗ trợ cộng t"
Bông Tẩy Trang 3 Lớp Mềm Mịn Dai BEAUTY P0061,[None],[2600000000],5,"Giao hàng nhanh, shop chuẩn bị hàng bị thiếu mất 1 sp, chất lượng tốt"
Bông Tẩy Trang 3 Lớp Mềm Mịn Dai BEAUTY P0061,[None],[2900000000],5,"Shop đóng gói còn sơ sài, được cái giao nhanh nên vẫn cho 5 sao. Bông xanh dày hơn bông vàng 1 chút, nhưng cả 2 loại đều mỏng hơn tưởng tượng của mình nên với mình thì thích hợp dùng để thoa toner chứ ko tẩy trang, bù lại thì rất tiết kiệm nước hoa hồng, nước tẩy trang mỗi lần sử dụng"
Bông Tẩy Trang 3 Lớp Mềm Mịn Dai BEAUTY P0061,[None],[2500000000],5,"Bông tẩy trang dùng thíchhhhh. Dày dặn, ko bị bở. Phấn mắt chưa sử dụng nhưng khá xinh xẻo. Chống nắng thơm, lên tone nhẹ. Ncl ưng!!!"
Bông Tẩy Trang 3 Lớp Mềm Mịn Dai BEAUTY P0061,[None],[2500000000],5,"Giao hàng nhanh 
M thấy bông xanh ok hơn bông vàngg 
Recommend mn mua bông xanh nha"
Bông Tẩy Trang 3 Lớp Mềm Mịn Dai BEAUTY P0061,[None],[2500000000],5,Okkk nhaaaaaaaaaaaaaaaaaaaaaaaaaaaaaaaaaaaaaaaaaaaa
Bông Tẩy Trang 3 Lớp Mềm Mịn Dai BEAUTY P0061,[None],[500000000],5,"Vì mọi ng đã đáng giá quá nhìu rồi nên chắc mik k cần nói nhiều quá okekekekek nha rẻ mà dùng cho tẩy trang là cực ổn k quá dày như loại bông tròn, bông k bị xù ra okekekeke"
Bông Tẩy Trang 3 Lớp Mềm Mịn Dai BEAUTY P0061,[None],[2500000000],5,Áhhhdbfbfbbdgdgdg chat luonh san pham phu hop voi gia tien shs
Bông Tẩy Trang 3 Lớp Mềm Mịn Dai BEAUTY P0061,[None],[500000000],5,"Shop giao hàng hơi lâu. Sp y hình. Săn dc giá 5k quá hời. Bông 2 mặt đều mịn giống nhau. Cảm thấy miếng bông dày dặn hơn, các đường dập cũng chắc chắn."
Bông Tẩy Trang 3 Lớp Mềm Mịn Dai BEAUTY P0061,[None],[2900000000],5,"Thật sự rất hài lòng về các spham đã mua ở shop, chỉ với 109k mà mua được bao nhiêu là sản phẩm, mà chất lượng lại rất ôk, s trả lời tn rất nhanh. Bông tẩy trang tuy k mềm và độ nén k chuẩn như loại m đang dùng nhưng so về mức giá thì ntn quá ổn ạ"
Bông Tẩy Trang 3 Lớp Mềm Mịn Dai BEAUTY P0061,[None],[2500000000],5,"Bông tẩy trang OK, dai, ko bở bông, hình ảnh và video mang tính chất nhận xu thôi ạ, 😆 "
Bông Tẩy Trang 3 Lớp Mềm Mịn Dai BEAUTY P0061,[None],[500000000],5,"iao tiếp là hành động truyền tải ý đồ, ý tứ của một chủ thể tới một chủ thể khác thông qua việc sử dụng các dấu hiệu, biểu tượng và các quy tắc giao tiếp mà cả hai bên cùng hiểu."
Bông Tẩy Trang 3 Lớp Mềm Mịn Dai BEAUTY P0061,[None],[500000000],2,"Đóng gói hàng cẩn thận,giao hàng hơi chậm.săn được sale nên k vđề gì.nhưng k biết là của trung quốc hay hàn quốc.
Sau khi dùng phải nhận xét lại là bông tẩy trang quá tệ.hàng k chất lượng.đổ nước tẩy trang vào thì bông tạo bọt k thể sử dụng được"
Bông Tẩy Trang 3 Lớp Mềm Mịn Dai BEAUTY P0061,[None],[2600000000],5,"Hình ảnh mang tính chất nhận xu. Sản phẩm phù hợp với giá  tiền !!!!

"
Bông Tẩy Trang 3 Lớp Mềm Mịn Dai BEAUTY P0061,[None],[2900000000],5,"Mua lần thứ nhiều của shop rồi, bông rất mềm, không rát mặt, tiết kiệm nước tẩy trang hơn so với các loại khác. Rất ưng"
Bông Tẩy Trang 3 Lớp Mềm Mịn Dai BEAUTY P0061,[None],[2900000000],5,"Tư vấn khách hàng chưa thực sự chu đáo, giao hàng lâu quá lâu. Lần thứ 2 mua hàng của shop. 5 sao động viên"
Bông Tẩy Trang 3 Lớp Mềm Mịn Dai BEAUTY P0061,[None],[2900000000],5,"Mình ko hiểu sao mình quét mã trên Wechat lại ko tìm thấy sản phẩm 
Không thấy sự khác biệt quá lớn giữa bông ở gói xanh và vàng "
Bông Tẩy Trang 3 Lớp Mềm Mịn Dai BEAUTY P0061,[None],[500000000],5,"Gói bông nhìn xịn sò, mềm lắm ạ. Túi zip xinh và hịn, so với giá bt mình mua thì quá hời ạ ^^. Shop giao hàng nhanh đóng gói cẩn thận ạ. Sẽ tiếp tục ủng hộ shop "
Bông Tẩy Trang 3 Lớp Mềm Mịn Dai BEAUTY P0061,[None],[2900000000],5,"Đóng gói bằng bao bì giấy, thik kiểu đóng gói vậy, đóng gói chắc chắn. Bông chưa dùng nên ko bik ok hơn loại tròn ko? "
Bông Tẩy Trang 3 Lớp Mềm Mịn Dai BEAUTY P0061,[None],[500000000],5,Săn đc quả deal quá chất lượng luôn có 2k heheee bthg mua tầm 20-25k. Mình dùng bông này nhìu lắm òi giờ mua tích thoi. Mình hay mua gói 222m
Bông Tẩy Trang 3 Lớp Mềm Mịn Dai BEAUTY P0061,[None],[2900000000],5,"Đóng gói cẩn thận , giao hàng nhanh, bông bao bì đẹp dễ thương giá rẻ lông mềm k rát da mặt k bở dùng siêu thích gói tới hơn 200 miếng luôn se ủng hộ lần sau"
Bông Tẩy Trang 3 Lớp Mềm Mịn Dai BEAUTY P0061,[None],[2500000000],5,Chất lượng sản phẩm tuyệt vời nhưng hình như mình đặt 3 loại mà shop chỉ giao 2 loại
Bông Tẩy Trang 3 Lớp Mềm Mịn Dai BEAUTY P0061,[None],[2500000000],5,Goodd hàng shop thì yên tâm quá rồiiii không phải chê gì cả hehe
Bông Tẩy Trang 3 Lớp Mềm Mịn Dai BEAUTY P0061,[None],[2900000000],5,"Soạn hàng đầy đủ
Mua hẳn 3 gói xài cho đã
Shop đóng gói cẩn thận
Giao hàng lâu"
Bông Tẩy Trang 3 Lớp Mềm Mịn Dai BEAUTY P0061,[None],[500000000],5,"Săn được đúng đợt sale 
Giá cực hời mà chất lượng bất ngờ luôn nha mn ơi
Một bịch mà lại được rất nhiều miếng bông chắc dùng được 1 năm quá
Chất bông lại cực kì mềm mịn. Rất đáng mua nha mn "
Bông Tẩy Trang 3 Lớp Mềm Mịn Dai BEAUTY P0061,[None],[2800000000],5,"Bông dày dặn, lau thoải mái"
Bông Tẩy Trang 3 Lớp Mềm Mịn Dai BEAUTY P0061,[None],[2900000000],5,sang tận nhà nó ở đâu vậy anh cũng iu anh em cũng có thể làm tốt hơn em nhiều hơn là em trẻ đẹp và cũng là người ta không biết là 
Bông Tẩy Trang 3 Lớp Mềm Mịn Dai BEAUTY P0061,[None],[500000000],5,"Chữ mặt trước hàn quốc,  chữ mặt sau made in china  :))) chả biết như nào nữa nhưng nghe vẻ dùng ổn,  chưa dùng nên k chắc lắm"
Bông Tẩy Trang 3 Lớp Mềm Mịn Dai BEAUTY P0061,[None],[2900000000],5,Giao hàng nhanh.chất lượng phù hợp với giá tiền.rất đág tiền
Bông Tẩy Trang 3 Lớp Mềm Mịn Dai BEAUTY P0061,[None],[2900000000],5,Giao hàng ok. Giao thiếu nhưng shop đã hoàn tiền rồi. Sẽ ủg hộ lân sau.
Bông Tẩy Trang 3 Lớp Mềm Mịn Dai BEAUTY P0061,[None],[2800000000],5,"Bông dùng thích mà giá rẻ. Mềm hơn bông túi màu cam, sẽ ủng hộ shop"
Bông Tẩy Trang 3 Lớp Mềm Mịn Dai BEAUTY P0061,[None],[2500000000],5,Thanks shop <3333333333333333333333333333333333333333333333
Bông Tẩy Trang 3 Lớp Mềm Mịn Dai BEAUTY P0061,[None],[500000000],5,"Bdndbsk sjavs ka die akd ưkw dnajs aiendbdk akw dõ. Ạd d dơ dondownf ợe đợnle siẹtnkeow fowbepebwohr ựoeb rợe. Tởh oebq rơv eielwnf eo
"
Bông Tẩy Trang 3 Lớp Mềm Mịn Dai BEAUTY P0061,[None],[2900000000],5,"Giao nhanh , sp dùng chất lượng, e đã mua lần này là lần thứ 2 rồi, sẽ ủng hộ shop nhiều"
Bông Tẩy Trang 3 Lớp Mềm Mịn Dai BEAUTY P0061,[None],[2900000000],5,"Bông tẩy trang màu xanh mịn dùng thích hơn loại màu vàng, mỗi tội dễ bị rách phần viền bông thui ạ"
Bông Tẩy Trang 3 Lớp Mềm Mịn Dai BEAUTY P0061,[None],[2900000000],5,Giao đủ hàng. Giao hàng nhanh. Chất lượng okkkkkkkkkkkkkkkkkkkkkkkkkkk
Bông Tẩy Trang 3 Lớp Mềm Mịn Dai BEAUTY P0061,[None],[500000000],5,"Shop đóng gói đpej và chắc chắn, thời gian giao hàng cũng ổn, chất lg tốt, mình sẽ quay lại ủng hộ shop"
Bông Tẩy Trang 3 Lớp Mềm Mịn Dai BEAUTY P0061,[None],[500000000],5,Shop giao hàng nhanh bông tẩy trang dùng thích lắm ạ🤪mua giá sale nên rẻ vô cùng
Bông Tẩy Trang 3 Lớp Mềm Mịn Dai BEAUTY P0061,[None],[500000000],5,Mình chưa dùng cố định hãng bông tt baoh nên giờ sẽ thử xem và nếu hợp sẽ chỉ chuyên dùng 1 loại
Bông Tẩy Trang 3 Lớp Mềm Mịn Dai BEAUTY P0061,[None],[2900000000],5,"Sản phẩm tốt, bông khá xin sò so với giá thành. Bông ko quá dày, tiết kiệm nước tẩy trang, độ thấm tốt, dai, không bị xơ bông."
Bông Tẩy Trang 3 Lớp Mềm Mịn Dai BEAUTY P0061,[None],[500000000],5,"Tôi rất ưg í hết hdjdidjsnsnxhdudjdjdndndjdjeuueueue
Dhduudjđjjdjdjdjdjxnxnd
Dbdjdidididjdj"
Bông Tẩy Trang 3 Lớp Mềm Mịn Dai BEAUTY P0061,[None],[500000000],5,Đóng gói không được cẩn thận lắm. Tuy nhiên với giá 5.000₫ thì chất lượng sản phẩm khá tốt 
Bông Tẩy Trang 3 Lớp Mềm Mịn Dai BEAUTY P0061,[None],[500000000],5,Xhnxnxjhshshhdhdhdhdhhfhchcyvyysjwjrhthhdhxuhvyvuxjsjsjhshdhdhchvyfujsjwbfbfbcjjvvidjsd
Bông Tẩy Trang 3 Lớp Mềm Mịn Dai BEAUTY P0061,[None],[500000000],5,Giao hàng nhanh chóng. Đòn gói chắc chắn. Săn deal 1k nhưng chất lượng rất tốt 
Bông Tẩy Trang 3 Lớp Mềm Mịn Dai BEAUTY P0061,[None],[500000000],5,"Săn dc giá 5k vừa rẻ mà hàng lại siêu chất lượng
Thăn kiu shop
Sẽ ủng hộ lâu dài naaaaaa"
Bông Tẩy Trang 3 Lớp Mềm Mịn Dai BEAUTY P0061,[None],[500000000],5,ndkrksnskwkwksnndjekekekekekekskskwkekekeekkeekskksskksskksskskksksskkssksksksksksksk
Bông Tẩy Trang 3 Lớp Mềm Mịn Dai BEAUTY P0061,[None],[2900000000],5,"Giao hàng nhanh, đóng gói cẩn thận, đúng màu, sẽ ủng hộ shop nhiều về sau ạ. Hd"
Bông Tẩy Trang 3 Lớp Mềm Mịn Dai BEAUTY P0061,[None],[2900000000],5,"Bông được nhiều mà có điều nó không được dai lắm, mình cũng mới dùng 1 lần. Giá ok"
Bông Tẩy Trang 3 Lớp Mềm Mịn Dai BEAUTY P0061,[None],[500000000],5,"Okkkkkkkkkkkkkkkkkkkkkk

Okkkkkkkkkkkkkkkkkkkkkk

Okkkkkkkkkkkkkkkkkkkkkk"
Bông Tẩy Trang 3 Lớp Mềm Mịn Dai BEAUTY P0061,[None],[500000000],5,"Mua trong đợt flash sale nên khá hời, bông tâỷ trang tốt, mỏng, sẽ ủng hộ shop nữa "
Bông Tẩy Trang 3 Lớp Mềm Mịn Dai BEAUTY P0061,[None],[2900000000],5,Thời gian giao hàng nhanh chóng đóng gói sản phẩm sơ sài giá cả hợp lý 
Bông Tẩy Trang 3 Lớp Mềm Mịn Dai BEAUTY P0061,[None],[500000000],5,"Dùng thích nha
Bông dày vừa tẩy trangkhông có sợi vải bám lại "
Bông Tẩy Trang 3 Lớp Mềm Mịn Dai BEAUTY P0061,[None],[500000000],5,"Bông mềm, săn sale giá tốt mà dc tận 200 miếng, chưa dùng nên chưa biết chất lượng"
Bông Tẩy Trang 3 Lớp Mềm Mịn Dai BEAUTY P0061,[None],[500000000],5,"đóng gói cẩn thận,  giao hàng khá nhanh, bông tẩy trang mỏng mền, chất lượng OK"
Bông Tẩy Trang 3 Lớp Mềm Mịn Dai BEAUTY P0061,[None],[500000000],5,Nsnanndnndnakmsmcnfmmsmmsmsmncnxjjsjsndnnsmdmmdmkdkxkcjcjshsjjdjjdjdjbahahhcnc
Bông Tẩy Trang 3 Lớp Mềm Mịn Dai BEAUTY P0061,[None],[500000000],5,"hàng giống hình shop chụp, ngại chụp nên lấy tạm ảnh và video khác ạ"
Bông Tẩy Trang 3 Lớp Mềm Mịn Dai BEAUTY P0061,[None],[500000000],5,Quả sale 8k của mình. Nhận mà thích quá trời luôn nè. K uổng công thức săn
Bông Tẩy Trang 3 Lớp Mềm Mịn Dai BEAUTY P0061,[None],[500000000],5,"Mình đang sài lọ màu xanh , cực kì sạch , không khô da , sau khi rửa giúp lcl thoáng dễ lột mụn cám mụn đầu đen ak bnmdjdjdncncn"
Bông Tẩy Trang 3 Lớp Mềm Mịn Dai BEAUTY P0061,[None],[2900000000],5,Sản phẩm tốt bông mềm dễ thấm hút nhưng hỏi mỏng độ dai k tốt lắm nên dễ rách nhưng với giá thành vậy vẫn xứng đáng 5 sao 
Bông Tẩy Trang 3 Lớp Mềm Mịn Dai BEAUTY P0061,[None],[900000000],5,Chưa dùng nên chưa rõ chất lượng. Vẫn đánh giá cho shop 5 sao nhé
