name,variations,price,rating_star,comment
Bông Tẩy Trang 3 Lớp Mềm Mịn Dai BEAUTY P0061,[''],[2500000000],5,"Mua lại lần 2 hàng vẫn xinh xịn hihi

(TB) XUÂN QUA HÈ SANG - NGÀY VÀNG RỰC RỠ! VinaPhone tặng Quý khách ưu đãi 20% giá trị thẻ nạp trong HÔM NAY - 07/05/2021. Giá trị KM gọi/nhắn tin các mạng trong 15 ngày. Mời QK trải nghiệm KHO GIẢI TRÍ KHÔNG GIỚI HẠN tại ứng dụng DIGILIFE của VinaPhone (https://"
Bông Tẩy Trang 3 Lớp Mềm Mịn Dai BEAUTY P0061,[''],[2500000000],5,"Có ai nhìn thấy ai đâu, trong những lúc quạnh hiu nhất mình chỉ còn cho mình khoảng không hun hút trước mặt mà soi cho cùng khắp những hư ảo của đời mình. Ôi những tình cờ nào đã cho người này gặp người kia, những khuôn mặt đã đến tình cờ rồi mất đi tình cờ."
Bông Tẩy Trang 3 Lớp Mềm Mịn Dai BEAUTY P0061,[''],[2500000000],5,"Giao hàng nhanh ạ, shop tư vấn nhiệt tình! Hàng ok lắm ạ, mọi người muốn mua thì đừng phân vân nhé, hình ảnh chỉ mang tính chất nhận xu thôi ạ. Chúc mọi người 1 ngày tốt lành"
Bông Tẩy Trang 3 Lớp Mềm Mịn Dai BEAUTY P0061,[''],[2500000000],5,Đóng gói bằng giấy nâu rất thân thiện môi trường. Với những sp như bông tẩy trang đóng gói như vậy  cũng ok.
Bông Tẩy Trang 3 Lớp Mềm Mịn Dai BEAUTY P0061,[''],[2500000000],5,"Đã dùng nhiều lần loại này rồi, dai, không xơ, và tiết kiệm, lau nhẹ nhàng thui ko rát da"
Bông Tẩy Trang 3 Lớp Mềm Mịn Dai BEAUTY P0061,[''],[2500000000],5,"Này là mua về xong cho mẹ sài thử, mẹ thấy ưng nên mua thêm cho mẹ 2 bịch, ý kiến giống như đánh giá bên dưới."
Bông Tẩy Trang 3 Lớp Mềm Mịn Dai BEAUTY P0061,[''],[2500000000],5,tốt ạ shop đóng gói rất là xinh xẻo luônnnn 😘 lần sau sẽ ủng hộ shop tiếp ạ xin lỗi vì hình ành kh liên quan 🥺
Bông Tẩy Trang 3 Lớp Mềm Mịn Dai BEAUTY P0061,[''],[2500000000],5,"So với bịch màu vàng thì mình thích bông của bịch xanh này hơn, không bị rát, mềm hơn, không bị tơi bông. "
Bông Tẩy Trang 3 Lớp Mềm Mịn Dai BEAUTY P0061,[''],[2500000000],5,"Shop giao hàng ok, rẻ hơn chỗ khác nhiều 
Lần sau sẽ ủng hộ shop tiếp nhaa"
Bông Tẩy Trang 3 Lớp Mềm Mịn Dai BEAUTY P0061,[''],[2500000000],5,"Giao hàng nhanh, nhưng mà đóng gói chưa ổn lắm, dễ bị bẹp bông, shop có thể lưu ý, túi bông nhìn bề ngoài khá sạch sẽ, chưa dùng nên chưa rõ chất lượng, tạm thời cho 5 sao"
Bông Tẩy Trang 3 Lớp Mềm Mịn Dai BEAUTY P0061,[''],[2500000000],5," Đã mua lần 2, sản phẩm đóng gói chắc chắn,..................."
Bông Tẩy Trang 3 Lớp Mềm Mịn Dai BEAUTY P0061,[''],[2500000000],5,"Mua lần thứ 2. Bông không quá mỏng, dùng ổn. 
~~~~~~~~~~~~~~~"
Bông Tẩy Trang 3 Lớp Mềm Mịn Dai BEAUTY P0061,[''],[2500000000],5,"chất lượng sản phẩm tốt 
giá rẻ nhưng sài rất oke
nên mua nha mọi người 
giao hàng cũng khá nhanh
nói chung là ưng
sẽ ủng hộ sớm nữa "
Bông Tẩy Trang 3 Lớp Mềm Mịn Dai BEAUTY P0061,[''],[2500000000],5,"Hàng oke
Fuhfxdhkhdyljđoydfkbff"
Bông Tẩy Trang 3 Lớp Mềm Mịn Dai BEAUTY P0061,[''],[2500000000],5,"Hình ảnh mang tc nhận xu 
Jabcknsbcjksnbcksnnxksnhajdjjsbdjsj"
Bông Tẩy Trang 3 Lớp Mềm Mịn Dai BEAUTY P0061,[''],[2500000000],5,"săn dc mã 50k nên mua 2 em này mình chỉ mất 5k5 tiền ship, nhận về ưng quá trời"
Bông Tẩy Trang 3 Lớp Mềm Mịn Dai BEAUTY P0061,[''],[2500000000],5,Lần nào cũng mua của shop😀 cứ sd loại này mãi vì ngon bổ rẻ hahaaaaa
Bông Tẩy Trang 3 Lớp Mềm Mịn Dai BEAUTY P0061,[''],[2500000000],5,"Bông dày dặn okeeeee
Không bị rách khi chà xát mạnh
Bông hai mặt "
Bông Tẩy Trang 3 Lớp Mềm Mịn Dai BEAUTY P0061,[''],[2500000000],5,"Giao hàng nhanh đóng gói cẩn thận. 
Sjsjsnnxjxkxjsksksxxxx"
Bông Tẩy Trang 3 Lớp Mềm Mịn Dai BEAUTY P0061,[''],[2500000000],5,Dùng thì thấy cũng ổn đá g mua    ..  cdgbbbvvvvvvvvvvvvvvvvvbbbbbbbb
Bông Tẩy Trang 3 Lớp Mềm Mịn Dai BEAUTY P0061,[''],[2500000000],5,Hàng giao nhanh shipper nhiệt tình bông okla dập kĩ k dính bông lên mặt nên mua nha m.n
Bông Tẩy Trang 3 Lớp Mềm Mịn Dai BEAUTY P0061,[''],[2500000000],5,"Sản phẩm ok, bên giao hơi lâu xíu 😂 Bạn nào nghiện mua onl tải Casbag về đc hoàn tiền mọi đơn hàng, nhập mã CZ5885M đc nhận ngay 10k vào tài khoản. Có thể rút hoặc đổi thẻ tùy ý 🙈

"
Bông Tẩy Trang 3 Lớp Mềm Mịn Dai BEAUTY P0061,[''],[2500000000],5,Tuy nhận hàng được hơi xí nhưng mà hàng ổn Đóng gói rất cẩn thận. Sẽ tiếp tục ủng hộ. 
Bông Tẩy Trang 3 Lớp Mềm Mịn Dai BEAUTY P0061,[''],[2500000000],5,"Shop quá cute hàng ship bthg mà shop sợ lâu nên đã ib 
Hàng đầy đủ
Quá chất lượng
Ship nhanh 
Sau sẽ ql ủ/h shop ❤️❤️❤️"
Bông Tẩy Trang 3 Lớp Mềm Mịn Dai BEAUTY P0061,[''],[2500000000],5,O g g h hxtzftjfudududifjcjstqhfiglcjdfufufhdhxhxjxjcuc
Bông Tẩy Trang 3 Lớp Mềm Mịn Dai BEAUTY P0061,[''],[2500000000],5,"Chất lượng tốt
Giá rẻ 
Shop đóng gói kĩ, giao hàng nhanh
Sẽ tiếp tục ủng hộ"
Bông Tẩy Trang 3 Lớp Mềm Mịn Dai BEAUTY P0061,[''],[2500000000],5,"Bông tẩy trang dùng rất thích, mềm, giá lại quá rẻ, lại nhiều nữa. Sẽ ủng hộ shop thêm"
Bông Tẩy Trang 3 Lớp Mềm Mịn Dai BEAUTY P0061,[''],[2500000000],5,Bông mềm khá dày dùng ưng lắm nên mua nha mọi người lần sau sẽ mua tiếp 
Bông Tẩy Trang 3 Lớp Mềm Mịn Dai BEAUTY P0061,[''],[2500000000],5,Đongs gói cẩu thả :(( bông khá dày sẽ trải nghiệm thêm :)))))))))))))))))
Bông Tẩy Trang 3 Lớp Mềm Mịn Dai BEAUTY P0061,[''],[2500000000],5,gshaajajjznnsjsnznsnjs zjsjsnnzn hẽnhdndnxjdjenjxnejb bdjejbxbxehndnxnxndndjdjjdjssjjdjxhxbxbxxhydbdhxbehhxhdhdhbxhdbdhhxbhhdbxhxhxbxdbbdbdhdhdhdhdhd
Bông Tẩy Trang 3 Lớp Mềm Mịn Dai BEAUTY P0061,[''],[2500000000],1,"Thất vọng, hàng mỏng ko tưởng, chất lượng kém, mà lỡ mua 2 bịch."
Bông Tẩy Trang 3 Lớp Mềm Mịn Dai BEAUTY P0061,[''],[2500000000],5,
Bông Tẩy Trang 3 Lớp Mềm Mịn Dai BEAUTY P0061,[''],[2500000000],5,"Bông dùng thích, okelaaaa nhaaâ
Nên mua ạ, rẻ nữa.........."
Bông Tẩy Trang 3 Lớp Mềm Mịn Dai BEAUTY P0061,[''],[2500000000],5,
Bông Tẩy Trang 3 Lớp Mềm Mịn Dai BEAUTY P0061,[''],[2500000000],5,"Hàng giao nhanh,  đóng gói cẩn thận, mình mua về cũng chưa mở ra thử nhưng bt đã dùng loại này ổn nên ko nghi ngại gì "
Bông Tẩy Trang 3 Lớp Mềm Mịn Dai BEAUTY P0061,[''],[2500000000],5,"Bông lần này dùng bị bở, rách , dính xơ bông. Nói chung chất lượng tệ, kém hẳn mấy lần trước"
Bông Tẩy Trang 3 Lớp Mềm Mịn Dai BEAUTY P0061,[''],[2500000000],5,Bịch hơi to so với túi nhé cần phải khắc phục đi thôi shop ak hihi
Bông Tẩy Trang 3 Lớp Mềm Mịn Dai BEAUTY P0061,[''],[2500000000],5,ahhshshs shsusjjajsns sbhsjs shaja shsjsjs sjajsnd djajsnd. djsbs d jsnsnxbdbdjjsjansbbs
Bông Tẩy Trang 3 Lớp Mềm Mịn Dai BEAUTY P0061,[''],[2500000000],5,"💯NGUỒN GỐC SẢN PHẨM HÀNG CỦA BUYGREE 💯
✅100% Hàng USA . 
✅Phát Hiện Hàng Giả Hoàn Trả 200% .
✅Buygreen phân phối chính hàng của hãng , Không như NHỮNG SHOP trôi nôi hiện tại khác mua tại siêu thị wall mart , amazon ... . Bên BUYGREEN NHẬP KHẨU TRỰC TIẾP TỪ HÃNG . ( HÀNG CHÍNH HÃNG ) .
✅ Nhập hàng "
Bông Tẩy Trang 3 Lớp Mềm Mịn Dai BEAUTY P0061,[''],[2500000000],5,"Bông mềm, mịn, khá dai
Gói 200 miếng với giá và chất lượng như này quá là okela lun ạ"
Bông Tẩy Trang 3 Lớp Mềm Mịn Dai BEAUTY P0061,[''],[2500000000],5,"Thích lắm, mua mấy lần r vẫn thích"
Bông Tẩy Trang 3 Lớp Mềm Mịn Dai BEAUTY P0061,[''],[2500000000],5,Vznanxbslpwnc dkdkwobd xkzkzbxjslwkqh sbozosns dnxbx dkd x. Skzkmzksks
Bông Tẩy Trang 3 Lớp Mềm Mịn Dai BEAUTY P0061,[''],[2500000000],5,"Mua của shop nhiều lần rồi, lần nào cucng ok có điều giao hàng hơi lâu, bông không quá mềm không bị xơ bông. Lần nào cũng mua 6-7 bịch để xài dần"
Bông Tẩy Trang 3 Lớp Mềm Mịn Dai BEAUTY P0061,[''],[2500000000],5,Bông siêu nhiều giá rẻ nên không đòi hỏi nhiều về chất lượng giao hàng nhanh
Bông Tẩy Trang 3 Lớp Mềm Mịn Dai BEAUTY P0061,[''],[2500000000],5,Giao hàng siêu nhanh luôn bông dùng ổn so với giá hơi mỏng với thấm hút k tốt lắm
Bông Tẩy Trang 3 Lớp Mềm Mịn Dai BEAUTY P0061,[''],[2500000000],5,"Khoác lên mình những bộ suit sặc sỡ, BTS khoe giọng hát live xuất sắc và vũ đạo điêu luyện, đẹp mắt. Đặc biệt, người hâm mộ còn choáng ngợp với những hình ảnh thành phố Seoul về đêm được quay từ trên cao trong phần trình diễn tuyệt vời của BTS. Màn trình diễn của BTS tại Grammy 2021 khiến người hâm "
Bông Tẩy Trang 3 Lớp Mềm Mịn Dai BEAUTY P0061,[''],[2500000000],5,Sản phẩm dùng okk giá tốt giao hàng nhanh. Cảm ơn shop nhiều nhaaaa
Bông Tẩy Trang 3 Lớp Mềm Mịn Dai BEAUTY P0061,[''],[2500000000],5,"Giao hàng nhanh , bông dùng tạm ổn với giá tiền 💰💚💚💚1️⃣1️⃣💚💚💚"
Bông Tẩy Trang 3 Lớp Mềm Mịn Dai BEAUTY P0061,[''],[2500000000],5,"Mềm đúng như cái tên, độ dai trung bình, với giá này thì quá là ok"
Bông Tẩy Trang 3 Lớp Mềm Mịn Dai BEAUTY P0061,[''],[2500000000],5,"Chất lương tốt, giao hàng nhanh, sẽ ủng hộ shop vào lần sau..."
Bông Tẩy Trang 3 Lớp Mềm Mịn Dai BEAUTY P0061,[''],[2500000000],5,"Vẫn bị xơ, tước bông khi dùng. Ko bằng đc bông của túi vàng trắng kia. Ncl mình thấy vẫn ưng nhất, dùng đc nhất từ trc đến nay là bông ở túi vàng trắng rẻ nhất á "
Bông Tẩy Trang 3 Lớp Mềm Mịn Dai BEAUTY P0061,[''],[2500000000],5,"Hàng đầy đủ sp ok lắm nha
Hình ảnh và video chỉ mang tính chất nhận xu"
Bông Tẩy Trang 3 Lớp Mềm Mịn Dai BEAUTY P0061,[''],[2500000000],5,"Btt dùng thích, mềm, thấm nhanh bao bì đẹp. 
Kẹp trong ảnh là 5 răng nhưng shop giao mình có 3 răng =(( "
Bông Tẩy Trang 3 Lớp Mềm Mịn Dai BEAUTY P0061,[''],[2500000000],5,Okkkkkkkkkkkkkkkkkkkkkkkkkkkkkkkkkkkkkkkkkkkkkkkkkk
Bông Tẩy Trang 3 Lớp Mềm Mịn Dai BEAUTY P0061,[''],[2500000000],5,Giao hàng nhanh bông k giày lắm nhưng tạm ổn số lượng khá nhiều với tầm giá là hợp lý mn có thể tham khảo ạ
Bông Tẩy Trang 3 Lớp Mềm Mịn Dai BEAUTY P0061,[''],[2500000000],5,"Mua lần 2 tại shop , chất lượng ok tắm lâu vlllll 😭😫🤦🏻‍♀️😫😕😂😃😕🐛😠🐛😃😕😃😑😑🤢😑🤢🌝🌝😑😑🌝😑🌝😑😑😑😑🌝🌝🌝🐛🌝🤢🐛🤢🤢🐛🐛🤢🤢🌝🐛🐛🐛🐛🌝"
Bông Tẩy Trang 3 Lớp Mềm Mịn Dai BEAUTY P0061,[''],[2500000000],5,"giao hàng đúng dự kiến, giao đủ, nói chung là mua nhiều rồi khá là ưng ý!"
Bông Tẩy Trang 3 Lớp Mềm Mịn Dai BEAUTY P0061,[''],[2500000000],5,Bông tẩy trang và mặt nạ mắt nhìn chung khá ok..Riêng chai xịt thơm miệng thì mùi nhẹ mình không thấy nổi bật cho lắm...Hàng chất lượng tốt.đóng gói đep
Bông Tẩy Trang 3 Lớp Mềm Mịn Dai BEAUTY P0061,[''],[2500000000],5,"Giao hàng nhanh, đầy đủ"
Bông Tẩy Trang 3 Lớp Mềm Mịn Dai BEAUTY P0061,[''],[2500000000],5,"Giao hàng nhanh, cẩn thận. Sản phẩm đúng hình. Bông mềm nhưng mỏng"
Bông Tẩy Trang 3 Lớp Mềm Mịn Dai BEAUTY P0061,[''],[2500000000],5,Hàng tốt lắmmm
Bông Tẩy Trang 3 Lớp Mềm Mịn Dai BEAUTY P0061,[''],[2500000000],5,"Giao hàng khá nhanh,sản phẩm dùng tạm ổn"
Bông Tẩy Trang 3 Lớp Mềm Mịn Dai BEAUTY P0061,[''],[2500000000],5,"Giao hàng nhanh , bông dày và mềm mịn lau không bị xước hay đau rát da , dễ chịu , nên mua sử dụng thử nha"
Bông Tẩy Trang 3 Lớp Mềm Mịn Dai BEAUTY P0061,[''],[2500000000],5,Giao nhầm hàng nhưng giá same same nhau nên thôi k báo shop đổi. Dùng thích và mềm hơn cái bông có hình tai mèo đen là gì quên tên rồi
Bông Tẩy Trang 3 Lớp Mềm Mịn Dai BEAUTY P0061,[''],[2500000000],5,"Bông tẩy trang không quá dày cũng không quá mỏng, sờ mịn tay dùng rất ok ạaaa"
Bông Tẩy Trang 3 Lớp Mềm Mịn Dai BEAUTY P0061,[''],[2500000000],5,"Giao hàng nhanh, sẽ ủng hộ thêm. Mình lười chụp ảnh nên lấy tạm ảnh ltinh "
Bông Tẩy Trang 3 Lớp Mềm Mịn Dai BEAUTY P0061,[''],[2500000000],5,"E muốn hỏi mng nên sài sp  trị thâm mụn nào tốt ạ. Trc e có tự nặn nên để lại nhiều thâm, thời gian sau e có đi spa lấy nhân mụn ra thì đỡ chút. Cho e xin tip trị thâm mụn và làm da trắng lên chút với ạ 😢"
Bông Tẩy Trang 3 Lớp Mềm Mịn Dai BEAUTY P0061,[''],[2500000000],5,Háhhxhdiejdbeirbckfbcidbxiebsifbrkfbekfjriejfotnrofnrkfofnfovmck
Bông Tẩy Trang 3 Lớp Mềm Mịn Dai BEAUTY P0061,[''],[2500000000],5,"Bông tẩy trang giá rẻ, chất lượng tốt. 
Chỉ có 1 điểm không hài lòng là mình đặt hộp đựng bàn chải shop lại gửi bàn chải cho mình. "
Bông Tẩy Trang 3 Lớp Mềm Mịn Dai BEAUTY P0061,[''],[2500000000],5,"Shop giao hàng nhanh. Từ lúc dùng bông này là mình theo luôn, mềm mịn dai. Shop còn 4 gói đặt lẹ dùng dần"
Bông Tẩy Trang 3 Lớp Mềm Mịn Dai BEAUTY P0061,[''],[2500000000],5,"Hàng đóng gói chắc chắn, giao nhanh và bông thì ko bị xơ. Lại còn rẻ nữa"
Bông Tẩy Trang 3 Lớp Mềm Mịn Dai BEAUTY P0061,[''],[2500000000],5,"Bông tẩy trang xài rất thích, đã mua nhiều lần rồi? nên mua nhé mọi người"
Bông Tẩy Trang 3 Lớp Mềm Mịn Dai BEAUTY P0061,[''],[2500000000],5,"Đcm câu chuyện của bạn mình. 

Bạn mình quẹt tinder quen được thằng sinh viên năm nhất, năm 2 gì đấy. Cả 2 thống nhất với nhau là chỉ là bạn phịch, còn sau đó vui thì tiếp, mà không vui thì thôi. 

Nói chung mình cũng không muốn đánh giá gì chuyện này, cuộc sống của ai người ấy chọn. Nên mọi người đ"
Bông Tẩy Trang 3 Lớp Mềm Mịn Dai BEAUTY P0061,[''],[2500000000],5,"Bông ổn dùng okelala lắm nhaaaaa 
Cũng nên dùng ạ 
Ab cdefgbxjex"
Bông Tẩy Trang 3 Lớp Mềm Mịn Dai BEAUTY P0061,[''],[2500000000],5,San pham rat oke.ahsuududidjdjdjdjdkdkdickcjcjcjfjfjfkfkfkkfjfjfjfjfjfjcjcjkcjcmkckcnncncncnc
Bông Tẩy Trang 3 Lớp Mềm Mịn Dai BEAUTY P0061,[''],[2500000000],5,"Mấy lần mua bông tẩy trang của shop rồi, trước dùng loại khác, nay dùng thử loại này xem sao"
Bông Tẩy Trang 3 Lớp Mềm Mịn Dai BEAUTY P0061,[''],[2500000000],5,"Chất lượng ổn, phù hợp giá tiền, đóng gói cẩn thận, giao hàng nhanh"
Bông Tẩy Trang 3 Lớp Mềm Mịn Dai BEAUTY P0061,[''],[2500000000],5,"2 bịch laneila chất bông khá mỏng, thích hợp dùng để lau toner, đỡ tốn sản phẩm
Bịch xanh chất bông khá dày dùng khá êm
Cả 3 đều ok không bị tơi bông, lau thỉnh thoảng hơi rát mặt xíu nhưng không sao"
Bông Tẩy Trang 3 Lớp Mềm Mịn Dai BEAUTY P0061,[''],[2500000000],5,"Tạmmmmmmmm ổnnnnnnnnnn , nói chung là phù hợp vs giá tiềnnnnnnn"
Bông Tẩy Trang 3 Lớp Mềm Mịn Dai BEAUTY P0061,[''],[2500000000],5,"Bông mềm mịn, không bị dày quá,........................   ."
Bông Tẩy Trang 3 Lớp Mềm Mịn Dai BEAUTY P0061,[''],[2500000000],5,"Mua nhiều lần rồi okkk lắmmm!
Mà sao em lại nói là nó không biết có đi hc về nhà rồi rồi á em yyyuuu"
Bông Tẩy Trang 3 Lớp Mềm Mịn Dai BEAUTY P0061,[''],[2500000000],5,Goddddd. Shop giao hàng nhanhhhh. Sản phẩm tốt...........  
Bông Tẩy Trang 3 Lớp Mềm Mịn Dai BEAUTY P0061,[''],[2500000000],5,Mình hay kéo dãn bông ra cho mềm và mỏng. Bông lần này mua k kéo dãn đc như lần trc
Bông Tẩy Trang 3 Lớp Mềm Mịn Dai BEAUTY P0061,[''],[2500000000],5,"Bông tẩy trang y như hình, giá oke, thấm nước oke dùng k bị xơ bông ra "
Bông Tẩy Trang 3 Lớp Mềm Mịn Dai BEAUTY P0061,[''],[2500000000],5,shop giao thiếu nhưng đã giải quyết ổn thoả rồi ưkfjajjfjsfne
Bông Tẩy Trang 3 Lớp Mềm Mịn Dai BEAUTY P0061,[''],[2500000000],5,"Dùng rất thích nhé, nếu có tiền sẽ mua tiếp nha. Hình ảnh chỉ mang tính chất minh họa lấy xu."
Bông Tẩy Trang 3 Lớp Mềm Mịn Dai BEAUTY P0061,[''],[2500000000],5,sản phẩm tuyệt vời chất lượng tốt giá thành rẻ njjhggjjgfhhggf
Bông Tẩy Trang 3 Lớp Mềm Mịn Dai BEAUTY P0061,[''],[2500000000],5,Sản phẩm OK nha mk rất thích. Bdjsksnsbbsvdndmdnd xmslslsbdbdmslsls
Bông Tẩy Trang 3 Lớp Mềm Mịn Dai BEAUTY P0061,[''],[2500000000],3,Bông hơi mỏng. Nhưng cũng khá dai. Khá ổn để đắt mặt nạ. 1 túi khá nhiều
Bông Tẩy Trang 3 Lớp Mềm Mịn Dai BEAUTY P0061,[''],[2500000000],5,
Bông Tẩy Trang 3 Lớp Mềm Mịn Dai BEAUTY P0061,[''],[2500000000],5,
Bông Tẩy Trang 3 Lớp Mềm Mịn Dai BEAUTY P0061,[''],[2500000000],5,"Hàng đủ. 
Ship 5 ngày. 
Để dùng thử mới biết được. 
Bọc hàng sơ sài túi giấy bình thường. "
Bông Tẩy Trang 3 Lớp Mềm Mịn Dai BEAUTY P0061,[''],[2500000000],5,
Bông Tẩy Trang 3 Lớp Mềm Mịn Dai BEAUTY P0061,[''],[2500000000],5,"đã nhận hàng và đang dùng rồi, mua ở đây mấy lần nên yên tâm lắm."
Bông Tẩy Trang 3 Lớp Mềm Mịn Dai BEAUTY P0061,[''],[2500000000],5,Chất bông mỏng xài toner acid hông bị hao nhưng mà cái mép dập k tốt lắm nhưng đk cái k xơ
Bông Tẩy Trang 3 Lớp Mềm Mịn Dai BEAUTY P0061,[''],[2500000000],5,Giao hàng nhanh. Đầy đủ sản phẩm. Hàng giá rẻ và chất lượng tạm ổn. Sinh viên thì dùng như này là tiết kiệm rồi ạ.
Bông Tẩy Trang 3 Lớp Mềm Mịn Dai BEAUTY P0061,[''],[2500000000],5,"Chất lượng sản phẩm tốt 
Đóng gói sản phẩm rất đẹp và chắc chắn 
Giao hàng nhanh "
Bông Tẩy Trang 3 Lớp Mềm Mịn Dai BEAUTY P0061,[''],[2500000000],5,"mình đặt hai túi thì có một túi bị hỏng zip. bông dai, thấm nước oke, dùng khá thíchhh"
Bông Tẩy Trang 3 Lớp Mềm Mịn Dai BEAUTY P0061,[''],[2500000000],4,"Sản phẩm 3 lớp cx ok 
Sài thử thì cx đk
Nếu dùng hết sẽ mua tiếp
Hình ảnh và video k liên quan lắm
"
Bông Tẩy Trang 3 Lớp Mềm Mịn Dai BEAUTY P0061,[''],[2500000000],5,"Chất lượng sản phẩm okkk , đặt hàng 1 ngày là đã có rồi nhanh lắmmm 🔨🧨🔮🔧⚙️⚗️⚙️🔧🔬🧿🔭⚙️⚗️⚙️🔬🔮⚙️⚙️⚗️⚙️"
Bông Tẩy Trang 3 Lớp Mềm Mịn Dai BEAUTY P0061,[''],[2500000000],5,"Giao hàng nhanh , bông mịn , shop đóng gói kĩ , chất lượng sản phẩm tốt , sẽ mua lại ủng hộ "
Bông Tẩy Trang 3 Lớp Mềm Mịn Dai BEAUTY P0061,[''],[2500000000],5,Gương hơi lỏng. Mọi sản phẩm đều ổn so với giá tiền...........
Bông Tẩy Trang 3 Lớp Mềm Mịn Dai BEAUTY P0061,[''],[2500000000],5,"Dùng ổn, shop trả lời tin nhắn nhanh. Giao hàng cũng rất nhanh. Đáng mua nha mn"
Bông Tẩy Trang 3 Lớp Mềm Mịn Dai BEAUTY P0061,[''],[2500000000],5,"Sản phẩm của shop rất tốt đã mua bông tẩy trang của shop 2 lần và xài cũng rất ổn, giá tiền thì lại quá rẻ sẽ tiếp tục ủng hộ shop trong thời gian tới"
Bông Tẩy Trang 3 Lớp Mềm Mịn Dai BEAUTY P0061,[''],[2500000000],5,"Bông dày vừa phải , mềm mịn cũng tạm ổn ship nhanh cảm ơn shop nhiều nha"
Bông Tẩy Trang 3 Lớp Mềm Mịn Dai BEAUTY P0061,[''],[2500000000],5,"Sản phẩm chất lượng tốt
Dùng khá thích mà lại tiết kiệm
Hhhhhihihi"
Bông Tẩy Trang 3 Lớp Mềm Mịn Dai BEAUTY P0061,[''],[2500000000],5,"Shop giao hàng đầy đủ, đóng hàng cẩn thận 👍
Bông tẩy trang nhìn đẹp xài ổn 🤗
Chúc shop mua may bán đắt 😍🤗👍"
Bông Tẩy Trang 3 Lớp Mềm Mịn Dai BEAUTY P0061,[''],[2500000000],5,"[QC] Gọi nội mạng chỉ 100đ/phút: Với 5.000đ, có 50 phút gọi nội mạng đến 24h ngày đăng ký. Tham gia, soạn MP5X gửi 109. Chi tiết LH 198 (0đ). Từ chối QC, soạn TC2 gui 199."
Bông Tẩy Trang 3 Lớp Mềm Mịn Dai BEAUTY P0061,[''],[2500000000],5,"Đã mua nhiều lần và thử 4-5 loại nhưng đây là loại mình thích nhất. Bông mềm mà dai. Shop vẫn gửi đúng hàng, đủ hàng, nhanh gọn lẹ. (Chiếc ảnh không liên quan lắm nhưng để thể hiện mình rất hài lòng ạ.)"
Bông Tẩy Trang 3 Lớp Mềm Mịn Dai BEAUTY P0061,[''],[2500000000],5,"Dùng tạm được, mềm mịn có nhưng tương đối thôi, mình đã hy vọng mịn hơn thế
Ko bị xơ"
Bông Tẩy Trang 3 Lớp Mềm Mịn Dai BEAUTY P0061,[''],[2500000000],5,"Giao hàng nhanh bọc gói cẩn thận, bông dùng mềm giá hạt dẻ. Dễ thươnggg"
Bông Tẩy Trang 3 Lớp Mềm Mịn Dai BEAUTY P0061,[''],[2500000000],5,Shop góiiiii hàngggg cẩnnnn thânnjnnnn giao hàngggg nhânhhhhhh
Bông Tẩy Trang 3 Lớp Mềm Mịn Dai BEAUTY P0061,[''],[2500000000],5,"Được khuyến mãi với ráng đủ để áp mã vận chyển nên mua cả lô, chưa dùng đến chưa biết chất lượng thế nào, "
Bông Tẩy Trang 3 Lớp Mềm Mịn Dai BEAUTY P0061,[''],[2500000000],5,Chưa dùng nên chưa biết ạ. Chắc là okie nèeeeeeeeeeeeeeeeeee
Bông Tẩy Trang 3 Lớp Mềm Mịn Dai BEAUTY P0061,[''],[2400000000],5,"Bông tẩy trang dùng ổn ạ, k dày nhưg k quá mỏng. Shop giao hàng nhanh"
Bông Tẩy Trang 3 Lớp Mềm Mịn Dai BEAUTY P0061,[''],[2500000000],5,Sản phẩm xinh. Bọc hàng cẩn thận. Đủ số lượng. Sẽ ủng hộ thêm..
Bông Tẩy Trang 3 Lớp Mềm Mịn Dai BEAUTY P0061,[''],[2400000000],5,"Thời gian giao hàng nhanhhh
Đóng gói hàng bằng giấy nên mình rất thíchh"
Bông Tẩy Trang 3 Lớp Mềm Mịn Dai BEAUTY P0061,[''],[2500000000],5,Bông dùng thích lắm nha. K bị rã bông nhiều . Giá lại rẻ nữaaaaa
Bông Tẩy Trang 3 Lớp Mềm Mịn Dai BEAUTY P0061,[''],[2500000000],5, shop giao hàng khá nhanh và đóng gói sản phẩm rất cẩn thận....
Bông Tẩy Trang 3 Lớp Mềm Mịn Dai BEAUTY P0061,[''],[2500000000],5,"Đã nhận được hàng, trông khá xinh đẹp. Chưa sử dụng nên ko rõ chất lượng như nào"
Bông Tẩy Trang 3 Lớp Mềm Mịn Dai BEAUTY P0061,[''],[2500000000],5,"Giao nhanh, mua 1 lần rồi và thấy dùng ô kê. Sẽ ủng hộ shop ạ. Mặt nạ chưa dùng nên k rõ ra saoooo ạ ...."
Bông Tẩy Trang 3 Lớp Mềm Mịn Dai BEAUTY P0061,[''],[2500000000],5,"Bông tẩy trang mỏng, mỗi lần sd phải trên 2 miếng. Giá rẻ, giống hàng nội địa Trung. Vẫn cho 5* vì chất lượng và đóng gói. 
Giao hàng lâu hơn dự kiến 2 ngày!! "
Bông Tẩy Trang 3 Lớp Mềm Mịn Dai BEAUTY P0061,[''],[2500000000],5,"Mua không biết bao nhiêu gói luôn rồi ý, siêu ưngggggggggggg"
Bông Tẩy Trang 3 Lớp Mềm Mịn Dai BEAUTY P0061,[''],[2500000000],5,"Mua lần 2 ạ, ưu điểm là rẻ, bông tẩy trangggggg ổnnnnnnnn,,,,,,,,, "
Bông Tẩy Trang 3 Lớp Mềm Mịn Dai BEAUTY P0061,[''],[2500000000],5,Xài bịch thứ n rổi bông mềm k bị tua tua nên khá ổn sẽ mua lạiiiii chứ
Bông Tẩy Trang 3 Lớp Mềm Mịn Dai BEAUTY P0061,[''],[2500000000],5,Sản phẩm ok lắm nhéeeeeeeeeeeeeeeeeeeeeeeeeeeeeeeeeeee
Bông Tẩy Trang 3 Lớp Mềm Mịn Dai BEAUTY P0061,[''],[2500000000],5,"Bông dùng mềm rất thích, k cứng như bông khác, trung thành vs e này"
Bông Tẩy Trang 3 Lớp Mềm Mịn Dai BEAUTY P0061,[''],[2500000000],5,"Khăn lau thấm nước tốt, mua về lau bếp :D
Bông tẩy trang đã mua tới lần thứ 3 nên không cần nói nhiều."
Bông Tẩy Trang 3 Lớp Mềm Mịn Dai BEAUTY P0061,[''],[2500000000],5,shop giao hàng đủ. Dùng loại màu xanh rồi rất thích nên giờ mua thêm loại màu vàng xài thử xem sao
Bông Tẩy Trang 3 Lớp Mềm Mịn Dai BEAUTY P0061,[''],[2500000000],5,"Bông mềm mịn, dùgng khá ok với những da nhạy cảm như mình. Giá cũng hợp lí, mua 2 gói nên đc freeship.  Xem nhiều shop, thấy shop này bông ok nhất, mn có nhu cầu thì nên mua"
Bông Tẩy Trang 3 Lớp Mềm Mịn Dai BEAUTY P0061,[''],[2500000000],5,"Giao hàng nhanh, gói hàng cẩn thận, bông tẩy trang ngon, bổ,rẻ ^°^"
Bông Tẩy Trang 3 Lớp Mềm Mịn Dai BEAUTY P0061,[''],[2500000000],5,"Giao hàng nhanh, bọc gói cẩn thận. Chưa dùng mong là mềm thích. Cảm ơn shop nha"
