name,variations,price,rating_star,comment
Mแบทt nแบก ๐FREESHIP๐ Mแบทt nแบก 3D Foodaholic Hรn Quแปc bรกn lแบป 1 miแบฟng,"['Lรด Hแปi ', 'Collagen ']","[500000000, 500000000]",5,"Shop phแปฅc vแปฅ แปn, mawtk nแบก chฦฐa sแปญ dแปฅng. Khรดng biแบฟt hiแปu quแบฃ ra sao, dรนng rแปi sแบฝ quay lแบกi ฤรกnh giรก "
Mแบทt nแบก ๐FREESHIP๐ Mแบทt nแบก 3D Foodaholic Hรn Quแปc bรกn lแบป 1 miแบฟng,['Collagen '],[500000000],5,Khong co hinh anh nhung hรng rat tot ship nhanh ! Se ung hแป dรi dรi
Mแบทt nแบก ๐FREESHIP๐ Mแบทt nแบก 3D Foodaholic Hรn Quแปc bรกn lแบป 1 miแบฟng,"['Sรขm ', 'Collagen ', 'Trร Xanh ']","[500000000, 500000000, 500000000]",5,"Sแบฃn phแบฉm nhฦฐ hรฌnh,chแบฅt lฦฐแปฃng oke,hรฌnh แบฃnh khรดng liรชn quan lแบฏm chแป mang tรญnh chแบฅt nhแบญn xu๐๐๐"
Mแบทt nแบก ๐FREESHIP๐ Mแบทt nแบก 3D Foodaholic Hรn Quแปc bรกn lแบป 1 miแบฟng,['Trร Xanh '],[450000000],5,"khรดng nghฤฉ sau 6/6mร ship nhanh vแบญy luรดn hรดm trฦฐแปc ฤแบทt hรดm sau cรณ hรng liแปn...hรขhhsbsbbzhkznznznbzkzmsnnz
nma bรบt kแบป mแบฏt thรฌ vแปซa kแบป dc 1bรชn thรฌ lรบc kแบป bรชn kia o ra mแปฑc nแปฏa"
Mแบทt nแบก ๐FREESHIP๐ Mแบทt nแบก 3D Foodaholic Hรn Quแปc bรกn lแบป 1 miแบฟng,['Khoai '],[500000000],5,รhcyiiifcitxigxixohcohchcoxhocohcljcphcohchocoyciyxitxigxiydfoygixig kh hk lhcohcoyuo
Mแบทt nแบก ๐FREESHIP๐ Mแบทt nแบก 3D Foodaholic Hรn Quแปc bรกn lแบป 1 miแบฟng,['Ngแบซu Nhiรชn'],[490000000],5,"Mแบทt nแบก chฦฐa dรนng nรชn chฦฐa biแบฟt review sao, cแปฉ cho 5 sao trc nhรฉ."
Mแบทt nแบก ๐FREESHIP๐ Mแบทt nแบก 3D Foodaholic Hรn Quแปc bรกn lแบป 1 miแบฟng,['Ngแบซu Nhiรชn'],[450000000],5,Mua lแบงn thแปฉ 3 แป shop rแบฅt hรi lรฒng tแปซ phแปฅc vแปฅ ฤแบฟn chแบฅt lฦฐแปฃng rแบฅt lร ok 
Mแบทt nแบก ๐FREESHIP๐ Mแบทt nแบก 3D Foodaholic Hรn Quแปc bรกn lแบป 1 miแบฟng,"['Khoai ', 'Lแปฑu']","[480000000, 480000000]",5,"shop dแป mแบฟn , rep nhanh , tฦฐ vแบฅn nhiแปt tรฌnh tแบญn tรขm . Giao hรng siรชu tแปc , giแบฃi quyแบฟt vแบฅn ฤแป yรชu lแบฏm . Mong shop giแปฏ vแปฏng phong ฤแป โคTรบm lแบกi khรดng cรณ gรฌ ฤแป chรช ร cรณ ฤแบฅy lร do shop dแป thฦฐฦกng chuyรชn nghiแปp quรก lรm mรฌnh khรดng nแปก mua chแป khรกc"
Mแบทt nแบก ๐FREESHIP๐ Mแบทt nแบก 3D Foodaholic Hรn Quแปc bรกn lแบป 1 miแบฟng,['Collagen '],[480000000],5,"ฤรบng sแบฃn phแบฉm, giao hรng nhanh, phแปฅc vแปฅ tแปt..................."
Mแบทt nแบก ๐FREESHIP๐ Mแบทt nแบก 3D Foodaholic Hรn Quแปc bรกn lแบป 1 miแบฟng,['Viแปt Quแบฅt'],[480000000],5,"ฤรฃ nhแบญn ฤแปง hรng. Shop ฤรณng gรณi kฤฉ, giao hรng rแบฅt nhanh. Chแบฅt lฦฐแปฃng thรฌ phแบฃi sau khi sแปญ dแปฅng mแปi biแบฟt ฤฦฐแปฃc."
Mแบทt nแบก ๐FREESHIP๐ Mแบทt nแบก 3D Foodaholic Hรn Quแปc bรกn lแบป 1 miแบฟng,['Ngแบซu Nhiรชn'],[450000000],5,"Giao hรng ฤแบงy ฤแปง, nhanh, kem chแปng nแบฏng cรณ tem mรกc ฤแบงy ฤแปง, kแบนp bแบฅm mi dแป thฦฐฦกng "
Mแบทt nแบก ๐FREESHIP๐ Mแบทt nแบก 3D Foodaholic Hรn Quแปc bรกn lแบป 1 miแบฟng,"['Sรขm ', 'รc Sรชn ', 'Lรด Hแปi ', 'Collagen ']","[480000000, 480000000, 480000000, 480000000]",4,"ฤแปง hรng, chฦฐa dรนng nรชn chฦฐa rรต chแบฅt lฦฐแปฃng nha"
Mแบทt nแบก ๐FREESHIP๐ Mแบทt nแบก 3D Foodaholic Hรn Quแปc bรกn lแบป 1 miแบฟng,['Lแปฑu'],[480000000],5,"Hรng giao nhanh
Chฦฐa dรนng nรชn chฦฐa biแบฟt chแบฅt lฦฐแปฃng sแบฃn phแบฉm.  Nhฦฐng nhรฌn chung แปn แบก"
Mแบทt nแบก ๐FREESHIP๐ Mแบทt nแบก 3D Foodaholic Hรn Quแปc bรกn lแบป 1 miแบฟng,['Lรด Hแปi '],[480000000],5,"hรng giแปng hรฌnh , shop giao ฤรบng mแบซu , ฤรบng sแป lฦฐแปฃng hรng , mask dรนng ok , cลฉng giแปng nhแปฏng cรกi mแบทt nแบก bรฌnh thฦฐแปng khรกc , khรก nhiแปu serum bรชn trong mแบทt nแบก nรชn thแบฅm vรo khรดng hแบฟt thรฌ khรก phรญ "
Mแบทt nแบก ๐FREESHIP๐ Mแบทt nแบก 3D Foodaholic Hรn Quแปc bรกn lแบป 1 miแบฟng,"['Sรขm ', 'Dฦฐa leo ', 'Collagen ', 'Cร chua ']","[500000000, 500000000, 500000000, 500000000]",5,ฤรฃ nhแบญn dc hรng ฤแบงy ฤแปง cแบฃm ฦกn shop nhiแปu lแบฏm nhฦฐng mร khรดng sao giao hรng siรชu nhanh luรดn sแบฝ แปงng hแป shop dรi dรi dรi dรi๐๐๐๐๐๐๐๐๐๐๐๐๐๐๐๐
Mแบทt nแบก ๐FREESHIP๐ Mแบทt nแบก 3D Foodaholic Hรn Quแปc bรกn lแบป 1 miแบฟng,['Lแปฑu'],[480000000],5,"Hรng chแบฅt lฦฐแปฃng cao vร giรก cแบฃ hแปฃp lรฝ, mua nhiแปu ฤแป dรnh xรi tแปซ tแปซ "
Mแบทt nแบก ๐FREESHIP๐ Mแบทt nแบก 3D Foodaholic Hรn Quแปc bรกn lแบป 1 miแบฟng,['Sรขm '],[490000000],5,"shop ฤรณng gรณi cแบฉn thแบญn, sแบฃn phแบฉm dรนng thรญch"
Mแบทt nแบก ๐FREESHIP๐ Mแบทt nแบก 3D Foodaholic Hรn Quแปc bรกn lแบป 1 miแบฟng,"['Lรด Hแปi ', 'Dฦฐa leo ']","[480000000, 480000000]",5,"Kem mรนi thฦกm rแบฅt thรญch. ฤแบฏp mแบทt nแบก dรนng cลฉng thรญch luรดn. Nhแบญn hรng phรกt ฤแบฏp luรดn. .............,,,,"
