variations,price,rating_star,comment
[''],[28900000000],5,"em ฤแบทt shopeemall cลฉg khรก yรชn tรขm vแป nguแปn gแปc , date xa tแปi nฤm 2025. Loแบกi nรy lร chai t2 em sdung, chai ฤแบงu lร em ฤc bsi trong bvien ฤhoc y dฦฐแปฃc kรช cho thแบฅy giแบฃm mแปฅn sฦฐng viรชm hแบณn vร da k bแป khรด cฤng, thแบฅy thรญch hแปฃp cho mแบฅy bแบกn ฤang dแบญy thรฌ hay bแป mแปฅn mแปง รก"
[''],[28900000000],5,"Hรng auth nha giแปng tuรฝp trฦฐแปc mรฌnh dรนng 
Giao hรng nhanhhhhhhhhhhh 
Hรฌnh แบฃnh mang tรญnh chแบฅt nhแบญn xuuuuuuuuuuu"
[''],[28500000000],5,"Thแปi gian giao hรng rแบฅt nhanh,chแบฅt lฦฐแปฃng sแบฃn phแบฉm chฦฐa rรต vรฌ mแปi xรi,ฤรณng gรณi sแบฃn phแบฉm chแบฏc chแบฏn,shop phแปฅc vแปฅ tแปt,shipper vui vแบป,rแบฅt ฤรกng tiแปn,cho shop 5 sao,khuyรชn cรกc bแบกn nรชn mua"
[''],[28900000000],5,Sp chรญnh hรฃng mua nhiแปu lแบงn r nรชn rแบฅt an tรขm! Hy vแปng sand phแบฉm ฤem lแบกi hiแปu quแบฃ ๐
[''],[28500000000],5,"Mรฌnh thแบฅy giรก แป shop lร แปn nhแบฅt แป shopee รก, hรng chuแบฉn nแปฏa, srm cรณ hแบกt scrub sรi thรญch lแบฏm, shop chฤm sรณc khรกch hรng nhiแปt tรฌnh, 10 sao แบก."
[''],[28900000000],5,Tuyแปt vแปi. Cรฒn ฤฦฐแปฃc tแบทng kรจm mask nแปฏa โค๏ธ quรก lร xแปn luรดn. Nรชn mua nha mng 
[''],[27400000000],5,"Hang ok lแบฏm nhรฉ, xรi cรณ hแบกt li ti, rแบฅt thjk, cแบฃm giรกc k bแป khรด da, da mjh hแปn hแปฃp xรi thjk cแปฑc kรฌ! 5sao cho chแบฅt lฦฐแปฃng"
[''],[27400000000],5,"ฤรฃ dรนng loแบกi nรy tแปซ ฤแปฃt ฤi trแป mแปฅn, thแบฅy ok nรชn mua thรชm ฤแป dรนng. Cรกc bแบกn ฤang cรณ mแปฅn cรณ thแป dรนng แบก"
[''],[28200000000],5,"Giao hรng nhanh, ฤรณng gรณi cแบฉn thแบญn, sp tแบกm แปn, sแบฝ แปงng hแป nแบฟu cรณ nhu cแบงu lแบงn tแปi :3333"
[''],[28900000000],5,"Giao hรng nhanh, dรนng ok, hรng mall nรชn yรชn tรขm nรกnkskskskskdnfndnsskakkskskdk"
[''],[28200000000],5,Giao hรng nhanh. Gรณi hรng chแบฏc chแบฏn. Sแบฝ แปงng hแป tiแบฟp. Hรฌnh khรดng liรชn quan
[''],[28500000000],5,Hรng chรญnh hรฃng. Shop uy tรญn.ฤรณng gรณi cแบฉn thแบญn. Nรชn mua nha mแปi ngฦฐแปiiii
[''],[28900000000],5,"Giao hรng nhanh ฤรณng gรณi cแบฉn thแบญn
Sแปญ dแปฅng sp bรชn shop rแบฅt yรชn tรขm แบก"
[''],[28900000000],5,Lแบงn ฤแบงu mua hรng nhฦฐng vรฌ shop mall nรชn mรฌnh yรชn tรขm แบก. Cรกm ฦกn shop 
[''],[28900000000],5,"ฤรณng gรณi hรng kฤฉ
giao hรng nhanhhh 
ncl okkkkkkk lแบฏm luรดngggg"
[''],[27400000000],5,"Giao hรng hฦกi lรขu, ฤรณng gรณi chแบฏc chแบฏn. Mong lร dรนng hแปฃp, nรชn mua nhรฉ"
[''],[28900000000],5,"Giao hรng nhanh chรณng, ฤรณng gรณi sแบฃn phแบฉm kฤฉ cรng, chแบฅt lฦฐแปฃng. "
[''],[28500000000],5,Abc xyz abc xyz abc xyz abc xyz abc xyz abc xyz abc xyz bac xyz abc xyz abc xyz abc xzy abc zแปน abc xzy
[''],[28900000000],5,
[''],[28900000000],5,"Giao hรng nhanh, ฤรบng loแบกi............................"
[''],[28900000000],5,"Sแบฃn phแบฉm ฤฦฐแปฃc ฤรณng gรณi cแบฉn thแบญn, ฤแบงy ฤแปง tem mรกc cแปงa shop. Sแปฏa rแปญa mแบทt dรนng rแบฅt ok."
[''],[28900000000],5,"Giao hรng nhanh, chแบฅt lฦฐแปฃng sแบฃn phแบฉm thรฌ chฦฐa biแบฟt nhฦฐ thแบฟ nรo"
[''],[27400000000],5,Giao hรng hฦกi lรขu. Srm thรฌ chฦฐa dรนng nรชn chฦฐa review ฤฦฐแปฃc๐๐๐๐
[''],[28900000000],5,"Giao hฦกi lรขu, sแบฃn phแบฉm check ฤฦฐแปฃc mรฃ, lแบงn ฤแบงu sแปญ dแปฅng ko biแบฟt nhฦฐ thแบฟ nรo sแบฝ ฤรกnh giรก chแบฅt lฦฐแปฃng sao, MN nรชn mua ฤi dรนng thแปญ nh, shop tฦฐ vแบฅn nhiแปt tรฌnh vui vแบป, rแบฅt hรi lรฒng..."
[''],[28900000000],5,"Shop chuแบฉn bแป hรng  cแบฉn thแบญn lแบฏm, giao nhanh nแปฏa. Mรฌnh mua hแป bแบกn nhฦฐng thแบฅy yรชn tรขm vแป chแบฅt lฦฐแปฃng lแบฏm"
[''],[28900000000],5,"Chแบฅt lฦฐฦกnggggggggg, ฤรกngggggg muaaaaaaa. Tฦฐ vแบฅn nhiแปt tรฌnh, hแป trแปฃ khรกch hแบฟt mรฌnh"
[''],[27400000000],5,"Gel rแปญa mแบทt sแบกch, thoรกng vร khรดng khรด da, khรดng rรกt da.
Cรกc hแบกt li ti min, khรดng lรm rรกt da."
[''],[28900000000],5,"Tin tฦฐแปng shop, giao hรng cแปฑc nhanh luรดnnnnnnmnnnnnnnnnnnnnnnn"
[''],[28900000000],5,Gel rm sแบกch mแปm da rแปญa xong k bแป cแบฃm giรกc khรด cฤng nhฦฐng vแบซn rแบฅt sแบกch bt srm cรณ hแบกt crub dแป bแป khรด da vร ฤau rรกt nhฦฐng loแบกi nรy xรi thแบฅy khรก รชm
[''],[28900000000],5,Mang tรญnh chแบฅt lแบฅy xu. Pppppppppppppppppppppppppppppppp
[''],[28900000000],5,Sp rแบฅt okie lah แบก xรi chai thแปฉ 2 r Sp rแบฅt okie lah แบก xรi chai thแปฉ 2 r mng nรชn thแปญ
[''],[28900000000],5,"Sแบฃn phแบฉm chแบฅt lฦฐแปฃng, gรณi hรng chแบฏc chแบฏn. Nhรขn viรชn csks tแปttt lแบฏm nhaaaa."
[''],[28900000000],5,Giao hรng tฦฐฦกng ฤแปi nhanh sแบฃn phแบฉm tฦฐฦกng ฤแปi แปn sแปญ dแปฅng รชm vแปi da
[''],[28900000000],5,"Sแบฃn phแบฉm ฤรณng gรณi chแบฏc chแบฏn, cแบฉn thแบญn. Dแปch vแปฅ cskh tแปt, cแปญa hรng chรญnh hรฃng, uy tรญn."
[''],[28900000000],5,Mรฌnh ฤแบทt shopeemaill nรชn rแบฅt yรชn tรขm vแป nguแปn gแปc cรณ tem chแปng giแบฃ nรชn rแบฅt yรชn tรขm
[''],[28500000000],5,"Sแบฃn phแบฉm ฤรณng gรณi cแบฉn thแบญn, chแบฅt lฦฐแปฃng ok. Tuy giao hรng hฦกi lรขu nhฦฐng sแบฝ แปงng hแป shop nhแปฏng lแบงn sau"
[''],[28500000000],5,"Giao hรng nhanh , ฤรณng gรณi kแป cรng,nแบฟu sแปญ dแปฅng tแปt sแบฝ  แปงng hแป tiแบฟp"
[''],[28900000000],5,"Sแบฃn phแบฉm แปn, cรณ ฤiแปu mong lแบงn sau shop ฤรณng gรณi hรng nhanh xรญu แบก! "
[''],[28900000000],5,"ฤรขy lร lแบงn thแปฉ 2 mua vร rแบฅt ฦฐng รฝ, giao hรng cลฉng rแบฅt nhanh"
[''],[28500000000],5,Sแบฝ ฤรกnh giรก lแบกi khi dรนng xong
[''],[28500000000],5,Sแปญa rแปญa mแบทt nรy m dรนng rแบฅt nhiแปu rแปi nรชn mua thแปญ แป shop xem sao m thฦฐแปng mua แป nhร thuแปc thแบฅy dรนng cลฉng ok k khรกc mแบฅy chai trฦฐแปc nรชn mua nha
[''],[28200000000],5,Sแบฃn phแบฉm ok ฤรณng gรณi hรng chแบฏc chแบฏn hรฌnh แบฃnh mang tรญnh nhแบญn xu th 
[''],[28500000000],5,"Srm thรญch, phรน hแปฃp da dแบงu mแปฅn, rแปญa sแบกch k khรด da, hแบกt cรณ hแบกt scrub nhฦฐng da mแปฅn vแบซn dรนng ฤc, ship nhanh "
[''],[27500000000],5,"san pham rat thich, hรng chรญnh hรฃng, gรณi hรng kฤฉ, cแบฉn thแบญn
sแปญ dแปฅng rแบฅt thรญch, mรฌnh dรนng buแปi tแปi cรฒn buแปi sรกng mรฌnh dรนng cosrx, dฤฉ nhiรชn tแบฉy trang ฤแบงy ฤแปง, sแปญ dแปฅng kh thแบฅy bแป khรด da lแบฏm nhฦฐng nแบฟu cho hรดm nรo lแปก nhiแปu quรก thรฌ sแบฝ hฦกi khรด vรนng chแปฏ U, 2 bรชn mรก, lรm khรด cแปi mแปฅn nhanh"
[''],[28500000000],5,Hรng chuแบฉn nha. Giao hรng nhanh. Rแปญa รญt bแปt. Tแบกo cแบฃm giรกc sแบกch sรขu mรกt mแบป mร da mแบกt k bแป khรด. Rแปญa xong vแบซn ฤแปง ฤแป แบฉm cho da. 
[''],[28500000000],5,"Giao hรng khรก nhanh, ฤรณng gรณi hรng kฤฉ
Mแป ra nghe mรนi thฦกm cแปงa srm rรนi แบก. 
Tem chแปng hรng giแบฃ ฤแบงy ฤแปง nแปฏa แบก. 
๐๐"
[''],[28500000000],5,Shop ฤรณng gรณi ฤแบนp sแบฃn phแบฉm chแบฅt lฦฐแปฃng๐ฅฐ๐ฅฐ๐ฅฐ๐ฅฐ๐ฅฐ๐ฅฐ๐ฅฐ๐ฅฐ๐ฅฐ๐ฅฐ๐ฅฐ๐ฅฐ๐ฅฐ๐ฅฐ๐ฅฐ๐ฅฐ๐ฅฐ๐ฅฐ๐ฅฐ๐ฅฐ๐ฅฐ๐ฅฐ๐๐ฅฐ๐ฅฐ๐คช
[''],[27500000000],5,"Sh giao hรng hฦกi lรขu ,ฤรณng gรณi sp kฤฉ, tฦฐ vแบฅn nhiแปt tรฌnh,sp chฦฐa sรi nรชn chฦฐa ฤรกnh giรก"
[''],[27500000000],5,"Shopee mall nรชn khรก yรชn tรขm, shop ฤรณng hรng kฤฉ, cรณ tแบทng kรจm mรณc khoรก 
Mรฌnh dรนng ฤแบฟn chai t3 rแปi, ฤฦฐแปฃc bรกc sฤฉ da liแปu kรช cho, khรก lร oke ๐"
[''],[28500000000],5,ฤรณng gรณi chแบฏc chแบฏn giao hรng oke ๐คฃ๐๐ฟ๐๐ฟ๐๐ฟ๐๐ฟ๐๐ฟ๐๐ฟ sรi oke mรฌnh sแบฝ แปงng hแป tiแบฟp 
[''],[27500000000],5,"sแบฃn phแบฉm chรญnh hรฃng, mua nhiแปu lแบงn shop nรy rแปi nรชn yรชn tรขm ko lo "
[''],[27500000000],5,"Mua hรng chรญnh hรฃng nรชn khรก yรชn tรขm, ฤรฃ mua vร sแปญ dแปฅng hแบฟt 1 tรบyp rแปi."
[''],[28900000000],5,"Trฦฐแปc ฤรณ mรฌnh cรณ mua toner klairs xรi thแบฅy rแบฅt แปn, tin tฦฐแปng shop sau ฤรณ mรฌnh cรณ quay lแบกi mua srm. Do mรฌnh ฤang trong quรก trรฌnh thay ฤแปi routine nรชn mแปi sแปญ dแปฅng hai sแบฃn phแบฉm nรy lแบงn ฤแบงu . Da mรฌnh lร da dแบงu cรณ mแปฅn rแบฅt nhแบกy cแบฃm. Xรi rแบฅt ok nha mn, mรฌnh thแบฅy da mฦฐแปt hฦกn hแบณn. "
[''],[28500000000],5,ฤรฃ nhแบญn ฤฦฐแปฃc hรng vร cแบฃm thแบฅy hรi lรฒng
[''],[27500000000],5,"Giao hรng nhanh, ฤรณng gรณi cแบฉn thแบญn, tem ฤแบงy ฤแปง, mรฌnh da dแบงu mแปฅn hy vแปng dรนng sแบฝ ok."
[''],[28500000000],5,"Giao hรng nhanh, gรณi hรng cแบฉn thแบญn, giao ฤรบng vร ฤแปง hรng, hรi lรฒng! "
[''],[28500000000],5,"Hรng cรณ tem nhรฃn mรกc ฤแบงy ฤแปง, ฤรณng gรณi hรng ok, giao hรng nhanh..."
[''],[28500000000],5,"Chแบฅt lฦฐแปฃng sแบฃn phแบฉm tแปt, ฤรณng gรณi ฤแบนp vร chแบฏc chแบฏn, giao hฦกi chแบญm"
[''],[28500000000],5,"Thแปi gian giao hรng bรฌnh thฦฐแปng ko nhanh
Cรณ tem chแปng giแบฃ vร hsd cรฒn rแบฅt xa nha 
Cรฒn ฤc tแบทng mรณc khoรก "
[''],[28500000000],5,"Shop giao hรng nhanh, ฤรณng gรณi cแบฉn thแบญn แบก. Lแบงn ฤแบงu mua hรng nรชn e chฦฐa feedback sแบฃn phแบฉm ฤc แบก. "
[''],[28900000000],5,"Trแปi ฦกi tui thแป tแบกi sao tui khรดng biแบฟt cรกi srm nรy sแปm hฦกn luรดn รก. Cแบฃm giรกc xรi xong da siรชu mฦฐแปt, sแบกch vร cรฒn cรณ hแบกt li ti tแบฉy da chแบฟt nhแบน nhรng nแปฏa. ฤแปnh cแปงa chop luรดn.
Shop thรฌ siรชu nhiแปt tรฌnh, dแปch vแปฅ hแป trแปฃ chฤm sรณc KH cแปฑc tแปt luรดn, ฤรณng gรณi chแบฏc chแบฏn, kแปน cรng vร nhanh lแบฏm. Cho 100 sao luรดn nhรฉ"
[''],[27500000000],5,"Pros: + ฤรณng gรณi kฤฉ, giao hรng cลฉng khรก nhanh. 
+ Shop tฦฐ vแบฅn nhiแปt tรฌnh, cรณ inb xรกc nhแบญn ฤฦกn hรng โค
+ Sแบฃn phแบฉm xรi cแปฑc kแปณ tแปt: rแปญa sแบกch mร khรดng khรด da, cรณ hแบกt scrub ฤแป tแบฉy tแบฟ bรo chแบฟt, dรนng thแบฅy ฤแปก mแปฅn แบฉn hฦกn
Cons: - Do kแบฟt cแบฅu srm nรชn bแป hay ฤแปng sแบฃn phแบฉm แป trong nแบฏp.
=>>> ฤรกng mua "
[''],[27500000000],5,Nhร mรฌnh cรณ 3 ngฦฐแปi bแป mแปฅn thรฌ ฤแปu dรนng sแปฏa rแปญa mแบทt nรy lร ฤแปง hiแปu chแบฅt lฦฐแปฃng ok sao rแปi. ฤi bรกc sฤฉ da liแปu ฤฦฐแปฃc bรกc kรช ฤฦกn rแปi dรนng nghiแปn quรก khรดng bแป ฤฦฐแปฃc luรดn 
[''],[27500000000],5,"ฤรฃ mua lแบงn hai, hรng chรญnh hรฃng, srm dรนng xong sแบกch, mแบทt mแปn, sแบฝ tiแบฟp tแปฅc xรi vร แปงng hแป shop"
[''],[28500000000],5,"Shop ฤรณng gรณi hรng cแบฉn thแบญn. Sแปฏa rแปญa mแบทt mรนi dแป chแปu, dรนng came thแบฅy da mแบทt ฤc rแปญa sแบกch sรขu. Ok nhรฉ "
[''],[28500000000],5,Lแบงn ฤแบงu mรฌnh rแปญa thรฌ sแบกch mร k bแป khรด da แบฅy ok nha. Cรฒn phแบฃi sรi hแบฟt chai mแปi biแบฟt mแปฅn cรณ giแบฃm k chแปฉ. Sp cรณ mรนi thฦกm nhแบน nhรng. Cรณ hแบกt massage nแปฏa.
[''],[28500000000],5,ฤรฃ nhแบญn ฤฦฐแปฃc hรng shop ฤรณng gรณi chแบฏc chแบฏn shipper vui vแบป thรขn thiแปn sp cรณ tem cรฒn nguyรชn
[''],[28500000000],5,"Lแบงn ฤแบงu mua แป shop ,chแบฅt lฦฐแปฃng phแปฅc vแปฅ rแบฅt tแปt ฤรณng gรณi cลฉng kแปน cรng cรฒn vแป chแบฅt lฦฐแปฃng sแบฃn phแบฉm thรฌ sแบฝ cho ฤรกnh giรก sau cรฒn trฦฐแปc mแบฏt mแปi thแปฉ ฤiแปu ok"
[''],[28500000000],5,"mua แป shop rแบฅt nhiแปu lแบงn nรชn lร yรชn tรขm vแป chแบฅt lฦฐแปฃng luรดn รญ, mng bรชn mua em nรณ vแป nhรฉ^^"
[''],[27500000000],5,Lฦฐแปi chแปฅp quรก e ฤang dรนng thแปญ cรณ vแบป lร hรng auth tแบกi dรนng khรกc thรญch em mแปi ฤแปi sang dรฒng nรy nแปฏa 
[''],[27500000000],5,Hรng gรณi kฤฉ nhแบฅt tแปซ trฦฐแปc ฤแบฟn giแป shop bรกn quรก cรณ tรขm mรฌnh rแบฅt thรญch โค๏ธ ฤi da liแปu kรช ฤฦกn cho sp nรy xรi ฤรฃ ฤฦฐแปฃc 3 thรกng da cแบฃi thiแปn rรต tแปซ nhแปฏng tuแบงn ฤแบงuโค๏ธ
[''],[28500000000],5,"Gรณi hรng rแบฅt nhanh. Khรกm da liแปu ฤฦฐแปฃc bsi kรช dรนng, xรi rแบฅt ok, hฦฐฦกng thฦกm dแป chแปu."
[''],[27500000000],5,"Hรng cรณ tem chแปng giแบฃ. Cรณ lแปp giแบฅy bแบกc, lร chai thแปฉ 3 mรฌnh dรนng rแบฅt แปn. Rแปญa nhแบน nhรng nhฦฐng rแบฅt sแบกch da. K bแป lรชn mแปฅn. Nhฦฐng shop giao cho bรชn vc hฦกi lรขu. ฤแบทt 3/3 ฤแบฟn 9/3 mแปi nhแบญn ฤc. ฤรณng gรณi tแบกm. "
[''],[28500000000],5,Loแบกi nรy mรฌnh ฤรฃ dรนng qua 1 chai . Giรก hฦกi ฤแบฏt nhฦฐng mร ai ฤang mแปฅn viรชm dรนng lร dแปu lแบฏm nha . Mรฌnh dรนng qua nhรฌu loแบกi chฦฐa loแบกi nรo ฦฐng v
[''],[28500000000],5,"Sp ok,!!!!!!!!!!!!!!!!@@@@@@@@@@@@@@@@@@@@@@@@@@@@@@@@@@@@@@@@@@@@@@@@@@yeutd91 kkkkkkkkkk kkkkkkkkkkkkkkkkkkkkkkkkkkkkkkkkkkkkkkkkkkkkkkkkkkkkkkkkkkkkkkkkkkkkkkkkkkkkkkkkkkkkkkkkkkkkkkkkkkkkkkkkkkkkkkkkkkkkkkkkkkkkkkkkkkkkkkkkkkkkkkkkkkkkkkkkkkkkkkkkkkkkkkkkkkkkk"
[''],[28500000000],5,Sแบฃn phแบฉm dรนng thรญch แบก. Cรณ tem nhรฃn nรชn cลฉng yรชn tรขm. Mua lแบงn 2 rแปi :))
[''],[27500000000],5,Xinloi mn vรฌ chiแบฟc แบฃnh khรดng liรชn quan lแบฏm. Chiแบฟc cleanser qua lร ukie luรดn โค๏ธโค๏ธโค๏ธ
[''],[27500000000],5,"Mall nรชn yรชn tรขm , shop trl nhiแปt tรฌnh .Nchung rแบฅt ok"
