name,variations,price,rating_star,comment
Set 7 Mặt Nạ Focallure Lõi Kép Giúp Cấp Nước Kiểm Soát Nhờn Trong 7 Ngày,"['#5', '#4', '#2', '#1']","[1900000000, 1900000000, 1900000000, 1900000000]",5,"shop đóng gói sản phẩm cẩn thận chắc chắc số lượng đủ, mặt nạ đắ thích lắm luôn á mình mua nhiều lần rùi"
Set 7 Mặt Nạ Focallure Lõi Kép Giúp Cấp Nước Kiểm Soát Nhờn Trong 7 Ngày,"['#5', '#4', '#3', '#2']","[2250000000, 2250000000, 2250000000, 2250000000]",5,Mua thử lần đầu đắp thấy thích. Da mướt mịn hơn sau khi rửa mặt nên mua 1 đống luôn. Đánh giá để nhận xu
Set 7 Mặt Nạ Focallure Lõi Kép Giúp Cấp Nước Kiểm Soát Nhờn Trong 7 Ngày,"['#5', '#3']","[2800000000, 2800000000]",5,Chất lượng sản phẩm tuyệt vời Chất lượng sản phẩm tuyệt vời Chất lượng sản phẩm tuyệt vời Chất lượng sản phẩm tuyệt vời Chất lượng sản phẩm tuyệt vời Chất lượng sản phẩm tuyệt vời Chất lượng sản phẩm tuyệt vời Chất lượng sản phẩm tuyệt vời Chất lượng sản phẩm tuyệt vời Chất lượng sản phẩm tuyệt vời 
Set 7 Mặt Nạ Focallure Lõi Kép Giúp Cấp Nước Kiểm Soát Nhờn Trong 7 Ngày,['#1'],[2800000000],5,"Son bóng chất dính dính như keo nha mn:(( mình hơi bất ngờ, màu đẹp
Son kem màu đẹp, khá lì và mềm môi, NHƯNG, bặm môi k được nha huhu
Không rcm em son này
Mặt nạ đắp đến hôm t2 lên mụn ngứa nha mn"
Set 7 Mặt Nạ Focallure Lõi Kép Giúp Cấp Nước Kiểm Soát Nhờn Trong 7 Ngày,"['#6', '#5', '#3']","[2800000000, 2800000000, 2800000000]",5,"Mình up ảnh tượng trưng lấy xu nhé😝
Nạ mình mua lần thứ hai vì đắp liệu trình trước thấy rất tót nè
Son rẻ mà cực kì lì. Mình xài từ trưa mà tới chiều son vẫn k phai dù mình uống nước đủ thứ. "
Set 7 Mặt Nạ Focallure Lõi Kép Giúp Cấp Nước Kiểm Soát Nhờn Trong 7 Ngày,['#2'],[2200000000],5,"Không hài lòng với cách đóng gói của shop,chỉ bọc bằng một túi nilong nên mặt nạ bị bể 
Giao thiếu hàng,nhắn tin thì shop nói sẽ đưa thêm vào lần mua tiếp theo "
Set 7 Mặt Nạ Focallure Lõi Kép Giúp Cấp Nước Kiểm Soát Nhờn Trong 7 Ngày,['#2'],[2200000000],5,"Mình thấy mặt nạ này khá là dễ thương mini nhưng Sài đc tận 2 lần / cái nên khá ổn tuy v nhưng công dụng mình thấy chỉ có cấp ẩm và làm dịu mát đã bỏ và tủ lạnh thì sài mát da lắm còn mấy công dụng khác thì ko đc rõ rệt với giá như thế thì cũng ổn á nên mua thử 1 lần nha. Mùi thì ko hôi, ổn."
Set 7 Mặt Nạ Focallure Lõi Kép Giúp Cấp Nước Kiểm Soát Nhờn Trong 7 Ngày,"['#5', '#2']","[2800000000, 2800000000]",5,"Sản phẩm giống với hình, chưa biết chất lượng như thế nào, đóng gói cẩn thận, giao hàng nhanh chóng."
Set 7 Mặt Nạ Focallure Lõi Kép Giúp Cấp Nước Kiểm Soát Nhờn Trong 7 Ngày,['#2'],[2140000000],5,"Mặt nạ khá thơm
Mình là da nhạy cảm mà dùng thử ko thấy sao
Mùi thích lắm
Lsau sẽ ủng hộ shop tiếp ạ"
Set 7 Mặt Nạ Focallure Lõi Kép Giúp Cấp Nước Kiểm Soát Nhờn Trong 7 Ngày,['#4'],[2800000000],5,"Đóng gói cực kỳ chỉnh chu, sạch, đẹp.
Có lấy một con cá mào xanh lá ra đắp thì thấy cực kỳ mát luon, đắp xong cảm giác được cấp ẩm hẳn, sài cũng ok, kh thấy bị kích ứng hay gì cả :3"
Set 7 Mặt Nạ Focallure Lõi Kép Giúp Cấp Nước Kiểm Soát Nhờn Trong 7 Ngày,['#1'],[2800000000],5,"Gói hàng siêu kĩ , đầy đủ đúng hàng, chất lượng ổn có điều cái kem nền lộ vân da lắm không được tệp vào da, trong các món mình đặt thấy ưng nhất chì kẻ mắt và phấn nénnnnnnnnnnnnnmnmmmmmm"
Set 7 Mặt Nạ Focallure Lõi Kép Giúp Cấp Nước Kiểm Soát Nhờn Trong 7 Ngày,['#2'],[2800000000],5,"Mặt nạ này mình đã từng dùng rồi, đắp lên thấy rất là mát luôn á. Mìn thích màu xanh lá nhất hihi"
Set 7 Mặt Nạ Focallure Lõi Kép Giúp Cấp Nước Kiểm Soát Nhờn Trong 7 Ngày,"['#5', '#3']","[2800000000, 2800000000]",5,Đã xài và rất thích nên mình đặt lại. Mỗi tội ship lâu lâu nên các bạn có xài nhớ canh 1 tuần nhé
Set 7 Mặt Nạ Focallure Lõi Kép Giúp Cấp Nước Kiểm Soát Nhờn Trong 7 Ngày,"['#5', '#3']","[2250000000, 2250000000]",5,"Shop giao hàng nhanh, điểm trừ là k ghi cách dùng và chia set. Mặt nạ dùng được, k bị kích ứng"
Set 7 Mặt Nạ Focallure Lõi Kép Giúp Cấp Nước Kiểm Soát Nhờn Trong 7 Ngày,['#3'],[2250000000],5,"Mới dùng thử viên màu vàng, dạng gel mùi cam thơm thơm, dùng xong cũng sáng da lên xíu, tạm ổn"
Set 7 Mặt Nạ Focallure Lõi Kép Giúp Cấp Nước Kiểm Soát Nhờn Trong 7 Ngày,['#3'],[2500000000],5,Trước mình dùng màu xanh lá thấy đỡ mụn hẳn luôn nên mua tiếp cái màu xanh dương để kiềm dầu cơ mà mình xài k hợp lắm nó lại lên ít mụn lại. Cơ mà mặt mình đỡ dầu hẳn nên k sao :3
Set 7 Mặt Nạ Focallure Lõi Kép Giúp Cấp Nước Kiểm Soát Nhờn Trong 7 Ngày,['#4'],[2800000000],5,"Nhỏ nhỏ dễ thương,vì là hàng quốc tế nên giao hàng khá lâu.Nhưng giá cả rất ổn phù hợp hs,sv"
Set 7 Mặt Nạ Focallure Lõi Kép Giúp Cấp Nước Kiểm Soát Nhờn Trong 7 Ngày,"['#4', '#1']","[2800000000, 2800000000]",5,"mask xinhhh lắm mng oiii, nma chuaa sử dụng thử nên chuaa n.xét gid duoccc mà nhìn cutee lắm nhaaa"
Set 7 Mặt Nạ Focallure Lõi Kép Giúp Cấp Nước Kiểm Soát Nhờn Trong 7 Ngày,['#2'],[2800000000],5,hàng rẻ và chết lượng ok giao nhanh ạ lần t2 mua ở shop rùi ạ 😀 quá nà ok lun
Set 7 Mặt Nạ Focallure Lõi Kép Giúp Cấp Nước Kiểm Soát Nhờn Trong 7 Ngày,['#2'],[2800000000],5,"Sản phẩm tốt, giá rẻ
Còn được tặng thêm quà
Lần sau sẽ tiếp tục mua ủng hộ shop
Hàng chuẩn "
Set 7 Mặt Nạ Focallure Lõi Kép Giúp Cấp Nước Kiểm Soát Nhờn Trong 7 Ngày,['#1'],[2300000000],5,"Hàng xinh xẻo , sale giá rẻ chưa dùng nên chưa biết chât s lượng . Hy vo jg tôitsgucjvzjsd"
Set 7 Mặt Nạ Focallure Lõi Kép Giúp Cấp Nước Kiểm Soát Nhờn Trong 7 Ngày,['#4'],[1900000000],5,"chất lượng sản phẩm tuyệt vời, đóng gói sản phẩm chắc chắn, mk đặt nhiều lần r nên đặt lại "
Set 7 Mặt Nạ Focallure Lõi Kép Giúp Cấp Nước Kiểm Soát Nhờn Trong 7 Ngày,['#4'],[2500000000],5,"Đã nhận hàng, đóng gói chắc chắn, số lượng đầy đủ
Chưa sử dụng nên chưa biết tính năng như thế nào. Mình mua mặt nạ ạ
Hxnđnndndjjdkdkđkođoldkdjjdodkdkdkkđkdkdkdkdhdbhdbddjjdidjdjr"
Set 7 Mặt Nạ Focallure Lõi Kép Giúp Cấp Nước Kiểm Soát Nhờn Trong 7 Ngày,['#2'],[2500000000],5,Sieuuuuuuuuuuiiiiiiiuuiiiiiiu ưnghhhhhh luonnnnnnnnnnn
Set 7 Mặt Nạ Focallure Lõi Kép Giúp Cấp Nước Kiểm Soát Nhờn Trong 7 Ngày,['#6'],[2250000000],5,"Set mặt nạ nhỏ, tiện dụng. Da đang bị mụn nên chưa dùng. Hàng mall nên mua, hi vọng là OK "
Set 7 Mặt Nạ Focallure Lõi Kép Giúp Cấp Nước Kiểm Soát Nhờn Trong 7 Ngày,['#2'],[2300000000],5,"Mặt nạ con cá khá nhỏ, mình không nghĩ nhỏ vậy, ban đầu tưởng kẹo cơ, kkkk, mặt nạ giấy tặng kèm đắp đã lắm, mát, sảng khoái đã, ưng lắm luôn, mua ở đây rẻ nữa, thích heheh, sẽ ủng hộ lại nè"
Set 7 Mặt Nạ Focallure Lõi Kép Giúp Cấp Nước Kiểm Soát Nhờn Trong 7 Ngày,"['#7', '#6', '#5', '#4', '#3', '#2', '#1']","[2800000000, 2800000000, 2800000000, 2800000000, 2800000000, 2800000000, 2800000000]",5,Đong goi can thân nhìn xinh dã man như đồ chơi trẻ con vậy. Chua thư nên chưa biêt ntn.
Set 7 Mặt Nạ Focallure Lõi Kép Giúp Cấp Nước Kiểm Soát Nhờn Trong 7 Ngày,"['#7', '#3', '#2']","[2800000000, 2800000000, 2800000000]",5,Chưa dùng thử nên chưa biết chất lượng thế nào nhưng nhìn ưng vỏ của eye liner lắm luôn
Set 7 Mặt Nạ Focallure Lõi Kép Giúp Cấp Nước Kiểm Soát Nhờn Trong 7 Ngày,['#2'],[1900000000],5,"Mặt nạ dùng khá ổn nha, mùi thơm nhẹ, dùng xong thấy k đỡ mụn tí nào nhg tháy da có vẻ mướt hơn"
Set 7 Mặt Nạ Focallure Lõi Kép Giúp Cấp Nước Kiểm Soát Nhờn Trong 7 Ngày,['#1'],[2500000000],5,"Xin lắm 
Dừng tốt
Hàng chất lượng 
Giá rẻ mua trong lúc sale càng rẻ hơn"
Set 7 Mặt Nạ Focallure Lõi Kép Giúp Cấp Nước Kiểm Soát Nhờn Trong 7 Ngày,['#2'],[2500000000],5,"Văn học, nghệ thuật là công cụ để hiểu biết, để khám phá, để sáng tạo thực tại xã hội."
Set 7 Mặt Nạ Focallure Lõi Kép Giúp Cấp Nước Kiểm Soát Nhờn Trong 7 Ngày,['#2'],[2500000000],5,"Giao đủ hàng, nhìn giống mấy con cá cute quá trời. Ít nên cũng dùng đủ cho 1 mặt/ lần"
Set 7 Mặt Nạ Focallure Lõi Kép Giúp Cấp Nước Kiểm Soát Nhờn Trong 7 Ngày,"['#3', '#2']","[2250000000, 2250000000]",5,"Giao hàng hơi lâu, chưa dùng nên chưa bt chất lượng như thế nào, nhìn xinh xinh cute"
Set 7 Mặt Nạ Focallure Lõi Kép Giúp Cấp Nước Kiểm Soát Nhờn Trong 7 Ngày,['#2'],[2800000000],5,"Chưa sử dụng nên không biết sao, hơi nhỏ với giá tiền này thì hợp lý, hình ảnh chủ yếu để nhận xu thôi :)))"
Set 7 Mặt Nạ Focallure Lõi Kép Giúp Cấp Nước Kiểm Soát Nhờn Trong 7 Ngày,['#2'],[2800000000],5,"Ảnh vs video chỉ mang tính chất lấy xu :> shop giao đủ,mặt nạ xinh, chưa dùng nên chưa biết ntn"
Set 7 Mặt Nạ Focallure Lõi Kép Giúp Cấp Nước Kiểm Soát Nhờn Trong 7 Ngày,['#1'],[2300000000],5,"Hàng giao đủ nhanh chóng
Date mới
Giao hàng khá nhanh
Mình mua lần thứ 3 rồi ok lắm"
Set 7 Mặt Nạ Focallure Lõi Kép Giúp Cấp Nước Kiểm Soát Nhờn Trong 7 Ngày,['#5'],[1900000000],5,Xinh xỉu luôn. Mình chưa dùng nhưng packaging đáng iu quá nên chắc chắn sẽ mua thêm
Set 7 Mặt Nạ Focallure Lõi Kép Giúp Cấp Nước Kiểm Soát Nhờn Trong 7 Ngày,"['#6', '#5']","[2500000000, 2500000000]",5,Mua lần 2 vs số lượng lớn :)) 6/6 sale may à nó k giới hạn đơn nên quất 3 set về dùng dần đợi lần sau :))
Set 7 Mặt Nạ Focallure Lõi Kép Giúp Cấp Nước Kiểm Soát Nhờn Trong 7 Ngày,['#1'],[2800000000],5,Sản phẩm đáng yêu mà không biết có hiệu quả không vì giá cả hợp lý nên đáng để thử
Set 7 Mặt Nạ Focallure Lõi Kép Giúp Cấp Nước Kiểm Soát Nhờn Trong 7 Ngày,['#2'],[2250000000],5,"Chất lượng sản phẩm tuyệt vời
Sản phẩm rất đẹp và chắc chắc"
Set 7 Mặt Nạ Focallure Lõi Kép Giúp Cấp Nước Kiểm Soát Nhờn Trong 7 Ngày,['#6'],[2800000000],5,"Xinh lắm, giá cả hợp lí. Săn sale nên rất hời.ship hơi lâu một chút nhưng ko sao"
Set 7 Mặt Nạ Focallure Lõi Kép Giúp Cấp Nước Kiểm Soát Nhờn Trong 7 Ngày,['#1'],[2140000000],3,Mua lại lần thứ 2 nhưng có loại mình dùng ok có loại thì hơi kích ứng nên cx ko thực sự thích lắm
Set 7 Mặt Nạ Focallure Lõi Kép Giúp Cấp Nước Kiểm Soát Nhờn Trong 7 Ngày,['#2'],[2300000000],5,Sản phẩm chất lượng cao khỏi nói. Nhất định bao giờ có tiền sẽ mua bảng mắt mày
Set 7 Mặt Nạ Focallure Lõi Kép Giúp Cấp Nước Kiểm Soát Nhờn Trong 7 Ngày,['#4'],[1900000000],5,"hàng quốc tế nên giao hơi lâu, mình chưa dùng thử, mấy cái viên bé bé xinh xinh"
Set 7 Mặt Nạ Focallure Lõi Kép Giúp Cấp Nước Kiểm Soát Nhờn Trong 7 Ngày,['#4'],[2800000000],5,Chất lượng ổn trong tầm giá. Dùng 1tg thấy hiệu quả cũng không rõ rệt lắm đâu ạ
Set 7 Mặt Nạ Focallure Lõi Kép Giúp Cấp Nước Kiểm Soát Nhờn Trong 7 Ngày,['#6'],[2800000000],5,"Chất lượng spham tuyệt vời, đog gói đẹp và chắc chắn, giao hàng nhanh. Nên mua"
Set 7 Mặt Nạ Focallure Lõi Kép Giúp Cấp Nước Kiểm Soát Nhờn Trong 7 Ngày,['#2'],[2800000000],5,"Giao đủ số lượng, đóng gói cẩn thận, shop nước ngoài nhưng giao hàng rất nhanh"
Set 7 Mặt Nạ Focallure Lõi Kép Giúp Cấp Nước Kiểm Soát Nhờn Trong 7 Ngày,['#1'],[2250000000],5,Nhờ bạn nhận hộ nên chưa biết chất lượng mặt nạ ra sao nhưng giá thành rẻ và là shop mall nên khá yên tâm
Set 7 Mặt Nạ Focallure Lõi Kép Giúp Cấp Nước Kiểm Soát Nhờn Trong 7 Ngày,['#7'],[2800000000],4,"Mua vì tò mò cái hộp xinh nhưng mà ôi trời ơi nó như sà phòng ấy, thất vọng kinh ra luôn"
Set 7 Mặt Nạ Focallure Lõi Kép Giúp Cấp Nước Kiểm Soát Nhờn Trong 7 Ngày,['#1'],[1900000000],5,Giao hàng nhanh nè. Sản phầm chưa dùng nên chưa biết ntn. Nhưng nc là oke nhé
Set 7 Mặt Nạ Focallure Lõi Kép Giúp Cấp Nước Kiểm Soát Nhờn Trong 7 Ngày,['#3'],[2140000000],5,Hàng giao hoi lâu nhưng sản phẩm như quảng cáo.hi vọng sài tốt sẽ ủng hộ thêm
Set 7 Mặt Nạ Focallure Lõi Kép Giúp Cấp Nước Kiểm Soát Nhờn Trong 7 Ngày,"['#7', '#1']","[2800000000, 2800000000]",5,"Giao đủ sản ohaarm, thời gian giao hàng tương đối nhanh, giao đủ sản phẩm như đã đwjt"
Set 7 Mặt Nạ Focallure Lõi Kép Giúp Cấp Nước Kiểm Soát Nhờn Trong 7 Ngày,['#5'],[2250000000],5,"Xinh lắmmmmmmmmmm luônnnnnnn
Mà mỗi tội chưa biết dùng saoooo.
"
Set 7 Mặt Nạ Focallure Lõi Kép Giúp Cấp Nước Kiểm Soát Nhờn Trong 7 Ngày,['#1'],[2800000000],5, Hybg  hhn cf njjnvd  mkkm fbmhdjv cfkl  vjkgf bnkfdc nkhv  hgc njhc jtsc bìc
Set 7 Mặt Nạ Focallure Lõi Kép Giúp Cấp Nước Kiểm Soát Nhờn Trong 7 Ngày,['#5'],[2800000000],5,"bth hàng quốc tế hơn 10 ngày mới giao mà tnhien đơn này chưa tới 4 ngày đã tới, shop mall nma đóng hàng bằng bao nilon nhìn sơ sài lắm"
Set 7 Mặt Nạ Focallure Lõi Kép Giúp Cấp Nước Kiểm Soát Nhờn Trong 7 Ngày,['#6'],[2250000000],5,"Mặt nạ cấp ẩm tạm ổn, giá rẻ, giao hàng nước ngoài khá nhanh, gói hàng chắc chắn"
Set 7 Mặt Nạ Focallure Lõi Kép Giúp Cấp Nước Kiểm Soát Nhờn Trong 7 Ngày,['#2'],[2800000000],5,Chưa dùng nhưng hi vọng chất lượng tốt. Giao hàng nhanh. Đóng hàng cẩn thận
Set 7 Mặt Nạ Focallure Lõi Kép Giúp Cấp Nước Kiểm Soát Nhờn Trong 7 Ngày,"['#3', '#2']","[2800000000, 2800000000]",5,"Hình ảnh mang tính chất nhận xu
Đóng gói cẩn thận. Sản phẩm thử ổn sẽ mua tiếp "
Set 7 Mặt Nạ Focallure Lõi Kép Giúp Cấp Nước Kiểm Soát Nhờn Trong 7 Ngày,['#2'],[2300000000],5,Uhubuhuhinino no joiswkwkwkskskskskdkdkdkdkdkdkdk wwwuwuuwuwuwuqqn wjkwiwwiwisiosxn d s wkwkkwkwkwakakakpanswo 
Set 7 Mặt Nạ Focallure Lõi Kép Giúp Cấp Nước Kiểm Soát Nhờn Trong 7 Ngày,['#7'],[2800000000],5,Không phải bây gì không có gì ai cũng đc không biết có gì không phải t cho m ý kiến cho t đi học 
Set 7 Mặt Nạ Focallure Lõi Kép Giúp Cấp Nước Kiểm Soát Nhờn Trong 7 Ngày,['#5'],[2200000000],5,"Một đống mặt nạ tròn tròn nhìn hay ghê, dùng thử rồi đánh giá chi tiết sau"
Set 7 Mặt Nạ Focallure Lõi Kép Giúp Cấp Nước Kiểm Soát Nhờn Trong 7 Ngày,"['#5', '#2']","[2800000000, 2800000000]",5,"Đóng gói sản phẩm chắc chắn, đồ khá là xinh, giá cả lại rẻ, sẽ ủng hộ tiếp"
Set 7 Mặt Nạ Focallure Lõi Kép Giúp Cấp Nước Kiểm Soát Nhờn Trong 7 Ngày,['#3'],[2300000000],5,"Hình ảnh mang tính chất lấy xu
Giao hàng nhanh
Giao đủ hàng
Sp sử dụng tốt"
Set 7 Mặt Nạ Focallure Lõi Kép Giúp Cấp Nước Kiểm Soát Nhờn Trong 7 Ngày,['#1'],[2300000000],5,"Hình ảnh mang tính chất lấy xu
Giao hàng nhanh
Giao đủ hàng
Sp sử dụng tốt"
Set 7 Mặt Nạ Focallure Lõi Kép Giúp Cấp Nước Kiểm Soát Nhờn Trong 7 Ngày,['#7'],[1900000000],5,Đóng hàng cẩn thận giao hàng đầy đủ hàng đúng mô tả giá rẻ nói chung là ok
Set 7 Mặt Nạ Focallure Lõi Kép Giúp Cấp Nước Kiểm Soát Nhờn Trong 7 Ngày,['#1'],[2200000000],5,"Giao hàng hơi lâu, mới dùng thử đc cái màu hồng 1 lần nhưng chưa thấy đc hiệu quả chắc phải dùng nhiều lần"
Set 7 Mặt Nạ Focallure Lõi Kép Giúp Cấp Nước Kiểm Soát Nhờn Trong 7 Ngày,"['#3', '#1']","[2250000000, 2250000000]",5,Chat luong san pham tuyet voi. Giao hang nhanh. Dong goi san pham ki cang
Set 7 Mặt Nạ Focallure Lõi Kép Giúp Cấp Nước Kiểm Soát Nhờn Trong 7 Ngày,['#7'],[2250000000],5,Mặt nạ nhỏ xinh. Chưa sử dụng nên chưa đánh giá được chất lượng sản phẩm.
Set 7 Mặt Nạ Focallure Lõi Kép Giúp Cấp Nước Kiểm Soát Nhờn Trong 7 Ngày,"['#5', '#3', '#2']","[2800000000, 2800000000, 2800000000]",5,"Giao hàng nhanh +_đúng mẫu OK +đủ số lượng ok 
Sử dụng xong da mịn hơn ok"
Set 7 Mặt Nạ Focallure Lõi Kép Giúp Cấp Nước Kiểm Soát Nhờn Trong 7 Ngày,"['#5', '#4', '#2', '#1']","[2250000000, 2250000000, 2250000000, 2250000000]",5,"Các sản phẩm đều nhỏ hơn mình nghĩ, siêu mini , đóng gói sản phẩm kỹ càng. "
Set 7 Mặt Nạ Focallure Lõi Kép Giúp Cấp Nước Kiểm Soát Nhờn Trong 7 Ngày,['#4'],[2200000000],5,"Chất lượng sản phẩm tuyệt vời 
Đóng gói sản phẩm rất đẹp và chắc chắn... "
Set 7 Mặt Nạ Focallure Lõi Kép Giúp Cấp Nước Kiểm Soát Nhờn Trong 7 Ngày,"['#5', '#3']","[2800000000, 2800000000]",5,"Dùng thấy cũng khá là mát , nói chung là ok . Mình ord tầm 1 tuần hơn có "
Set 7 Mặt Nạ Focallure Lõi Kép Giúp Cấp Nước Kiểm Soát Nhờn Trong 7 Ngày,"['#4', '#2']","[2500000000, 2500000000]",5,Giao hàng siêu nhanh không ngờ là sớm vậy chất lượng tốt đã dùng nhiều lần sẽ tiếp tục ủng hộ
Set 7 Mặt Nạ Focallure Lõi Kép Giúp Cấp Nước Kiểm Soát Nhờn Trong 7 Ngày,"['#4', '#2']","[2500000000, 2500000000]",5,"Bọc hàng cẩn thận. Giao trước hẹn nhma mình thấy vẫn hơi chậm. Nhìn khá xinh, còn chất lượng như nào thì chưa biết vì chưa dùng. Ncl 👍"
Set 7 Mặt Nạ Focallure Lõi Kép Giúp Cấp Nước Kiểm Soát Nhờn Trong 7 Ngày,"['#7', '#6', '#5', '#4', '#2', '#1']","[2140000000, 2140000000, 2140000000, 2140000000, 2140000000, 2140000000]",5,"Đã dùng và dùng cực thích luôn nên đây là lần mua thứ 2. Còn đặt cho chị em nữa
L"
Set 7 Mặt Nạ Focallure Lõi Kép Giúp Cấp Nước Kiểm Soát Nhờn Trong 7 Ngày,['#2'],[2140000000],5,Giao hàng nhanh . nhìn xinh đáng yêu . chưa dùng nên chưa biết chất lượng
Set 7 Mặt Nạ Focallure Lõi Kép Giúp Cấp Nước Kiểm Soát Nhờn Trong 7 Ngày,"['#3', '#2']","[2300000000, 2300000000]",5,shop đóng gói cẩn thận đc tặng kèm mặt nạ giao hàng 5 ngày jzksbsksksjs
Set 7 Mặt Nạ Focallure Lõi Kép Giúp Cấp Nước Kiểm Soát Nhờn Trong 7 Ngày,['#4'],[1900000000],5,Vì chỗ mình dịch nên giao hàng hơi lâu. Nhưng sản phẩm dùng cực thích luôn ạ. Đã mua lần 2. Ảnh và vid chỉ mang tính chất nhận xu
Set 7 Mặt Nạ Focallure Lõi Kép Giúp Cấp Nước Kiểm Soát Nhờn Trong 7 Ngày,"['#4', '#2']","[2800000000, 2800000000]",5,Đánh giá chỉ mang tính chất nhận xu chứ không bình luạn gì về sản phẩm 
Set 7 Mặt Nạ Focallure Lõi Kép Giúp Cấp Nước Kiểm Soát Nhờn Trong 7 Ngày,"['#5', '#2']","[2800000000, 2800000000]",5,Gậgajaoaubala faiaywgkaoaia jaoaiahlwiwjaja haoaiahhsnajaalb mavajalak
Set 7 Mặt Nạ Focallure Lõi Kép Giúp Cấp Nước Kiểm Soát Nhờn Trong 7 Ngày,['#7'],[2200000000],5,Mới dùng 2v nhưng thấy 1v dùng cho 1l thì hơi nh mà để lại khó bảo quản
Set 7 Mặt Nạ Focallure Lõi Kép Giúp Cấp Nước Kiểm Soát Nhờn Trong 7 Ngày,['#2'],[2800000000],4,"dùng rất tốt vì dùng rồi nên k có ảnh tất cả các mẫu hì hì giao hàng nhanh
tốt"
Set 7 Mặt Nạ Focallure Lõi Kép Giúp Cấp Nước Kiểm Soát Nhờn Trong 7 Ngày,['#2'],[2800000000],5,"Hàng rất chi là ok
Đợi hơi lâu xíu 
Mua chỗ nảy hơi bị nhiều r mà chưa lần nào thất vọng hết á"
Set 7 Mặt Nạ Focallure Lõi Kép Giúp Cấp Nước Kiểm Soát Nhờn Trong 7 Ngày,"['#6', '#5']","[2600000000, 2600000000]",5,"lúc đặt không biết 1 set là nhìu trứng 
đặt 2 set ra 14 trứng 
quá nhìu luôn mình chưa thử 
chắc đắp mát da thì được"
Set 7 Mặt Nạ Focallure Lõi Kép Giúp Cấp Nước Kiểm Soát Nhờn Trong 7 Ngày,['#2'],[2250000000],5,Nhỏ xinh đáng yêu. Zai nhà mình tưởng kẹo mẹ ơi kẹo này. Chúc shop buôn may bán đắt
Set 7 Mặt Nạ Focallure Lõi Kép Giúp Cấp Nước Kiểm Soát Nhờn Trong 7 Ngày,['#2'],[2250000000],5,"Hàng như hình, chất lượng tốt, shop đóng gói cẩn thận, giao hàng nhanh"
Set 7 Mặt Nạ Focallure Lõi Kép Giúp Cấp Nước Kiểm Soát Nhờn Trong 7 Ngày,['#4'],[2800000000],5,"Hàng oke nha
Hình ảnh mang tính chất minh hoạ ae thông cảm ạ"
Set 7 Mặt Nạ Focallure Lõi Kép Giúp Cấp Nước Kiểm Soát Nhờn Trong 7 Ngày,['#2'],[2800000000],5,"Vỏ ngoài khá cute 
Đóng gói sản phẩm chắc chắn 
Tgian giao hàg nhanh"
Set 7 Mặt Nạ Focallure Lõi Kép Giúp Cấp Nước Kiểm Soát Nhờn Trong 7 Ngày,"['#3', '#2']","[2300000000, 2300000000]",5,Hàng đẹp giống hình mình chưa dùng thử nhưng nhìn bắt mắt lắm nha mn 
Set 7 Mặt Nạ Focallure Lõi Kép Giúp Cấp Nước Kiểm Soát Nhờn Trong 7 Ngày,"['#6', '#5', '#1']","[2800000000, 2800000000, 2250000000]",5,"Hàng ok , video và ảnh bên trên chỉ mang hình chất lấy xu ....
...."
Set 7 Mặt Nạ Focallure Lõi Kép Giúp Cấp Nước Kiểm Soát Nhờn Trong 7 Ngày,"['#6', '#5']","[2800000000, 2800000000]",5,Shop giao hàng nhanh. Đóng gói sản phẩm. đẹp và chắc chắn. Giá tốt.
Set 7 Mặt Nạ Focallure Lõi Kép Giúp Cấp Nước Kiểm Soát Nhờn Trong 7 Ngày,"['#3', '#2', '#1']","[2300000000, 2300000000, 2300000000]",5,"Mua rất nhiều lần rồi, rất đáng tiền , cấp ẩm tốt, giao nhanh nueax"
Set 7 Mặt Nạ Focallure Lõi Kép Giúp Cấp Nước Kiểm Soát Nhờn Trong 7 Ngày,['#1'],[2800000000],5,"Đã nhận đủ hàng, ship nhanh, Sp dùng ok, đã mua lại mấy lần rồi! Ok"
Set 7 Mặt Nạ Focallure Lõi Kép Giúp Cấp Nước Kiểm Soát Nhờn Trong 7 Ngày,['#5'],[2200000000],5,"Chất lượng sản phẩm tốt 
Đóng gói sản phẩm rất đẹp và chắc chắn... "
Set 7 Mặt Nạ Focallure Lõi Kép Giúp Cấp Nước Kiểm Soát Nhờn Trong 7 Ngày,['#3'],[2200000000],5,"Chất lượng sản phẩm tốt 
Đóng gói sản phẩm rất đẹp và chắc chắn... "
Set 7 Mặt Nạ Focallure Lõi Kép Giúp Cấp Nước Kiểm Soát Nhờn Trong 7 Ngày,['#2'],[2200000000],5,"Chất lượng sản phẩm tốt 
Đóng gói sản phẩm rất đẹp và chắc chắn... "
Set 7 Mặt Nạ Focallure Lõi Kép Giúp Cấp Nước Kiểm Soát Nhờn Trong 7 Ngày,['#7'],[2140000000],5,Chẩt lượng sản phẩm chưa dùng nên không biết . Giao hàng khá nhanh 
Set 7 Mặt Nạ Focallure Lõi Kép Giúp Cấp Nước Kiểm Soát Nhờn Trong 7 Ngày,['#4'],[2250000000],5,"Giao hàng nhanh, shop phục vụ tốt, nhiệt tình chất lượng tuyệt vời "
Set 7 Mặt Nạ Focallure Lõi Kép Giúp Cấp Nước Kiểm Soát Nhờn Trong 7 Ngày,['#6'],[2200000000],5,"Đủ hàng mà có 1 viên bị vỡ mất, chưa dùng nên chưa biết chất lượng "
Set 7 Mặt Nạ Focallure Lõi Kép Giúp Cấp Nước Kiểm Soát Nhờn Trong 7 Ngày,['#7'],[2200000000],5,"Chất lượng sản phẩm tuyệt vời, đóng gói chắc chắn, giao hàng nhanh"
Set 7 Mặt Nạ Focallure Lõi Kép Giúp Cấp Nước Kiểm Soát Nhờn Trong 7 Ngày,['#3'],[2300000000],5,"Sản phẩm như hình ảnh, thời gian giao hàng nhanh. Shop phục vụ tốt"
Set 7 Mặt Nạ Focallure Lõi Kép Giúp Cấp Nước Kiểm Soát Nhờn Trong 7 Ngày,['#1'],[1900000000],5,"Mặt nạ giao đủ 7 cái nguyên vẹn, ko bị bể, hi vọng xài được hihihi"
Set 7 Mặt Nạ Focallure Lõi Kép Giúp Cấp Nước Kiểm Soát Nhờn Trong 7 Ngày,['#6'],[1900000000],5,"Giao hàng nhanh. Đầy đủ
Chưa dùng nên tạm để 5* 
Sẽ đánh giá lại sau"
Set 7 Mặt Nạ Focallure Lõi Kép Giúp Cấp Nước Kiểm Soát Nhờn Trong 7 Ngày,['#3'],[1900000000],5,Chất lượng sản phẩm tuyệt vời sản phẩm đóng gói chắc chắn kĩ càng
Set 7 Mặt Nạ Focallure Lõi Kép Giúp Cấp Nước Kiểm Soát Nhờn Trong 7 Ngày,['#7'],[1900000000],5,"sản phẩm đúng như hình, rất ưng ý giao hàng còn nhanh hơn dự kiến"
