name,variations,price,rating_star,comment
Set 7 Mặt Nạ Focallure Lõi Kép Giúp Cấp Nước Kiểm Soát Nhờn Trong 7 Ngày,['#3'],[2250000000],5,Hàng tốt đóng gói cẩn thận giao hàng nhanh vừa túi tiền. Hình ảnh mang tc nhận xu. Tks shop.
Set 7 Mặt Nạ Focallure Lõi Kép Giúp Cấp Nước Kiểm Soát Nhờn Trong 7 Ngày,['#2'],[2500000000],5,"BOT Bảo Tín, [24.04.21 17:36]
CTKD75AQ
CTKNWL1Z
CTKMEDQQ
CTKAXCQG
CTK972YZ
20k chat

BOT Bảo Tín, [24.04.21 17:36]
CTKVT5CQ
CTK7QGQW
CTKAL8HV
CTKU48QF
CTKVYPF9
CTKJ4DFV
CTKZUPQS
CTK2WKTF
CTKH8E1D
CTKANH3E
CTKEHF5M
CTKX4N46
CTK3B1WX
CTKGWGQT
CTKXJFAX
CTKLHP3Z
CTKWKA1F
CTKFCK4V
CTKY7GMC
CTK77J4X
CTKD6"
Set 7 Mặt Nạ Focallure Lõi Kép Giúp Cấp Nước Kiểm Soát Nhờn Trong 7 Ngày,['#6'],[2250000000],5,"TWENTY-FIVE 25 LỪA ĐẢO TRẢ THIẾU TIỀN LƯƠNG NHÂN VIÊN.
- Xem xét, cân nhắc lại việc có nên vào làm tại TWENTY-FIVE 25 – thời trang có trên 15 cơ sở nằm xung quanh Hà Nội nhé mng.
- Gần tết ( gần cuối t12) mình thấy thông tin tuyển dụng của Twenty- Five dày đặc khắp trang mạng Facebook. Giữa nhiều ch"
Set 7 Mặt Nạ Focallure Lõi Kép Giúp Cấp Nước Kiểm Soát Nhờn Trong 7 Ngày,['#4'],[1900000000],5,"Quy khach da dang ky thanh cong goi cuoc 02GB1DNEW, co 02GB su dung den het 24h cua ngay dang ky. Su dung het 02GB thue bao se truy cap theo chinh sach cua goi Mobile internet hien tai (neu co). Soan KTMI gui 191 de kiem tra cac goi cuoc dang su dung, soan KTTK gui 191 de kiem tra luu luong. Chi tie"
Set 7 Mặt Nạ Focallure Lõi Kép Giúp Cấp Nước Kiểm Soát Nhờn Trong 7 Ngày,"['#6', '#4', '#3', '#1']","[2140000000, 2140000000, 2140000000, 2140000000]",5,"Mua ngay đợt sale, giá hời hơn 1 chút. Chưa đắp thử nên chưa biết hiệu quả. Có 1 cái bị bung ra do bị ép, mong shop gói hàng nên quấn chống sốc."
Set 7 Mặt Nạ Focallure Lõi Kép Giúp Cấp Nước Kiểm Soát Nhờn Trong 7 Ngày,['#2'],[2800000000],5,"[QC] DUNG QUEN UU DAI CUA BAN tren VIETTELPAY: GIAM 20% khi mua goi cuoc Data (khong gioi han so lan) va GIAM 10% khi nap tien dien thoai Viettel cho chinh minh (KM trong 06 thang, tinh tu thoi diem TB tham gia chuong trinh thanh cong). Chi tiet xem tai https://vt.viettelpay.vn/1gt10s4. LH 18009000 "
Set 7 Mặt Nạ Focallure Lõi Kép Giúp Cấp Nước Kiểm Soát Nhờn Trong 7 Ngày,"['#3', '#2']","[2250000000, 2250000000]",4,"Mặt nạ đang dùng nên không biết kết quả ra sao. Miếng dán lột mụn đầu đen không dán được, dán không ăn chắc vào da, lột ra không lấy được miếng mụn nào. Làm mình tin tưởng mua hẳn 10 tấmmmm"
Set 7 Mặt Nạ Focallure Lõi Kép Giúp Cấp Nước Kiểm Soát Nhờn Trong 7 Ngày,['#5'],[2800000000],5,"với lớp ngoài là lõi cấp ẩm (lòng trắng trứng) và lõi chức năng (lòng đỏ trứng).
  4 tác dụng tùy chọn
  - Màu vàng （Làm trắng）: Chiết xuất các tinh chất làm trắng da từ thực vật tự nhiên như việt quất, arbutin và hoa cúc, cũng như ""Chuyên gia làm trắng da"" niacinamide và fulfulene ， có tác dụng dưỡ"
Set 7 Mặt Nạ Focallure Lõi Kép Giúp Cấp Nước Kiểm Soát Nhờn Trong 7 Ngày,"['#3', '#2']","[2800000000, 2800000000]",5,"Chưa dùng sp nên chưa đánh giá được 
Giao đủ hàng 
................"
Set 7 Mặt Nạ Focallure Lõi Kép Giúp Cấp Nước Kiểm Soát Nhờn Trong 7 Ngày,['#1'],[2200000000],5,"[TB] Tang 20% gia tri tat ca the nap trong ngay 25/05/2021. Tien KM su dung noi mang, khong gioi han thoi gian.
NHAN THEM CHIET KHAU len den 10% khi nap the qua VIETTELPAY tai http://viettelpay.vn/1/kmnapthe20/ . CT danh rieng cho TB cua Quy khach. LH 198 (0d)."
Set 7 Mặt Nạ Focallure Lõi Kép Giúp Cấp Nước Kiểm Soát Nhờn Trong 7 Ngày,['#4'],[2500000000],5,"Đây là lần 3 mình mua mặt nạ này rồi vì tiện và thích. Mỗi cái dùng đủ cho 1 lần. Cấp ẩm rất tốt, dùng xong da mềm, ẩm và mướt lắm nha. Lần này ship nhanh hơn những lần trước"
Set 7 Mặt Nạ Focallure Lõi Kép Giúp Cấp Nước Kiểm Soát Nhờn Trong 7 Ngày,['#1'],[1900000000],5,"""Bất kể bạn đang ở độ tuổi nào, tôi nghĩ chúng ta đều nên học cách nói chuyện dịu dàng với những người bên cạnh, ít nhất đừng thốt ra những lời khiến đối phương ấm ức, bởi vì có lẽ bạn không biết, ngôn ngữ thật sự là một loại sức mạnh thần kỳ, nó sẽ làm mọi người yêu quý bạn, cũng khiến người bạn yê"
Set 7 Mặt Nạ Focallure Lõi Kép Giúp Cấp Nước Kiểm Soát Nhờn Trong 7 Ngày,"['#7', '#3']","[2800000000, 2800000000]",5,"Sản phẩm tốt, giá cả tốt, giao hàng rất tốt....sẽ quay lại và tiếp tục ủng hộ "
Set 7 Mặt Nạ Focallure Lõi Kép Giúp Cấp Nước Kiểm Soát Nhờn Trong 7 Ngày,['#2'],[2800000000],3,"Mình không chấp nhận được cách shop gói đồ gửi từ Trung về bằng 1 cái bịch nilong mỏng dính không có lấy 1 miếng chống xốc và bị rách 1 lỗ Còn riêng sản phẩm này mình rate 3 sao vì mình mua combo 2 cái set 7 mask màu xanh lá mà ship cho mình ""hẳn"" 6 mask xanh lá xong trộn linh tinh mask khác vào :) "
Set 7 Mặt Nạ Focallure Lõi Kép Giúp Cấp Nước Kiểm Soát Nhờn Trong 7 Ngày,['#1'],[1900000000],5,Mặt nạ chưa dùng nhưng nhìn rất xinh. Cảm ơn shop nhiều nhé. Lần sau sẽ ủng hộ shop
Set 7 Mặt Nạ Focallure Lõi Kép Giúp Cấp Nước Kiểm Soát Nhờn Trong 7 Ngày,['#4'],[2800000000],5,"Dễ sử dụng, khá đáng yêu. Trải nghiệm thử 1 tuần thì mình ko thấy da mặt mình có biến đổi gì khác cả😢 nhưng mà bao bì dễ thương với đắp lên khá mát da nên cho 5 sao, còn về giảm mụn thì mình ko thấy gì, nhưng có làm sáng da một chút❤️ nói chung khá ưng vì với giá rẻ như này thì ko đòi hỏi gì hơn 😘"
Set 7 Mặt Nạ Focallure Lõi Kép Giúp Cấp Nước Kiểm Soát Nhờn Trong 7 Ngày,['#3'],[2300000000],5,Nhìn nhỏ nhỏ xinh xinh 🥰 Hàng quốc tế mà giao siêu nhanh chỉ 5 ngày. Mua 1 set dùng thử mới dùng lần đầu came giác mịn thích lắm ý mong là dùng lâu hiệu quả. Sẽ ủng hộ shop tiếp 💚
Set 7 Mặt Nạ Focallure Lõi Kép Giúp Cấp Nước Kiểm Soát Nhờn Trong 7 Ngày,['#2'],[2800000000],5,"gọi là ổn trong tầm giá còn chất lượng thì chưa bt ntn , vài ngày quay lại đánh giá lại 
tuy giao gần 1 tuần mới nhận đc nhưng shipper thân thiện nhiệt tình nên bỏ qua , shop cũng dễ thương."
Set 7 Mặt Nạ Focallure Lõi Kép Giúp Cấp Nước Kiểm Soát Nhờn Trong 7 Ngày,['#4'],[2250000000],5,"Chào mừng bạn đến với bảng nhớ tạm của Gboard, bất kỳ văn bản nào bạn sao chép sẽ được lưu tại đây.Chào mừng bạn đến với bảng nhớ tạm của Gboard, bất kỳ văn bản nào bạn sao chép sẽ được lưu tại đây."
Set 7 Mặt Nạ Focallure Lõi Kép Giúp Cấp Nước Kiểm Soát Nhờn Trong 7 Ngày,"['#7', '#2']","[2800000000, 2800000000]",5,"Mình đã mua nhiều lần rồi, giao hàng lúc nào cũng đủ 👍🏻👍🏻👍🏻👍🏻👍🏻"
Set 7 Mặt Nạ Focallure Lõi Kép Giúp Cấp Nước Kiểm Soát Nhờn Trong 7 Ngày,['#4'],[2200000000],5,"Đã mua nhiều và fb nhiều. Đợt này kmai nhiều nên mua tiếp , bỏ tủ lạnh đắp bao phê con dê 😋😋😋😋. Đắp xong mát xa da đúng bài "
Set 7 Mặt Nạ Focallure Lõi Kép Giúp Cấp Nước Kiểm Soát Nhờn Trong 7 Ngày,['#3'],[2250000000],5,"Cute dễ thương. Chưa dùng nên chưa biết công dụng ra sao
Dịch giao hàng hơi trễ"
Set 7 Mặt Nạ Focallure Lõi Kép Giúp Cấp Nước Kiểm Soát Nhờn Trong 7 Ngày,['#3'],[2500000000],5,"Cảm ơn shop. Mình rất hài lòng và sẽ tiếp tục ủng hộ shop. Hàng đẹp, y hình, chất lượng tốt. Shop giao nhanh, đúng màu, đóng gói cẩn thận. Mong shop có nhiều deal cho khách ruột như mình 💞"
Set 7 Mặt Nạ Focallure Lõi Kép Giúp Cấp Nước Kiểm Soát Nhờn Trong 7 Ngày,"['#4', '#3', '#1']","[2800000000, 2800000000, 2800000000]",5,chưa sài sản phẩm. chắc sào ok. dhdnxnmxmdmejdhxbxnxnxmxncndjsksmsnxnxnxncncdjjeosksncncnahqqgbsbxjdjdjejrđjdjjrịdjdjđjdjieơkwkwksjdxnnxnxmzmzmxbcbxhxhcucuiêuưoqợdhdnxnxnxnxnnxnxmxmxbd
Set 7 Mặt Nạ Focallure Lõi Kép Giúp Cấp Nước Kiểm Soát Nhờn Trong 7 Ngày,"['#7', '#5', '#4', '#3', '#2']","[2140000000, 2140000000, 2140000000, 2140000000, 2140000000]",5,"mỗi hộp mặt nạ dùng 1 lần hình con cá rất xinh, vừa đủ cho 1 lần dùng, bị cái bỏ dô cái núi nilon đen ship về hơi sơ sài k có bảo vệ sp bên trong, hên là của mình ko bị bể hay gì cả"
Set 7 Mặt Nạ Focallure Lõi Kép Giúp Cấp Nước Kiểm Soát Nhờn Trong 7 Ngày,['#1'],[2140000000],5,Goi cuoc MAX70N(70000 d/9GB/30 ngay) cua Quy khach se duoc gia han vao 18:40 12/05/2021. Quy khach vui long nap du tien (70000 d) de gia han goi cuoc thanh cong. CSKH 18001091
Set 7 Mặt Nạ Focallure Lõi Kép Giúp Cấp Nước Kiểm Soát Nhờn Trong 7 Ngày,"['#6', '#1']","[2250000000, 2250000000]",5,"Trông mặt nạ cute dã man 😁 một quả trứng, trộn với nhau rồi đắp lên mặt. chất kem thơm. Ko gây kích ứng gì. "
Set 7 Mặt Nạ Focallure Lõi Kép Giúp Cấp Nước Kiểm Soát Nhờn Trong 7 Ngày,['#1'],[2250000000],5,"Mút tán khá tốt, nhìn dễ thương.
Đóng gói sản phẩm thì sơ sài quá, có mỗi cái túi bọc thui. Hàng mỹ phẩm, mặt nạ, phấn mắt mà bọc vậy làm mình hết hồn. May mà đồ không bị vỡ."
Set 7 Mặt Nạ Focallure Lõi Kép Giúp Cấp Nước Kiểm Soát Nhờn Trong 7 Ngày,['#2'],[2800000000],5,"Dạo này có gì mới không? Việc tự học có ý nghĩa to lớn như vậy nên bản thân chúng ta phải xây dựng cho mình tinh thần tự học trên nền tảng của sự say mê, ham học, ham hiểu biết, giàu khát vọng và kiên trì trên con đường chinh phục tri thức. Từ đó bản thân mỗi con người cần chủ động, tích cực, sáng t"
Set 7 Mặt Nạ Focallure Lõi Kép Giúp Cấp Nước Kiểm Soát Nhờn Trong 7 Ngày,['#2'],[2800000000],5,"Khi mới đắp lên thì mát mát, chủ yếu tác dụng của em này để thư giãn thôi, sau khoảng 20p da hơi châm chích nhẹ. Tác dụng làm sáng da của màu cam thì gần như không thấy, nhưng dưỡng ẩm đủ cho da mịn màng hơn. Màu trắng để kiềm dầu nhưng sử dụng cũng vậy."
Set 7 Mặt Nạ Focallure Lõi Kép Giúp Cấp Nước Kiểm Soát Nhờn Trong 7 Ngày,['#7'],[2500000000],5,"< GÓC ĐẸP NGƯỜI ĐẸP NẾT >

Cụ thể là ở phút 92, khi chỉ còn 3 phút bù giờ cuối cùng là Malaysia chính thức bại trận trước tuyển Việt Nam. Trong lúc tranh bóng Akhyarrashid đã có va chạm với Đỗ Duy Mạnh khiến anh bị ngã và ngồi giữa sân với sự mệt mỏi hiện rõ trên khuôn mặt. Akhyarrashid ngay lập tức"
Set 7 Mặt Nạ Focallure Lõi Kép Giúp Cấp Nước Kiểm Soát Nhờn Trong 7 Ngày,"['#7', '#5']","[2800000000, 2800000000]",5,"Mặt nạ nhỏ xíu à, đắp xong sẽ review thêm nhưng tưởng shop chia ra mà ko chia xong để hết vô túi hàng ko để riêng gì cả"
Set 7 Mặt Nạ Focallure Lõi Kép Giúp Cấp Nước Kiểm Soát Nhờn Trong 7 Ngày,"['#7', '#6', '#5', '#4', '#3', '#2', '#1']","[2800000000, 2800000000, 2800000000, 2800000000, 2800000000, 2800000000, 2800000000]",5,"Giao hàng khá nhanh, có 5 ngày là tới rùi. Mặt nạ trông bé hơn mình nghĩ =))) lần đầu dùng nhma liều mua full option lun, mong là dùng hợp để khum phí tiền =)))))"
Set 7 Mặt Nạ Focallure Lõi Kép Giúp Cấp Nước Kiểm Soát Nhờn Trong 7 Ngày,['#4'],[2800000000],5,Vừa đắp mặt cho ny xong thì cãi nhau đánh nhau và chia tay. Sầu quá nên không thèm nói về chất lượng sp nữa. Ơ nhưng mà thơm còn dùng như nào thì không nói đâu. 
Set 7 Mặt Nạ Focallure Lõi Kép Giúp Cấp Nước Kiểm Soát Nhờn Trong 7 Ngày,"['#5', '#1']","[2800000000, 2800000000]",5,"DAS (Dr.Anh's Secret) Diet là phương pháp giảm béo Low Carb hiệu quả và đơn giản nhất, không cần phải nhịn ăn, không cần phải tập thể dục, chỉ cần... ăn và ..."
Set 7 Mặt Nạ Focallure Lõi Kép Giúp Cấp Nước Kiểm Soát Nhờn Trong 7 Ngày,['#6'],[2800000000],5,"Mua giùm nên không đưa ra đánh giá chính xác được. Nhỏ nhắn dễ thương , hi vọng xài tốt. 

Nếu mẹ và e gái thích sẽ quay lại muq và đưa ra đánh giá khách quan"
Set 7 Mặt Nạ Focallure Lõi Kép Giúp Cấp Nước Kiểm Soát Nhờn Trong 7 Ngày,['#2'],[2500000000],5,"mua mấy lần rùi nên an tâm.sp dùng ok lắm.trước mua có đánh giá về hũ xanh lá gòi nên lần này đánh giá lấy xu thôi
Lúc dùng để 15' rồi rửa=nước ấm nhé.lúc rửa sẽ cảm thấy còn nhờn nhờn chưa khô là do nước vào á nên cứ rửa sạch là đc or dùng máy mas cho tinh chất thấm hơn cũng ok.Một hũ dùg đc 2-3lan"
Set 7 Mặt Nạ Focallure Lõi Kép Giúp Cấp Nước Kiểm Soát Nhờn Trong 7 Ngày,"['#4', '#3', '#2']","[2800000000, 2800000000, 2800000000]",5,"Shop giao hàng đầy đủ, đúng loại. Mặt nạ nhìn nhỏ nhỏ xinh xinh. Dù chưa sử dụng sản phẩm nhưng rất yên tâm về chất lượng vì đã mua hàng của shop nhiều lần."
Set 7 Mặt Nạ Focallure Lõi Kép Giúp Cấp Nước Kiểm Soát Nhờn Trong 7 Ngày,['#6'],[2800000000],5,"ảnh và video không liên quan, hàng rất đẹp, giá thành rẻ, giao hàng nhanh, shop phục vụ rất tốt, nói chung là cực kì hài lòng, cảm ơn shop nhiều ạ !"
Set 7 Mặt Nạ Focallure Lõi Kép Giúp Cấp Nước Kiểm Soát Nhờn Trong 7 Ngày,"['#7', '#6', '#3']","[2500000000, 2500000000, 2500000000]",5,Hàng quốc tế nên giao hơi lâu. Gói hàng cũng khá sơ sài. Bạn mình sử dụng thấy ok nhưng mình chưa dùng nên k dám đánh giá chất lượng. Sẽ review sau
Set 7 Mặt Nạ Focallure Lõi Kép Giúp Cấp Nước Kiểm Soát Nhờn Trong 7 Ngày,"['#6', '#4', '#3', '#2']","[2800000000, 2800000000, 2500000000, 2500000000]",5,"Đặt hàng 15.04
Nhận hàng 24.04

Nhìn cưng, lần 2 mua hàng.
#2: 3 green, 2 blue, 1 yellow, 1 pink
#3: 3 yellow, 3 blue, 1 pink
#4: 4 green, 1 pink, 2 blue
#6: 5 pink, 1 blue, 1 green

Có hương liệu nhưng mùi khá dễ chịu, màu green mướt da nhanh, blue ổn, pink vs yellow mình chưa xài chưa biết ntn."
Set 7 Mặt Nạ Focallure Lõi Kép Giúp Cấp Nước Kiểm Soát Nhờn Trong 7 Ngày,['#2'],[1900000000],5,Mình mới dùng thử thì chưa thấy có tác dụng gì mấy. Không biết dùng thêm 1-2 cái nữa thì sao. Hàng quốc tế nên giao hơi lâu chút nha mọi người.
Set 7 Mặt Nạ Focallure Lõi Kép Giúp Cấp Nước Kiểm Soát Nhờn Trong 7 Ngày,['#5'],[2800000000],5,Sản phải đẹp đã mua nhiều lần và sẽ ủng hộ tiếp tục nữa giao hàng nhanh 
Set 7 Mặt Nạ Focallure Lõi Kép Giúp Cấp Nước Kiểm Soát Nhờn Trong 7 Ngày,['#2'],[2800000000],5,Sản phẩm khá ok.Son dưỡng có mùi khá thơm.Kem nền mình đặt màu 04 cho tự nhiên nhưng khi nhận về test lên tay màu lại thiên về vàng k hợp với da trắng lắm.Nhũ mắt và phấn phủ thì khá ok.Bao bì đóng gói có mã để check.Tóm lại hàng xịn
Set 7 Mặt Nạ Focallure Lõi Kép Giúp Cấp Nước Kiểm Soát Nhờn Trong 7 Ngày,['#2'],[2800000000],5,"Mặt nạ gel nhìn cute, nhưng có vẻ ko hợp da mình( hỗn hợp thiên dầu nhạy cảm có mụn) dán mụn loại bạn đêm hơi dày, nên mua loại ban ngày hơn "
Set 7 Mặt Nạ Focallure Lõi Kép Giúp Cấp Nước Kiểm Soát Nhờn Trong 7 Ngày,['#5'],[2250000000],5,"O           0      0  0  0        0  0  0
   O      0        0                 0
      O0           0  0  0        0  0  0
        0            0                         0
        0            0  0  0        0  0  0
        "
Set 7 Mặt Nạ Focallure Lõi Kép Giúp Cấp Nước Kiểm Soát Nhờn Trong 7 Ngày,['#5'],[2800000000],4,"giao đủ hàng nhưng mà bị lâu quá , chưa dùng mặt nạ nên kbiet chất lượng sản phẩm ra sao nhưng mà cái bút hai đầu eyeliner cả mascara hơi thất vọng . Đầu eyeliner thì mềm quá mực ra hơi nhiều cảm giác rất khó vẽ vòn đầu mascara thì chuốt đc xíu cảm giác hơi nặng mi . Ncl hợp với giá tiền "
Set 7 Mặt Nạ Focallure Lõi Kép Giúp Cấp Nước Kiểm Soát Nhờn Trong 7 Ngày,['#4'],[2800000000],5,"Hàng giống hình, giao hàng nhanh. Đóng gói cẩn thận. Mà bị mẻ một chút ở nắp"
Set 7 Mặt Nạ Focallure Lõi Kép Giúp Cấp Nước Kiểm Soát Nhờn Trong 7 Ngày,['#2'],[2140000000],5,"Shop giao hàng nhanh, đầy đủ. Set nhìn khá xịn xò. Mình mới đắp màu xanh lá thấy mùi thơm, khá săn da. Để đắp thêm mấy loại khác xem sao."
Set 7 Mặt Nạ Focallure Lõi Kép Giúp Cấp Nước Kiểm Soát Nhờn Trong 7 Ngày,['#3'],[2800000000],5,Mặt nạ chưa sd thử nên chưa biết hiệu quả ntn.. Nhưng packing bé bé xinh lắm....................................  ......... Hhhhhhhhhhhhh
Set 7 Mặt Nạ Focallure Lõi Kép Giúp Cấp Nước Kiểm Soát Nhờn Trong 7 Ngày,['#2'],[2500000000],5,Dùng cấp ẩm ok. Da nhạy cảm k nên dùng hihihi...........................................................................................
Set 7 Mặt Nạ Focallure Lõi Kép Giúp Cấp Nước Kiểm Soát Nhờn Trong 7 Ngày,['#2'],[2800000000],5,"
Hôm trước em đi tập ngắm súng ý
Người bên ngoài cứ bảo em ngu vì không ngắm súng vào tâm 
Nhưng người ta đâu có biết tâm của em là anh"
Set 7 Mặt Nạ Focallure Lõi Kép Giúp Cấp Nước Kiểm Soát Nhờn Trong 7 Ngày,['#3'],[2250000000],5,"Đắp đc 1 tuần r đánh giá 
Nói chung ko đc hiệu quả
Ko thích lắm mlemmmm"
Set 7 Mặt Nạ Focallure Lõi Kép Giúp Cấp Nước Kiểm Soát Nhờn Trong 7 Ngày,"['#7', '#5']","[2250000000, 2250000000]",5,Mặt nạ để không bọc lại gây vỡ dính nhớt lên các sản phẩm khác khiến mình phải mang đi rửa với nước hơi thất vọng về lần đóng gói này 
Set 7 Mặt Nạ Focallure Lõi Kép Giúp Cấp Nước Kiểm Soát Nhờn Trong 7 Ngày,"['#5', '#2']","[2800000000, 2800000000]",5,"Giao hàng lâu vì hàng quốc tế, hy vọng dùng không bị kích ứng da. 1 lần đắp vừa đủ mặt mình, nếu dùng tốt mình sẽ mua thêm lần nữa"
Set 7 Mặt Nạ Focallure Lõi Kép Giúp Cấp Nước Kiểm Soát Nhờn Trong 7 Ngày,['#2'],[2300000000],5,Chưa đắp nên k biết chất lượng. Ship hơi lâu nhưng đóng gói kĩ càng
Set 7 Mặt Nạ Focallure Lõi Kép Giúp Cấp Nước Kiểm Soát Nhờn Trong 7 Ngày,['#2'],[1900000000],5,Sản phẩm nhỏ nhắn .  Đúng đủ hàng mới dùng 1 cái xanh lá cây mùi khá thơm dùng tiết kiệm đc 2 lần .mk còn là HS nên tiết kiệm
Set 7 Mặt Nạ Focallure Lõi Kép Giúp Cấp Nước Kiểm Soát Nhờn Trong 7 Ngày,['#6'],[2250000000],5,Sản phẩm rất đáng yêu và thơm. Rất đáng đồng tiền bát gạo. Mua về dùng rất thích. Lười chụp lại ảnh nên ảnh mang tc nhận xu.
Set 7 Mặt Nạ Focallure Lõi Kép Giúp Cấp Nước Kiểm Soát Nhờn Trong 7 Ngày,"['#7', '#4', '#2']","[2250000000, 2250000000, 2250000000]",5,"Shop giao rất đầy đủ và nhanh chóng. Chưa dùng nên chưa biết thế nào, nhưng thấy siêu yêu luôn ấy, bé xinh như viên kẹo vậy."
Set 7 Mặt Nạ Focallure Lõi Kép Giúp Cấp Nước Kiểm Soát Nhờn Trong 7 Ngày,['#4'],[2250000000],4,"Một viên xanh bị như vậy
Kb có s k nữa
Hàng bé hơn so vs mk nghĩ
Najsjs"
Set 7 Mặt Nạ Focallure Lõi Kép Giúp Cấp Nước Kiểm Soát Nhờn Trong 7 Ngày,['#5'],[2500000000],5,"trông xinh yêu lắm luôn ấy, thấy bảo set 7 mặt nạ mà shop giao mình 8 🤪🤪 cho tủ lạnh lôi ra đắp bao phê bao thư giãn nhaaa"
Set 7 Mặt Nạ Focallure Lõi Kép Giúp Cấp Nước Kiểm Soát Nhờn Trong 7 Ngày,"['#7', '#2']","[2800000000, 2800000000]",5,"Mask đặc, mùi thơm bth cho vào tủ lạnh rồi bỏ ra đắp siêu mát. Công dụng thì k được như ý mình cho lắm so vs giá thì ổn."
Set 7 Mặt Nạ Focallure Lõi Kép Giúp Cấp Nước Kiểm Soát Nhờn Trong 7 Ngày,['#7'],[2500000000],5,"Giao hàng đúng và đủ nè,, mask lõi kép kia dùng khá là thích ,sau 15' thì da mình cũng mềm với không tiết dầu mấy săn sale 6.6 nên khá là rẻ , có dịp còn ủng hộ nè:3"
Set 7 Mặt Nạ Focallure Lõi Kép Giúp Cấp Nước Kiểm Soát Nhờn Trong 7 Ngày,['#3'],[2800000000],5,hàng đẹp lắm ưng cái bụng sẽ ủng hộ shop tiếp hình ảnh chỉ mang tính chất minh hoạ
Set 7 Mặt Nạ Focallure Lõi Kép Giúp Cấp Nước Kiểm Soát Nhờn Trong 7 Ngày,"['#5', '#3']","[2800000000, 2800000000]",5,"Sản phẩm tốt, gói hàng cẩn thận, set nạ môi xài tốt, mềm môi, thơm, son thì màu hơi nhạt so với hình, thơm mùi socola."
Set 7 Mặt Nạ Focallure Lõi Kép Giúp Cấp Nước Kiểm Soát Nhờn Trong 7 Ngày,['#2'],[2140000000],5,"Giao hàng siêu nhanh, gói hàng cẩn thận oke, mask cũng rẻ, dùng oke, lượng gel đủ dùng, đắp mask thì ko có hqua tức thời luôn đâu mà nchung là để tủ lạnh xong lôi ra đắp nó mát nó phê gì đâu á :))"
Set 7 Mặt Nạ Focallure Lõi Kép Giúp Cấp Nước Kiểm Soát Nhờn Trong 7 Ngày,['#3'],[2250000000],5,Bé hơn tưởng tượng ...k kì vọng có công dụng như hãng miêu tả ...mua về chủ yếu để đắp thư giãn ...để trong tủ lạnh lấy ra đắp sẽ thích hơn
Set 7 Mặt Nạ Focallure Lõi Kép Giúp Cấp Nước Kiểm Soát Nhờn Trong 7 Ngày,['#5'],[2800000000],5,"Mặt nạ quả trứng nhìn rất dễ thương
Giao hàng hơi lâu xíu
Mua thử xem dùng tnao, nếu cảm thấy có tác dụng thì sẽ ủng hộ tiếp"
Set 7 Mặt Nạ Focallure Lõi Kép Giúp Cấp Nước Kiểm Soát Nhờn Trong 7 Ngày,['#5'],[2250000000],5,"Giao đúng mẫu, đúng loại. Nhìn xinh xinh, chưa đắp thử nên chưa biết có hiệu quả k. Nói chung nên mua dùng thử."
Set 7 Mặt Nạ Focallure Lõi Kép Giúp Cấp Nước Kiểm Soát Nhờn Trong 7 Ngày,['#2'],[2300000000],5,"Shop giao đúng và đủ sản phẩm,đáng mua lắm nha mn :3, được tặng thêm 1 mák nha đam , sẽ ủng hộ shop lần nữa 🥰🥰🥰"
Set 7 Mặt Nạ Focallure Lõi Kép Giúp Cấp Nước Kiểm Soát Nhờn Trong 7 Ngày,"['#3', '#2']","[2500000000, 2500000000]",5,"Sài cho vui chứ chắc không nhiều tác dụng, giao đủ hàng, 1 viên nó bé bé xinh xinh xài đủ 1 lần nha mọi người."
Set 7 Mặt Nạ Focallure Lõi Kép Giúp Cấp Nước Kiểm Soát Nhờn Trong 7 Ngày,['#5'],[2200000000],5,"Giao hàng bình thường, mình mua flash sale nhưng so với giá lúc bình thường cũng không rẻ hơn nhiều, khá ưng ý"
Set 7 Mặt Nạ Focallure Lõi Kép Giúp Cấp Nước Kiểm Soát Nhờn Trong 7 Ngày,"['#3', '#2', '#1']","[2800000000, 2800000000, 2800000000]",5,"Trời ơi bao bì đáng iuu xinh xẻo, giao hàng ngày càng nhanh, mình mua nhiều lần òi nên yên tâm lắm lun, mọi ngừoi mua trải nghiệm rồi sẽ mê đó nhaaaaa"
Set 7 Mặt Nạ Focallure Lõi Kép Giúp Cấp Nước Kiểm Soát Nhờn Trong 7 Ngày,"['#6', '#5', '#1']","[2800000000, 2800000000, 2800000000]",5,"săn sale freeship và được hoàn xu nên mua cũng khá nhiều, nói chung cũng thấy rẻ á nên mua nhiều mặt nạ. Để xài thử rồi cho review cụ thể nè. Còn cái glow thì thấy review tốt lắm nên mua thử, khi nào make up sẽ dùng. "
Set 7 Mặt Nạ Focallure Lõi Kép Giúp Cấp Nước Kiểm Soát Nhờn Trong 7 Ngày,['#2'],[2800000000],5,Shop giao hàng nhanh . Sản phẩm đẹp đúng mẫu mã gooooooooooooodddd. Hình ảnh chỉ mang tính chất nhận xu :v
Set 7 Mặt Nạ Focallure Lõi Kép Giúp Cấp Nước Kiểm Soát Nhờn Trong 7 Ngày,['#7'],[2800000000],5,"Mình mua 4 set này rồi ý, xinh xắn lắm luôn và xài cũng thíchhhh nữa đóooo, đóng gói bao bì chắc chắnnnnnnnnnnnnn, mọi người nênn mua trải nghiệm ạ"
Set 7 Mặt Nạ Focallure Lõi Kép Giúp Cấp Nước Kiểm Soát Nhờn Trong 7 Ngày,['#2'],[2500000000],5,"Mấy bé này nhỏ hơn mình nghĩ nhưng mà cũng xinh xinh cute nên bỏ qua, chưa xài thử nên không biết thế nào"
