name,variations,price,rating_star,comment
Set 7 Mặt Nạ Focallure Lõi Kép Giúp Cấp Nước Kiểm Soát Nhờn Trong 7 Ngày,"['#6', '#5', '#2']","[2200000000, 2200000000, 2200000000]",5,"Giao hàng nhanh. Đóng gói sản phẩm cẩn thận. Chất lượng sản phẩm tuyệt vời.

"
Set 7 Mặt Nạ Focallure Lõi Kép Giúp Cấp Nước Kiểm Soát Nhờn Trong 7 Ngày,"['#4', '#2']","[2800000000, 2300000000]",5,"Đóng gói được, giao hàng đủ đồ, sản phẩm đều được, sử dụng mới biết "
Set 7 Mặt Nạ Focallure Lõi Kép Giúp Cấp Nước Kiểm Soát Nhờn Trong 7 Ngày,['#3'],[2250000000],5,"Giao hàng nhanh, nhưng mà shipper khi giao hàng tới lại vứt trc nhà ko giao trực tiếp cho khách, lỡ mất hàng của khách rồi ai chịu trách nhiệm "
Set 7 Mặt Nạ Focallure Lõi Kép Giúp Cấp Nước Kiểm Soát Nhờn Trong 7 Ngày,['#3'],[2300000000],5,Đặt 9cai mặt nạ đc shop tặng thêm 1 cái nữa. Đongs gói hơi ẩuuuuu
Set 7 Mặt Nạ Focallure Lõi Kép Giúp Cấp Nước Kiểm Soát Nhờn Trong 7 Ngày,['#1'],[2200000000],5,Dien thoai phai co Nhac Chuong Cho moi vui. Thay tieng tut tut khi nguoi khac goi cho ban bang cac bai hat HOT nhat. Soan DK HR gui 123 de dang ky. De chon bai hat truy cap http://happyring.vietnamobile.com.vn. Soan Mua MaBaiHat gui 2345 de cai dat bat hat. Tran trong.
Set 7 Mặt Nạ Focallure Lõi Kép Giúp Cấp Nước Kiểm Soát Nhờn Trong 7 Ngày,"['#5', '#4']","[2800000000, 2800000000]",5,ĐẸPPPPPPPPPPPPPPPPPPPPPPPPPPPPPPPPPPPPPPPPPPPPPPPPPPPPPPPPPPPPPPPPPPPPPPPPPPPPPPPPPPPPPPPPPPPPPPPPPPPPPPPPPPPPPPPPPPPPPPPPP
Set 7 Mặt Nạ Focallure Lõi Kép Giúp Cấp Nước Kiểm Soát Nhờn Trong 7 Ngày,['#4'],[2800000000],4,"Hàng ok sịn, dùng xong đã khá mịn còn mụn còn nguyên :)) mình dùng trong 3 ngày r nhá 
Chắc dùng hết mới giảm :)))
Đc cái đủ hàng :>
Giao nhanh"
Set 7 Mặt Nạ Focallure Lõi Kép Giúp Cấp Nước Kiểm Soát Nhờn Trong 7 Ngày,['#7'],[2250000000],5,Giao hàng nhanh mặt nạ đắp rất okee để trong tủ lạnh đắp pheeee hơn nha
Set 7 Mặt Nạ Focallure Lõi Kép Giúp Cấp Nước Kiểm Soát Nhờn Trong 7 Ngày,"['#6', '#2']","[2800000000, 2800000000]",5,"Hic được nhiều lắm lắm luôn ấy, mà rẻ. Chưa dùng, nma nhìn có vẻ xinh, 1 vỉ như thế là 1 lần dùng 2 người luôn cũm đc á mn"
Set 7 Mặt Nạ Focallure Lõi Kép Giúp Cấp Nước Kiểm Soát Nhờn Trong 7 Ngày,['#1'],[2500000000],5,"Sản phẩm tốt 
Mask mịn da cấp ẩm tốt 
Giao hàng nhanh 
Uy tín ❤️❤️❤️❤️❤️"
Set 7 Mặt Nạ Focallure Lõi Kép Giúp Cấp Nước Kiểm Soát Nhờn Trong 7 Ngày,['#2'],[2300000000],5,"Mặt nạ siêu rẻ luôn lại còn dễ thương nữa chứ
Dùng cái này cũng được hehee"
Set 7 Mặt Nạ Focallure Lõi Kép Giúp Cấp Nước Kiểm Soát Nhờn Trong 7 Ngày,['#1'],[2800000000],5,"mặt nạ đỉnh của chóp, dùng thíchhhhh cực, ờm nhưng viên màu hồng mùi hơi khó chịu"
Set 7 Mặt Nạ Focallure Lõi Kép Giúp Cấp Nước Kiểm Soát Nhờn Trong 7 Ngày,['#2'],[2250000000],4,"Packing siêu dễ thương
Đóng gói chắc chắn
Chưa sử dụng nên chưa biết ntn "
Set 7 Mặt Nạ Focallure Lõi Kép Giúp Cấp Nước Kiểm Soát Nhờn Trong 7 Ngày,['#2'],[2250000000],5,Đóng gói siêu cẩn thận. Hàng về nhanh hơn tưởng. Test qua thì thấy tạm ok.
Set 7 Mặt Nạ Focallure Lõi Kép Giúp Cấp Nước Kiểm Soát Nhờn Trong 7 Ngày,"['#7', '#6', '#2', '#1']","[2800000000, 2800000000, 2300000000, 2300000000]",5,"Đặt 4 set và nghĩ mỗi nàu đều nhau nhưng màu danh dương và nàu hồng nhiều hơn 😂😂
Tuy nhiên vẫn được tặng 1 mask lô hội nên vẫn đánh giá tốt"
Set 7 Mặt Nạ Focallure Lõi Kép Giúp Cấp Nước Kiểm Soát Nhờn Trong 7 Ngày,['#5'],[2800000000],5,Sản phẩm sử dụng ok. Rất đáng tiên đó. Mặt nạ môi dùng rất thích luôn
Set 7 Mặt Nạ Focallure Lõi Kép Giúp Cấp Nước Kiểm Soát Nhờn Trong 7 Ngày,"['#4', '#2']","[2200000000, 2200000000]",5,"Bé hơn em nghĩ, em tưởng mua 2 set khác nhau thì shop chia ra cho nhưng mà shop không có chia..............bkshnzksbywbsnjsbf"
Set 7 Mặt Nạ Focallure Lõi Kép Giúp Cấp Nước Kiểm Soát Nhờn Trong 7 Ngày,"['#7', '#4']","[2500000000, 2500000000]",5,"Hàng quốc tế nên 5 ngày sau hàng mới về, nói chung hàng ổn, mặt nạ mình mua theo set nhưng 2 set mình mua không đầy đủ từng loại như trong hình"
Set 7 Mặt Nạ Focallure Lõi Kép Giúp Cấp Nước Kiểm Soát Nhờn Trong 7 Ngày,['#5'],[2800000000],5,"Giao hàng nhanh , chất lượng tốt. Đóng gói hơi ẩu 1 chút, còn lại ok"
Set 7 Mặt Nạ Focallure Lõi Kép Giúp Cấp Nước Kiểm Soát Nhờn Trong 7 Ngày,"['#2', '#1']","[2800000000, 2800000000]",5,"Date xa, giao hàng nhanh và rất đủ, chia theo tình trạng da và thứ tự"
Set 7 Mặt Nạ Focallure Lõi Kép Giúp Cấp Nước Kiểm Soát Nhờn Trong 7 Ngày,['#2'],[2800000000],5,"Mình đã dùng sp đc1 tuần 
Hàng chất lượng lắm nhé 
Da có cải thiện trong1 tuần"
Set 7 Mặt Nạ Focallure Lõi Kép Giúp Cấp Nước Kiểm Soát Nhờn Trong 7 Ngày,"['#6', '#5', '#4', '#2', '#1']","[2140000000, 2140000000, 2140000000, 2140000000, 2140000000]",5,"Giao hàng nhanh, chất lượng sản phẩm tuyệt vời, bao bì đẹp lại còn mua được ngay lúc flash sale nữa ạ"
Set 7 Mặt Nạ Focallure Lõi Kép Giúp Cấp Nước Kiểm Soát Nhờn Trong 7 Ngày,['#5'],[2800000000],5,"Mặt nạ này bôi để tầm 10p thì rửa, mà yhieest kế nhìn giống mặt nạ ngủ của Hàn ghê. Được cái ko thơm, cũng ko có mùi j khó chịu hết. Mới xài thử 2 loại là cấp nước với sáng da thôi. Cảm nhận là cấp ẩm tức thì cho da, hợp cho trước khi make up hơn. Ko dưỡng ẩm sâu. Tạm ổn"
Set 7 Mặt Nạ Focallure Lõi Kép Giúp Cấp Nước Kiểm Soát Nhờn Trong 7 Ngày,['#2'],[2800000000],5,"Dùng rất oke, có 7 cái đã bỏ ra dùng thử thấy rất hài lòng với chất lượng sản phẩm"
Set 7 Mặt Nạ Focallure Lõi Kép Giúp Cấp Nước Kiểm Soát Nhờn Trong 7 Ngày,['#2'],[2300000000],5,"Ốp xinhh lắm. Do ko có ảnh đây nên lấy tạm ảnh ni v .......
:))))))))))))))))
"
Set 7 Mặt Nạ Focallure Lõi Kép Giúp Cấp Nước Kiểm Soát Nhờn Trong 7 Ngày,['#3'],[2800000000],5,"Shop giao hàng siêu nhanh
Miếng lột mụn dùng khá ổn còn mặt nạ thì chưa dùng nên cx ko bt"
Set 7 Mặt Nạ Focallure Lõi Kép Giúp Cấp Nước Kiểm Soát Nhờn Trong 7 Ngày,['#5'],[1900000000],5,"Nhỏ nhỏ xinh xinh :))))))
Không biết ổn áp ko
Giao hàng nhanhh"
Set 7 Mặt Nạ Focallure Lõi Kép Giúp Cấp Nước Kiểm Soát Nhờn Trong 7 Ngày,['#7'],[2800000000],5,Bxbzjjakakakansbsbx bđhdjêuuuệhwwjjwjwjwwjjwjwwjwjjwjwjwjsjsjdjdjdjdjdjdhdhd
Set 7 Mặt Nạ Focallure Lõi Kép Giúp Cấp Nước Kiểm Soát Nhờn Trong 7 Ngày,['#2'],[1900000000],5,"xài rất tốt và hiệu quả, mình đã xài rồi và mua lại lần 2, đóng gói cũng ổn và giao đủ"
Set 7 Mặt Nạ Focallure Lõi Kép Giúp Cấp Nước Kiểm Soát Nhờn Trong 7 Ngày,['#2'],[2800000000],5,Mặt nạ đủ số lg. Mới đắp thử màu xanh khi rửa xong da mát k bị quá khô mùi hơi hương liệu k bị kích ứng hay gì cả khá ok
Set 7 Mặt Nạ Focallure Lõi Kép Giúp Cấp Nước Kiểm Soát Nhờn Trong 7 Ngày,['#2'],[2800000000],5,"Hàng đầy đủ, đã nghe review tốt nên mua ở đây, mẫu mã cũng đẹp, nếu ok sẽ dùng lâu dài. Giao hàng tầm 1 tuần là có, đối với hàng giao quốc tế thì ok."
Set 7 Mặt Nạ Focallure Lõi Kép Giúp Cấp Nước Kiểm Soát Nhờn Trong 7 Ngày,['#1'],[1900000000],5,Dùng ok lắm nhỏ nhưng dùng hết mặt còn dư 1 xíu
Set 7 Mặt Nạ Focallure Lõi Kép Giúp Cấp Nước Kiểm Soát Nhờn Trong 7 Ngày,['#7'],[2800000000],5,"Đóng gói sản phẩm chắc chắn, giao hàng cực nhanh luôn , giá thành còn rẻ nữa "
Set 7 Mặt Nạ Focallure Lõi Kép Giúp Cấp Nước Kiểm Soát Nhờn Trong 7 Ngày,['#2'],[2800000000],5,"[TB] Mung Xuan Tan Suu 2021! Viettel kinh chuc Quy khach nam moi An khang thinh vuong, Van su nhu y. Cam on Quy khach da yeu men va su dung dich vu cua Viettel. Tran trong!"
Set 7 Mặt Nạ Focallure Lõi Kép Giúp Cấp Nước Kiểm Soát Nhờn Trong 7 Ngày,['#1'],[2500000000],5,"Sản phẩm đúng như hình, giao đúng hàng, shop quốc tế nên đợi hơi lâu. Mua 2 lần của shop rồi, dùng thích, đắp lên mặt ko bị châm chích, sản phẩm cute"
Set 7 Mặt Nạ Focallure Lõi Kép Giúp Cấp Nước Kiểm Soát Nhờn Trong 7 Ngày,['#2'],[2800000000],5,"Giao đủ, đây là hàng mua chung với bạn nên khum biết như nào ..."
Set 7 Mặt Nạ Focallure Lõi Kép Giúp Cấp Nước Kiểm Soát Nhờn Trong 7 Ngày,['#1'],[2800000000],5,"Nhỏ xíu à , lúc đầu em tưởng nó cũng to bằng lòng bàn tay:< nên các ce nhớ mua nhiều thì mới dùng đủ"
Set 7 Mặt Nạ Focallure Lõi Kép Giúp Cấp Nước Kiểm Soát Nhờn Trong 7 Ngày,['#3'],[2500000000],5,"Mặt nạ rẻ mà chất lượng lại tốt, vượt ngoài mong đợi, sẽ mua thêm"
Set 7 Mặt Nạ Focallure Lõi Kép Giúp Cấp Nước Kiểm Soát Nhờn Trong 7 Ngày,['#5'],[2800000000],5,"Lần thứ hai mua ở đây rồi, chất lượng khỏi phải bàn nhaaaaa, giao hàng siêu nhanh đóng gói kĩ nữa "
Set 7 Mặt Nạ Focallure Lõi Kép Giúp Cấp Nước Kiểm Soát Nhờn Trong 7 Ngày,['#7'],[2500000000],5,Chất lương sản phẩm mê đã mua lần thứ hai và cảm thấy rất hài lòng giá cũng ổn nhưng ship hàng hơi lâu
Set 7 Mặt Nạ Focallure Lõi Kép Giúp Cấp Nước Kiểm Soát Nhờn Trong 7 Ngày,"['#3', '#2']","[2500000000, 2500000000]",5,Yeu lam a💜💜💜💜💜💜💜💜💜💜💜💜💜💜💜💜💜💜💜💜💜💜💜💜💜💜💜💜💜💜💜💜💜💜💜💜💜💜💜💜💜💜💜💜💜
Set 7 Mặt Nạ Focallure Lõi Kép Giúp Cấp Nước Kiểm Soát Nhờn Trong 7 Ngày,['#7'],[2800000000],5,"Mới dùng được 1c thấy khá là oke
Mình nhét vào tủ lạnh hết r nên khum có ảnh "
Set 7 Mặt Nạ Focallure Lõi Kép Giúp Cấp Nước Kiểm Soát Nhờn Trong 7 Ngày,['#5'],[1900000000],5,Thơm........................khkfjhfbbdhdbhdugvbjjj
Set 7 Mặt Nạ Focallure Lõi Kép Giúp Cấp Nước Kiểm Soát Nhờn Trong 7 Ngày,['#2'],[2800000000],5,Đắp mặt nạ nhỏ nhỏ xinh xinh siu cute ahop giao đue đồ hihihihi
Set 7 Mặt Nạ Focallure Lõi Kép Giúp Cấp Nước Kiểm Soát Nhờn Trong 7 Ngày,['#2'],[2800000000],5,"- Shop giao đủ hàng, đủ sl ạ
- Date xa
- Mặt nạ nhìn đáng iu nma kb dùg có hiệu quả k"
Set 7 Mặt Nạ Focallure Lõi Kép Giúp Cấp Nước Kiểm Soát Nhờn Trong 7 Ngày,['#1'],[2300000000],5,"Hàng đóng gói rất chắc chắn tuy nhiên có 1 cái bị méo một chút thôi chứ ko bị vỡ, hàng giao đủ 1 set còn về chất lượng thì mình chưa sử dụng nên chưa biết như thế nào🥰❤❤❤"
Set 7 Mặt Nạ Focallure Lõi Kép Giúp Cấp Nước Kiểm Soát Nhờn Trong 7 Ngày,"['#7', '#5', '#3', '#1']","[2800000000, 2800000000, 2800000000, 2800000000]",5,"Hình ảnh không liên quan nhưng mà mặt nạ nhìn nhỏ mà đủ dùng cho cả mặt á, nói chung dùng ổn nhưng mà mình lười đắp, mua vì nó cute =)))"
Set 7 Mặt Nạ Focallure Lõi Kép Giúp Cấp Nước Kiểm Soát Nhờn Trong 7 Ngày,['#3'],[1900000000],5,Shop giao đủ mẫu mã. Ko bị hỏng 1 gói nào hết. Chưa dùng nên không biết như nào. Mình mua sale chỉ 19k thôi nên ưng. Chứ 7 gói này mà 28k chắc chẳng mua bao giờ :)) Giao hàng nhanh
Set 7 Mặt Nạ Focallure Lõi Kép Giúp Cấp Nước Kiểm Soát Nhờn Trong 7 Ngày,['#7'],[2200000000],5,Sale với thấy xinh xinh nên mua thử. ship về hơi lâu nhưng giá ok. Đóng gói sản phẩm chắc chắn.
Set 7 Mặt Nạ Focallure Lõi Kép Giúp Cấp Nước Kiểm Soát Nhờn Trong 7 Ngày,['#4'],[1900000000],5,Gi khxiycoucpivonkoucuodtixpugivipiyxhicojjpkkvupcjvivvj
Set 7 Mặt Nạ Focallure Lõi Kép Giúp Cấp Nước Kiểm Soát Nhờn Trong 7 Ngày,['#4'],[2800000000],5,Về rcct có GTVT ý kiến riêng của mình nha cảm ơn bạn đã chia sẻ hay quá bạn ơi mình đi chéo sub k
Set 7 Mặt Nạ Focallure Lõi Kép Giúp Cấp Nước Kiểm Soát Nhờn Trong 7 Ngày,"['#5', '#4']","[2800000000, 2800000000]",5,
Set 7 Mặt Nạ Focallure Lõi Kép Giúp Cấp Nước Kiểm Soát Nhờn Trong 7 Ngày,"['#2', '#1']","[2800000000, 2800000000]",5,
Set 7 Mặt Nạ Focallure Lõi Kép Giúp Cấp Nước Kiểm Soát Nhờn Trong 7 Ngày,['#2'],[2250000000],5,"Hàng đúng hình ảnh. Mặt nạ đẹp
Chưa dùng nên ko vt về hiệu quả được. 
Đóng gói sản phẩm đẹp"
Set 7 Mặt Nạ Focallure Lõi Kép Giúp Cấp Nước Kiểm Soát Nhờn Trong 7 Ngày,['#2'],[2800000000],5,Mình up đại ảnh á . Mua của shop nhiều rồi nên yên tâm lắm . Tiếp tục ủng hộ nạ 
Set 7 Mặt Nạ Focallure Lõi Kép Giúp Cấp Nước Kiểm Soát Nhờn Trong 7 Ngày,"['#3', '#2']","[2500000000, 2500000000]",5,Tuy ảnh và video không liên quan nhưng đây là lần mình mua thứ 2 của shop mọi người tự hỉu nhỉ
Set 7 Mặt Nạ Focallure Lõi Kép Giúp Cấp Nước Kiểm Soát Nhờn Trong 7 Ngày,['#2'],[2500000000],5,"Quá là oklaaaa
Lần này là mua lần t2 của shopp
Nma đóng gói hơi sơ sài"
Set 7 Mặt Nạ Focallure Lõi Kép Giúp Cấp Nước Kiểm Soát Nhờn Trong 7 Ngày,['#7'],[2250000000],5,"Mặt nạ chưa dùng nên chưa review được, tuy nhiên giao hàng nhanh ahihi
Anh shipper cx siêu dễ thương ❤"
Set 7 Mặt Nạ Focallure Lõi Kép Giúp Cấp Nước Kiểm Soát Nhờn Trong 7 Ngày,['#7'],[2200000000],5,"Chất lượng sản phẩm tốt, giá cả phù hợp, giao hành nhanh hơn dự kiến, nếu được sẽ tiếp tục mua hàng trong những sale sau. Đánh giá chỉ mang tính chất để nhận xu😂"
Set 7 Mặt Nạ Focallure Lõi Kép Giúp Cấp Nước Kiểm Soát Nhờn Trong 7 Ngày,['#6'],[1900000000],5,"Cảm giác đắp vào mát da, cung capa độ ẩm, còn hàng ok hết, trông sp khá xinh xắn, mặt nạ Trung Quốc"
Set 7 Mặt Nạ Focallure Lõi Kép Giúp Cấp Nước Kiểm Soát Nhờn Trong 7 Ngày,['#4'],[2250000000],5,"Shop giao đúng sản phẩm, sử dụng xong thấy da mặt có vẻ mịn màng"
Set 7 Mặt Nạ Focallure Lõi Kép Giúp Cấp Nước Kiểm Soát Nhờn Trong 7 Ngày,['#5'],[2250000000],5,Hàng từ nước ngoài nhưng giao hàng khá nhanh sản phẩm đẹp cứng cáp chắc chắn. Nhìn rất chi là xịn sò 
Set 7 Mặt Nạ Focallure Lõi Kép Giúp Cấp Nước Kiểm Soát Nhờn Trong 7 Ngày,"['#6', '#5']","[2500000000, 2500000000]",5,Tốttttttttttttttttttttttttrrrrrrrrrrrrrrrrrrrrrrrrrtttt
Set 7 Mặt Nạ Focallure Lõi Kép Giúp Cấp Nước Kiểm Soát Nhờn Trong 7 Ngày,['#2'],[2800000000],5,"Hàng shopee mail nên k có gì bàn nữa ạ , nhỏ nhắn , xinh và đủ nhaa
"
Set 7 Mặt Nạ Focallure Lõi Kép Giúp Cấp Nước Kiểm Soát Nhờn Trong 7 Ngày,['#4'],[2800000000],5,dfghjklaskjhgfdhzjakldfcgvhbjnkmlsdfghjksdfghjklfghjk
Set 7 Mặt Nạ Focallure Lõi Kép Giúp Cấp Nước Kiểm Soát Nhờn Trong 7 Ngày,"['#7', '#5', '#4', '#2']","[2250000000, 2250000000, 2250000000, 2250000000]",5,"Đủ số lượng nha, chưa dùng nên chưa pít luôn :3 hjejehwhwjwwjwjj"
Set 7 Mặt Nạ Focallure Lõi Kép Giúp Cấp Nước Kiểm Soát Nhờn Trong 7 Ngày,['#5'],[2500000000],5,Sản phẩm rất xinh và cute........ muốn vote 10 sao được không ạ
Set 7 Mặt Nạ Focallure Lõi Kép Giúp Cấp Nước Kiểm Soát Nhờn Trong 7 Ngày,"['#5', '#3']","[2800000000, 2800000000]",5,"Sản phẩm nhìn xinh, mỗi tội màu vàng ra ngoài không được tươi như trong ảnh. Giao hàng đủ và đúng."
Set 7 Mặt Nạ Focallure Lõi Kép Giúp Cấp Nước Kiểm Soát Nhờn Trong 7 Ngày,['#3'],[2500000000],5,"lại mê ơi là mê lun á tròi oi xinh xỉuuuu lun á quốc tế mà giao cũng nhanh , nhận mà xinh ơi là xinh đủ đồ gói đẹp lun"
Set 7 Mặt Nạ Focallure Lõi Kép Giúp Cấp Nước Kiểm Soát Nhờn Trong 7 Ngày,['#3'],[2490000000],5,Ảnh và video mang tính chất lấy xu ggxxbnh 👌cfdsfhhhhvcđghbv
Set 7 Mặt Nạ Focallure Lõi Kép Giúp Cấp Nước Kiểm Soát Nhờn Trong 7 Ngày,"['#6', '#2']","[2800000000, 2800000000]",5,Hàng giao từ nước ngoài nhưng giao nhanh. Chưa dùng sản phẩm nên chưa biết chất lượng thế nào
Set 7 Mặt Nạ Focallure Lõi Kép Giúp Cấp Nước Kiểm Soát Nhờn Trong 7 Ngày,['#2'],[2140000000],5,"Chất lượng cũng okeee, nhỏ gọn dễ đem đi mọi nơi, đóng gói sản phẩm chắc chắn"
Set 7 Mặt Nạ Focallure Lõi Kép Giúp Cấp Nước Kiểm Soát Nhờn Trong 7 Ngày,['#3'],[2800000000],5,Mua hộ bạn nên chả biết chất lượng các thứ như nào nhưng nhìn dễ thương quá nên chắc lần sau mình sẽ tự mua cho mình dùng thử
Set 7 Mặt Nạ Focallure Lõi Kép Giúp Cấp Nước Kiểm Soát Nhờn Trong 7 Ngày,"['#5', '#3', '#2', '#1']","[2800000000, 2800000000, 2800000000, 2800000000]",5,"Giao hàng siêu nhanh, sp y hình, nhỏ nhỏ nhìn xinh lắm nha. Kiểm tra hàng thì thấy dư ra 2 quả trứng k bk tặng hay shop đếm nhầm nữa"
Set 7 Mặt Nạ Focallure Lõi Kép Giúp Cấp Nước Kiểm Soát Nhờn Trong 7 Ngày,['#5'],[2500000000],5,Cmt để nhận xu. Sản phẩm bé hơn mình nghĩ. Đắp mặt dạng gel. Mới dùng 1 lần. Sp rẻ nên kb ntn. Chúc shop đắt hàng👍👍👍👍👍👍👍👍👍👍👍👍👍👍👍👍👍
Set 7 Mặt Nạ Focallure Lõi Kép Giúp Cấp Nước Kiểm Soát Nhờn Trong 7 Ngày,['#3'],[2200000000],4,"Giao hàng đủ, sản phẩm mình chưa dùng nên chưa biết kết quả ra sao. Nhưng mình không thích cách gói hàng của shop lắm nên cho 4 sao :3"
Set 7 Mặt Nạ Focallure Lõi Kép Giúp Cấp Nước Kiểm Soát Nhờn Trong 7 Ngày,['#2'],[2800000000],5,Sp tốt vì hành quốc tế nên giao hơi lâu nhỏ nhỏ xinh xinh lắm nha
Set 7 Mặt Nạ Focallure Lõi Kép Giúp Cấp Nước Kiểm Soát Nhờn Trong 7 Ngày,['#3'],[2200000000],5,"Mask bao xịn luôn, bé bé xinh xinh. Mình cực kì ưng. Cảm ơn shop nhiều. "
Set 7 Mặt Nạ Focallure Lõi Kép Giúp Cấp Nước Kiểm Soát Nhờn Trong 7 Ngày,['#2'],[2800000000],5,đóng gói sản phẩmm rất đẹp và chắc chắn hình ảnh không liên quan tẹo
Set 7 Mặt Nạ Focallure Lõi Kép Giúp Cấp Nước Kiểm Soát Nhờn Trong 7 Ngày,['#5'],[2800000000],5,Mình thích nhất loại này mua sử dung lâu dài okeeeeeeeeeeeee lắm
Set 7 Mặt Nạ Focallure Lõi Kép Giúp Cấp Nước Kiểm Soát Nhờn Trong 7 Ngày,"['#5', '#4']","[2800000000, 2800000000]",5,"Đóng gói bình thường, mặt nạ nhỏ nhưng nhìn khá là xinh luôn.."
Set 7 Mặt Nạ Focallure Lõi Kép Giúp Cấp Nước Kiểm Soát Nhờn Trong 7 Ngày,['#5'],[2800000000],5,Mới đắp thử 1 lần thấy cũng ổn đấy. Đắp vài lần xem thế nào. Thấy rẻ quá
Set 7 Mặt Nạ Focallure Lõi Kép Giúp Cấp Nước Kiểm Soát Nhờn Trong 7 Ngày,"['#4', '#1']","[2800000000, 2800000000]",5,
Set 7 Mặt Nạ Focallure Lõi Kép Giúp Cấp Nước Kiểm Soát Nhờn Trong 7 Ngày,"['#7', '#4']","[2800000000, 2800000000]",5,Đánh giá nhận 100 xuuuuuuuuuuuuuuuuuuuuuuuuuuuuuuuuuuu
Set 7 Mặt Nạ Focallure Lõi Kép Giúp Cấp Nước Kiểm Soát Nhờn Trong 7 Ngày,['#7'],[2800000000],5,Hàng rất xịn nha .. xài sướng lắm ạ .......................
Set 7 Mặt Nạ Focallure Lõi Kép Giúp Cấp Nước Kiểm Soát Nhờn Trong 7 Ngày,['#3'],[2800000000],5,"đủ sản phẩm, nhìn giống mặt nạ ngủ nhưng thực chất nó là mặt nạ bth đắp từ 15-20p r rửa sạch lại mặt"
Set 7 Mặt Nạ Focallure Lõi Kép Giúp Cấp Nước Kiểm Soát Nhờn Trong 7 Ngày,['#7'],[2800000000],5,Lấy dùm chưa được cầmmmmmmmmmmmmmmmmmmmmmmmmmmmmmmmmmmm
Set 7 Mặt Nạ Focallure Lõi Kép Giúp Cấp Nước Kiểm Soát Nhờn Trong 7 Ngày,['#5'],[1900000000],5,Hàng ok lala ko có thời gian chụp hình nên thôihhhhhhhhhhjhh
Set 7 Mặt Nạ Focallure Lõi Kép Giúp Cấp Nước Kiểm Soát Nhờn Trong 7 Ngày,['#2'],[2800000000],5,"Chất lượng sản phẩm tốt, thời gian giao hàng nhanh, rất đáng tiền"
Set 7 Mặt Nạ Focallure Lõi Kép Giúp Cấp Nước Kiểm Soát Nhờn Trong 7 Ngày,"['#7', '#1']","[2250000000, 2250000000]",5,Chưa dùng nhưng nhìn kiểu cute ý :33. Nhìn nhỏ vậy chứ nó kiểu đầy ụ ý :))
Set 7 Mặt Nạ Focallure Lõi Kép Giúp Cấp Nước Kiểm Soát Nhờn Trong 7 Ngày,['#1'],[2800000000],5,Nhìn xinh như kẹo ý bé nhà mh cứ đồ ăn thôiiiiiiiiiiiiiiiiiiiiiiiiiiiiiiiiiiiiiiiiiiiiiiiiiiiiiiiiiiiiiiiiiiiiiiiiiiiiiiiiiiiiiiiiii
Set 7 Mặt Nạ Focallure Lõi Kép Giúp Cấp Nước Kiểm Soát Nhờn Trong 7 Ngày,['#3'],[2250000000],5,Giao đủ hàng . hàng nước ngoài nhưng giao cũng ko lâu lắm. Mặt nạ chưa sài nên chưa đánh giá chất lượng dc.
Set 7 Mặt Nạ Focallure Lõi Kép Giúp Cấp Nước Kiểm Soát Nhờn Trong 7 Ngày,['#4'],[2800000000],5,"Hình ảnh và vid chỉ mang tính chất thay thế.
Sản phẩm tốt, hàng nước ngoài nên giao hơi lâu. "
Set 7 Mặt Nạ Focallure Lõi Kép Giúp Cấp Nước Kiểm Soát Nhờn Trong 7 Ngày,['#2'],[2800000000],5,Không biết đã mua mặt nạ này bao nhiêu lần luôn rẻ mà dùng rất có hiệu quả
Set 7 Mặt Nạ Focallure Lõi Kép Giúp Cấp Nước Kiểm Soát Nhờn Trong 7 Ngày,['#5'],[2800000000],5,Hsbdhdjfjbdvdvdhdhbcbcbcbcbnd. Bình luận mang tính chất nhận xu
Set 7 Mặt Nạ Focallure Lõi Kép Giúp Cấp Nước Kiểm Soát Nhờn Trong 7 Ngày,['#2'],[2800000000],5,Sản phẩm rất chất lượng Sản phẩm rất chất lượng Sản phẩm rất chất lượng 
Set 7 Mặt Nạ Focallure Lõi Kép Giúp Cấp Nước Kiểm Soát Nhờn Trong 7 Ngày,['#5'],[2800000000],5,Hàng nước ngoài nên vc lâu chưa sử dụng chưa biết thế nào hàng nc người nên vc lâu
Set 7 Mặt Nạ Focallure Lõi Kép Giúp Cấp Nước Kiểm Soát Nhờn Trong 7 Ngày,['#2'],[2250000000],5,"Shop có thái độ phục vụ tốt, phản hồi nhanh và tích cực! ❤️ tiếp tục ủng hộ"
Set 7 Mặt Nạ Focallure Lõi Kép Giúp Cấp Nước Kiểm Soát Nhờn Trong 7 Ngày,"['#3', '#2']","[2800000000, 2800000000]",3,Sản phẩm như hình nhưng sử dụng chả thấy tác dụng gì. Hàng nước ngoài giao khá lâu ( Hình ảnh chỉ mang tc nhận xu)
Set 7 Mặt Nạ Focallure Lõi Kép Giúp Cấp Nước Kiểm Soát Nhờn Trong 7 Ngày,['#2'],[2300000000],5,Set nhỏ xíu xiu cưng lém 🤤 đặt hàng qte mà ship hàng nhanh lắm ahhh 
Set 7 Mặt Nạ Focallure Lõi Kép Giúp Cấp Nước Kiểm Soát Nhờn Trong 7 Ngày,['#5'],[2800000000],5,"giao đủ sản phẩm, nếu dùng oke sẽ ủng hộ shop típ nhaaaaaaaaaa"
Set 7 Mặt Nạ Focallure Lõi Kép Giúp Cấp Nước Kiểm Soát Nhờn Trong 7 Ngày,['#4'],[2800000000],5,"Giao đúng và đủ hàng.
Package nhìn siêu cute. Sau khi dùng sẽ rv thêm về chất lượng."
Set 7 Mặt Nạ Focallure Lõi Kép Giúp Cấp Nước Kiểm Soát Nhờn Trong 7 Ngày,"['#6', '#5', '#3', '#2']","[2800000000, 2800000000, 2800000000, 2800000000]",5,"Sản phẩm bé xí đáng yêu chưa sử dụng nên chưa biết chất lượng ra sau ,hi vọng sẽ ổn"
Set 7 Mặt Nạ Focallure Lõi Kép Giúp Cấp Nước Kiểm Soát Nhờn Trong 7 Ngày,['#4'],[1900000000],5,"Sản phẩm giống với mô tả 
Mua được giá sale nên khá thích
Hàng quốc tế nhưng giao hàng khá nhanh
Mong là dùng ok"
Set 7 Mặt Nạ Focallure Lõi Kép Giúp Cấp Nước Kiểm Soát Nhờn Trong 7 Ngày,['#1'],[2200000000],5,"Ship nhanh , mask mình mua lần ni là đợt hai . Xài khá ổn nghen "
Set 7 Mặt Nạ Focallure Lõi Kép Giúp Cấp Nước Kiểm Soát Nhờn Trong 7 Ngày,['#2'],[2800000000],5,"Giao đủ sản phẩm, mask chưa dùng thử nên không cảm nhận được chất lượng"
Set 7 Mặt Nạ Focallure Lõi Kép Giúp Cấp Nước Kiểm Soát Nhờn Trong 7 Ngày,"['#7', '#6', '#5']","[2140000000, 2140000000, 2140000000]",5,HÀNG GIAO QUỐC TẾ RẤT LÂU LUÔN - đợi xĩu - nhận hàng đầy đủ nên thôi - chua dùng nên ko bít 
