variations,price,rating_star,comment
"['1 MIแบพNG XANH DฦฏฦNG', '1 MIแบพNG XANH Lร', '1 MIแบพNG ฤแป', '1 MIแบพNG VรNG']","[1650000000, 1650000000, 1650000000, 1650000000]",5,Chแบฅt lฦฐแปฃng sแบฃn phแบฉm oki lแบฏm luรดn!!! Khuyแบฟn khรญch mแปi ngฦฐแปi nรชn mua nha!!! :33333
['1 MIแบพNG VรNG'],[1650000000],5,"Mแบทt nแบก auth 100% mร giรก cลฉng khรก ok, lแบงn sau sแบฝ mua แปงng hแป tiแบฟp.."
['1 MIแบพNG XANH Lร'],[1650000000],5,ฤรฃ mua hรng nhiแปu lแบงn แป shop vร lแบงn nรo cลฉng ok hแบฟt แบก. ฤรณng gรณi rแบฅt cแบฉn thแบญn luรดn
['1 MIแบพNG VรNG'],[1650000000],3,Giao sai mแบซuuu ฤแบทt mรuuu vรngg thรฌ khรดnggg ฤรบnggg mแบซuu nhฦฐng hรng ฤแบนpp tแบกm bแป qua
"['1 MIแบพNG XANH DฦฏฦNG', '1 MIแบพNG XANH Lร', '1 MIแบพNG VรNG']","[1650000000, 1650000000, 1650000000]",5,"Chแบฅt lฦฐแปฃng tแปt mร giรก lแบกi แปn, ok lแบฏm แบก hรฌnh แบฃnh chแป mang tรญnh chแบฅt minh hแปaaaaaa"
"['1 MIแบพNG XANH DฦฏฦNG', '1 MIแบพNG XANH Lร']","[1650000000, 1650000000]",5,"Chฦฐa xรi nรชn khรดng biแบฟt chแบฅt lฦฐแปฃng s ,nhฦฐng  giao hรng rแบฅt nhanh "
['1 MIแบพNG VรNG'],[1650000000],4,Giao sai sแบฃn phแบฉm chฦฐa ฤแบฏp ko biแบฟt cรณ giแปng loแบกi mรฌnh hay dรนng khรดng
['1 MIแบพNG XANH DฦฏฦNG'],[1650000000],5,"Mแบทt nแบก chฦฐa xรi, mแบทt nแบก mรดi thรฌ xรi แปn, hแบกt mแปn khรดng bแป rรกt mรดi. Shop giao lรขu hฦกn mรฌnh nghฤฉ. "
['1 MIแบพNG XANH DฦฏฦNG'],[1650000000],5,sแบฃn phแบฉm rแบฅt chi lร tแปt luรดn mแบทc dรน chฦฐa tแปซng xรi hihi hihi hihi hihi hihi hihi hihi hihi
"['1 MIแบพNG XANH DฦฏฦNG', '1 MIแบพNG XANH Lร', '1 MIแบพNG ฤแป', '1 MIแบพNG VรNG']","[1650000000, 1650000000, 1650000000, 1650000000]",5,Xkgxkgkyxgoxkyxgkxkg kgfk kggkkg kgxlhxlhhxlgjfz. Xfkztkxlyx
"['1 MIแบพNG XANH DฦฏฦNG', '1 MIแบพNG XANH Lร', '1 MIแบพNG ฤแป', '1 MIแบพNG VรNG']","[1650000000, 1650000000, 1650000000, 1650000000]",5,"Mแบทt nแบก ฤแบฏp rแบฅt ฤรฃ, giao hรng nhanh chรณng gรณi hรng kแปน good......"
['1 MIแบพNG XANH Lร'],[1550000000],5,Shop giao hรng nhanh lแบฏm แบก. Giรก ok ship nhanh. แบขnh chแป mang tc lแบฅy xu hihi 
['1 MIแบพNG VรNG'],[1650000000],5,Chฦฐaa ฤแบฏp mร thแบงy hรng giao nhanh mร xแปn quaaa
"['1 MIแบพNG ฤแป', '1 MIแบพNG VรNG']","[1550000000, 1550000000]",5,Okkkkkkkkkkkkkkkkkkkkkkkkkkkkkkkkkkkkkkkkkkkkkkkkk
['1 MIแบพNG VรNG'],[1650000000],5,Giao hรng nhanh. Tแบฉy tแบฟ bรo mรดi mรนi nhแบน. 
"['1 MIแบพNG XANH Lร', '1 MIแบพNG VรNG']","[1650000000, 1650000000]",5,Hรng nhรฌn xinh cรณ mรu hแปng yรชu thik cแปงa mรฌnh.noi chung mรฌnh thแบฅy cลฉng ok
['1 MIแบพNG XANH Lร'],[1650000000],5,Em lฦฐแปi chแปฅp แบฃnh แบก. Shop giao ฤแปง ฤแป.........................
"['1 MIแบพNG XANH DฦฏฦNG', '1 MIแบพNG XANH Lร', '1 MIแบพNG VรNG']","[1650000000, 1650000000, 1650000000]",5,Sแบฃn phแบฉm shop tแปt khรดng cรณ gรฌ ฤแป nรณi rแปi tแบกi mua cแปงa shop rแบฅt nhiแปu lแบงn rแปi ๐๐๐๐๐๐๐๐๐๐๐๐๐๐๐๐๐๐๐๐๐๐๐
['1 MIแบพNG XANH DฦฏฦNG'],[1650000000],5,Mแบทt nแบก chuแบฉn.giao hรng nhanh.chฦฐa sแปญ dแปฅng nรชn chฦฐa ฤรกnh giรก thรชm vแป chแบฅt lฦฐแปฃng
['1 MIแบพNG VรNG'],[1500000000],5,Mรฌnh chฦฐa dรนng nhฦฐng shop giao ฤแปง hรng vร giao khรก nhanh แบก....
['1 MIแบพNG VรNG'],[1500000000],5,"Shop giao ฤแปง hรng, hฦกi mรณp mรฉo tรญ, shop giao hรng nhanh, sแบฝ แปงng hแป thรชm sau nhรฉ ๐ป๐ป๐ป๐ป"
['1 MIแบพNG XANH Lร'],[1500000000],5,Mแบทt nแบก cแปงa jangx nรy dรนng cแปฑc thรญch luรดn แบก kkk mag mua hรng cแปงa shop nรy thรฌ just auth nรชn ko cรณ j phk ฤแบฏn ฤo cแบฃ giรก cแปงa sp thรฌ รดi chแปi rแบป quรก แบก. Cรฒn kแบนp nรขg mลฉi hฦกi rแปng hay sao รฝ แบก 
['1 MIแบพNG XANH DฦฏฦNG'],[1500000000],5,"ฤแป trong ngฤn mรกt tแปง lแบกnh ฤแบฏp bao phรช luรดn รก mแบฅy bแบกn 
Shop gรณi hรng kแปน, giao nhanh โค"
"['1 MIแบพNG XANH DฦฏฦNG', '1 MIแบพNG XANH Lร', '1 MIแบพNG ฤแป', '1 MIแบพNG VรNG']","[1500000000, 1500000000, 1500000000, 1500000000]",5,"Kแบป mแบฏt ฤแบนp , lรขu trรดi , rแบป , ฤรกng mua nha mแปi ngฦฐแปi. Mแบทt nแบก ok nรจ . Giao hรng nhanh"
['1 MIแบพNG XANH DฦฏฦNG'],[1500000000],5,Mรฌnh chฦฐa xรi ฦฐjsjsjjsjsjbsbsbsbbsbsnsjjsjshshhshshshhshsh
"['1 MIแบพNG XANH DฦฏฦNG', '1 MIแบพNG XANH Lร', '1 MIแบพNG ฤแป', '1 MIแบพNG VรNG']","[1500000000, 1500000000, 1500000000, 1500000000]",5,"Amazinggggggghhh gรบtt chรณp shopppppppppp
Bissss bisssss"
['1 MIแบพNG XANH Lร'],[1500000000],5,Jdjsjsjsjsjsjkekwoskdndnjdjdndjdjฤoแบนnรฉnnkdkdndbshแปฑe
"['1 MIแบพNG XANH Lร', '1 MIแบพNG ฤแป']","[1606000000, 1606000000]",5,ฤรฃ mua nhรฌu lแบงn แป shop rแบฅt yรชn tรขm giao hรng hฦกi lรขu hฦกn nhแปฏng lแบงn trc
"['1 MIแบพNG XANH DฦฏฦNG', '1 MIแบพNG XANH Lร', '1 MIแบพNG ฤแป', '1 MIแบพNG VรNG']","[1500000000, 1500000000, 1500000000, 1500000000]",5,"Xl hรฌnh k liรชn qan แบก. Hรng chuแบฉn xแปn ,giao hรng nhanh.ฤรฃ mua cแปงa shop nhiแปu lแบงn 5* "
['1 MIแบพNG VรNG'],[1606000000],5,Lแบงn ฤแบงu mua แป ฤรขy. Ko biแบฟt do vแบญn chuyแปn hay sao mร thแบฅy hแปp mรณpp
"['1 MIแบพNG XANH Lร', '1 MIแบพNG VรNG']","[1650000000, 1650000000]",5,"Shop giao hรng nhanh, giao ฤแปง hรng, gรณi ฤแป cแบฉn thแบญn, sแบฝ ฤแบทt mua lแบงn sau, cแบฃm ฦกn shop. รhbdbdjndnnejxnndndn"
['1 MIแบพNG VรNG'],[1650000000],1,Mua 3 mแบทt nแบก vรng mร shop giao 1 mแบทt nแบก xanh. Nhแบฏn tin thรฌ shop k giแบฃi thรญch hay xin lแปi gรฌ cแบฃ. Thแปฑc sแปฑ sแบฝ khรดng tiแบฟp tแปฅc แปงng hแป shop nแปฏa
['1 MIแบพNG XANH DฦฏฦNG'],[1650000000],5,"ฤรณng gรณi chแบฏc chแบฏn, kแปน cรng, chuแบฉn bแป hรng nhanh, chแบฅt lฦฐฦกฬฃng saฬn phรขฬm tแปt"
"['1 MIแบพNG XANH DฦฏฦNG', '1 MIแบพNG XANH Lร', '1 MIแบพNG ฤแป', '1 MIแบพNG VรNG']","[1650000000, 1650000000, 1650000000, 1650000000]",5,Mแบทt nแบก rแบป mร chแบฅt lฦฐแปฃng giao hรng nhanh nแปฏa 
['1 MIแบพNG XANH DฦฏฦNG'],[1650000000],5,
"['1 MIแบพNG XANH Lร', '1 MIแบพNG VรNG']","[1650000000, 1650000000]",5,Hรng oki nรชn ฤแบทt lแบงn thแปฉ 2 rแปi แบก
"['1 MIแบพNG XANH DฦฏฦNG', '1 MIแบพNG XANH Lร', '1 MIแบพNG ฤแป', '1 MIแบพNG VรNG']","[1650000000, 1650000000, 1650000000, 1650000000]",5,check ฤฦฐแปฃc mรฃ vแบกch!!!giao hรng nhanh...sแบฝ tiแบฟp tแปฅc แปงng hแป!!!!
['1 MIแบพNG VรNG'],[1650000000],5,Quรก thรญch โค๏ธ๐คฃ
['1 MIแบพNG XANH DฦฏฦNG'],[1650000000],5,Mแบทt nแบก mรกt lแบฏm แบก k bt hiแปu quแบฃ k
"['1 MIแบพNG XANH Lร', '1 MIแบพNG VรNG']","[1650000000, 1650000000]",5,ฤรขy lร lแบงn thแปฉ 2 mik mua shop nรy shop giao hรng nhanh . cรฒn vแป loแบกi mแบทt nแบก nรy thรฌ khแปi bรn cรฃi vแป chแบฅt lฦฐแปฃng
"['1 MIแบพNG XANH Lร', '1 MIแบพNG VรNG']","[1650000000, 1650000000]",5,Hdhdhdjdjdjkdkdjdjxjxjxjhxhxhdnsjskskksmsnxhxgtdgshshshsbdjkdjdhdbbdndndkdishsnsnbshdhxhdbdbdhsnn
['1 MIแบพNG VรNG'],[1650000000],5,Mแบทt nแบก hรฌnh nhฦฐ shop hแบฟt nรชn gแปญi cho mรฌnh loแบกi khรกc รญ mong sau nรy nแบฟu hแบฟt shop nรชn nhแบฏn tin trฦฐแปc
['1 MIแบพNG XANH DฦฏฦNG'],[1650000000],5,"Giao hรng nhanh, ฤรณng gรณi cแบฉn thแบญn"
['1 MIแบพNG VรNG'],[1650000000],5,"Hiแบฟm khi lรชn ฤรกnh giรก cho cรกc shop nhฦฐng mh ฤรกnh giรก shop nรy vรฌ rแบฅt ฦฐng bแปฅng. Shop giao hรng nhanh, ฤรณng gรณi cแบฉn thแบญn. Mh mua son vร mแบทt nแบก cรณ vแป hแปp vร tem chแปng hรng giแบฃ vร giao ฤรบng hรng (mh hay bแป giao nhแบงm hรng tแปซ cรกc shop khรกc). Chฦฐa biแบฟt chแบฅt lฦฐแปฃng ra sao, nแบฟu ok mh sแบฝ แปงng hแป lรขu dรi."
"['1 MIแบพNG ฤแป', '1 MIแบพNG VรNG']","[1650000000, 1650000000]",5,"Mแบทt nแบก ฤแบฏp siรชu ฤรฃ 
Thฦกm vร giรก lแบกi oki 
Luรดn แปงng hแป shop !!!!!!!!"
['1 MIแบพNG VรNG'],[1500000000],5,lllllllllllllllllllllllllllllllllllllllllllllllllllll
"['1 MIแบพNG XANH DฦฏฦNG', '1 MIแบพNG XANH Lร', '1 MIแบพNG VรNG']","[1500000000, 1500000000, 1500000000]",5,"ฤรณng gรณi hรng cแบฉn thแบญn, giao hรng siรชu nhanh, sp chแบฅt lฦฐแปฃng, hรi lรฒng โค๏ธ"
['1 MIแบพNG ฤแป'],[1500000000],5,"hรng chแบฅt, shipper vร shop thรขn thiแปn nhiแปt tรฌnh แบก ๐ฅฐ๐ฅฐโค๏ธโค๏ธโค๏ธโค๏ธ"
